{
  "identify": "ILD-99-聲-275-20100512-1",
  "court": {
    "name": "臺灣宜蘭地方法院",
    "code": "ILD"
  },
  "division": {
    "name": "刑事",
    "code": "M"
  },
  "year": 99,
  "word": "聲",
  "number": "275",
  "jcheck": "1",
  "reason": "保護管束",
  "content": "臺灣宜蘭地方法院刑事裁定               99年度聲字第275號\n聲  請  人  臺灣宜蘭地方法院檢察署檢察官\n受  刑  人  甲○○\n上列受刑人因違反毒品危害防制條例案件，聲請人聲請付保護管\n束（99年度執聲字第218號），本院裁定如下：\n    主  文\n甲○○假釋中付保護管束。\n    理  由\n一、聲請意旨略以：受刑人甲○○因違反毒品危害防制條例案件\n    ，現在臺灣宜蘭監獄執行中，經呈奉核准假釋在案，爰依刑\n    法第93條第2項及刑事訴訟法第481條聲請假釋中應付保護管\n    束之裁定等語。\n二、經查：受刑人甲○○因違反毒品危害防制條例案件，為本院\n    先後判決處執行有期徒刑2年10月及8月確定，現在臺灣宜蘭\n    監獄執行中，其刑滿日期原為民國100年3月13日，經依行刑\n    累進處遇條例縮刑28日後，其刑期終了日為100年2月13日，\n    業經法務部以99年5月6日以法矯字第0999017675號函核准假\n    釋出獄，有臺灣高等法院被告前案紀錄表及臺灣宜蘭監獄假\n    釋出獄人交付保護管束名冊在卷可稽，本院審核相關文件，\n    認聲請人之聲請為正當，爰依刑事訴訟法第481條第1項、刑\n    法第93條第2項、第96條但書，裁定如主文。\n中    華    民    國    99    年    5     月    12    日\n                  刑事第三庭  法  官  陳映佐\n以上正本證明與原本無異。\n如不服本裁定，應於裁定送達後5日內，向本院提出抗告狀。（\n應附繕本）\n                              書記官  翁靜儀\n中    華    民    國    99    年    5     月    13    日",
  "structure": {
    "main": "甲○○假釋中付保護管束。",
    "reason": "一、聲請意旨略以：受刑人甲○○因違反毒品危害防制條例案件\n    ，現在臺灣宜蘭監獄執行中，經呈奉核准假釋在案，爰依刑\n    法第93條第2項及刑事訴訟法第481條聲請假釋中應付保護管\n    束之裁定等語。\n二、經查：受刑人甲○○因違反毒品危害防制條例案件，為本院\n    先後判決處執行有期徒刑2年10月及8月確定，現在臺灣宜蘭\n    監獄執行中，其刑滿日期原為民國100年3月13日，經依行刑\n    累進處遇條例縮刑28日後，其刑期終了日為100年2月13日，\n    業經法務部以99年5月6日以法矯字第0999017675號函核准假\n    釋出獄，有臺灣高等法院被告前案紀錄表及臺灣宜蘭監獄假\n    釋出獄人交付保護管束名冊在卷可稽，本院審核相關文件，\n    認聲請人之聲請為正當，爰依刑事訴訟法第481條第1項、刑\n    法第93條第2項、第96條但書，裁定如主文。"
  },
  "characters": {
    "judges": [
      "陳映佐"
    ],
    "prosecutors": [

    ],
    "lawyers": [

    ],
    "clerks": [
      "翁靜儀"
    ],
    "plaintiffs": [

    ],
    "defendants": [

    ],
    "prosecutor_office": [
      "臺灣宜蘭地方法院檢察署檢察官"
    ],
    "creditors": [

    ],
    "debtors": [

    ],
    "judicial_associate_officer": [

    ]
  },
  "adjudged_at": "2010-05-12",
  "created_at": "2016-01-05 12:29:59",
  "updated_at": "2016-01-05 12:29:59"
}