{
  "identify": "ILD-99-司票-146-20100512-4",
  "court": {
    "name": "臺灣宜蘭地方法院",
    "code": "ILD"
  },
  "division": {
    "name": "民事",
    "code": "V"
  },
  "year": 99,
  "word": "司票",
  "number": "146",
  "jcheck": "4",
  "reason": "本票裁定",
  "content": "臺灣宜蘭地方法院民事裁定             99年度司票字第146號\n聲  請  人  匯豐汽車股份有限公司\n法定代理人  甲○○\n相  對  人  游玉鳳即華邑工程行\n上列當事人間聲請對本票准許強制執行事件，本院裁定如下：\n    主  文\n相對人於民國九十八年八月二十日簽發之本票金額新台幣貳拾伍\n萬元，其中新台幣貳拾壹萬壹仟壹佰肆拾肆元部分，及自民國九\n十九年四月二十一日起至清償日止，按年利率百分之一七點九０\n計算之利息，准予強制執行。\n聲請程序費用新台幣壹仟元由相對人負擔。\n    理  由\n一、本件聲請意旨略以：聲請人執有相對人於民國98年8月20日\n    簽發並免除作成拒絕證書之本票一紙，內載金額250,000元\n    ，到期日為民國99年4月20日，詎屆期經提示後，尚有如主\n    文所示之票款本金及利息未獲清償，為此提出本票一紙，聲\n    請裁定准許強制執行。\n二、本件聲請核與票據法第123條規定相符，應予准許。\n三、依非訟事件法第21條第2項、第24條第1項，民事訴訟法第78\n    條，裁定如主文。\n中    華    民    國    99    年    5     月    12    日\n                  臺灣宜蘭地方法院民事庭\n                      司法事務官  徐家惠\n一、正本係照原本作成。\n二、如不服本裁定，應於裁定送達後10日內向本院提出抗告狀，\n    並繳納抗告費新台幣1仟元。\n三、發票人如主張本票係偽造、變造者，應於接到本裁定後20\n    日之不變期間內，對執票人向本院另行提起確認之訴。\n中    華    民    國    99    年    5     月    17    日\n                      書  記  官  陳旺誠\n◎附註：\n一、聲請人、相對人如於事後遞狀均請註明案號、股別。\n二、聲請人應於收受本票裁定後5日內，提出相對人最新戶籍謄\n    本（記事欄勿省略），以核對本票裁定是否合法送達相對人；\n    如相對人係法人，則應提出法人最新登記資料（例如公司設\n    立變更登記事項表）及法定代理人最新戶籍謄本（記事欄勿省略\n    ），以核對是否合法送達。（否則無法核發確定證明書）\n三、案件一經確定，本院依職權逕行核發確定證明書，聲請人毋\n    庸另行聲請。",
  "structure": {
    "main": "相對人於民國九十八年八月二十日簽發之本票金額新台幣貳拾伍\n萬元，其中新台幣貳拾壹萬壹仟壹佰肆拾肆元部分，及自民國九\n十九年四月二十一日起至清償日止，按年利率百分之一七點九０\n計算之利息，准予強制執行。\n聲請程序費用新台幣壹仟元由相對人負擔。",
    "reason": "一、本件聲請意旨略以：聲請人執有相對人於民國98年8月20日\n    簽發並免除作成拒絕證書之本票一紙，內載金額250,000元\n    ，到期日為民國99年4月20日，詎屆期經提示後，尚有如主\n    文所示之票款本金及利息未獲清償，為此提出本票一紙，聲\n    請裁定准許強制執行。\n二、本件聲請核與票據法第123條規定相符，應予准許。\n三、依非訟事件法第21條第2項、第24條第1項，民事訴訟法第78\n    條，裁定如主文。"
  },
  "characters": {
    "judges": [

    ],
    "prosecutors": [

    ],
    "lawyers": [

    ],
    "clerks": [

    ],
    "plaintiffs": [

    ],
    "defendants": [

    ],
    "prosecutor_office": [
      "匯豐汽車股份有限公司"
    ],
    "creditors": [

    ],
    "debtors": [

    ],
    "judicial_associate_officer": [
      "徐家惠"
    ]
  },
  "adjudged_at": "2010-05-12",
  "created_at": "2016-01-05 12:33:12",
  "updated_at": "2016-01-05 12:33:12"
}