{
  "identify": "ILD-99-易-150-20100512-1",
  "court": {
    "name": "臺灣宜蘭地方法院",
    "code": "ILD"
  },
  "division": {
    "name": "刑事",
    "code": "M"
  },
  "year": 99,
  "word": "易",
  "number": "150",
  "jcheck": "1",
  "reason": "毒品危害防制條例",
  "content": "臺灣宜蘭地方法院宣示判決筆錄           99年度易字第150號\n公  訴  人  臺灣宜蘭地方法院檢察署檢察官\n被      告  甲○○\n上列被告因毒品危害防制條例案件，經檢察官提起公訴（99年度\n毒偵字第166號），於中華民國99年5月12日下午5時整，在本院\n第三法庭宣示判決，出席職員如下：\n    法  官 鄧晴馨\n    書記官 林怡君\n    通  譯 吳嘉晟\n法官起立朗讀判決主文、犯罪事實要旨、處罰條文、附記事項，\n及告以上訴限制、期間並提出上訴狀之法院，且諭知記載其內容\n：\n一、主  文：\n    甲○○施用第二級毒品，累犯，處有期徒刑伍月，如易科罰\n    金，以新臺幣壹仟元折算壹日。\n二、事  實：\n    甲○○前因施用毒品案件，經本院裁定送觀察、勒戒後，認\n    無繼續施用毒品之傾向，於民國92年10月21日執行完畢釋放\n    。再因施用毒品案件，經本院先後以95年度羅簡字第166號\n    、95年度宜簡字第424號各判處有期徒刑6月、5月確定；因\n    違反森林法案件，經本院以95年度訴字第114號判處有期徒\n    刑7月，罰金新臺幣9272元確定；因竊盜案件，先後經本院\n    以95年度易字第464號、臺灣台北地方法院以95年度易字第\n    1670號各判處有期徒刑7月確定後，前開案件經本院以96 年\n    度聲減字第329號裁定減刑並定應執行刑有期徒刑為1年2 月\n    15日，罰金新臺幣4636元確定，於96年10月4日執行完畢。\n    詎仍不知悛悔，復基於施用第二級毒品甲基安非他命之犯意\n    ，於99年1月19日22時40分為警採尿回溯96小時內之某時，\n    在不詳地點，施用第二級毒品甲基安非他命1次。嗣於同日\n    19時40分許，因另案遭通緝，在宜蘭縣羅東鎮○○路○段與\n    純精路口為警查獲，經同意後採尿送驗，結果呈第二級毒品\n    甲基安非他命類陽性反應，始悉上情。\n三、處罰條文：\n    毒品危害防制條例第10條第2項，刑法第11條前段、第47條\n    第1項、第41條第1項前段。\n四、協商判決除有刑事訴訟法第455條之4第1項第1款於本訊問程\n    序終結前，被告撤銷協商合意或檢察官撤回協商聲請者；第\n    2款被告協商之意思非出於自由意志者；第4款被告所犯之罪\n    非第455條之2第1項所定得以協商判決者；第6款被告有其他\n    較重之裁判上一罪之犯罪事實者；第7款法院認應諭知免刑\n    或免訴、不受理者情形之一，及違反同條第2項「法院應於\n    協商合意範圍內為判決；法院為協商判決所科之刑，以宣告\n    緩刑或2年以下有期徒刑、拘役或罰金為限」之規定者外，\n    不得上訴。\n五、如有前述得上訴之情形而不服本件判決，得自收受判決送達\n    之日起10日內，向本院提出上訴書狀，上訴於第二審法院。\n中    華    民    國    99    年    5    月     12    日\n                  臺灣宜蘭地方法院刑事第四庭\n                      書記官  林怡君\n                      法  官  鄧晴馨\n上筆錄證明與原本無異。\n                      書記官  林怡君\n中    華    民    國    99    年    5     月    13    日",
  "structure": {
  },
  "characters": {
    "judges": [
      "鄧晴馨",
      "鄧晴馨"
    ],
    "prosecutors": [

    ],
    "lawyers": [

    ],
    "clerks": [
      "林怡君",
      "林怡君",
      "林怡君"
    ],
    "plaintiffs": [

    ],
    "defendants": [
      "甲○○"
    ],
    "prosecutor_office": [
      "臺灣宜蘭地方法院檢察署檢察官"
    ],
    "creditors": [

    ],
    "debtors": [

    ],
    "judicial_associate_officer": [

    ]
  },
  "adjudged_at": "2010-05-12",
  "created_at": "2016-01-05 12:30:19",
  "updated_at": "2016-01-05 12:30:19"
}