{
  "identify": "KLD-99-聲-504-20100512-1",
  "court": {
    "name": "臺灣基隆地方法院",
    "code": "KLD"
  },
  "division": {
    "name": "刑事",
    "code": "M"
  },
  "year": 99,
  "word": "聲",
  "number": "504",
  "jcheck": "1",
  "reason": "假釋中付保護管束",
  "content": "臺灣基隆地方法院刑事裁定               99年度聲字第504號\n聲  請  人  臺灣基隆地方法院檢察署檢察官\n受  刑  人  甲○○\n上列受刑人因偽造文書等案件，經聲請人聲請付保護管束（99年\n度執聲字第380號、97年度執字第1518號、臺灣基隆地方法院檢\n察署97年度執助字第1100號），本院裁定如下：\n    主  文\n甲○○假釋中付保護管束。\n    理  由\n一、聲請意旨略稱：受刑人甲○○前因偽造文書等罪，經臺灣基\n    隆地方法院以97年度訴字32號判決應執行有期徒刑2年4月（\n    起訴案號臺灣基隆地方法院檢察署96年度偵字第5755號），\n    並發交臺灣高雄第二監獄燕巢分監執行中。茲聲請人以受刑\n    人業經法務部以民國99年5月5日法矯字第0999017677號函核\n    准假釋，並經法務部矯正司以99年5月5日法矯司字第099090\n    5911號函將「假釋出獄人交付保護管束名冊」檢送聲請人在\n    案，受刑人刑期終結日期原為99年8月23日，惟依行刑累進\n    處遇條例縮短刑期日數58日，縮短刑期後刑期屆滿日為99年\n    6月26日，聲請於其假釋中付保護管束。經本院審核有關文\n    件，本院為上開案件之犯罪事實最後裁判之法院，爰認聲請\n    為正當。\n二、依刑事訴訟法第481條第1項、刑法第96條但書、第93條第2\n    項，裁定如主文。\n中    華    民    國    99    年    5     月    12    日\n                  刑事第三庭法    官  鄭景文\n以上正本證明與原本無異。\n對於本件裁定如有不服，應於送達後5日內， 向本院提出抗告書\n狀（應附繕本），敘述抗告之理由，抗告於臺灣高等法院。\n中    華    民    國    99    年    5     月    12    日\n                            書 記 官  李繼業",
  "structure": {
    "main": "甲○○假釋中付保護管束。",
    "reason": "一、聲請意旨略稱：受刑人甲○○前因偽造文書等罪，經臺灣基\n    隆地方法院以97年度訴字32號判決應執行有期徒刑2年4月（\n    起訴案號臺灣基隆地方法院檢察署96年度偵字第5755號），\n    並發交臺灣高雄第二監獄燕巢分監執行中。茲聲請人以受刑\n    人業經法務部以民國99年5月5日法矯字第0999017677號函核\n    准假釋，並經法務部矯正司以99年5月5日法矯司字第099090\n    5911號函將「假釋出獄人交付保護管束名冊」檢送聲請人在\n    案，受刑人刑期終結日期原為99年8月23日，惟依行刑累進\n    處遇條例縮短刑期日數58日，縮短刑期後刑期屆滿日為99年\n    6月26日，聲請於其假釋中付保護管束。經本院審核有關文\n    件，本院為上開案件之犯罪事實最後裁判之法院，爰認聲請\n    為正當。\n二、依刑事訴訟法第481條第1項、刑法第96條但書、第93條第2\n    項，裁定如主文。"
  },
  "characters": {
    "judges": [
      "鄭景文"
    ],
    "prosecutors": [

    ],
    "lawyers": [

    ],
    "clerks": [

    ],
    "plaintiffs": [

    ],
    "defendants": [

    ],
    "prosecutor_office": [
      "臺灣基隆地方法院檢察署檢察官"
    ],
    "creditors": [

    ],
    "debtors": [

    ],
    "judicial_associate_officer": [

    ]
  },
  "adjudged_at": "2010-05-12",
  "created_at": "2016-01-05 12:33:41",
  "updated_at": "2016-01-05 12:33:41"
}