{
  "identify": "KLD-98-司聲-421-20100512-1",
  "court": {
    "name": "臺灣基隆地方法院",
    "code": "KLD"
  },
  "division": {
    "name": "民事",
    "code": "V"
  },
  "year": 98,
  "word": "司聲",
  "number": "421",
  "jcheck": "1",
  "reason": "公示送達",
  "content": "臺灣基隆地方法院民事裁定             98年度司聲字第421號\n聲  請  人  馬來西亞商亞聯資本股份有限公司台灣分公司\n法定代理人  丁○○\n送達代收人  乙○○\n相  對  人  長欣文化事業有限公司\n兼上一人之\n法定代理人  丙○○\n            甲○○\n上列聲請人聲請對相對人等為公示送達事件，本院裁定如下：\n    主  文\n准將聲請人對相對人丙○○、甲○○如附件所示意思表示之通知\n為公示送達。\n聲請人其餘聲請駁回。\n聲請程序費用新臺幣壹仟元由相對人負擔。\n    理  由\n一、按表意人非因自己之過失不知相對人居所者，得依民事訴訟\n    法公示送達之規定，以公示送達為意思表示之通知，民法第\n    97條定有明文。\n二、本件聲請人以因相對人丙○○住所遷移不明、相對人甲○○\n    查無此人，以致原件退回，為此聲請裁定准為公示送達，並\n    提出債權讓與證明書影本乙紙、民國(以下同)98年12月 8日\n    之存證信函影本乙紙、基隆郵局退回信函封面影本三紙、相\n    對人長欣文化事業之有限公司變更事登記事項卡影本乙紙、\n    相對人丙○○、甲○○之戶籍謄本各乙紙等件為證，顯見相\n    對人有不知其真正住居所之情事，確實核與首揭法條規定相\n    符，應予准許。次按，本件聲請人聲請對相對人長欣文化事\n    業有限公司公示送達部分，因該公司已於93年6月2日經主管\n    機關臺北市政府為廢止登記，失其法人格，此有長欣文化事\n    業有限公司變更事登記事項卡影本在卷可憑，自應予駁回。\n三、依非訟事件法第21條第2項、第24條第1項、民事訴訟法第95\n    條及第78條，裁定如主文。\n四、如對本裁定抗告須於裁定送達後10日內向本院提出抗告狀，\n    並繳納抗告費新臺幣1,000元。\n中    華    民    國    99    年     5    月   12     日\n                  民事庭司法事務官  邱文翰",
  "structure": {
    "main": "准將聲請人對相對人丙○○、甲○○如附件所示意思表示之通知\n為公示送達。\n聲請人其餘聲請駁回。\n聲請程序費用新臺幣壹仟元由相對人負擔。",
    "reason": "一、按表意人非因自己之過失不知相對人居所者，得依民事訴訟\n    法公示送達之規定，以公示送達為意思表示之通知，民法第\n    97條定有明文。\n二、本件聲請人以因相對人丙○○住所遷移不明、相對人甲○○\n    查無此人，以致原件退回，為此聲請裁定准為公示送達，並\n    提出債權讓與證明書影本乙紙、民國(以下同)98年12月 8日\n    之存證信函影本乙紙、基隆郵局退回信函封面影本三紙、相\n    對人長欣文化事業之有限公司變更事登記事項卡影本乙紙、\n    相對人丙○○、甲○○之戶籍謄本各乙紙等件為證，顯見相\n    對人有不知其真正住居所之情事，確實核與首揭法條規定相\n    符，應予准許。次按，本件聲請人聲請對相對人長欣文化事\n    業有限公司公示送達部分，因該公司已於93年6月2日經主管\n    機關臺北市政府為廢止登記，失其法人格，此有長欣文化事\n    業有限公司變更事登記事項卡影本在卷可憑，自應予駁回。\n三、依非訟事件法第21條第2項、第24條第1項、民事訴訟法第95\n    條及第78條，裁定如主文。\n四、如對本裁定抗告須於裁定送達後10日內向本院提出抗告狀，\n    並繳納抗告費新臺幣1,000元。"
  },
  "characters": {
    "judges": [

    ],
    "prosecutors": [

    ],
    "lawyers": [

    ],
    "clerks": [

    ],
    "plaintiffs": [

    ],
    "defendants": [

    ],
    "prosecutor_office": [
      "馬來西亞商亞聯資本股份有限公司台灣分公司"
    ],
    "creditors": [

    ],
    "debtors": [

    ],
    "judicial_associate_officer": [
      "邱文翰"
    ]
  },
  "adjudged_at": "2010-05-12",
  "created_at": "2016-01-05 12:35:19",
  "updated_at": "2016-01-05 12:35:19"
}