{
  "identify": "KLD-99-訴-207-20100512-2",
  "court": {
    "name": "臺灣基隆地方法院",
    "code": "KLD"
  },
  "division": {
    "name": "刑事",
    "code": "M"
  },
  "year": 99,
  "word": "訴",
  "number": "207",
  "jcheck": "2",
  "reason": "違反水土保持法",
  "content": "臺灣基隆地方法院宣示判決筆錄           99年度訴字第207號\n公  訴  人  臺灣基隆地方法院檢察署檢察官\n被      告  甲○○\n選任辯護人  林月雪  律師\n上列被告因違反水土保持法案件（98年度偵字第2354號），於中\n華民國99年5 月12日下午4 時在本院刑事第二法庭宣示判決，出\n席人員如下：\n    法      官 王慧惠\n    書  記  官 王一芳\n審判長起立朗讀判決主文、犯罪事實要旨、處罰條文，及告以上\n訴限制、期間並提出上訴狀之法院，且諭知記載其內容：\n一、主文：\n    甲○○違反水土保持義務人於山坡地修建道路、堆積土石或\n    從事其他開挖整地之行為，應先擬具水土保持計畫，送請主\n    管機關核定之規定，未先擬具水土保持計畫，致生水土流失\n    ，處有期徒刑拾月。緩刑貳年。\n二、犯罪事實要旨：\n    緣甲○○前於民國97年3 月間，向瑞三股份有限公司（下稱\n    瑞三公司）購買碧雲山莊之坐落土地，且為臺北縣平溪鄉○\n    ○○段月桃寮小段第77地號（登記所有人為瑞三公司）及同\n    地段第250 地號（係財政部國有財產局【下稱國有財產局】\n    管理之國有土地，且瑞三公司原已佔用）暨如附圖所示業經\n    標示為未登錄D1、D2（亦係國有土地，併其原亦已由瑞三公\n    司佔有使用）等各筆土地之使用人，並為同地段第245-6 、\n    245-7 、245-8 、251 、252-40、252-41、252-42、252-43\n    、252-46、252-47、252-48、252-50、252-51、252-65、25\n    2-66、252-67、252-68、252-69、252-70、252-76、276-4\n    、276-6 、276-7 、276-8 、276-14地號等各筆土地之所有\n    人（上開各筆土地，以下均合併簡稱為系爭土地），而為水\n    土保持法第四條所稱之「水土保持義務人」。乃甲○○明知\n    系爭土地業經行政院核定暨政府公告劃定為山坡地保育利用\n    條例及水土保持法所稱之「山坡地」，刻則由臺北縣政府負\n    責其「山坡地」之管理，且明知水土保持義務人於山坡地從\n    事水土保持法第十二條第一項所列各款行為以前，應先擬具\n    水土保持計畫，送請主管機關核定，猶未擬具水土保持計畫\n    ，旋自97年4 月間起，陸續在系爭土地如附圖所示之各該範\n    圍，開挖整地、修建道路、設置駁坎、堆積土石及設置涵管\n    ，迨臺北縣政府農業局獲悉上情而於98年3 月5 日到場會勘\n    之時，現場果已致生水土流失之結果。\n三、處罰條文 ：\n    水土保持法第33條第3 項前段、刑法第74條第1 項第1 款。\n四、教示上訴期間及其限制：\n    協商判決除有刑事訴訟法第445 條之4 第1 項第1 款於本訊\n    問程序終結前，被告撤銷協商合意或檢察官撤回協商聲請者\n    ；第2 款被告協商之意思非出於自由意志者；第4 款被告所\n    犯之罪非第455 條之2 第1 項所定得以協商判決者；第6 款\n    被告有其他較重之裁判上一罪之犯罪事實者；第7 款法院認\n    應諭知免刑或免訴、不受理者情形之一，及違反同條第2 項\n    法院「應於協商合意範圍內為判決；法院為協商判決所科之\n    刑，以宣告緩刑或二年以下有期徒刑、拘役或罰金為限」之\n    規定者外，不得上訴。\n五、教示提出上訴狀之法院：\n    本件如得上訴，而如不服本件判決，得自收受判決送達之日\n    起10日內，向本院提出上訴書狀，上訴於第二審法院。\n中    華    民    國    99    年    5     月    12    日\n                  臺灣基隆地方法院刑事第四庭\n                      書  記  官  王一芳\n                      法      官  王慧惠\n以上正本證明與原本無異。\n本判決除有刑事訴訟法第455 條之4 第1 項第1 款、第2 款、第\n4 款、第6 款、第7 款所定情形之一，或違反同條第2 項規定者\n外，不得上訴。\n如有前揭除外情形，對於本件判決如有不服，應於收受本判決後\n10日內向本院提出上訴書狀，其未敘述上訴理由者，並得於提起\n上訴後10日內向本院補提理由書狀（均須按他造當事人之人數附\n繕本）「切勿逕送上級法院」。\n中    華    民    國    99    年    5     月    12    日\n                      書  記  官  王一芳\n附錄論罪法條：\n水土保持法第33條第3 項\n有下列情形之一者，處新台幣6 萬元以上30萬元以下罰鍰：\n一、違反第8 條第1 項規定未依水土保持技術規範實施水土保持\n    之處理與維護，或違反第22條第1 項，未在規定期限內改正\n    或實施仍不合水土保持技術規範者。\n二、違反第12條至第14條規定之一，未先擬具水土保持計畫或未\n    依核定計畫實施水土保持之處理與維護者，或違反第23條規\n    定，未在規定期限內改正或實施仍不合水土保持技術規範者\n    。\n前項各款情形之一，經繼續限期改正而不改正者或實施仍不合水\n土保持技術規範者，按次分別處罰，至改正為止，並令其停工，\n得沒入其設施及所使用之機具，強制拆除及清除其工作物，所需\n費用，由經營人、使用人或所有人負擔。\n第1 項第2 款情形，致生水土流失或毀損水土保持之處理與維護\n設施者，處6 月以上5 年以下有期徒刑，得併科新台幣60萬元以\n下罰金；因而致人於死者，處3 年以上10年以下有期徒刑，得併\n科新台幣80萬元以下罰金；致重傷者，處1 年以上7 年以下有期\n徒刑，得併科新台幣60萬元以下罰金。",
  "structure": {
  },
  "characters": {
    "judges": [
      "王慧惠",
      "王慧惠"
    ],
    "prosecutors": [

    ],
    "lawyers": [

    ],
    "clerks": [

    ],
    "plaintiffs": [

    ],
    "defendants": [
      "甲○○"
    ],
    "prosecutor_office": [
      "臺灣基隆地方法院檢察署檢察官"
    ],
    "creditors": [

    ],
    "debtors": [

    ],
    "judicial_associate_officer": [

    ]
  },
  "adjudged_at": "2010-05-12",
  "created_at": "2016-01-05 12:34:08",
  "updated_at": "2016-01-05 12:34:08"
}