{
  "identify": "KSB-98-訴-657-20100105-1",
  "court": {
    "name": "高雄高等行政法院",
    "code": "KSB"
  },
  "division": {
    "name": "行政",
    "code": "A"
  },
  "year": 98,
  "word": "訴",
  "number": "657",
  "jcheck": "1",
  "reason": "耕地三七五租約",
  "content": "高雄高等行政法院裁定\n                                       98年度訴字第657號\n原      告  甲○○\n被      告  臺南縣麻豆鎮公所\n代  表  人  乙○○  鎮長\n參  加  人  丙○○\n            丁○○\n上列原告與被告間耕地三七五租約事件，本院裁定如下：\n    主  文\n丙○○、丁○○應獨立參加本件訴訟。\n    理  由\n一、按行政法院認為撤銷訴訟之結果，第三人之權利或法律上利\n    益將受損害者，得依職權命其獨立參加訴訟，行政訴訟法第\n    42條第1項定有明文。\n二、緣原告以三七五租約方式向訴外人黃堅承租坐落臺南縣寮子\n    段36-2地號土地（下稱系爭土地），其後黃堅於民國97年\n    10月20日將系爭土地贈與其子丙○○、丁○○。嗣租約於97\n    年底期滿，原告於98年1月5日申請續訂租約，而丙○○、丁\n    ○○亦以擴大家庭農場經營規模為由申請收回耕地；案經被\n    告以98年4月10日麻所民字第0980005361號通知書准由出租\n    人收回自耕；並另以98年4月15日麻所民字第0980005628號\n    函，請出租人於文到20日內補償承租人，補償項目包括１、\n    承租人改良土地所支付之費用，但以未失效能部分之價值為\n    限。２、尚未收穫農作物之價額。惟原告於98年5月6日向被\n    告提出陳報書謂出租人應補償其終止租約當期公告現值減除\n    土地增值稅餘額3分之1，並應加計改良土地費用。經被告以\n    98年5月8日麻所民字第0980006752號函復原告有關耕地三七\n    五減租條例第19條第3項出租人依同條第2項規定收回耕地時\n    ，準用第17條第2項補償承租人之規定，業經內政部95年7月\n    19日台內地字第0950117562號函釋自95年7月9日起失其效力\n    。原告不服，提起訴願，遭決定駁回，遂提起本件行政訴訟\n    。茲因本件撤銷訴訟之結果，丙○○、丁○○之權利或法律\n    上利益將受損害，依法命其獨立參加訴訟，爰為裁定如主文\n    。\n中    華    民    國    99    年     1    月    5     日\n             高雄高等行政法院第二庭\n                         審判長法官  江  幸  垠\n                               法官  吳  永  宋\n                               法官  簡  慧  娟\n以上正本係照原本作成。\n不得抗告。\n中    華    民    國    99    年     1    月    5     日\n                             書記官  涂  瓔  純\n",
  "structure": {
    "main": "丙○○、丁○○應獨立參加本件訴訟。",
    "reason": "一、按行政法院認為撤銷訴訟之結果，第三人之權利或法律上利\n    益將受損害者，得依職權命其獨立參加訴訟，行政訴訟法第\n    42條第1項定有明文。\n二、緣原告以三七五租約方式向訴外人黃堅承租坐落臺南縣寮子\n    段36-2地號土地（下稱系爭土地），其後黃堅於民國97年\n    10月20日將系爭土地贈與其子丙○○、丁○○。嗣租約於97\n    年底期滿，原告於98年1月5日申請續訂租約，而丙○○、丁\n    ○○亦以擴大家庭農場經營規模為由申請收回耕地；案經被\n    告以98年4月10日麻所民字第0980005361號通知書准由出租\n    人收回自耕；並另以98年4月15日麻所民字第0980005628號\n    函，請出租人於文到20日內補償承租人，補償項目包括１、\n    承租人改良土地所支付之費用，但以未失效能部分之價值為\n    限。２、尚未收穫農作物之價額。惟原告於98年5月6日向被\n    告提出陳報書謂出租人應補償其終止租約當期公告現值減除\n    土地增值稅餘額3分之1，並應加計改良土地費用。經被告以\n    98年5月8日麻所民字第0980006752號函復原告有關耕地三七\n    五減租條例第19條第3項出租人依同條第2項規定收回耕地時\n    ，準用第17條第2項補償承租人之規定，業經內政部95年7月\n    19日台內地字第0950117562號函釋自95年7月9日起失其效力\n    。原告不服，提起訴願，遭決定駁回，遂提起本件行政訴訟\n    。茲因本件撤銷訴訟之結果，丙○○、丁○○之權利或法律\n    上利益將受損害，依法命其獨立參加訴訟，爰為裁定如主文\n    。"
  },
  "characters": {
    "judges": [

    ],
    "prosecutors": [

    ],
    "lawyers": [

    ],
    "clerks": [
      "涂瓔純"
    ],
    "plaintiffs": [
      "甲○○"
    ],
    "defendants": [
      "臺南縣麻豆鎮公所",
      "代  表  人  乙○○  鎮長",
      "參  加  人  丙○○"
    ],
    "prosecutor_office": [

    ],
    "creditors": [

    ],
    "debtors": [

    ],
    "judicial_associate_officer": [

    ]
  },
  "adjudged_at": "2010-01-05",
  "created_at": "2016-01-05 15:06:10",
  "updated_at": "2016-01-05 15:06:10"
}