{
  "identify": "KSH-98-上訴-1668-20100104-1",
  "court": {
    "name": "臺灣高等法院",
    "code": "KSH"
  },
  "division": {
    "name": "刑事",
    "code": "M"
  },
  "year": 98,
  "word": "上訴",
  "number": "1668",
  "jcheck": "1",
  "reason": "違反毒品危害防制條例",
  "content": "臺灣高等法院高雄分院刑事判決        98年度上訴字第1668號\n上  訴  人\n即  被  告  乙○○\n送達代收人  甲○○\n上列上訴人因違反毒品危害防制條例案件，不服臺灣高雄地方法\n院98年度審訴字第3313號中華民國98年10月20日第一審判決（起\n訴案號：臺灣高雄地方法院檢察署98年度毒偵字第3574、3951號\n），提起上訴，本院判決如下：\n     主  文\n上訴駁回。\n     理  由\n一、按上訴書狀應敘述具體理由；又第二審法院認為上訴書狀未\n    敘述理由或上訴有刑事訴訟法第362 條前段之情形者，應以\n    判決駁回之，同法第361 條第2 項、第367 條前段定有明文\n    。而依法院辦理刑事訴訟案件應行注意事項第162 條規定：\n    「……所稱具體理由，係指須就不服之判決為具體之指摘而\n    言，如僅泛稱原判決認事用法不當或採證違法、判決不公等\n    ，均非具體理由。……」亦即所謂具體理由，必係依據卷內\n    既有訴訟資料或提出新事證，指摘或表明第一審判決有何採\n    證認事、用法或量刑等足以影響判決本旨之不當或違法，而\n    構成應予撤銷之具體事由，始克當之（例如：依憑證據法則\n    具體指出所採證據何以不具證據能力，或依憑卷證資料，明\n    確指出所為證據證明力之判斷如何違背經驗、論理法則）；\n    倘僅泛言原判決認定事實錯誤、違背法令、量刑失之過重或\n    輕縱，而未依上揭意旨指出具體事由，或形式上雖已指出具\n    體事由，然該事由縱使屬實，亦不足以認為原判決有何不當\n    或違法者（例如：對不具有調查必要性之證據，法院未依聲\n    請調查亦未說明理由，或援用證據不當，但除去該證據仍應\n    為同一事實之認定），皆難謂係具體理由，俾與第二審上訴\n    制度旨在請求第二審法院撤銷、變更第一審不當或違法之判\n    決，以實現個案救濟之立法目的相契合，並節制濫行上訴（\n    最高法院97年度台上字第892 號判決意旨參照）。\n二、經查，上訴人即被告乙○○雖於上訴期間屆滿（即98年11月\n    12日）前提出上訴書狀，並具理由略以伊已就醫並服用美沙\n    冬治療，且全家總動員幫助伊戒絕毒品，而伊現有正當工作\n    ，請求給予緩刑等語。惟查，被告經原審論以施用第一級毒\n    品罪2 罪，各判處有期徒刑7 月，應執行有期徒刑1 年，已\n    經原審判決敘述：被告上開犯行業經其於原審審理中自白，\n    並有高雄市立凱旋醫院濫用藥物尿液檢驗報告2 份可憑；且\n    被告前因施用毒品等案件，經法院判決有罪確定，於94年3\n    月30日縮刑期滿執行完畢，其前受有期徒刑執行完畢後，5\n    年內故意再犯有期徒刑以上之本罪，應論以累犯並依法加重\n    其刑；復於量刑審酌被告前經觀察、勒戒及刑罰之執行，仍\n    未能徹底戒絕毒品，復再犯本件施用毒品罪，顯見其自制力\n    不足，無法擺脫毒品，未能體悟施用毒品對自己、家人造成\n    之傷害及社會之負擔，惟念所犯施用毒品罪乃屬戕害自身身\n    心健康行為，尚未對他人造成實害，其行為本身對社會所造\n    成之危害並非直接，反社會性之程度應屬較低，且其犯後已\n    坦認犯行等一切情狀，理由堪稱完備，且依其量刑審酌之事\n    項，亦無何違反刑法第57條規定之情事，客觀上並無不當之\n    處。又被告上訴狀所載之理由，僅以上情求處緩刑，但未明\n    確指出原審判決上開所為之判斷及量刑，有如何違背經驗、\n    論理法則之處，亦即並未就原審之採證及判斷指出判決有何\n    違背法令或不當之處，其上訴即不合法律上之程式。\n三、再上訴不合法律上之程式之情形，依刑事訴訟法第367 條但\n    書規定：「但其情形可以補正而未經原審法院命其補正者，\n    審判長應定期先命補正。」本件被告提出上訴書狀未敘述理\n    由，亦未經原審法院命其補正，業經本院於98年9 月23日以\n    98年度上訴字第1292號裁定命被告補提理由書狀，經被告於\n    98年9 月3 日補提上訴理由如上，然並未敘述具體理由，且\n    於上訴期間屆滿後之20日內（即98年12月2 日以前），亦未\n    補提上訴具體理由，依上開規定，顯屬違背法律上之程式，\n    應由本院依同法第367 條前段、第372 條規定，不經言詞辯\n    論判決如主文。\n中    華    民    國    99    年    1     月    4     日\n                  刑事第七庭    審判長法  官  莊飛宗\n                                      法  官  陳明富\n                                      法  官  蔡廣昇\n以上正本證明與原本無異。\n如不服本判決應於收受本判決後10日內向本院提出上訴書狀，其\n未敘述上訴理由者，並得於提起上訴後10日內向本院補提理由書\n狀（均須按他造當事人之人數附繕本）「切勿逕送上級法院」。\n中    華    民    國    99    年    1     月    4     日\n                                      書記官  曾允志",
  "structure": {
    "main": "上訴駁回。",
    "reason": "一、按上訴書狀應敘述具體理由；又第二審法院認為上訴書狀未\n    敘述理由或上訴有刑事訴訟法第362 條前段之情形者，應以\n    判決駁回之，同法第361 條第2 項、第367 條前段定有明文\n    。而依法院辦理刑事訴訟案件應行注意事項第162 條規定：\n    「……所稱具體理由，係指須就不服之判決為具體之指摘而\n    言，如僅泛稱原判決認事用法不當或採證違法、判決不公等\n    ，均非具體理由。……」亦即所謂具體理由，必係依據卷內\n    既有訴訟資料或提出新事證，指摘或表明第一審判決有何採\n    證認事、用法或量刑等足以影響判決本旨之不當或違法，而\n    構成應予撤銷之具體事由，始克當之（例如：依憑證據法則\n    具體指出所採證據何以不具證據能力，或依憑卷證資料，明\n    確指出所為證據證明力之判斷如何違背經驗、論理法則）；\n    倘僅泛言原判決認定事實錯誤、違背法令、量刑失之過重或\n    輕縱，而未依上揭意旨指出具體事由，或形式上雖已指出具\n    體事由，然該事由縱使屬實，亦不足以認為原判決有何不當\n    或違法者（例如：對不具有調查必要性之證據，法院未依聲\n    請調查亦未說明理由，或援用證據不當，但除去該證據仍應\n    為同一事實之認定），皆難謂係具體理由，俾與第二審上訴\n    制度旨在請求第二審法院撤銷、變更第一審不當或違法之判\n    決，以實現個案救濟之立法目的相契合，並節制濫行上訴（\n    最高法院97年度台上字第892 號判決意旨參照）。\n二、經查，上訴人即被告乙○○雖於上訴期間屆滿（即98年11月\n    12日）前提出上訴書狀，並具理由略以伊已就醫並服用美沙\n    冬治療，且全家總動員幫助伊戒絕毒品，而伊現有正當工作\n    ，請求給予緩刑等語。惟查，被告經原審論以施用第一級毒\n    品罪2 罪，各判處有期徒刑7 月，應執行有期徒刑1 年，已\n    經原審判決敘述：被告上開犯行業經其於原審審理中自白，\n    並有高雄市立凱旋醫院濫用藥物尿液檢驗報告2 份可憑；且\n    被告前因施用毒品等案件，經法院判決有罪確定，於94年3\n    月30日縮刑期滿執行完畢，其前受有期徒刑執行完畢後，5\n    年內故意再犯有期徒刑以上之本罪，應論以累犯並依法加重\n    其刑；復於量刑審酌被告前經觀察、勒戒及刑罰之執行，仍\n    未能徹底戒絕毒品，復再犯本件施用毒品罪，顯見其自制力\n    不足，無法擺脫毒品，未能體悟施用毒品對自己、家人造成\n    之傷害及社會之負擔，惟念所犯施用毒品罪乃屬戕害自身身\n    心健康行為，尚未對他人造成實害，其行為本身對社會所造\n    成之危害並非直接，反社會性之程度應屬較低，且其犯後已\n    坦認犯行等一切情狀，理由堪稱完備，且依其量刑審酌之事\n    項，亦無何違反刑法第57條規定之情事，客觀上並無不當之\n    處。又被告上訴狀所載之理由，僅以上情求處緩刑，但未明\n    確指出原審判決上開所為之判斷及量刑，有如何違背經驗、\n    論理法則之處，亦即並未就原審之採證及判斷指出判決有何\n    違背法令或不當之處，其上訴即不合法律上之程式。\n三、再上訴不合法律上之程式之情形，依刑事訴訟法第367 條但\n    書規定：「但其情形可以補正而未經原審法院命其補正者，\n    審判長應定期先命補正。」本件被告提出上訴書狀未敘述理\n    由，亦未經原審法院命其補正，業經本院於98年9 月23日以\n    98年度上訴字第1292號裁定命被告補提理由書狀，經被告於\n    98年9 月3 日補提上訴理由如上，然並未敘述具體理由，且\n    於上訴期間屆滿後之20日內（即98年12月2 日以前），亦未\n    補提上訴具體理由，依上開規定，顯屬違背法律上之程式，\n    應由本院依同法第367 條前段、第372 條規定，不經言詞辯\n    論判決如主文。"
  },
  "characters": {
    "judges": [
      "莊飛宗",
      "陳明富",
      "蔡廣昇"
    ],
    "prosecutors": [

    ],
    "lawyers": [

    ],
    "clerks": [

    ],
    "plaintiffs": [

    ],
    "defendants": [
      "乙"
    ],
    "prosecutor_office": [

    ],
    "creditors": [

    ],
    "debtors": [

    ],
    "judicial_associate_officer": [

    ]
  },
  "adjudged_at": "2010-01-04",
  "created_at": "2016-01-05 14:39:47",
  "updated_at": "2016-01-05 14:39:47"
}