{
  "identify": "KSH-98-重上更(三)-122-20100104-1",
  "court": {
    "name": "臺灣高等法院",
    "code": "KSH"
  },
  "division": {
    "name": "刑事",
    "code": "M"
  },
  "year": 98,
  "word": "重上更(三)",
  "number": "122",
  "jcheck": "1",
  "reason": "強盜等",
  "content": "臺灣高等法院高雄分院刑事裁定   98年度重上更(三)字第122號\n聲  請  人\n即  被  告  甲○○\n選任辯護人  鄧國璽律師\n上列被告因強盜等案件，聲請具保停止羈押，本院裁定如下：\n    主  文\n甲○○提出新台幣捌萬元之保證金後，准自民國九十九年一月九\n日起停止羈押，並限制甲○○住居在屏東縣新園鄉○○村○○路\n193 巷19號，暨禁止甲○○出境、出海。\n    理  由\n一、聲請意旨略以：聲請人即被告甲○○於民國96年9 月3 日遭\n    羈押迄今已2 年多，家中經濟不穩定，被告希望能返家工作\n    維持家計，又被告所犯雖屬5 年以上之重罪，但依大法官釋\n    字第665 號意旨，仍須有相當理由認被告有逃亡、串證之虞\n    始得羈押，而被告經偵、審程序已無串證或湮滅證據之虞，\n    家中又有父、母及固定居住處，亦無逃亡之虞，為此請准被\n    告具保停止羈押等語。\n二、被告甲○○前經本院於98年10月14日訊問被告後，認其為所\n    犯刑法第330 條第1 項如原審法院判決事實欄一、(三)、(四)、\n    (五)、(八)所示強盜4 罪（即本院前審之98年度上更(二)字第79號\n    判決事實欄一、(一)、(二)、(三)、(四)所示）之犯罪嫌疑重大，有\n    刑事訴訟法第101 條第1 項第3 款之情形，非予羈押顯難進\n    行更審審判或執行，於98年10月14日執行羈押，嗣於98年11\n    月9 日起由臺灣高雄地方法院檢察署檢察官借提執行另案之\n    有期徒刑2 月，將於99年1 月8 日執行期滿，合先敘明。\n三、經查被告甲○○所犯上開強盜等4 罪，已於98年12月29日宣\n    判，雖判處被告應執行有期徒刑10年在案，然本院茲審酌本\n    案相關卷證，認被告於99年1 月8 日執行期滿後，已無繼續\n    羈押被告之必要，爰裁定被告提出新台幣8 萬元之保證金後\n    ，自99年1 月9 日起准予停止羈押。又為確保日後更審之審\n    理或有罪之執行，併予限制被告住居在屏東縣新園鄉○○村\n    ○○路193 巷19號，及禁止被告出境、出海。\n據上論斷，依刑事訴訟法第111 條第1 項、第5 項、第121 條第\n1 項，裁定如主文。\n中    華    民    國    99    年    1    月      4    日\n                    刑事第三庭  審判長法  官  莊崑山\n                                      法  官  唐照明\n                                      法  官  張意聰\n以上正本證明與原本無異。\n如不服本裁定應於送達後5 日內向本院提出抗告狀。\n中    華    民    國    99    年    1    月      4    日\n                                      書記官  陳金",
  "structure": {
    "main": "甲○○提出新台幣捌萬元之保證金後，准自民國九十九年一月九\n日起停止羈押，並限制甲○○住居在屏東縣新園鄉○○村○○路\n193 巷19號，暨禁止甲○○出境、出海。",
    "reason": "一、聲請意旨略以：聲請人即被告甲○○於民國96年9 月3 日遭\n    羈押迄今已2 年多，家中經濟不穩定，被告希望能返家工作\n    維持家計，又被告所犯雖屬5 年以上之重罪，但依大法官釋\n    字第665 號意旨，仍須有相當理由認被告有逃亡、串證之虞\n    始得羈押，而被告經偵、審程序已無串證或湮滅證據之虞，\n    家中又有父、母及固定居住處，亦無逃亡之虞，為此請准被\n    告具保停止羈押等語。\n二、被告甲○○前經本院於98年10月14日訊問被告後，認其為所\n    犯刑法第330 條第1 項如原審法院判決事實欄一、(三)、(四)、\n    (五)、(八)所示強盜4 罪（即本院前審之98年度上更(二)字第79號\n    判決事實欄一、(一)、(二)、(三)、(四)所示）之犯罪嫌疑重大，有\n    刑事訴訟法第101 條第1 項第3 款之情形，非予羈押顯難進\n    行更審審判或執行，於98年10月14日執行羈押，嗣於98年11\n    月9 日起由臺灣高雄地方法院檢察署檢察官借提執行另案之\n    有期徒刑2 月，將於99年1 月8 日執行期滿，合先敘明。\n三、經查被告甲○○所犯上開強盜等4 罪，已於98年12月29日宣\n    判，雖判處被告應執行有期徒刑10年在案，然本院茲審酌本\n    案相關卷證，認被告於99年1 月8 日執行期滿後，已無繼續\n    羈押被告之必要，爰裁定被告提出新台幣8 萬元之保證金後\n    ，自99年1 月9 日起准予停止羈押。又為確保日後更審之審\n    理或有罪之執行，併予限制被告住居在屏東縣新園鄉○○村\n    ○○路193 巷19號，及禁止被告出境、出海。\n據上論斷，依刑事訴訟法第111 條第1 項、第5 項、第121 條第\n1 項，裁定如主文。"
  },
  "characters": {
    "judges": [
      "莊崑山",
      "唐照明",
      "張意聰"
    ],
    "prosecutors": [

    ],
    "lawyers": [
      "鄧國璽"
    ],
    "clerks": [

    ],
    "plaintiffs": [

    ],
    "defendants": [
      "甲"
    ],
    "prosecutor_office": [

    ],
    "creditors": [

    ],
    "debtors": [

    ],
    "judicial_associate_officer": [

    ]
  },
  "adjudged_at": "2010-01-04",
  "created_at": "2016-01-05 14:38:49",
  "updated_at": "2016-01-05 14:38:49"
}