{
  "identify": "KSH-98-交抗-770-20100105-1",
  "court": {
    "name": "臺灣高等法院",
    "code": "KSH"
  },
  "division": {
    "name": "刑事",
    "code": "M"
  },
  "year": 98,
  "word": "交抗",
  "number": "770",
  "jcheck": "1",
  "reason": "聲明異議",
  "content": "臺灣高等法院高雄分院刑事裁定         98年度交抗字第770號\n抗  告  人\n即受處分人  甲○○\n上列抗告人因違反道路交通管理處罰條例聲明異議案件，不服臺\n灣高雄地方法院中華民國98年10月8 日裁定（98年度交聲字第25\n98號），提起抗告，本院裁定如下：\n    主  文\n抗告駁回。\n    理  由\n一、抗告意旨略以：原舉發單位已來函表示本案抗告人之行為，\n    略有疏忽，無故意掩藏車牌號碼之心機；原處分機關係以道\n    路交通處罰條例第13條第1 款「以安裝其他器具之方式，不\n    能辨識車牌」，其他器具係指機器或工具，然駕駛人是將廣\n    告名片，張貼位置不妥，該車牌目視仍清晰可見，並無模糊\n    不清以致無法辨識情形；因駕駛人不識字，並無將名片到處\n    張貼而進行違規行為或犯罪事實之隱瞞行為；駕駛人疏忽之\n    行為，將依交通法規更正，保證車牌貼個人名片是不宜之行\n    為，請求撤銷原裁定云云。\n二、原審則以：「(一)本件異議人甲○○於民國（下同）97年12月\n    18日11時57分，騎乘其所有之車牌號碼SC7-653 號輕型機車\n    ，行經高雄市○○區○○路711 號前時，因車牌上粘貼2 張\n    名片致無法辨認牌號，經高雄市政府警察局三民第二分局警\n    備隊警員認有「機車牌照（號牌）以安裝其他器具之方式，\n    使不能辨認其牌號」違反道路交通管理處罰條例第13條第1\n    款之規定，當場攔查製單舉發，嗣經原處分機關依道路交通\n    管理處罰條例第13條第1 款規定裁處等情，有高雄市政府警\n    察局高市警交字第B00000000 號舉發違反道路交通管理事件\n    通知單、交通部公路總局高雄區監理所高監營裁字第裁80-B\n    000000 00 號違反道路交通管理事件裁決書各1 份附卷可稽\n    。(二)異議人上開機車車牌上確有廣告名片2 張，粘貼於車牌\n    上所載「臺灣省」處、車牌號碼「SC7-653 」之數字「7 」\n    、「6 」下方，此為異議人所不爭執，並有卷附照片2張 足\n    資佐證。異議人雖以前詞置辯，然觀諸該舉發照片所示，該\n    粘貼於下方之廣告名片已遮蔽數字「7 」、「6 」之部分字\n    體，並使「7 」部分字體可能誤認為係英文字母「Z 」，使\n    「6 」部分字體不易辨識或可能誤認為「0 」，是確實有使\n    車牌號碼不易辨識之情形。又按道路交通管理處罰條例13條\n    第1 款之所由設，乃立法者為使汽機車所有人就其行政法上\n    義務之違反應負其行政處罰責任，以加強道路交通管理之行\n    政目的所為之規定。而牌照係辨識車籍之最重要依據，為使\n    用路人輕易知悉行駛於路上之車輛為何人所有，藉以保障行\n    車安全，維護社會秩序，準此，號牌之懸掛應使用路人得以\n    清楚辨識其車牌號碼方屬適法。本件駕駛人既領有駕駛執照\n    ，其就「道路交通安全規則」第11條第2 項「按汽車號牌不\n    得變造損毀、塗抹或粘貼其他材料、加裝邊框或霓虹燈、裝\n    置旋轉架、顛倒懸掛或以安裝其他器具之方式使不能辨認其\n    牌號，並不得以他物遮蔽，如有污穢，致不能辨認其牌號時\n    ，應洗刷清楚」之相關規定，當應知之甚稔，機車所有人或\n    機車駕駛人，為維護行駛道路之安全及秩序，即應注意各項\n    機車設備功能之完善並符合法律之規定，故縱如異議人所述\n    粘貼廣告名片係為從事黑糖小生意，不知招牌蓋住車牌號碼\n    ，仍應依前揭之說明及法律規定，不得以安裝其他器具之方\n    式使不能辨認其牌號，是異議人前開所辯，顯不足採。」等\n    ，以本件異議人前開違規之事證已足堪認定，認原處分機關\n    依道路交通管理處罰條例第13條第1 款、違反道路交通管理\n    事件統一裁罰基準及處理細則第43條、第44條、第67條之規\n    定，就異議人以安裝其他器具之方式不能辨識號牌之違規行\n    為，裁處罰鍰4,800 元之處分，並無違誤，而據以駁回異議\n    人之異議。\n三、經查：\n  (一)按汽車號牌懸掛位置，除原設有固定位置外，機器腳踏車及\n    拖車號牌每車一面，應正面懸掛於車輛後端之明顯適當位置\n    ；汽車號牌不得變造損毀、塗抹或粘貼其他材料、加裝邊框\n    或霓虹燈、裝置旋轉架、顛倒懸掛或以安裝其他器具之方式\n    使不能辨認其牌號，並不得以他物遮蔽，如有污穢，致不能\n    辨認其牌號時，應洗刷清楚，道路交通安全規則第11條第1\n    項第3 款前段、第2 項訂有明文。次按汽車行駛，有損毀或\n    變造汽車牌照、塗抹污損牌照，或以安裝其他器具之方式，\n    使不能辨認其牌號者，處汽車所有人2,400 元以上4,800 元\n    以下罰鍰，並責令申請換領牌照或改正，道路交通管理處罰\n    條例第13條第1 款亦有明文。\n  (二)本件抗告人所有上開機車所懸掛之車牌號碼「SC7-653 」，\n    其上確貼有廣告名片2 張，分別粘貼於車牌中間靠上方邊緣\n    「臺灣省」三字之位置及車牌號碼「SC7-653 」之數字「7\n    」、「6 」之正下方，此為抗告人所供承不諱，並有上開機\n    車車牌之照片2 張附卷可資佐證。依上開二張照片所示，該\n    粘貼於車牌「7 」、「6 」二字正下方之廣告名片，已遮蔽\n    數字「7 」、「6 」之部分字體，使「7 」部分之字體，外\n    觀上變成「7 」，不易變認出係原來之「7 」，反而很容易\n    讓人誤認為係英文字母「Z 」，另外使「6 」部分字體，外\n    觀上變成「C 」，不易辨認出係原來之「6 」，而容易使人\n    誤認為係「0 」，凡此，足認抗告人上開貼名片之行為，確\n    實已致不能（易）辨認其牌號之程度甚明。\n  (三)綜上所述，抗告人上揭違規事證明確。原處分機關依道路交\n    通管理處罰條例第13條第1 款、違反道路交通管理事件統一\n    裁罰基準及處理細則第43條、第44條、第67條之規定，就抗\n    告人以安裝其他器具之方式（即貼名片）致不能辨識車牌號\n    碼之違規行為，裁處罰鍰4,800 元之處分，經核並無違誤，\n    原審依道路交通案件處理辦法第19條規定，以駁回抗告人之\n    異議，核無違誤。抗告人仍執陳詞，提起抗告，並無理由，\n    應予駁回。\n四、據上論結，應依道路交通案件處理辦法第26條，刑事訴訟法\n    第412條，裁定如主文。\n中    華    民    國    99    年    1     月    5     日\n                刑事第五庭    審判長法  官  曾永宗\n                                    法  官  任森銓\n                                    法  官  鍾宗霖\n以上正本證明與原本無異。\n不得再抗告。\n中    華    民    國    99    年    1     月    5     日\n                                    書記官  黎  珍",
  "structure": {
    "main": "抗告駁回。",
    "reason": "一、抗告意旨略以：原舉發單位已來函表示本案抗告人之行為，\n    略有疏忽，無故意掩藏車牌號碼之心機；原處分機關係以道\n    路交通處罰條例第13條第1 款「以安裝其他器具之方式，不\n    能辨識車牌」，其他器具係指機器或工具，然駕駛人是將廣\n    告名片，張貼位置不妥，該車牌目視仍清晰可見，並無模糊\n    不清以致無法辨識情形；因駕駛人不識字，並無將名片到處\n    張貼而進行違規行為或犯罪事實之隱瞞行為；駕駛人疏忽之\n    行為，將依交通法規更正，保證車牌貼個人名片是不宜之行\n    為，請求撤銷原裁定云云。\n二、原審則以：「(一)本件異議人甲○○於民國（下同）97年12月\n    18日11時57分，騎乘其所有之車牌號碼SC7-653 號輕型機車\n    ，行經高雄市○○區○○路711 號前時，因車牌上粘貼2 張\n    名片致無法辨認牌號，經高雄市政府警察局三民第二分局警\n    備隊警員認有「機車牌照（號牌）以安裝其他器具之方式，\n    使不能辨認其牌號」違反道路交通管理處罰條例第13條第1\n    款之規定，當場攔查製單舉發，嗣經原處分機關依道路交通\n    管理處罰條例第13條第1 款規定裁處等情，有高雄市政府警\n    察局高市警交字第B00000000 號舉發違反道路交通管理事件\n    通知單、交通部公路總局高雄區監理所高監營裁字第裁80-B\n    000000 00 號違反道路交通管理事件裁決書各1 份附卷可稽\n    。(二)異議人上開機車車牌上確有廣告名片2 張，粘貼於車牌\n    上所載「臺灣省」處、車牌號碼「SC7-653 」之數字「7 」\n    、「6 」下方，此為異議人所不爭執，並有卷附照片2張 足\n    資佐證。異議人雖以前詞置辯，然觀諸該舉發照片所示，該\n    粘貼於下方之廣告名片已遮蔽數字「7 」、「6 」之部分字\n    體，並使「7 」部分字體可能誤認為係英文字母「Z 」，使\n    「6 」部分字體不易辨識或可能誤認為「0 」，是確實有使\n    車牌號碼不易辨識之情形。又按道路交通管理處罰條例13條\n    第1 款之所由設，乃立法者為使汽機車所有人就其行政法上\n    義務之違反應負其行政處罰責任，以加強道路交通管理之行\n    政目的所為之規定。而牌照係辨識車籍之最重要依據，為使\n    用路人輕易知悉行駛於路上之車輛為何人所有，藉以保障行\n    車安全，維護社會秩序，準此，號牌之懸掛應使用路人得以\n    清楚辨識其車牌號碼方屬適法。本件駕駛人既領有駕駛執照\n    ，其就「道路交通安全規則」第11條第2 項「按汽車號牌不\n    得變造損毀、塗抹或粘貼其他材料、加裝邊框或霓虹燈、裝\n    置旋轉架、顛倒懸掛或以安裝其他器具之方式使不能辨認其\n    牌號，並不得以他物遮蔽，如有污穢，致不能辨認其牌號時\n    ，應洗刷清楚」之相關規定，當應知之甚稔，機車所有人或\n    機車駕駛人，為維護行駛道路之安全及秩序，即應注意各項\n    機車設備功能之完善並符合法律之規定，故縱如異議人所述\n    粘貼廣告名片係為從事黑糖小生意，不知招牌蓋住車牌號碼\n    ，仍應依前揭之說明及法律規定，不得以安裝其他器具之方\n    式使不能辨認其牌號，是異議人前開所辯，顯不足採。」等\n    ，以本件異議人前開違規之事證已足堪認定，認原處分機關\n    依道路交通管理處罰條例第13條第1 款、違反道路交通管理\n    事件統一裁罰基準及處理細則第43條、第44條、第67條之規\n    定，就異議人以安裝其他器具之方式不能辨識號牌之違規行\n    為，裁處罰鍰4,800 元之處分，並無違誤，而據以駁回異議\n    人之異議。\n三、經查：\n  (一)按汽車號牌懸掛位置，除原設有固定位置外，機器腳踏車及\n    拖車號牌每車一面，應正面懸掛於車輛後端之明顯適當位置\n    ；汽車號牌不得變造損毀、塗抹或粘貼其他材料、加裝邊框\n    或霓虹燈、裝置旋轉架、顛倒懸掛或以安裝其他器具之方式\n    使不能辨認其牌號，並不得以他物遮蔽，如有污穢，致不能\n    辨認其牌號時，應洗刷清楚，道路交通安全規則第11條第1\n    項第3 款前段、第2 項訂有明文。次按汽車行駛，有損毀或\n    變造汽車牌照、塗抹污損牌照，或以安裝其他器具之方式，\n    使不能辨認其牌號者，處汽車所有人2,400 元以上4,800 元\n    以下罰鍰，並責令申請換領牌照或改正，道路交通管理處罰\n    條例第13條第1 款亦有明文。\n  (二)本件抗告人所有上開機車所懸掛之車牌號碼「SC7-653 」，\n    其上確貼有廣告名片2 張，分別粘貼於車牌中間靠上方邊緣\n    「臺灣省」三字之位置及車牌號碼「SC7-653 」之數字「7\n    」、「6 」之正下方，此為抗告人所供承不諱，並有上開機\n    車車牌之照片2 張附卷可資佐證。依上開二張照片所示，該\n    粘貼於車牌「7 」、「6 」二字正下方之廣告名片，已遮蔽\n    數字「7 」、「6 」之部分字體，使「7 」部分之字體，外\n    觀上變成「7 」，不易變認出係原來之「7 」，反而很容易\n    讓人誤認為係英文字母「Z 」，另外使「6 」部分字體，外\n    觀上變成「C 」，不易辨認出係原來之「6 」，而容易使人\n    誤認為係「0 」，凡此，足認抗告人上開貼名片之行為，確\n    實已致不能（易）辨認其牌號之程度甚明。\n  (三)綜上所述，抗告人上揭違規事證明確。原處分機關依道路交\n    通管理處罰條例第13條第1 款、違反道路交通管理事件統一\n    裁罰基準及處理細則第43條、第44條、第67條之規定，就抗\n    告人以安裝其他器具之方式（即貼名片）致不能辨識車牌號\n    碼之違規行為，裁處罰鍰4,800 元之處分，經核並無違誤，\n    原審依道路交通案件處理辦法第19條規定，以駁回抗告人之\n    異議，核無違誤。抗告人仍執陳詞，提起抗告，並無理由，\n    應予駁回。\n四、據上論結，應依道路交通案件處理辦法第26條，刑事訴訟法\n    第412條，裁定如主文。"
  },
  "characters": {
    "judges": [
      "曾永宗",
      "任森銓",
      "鍾宗霖"
    ],
    "prosecutors": [

    ],
    "lawyers": [

    ],
    "clerks": [

    ],
    "plaintiffs": [

    ],
    "defendants": [

    ],
    "prosecutor_office": [

    ],
    "creditors": [

    ],
    "debtors": [

    ],
    "judicial_associate_officer": [

    ]
  },
  "adjudged_at": "2010-01-05",
  "created_at": "2016-01-05 15:10:41",
  "updated_at": "2016-01-05 15:10:41"
}