{
  "identify": "KSH-98-上訴-1872-20100104-1",
  "court": {
    "name": "臺灣高等法院",
    "code": "KSH"
  },
  "division": {
    "name": "刑事",
    "code": "M"
  },
  "year": 98,
  "word": "上訴",
  "number": "1872",
  "jcheck": "1",
  "reason": "偽證",
  "content": "臺灣高等法院高雄分院刑事判決        98年度上訴字第1872號\n上  訴  人  臺灣屏東地方法院檢察署檢察官\n被      告  甲○○\n上列上訴人因被告偽證案件，不服臺灣屏東地方法院98年度訴字\n第869 號中華民國98年10月21日第一審判決（起訴案號：臺灣屏\n東地方法院檢察署98年度偵字第892 號），提起上訴，本院判決\n如下：\n     主  文\n上訴駁回。\n     理  由\n一、按不服地方法院之第一審判決而上訴者，應向管轄第二審之\n    高等法院為之。上訴書狀應敘述具體理由。第二審法院認為\n    上訴書狀未敘述理由，應以判決駁回之，刑事訴訟法第361\n    條第1 項、第2 項、第367 條前段定有明文。\n二、本件被告甲○○經原審論以刑法第168 條之偽證罪，判處有\n    期徒刑2 月，減為有期徒刑1 月，緩刑2 年後，檢察官於民\n    國98年11月23 日 具狀提起上訴，上訴理由略以：被告為迴\n    護醫師而為虛偽證述，妨害國家司法審判之正確性，造成司\n    法資源浪費，影響司法威信，更令該業務過失致死案迄今13\n    年纏訟未休，致該案被害人家屬身心受創，被告竟仍獲邀緩\n    刑，實有失公道云云，有上訴狀在卷可按。\n三、經查：原判決就被告所犯偽證罪量處有期徒刑2 月，減為有\n    期徒刑1 月，緩刑2 年，已於判決理由中詳載其量刑及諭知\n    緩刑之理由，原判決並無違背法令。上訴人並非依據卷內訴\n    訟資料提出新證據或指摘、表明原判決有何足以影響判決本\n    旨之不當或違法，而構成應予撤銷之具體事由，與刑事訴訟\n    法第361 條第2 項所稱「具體理由」尚非相當。按之上開規\n    定，上訴人之上訴顯屬違背法律上之程式，應由本院依同法\n    第367 條前段、第372 條規定，不經言詞辯論逕行判決如主\n    文。\n中    華    民    國    99    年    1     月    4     日\n                  刑事第九庭    審判長法  官  莊秋桃\n                                      法  官  田平安\n                                      法  官  范惠瑩\n以上正本證明與原本無異。\n如不服本判決應於收受本判決後10日內向本院提出上訴書狀，其\n未敘述上訴理由者，並得於提起上訴後10日內向本院補提理由書\n狀（均須按他造當事人之人數附繕本）「切勿逕送上級法院」。\n中    華    民    國    99    年    1     月    4     日\n                                      書記官  戴育婷",
  "structure": {
    "main": "上訴駁回。",
    "reason": "一、按不服地方法院之第一審判決而上訴者，應向管轄第二審之\n    高等法院為之。上訴書狀應敘述具體理由。第二審法院認為\n    上訴書狀未敘述理由，應以判決駁回之，刑事訴訟法第361\n    條第1 項、第2 項、第367 條前段定有明文。\n二、本件被告甲○○經原審論以刑法第168 條之偽證罪，判處有\n    期徒刑2 月，減為有期徒刑1 月，緩刑2 年後，檢察官於民\n    國98年11月23 日 具狀提起上訴，上訴理由略以：被告為迴\n    護醫師而為虛偽證述，妨害國家司法審判之正確性，造成司\n    法資源浪費，影響司法威信，更令該業務過失致死案迄今13\n    年纏訟未休，致該案被害人家屬身心受創，被告竟仍獲邀緩\n    刑，實有失公道云云，有上訴狀在卷可按。\n三、經查：原判決就被告所犯偽證罪量處有期徒刑2 月，減為有\n    期徒刑1 月，緩刑2 年，已於判決理由中詳載其量刑及諭知\n    緩刑之理由，原判決並無違背法令。上訴人並非依據卷內訴\n    訟資料提出新證據或指摘、表明原判決有何足以影響判決本\n    旨之不當或違法，而構成應予撤銷之具體事由，與刑事訴訟\n    法第361 條第2 項所稱「具體理由」尚非相當。按之上開規\n    定，上訴人之上訴顯屬違背法律上之程式，應由本院依同法\n    第367 條前段、第372 條規定，不經言詞辯論逕行判決如主\n    文。"
  },
  "characters": {
    "judges": [
      "莊秋桃",
      "田平安",
      "范惠瑩"
    ],
    "prosecutors": [

    ],
    "lawyers": [

    ],
    "clerks": [

    ],
    "plaintiffs": [

    ],
    "defendants": [
      "甲○○"
    ],
    "prosecutor_office": [

    ],
    "creditors": [

    ],
    "debtors": [

    ],
    "judicial_associate_officer": [

    ]
  },
  "adjudged_at": "2010-01-04",
  "created_at": "2016-01-05 14:39:59",
  "updated_at": "2016-01-05 14:39:59"
}