{
  "identify": "KSH-98-毒抗-166-20100105-1",
  "court": {
    "name": "臺灣高等法院",
    "code": "KSH"
  },
  "division": {
    "name": "刑事",
    "code": "M"
  },
  "year": 98,
  "word": "毒抗",
  "number": "166",
  "jcheck": "1",
  "reason": "聲請觀察勒戒",
  "content": "臺灣高等法院高雄分院刑事裁定         98年度毒抗字第166號\n抗  告  人\n即  被  告  甲○○\n上列抗告人因聲請觀察勒戒案件，不服臺灣屏東地方法院中華民\n國98年11月19日裁定（98年度毒聲字第398 號），提起抗告，本\n院裁定如下：\n    主  文\n抗告駁回。\n    理  由\n一、本件抗告意旨略以：本案聲請書所指查獲地點即為抗告人住\n    宅屋簷下，當時被告並無任何施用毒品之事證，卻遭警方帶\n    往東港分局東濱派出所內採尿，警方之逮捕程序是否合乎法\n    律程序？是採尿結果能否作為裁定之依據，實有疑義；又被\n    告曾在安泰醫院接受美沙冬治療，聲請書也未提及此事；另\n    被告曾因釣魚滑倒受傷，有安泰醫院住院證明可證，在劇痛\n    時打止痛藥，有類嗎啡合成物，聲請書所稱各別醫院回函均\n    稱所開之藥並無此類成分，但在綜合後的藥理作用是不是有\n    可能呈現此種反應？為此，提起抗告云云。\n二、經查，甲○○前因施用毒品案件，經裁定送觀察勒戒並執行\n    觀察勒戒後，復經裁定強制戒治，於89年4 月26日送強制戒\n    治，嗣經裁定停止戒治，於88年9 月23日因續執行徒刑出監\n    。詎於強制戒治執行完畢後5 年後，又基於施用第一級毒品\n    海洛因之犯意，於98年7 月30日上午10時許，在屏東縣東港\n    鎮○○路119 號4 樓住處施用第一級毒品海洛因之事實，業\n    據被告於警詢坦承不諱，並有被告前科紀錄表可憑。被告嗣\n    後雖否認有上開施用第一級毒品海洛因之犯行，並以上開情\n    詞置辯；惟查，被告於98年8 月3 日14時40分許，在屏東縣\n    東港鎮○○路旁，為警盤查，發現被告手上有針孔痕跡並坦\n    承有注射毒品，而願意接受調查並接受警方採尿送驗，有警\n    詢筆錄可憑。又被告之尿液經送檢驗後呈可待因及嗎啡陽性\n    反應，有臺灣檢驗科技股份有限公司出具之尿液檢驗報告附\n    卷可稽，而經檢察官函查安泰醫院、輔英科技大學附設醫院\n    及屏安醫院結果，據安泰醫院以98年10月13日98東安醫字第\n    0604號函覆：「病患甲○○先生98年5 月2 日至5 月6 日因\n    右下肢骨折於本院住院。爾後未再至本院門診。」、輔英科\n    技大學附設醫院以98年10月8 日輔醫歷字第0981008012號函\n    覆：「病患甲○○曾於民國98年8 月10日起至98年9 月15日\n    止在本院身心內科門診追蹤治療，經診斷……，並處以治療\n    藥物，該類藥物並不致產生嗎啡陽性反應。」、屏安醫院以\n    98年10月8 日屏安病歷字第0981003 號函覆：「……二、查\n    甲○○先生於98年6 月至8 月之間並無至本院門診就診之紀\n    錄。三、查甲○○先生於本院最後一次門診時間為88年1 月\n    2 日。」（見毒偵卷第10頁至第12頁）。是被告所辯不足採\n    信。\n三、按犯毒品危害防制條例第10條之罪者，檢察官應聲請法院裁\n    定，或少年法院（地方法院少年法庭）應先裁定，令被告或\n    少年入勒戒處所觀察、勒戒，其期間不得逾2 月；依第1 項\n    規定為觀察、勒戒或強制戒治執行完畢釋放後，5 年後再犯\n    第10條之罪者，適用本條例前2 項之規定，毒品危害防制條\n    例第20條第1 項、第3 項有明文規定。是原審依上開規定裁\n    定「甲○○施用第一級毒品，令入勒戒處所觀察、勒戒，其\n    期間不得逾2 月。」核無違誤，被告仍執前詞提起抗告，為\n    無理由，應予駁回。\n四、據上論結，應依刑事訴訟法第412 條，裁定如主文。\n中    華    民    國    99    年    1     月    5     日\n              刑事第六庭    審判長法  官  王憲義\n                                  法  官  簡志瑩\n                                  法  官  邱永貴\n以上正本證明與原本無異。\n不得再抗告。\n中    華    民    國    99    年    1     月    5     日\n                                  書記官  鄭翠芬",
  "structure": {
    "main": "抗告駁回。",
    "reason": "一、本件抗告意旨略以：本案聲請書所指查獲地點即為抗告人住\n    宅屋簷下，當時被告並無任何施用毒品之事證，卻遭警方帶\n    往東港分局東濱派出所內採尿，警方之逮捕程序是否合乎法\n    律程序？是採尿結果能否作為裁定之依據，實有疑義；又被\n    告曾在安泰醫院接受美沙冬治療，聲請書也未提及此事；另\n    被告曾因釣魚滑倒受傷，有安泰醫院住院證明可證，在劇痛\n    時打止痛藥，有類嗎啡合成物，聲請書所稱各別醫院回函均\n    稱所開之藥並無此類成分，但在綜合後的藥理作用是不是有\n    可能呈現此種反應？為此，提起抗告云云。\n二、經查，甲○○前因施用毒品案件，經裁定送觀察勒戒並執行\n    觀察勒戒後，復經裁定強制戒治，於89年4 月26日送強制戒\n    治，嗣經裁定停止戒治，於88年9 月23日因續執行徒刑出監\n    。詎於強制戒治執行完畢後5 年後，又基於施用第一級毒品\n    海洛因之犯意，於98年7 月30日上午10時許，在屏東縣東港\n    鎮○○路119 號4 樓住處施用第一級毒品海洛因之事實，業\n    據被告於警詢坦承不諱，並有被告前科紀錄表可憑。被告嗣\n    後雖否認有上開施用第一級毒品海洛因之犯行，並以上開情\n    詞置辯；惟查，被告於98年8 月3 日14時40分許，在屏東縣\n    東港鎮○○路旁，為警盤查，發現被告手上有針孔痕跡並坦\n    承有注射毒品，而願意接受調查並接受警方採尿送驗，有警\n    詢筆錄可憑。又被告之尿液經送檢驗後呈可待因及嗎啡陽性\n    反應，有臺灣檢驗科技股份有限公司出具之尿液檢驗報告附\n    卷可稽，而經檢察官函查安泰醫院、輔英科技大學附設醫院\n    及屏安醫院結果，據安泰醫院以98年10月13日98東安醫字第\n    0604號函覆：「病患甲○○先生98年5 月2 日至5 月6 日因\n    右下肢骨折於本院住院。爾後未再至本院門診。」、輔英科\n    技大學附設醫院以98年10月8 日輔醫歷字第0981008012號函\n    覆：「病患甲○○曾於民國98年8 月10日起至98年9 月15日\n    止在本院身心內科門診追蹤治療，經診斷……，並處以治療\n    藥物，該類藥物並不致產生嗎啡陽性反應。」、屏安醫院以\n    98年10月8 日屏安病歷字第0981003 號函覆：「……二、查\n    甲○○先生於98年6 月至8 月之間並無至本院門診就診之紀\n    錄。三、查甲○○先生於本院最後一次門診時間為88年1 月\n    2 日。」（見毒偵卷第10頁至第12頁）。是被告所辯不足採\n    信。\n三、按犯毒品危害防制條例第10條之罪者，檢察官應聲請法院裁\n    定，或少年法院（地方法院少年法庭）應先裁定，令被告或\n    少年入勒戒處所觀察、勒戒，其期間不得逾2 月；依第1 項\n    規定為觀察、勒戒或強制戒治執行完畢釋放後，5 年後再犯\n    第10條之罪者，適用本條例前2 項之規定，毒品危害防制條\n    例第20條第1 項、第3 項有明文規定。是原審依上開規定裁\n    定「甲○○施用第一級毒品，令入勒戒處所觀察、勒戒，其\n    期間不得逾2 月。」核無違誤，被告仍執前詞提起抗告，為\n    無理由，應予駁回。\n四、據上論結，應依刑事訴訟法第412 條，裁定如主文。"
  },
  "characters": {
    "judges": [
      "王憲義",
      "簡志瑩",
      "邱永貴"
    ],
    "prosecutors": [

    ],
    "lawyers": [

    ],
    "clerks": [

    ],
    "plaintiffs": [

    ],
    "defendants": [
      "甲"
    ],
    "prosecutor_office": [

    ],
    "creditors": [

    ],
    "debtors": [

    ],
    "judicial_associate_officer": [

    ]
  },
  "adjudged_at": "2010-01-05",
  "created_at": "2016-01-05 15:09:16",
  "updated_at": "2016-01-05 15:09:16"
}