{
  "identify": "KSH-99-附民-38-20100512-1",
  "court": {
    "name": "臺灣高等法院",
    "code": "KSH"
  },
  "division": {
    "name": "刑事",
    "code": "M"
  },
  "year": 99,
  "word": "附民",
  "number": "38",
  "jcheck": "1",
  "reason": "損害賠償",
  "content": "臺灣高等法院高雄分院刑事附帶民事訴訟判決\n原      告  丁○○○\n            丙○○\n被      告  乙○○\n上列被告因誹謗等案件（99年度上易字第183 號），經原告提起\n附帶民事訴訟請求損害賠償，本院判決如下：\n    主  文\n原告之訴駁回。\n    事實及理由\n一、原告因本院99年度上易字第183 號刑事案件，起訴請求被告\n    乙○○於其住處（即高雄市○○區○○路885 之3 號）大門\n    外，張貼向原告2 人認錯、悔過、道歉之海報1 星期，並應\n    賠償原告2 人各新臺幣100 萬元。\n二、被告乙○○未為任何聲明或陳述。\n三、按刑事訴訟諭知無罪、免訴或不受理之判決者，應以判決駁\n    回原告之訴，刑事訴訟法第503 條第1 項前段定有明文。查\n    本件被告乙○○被訴誹謗等案件，業經本院為無罪判決確定\n    在案，有該判決書在卷，依諸上開規定，自應駁回原告附帶\n    提起之民事訴訟。\n四、被告甲○○部分，另由本院移送民事庭審理。\n據上論結，應依刑事訴訟法第503 條第1 項前段，判決如主文。\n中    華    民    國    99    年    5     月    12    日\n                  刑事第一庭    審判長法  官 翁慶珍\n                                      法  官 黃仁松\n                                      法  官 徐美麗\n以上正本證明與原本無異。\n不得上訴。\n中    華    民    國    99    年    5     月    12    日\n                                      書記官 賴梅琴",
  "structure": {
    "main": "原告之訴駁回。",
    "fact": "一、原告因本院99年度上易字第183 號刑事案件，起訴請求被告\n    乙○○於其住處（即高雄市○○區○○路885 之3 號）大門\n    外，張貼向原告2 人認錯、悔過、道歉之海報1 星期，並應\n    賠償原告2 人各新臺幣100 萬元。\n二、被告乙○○未為任何聲明或陳述。\n三、按刑事訴訟諭知無罪、免訴或不受理之判決者，應以判決駁\n    回原告之訴，刑事訴訟法第503 條第1 項前段定有明文。查\n    本件被告乙○○被訴誹謗等案件，業經本院為無罪判決確定\n    在案，有該判決書在卷，依諸上開規定，自應駁回原告附帶\n    提起之民事訴訟。\n四、被告甲○○部分，另由本院移送民事庭審理。\n據上論結，應依刑事訴訟法第503 條第1 項前段，判決如主文。",
    "reason": "一、原告因本院99年度上易字第183 號刑事案件，起訴請求被告\n    乙○○於其住處（即高雄市○○區○○路885 之3 號）大門\n    外，張貼向原告2 人認錯、悔過、道歉之海報1 星期，並應\n    賠償原告2 人各新臺幣100 萬元。\n二、被告乙○○未為任何聲明或陳述。\n三、按刑事訴訟諭知無罪、免訴或不受理之判決者，應以判決駁\n    回原告之訴，刑事訴訟法第503 條第1 項前段定有明文。查\n    本件被告乙○○被訴誹謗等案件，業經本院為無罪判決確定\n    在案，有該判決書在卷，依諸上開規定，自應駁回原告附帶\n    提起之民事訴訟。\n四、被告甲○○部分，另由本院移送民事庭審理。\n據上論結，應依刑事訴訟法第503 條第1 項前段，判決如主文。"
  },
  "characters": {
    "judges": [
      "翁慶珍",
      "黃仁松",
      "徐美麗"
    ],
    "prosecutors": [

    ],
    "lawyers": [

    ],
    "clerks": [

    ],
    "plaintiffs": [
      "丁"
    ],
    "defendants": [
      "乙○○"
    ],
    "prosecutor_office": [

    ],
    "creditors": [

    ],
    "debtors": [

    ],
    "judicial_associate_officer": [

    ]
  },
  "adjudged_at": "2010-05-12",
  "created_at": "2016-01-05 12:03:26",
  "updated_at": "2016-01-05 12:03:26"
}