{
  "identify": "KSH-98-聲-1379-20100105-1",
  "court": {
    "name": "臺灣高等法院",
    "code": "KSH"
  },
  "division": {
    "name": "刑事",
    "code": "M"
  },
  "year": 98,
  "word": "聲",
  "number": "1379",
  "jcheck": "1",
  "reason": "聲請具保停止羈押",
  "content": "臺灣高等法院高雄分院刑事裁定          98年度聲字第1379號\n聲  請  人\n即  被  告  甲○○\n上列被告因強盜等案件，聲請具保停止羈押，本院裁定如下：\n    主  文\n聲請駁回。\n    理  由\n一、本件聲請意旨略以：被告自一審羈押起迄今已有六個多月之\n    久，本案細節除部分不實外，其餘被告均已詳細說明，一審\n    已判決，被告之人身自由，是否應予兼顧而准予保釋，且被\n    告也有正當職業和固定住所，也無任何逃亡之證據，由於被\n    告幼子從小就做氣切手術，身心狀況不佳，須常跑醫院就診\n    ，並領有中度多重障礙手冊，且家中還有一年邁母親，本來\n    家中一切重擔、經濟來源，全在被告之肩上，被告羈押至今\n    ，家庭頓失依靠，生活全無著落，羈押六個月期間，被告身\n    心深受打擊，也有好好反省思過，被告已與被害人達成和解\n    ，可見被告有悔悟之心，被告願以相當之金額為具保之保障\n    ，願意限制住居，且可以定時向警察機關報到，請求准予具\n    保停上羈押等語。\n二、按被告經法官訊問後，認為犯罪嫌疑重大，有逃亡或有事實\n    足認為有逃亡之虞者，所犯為死刑、無期徒刑或最輕本刑5\n    年以上有期徒刑上之罪，非予羈押，顯難進行追訴、審判或\n    執行者，得羈押之，刑事訴訟法第101 條第1 項第1 款、第\n    3 款定有明文。次按法院為羈押之裁定時，其本質上係使刑\n    事訴訟程序得以順利進行，或為保全證據或為擔保嗣後刑之\n    執行，而對被告所實施剝奪其人身自由之強制處分，法院僅\n    須審查被告犯罪嫌疑是否重大、與有無賴此保全偵審或執行\n    之必要，關於羈押原因之判斷，尚不適用訴訟法上之嚴格證\n    明原則。且被告有無刑事訴訟法第101 條第1 項各款規定之\n    情形，應否羈押及羈押後其原因是否仍然存在，有無繼續羈\n    押之必要，俱屬事實問題，法院有依法認定裁量之職權。\n三、經查，本件被告甲○○因強盜等案件，已經原審以犯結夥攜\n    帶兇器強盜罪，判處有期徒刑7 年6 月在案，被告不服提起\n    上訴，前經本院訊問後，認為所涉犯刑法第330 條第1 項之\n    結夥3 人攜帶兇器強盜罪，罪嫌重大，有刑事訴訟法第101\n    條第1 項第1 、3 款之情形，非予羈押，顯難進行審判或執\n    行，而自98年12月1 日起執行羈押。被告所涉犯加重強盜罪\n    名，係最輕本刑七年以上有期徒刑之罪，核符刑事訴訟法第\n    101 條第1 項第3 款最輕本刑5 年以上有期徒刑上之罪之羈\n    押要件，又被告否認犯本件加重強盜罪，且經原審判處7 年\n    6 月之徒刑，有逃亡之虞，本院綜合上開各情，揆諸首揭羈\n    押要件之說明，認本件羈押原因尚未消滅，聲請人以上揭個\n    人或家人身心健康問題或家庭經濟等事由，聲請具保停止羈\n    押，自難准許，應予駁回，特此裁定。\n中    華    民    國    99    年    1     月    5     日\n                刑事第五庭    審判長法  官  曾永宗\n                                    法  官  任森銓\n                                    法  官  鍾宗霖\n以上正本證明與原本無異。\n如不服本裁定應於送達後5日內向本院提出抗告狀。\n中    華    民    國    99    年    1     月    5     日\n                                    書記官  黎  珍",
  "structure": {
    "main": "聲請駁回。",
    "reason": "一、本件聲請意旨略以：被告自一審羈押起迄今已有六個多月之\n    久，本案細節除部分不實外，其餘被告均已詳細說明，一審\n    已判決，被告之人身自由，是否應予兼顧而准予保釋，且被\n    告也有正當職業和固定住所，也無任何逃亡之證據，由於被\n    告幼子從小就做氣切手術，身心狀況不佳，須常跑醫院就診\n    ，並領有中度多重障礙手冊，且家中還有一年邁母親，本來\n    家中一切重擔、經濟來源，全在被告之肩上，被告羈押至今\n    ，家庭頓失依靠，生活全無著落，羈押六個月期間，被告身\n    心深受打擊，也有好好反省思過，被告已與被害人達成和解\n    ，可見被告有悔悟之心，被告願以相當之金額為具保之保障\n    ，願意限制住居，且可以定時向警察機關報到，請求准予具\n    保停上羈押等語。\n二、按被告經法官訊問後，認為犯罪嫌疑重大，有逃亡或有事實\n    足認為有逃亡之虞者，所犯為死刑、無期徒刑或最輕本刑5\n    年以上有期徒刑上之罪，非予羈押，顯難進行追訴、審判或\n    執行者，得羈押之，刑事訴訟法第101 條第1 項第1 款、第\n    3 款定有明文。次按法院為羈押之裁定時，其本質上係使刑\n    事訴訟程序得以順利進行，或為保全證據或為擔保嗣後刑之\n    執行，而對被告所實施剝奪其人身自由之強制處分，法院僅\n    須審查被告犯罪嫌疑是否重大、與有無賴此保全偵審或執行\n    之必要，關於羈押原因之判斷，尚不適用訴訟法上之嚴格證\n    明原則。且被告有無刑事訴訟法第101 條第1 項各款規定之\n    情形，應否羈押及羈押後其原因是否仍然存在，有無繼續羈\n    押之必要，俱屬事實問題，法院有依法認定裁量之職權。\n三、經查，本件被告甲○○因強盜等案件，已經原審以犯結夥攜\n    帶兇器強盜罪，判處有期徒刑7 年6 月在案，被告不服提起\n    上訴，前經本院訊問後，認為所涉犯刑法第330 條第1 項之\n    結夥3 人攜帶兇器強盜罪，罪嫌重大，有刑事訴訟法第101\n    條第1 項第1 、3 款之情形，非予羈押，顯難進行審判或執\n    行，而自98年12月1 日起執行羈押。被告所涉犯加重強盜罪\n    名，係最輕本刑七年以上有期徒刑之罪，核符刑事訴訟法第\n    101 條第1 項第3 款最輕本刑5 年以上有期徒刑上之罪之羈\n    押要件，又被告否認犯本件加重強盜罪，且經原審判處7 年\n    6 月之徒刑，有逃亡之虞，本院綜合上開各情，揆諸首揭羈\n    押要件之說明，認本件羈押原因尚未消滅，聲請人以上揭個\n    人或家人身心健康問題或家庭經濟等事由，聲請具保停止羈\n    押，自難准許，應予駁回，特此裁定。"
  },
  "characters": {
    "judges": [
      "曾永宗",
      "任森銓",
      "鍾宗霖"
    ],
    "prosecutors": [

    ],
    "lawyers": [

    ],
    "clerks": [

    ],
    "plaintiffs": [

    ],
    "defendants": [
      "甲"
    ],
    "prosecutor_office": [

    ],
    "creditors": [

    ],
    "debtors": [

    ],
    "judicial_associate_officer": [

    ]
  },
  "adjudged_at": "2010-01-05",
  "created_at": "2016-01-05 15:10:51",
  "updated_at": "2016-01-05 15:10:51"
}