{
  "identify": "KSH-98-上訴-1883-20100104-1",
  "court": {
    "name": "臺灣高等法院",
    "code": "KSH"
  },
  "division": {
    "name": "刑事",
    "code": "M"
  },
  "year": 98,
  "word": "上訴",
  "number": "1883",
  "jcheck": "1",
  "reason": "違反毒品危害防制條例",
  "content": "臺灣高等法院高雄分院刑事判決        98年度上訴字第1883號\n上  訴  人\n即  被  告  甲○○\n上列上訴人因違反毒品危害防制條例案件，不服臺灣屏東地方法\n院98年度訴字第919 號中華民國98年10月16日第一審判決（起訴\n案號：臺灣屏東地方法院檢察署98年度毒偵字第1066號），提起\n上訴，本院判決如下：\n     主  文\n上訴駁回。\n     理  由\n一、按不服地方法院之第一審判決而上訴者，應向管轄第二審之\n    高等法院為之，且上訴書狀應敘述具體理由。第二審法院認\n    為上訴書狀未敘述理由或上訴有刑事訴訟法第362 條前段之\n    情形者，應以判決駁回之，刑事訴訟法第361 條第1 項、第\n    367 條前段定有明文。所謂不服第一審判決之具體理由，必\n    係依卷內既有訴訟資料或提出新事證，指摘或表明第一審判\n    決有何採證認事、用法或量刑等足以影響判決本旨之不當或\n    違法，而構成應予撤銷之具體事由，始足當之；倘僅泛言原\n    判決認定事實錯誤、違背法令、量刑失之過重或輕縱，而未\n    指出具體事由，或形式上雖已指出具體事由，然該事由縱使\n    屬實，亦不足以認為原判決有何不當或違法者，皆難謂係具\n    體事由，俾與第二審上訴制度在請求第二審法院撤銷、變更\n    第一審不當或違法之判決，以實現個案救濟及節制濫行上訴\n    之立法目的相契合。是倘上訴人之上訴書狀雖述上訴理由\n    ，惟並未具體述第一審判決有何不當或違法情形，即與未\n    述具體理由無異，所為上訴，即非適法。\n二、本件上訴人即被告甲○○不服原判決，上訴理由略以：被告\n    在未被警方查獲之前，即自動向行政院衛生署指定之醫療機\n    構請求治療，而接受在屏安醫院附設美沙冬替代療法戒毒，\n    現仍持續治療中，檢察官未依毒品危害防制條例第21條第2\n    項規定予以不起訴處分，卻逕予起訴，顯有違誤，為此請求\n    撤銷原判決云云。\n三、查本件係屏東縣警察局於98年5 月8 日偵辦謝士雲案時，經\n    被告同意採其尿液，確呈嗎啡陽性反應，而查獲被告有於是\n    日上午10時許，在其住處，有以注射方式施用第一級毒品海\n    洛因之犯行，其於原審審理時亦坦承有施用海洛因之事實，\n    原審依憑其自白及台灣檢驗科技股份有限公司濫用藥物檢驗\n    報告等證據資料調查之結果，認定其犯行，所為證據之取捨\n    及判斷，核無不合。上訴意旨僅以其於本件被查獲前，即至\n    屏安醫院接受美沙冬治療，檢察官未予不起訴處分，即逕予\n    起訴，顯有未當，為唯一理由，而於原判決究竟如何違背法\n    令，並無一語涉及；況被告縱有接受美沙冬治療，然其係於\n    治療中再犯施用第一級毒品罪，並非於施用毒品後，未被發\n    覺前，即自動接受治療，而於治療中始經查獲，治療前施用\n    毒品之犯行，即無毒品危害防制條例第21條第2 項檢察官應\n    為不起訴處分規定之適用，揆諸首揭說明，難謂係具體理由\n    ，其上訴自屬違背法律上之程式，應予駁回，並不經言詞辯\n    論為之。\n四、據上論斷，應依刑事訴訟法第367 條前段、第372 條，判決\n    如主文。\n中    華    民    國    99    年    1     月    4     日\n                  刑事第四庭    審判長法  官  蕭權閔\n                                      法  官  林水城\n                                      法  官  陳吉雄\n以上正本證明與原本無異。\n如不服本判決應於收受本判決後10日內向本院提出上訴書狀，其\n未敘述上訴理由者，並得於提起上訴後10日內向本院補提理由書\n狀（均須按他造當事人之人數附繕本）「切勿逕送上級法院」。\n中    華    民    國    99    年    1     月    6     日\n                                      書記官  郭蘭蕙",
  "structure": {
    "main": "上訴駁回。",
    "reason": "一、按不服地方法院之第一審判決而上訴者，應向管轄第二審之\n    高等法院為之，且上訴書狀應敘述具體理由。第二審法院認\n    為上訴書狀未敘述理由或上訴有刑事訴訟法第362 條前段之\n    情形者，應以判決駁回之，刑事訴訟法第361 條第1 項、第\n    367 條前段定有明文。所謂不服第一審判決之具體理由，必\n    係依卷內既有訴訟資料或提出新事證，指摘或表明第一審判\n    決有何採證認事、用法或量刑等足以影響判決本旨之不當或\n    違法，而構成應予撤銷之具體事由，始足當之；倘僅泛言原\n    判決認定事實錯誤、違背法令、量刑失之過重或輕縱，而未\n    指出具體事由，或形式上雖已指出具體事由，然該事由縱使\n    屬實，亦不足以認為原判決有何不當或違法者，皆難謂係具\n    體事由，俾與第二審上訴制度在請求第二審法院撤銷、變更\n    第一審不當或違法之判決，以實現個案救濟及節制濫行上訴\n    之立法目的相契合。是倘上訴人之上訴書狀雖述上訴理由\n    ，惟並未具體述第一審判決有何不當或違法情形，即與未\n    述具體理由無異，所為上訴，即非適法。\n二、本件上訴人即被告甲○○不服原判決，上訴理由略以：被告\n    在未被警方查獲之前，即自動向行政院衛生署指定之醫療機\n    構請求治療，而接受在屏安醫院附設美沙冬替代療法戒毒，\n    現仍持續治療中，檢察官未依毒品危害防制條例第21條第2\n    項規定予以不起訴處分，卻逕予起訴，顯有違誤，為此請求\n    撤銷原判決云云。\n三、查本件係屏東縣警察局於98年5 月8 日偵辦謝士雲案時，經\n    被告同意採其尿液，確呈嗎啡陽性反應，而查獲被告有於是\n    日上午10時許，在其住處，有以注射方式施用第一級毒品海\n    洛因之犯行，其於原審審理時亦坦承有施用海洛因之事實，\n    原審依憑其自白及台灣檢驗科技股份有限公司濫用藥物檢驗\n    報告等證據資料調查之結果，認定其犯行，所為證據之取捨\n    及判斷，核無不合。上訴意旨僅以其於本件被查獲前，即至\n    屏安醫院接受美沙冬治療，檢察官未予不起訴處分，即逕予\n    起訴，顯有未當，為唯一理由，而於原判決究竟如何違背法\n    令，並無一語涉及；況被告縱有接受美沙冬治療，然其係於\n    治療中再犯施用第一級毒品罪，並非於施用毒品後，未被發\n    覺前，即自動接受治療，而於治療中始經查獲，治療前施用\n    毒品之犯行，即無毒品危害防制條例第21條第2 項檢察官應\n    為不起訴處分規定之適用，揆諸首揭說明，難謂係具體理由\n    ，其上訴自屬違背法律上之程式，應予駁回，並不經言詞辯\n    論為之。\n四、據上論斷，應依刑事訴訟法第367 條前段、第372 條，判決\n    如主文。"
  },
  "characters": {
    "judges": [
      "蕭權閔",
      "林水城",
      "陳吉雄"
    ],
    "prosecutors": [

    ],
    "lawyers": [

    ],
    "clerks": [

    ],
    "plaintiffs": [

    ],
    "defendants": [
      "甲"
    ],
    "prosecutor_office": [

    ],
    "creditors": [

    ],
    "debtors": [

    ],
    "judicial_associate_officer": [

    ]
  },
  "adjudged_at": "2010-01-04",
  "created_at": "2016-01-05 14:40:02",
  "updated_at": "2016-01-05 14:40:02"
}