{
  "identify": "KSH-98-抗-329-20100104-1",
  "court": {
    "name": "臺灣高等法院",
    "code": "KSH"
  },
  "division": {
    "name": "民事",
    "code": "V"
  },
  "year": 98,
  "word": "抗",
  "number": "329",
  "jcheck": "1",
  "reason": "停止執行",
  "content": "臺灣高等法院高雄分院民事裁定           98年度抗字第329號\n抗  告  人  甲○○\n相  對  人  乙○○\n上列抗告人與相對人乙○○間因聲請停止執行事件，對於中華民\n國98年10月26日臺灣高雄地方法院98年度審聲字第326 號所為裁\n定，提起抗告，本院裁定如下\n    主  文\n抗告駁回。\n抗告程序費用由抗告人負擔。\n    理  由\n一、抗告意旨略以：相對人非原法院96年執字第121102號強制執\n    行事件所拍賣清水段627 地號毗連耕地之現耕所有權人之事\n    實，業經高雄縣政府、美濃地政事務所更正在案，相對人確\n    無優先承買權。若執行處發給相對人權利移轉證書，抗告人\n    優先承買之權利將無從實現，勢難回復原狀，抗告人已提起\n    確認優先承買權存在訴訟，俟終局判決確定後再決定是否繼\n    續強制執行之程序。若有繼續強制執行程序將遭受難以回復\n    之事由時，應准予類推適用強制執行法第18條第2 項之規定\n    ，得為裁定准許停止執行為宜。為此，求予廢棄原裁定並准\n    予停止執行等語。\n二、按有回復原狀之聲請，或提起再審或異議之訴，或對於和解\n    為繼續審判之請求，或提起宣告調解無效之訴，撤銷調解之\n    訴，或對於許可強制執行之裁定提起抗告時，法院因必要情\n    形或依聲請定相當並確實擔保，得為停止強制執行之裁定，\n    強制執行法第18條第2 項定有明文。是以，強制執行程序開\n    始後，除法律另有規定外，不停止執行，為強制執行法第18\n    條第1 項所明定，則除有同法條第2 項所規定之情形或其他\n    法定情形下，執行法院並無停止執行之權限。（最高法院90\n    年度台上字第676 號裁判意旨參照）\n三、抗告人以其業經向原法院提起確認優先承買權存在訴訟為理\n    由，聲請先予裁定停止原法院96年度執字第121102號請求清\n    償借款強制執行事件之強制執行。惟抗告人於98年度審訴字\n    第2404號請求確認優先承買權存在事件所為應受判決事項之\n    聲明為：確認伊對於訴外人即執行債務人邱玉峰所有坐落高\n    雄縣美濃鎮○○段627 地號土地有優先承買權存在，此業經\n    原法院調卷查明無誤。則依抗告人所提起之確認訴訟，核與\n    首揭強制執行法第18條第2 項所規定得聲請停止執行之情形\n    不符，並非停止執行之法定事由。又按類推適用，係就法律\n    未規定之事項，比附援引與其性質相類似之規定，加以適用\n    ，為基於平等原則及社會通念以填補法律漏洞的方法，倘無\n    法律漏洞，自不生類推適用而補充之問題。而所謂法律漏洞\n    ，乃指違反法律規範計劃、意旨的不完整性。法律所未規定\n    者，並非當然構成法律漏洞，端視其是否違反法律規範意旨\n    、計劃及立法者之是否有意沉默而定。而停止執行事由既有\n    強制執行法第18條明文規定，自非屬法律未規定之事項，本\n    件經核無類推適用之餘地。抗告論旨稱可類推適用強制執行\n    法第18條第2 項規定，指摘原裁定未予類推適用為不當，求\n    予廢棄，不應准許。\n據上論結，本件抗告為無理由，依強制執行法第30條之1 、民事\n訴訟法第495 條之1 、第449 條第1 項、第95條、第78條，裁定\n如主文。\n中    華    民    國    99    年    1     月    4     日\n                            民事第六庭\n                                審判長法官  許明進\n                                法      官  徐文祥\n                                法      官  張明振\n以上正本證明與原本無異。\n如不服本裁定應於送達後10日內向本院提出再抗告狀（並按他造\n當事人之人數附繕本），並繳納再抗告費新臺幣1,000 元。\n再為抗告僅得以適用法規顯有錯誤為理由，並應委任律師為代理\n人。\n中    華    民    國    99    年    1     月    6     日\n                                  書  記  官  熊惠津\n附註：\n抗告人之配偶、三親等內之血親、二親等內之姻親，或抗告人為\n法人、中央或地方機關時，其所屬專任人員具有律師資格並經法\n院認適當者，亦得為第三審訴訟代理人。\n抗告人或其法定代理人具有律師資格者及前項情形，應於提起抗\n告或委任時釋明之。",
  "structure": {
    "main": "抗告駁回。\n抗告程序費用由抗告人負擔。",
    "reason": "一、抗告意旨略以：相對人非原法院96年執字第121102號強制執\n    行事件所拍賣清水段627 地號毗連耕地之現耕所有權人之事\n    實，業經高雄縣政府、美濃地政事務所更正在案，相對人確\n    無優先承買權。若執行處發給相對人權利移轉證書，抗告人\n    優先承買之權利將無從實現，勢難回復原狀，抗告人已提起\n    確認優先承買權存在訴訟，俟終局判決確定後再決定是否繼\n    續強制執行之程序。若有繼續強制執行程序將遭受難以回復\n    之事由時，應准予類推適用強制執行法第18條第2 項之規定\n    ，得為裁定准許停止執行為宜。為此，求予廢棄原裁定並准\n    予停止執行等語。\n二、按有回復原狀之聲請，或提起再審或異議之訴，或對於和解\n    為繼續審判之請求，或提起宣告調解無效之訴，撤銷調解之\n    訴，或對於許可強制執行之裁定提起抗告時，法院因必要情\n    形或依聲請定相當並確實擔保，得為停止強制執行之裁定，\n    強制執行法第18條第2 項定有明文。是以，強制執行程序開\n    始後，除法律另有規定外，不停止執行，為強制執行法第18\n    條第1 項所明定，則除有同法條第2 項所規定之情形或其他\n    法定情形下，執行法院並無停止執行之權限。（最高法院90\n    年度台上字第676 號裁判意旨參照）\n三、抗告人以其業經向原法院提起確認優先承買權存在訴訟為理\n    由，聲請先予裁定停止原法院96年度執字第121102號請求清\n    償借款強制執行事件之強制執行。惟抗告人於98年度審訴字\n    第2404號請求確認優先承買權存在事件所為應受判決事項之\n    聲明為：確認伊對於訴外人即執行債務人邱玉峰所有坐落高\n    雄縣美濃鎮○○段627 地號土地有優先承買權存在，此業經\n    原法院調卷查明無誤。則依抗告人所提起之確認訴訟，核與\n    首揭強制執行法第18條第2 項所規定得聲請停止執行之情形\n    不符，並非停止執行之法定事由。又按類推適用，係就法律\n    未規定之事項，比附援引與其性質相類似之規定，加以適用\n    ，為基於平等原則及社會通念以填補法律漏洞的方法，倘無\n    法律漏洞，自不生類推適用而補充之問題。而所謂法律漏洞\n    ，乃指違反法律規範計劃、意旨的不完整性。法律所未規定\n    者，並非當然構成法律漏洞，端視其是否違反法律規範意旨\n    、計劃及立法者之是否有意沉默而定。而停止執行事由既有\n    強制執行法第18條明文規定，自非屬法律未規定之事項，本\n    件經核無類推適用之餘地。抗告論旨稱可類推適用強制執行\n    法第18條第2 項規定，指摘原裁定未予類推適用為不當，求\n    予廢棄，不應准許。\n據上論結，本件抗告為無理由，依強制執行法第30條之1 、民事\n訴訟法第495 條之1 、第449 條第1 項、第95條、第78條，裁定\n如主文。"
  },
  "characters": {
    "judges": [
      "徐文祥",
      "張明振"
    ],
    "prosecutors": [

    ],
    "lawyers": [
      "抗告人或其法定代理人具有"
    ],
    "clerks": [

    ],
    "plaintiffs": [

    ],
    "defendants": [

    ],
    "prosecutor_office": [

    ],
    "creditors": [

    ],
    "debtors": [

    ],
    "judicial_associate_officer": [

    ]
  },
  "adjudged_at": "2010-01-04",
  "created_at": "2016-01-05 14:40:36",
  "updated_at": "2016-01-05 14:40:36"
}