{
  "identify": "KSH-99-交抗-132-20100512-1",
  "court": {
    "name": "臺灣高等法院",
    "code": "KSH"
  },
  "division": {
    "name": "刑事",
    "code": "M"
  },
  "year": 99,
  "word": "交抗",
  "number": "132",
  "jcheck": "1",
  "reason": "聲明異議",
  "content": "臺灣高等法院高雄分院刑事裁定         99年度交抗字第132號\n抗告人即\n受處分人    甲○○\n上列抗告人因交通違規聲明異議案件，不服臺灣高雄地方法院中\n華民國99年3 月19日裁定（99年度交聲字第764 號），提起抗告\n，本院裁定如下：\n    主  文\n抗告駁回。\n    理  由\n一、抗告意旨略以：抗告人之姓名為「甲○○」，惟交通違規之\n    罰單通知書及裁決書，將抗告人之名字誤載為「李澧育」，\n    顯有行政疏失，其違法在先，如何能適用法律來處罰抗告人\n    ，為此提起抗告等語。\n二、經查：抗告人甲○○於民國93年7 月8 日14時48分，在鳳山\n    市○○路無照駕駛機車，其交通違規之罰單通知書及裁決書\n    ，雖將抗告人甲○○之名字誤載為「李澧育」，惟由機車車\n    號、身分證字號及戶籍地址，均可特定受處分人為抗告人甲\n    ○○無誤，且「甲○○」之「灃」字，與「李澧育」之「澧\n    」字，一般均認為可通用，「澧」字為較簡便之寫法，已可\n    確定為同一人，故原行政處分之效力並不生影響，本件抗告\n    並無理由，應予駁回。\n三、據上論結，應依刑事訴訟法第412 條，裁定如主文。\n中    華    民    國    99    年    5     月    12    日\n                  刑事第八庭    審判長法  官  洪兆隆\n                                      法  官  郭玫利\n                                      法  官  張盛喜\n以上正本證明與原本無異。\n不得再抗告。\n中    華    民    國    99    年    5     月    12    日\n                                      書記官  黃一秋",
  "structure": {
    "main": "抗告駁回。",
    "reason": "一、抗告意旨略以：抗告人之姓名為「甲○○」，惟交通違規之\n    罰單通知書及裁決書，將抗告人之名字誤載為「李澧育」，\n    顯有行政疏失，其違法在先，如何能適用法律來處罰抗告人\n    ，為此提起抗告等語。\n二、經查：抗告人甲○○於民國93年7 月8 日14時48分，在鳳山\n    市○○路無照駕駛機車，其交通違規之罰單通知書及裁決書\n    ，雖將抗告人甲○○之名字誤載為「李澧育」，惟由機車車\n    號、身分證字號及戶籍地址，均可特定受處分人為抗告人甲\n    ○○無誤，且「甲○○」之「灃」字，與「李澧育」之「澧\n    」字，一般均認為可通用，「澧」字為較簡便之寫法，已可\n    確定為同一人，故原行政處分之效力並不生影響，本件抗告\n    並無理由，應予駁回。\n三、據上論結，應依刑事訴訟法第412 條，裁定如主文。"
  },
  "characters": {
    "judges": [
      "洪兆隆",
      "郭玫利",
      "張盛喜"
    ],
    "prosecutors": [

    ],
    "lawyers": [

    ],
    "clerks": [

    ],
    "plaintiffs": [

    ],
    "defendants": [

    ],
    "prosecutor_office": [

    ],
    "creditors": [

    ],
    "debtors": [

    ],
    "judicial_associate_officer": [

    ]
  },
  "adjudged_at": "2010-05-12",
  "created_at": "2016-01-05 12:02:28",
  "updated_at": "2016-01-05 12:02:28"
}