{
  "identify": "KSH-98-上訴-1469-20100104-1",
  "court": {
    "name": "臺灣高等法院",
    "code": "KSH"
  },
  "division": {
    "name": "刑事",
    "code": "M"
  },
  "year": 98,
  "word": "上訴",
  "number": "1469",
  "jcheck": "1",
  "reason": "毒品危害防制條例等",
  "content": "臺灣高等法院高雄分院刑事裁定        98年度上訴字第1469號\n上  訴  人\n即  被  告  甲○○\n選任辯護人  洪條根律師\n上列被告因毒品危害防制條例等等上訴案件，本院裁定如下：\n    主  文\n甲○○羈押期間自民國玖拾玖年壹月拾玖日起延長貳月。\n    理  由\n一、上訴人即被告甲○○（下稱被告）前經本院認為犯未經許可\n    寄藏手槍罪，嫌疑重大，有刑事訴訟法第101 條第1 項第1\n    、3 款情形，非予羈押，顯難進行審判或執行，於民國98年\n    10 月19 日執行羈押，至99年1 月18日第一次羈押期間即將\n    屆滿。\n二、茲被告已經原審判決未經許可寄藏手槍，處有期徒刑11年，\n    且被告遭查獲持有第一級毒品海洛因純質淨重425.26公克、\n    第二級毒品甲基安非他命驗後總淨重916.21公克，數量非少\n    ，被告被訴販賣第一、二級毒品及未經許可寄藏手槍罪，嫌\n    疑自屬重大；再被告前於84年間，因盜匪案件經判刑2 年6\n    月確定及撤銷保護管束應執行殘刑6 年4 月經通知到案執行\n    未果，嗣於85年2 月14日始經通緝到案，有被告前案紀錄表\n    在卷足憑，足認被告有事實足認有逃亡之虞。是本院以前項\n    原因依然存在，認有繼續羈押之必要，應自99年1 月19日起\n    延長羈押2 月，爰依刑事訴訟法第108 條第1 項、第5 項，\n    裁定如主文。\n中    華    民    國    99    年    1     月    4     日\n                  刑事第八庭    審判長法  官   洪兆隆\n                                      法  官   張盛喜\n                                      法  官   郭玫利\n以上正本證明與原本無異。\n如不服本裁定應於送達後5 日內向本院提出抗告狀。\n中    華    民    國    99    年    1     月    4     日\n                                      書記官   楊茱宜",
  "structure": {
    "main": "甲○○羈押期間自民國玖拾玖年壹月拾玖日起延長貳月。",
    "reason": "一、上訴人即被告甲○○（下稱被告）前經本院認為犯未經許可\n    寄藏手槍罪，嫌疑重大，有刑事訴訟法第101 條第1 項第1\n    、3 款情形，非予羈押，顯難進行審判或執行，於民國98年\n    10 月19 日執行羈押，至99年1 月18日第一次羈押期間即將\n    屆滿。\n二、茲被告已經原審判決未經許可寄藏手槍，處有期徒刑11年，\n    且被告遭查獲持有第一級毒品海洛因純質淨重425.26公克、\n    第二級毒品甲基安非他命驗後總淨重916.21公克，數量非少\n    ，被告被訴販賣第一、二級毒品及未經許可寄藏手槍罪，嫌\n    疑自屬重大；再被告前於84年間，因盜匪案件經判刑2 年6\n    月確定及撤銷保護管束應執行殘刑6 年4 月經通知到案執行\n    未果，嗣於85年2 月14日始經通緝到案，有被告前案紀錄表\n    在卷足憑，足認被告有事實足認有逃亡之虞。是本院以前項\n    原因依然存在，認有繼續羈押之必要，應自99年1 月19日起\n    延長羈押2 月，爰依刑事訴訟法第108 條第1 項、第5 項，\n    裁定如主文。"
  },
  "characters": {
    "judges": [
      "洪兆隆",
      "張盛喜",
      "郭玫利"
    ],
    "prosecutors": [

    ],
    "lawyers": [
      "洪條根"
    ],
    "clerks": [

    ],
    "plaintiffs": [

    ],
    "defendants": [
      "甲"
    ],
    "prosecutor_office": [

    ],
    "creditors": [

    ],
    "debtors": [

    ],
    "judicial_associate_officer": [

    ]
  },
  "adjudged_at": "2010-01-04",
  "created_at": "2016-01-05 14:39:19",
  "updated_at": "2016-01-05 14:39:19"
}