{
  "identify": "KSH-98-上訴-1903-20100104-1",
  "court": {
    "name": "臺灣高等法院",
    "code": "KSH"
  },
  "division": {
    "name": "刑事",
    "code": "M"
  },
  "year": 98,
  "word": "上訴",
  "number": "1903",
  "jcheck": "1",
  "reason": "違反毒品危害防制條例",
  "content": "臺灣高等法院高雄分院刑事判決        98年度上訴字第1903號\n上  訴  人\n即  被  告  甲○○\n上列上訴人因違反毒品危害防制條例案件，不服臺灣高雄地方法\n院98年度審訴字第4046號中華民國98年11月25日第一審判決（起\n訴案號：臺灣高雄地方法院檢察署98年度毒偵字第5467號），提\n起上訴，本院判決如下：\n     主  文\n上訴駁回。\n     理  由\n按不服地方法院之第一審判決而上訴者，應向管轄第二審之高等\n法院為之。上訴書狀應敘述具體理由。第二審法院認為上訴書狀\n未敘述理由，應以判決駁回之，刑事訴訟法第361 條第1 項、第\n2 項、第367 條前段定有明文。本件上訴人即被告經原審論以毒\n品危害防制條例第10條第1 項之施用第一級毒品罪，判處有期徒\n刑9 月後，於民國98年12月11日具狀提起上訴，上訴理由狀指摘\n：上訴人之驗尿報告，雖呈嗎啡陽性反應，然上訴人每天需至醫\n院喝美沙冬藥物，該藥物影響檢驗結果，此由上訴人之尿液檢驗\n結果只超過正值300 ，多一點點，即可證明原審之誤差云云，有\n上訴狀在卷可按。經查，本件施用第一級毒品案件，業據上訴人\n於原審法院審理中認罪在卷，上訴意旨空言否認犯行，並非依據\n卷內訴訟資料提出新證據或指摘、表明原判決有何足以影響判決\n本旨之不當或違法，而構成應予撤銷之具體事由，與刑事訴訟法\n第361 條第2 項所稱「具體理由」尚非相當。按之上開規定，上\n訴人之上訴顯屬違背法律上之程式，應由本院依同法第367 條前\n段、第372 條規定，不經言詞辯論逕行判決如主文。\n中    華    民    國    99    年    1     月    4     日\n                  刑事第九庭    審判長法  官  莊秋桃\n                                      法  官  田平安\n                                      法  官  范惠瑩\n以上正本證明與原本無異。\n如不服本判決應於收受本判決後10日內向本院提出上訴書狀，其\n未敘述上訴理由者，並得於提起上訴後10日內向本院補提理由書\n狀（均須按他造當事人之人數附繕本）「切勿逕送上級法院」。\n中    華    民    國    99    年    1     月    4     日\n                                      書記官  戴育婷",
  "structure": {
    "main": "上訴駁回。",
    "reason": "按不服地方法院之第一審判決而上訴者，應向管轄第二審之高等\n法院為之。上訴書狀應敘述具體理由。第二審法院認為上訴書狀\n未敘述理由，應以判決駁回之，刑事訴訟法第361 條第1 項、第\n2 項、第367 條前段定有明文。本件上訴人即被告經原審論以毒\n品危害防制條例第10條第1 項之施用第一級毒品罪，判處有期徒\n刑9 月後，於民國98年12月11日具狀提起上訴，上訴理由狀指摘\n：上訴人之驗尿報告，雖呈嗎啡陽性反應，然上訴人每天需至醫\n院喝美沙冬藥物，該藥物影響檢驗結果，此由上訴人之尿液檢驗\n結果只超過正值300 ，多一點點，即可證明原審之誤差云云，有\n上訴狀在卷可按。經查，本件施用第一級毒品案件，業據上訴人\n於原審法院審理中認罪在卷，上訴意旨空言否認犯行，並非依據\n卷內訴訟資料提出新證據或指摘、表明原判決有何足以影響判決\n本旨之不當或違法，而構成應予撤銷之具體事由，與刑事訴訟法\n第361 條第2 項所稱「具體理由」尚非相當。按之上開規定，上\n訴人之上訴顯屬違背法律上之程式，應由本院依同法第367 條前\n段、第372 條規定，不經言詞辯論逕行判決如主文。"
  },
  "characters": {
    "judges": [
      "莊秋桃",
      "田平安",
      "范惠瑩"
    ],
    "prosecutors": [

    ],
    "lawyers": [

    ],
    "clerks": [

    ],
    "plaintiffs": [

    ],
    "defendants": [
      "甲"
    ],
    "prosecutor_office": [

    ],
    "creditors": [

    ],
    "debtors": [

    ],
    "judicial_associate_officer": [

    ]
  },
  "adjudged_at": "2010-01-04",
  "created_at": "2016-01-05 14:39:54",
  "updated_at": "2016-01-05 14:39:54"
}