{
  "identify": "KSH-99-抗-106-20100512-1",
  "court": {
    "name": "臺灣高等法院",
    "code": "KSH"
  },
  "division": {
    "name": "刑事",
    "code": "M"
  },
  "year": 99,
  "word": "抗",
  "number": "106",
  "jcheck": "1",
  "reason": "聲請定其應執行刑",
  "content": "臺灣高等法院高雄分院刑事裁定           99年度抗字第106號\n 抗告人\n即受刑人    甲○○\n上列抗告人因數罪併罰聲請定其應執行刑案件，不服臺灣屏東地\n方法院中華民國99年3 月30日裁定（99年度聲字第333 號），提\n起抗告，本院裁定如下：\n    主  文\n抗告駁回。\n    理  由\n一、抗告意旨略以：抗告人所犯2 罪，一件是判有期徒刑1 年4\n    月，另一件是判1 年4 月減為有期徒刑8 月，2 件定執行刑\n    後，應不得高於1 年8 月，原裁定所定之執行刑1 年10月，\n    其裁量過重，請再予酌減2 月，為此提起抗告等語。\n二、經查：宣告多數有期徒刑者，於各刑中之最長期以上，各刑\n    合併之刑期以下，定其刑期，刑法第51條第5 款定有明文。\n    本件抗告人因犯違反廢棄物清理法2 罪，經先後判處有期徒\n    刑1 年4 月及1 年4 月減為有期徒刑8 月，經分別確定在案\n    ，原審定執行刑為1 年10月，因所定之刑期仍在各刑合併之\n    刑期以下，於法並無違背，本件抗告，並無理由，應予駁回\n    。\n三、據上論結，應依刑事訴訟法第412 條，裁定如主文。\n中    華    民    國    99    年    5     月    12    日\n                  刑事第八庭    審判長法  官  洪兆隆\n                                      法  官  郭玫利\n                                      法  官  張盛喜\n以上正本證明與原本無異。\n不得再抗告。\n中    華    民    國    99    年    5     月    12    日\n                                      書記官  黃一秋",
  "structure": {
    "main": "抗告駁回。",
    "reason": "一、抗告意旨略以：抗告人所犯2 罪，一件是判有期徒刑1 年4\n    月，另一件是判1 年4 月減為有期徒刑8 月，2 件定執行刑\n    後，應不得高於1 年8 月，原裁定所定之執行刑1 年10月，\n    其裁量過重，請再予酌減2 月，為此提起抗告等語。\n二、經查：宣告多數有期徒刑者，於各刑中之最長期以上，各刑\n    合併之刑期以下，定其刑期，刑法第51條第5 款定有明文。\n    本件抗告人因犯違反廢棄物清理法2 罪，經先後判處有期徒\n    刑1 年4 月及1 年4 月減為有期徒刑8 月，經分別確定在案\n    ，原審定執行刑為1 年10月，因所定之刑期仍在各刑合併之\n    刑期以下，於法並無違背，本件抗告，並無理由，應予駁回\n    。\n三、據上論結，應依刑事訴訟法第412 條，裁定如主文。"
  },
  "characters": {
    "judges": [
      "洪兆隆",
      "郭玫利",
      "張盛喜"
    ],
    "prosecutors": [

    ],
    "lawyers": [

    ],
    "clerks": [

    ],
    "plaintiffs": [

    ],
    "defendants": [

    ],
    "prosecutor_office": [

    ],
    "creditors": [

    ],
    "debtors": [

    ],
    "judicial_associate_officer": [

    ]
  },
  "adjudged_at": "2010-05-12",
  "created_at": "2016-01-05 12:02:39",
  "updated_at": "2016-01-05 12:02:39"
}