{
  "identify": "KSH-99-交抗-112-20100512-1",
  "court": {
    "name": "臺灣高等法院",
    "code": "KSH"
  },
  "division": {
    "name": "刑事",
    "code": "M"
  },
  "year": 99,
  "word": "交抗",
  "number": "112",
  "jcheck": "1",
  "reason": "聲請再審",
  "content": "臺灣高等法院高雄分院刑事裁定         99年度交抗字第112號\n抗告人即\n受處分人    甲○○\n輔 佐 人    乙○○\n上列抗告人因交通違規聲請再審案件，不服臺灣高雄地方法院中\n華民國99年3 月4 日裁定（99年度聲再字第1 號），提起抗告，\n本院裁定如下：\n    主  文\n抗告駁回。\n    理  由\n一、按刑事再審係以「確定判決」為對象，此觀刑事訴訟法第42\n    0 條、第421 條及第422 條文之規定內容甚明，故聲請再審\n    之客體，限於實體上之確定判決，刑事裁定不論關於程序上\n    或實體上事項，均不得為再審對象；又按法院認為聲請再審\n    之程序違背規定者，應以裁定駁回之，刑事訴訟法第433 條\n    亦定有明文。\n二、經查：本件抗告人甲○○因交通違規，違反道路交通管理處\n    罰條例案件，對台灣高雄地方法院民國（以下同）97年6 月\n    19日97年度交聲字第253 號交通事件裁定、98年11月18日98\n    年度聲再字第74號裁定，及本院98年度抗字第389 號裁定聲\n    請再審，查其聲請再審之對象係「交通事件裁定」及「刑事\n    裁定」，均非確定判決，揆諸前揭說明，對裁定不得聲請再\n    審，是其程序顯屬違背規定，原審駁回其再審之聲請，核無\n    不合，其抗告為無理由，應予駁回。\n三、據上論結，應依刑事訴訟法第412 條，裁定如主文。\n中    華    民    國    99    年    5     月    12    日\n                  刑事第八庭    審判長法  官  洪兆隆\n                                      法  官  郭玫利\n                                      法  官  張盛喜\n以上正本證明與原本無異。\n不得再抗告。\n中    華    民    國    99    年    5     月    12    日\n                                      書記官  黃一秋",
  "structure": {
    "main": "抗告駁回。",
    "reason": "一、按刑事再審係以「確定判決」為對象，此觀刑事訴訟法第42\n    0 條、第421 條及第422 條文之規定內容甚明，故聲請再審\n    之客體，限於實體上之確定判決，刑事裁定不論關於程序上\n    或實體上事項，均不得為再審對象；又按法院認為聲請再審\n    之程序違背規定者，應以裁定駁回之，刑事訴訟法第433 條\n    亦定有明文。\n二、經查：本件抗告人甲○○因交通違規，違反道路交通管理處\n    罰條例案件，對台灣高雄地方法院民國（以下同）97年6 月\n    19日97年度交聲字第253 號交通事件裁定、98年11月18日98\n    年度聲再字第74號裁定，及本院98年度抗字第389 號裁定聲\n    請再審，查其聲請再審之對象係「交通事件裁定」及「刑事\n    裁定」，均非確定判決，揆諸前揭說明，對裁定不得聲請再\n    審，是其程序顯屬違背規定，原審駁回其再審之聲請，核無\n    不合，其抗告為無理由，應予駁回。\n三、據上論結，應依刑事訴訟法第412 條，裁定如主文。"
  },
  "characters": {
    "judges": [
      "洪兆隆",
      "郭玫利",
      "張盛喜"
    ],
    "prosecutors": [

    ],
    "lawyers": [

    ],
    "clerks": [

    ],
    "plaintiffs": [

    ],
    "defendants": [

    ],
    "prosecutor_office": [

    ],
    "creditors": [

    ],
    "debtors": [

    ],
    "judicial_associate_officer": [

    ]
  },
  "adjudged_at": "2010-05-12",
  "created_at": "2016-01-05 12:03:01",
  "updated_at": "2016-01-05 12:03:01"
}