{
  "identify": "KSH-98-抗-393-20100104-1",
  "court": {
    "name": "臺灣高等法院",
    "code": "KSH"
  },
  "division": {
    "name": "刑事",
    "code": "M"
  },
  "year": 98,
  "word": "抗",
  "number": "393",
  "jcheck": "1",
  "reason": "撤銷緩刑",
  "content": "臺灣高等法院高雄分院刑事裁定           98年度抗字第393號\n抗  告  人  臺灣屏東地方法院檢察署檢察官\n受  刑  人  甲○○\n上列抗告人因受刑人撤銷緩刑案件，不服臺灣屏東地方法院中華\n民國98年10月27日裁定（98年度撤緩字第98號），提起抗告，本\n院裁定如下：\n    主  文\n抗告駁回。\n    理  由\n一、本件抗告意旨略以：本件受刑人前因違反臺灣地區與大陸地\n    區人民關係條例等案件，經臺灣屏東地方法院以97年度訴字\n    第1487號判決判處有期徒刑6 月，減為有期徒刑3 月，並諭\n    知緩刑2 年，於98年2 月14日確定。受刑人另於緩刑期內之\n    98年3 月2 日，因違反性騷擾防治法案件，經臺灣屏東地方\n    法院以98年度簡字第1097號判決判處拘役30日，於98年9 月\n    14日確定。茲受刑人先前所受有期徒刑併緩刑2 年宣告後，\n    尚不及一個月，即又於緩刑期間內之98年3 月2 日，故意再\n    犯違反性騷擾防治法案件，堪認受刑人守法觀薄弱且未改過\n    遷善，足認原宣告之緩刑難收預期之效果而有執行刑罰之必\n    要。爰提起抗告請求撤銷原裁定，更為適法之裁定等語。\n二、原裁定意旨略以：本件受刑人甲○○先後所犯違反臺灣地區\n    與大陸地區人民關係條例等案件、違反性騷擾防治法案件，\n    2 案所侵害法益之性質迥異，犯罪原因及社會危害程度亦完\n    全不同；復佐以其所犯違反性騷擾防治法案件中，僅徒手撫\n    摸被害人臀部一把，其行為手段尚非過激。是難認前案違反\n    臺灣地區與大陸地區人民關係條例等案件中原為促使受刑人\n    改過自新而宣告之緩刑，已難以收預期效果，而確有執行刑\n    罰必要。因而駁回檢察官撤銷緩刑宣告之聲請。\n三、按中華民國98年5 月19日刑法修正施行前，受緩刑之宣告，\n    98年5 月19日修正刑法施行後，仍在緩刑期內者，適用98年\n    5 月19日修正施行之刑法第75條及第75條之1 規定，刑法施\n    行法第6 之1 條第2 項定有明文。又刑法第75條、第75條之\n    1 業於民國98年5 月19日經立法院修正通過，於98年6 月10\n    日經總統公布後，並於98年9 月1 日施行。查本件受刑人甲\n    ○○前因違反臺灣地區與大陸地區人民關係條例等案件，經\n    原審法院以97年度訴字第1487號判決判處有期徒刑6 月，減\n    為有期徒刑3 月，緩刑2 年，於98年2 月14日確定，現仍在\n    緩刑期內，依前開規定，本件應適用98年9 月1 日施行之刑\n    法第75條、第75條之1 規定，合先敘明。\n四、依刑法第75條之1 第1 項第2 款之規定，緩刑期內因故意犯\n    他罪，而在緩刑期內受6 月以下有期徒刑、拘役或罰金之宣\n    告確定之情形，足認原宣告之緩刑難收其預期效果，而有執\n    行刑罰之必要，得撤銷其宣告。是故，在緩刑期內，故意犯\n    他罪，而在緩刑期內，受有期徒刑6 月以下、拘役或罰金之\n    宣告確定者，法官應依職權本於合目的性之裁量，妥適審酌\n    被告所犯前後數罪間，關於法益侵害之性質、再犯之原因、\n    違反法規範之情節是否重大、被告主觀犯意所顯現之惡性及\n    其反社會性等情，是否已使前案原為促使惡性輕微之被告或\n    偶發犯、初犯改過自新而宣告之緩刑，已難收其預期之效果\n    ，而確有執行刑罰之必要，此與刑法第75條第1 項所定之2\n    款要件有一具備，即毋庸再行審酌其他情狀，應逕予撤銷緩\n    刑之情形不同。\n五、經查，本件受刑人前因違反臺灣地區與大陸地區人民關係條\n    例等案件，經原審法院以97年度訴字第1487號判決判處有期\n    徒刑6 月，減為有期徒刑3 月，並諭知緩刑2 年，於98年2\n    月14日確定。而受刑人另於緩刑期內之98年3 月2 日，因違\n    反性騷擾防治法案件，經原審法院以98年度簡字第1097號判\n    決判處拘役30日，於98年9 月14日確定等情，固有上開刑事\n    判決及臺灣高等法院被告前案紀錄表在卷可證。惟審酌本件\n    受刑人所犯前開2 案中之各罪，侵害法益之性質迥異，犯罪\n    原因及社會危害程度亦完全不同；復佐以其於緩刑期間所犯\n    違反性騷擾防治法案件，犯罪事實乃受刑人「因病至屏東縣\n    恆南路188 號署立恆春旅遊醫院急診室就醫時，意圖性騷擾\n    ，趁為其護理之護士甲女不注意時，趁機以左手撫摸甲女之\n    左臀部1 把」，衡其犯罪情節應屬偶發，違反法規範之情節\n    尚非重大，由其主觀犯意所顯現之惡性及其反社會性之內涵\n    ，難認前案違反臺灣地區與大陸地區人民關係條例等案件中\n    原為促使受刑人改過遷善自新向上而宣告之緩刑，已難以收\n    預期效果，而確有執行刑罰必要。自不能僅因其在緩刑期內\n    犯違反性騷擾防治法案件，經法院判處拘役刑確定，即遽認\n    前案所諭知之緩刑，應予撤銷。此外，依聲請人檢具之卷證\n    資料，亦無其他證據足資認定原宣告之緩刑有何難收其預期\n    之效果，而有必要執行刑罰之情形。\n六、原審因而駁回聲請人撤銷緩刑之聲請，經核並無違誤。檢察\n    官仍執前詞提起抗告，並無理由，抗告應予駁回。\n七、據上論結，應依刑事訴訟法第412 條，裁定如主文。\n中    華    民    國    99    年    1     月     4    日\n                    刑事第三庭  審判長法  官 莊崑山\n                                      法  官 張意聰\n                                      法  官 唐照明\n以上正本證明與原本無異。\n不得再抗告。\n中    華    民    國    99    年    1     月     4    日\n                                      書記官 張雲義",
  "structure": {
    "main": "抗告駁回。",
    "reason": "一、本件抗告意旨略以：本件受刑人前因違反臺灣地區與大陸地\n    區人民關係條例等案件，經臺灣屏東地方法院以97年度訴字\n    第1487號判決判處有期徒刑6 月，減為有期徒刑3 月，並諭\n    知緩刑2 年，於98年2 月14日確定。受刑人另於緩刑期內之\n    98年3 月2 日，因違反性騷擾防治法案件，經臺灣屏東地方\n    法院以98年度簡字第1097號判決判處拘役30日，於98年9 月\n    14日確定。茲受刑人先前所受有期徒刑併緩刑2 年宣告後，\n    尚不及一個月，即又於緩刑期間內之98年3 月2 日，故意再\n    犯違反性騷擾防治法案件，堪認受刑人守法觀薄弱且未改過\n    遷善，足認原宣告之緩刑難收預期之效果而有執行刑罰之必\n    要。爰提起抗告請求撤銷原裁定，更為適法之裁定等語。\n二、原裁定意旨略以：本件受刑人甲○○先後所犯違反臺灣地區\n    與大陸地區人民關係條例等案件、違反性騷擾防治法案件，\n    2 案所侵害法益之性質迥異，犯罪原因及社會危害程度亦完\n    全不同；復佐以其所犯違反性騷擾防治法案件中，僅徒手撫\n    摸被害人臀部一把，其行為手段尚非過激。是難認前案違反\n    臺灣地區與大陸地區人民關係條例等案件中原為促使受刑人\n    改過自新而宣告之緩刑，已難以收預期效果，而確有執行刑\n    罰必要。因而駁回檢察官撤銷緩刑宣告之聲請。\n三、按中華民國98年5 月19日刑法修正施行前，受緩刑之宣告，\n    98年5 月19日修正刑法施行後，仍在緩刑期內者，適用98年\n    5 月19日修正施行之刑法第75條及第75條之1 規定，刑法施\n    行法第6 之1 條第2 項定有明文。又刑法第75條、第75條之\n    1 業於民國98年5 月19日經立法院修正通過，於98年6 月10\n    日經總統公布後，並於98年9 月1 日施行。查本件受刑人甲\n    ○○前因違反臺灣地區與大陸地區人民關係條例等案件，經\n    原審法院以97年度訴字第1487號判決判處有期徒刑6 月，減\n    為有期徒刑3 月，緩刑2 年，於98年2 月14日確定，現仍在\n    緩刑期內，依前開規定，本件應適用98年9 月1 日施行之刑\n    法第75條、第75條之1 規定，合先敘明。\n四、依刑法第75條之1 第1 項第2 款之規定，緩刑期內因故意犯\n    他罪，而在緩刑期內受6 月以下有期徒刑、拘役或罰金之宣\n    告確定之情形，足認原宣告之緩刑難收其預期效果，而有執\n    行刑罰之必要，得撤銷其宣告。是故，在緩刑期內，故意犯\n    他罪，而在緩刑期內，受有期徒刑6 月以下、拘役或罰金之\n    宣告確定者，法官應依職權本於合目的性之裁量，妥適審酌\n    被告所犯前後數罪間，關於法益侵害之性質、再犯之原因、\n    違反法規範之情節是否重大、被告主觀犯意所顯現之惡性及\n    其反社會性等情，是否已使前案原為促使惡性輕微之被告或\n    偶發犯、初犯改過自新而宣告之緩刑，已難收其預期之效果\n    ，而確有執行刑罰之必要，此與刑法第75條第1 項所定之2\n    款要件有一具備，即毋庸再行審酌其他情狀，應逕予撤銷緩\n    刑之情形不同。\n五、經查，本件受刑人前因違反臺灣地區與大陸地區人民關係條\n    例等案件，經原審法院以97年度訴字第1487號判決判處有期\n    徒刑6 月，減為有期徒刑3 月，並諭知緩刑2 年，於98年2\n    月14日確定。而受刑人另於緩刑期內之98年3 月2 日，因違\n    反性騷擾防治法案件，經原審法院以98年度簡字第1097號判\n    決判處拘役30日，於98年9 月14日確定等情，固有上開刑事\n    判決及臺灣高等法院被告前案紀錄表在卷可證。惟審酌本件\n    受刑人所犯前開2 案中之各罪，侵害法益之性質迥異，犯罪\n    原因及社會危害程度亦完全不同；復佐以其於緩刑期間所犯\n    違反性騷擾防治法案件，犯罪事實乃受刑人「因病至屏東縣\n    恆南路188 號署立恆春旅遊醫院急診室就醫時，意圖性騷擾\n    ，趁為其護理之護士甲女不注意時，趁機以左手撫摸甲女之\n    左臀部1 把」，衡其犯罪情節應屬偶發，違反法規範之情節\n    尚非重大，由其主觀犯意所顯現之惡性及其反社會性之內涵\n    ，難認前案違反臺灣地區與大陸地區人民關係條例等案件中\n    原為促使受刑人改過遷善自新向上而宣告之緩刑，已難以收\n    預期效果，而確有執行刑罰必要。自不能僅因其在緩刑期內\n    犯違反性騷擾防治法案件，經法院判處拘役刑確定，即遽認\n    前案所諭知之緩刑，應予撤銷。此外，依聲請人檢具之卷證\n    資料，亦無其他證據足資認定原宣告之緩刑有何難收其預期\n    之效果，而有必要執行刑罰之情形。\n六、原審因而駁回聲請人撤銷緩刑之聲請，經核並無違誤。檢察\n    官仍執前詞提起抗告，並無理由，抗告應予駁回。\n七、據上論結，應依刑事訴訟法第412 條，裁定如主文。"
  },
  "characters": {
    "judges": [
      "莊崑山",
      "張意聰",
      "唐照明"
    ],
    "prosecutors": [

    ],
    "lawyers": [

    ],
    "clerks": [

    ],
    "plaintiffs": [

    ],
    "defendants": [

    ],
    "prosecutor_office": [

    ],
    "creditors": [

    ],
    "debtors": [

    ],
    "judicial_associate_officer": [

    ]
  },
  "adjudged_at": "2010-01-04",
  "created_at": "2016-01-05 14:39:39",
  "updated_at": "2016-01-05 14:39:39"
}