{
  "identify": "KSH-98-交抗-837-20100105-1",
  "court": {
    "name": "臺灣高等法院",
    "code": "KSH"
  },
  "division": {
    "name": "刑事",
    "code": "M"
  },
  "year": 98,
  "word": "交抗",
  "number": "837",
  "jcheck": "1",
  "reason": "聲明異議",
  "content": "臺灣高等法院高雄分院刑事裁定         98年度交抗字第837號\n抗  告  人\n即受處分人  甲○○\n上列抗告人因違反道路交通管理處罰條例聲明異議案件，不服臺\n灣屏東地方法院中華民國98年9 月21日裁定（98年度交聲字第24\n9 號），提起抗告，本院裁定如下：\n    主  文\n抗告駁回。\n    理  由\n一、抗告意旨略以：本件違規事件裁罰員警所提出違規錄影之影\n    片有間斷，未全程錄影，其裁罰違規人闖紅燈之證據顯有不\n    足，原法院卻未撤銷該不當之處分，為此提起抗告，請撤銷\n    原裁定云云。\n二、按「受處分人，不服第8 條主管機關所為之處罰，得於接到\n    裁決書之翌日起20日內，向管轄地方法院聲明異議」、「法\n    院受理前項異議，以裁定為之」、「不服前項裁定，受處分\n    人或原處分機關得為抗告」，道路交通管理處罰條例第87條\n    第1 項、第2 項、第3 項前段各有明文。又法院受理有關交\n    通事件，準用刑事訴訟法之規定，同條例第89條前段亦有明\n    文。另道路交通案件處理辦法第26條前段規定：「抗告程序\n    準用刑事訴訟法有關規定」。而刑事訴訟法第403 條第1 項\n    規定：「當事人對於法院之裁定有不服者，除有特別規定外\n    ，得抗告於直接上級法院」。再參酌最高法院28年上字第35\n    76號判例意旨：「本案雖依法不能提起自訴，惟某甲既為本\n    案提起自訴之人，第一審判決亦將某甲列為自訴人，則某甲\n    在刑事訴訟程序上不能不認為當事人，原判決不因此認其上\n    訴為不合法，尚不能指為違誤」等情，足認交通裁罰及聲明\n    異議案件，對交通主管機關所為之裁決，其聲明異議權僅限\n    於受裁決人即受處分人，其他人自無聲明異議之權，惟無聲\n    明異議權人（即非受處分人）若以自己名義聲明異議繫屬於\n    法院，就該具體繫屬於法院之交通案件而言，其即為當事人\n    （參照上開判例意旨自明），縱法院以其無聲明異議權而駁\n    回其聲明異議，因受裁定之訴訟當事人僅係該無聲明異議權\n    而聲明異議之人，應僅該人有抗告權，其他縱係原交通裁罰\n    之受處分人，因非受裁定之當事人，亦無抗告權。至於道路\n    交通管理處罰條例第87條第3 項前段規定之「不服前項裁定\n    ，受處分人得為抗告」所稱之「受處分人」，應指依同條第\n    1 項、第2 項規定提出聲明異議而受裁定之受處分人而言，\n    而非謂未受法院裁定之受處分人亦有抗告權，此參該第3 項\n    規定係承接同條第1 項、第2 項規定自明。則依道路交通管\n    理處罰條例第89條授權制定之道路交通案件處理辦法第25條\n    規定：「受處分人或原處分機關對於地方法院或其分院交通\n    法庭所為之裁定有不服者，得為抗告」，其中之「受處分人\n    」，亦應為相同之解釋。\n三、按交通法庭認聲明異議不合法律上之程式或其異議權已經喪\n    失者，應以裁定駁回之，但其不合法律上之程式可補正者，\n    應先定期命為補正，逾期不補正者，即予駁回，道路交通案\n    件處理辦法第18條定有規定。同辦法第19條規定：「交通法\n    庭認為聲明異議無理由者，應以裁定駁回之」。又原審法院\n    認為抗告不合法律上之程式或法律上不應准許，或其抗告權\n    已經喪失者，應以裁定駁回之，但其不合法律上之程式可補\n    正者，應定期間先命補正，刑事訴訟法第408 條第1 項亦有\n    明文。刑事訴訟法第411 條規定：「抗告法院認為抗告有第\n    408 條第1 項前段之情形者，應以裁定駁回之，但其情形可\n    以補正而未經原審法院命其補正者，審判長應定期間先命補\n    正」。而聲明異議不合法律上之程式，係指其聲明異議之程\n    序不合法定程式而言，例如未依道路交通案件處理辦法第13\n    條規定，敘述異議之理由等，至於無異議權人聲明異議，固\n    不合道路交通案件處理辦法第18條所定「其異議權已經喪失\n    」，係指原有異議權而因捨棄或逾期而喪失之情形，但無異\n    議權人之聲明異議既係屬於就具體交通異議案件無實施聲明\n    異議之權能，即相當於民事及行政訴訟中所稱之當事人不適\n    格之情形，對照民事及行政訴皆認為當事人不適格係屬訴無\n    理由之法理（最高法院90年度台上字第1322號民事判決及最\n    高行政法院90年6 月份庭長法官聯席會議意旨參照），應認\n    無異議權人之聲明異議，應屬上開辦法第19條規定之聲明異\n    議無理由，而不屬同辦法第18條但書所定之「不合法律上之\n    程式可補正」情形，自不生應裁定命補正之問題。至於無抗\n    告權人之抗告，係屬刑事訴訟法第408 條規定之「法律上不\n    應准許」之情形，亦非屬抗告不合法律上之程式（此指抗告\n    狀未敘述抗告理由等），亦不生應裁定命補正之問題。\n四、經查：\n  (一)本件抗告狀之抗告人欄係列「甲○○」為抗告人，而抗告狀\n    末之具狀人簽章欄亦載：「具狀人：甲○○」，並蓋用其印\n    文，「施進玄」係列撰狀人，此有抗告狀在卷可稽。是本件\n    抗告係由「甲○○」以抗告人身分提起抗告，「施進玄」並\n    非本件抗告之抗告人甚明。\n  (二)本件交通違規案件受裁決處分人為「甲○○」，有交通部公\n    路總局屏東監理站於98年06月22日所為之違反道路交通管理\n    事件裁決書（原處分案號：屏監違字第裁82-V00000000號）\n    附卷可稽，惟於原審提出聲明異議者並非「甲○○」，而係\n    由「施進玄」以自己個人名義於原審提起聲明異議，然「施\n    進玄」並非本件裁決處分之受處分人，自無聲明異議之權，\n    原審此部分認定並無違誤。\n五、綜上所述，「施進玄」既非本件裁決處分之受處分人，其對\n    該裁決處分即無提起聲明異議之權，依前開說明，其於原審\n    提起之聲明異議，應屬無理由，原審因而駁回其異議，並無\n    不合。另就原審裁定得提起抗告者，應限於原審提出聲明異\n    議而受裁定之「施進玄」，「甲○○」既非屬受原審裁定之\n    當事人，自無抗告權，則「甲○○」提起本件抗告，於法律\n    上不應准許，應予駁回。\n據上論結，應依道路交通管理處罰條例第89條、道路交通案件處\n理辦法第26條、刑事訴訟法第411 條前段，裁定如主文。\n中    華    民    國    99    年    1     月    5     日\n                  刑事第一庭    審判長法  官  周賢銳\n                                      法  官  徐美麗\n                                      法  官  施柏宏\n以上正本證明與原本無異。\n不得再抗告。\n中    華    民    國    99    年    1     月    5     日\n                                      書記官  魏文常",
  "structure": {
    "main": "抗告駁回。",
    "reason": "一、抗告意旨略以：本件違規事件裁罰員警所提出違規錄影之影\n    片有間斷，未全程錄影，其裁罰違規人闖紅燈之證據顯有不\n    足，原法院卻未撤銷該不當之處分，為此提起抗告，請撤銷\n    原裁定云云。\n二、按「受處分人，不服第8 條主管機關所為之處罰，得於接到\n    裁決書之翌日起20日內，向管轄地方法院聲明異議」、「法\n    院受理前項異議，以裁定為之」、「不服前項裁定，受處分\n    人或原處分機關得為抗告」，道路交通管理處罰條例第87條\n    第1 項、第2 項、第3 項前段各有明文。又法院受理有關交\n    通事件，準用刑事訴訟法之規定，同條例第89條前段亦有明\n    文。另道路交通案件處理辦法第26條前段規定：「抗告程序\n    準用刑事訴訟法有關規定」。而刑事訴訟法第403 條第1 項\n    規定：「當事人對於法院之裁定有不服者，除有特別規定外\n    ，得抗告於直接上級法院」。再參酌最高法院28年上字第35\n    76號判例意旨：「本案雖依法不能提起自訴，惟某甲既為本\n    案提起自訴之人，第一審判決亦將某甲列為自訴人，則某甲\n    在刑事訴訟程序上不能不認為當事人，原判決不因此認其上\n    訴為不合法，尚不能指為違誤」等情，足認交通裁罰及聲明\n    異議案件，對交通主管機關所為之裁決，其聲明異議權僅限\n    於受裁決人即受處分人，其他人自無聲明異議之權，惟無聲\n    明異議權人（即非受處分人）若以自己名義聲明異議繫屬於\n    法院，就該具體繫屬於法院之交通案件而言，其即為當事人\n    （參照上開判例意旨自明），縱法院以其無聲明異議權而駁\n    回其聲明異議，因受裁定之訴訟當事人僅係該無聲明異議權\n    而聲明異議之人，應僅該人有抗告權，其他縱係原交通裁罰\n    之受處分人，因非受裁定之當事人，亦無抗告權。至於道路\n    交通管理處罰條例第87條第3 項前段規定之「不服前項裁定\n    ，受處分人得為抗告」所稱之「受處分人」，應指依同條第\n    1 項、第2 項規定提出聲明異議而受裁定之受處分人而言，\n    而非謂未受法院裁定之受處分人亦有抗告權，此參該第3 項\n    規定係承接同條第1 項、第2 項規定自明。則依道路交通管\n    理處罰條例第89條授權制定之道路交通案件處理辦法第25條\n    規定：「受處分人或原處分機關對於地方法院或其分院交通\n    法庭所為之裁定有不服者，得為抗告」，其中之「受處分人\n    」，亦應為相同之解釋。\n三、按交通法庭認聲明異議不合法律上之程式或其異議權已經喪\n    失者，應以裁定駁回之，但其不合法律上之程式可補正者，\n    應先定期命為補正，逾期不補正者，即予駁回，道路交通案\n    件處理辦法第18條定有規定。同辦法第19條規定：「交通法\n    庭認為聲明異議無理由者，應以裁定駁回之」。又原審法院\n    認為抗告不合法律上之程式或法律上不應准許，或其抗告權\n    已經喪失者，應以裁定駁回之，但其不合法律上之程式可補\n    正者，應定期間先命補正，刑事訴訟法第408 條第1 項亦有\n    明文。刑事訴訟法第411 條規定：「抗告法院認為抗告有第\n    408 條第1 項前段之情形者，應以裁定駁回之，但其情形可\n    以補正而未經原審法院命其補正者，審判長應定期間先命補\n    正」。而聲明異議不合法律上之程式，係指其聲明異議之程\n    序不合法定程式而言，例如未依道路交通案件處理辦法第13\n    條規定，敘述異議之理由等，至於無異議權人聲明異議，固\n    不合道路交通案件處理辦法第18條所定「其異議權已經喪失\n    」，係指原有異議權而因捨棄或逾期而喪失之情形，但無異\n    議權人之聲明異議既係屬於就具體交通異議案件無實施聲明\n    異議之權能，即相當於民事及行政訴訟中所稱之當事人不適\n    格之情形，對照民事及行政訴皆認為當事人不適格係屬訴無\n    理由之法理（最高法院90年度台上字第1322號民事判決及最\n    高行政法院90年6 月份庭長法官聯席會議意旨參照），應認\n    無異議權人之聲明異議，應屬上開辦法第19條規定之聲明異\n    議無理由，而不屬同辦法第18條但書所定之「不合法律上之\n    程式可補正」情形，自不生應裁定命補正之問題。至於無抗\n    告權人之抗告，係屬刑事訴訟法第408 條規定之「法律上不\n    應准許」之情形，亦非屬抗告不合法律上之程式（此指抗告\n    狀未敘述抗告理由等），亦不生應裁定命補正之問題。\n四、經查：\n  (一)本件抗告狀之抗告人欄係列「甲○○」為抗告人，而抗告狀\n    末之具狀人簽章欄亦載：「具狀人：甲○○」，並蓋用其印\n    文，「施進玄」係列撰狀人，此有抗告狀在卷可稽。是本件\n    抗告係由「甲○○」以抗告人身分提起抗告，「施進玄」並\n    非本件抗告之抗告人甚明。\n  (二)本件交通違規案件受裁決處分人為「甲○○」，有交通部公\n    路總局屏東監理站於98年06月22日所為之違反道路交通管理\n    事件裁決書（原處分案號：屏監違字第裁82-V00000000號）\n    附卷可稽，惟於原審提出聲明異議者並非「甲○○」，而係\n    由「施進玄」以自己個人名義於原審提起聲明異議，然「施\n    進玄」並非本件裁決處分之受處分人，自無聲明異議之權，\n    原審此部分認定並無違誤。\n五、綜上所述，「施進玄」既非本件裁決處分之受處分人，其對\n    該裁決處分即無提起聲明異議之權，依前開說明，其於原審\n    提起之聲明異議，應屬無理由，原審因而駁回其異議，並無\n    不合。另就原審裁定得提起抗告者，應限於原審提出聲明異\n    議而受裁定之「施進玄」，「甲○○」既非屬受原審裁定之\n    當事人，自無抗告權，則「甲○○」提起本件抗告，於法律\n    上不應准許，應予駁回。\n據上論結，應依道路交通管理處罰條例第89條、道路交通案件處\n理辦法第26條、刑事訴訟法第411 條前段，裁定如主文。"
  },
  "characters": {
    "judges": [
      "周賢銳",
      "徐美麗",
      "施柏宏"
    ],
    "prosecutors": [

    ],
    "lawyers": [

    ],
    "clerks": [

    ],
    "plaintiffs": [

    ],
    "defendants": [

    ],
    "prosecutor_office": [

    ],
    "creditors": [

    ],
    "debtors": [

    ],
    "judicial_associate_officer": [

    ]
  },
  "adjudged_at": "2010-01-05",
  "created_at": "2016-01-05 15:10:55",
  "updated_at": "2016-01-05 15:10:55"
}