{
  "identify": "KSH-98-聲-1423-20100104-1",
  "court": {
    "name": "臺灣高等法院",
    "code": "KSH"
  },
  "division": {
    "name": "刑事",
    "code": "M"
  },
  "year": 98,
  "word": "聲",
  "number": "1423",
  "jcheck": "1",
  "reason": "聲請發還保證金",
  "content": "臺灣高等法院高雄分院刑事裁定          98年度聲字第1423號\n聲  請  人  乙○○\n送達代收人  甲○○\n被      告  丙○○\n上列聲請人因聲請發還保證金（原案件本院98年度上易字第895\n號詐欺案件），本院裁定如下：\n    主  文\n乙○○於民國97年4 月26日所繳交之保證金新台幣伍萬元應予發\n還。\n    理  由\n一、聲請意旨略以：被告丙○○前因詐欺案件，經臺灣高雄地方\n    法院檢察署准予具保5 萬元，並停止羈押在案，現又因涉犯\n    強盜案，經判刑有期徒刑7 年10月確定，已移送執行，本件\n    詐欺案又已判決確定等待移送執行中，丙○○既已入監執行\n    強盜案之刑期，即無逃亡之可能，具保人乃無繼續保證之必\n    要，為此聲請發還保證金等語。\n二、按免除具保之責任或經退保者，應將保證書註銷或將未沒入\n    之保證金發還，刑事訴訟法第119 條第3 項定有明文；又具\n    保人繳納保證金，旨在防止被告逃匿，此觀同法第118 條、\n    第119 條之規定自明；若被告已入監執行，即無逃匿可言，\n    具保人之責任即已免除。\n三、本件被告丙○○因詐欺案件，經臺灣高雄地方法院檢察署准\n    予具保停止羈押在案，惟被告因另涉強盜案，經台灣高等法\n    院台南分院判處有期徒刑7 年10月確定，並於98年10月27日\n    入高雄女子監獄執行，有台灣高等法院被告前案紀錄表、台\n    灣高等法院台南分院98年上訴字第676 號判決書在卷可參；\n    是被告既已另案移送執行有期徒刑7 年10月，即無逃亡之可\n    能，具保人亦已無具保之必要，其聲請發還保證金，經核並\n    無不合，應予准許。又本件詐欺案件亦據本院判刑確定，因\n    尚未送執行，則有關保證金之發還事項，仍應由本院為准駁\n    回之決定，併此說明。\n四、據上論結，應依刑事訴訟法第220 條，裁定如主文。\n中    華    民    國    99    年    1     月    4     日\n              刑事第六庭    審判長法  官  王憲義\n                                  法  官  邱永貴\n                                  法  官  簡志瑩\n以上正本證明與原本無異。\n如不服本裁定應於送達後5 日內向本院提出抗告狀。\n中    華    民    國    99    年    1     月    4     日\n                                  書記官  吳新貞",
  "structure": {
    "main": "乙○○於民國97年4 月26日所繳交之保證金新台幣伍萬元應予發\n還。",
    "reason": "一、聲請意旨略以：被告丙○○前因詐欺案件，經臺灣高雄地方\n    法院檢察署准予具保5 萬元，並停止羈押在案，現又因涉犯\n    強盜案，經判刑有期徒刑7 年10月確定，已移送執行，本件\n    詐欺案又已判決確定等待移送執行中，丙○○既已入監執行\n    強盜案之刑期，即無逃亡之可能，具保人乃無繼續保證之必\n    要，為此聲請發還保證金等語。\n二、按免除具保之責任或經退保者，應將保證書註銷或將未沒入\n    之保證金發還，刑事訴訟法第119 條第3 項定有明文；又具\n    保人繳納保證金，旨在防止被告逃匿，此觀同法第118 條、\n    第119 條之規定自明；若被告已入監執行，即無逃匿可言，\n    具保人之責任即已免除。\n三、本件被告丙○○因詐欺案件，經臺灣高雄地方法院檢察署准\n    予具保停止羈押在案，惟被告因另涉強盜案，經台灣高等法\n    院台南分院判處有期徒刑7 年10月確定，並於98年10月27日\n    入高雄女子監獄執行，有台灣高等法院被告前案紀錄表、台\n    灣高等法院台南分院98年上訴字第676 號判決書在卷可參；\n    是被告既已另案移送執行有期徒刑7 年10月，即無逃亡之可\n    能，具保人亦已無具保之必要，其聲請發還保證金，經核並\n    無不合，應予准許。又本件詐欺案件亦據本院判刑確定，因\n    尚未送執行，則有關保證金之發還事項，仍應由本院為准駁\n    回之決定，併此說明。\n四、據上論結，應依刑事訴訟法第220 條，裁定如主文。"
  },
  "characters": {
    "judges": [
      "王憲義",
      "邱永貴",
      "簡志瑩"
    ],
    "prosecutors": [

    ],
    "lawyers": [

    ],
    "clerks": [

    ],
    "plaintiffs": [

    ],
    "defendants": [
      "丙○○"
    ],
    "prosecutor_office": [
      "乙"
    ],
    "creditors": [

    ],
    "debtors": [

    ],
    "judicial_associate_officer": [

    ]
  },
  "adjudged_at": "2010-01-04",
  "created_at": "2016-01-05 14:39:43",
  "updated_at": "2016-01-05 14:39:43"
}