{
  "identify": "KSH-98-重上-101-20100512-2",
  "court": {
    "name": "臺灣高等法院",
    "code": "KSH"
  },
  "division": {
    "name": "民事",
    "code": "V"
  },
  "year": 98,
  "word": "重上",
  "number": "101",
  "jcheck": "2",
  "reason": "確認買賣關係存在等",
  "content": "臺灣高等法院高雄分院民事判決         98年度重上字第101號\n上  訴  人  丙○○\n訴訟代理人  陳旻沂律師\n複 代 理人  吳艾黎律師\n被 上 訴人  甲○○\n            乙○○\n上二人共同\n訴訟代理人  王仁聰律師\n上列當事人間請求確認買賣關係存在等事件，上訴人對於民國98\n年11月16日臺灣高雄地方法院98年度訴字第1199號第一審判決提\n起上訴，本院於民國99年4月28日言詞辯論終結，判決如下：\n    主  文\n上訴駁回。\n第二審訴訟費用由上訴人負擔。\n    事 實 及 理 由\n一、本件上訴人主張：(一)被上訴人甲○○於民國98年2 月20日23\n    時30分許，至高雄市前金區○○○路87號3 樓，向上訴人表\n    示坐落高雄市○○區○○段1060地號土地應有部分250/3,00\n    0 ，及其上1401建號即門牌號碼高雄市前金區○○○路87號\n    3 樓建物所有權全部，暨1397建號共同使用部分之建物應有\n    部分1/12（下稱系爭不動產），其業以其妻即被上訴人杜秀\n    卿名義向原審民事執行處標得，願以新台幣（下同）684 萬\n    元出售與上訴人，上訴人當場表示同意，並約定於杜秀卿取\n    得系爭不動產之權利移轉證書後，再將系爭不動產之所有權\n    移轉登記予上訴人，故上訴人與甲○○確已就買賣標的物及\n    價金等買賣必要之點達成合意，買賣契約已成立，未料翌日\n    甲○○竟反悔，向上訴人表示不賣，上訴人自得請求甲○○\n    於其給付684 萬元價金之同時，將系爭不動產所有權移轉登\n    記予上訴人。又甲○○與乙○○間就系爭不動產有借名登記\n    關係之存在，其本得請求乙○○將系爭不動產所有權移轉登\n    記予其或所指定之第三人，甲○○既怠於行使權利，上訴人\n    自得依民法第242 條之規定，代位甲○○向乙○○請求將系\n    爭不動產所有權移轉登記予上訴人。(二)上訴人於上開買賣契\n    約成立後之翌日，即將系爭不動產以1,100 萬元出售予訴外\n    人曾素真，因甲○○拒絕履行上開買賣契約，係屬可歸責於\n    甲○○之事由致給付不能，上訴人因此受有差價416 萬元（\n    1,100 萬元－684 萬元=416萬元）之損害，自得依民法第22\n    6 條規定向甲○○請求損害賠償此部分所失之利益。為此，\n    依民法第348 條、第242 條及第226 條之規定，提起本件訴\n    訟等語。並先位聲明求為判決：(一)確認上訴人與被上訴人甲\n    ○○間就系爭不動產之買賣關係存在。(二)被上訴人杜秀卿應\n    於上訴人給付684 萬元予被上訴人甲○○之同時，將系爭不\n    動產所有權移轉登記予上訴人。如被上訴人杜秀卿與甲○○\n    間就系爭不動產無借名登記關係存在，則備位聲明求為判決\n    ：(一)被上訴人甲○○應給付上訴人416 萬元，及自起訴狀繕\n    本送達翌日起至清償日止按年息5%計算之利息。(二)上訴人願\n    以高雄銀行無記名可轉讓定期存單供擔保請准宣告假執行。\n二、被上訴人則以：系爭不動產係被上訴人乙○○向原審民事執\n    處標得，為其個人所有，投標款項亦係杜秀卿自其在國泰世\n    華商業銀行所開設之帳號000000000000號帳戶（以下稱系爭\n    帳戶）支出，甲○○從未向上訴人表示系爭不動產係其以乙\n    ○○名義向原審民事執行處標購，亦未曾同意將系爭不動產\n    以684 萬元出售予上訴人。另曾素真係代書及從事代標業務\n    ，熟知系爭不動產之市場行情僅600 餘萬元，不可能以高於\n    市場價格即1,100 萬元向上訴人購買系爭不動產，上訴人所\n    提出其與曾素真於98年2 月21日所簽定協議書（下稱系爭協\n    議書）應非真正，縱系爭協議書係真正，惟上訴人未查證被\n    上訴人甲○○所言是否屬實，及在未與被上訴人甲○○簽立\n    正式買賣契約之情形下，即擅自轉售系爭不動產，亦與有過\n    失等語置辯。並答辯聲明求為判決：(一)上訴人之訴駁回。(二)\n    被上訴人如受不利判決，願供擔保請准宣告免為假執行。\n三、原審判決上訴人敗訴，上訴人不服，提起上訴，上訴之先位\n    聲明求為判決：(一)原判決關於駁回上訴人後開第二、三項之\n    請求廢棄。(二)確認上訴人與被上訴人甲○○間就系爭不動產\n    之買賣關係存在。(三)被上訴人杜秀卿應於上訴人給付684 萬\n    元予甲○○之同時，將系爭不動產所有權移轉登記予上訴人\n    。備位聲明求為判決：(一)原判決關於駁回上訴人後開第二項\n    之請求廢棄。(二)被上訴人甲○○應給付上訴人416 萬元，及\n    自起訴狀繕本送達翌日起至清償日止按年息5%計算之利息。\n    (三)上訴人願以高雄銀行無記名可轉讓定期存單供擔保，請准\n    宣告假執行。被上訴人則答辯聲明求為判決：(一)駁回上訴。\n    (二)願供擔保，請准宣告免為假執行。\n四、兩造不爭執事項如下:\n  (一)系爭不動產及坐落高雄市○○區○○段1060地號土地應有部\n    分250/3,000 ，及其上1409建號即門牌號碼高雄市前金區○\n    ○○路87號11樓建物所有權全部，暨1397建號共同使用部分\n    之建物應有部分1/12（下稱系爭11樓不動產），經原審民事\n    執行處以96年度執字第52347 號強制執行事件予以執行拍賣\n    ，由被上訴人乙○○於98年2 月20日以13,680,000元拍定取\n    得，且其中2,663,000 元及9,811,000 元係由被上訴人杜秀\n    卿自其在國泰世華商業銀行股份有限公司所開設之帳號0000\n    00000000號帳戶提領支付，被上訴人乙○○並於98年3 月17\n    日辦妥系爭不動產所有權移轉登記完畢。\n  (二)被上訴人甲○○曾於98年2 月20日晚上，前往訴外人劉文景\n    在高雄市前金區○○○路87號3 樓所經營之KTV 與上訴人見\n    面。\n  (三)上訴人所提出其於98年2 月21日晚上10時許，與被上訴人甲\n    ○○在高雄市苓雅區○○○路62號6 樓會面談話錄音之譯文\n    內容為真正，並有譯文在卷可稽（見原審卷第32頁至34頁）\n    。\n五、兩造爭執事項如下: (一)系爭不動產是否係被上訴人甲○○借\n    名登記在被上訴人杜秀卿名下? (二)上訴人與被上訴人甲○○\n    就系爭不動產是否有成立買賣契約？如有成立買賣契約，則\n    上訴人代位請求被上訴人乙○○移轉系爭不動產所有權，是\n    否有理由？(三)如被上訴人甲○○與杜秀卿間就系爭不動產無\n    借名登記關係存在，則上訴人本於民法第226 條第1 項之規\n    定，請求被上訴人甲○○賠償416 萬元本息，是否有理由？\n    茲就此爭執點分述如下:\n（一）系爭不動產是否係被上訴人甲○○借名登記在被上訴人杜\n      秀卿名下?\n    1.上訴人主張系爭不動產係被上訴人甲○○借名登記在被上\n      訴人杜秀卿名下等情，為被上訴人所否認，自應由上訴人\n      負舉證之責。查，上訴人主張被上訴人甲○○於98年2 月\n      20日23時30分許，在高雄市前金區○○○路87號3 樓，向\n      上訴人表示系爭不動產係其以杜秀卿名義向原審民事執行\n      處標得等情，核與證人劉文景於原審結證稱: 在98年2 月\n      20日晚上11點半左右，上訴人與甲○○相約到上訴人辦公\n      室，伊也跟著進去，甲○○說他用他太太的名義（即杜秀\n      卿）買下11樓（即系爭11樓不動產）及3 樓（即系爭不動\n      產）等情相符（見原審卷第73頁），且依上訴人所提出其\n      於98年2 月21日晚上10時許，與甲○○在高雄市苓雅區○\n      ○○路62號6 樓會面談話錄音之譯文內容記載，甲○○亦\n      承認有於98年2 月20日說係伊叫杜秀卿標買系爭不動產，\n      有兩造就其內容真正不爭執之譯文在卷可證（見原審卷第\n      32頁至34頁），足見上訴人之上開主張屬實，惟系爭不動\n      產係被上訴人杜秀卿向原審民事執行處拍買取得，並登記\n      在被上訴人杜秀卿名下，其為系爭不動產之所有權人，被\n      上訴人杜秀卿與甲○○間就系爭不動產是否有借名登記關\n      係存在，牽涉系爭不動產真正所有權人之歸屬，事關重大\n      ，非單僅憑甲○○之片面陳述即可認定，尚需登記所有權\n      人杜秀卿承認始可，否則無異承認任何第三人均可任意指\n      稱其就某不動產有借名登記關係存在，是尚難因被上訴人\n      甲○○於98年2 月20日23時30分許，向上訴人表示系爭不\n      動產係其以杜秀卿名義向原審民事執行處標得，即認定杜\n      秀卿與甲○○間就系爭不動產有借名登記關係存在。\n    2.次查，系爭不動產及系爭11樓不動產，係杜秀卿於98年2\n      月20日以13,680,000元向原審民事執行處拍定取得，其中\n      2,663,000 元及9,811,000 元係由杜秀卿之系爭帳戶提領\n      支付，被上訴人乙○○並於98年3 月17日辦妥系爭不動產\n      所有權移轉登記完畢等情，為兩造所不爭執，足見系爭不\n      動產係由杜秀卿向原審民事執行處拍定取得，並已辦妥所\n      有權移轉登記，則系爭不動產應係杜秀卿所有，至於拍定\n      所需之資金來源是否為甲○○所提供，乃甲○○與杜秀卿\n      間之問題，與系爭不動產之真正購買人係何人無關，苟杜\n      秀卿標買系爭不動產之金錢係來自甲○○，其等間有可能\n      是贈與、借貸等關係存在，非謂杜秀卿標買系爭不動產之\n      款項係來自甲○○，即可逕認定系爭不動產係甲○○借用\n      杜秀卿之名義所標購，並借名登記在杜秀卿名下，此外，\n      上訴人未能舉證證明系爭不動產係被上訴人甲○○借名登\n      記在被上訴人杜秀卿名下，從而上訴人主張杜秀卿標買系\n      爭不動產之款項係來自甲○○，故系爭不動產是甲○○借\n      名登記在被上訴人杜秀卿名下云云，尚難採信。\n（二）上訴人與被上訴人甲○○就系爭不動產是否有成立買賣契\n      約？如有成立買賣契約，則上訴人代位請求被上訴人乙○\n      ○移轉系爭不動產所有權，是否有理由？\n    1.按「契約有預約與本約之分，兩者異其性質及效力，預約\n      權利人僅得請求對方履行訂立本約之義務，不得逕依預定\n      之本約內容請求履行，又買賣預約，非不得就標的物及價\n      金之範圍先為擬定，作為將來訂立本約之張本，但不能因\n      此即認買賣本約業已成立。」（最高法院61年台上字第96\n      4 號判例可資參照）。又「不動產之買賣，除標的物及其\n      價金，當事人須互相同意外，尚涉及付款方法、稅負、點\n      交、費用及違約等重要事項。買賣預約，固非不得就標的\n      物及其價金，或其他事項之範圍先為擬定，作為將來訂立\n      本約之張本，惟預約與本約究非同一，其內容未必盡同，\n      通常均由當事人就預約所擬定之範圍進行商議，於獲得具\n      體之結論後，再據以訂立本約。」，有最高法院79年度台\n      上字第1357號判決可資參照。\n    2.查，證人劉文景於原審結證稱：98年2 月20日晚上11點半\n      ，甲○○說系爭11樓不動產要作營業用，系爭不動產用不\n      到，上訴人表示要買，甲○○就說價金為拍定價金1368萬\n      元之一半，費用也是一人一半，上訴人同意，當時雙方未\n      提到要收訂金或頭期款等情（見原審卷第73、74頁），且\n      依上訴人所提出之證人劉文景所出具之證明書記載，上訴\n      人與甲○○就買賣價金已達成協議，並約定於取得權利移\n      轉證書後再過戶予上訴人，投標及過戶等費用由其等2 人\n      平均分攤等情，有該證明書在卷可稽（見原審卷第36頁）\n      ，是依上開證人劉文景及證明書僅能證明上訴人與甲○○\n      就買賣標的物、價金、投標及過戶費用有達成合意，但就\n      付款方法、稅負、點交及違約等重要事項則完全未為約定\n      ，故上訴人與甲○○間就買賣系爭不動產所為之約定應屬\n      買賣之「預約」而非本約，依前開1.之說明，上訴人僅能\n      請求甲○○訂定買賣本約，在訂立買賣本約前，難謂上訴\n      人與甲○○間就系爭不動產已有買賣關係存在，是上訴人\n      主張伊與甲○○間就系爭不動產已成立買賣契約，請求確\n      認上訴人與甲○○間就系爭不動產之買賣關係存在，應屬\n      無據。\n    3.次按債權人得以自己名義代位行使者，為債務人之權利而\n      非自己之權利，若債務人自己並無該項權利，債權人自無\n      代位行使之可言。又代位權係債權人代行債務人之權利，\n      故代行者與被代行者之間，必須有債權債務關係之存在，\n      否則即無行使代位權之可言。另「債權人依民法第242 條\n      規定代位行使之權利，原屬債務人之權利，故債權人行使\n      代位權時，惟有請求第三債務人向債務人為給付，原判決\n      既認被上訴人代位林○平行使權利為正當，竟命上訴人將\n      系爭土地所有權直接移轉登記予被上訴人，尤見矛盾。」\n      ，分別有最高法院49年台上字第175 號判例、49年台上字\n      第1274號判例、71年度台上字第4947號判決可資參照。\n    4.次查，上訴人與甲○○間就系爭不動產尚未成立買賣關係\n      ，自無權請求甲○○移轉系爭不動產所有權，且甲○○與\n      杜秀卿間就系爭不動產並無借名登記關係，已如前述，則\n      甲○○亦無權請求杜秀卿移轉系爭不動產所有權，依上開\n      3.說明，上訴人既無權請求甲○○移轉系爭不動產所有權\n      ，且甲○○亦無權請求杜秀卿移轉系爭不動產所有權，則\n      上訴人自應無權「代位」甲○○請求杜秀卿於上訴人給付\n      684 萬元予甲○○之同時，將系爭不動產移轉登記予上訴\n      人，何況上訴人與杜秀卿間並無任何法律關係存在，其亦\n      無權請求杜秀卿直接將系爭不動產移轉登記予上訴人，故\n      上訴人請求杜秀卿於上訴人給付684 萬元予甲○○之同時\n      ，將系爭不動產所有權移轉登記予上訴人，難謂有據。\n（三）如被上訴人甲○○與杜秀卿間就系爭不動產無借名登記關\n      係存在，則上訴人本於民法第226 條第1 項之規定，請求\n      被上訴人甲○○賠償416 萬元本息，是否有理由？\n      查，依上開（二）所述，上訴人與甲○○間就系爭不動產\n      所為之約定應屬買賣之「預約」而非本約，則上訴人僅能\n      請求甲○○訂定買賣本約，必於上訴人與甲○○就系爭不\n      動產訂定買賣本約，且甲○○無法履行買賣契約之約定時\n      ，始能謂甲○○給付不能，茲上訴人與甲○○尚未就系爭\n      不動產訂定買賣本約，其買賣本約能否如期簽訂尚屬未知\n      ，難謂甲○○有給付不能之情形，是上訴人本於民法第22\n      6 條第1 項之規定，請求甲○○賠償其無法將系爭不動產\n      轉售予曾素真而可獲得之利益416 萬元本息，為無理由。\n六、綜上所述，上訴人本於民法第348 條、第242 條及第226 條\n    之規定，先位請求確認上訴人與被上訴人甲○○間就系爭不\n    動產之買賣關係存在，及被上訴人杜秀卿應於上訴人給付68\n    4 萬元予被上訴人甲○○之同時，將系爭不動產所有權移轉\n    登記予上訴人；暨備位請求被上訴人甲○○應給付上訴人41\n    6 萬元，及自起訴狀繕本送達翌日起至清償日止按年息5%計\n    算之利息，均為無理由，不應准許。其假執行之聲請亦失所\n    附麗，應併予駁回。原審為上訴人敗訴之判決，及駁回其假\n    執行之聲請，於法尚無不合。上訴意旨指摘原判決不當，求\n    予廢棄改判，為無理由，應予駁回。\n七、本件事證已臻明確，兩造其餘攻擊防禦方法於本件判決結果\n    不生影響，故不再一一論述，併此明。\n八、據上論結，本件上訴為無理由，依民事訴訟法第449 條第1\n    項、第78條，判決如主文。\n中    華    民    國    99    年    5     月    12    日\n                            民事第三庭\n                                審判長法官  張國彬\n                                法      官  吳登輝\n                                法      官  鄭月霞\n以上正本證明與原本無異。\n如對本判決上訴，須於判決送達後20日內向本院提出上訴狀，其\n未表明上訴理由者，應於上訴後20日內向本院提出上訴理由書（\n均須按他造當事人之人數附繕本）。上訴時應提出委任律師或具\n有律師資格之人之委任狀，並依附註條文規定辦理。\n中    華    民    國    99    年    5     月    12    日\n                                書  記  官  白  蘭\n附註：\n民事訴訟法第466 條之1 ：\n對於第二審判決上訴，上訴人應委任律師為訴訟代理人，但上訴\n人或其法定代理人具有律師資格者，不在此限。\n上訴人之配偶、三親等內之血親、二親等內之姻親，或上訴人為\n法人、中央或地方機關時，其所屬專任人員具有律師資格並經法\n院認適當者，亦得為第三審訴訟代理人。\n第1 項但書及第2 項情形，應於提起上訴或委任時釋明之。",
  "structure": {
    "fact": "一、本件上訴人主張：(一)被上訴人甲○○於民國98年2 月20日23\n    時30分許，至高雄市前金區○○○路87號3 樓，向上訴人表\n    示坐落高雄市○○區○○段1060地號土地應有部分250/3,00\n    0 ，及其上1401建號即門牌號碼高雄市前金區○○○路87號\n    3 樓建物所有權全部，暨1397建號共同使用部分之建物應有\n    部分1/12（下稱系爭不動產），其業以其妻即被上訴人杜秀\n    卿名義向原審民事執行處標得，願以新台幣（下同）684 萬\n    元出售與上訴人，上訴人當場表示同意，並約定於杜秀卿取\n    得系爭不動產之權利移轉證書後，再將系爭不動產之所有權\n    移轉登記予上訴人，故上訴人與甲○○確已就買賣標的物及\n    價金等買賣必要之點達成合意，買賣契約已成立，未料翌日\n    甲○○竟反悔，向上訴人表示不賣，上訴人自得請求甲○○\n    於其給付684 萬元價金之同時，將系爭不動產所有權移轉登\n    記予上訴人。又甲○○與乙○○間就系爭不動產有借名登記\n    關係之存在，其本得請求乙○○將系爭不動產所有權移轉登\n    記予其或所指定之第三人，甲○○既怠於行使權利，上訴人\n    自得依民法第242 條之規定，代位甲○○向乙○○請求將系\n    爭不動產所有權移轉登記予上訴人。(二)上訴人於上開買賣契\n    約成立後之翌日，即將系爭不動產以1,100 萬元出售予訴外\n    人曾素真，因甲○○拒絕履行上開買賣契約，係屬可歸責於\n    甲○○之事由致給付不能，上訴人因此受有差價416 萬元（\n    1,100 萬元－684 萬元=416萬元）之損害，自得依民法第22\n    6 條規定向甲○○請求損害賠償此部分所失之利益。為此，\n    依民法第348 條、第242 條及第226 條之規定，提起本件訴\n    訟等語。並先位聲明求為判決：(一)確認上訴人與被上訴人甲\n    ○○間就系爭不動產之買賣關係存在。(二)被上訴人杜秀卿應\n    於上訴人給付684 萬元予被上訴人甲○○之同時，將系爭不\n    動產所有權移轉登記予上訴人。如被上訴人杜秀卿與甲○○\n    間就系爭不動產無借名登記關係存在，則備位聲明求為判決\n    ：(一)被上訴人甲○○應給付上訴人416 萬元，及自起訴狀繕\n    本送達翌日起至清償日止按年息5%計算之利息。(二)上訴人願\n    以高雄銀行無記名可轉讓定期存單供擔保請准宣告假執行。\n二、被上訴人則以：系爭不動產係被上訴人乙○○向原審民事執\n    處標得，為其個人所有，投標款項亦係杜秀卿自其在國泰世\n    華商業銀行所開設之帳號000000000000號帳戶（以下稱系爭\n    帳戶）支出，甲○○從未向上訴人表示系爭不動產係其以乙\n    ○○名義向原審民事執行處標購，亦未曾同意將系爭不動產\n    以684 萬元出售予上訴人。另曾素真係代書及從事代標業務\n    ，熟知系爭不動產之市場行情僅600 餘萬元，不可能以高於\n    市場價格即1,100 萬元向上訴人購買系爭不動產，上訴人所\n    提出其與曾素真於98年2 月21日所簽定協議書（下稱系爭協\n    議書）應非真正，縱系爭協議書係真正，惟上訴人未查證被\n    上訴人甲○○所言是否屬實，及在未與被上訴人甲○○簽立\n    正式買賣契約之情形下，即擅自轉售系爭不動產，亦與有過\n    失等語置辯。並答辯聲明求為判決：(一)上訴人之訴駁回。(二)\n    被上訴人如受不利判決，願供擔保請准宣告免為假執行。\n三、原審判決上訴人敗訴，上訴人不服，提起上訴，上訴之先位\n    聲明求為判決：(一)原判決關於駁回上訴人後開第二、三項之\n    請求廢棄。(二)確認上訴人與被上訴人甲○○間就系爭不動產\n    之買賣關係存在。(三)被上訴人杜秀卿應於上訴人給付684 萬\n    元予甲○○之同時，將系爭不動產所有權移轉登記予上訴人\n    。備位聲明求為判決：(一)原判決關於駁回上訴人後開第二項\n    之請求廢棄。(二)被上訴人甲○○應給付上訴人416 萬元，及\n    自起訴狀繕本送達翌日起至清償日止按年息5%計算之利息。\n    (三)上訴人願以高雄銀行無記名可轉讓定期存單供擔保，請准\n    宣告假執行。被上訴人則答辯聲明求為判決：(一)駁回上訴。\n    (二)願供擔保，請准宣告免為假執行。\n四、兩造不爭執事項如下:\n  (一)系爭不動產及坐落高雄市○○區○○段1060地號土地應有部\n    分250/3,000 ，及其上1409建號即門牌號碼高雄市前金區○\n    ○○路87號11樓建物所有權全部，暨1397建號共同使用部分\n    之建物應有部分1/12（下稱系爭11樓不動產），經原審民事\n    執行處以96年度執字第52347 號強制執行事件予以執行拍賣\n    ，由被上訴人乙○○於98年2 月20日以13,680,000元拍定取\n    得，且其中2,663,000 元及9,811,000 元係由被上訴人杜秀\n    卿自其在國泰世華商業銀行股份有限公司所開設之帳號0000\n    00000000號帳戶提領支付，被上訴人乙○○並於98年3 月17\n    日辦妥系爭不動產所有權移轉登記完畢。\n  (二)被上訴人甲○○曾於98年2 月20日晚上，前往訴外人劉文景\n    在高雄市前金區○○○路87號3 樓所經營之KTV 與上訴人見\n    面。\n  (三)上訴人所提出其於98年2 月21日晚上10時許，與被上訴人甲\n    ○○在高雄市苓雅區○○○路62號6 樓會面談話錄音之譯文\n    內容為真正，並有譯文在卷可稽（見原審卷第32頁至34頁）\n    。\n五、兩造爭執事項如下: (一)系爭不動產是否係被上訴人甲○○借\n    名登記在被上訴人杜秀卿名下? (二)上訴人與被上訴人甲○○\n    就系爭不動產是否有成立買賣契約？如有成立買賣契約，則\n    上訴人代位請求被上訴人乙○○移轉系爭不動產所有權，是\n    否有理由？(三)如被上訴人甲○○與杜秀卿間就系爭不動產無\n    借名登記關係存在，則上訴人本於民法第226 條第1 項之規\n    定，請求被上訴人甲○○賠償416 萬元本息，是否有理由？\n    茲就此爭執點分述如下:\n（一）系爭不動產是否係被上訴人甲○○借名登記在被上訴人杜\n      秀卿名下?\n    1.上訴人主張系爭不動產係被上訴人甲○○借名登記在被上\n      訴人杜秀卿名下等情，為被上訴人所否認，自應由上訴人\n      負舉證之責。查，上訴人主張被上訴人甲○○於98年2 月\n      20日23時30分許，在高雄市前金區○○○路87號3 樓，向\n      上訴人表示系爭不動產係其以杜秀卿名義向原審民事執行\n      處標得等情，核與證人劉文景於原審結證稱: 在98年2 月\n      20日晚上11點半左右，上訴人與甲○○相約到上訴人辦公\n      室，伊也跟著進去，甲○○說他用他太太的名義（即杜秀\n      卿）買下11樓（即系爭11樓不動產）及3 樓（即系爭不動\n      產）等情相符（見原審卷第73頁），且依上訴人所提出其\n      於98年2 月21日晚上10時許，與甲○○在高雄市苓雅區○\n      ○○路62號6 樓會面談話錄音之譯文內容記載，甲○○亦\n      承認有於98年2 月20日說係伊叫杜秀卿標買系爭不動產，\n      有兩造就其內容真正不爭執之譯文在卷可證（見原審卷第\n      32頁至34頁），足見上訴人之上開主張屬實，惟系爭不動\n      產係被上訴人杜秀卿向原審民事執行處拍買取得，並登記\n      在被上訴人杜秀卿名下，其為系爭不動產之所有權人，被\n      上訴人杜秀卿與甲○○間就系爭不動產是否有借名登記關\n      係存在，牽涉系爭不動產真正所有權人之歸屬，事關重大\n      ，非單僅憑甲○○之片面陳述即可認定，尚需登記所有權\n      人杜秀卿承認始可，否則無異承認任何第三人均可任意指\n      稱其就某不動產有借名登記關係存在，是尚難因被上訴人\n      甲○○於98年2 月20日23時30分許，向上訴人表示系爭不\n      動產係其以杜秀卿名義向原審民事執行處標得，即認定杜\n      秀卿與甲○○間就系爭不動產有借名登記關係存在。\n    2.次查，系爭不動產及系爭11樓不動產，係杜秀卿於98年2\n      月20日以13,680,000元向原審民事執行處拍定取得，其中\n      2,663,000 元及9,811,000 元係由杜秀卿之系爭帳戶提領\n      支付，被上訴人乙○○並於98年3 月17日辦妥系爭不動產\n      所有權移轉登記完畢等情，為兩造所不爭執，足見系爭不\n      動產係由杜秀卿向原審民事執行處拍定取得，並已辦妥所\n      有權移轉登記，則系爭不動產應係杜秀卿所有，至於拍定\n      所需之資金來源是否為甲○○所提供，乃甲○○與杜秀卿\n      間之問題，與系爭不動產之真正購買人係何人無關，苟杜\n      秀卿標買系爭不動產之金錢係來自甲○○，其等間有可能\n      是贈與、借貸等關係存在，非謂杜秀卿標買系爭不動產之\n      款項係來自甲○○，即可逕認定系爭不動產係甲○○借用\n      杜秀卿之名義所標購，並借名登記在杜秀卿名下，此外，\n      上訴人未能舉證證明系爭不動產係被上訴人甲○○借名登\n      記在被上訴人杜秀卿名下，從而上訴人主張杜秀卿標買系\n      爭不動產之款項係來自甲○○，故系爭不動產是甲○○借\n      名登記在被上訴人杜秀卿名下云云，尚難採信。\n（二）上訴人與被上訴人甲○○就系爭不動產是否有成立買賣契\n      約？如有成立買賣契約，則上訴人代位請求被上訴人乙○\n      ○移轉系爭不動產所有權，是否有理由？\n    1.按「契約有預約與本約之分，兩者異其性質及效力，預約\n      權利人僅得請求對方履行訂立本約之義務，不得逕依預定\n      之本約內容請求履行，又買賣預約，非不得就標的物及價\n      金之範圍先為擬定，作為將來訂立本約之張本，但不能因\n      此即認買賣本約業已成立。」（最高法院61年台上字第96\n      4 號判例可資參照）。又「不動產之買賣，除標的物及其\n      價金，當事人須互相同意外，尚涉及付款方法、稅負、點\n      交、費用及違約等重要事項。買賣預約，固非不得就標的\n      物及其價金，或其他事項之範圍先為擬定，作為將來訂立\n      本約之張本，惟預約與本約究非同一，其內容未必盡同，\n      通常均由當事人就預約所擬定之範圍進行商議，於獲得具\n      體之結論後，再據以訂立本約。」，有最高法院79年度台\n      上字第1357號判決可資參照。\n    2.查，證人劉文景於原審結證稱：98年2 月20日晚上11點半\n      ，甲○○說系爭11樓不動產要作營業用，系爭不動產用不\n      到，上訴人表示要買，甲○○就說價金為拍定價金1368萬\n      元之一半，費用也是一人一半，上訴人同意，當時雙方未\n      提到要收訂金或頭期款等情（見原審卷第73、74頁），且\n      依上訴人所提出之證人劉文景所出具之證明書記載，上訴\n      人與甲○○就買賣價金已達成協議，並約定於取得權利移\n      轉證書後再過戶予上訴人，投標及過戶等費用由其等2 人\n      平均分攤等情，有該證明書在卷可稽（見原審卷第36頁）\n      ，是依上開證人劉文景及證明書僅能證明上訴人與甲○○\n      就買賣標的物、價金、投標及過戶費用有達成合意，但就\n      付款方法、稅負、點交及違約等重要事項則完全未為約定\n      ，故上訴人與甲○○間就買賣系爭不動產所為之約定應屬\n      買賣之「預約」而非本約，依前開1.之說明，上訴人僅能\n      請求甲○○訂定買賣本約，在訂立買賣本約前，難謂上訴\n      人與甲○○間就系爭不動產已有買賣關係存在，是上訴人\n      主張伊與甲○○間就系爭不動產已成立買賣契約，請求確\n      認上訴人與甲○○間就系爭不動產之買賣關係存在，應屬\n      無據。\n    3.次按債權人得以自己名義代位行使者，為債務人之權利而\n      非自己之權利，若債務人自己並無該項權利，債權人自無\n      代位行使之可言。又代位權係債權人代行債務人之權利，\n      故代行者與被代行者之間，必須有債權債務關係之存在，\n      否則即無行使代位權之可言。另「債權人依民法第242 條\n      規定代位行使之權利，原屬債務人之權利，故債權人行使\n      代位權時，惟有請求第三債務人向債務人為給付，原判決\n      既認被上訴人代位林○平行使權利為正當，竟命上訴人將\n      系爭土地所有權直接移轉登記予被上訴人，尤見矛盾。」\n      ，分別有最高法院49年台上字第175 號判例、49年台上字\n      第1274號判例、71年度台上字第4947號判決可資參照。\n    4.次查，上訴人與甲○○間就系爭不動產尚未成立買賣關係\n      ，自無權請求甲○○移轉系爭不動產所有權，且甲○○與\n      杜秀卿間就系爭不動產並無借名登記關係，已如前述，則\n      甲○○亦無權請求杜秀卿移轉系爭不動產所有權，依上開\n      3.說明，上訴人既無權請求甲○○移轉系爭不動產所有權\n      ，且甲○○亦無權請求杜秀卿移轉系爭不動產所有權，則\n      上訴人自應無權「代位」甲○○請求杜秀卿於上訴人給付\n      684 萬元予甲○○之同時，將系爭不動產移轉登記予上訴\n      人，何況上訴人與杜秀卿間並無任何法律關係存在，其亦\n      無權請求杜秀卿直接將系爭不動產移轉登記予上訴人，故\n      上訴人請求杜秀卿於上訴人給付684 萬元予甲○○之同時\n      ，將系爭不動產所有權移轉登記予上訴人，難謂有據。\n（三）如被上訴人甲○○與杜秀卿間就系爭不動產無借名登記關\n      係存在，則上訴人本於民法第226 條第1 項之規定，請求\n      被上訴人甲○○賠償416 萬元本息，是否有理由？\n      查，依上開（二）所述，上訴人與甲○○間就系爭不動產\n      所為之約定應屬買賣之「預約」而非本約，則上訴人僅能\n      請求甲○○訂定買賣本約，必於上訴人與甲○○就系爭不\n      動產訂定買賣本約，且甲○○無法履行買賣契約之約定時\n      ，始能謂甲○○給付不能，茲上訴人與甲○○尚未就系爭\n      不動產訂定買賣本約，其買賣本約能否如期簽訂尚屬未知\n      ，難謂甲○○有給付不能之情形，是上訴人本於民法第22\n      6 條第1 項之規定，請求甲○○賠償其無法將系爭不動產\n      轉售予曾素真而可獲得之利益416 萬元本息，為無理由。\n六、綜上所述，上訴人本於民法第348 條、第242 條及第226 條\n    之規定，先位請求確認上訴人與被上訴人甲○○間就系爭不\n    動產之買賣關係存在，及被上訴人杜秀卿應於上訴人給付68\n    4 萬元予被上訴人甲○○之同時，將系爭不動產所有權移轉\n    登記予上訴人；暨備位請求被上訴人甲○○應給付上訴人41\n    6 萬元，及自起訴狀繕本送達翌日起至清償日止按年息5%計\n    算之利息，均為無理由，不應准許。其假執行之聲請亦失所\n    附麗，應併予駁回。原審為上訴人敗訴之判決，及駁回其假\n    執行之聲請，於法尚無不合。上訴意旨指摘原判決不當，求\n    予廢棄改判，為無理由，應予駁回。\n七、本件事證已臻明確，兩造其餘攻擊防禦方法於本件判決結果\n    不生影響，故不再一一論述，併此明。\n八、據上論結，本件上訴為無理由，依民事訴訟法第449 條第1\n    項、第78條，判決如主文。"
  },
  "characters": {
    "judges": [
      "吳登輝",
      "鄭月霞"
    ],
    "prosecutors": [

    ],
    "lawyers": [
      "陳旻沂",
      "吳艾黎",
      "王仁聰",
      "有",
      "人或其法定代理人具有"
    ],
    "clerks": [

    ],
    "plaintiffs": [

    ],
    "defendants": [

    ],
    "prosecutor_office": [

    ],
    "creditors": [

    ],
    "debtors": [

    ],
    "judicial_associate_officer": [

    ]
  },
  "adjudged_at": "2010-05-12",
  "created_at": "2016-01-05 12:04:01",
  "updated_at": "2016-01-05 12:04:01"
}