{
  "identify": "KSH-98-交抗-876-20100104-1",
  "court": {
    "name": "臺灣高等法院",
    "code": "KSH"
  },
  "division": {
    "name": "刑事",
    "code": "M"
  },
  "year": 98,
  "word": "交抗",
  "number": "876",
  "jcheck": "1",
  "reason": "聲明異議",
  "content": "臺灣高等法院高雄分院刑事裁定         98年度交抗字第876號\n抗告人即\n原處分機關  交通部公路總局高雄區監理所屏東監理站\n代  表  人  乙○○\n受處分人    甲○○\n上列抗告人因聲明異議案件，不服臺灣屏東地方法院中華民國98\n年11月13日裁定（98年度交聲字第375 號），提起抗告，本院裁\n定如下：\n    主  文\n抗告駁回。\n    理  由\n一、本件經本院審理結果，認第一審裁定認事、用法均無違誤，\n    應予維持，並引用第一審裁定之理由及證據（如附件）。\n二、本件抗告意旨：如附件抗告狀所載。\n三、經查：本件受處分人甲○○酒後騎乘重型機車違反道路交通\n    管理處罰條例第35條第1 項第1 款規定，同時涉犯刑法第18\n    5 條之3 公共危險罪嫌，刑事部分經臺灣屏東地方法院檢察\n    署檢察官為緩起訴處分，並命受處分人向指定之公益團體、\n    地方自治團體支付新臺幣（下同）3 萬元，受處分人業已支\n    付3 萬元完畢，抗告人裁處受處分人罰鍰45,000元部分，應\n    扣除上開3 萬元之緩起訴處分金，受處分人僅需補繳罰鍰15\n    ,000元等情，業據原裁定論述甚詳。原審因而撤銷原處分罰\n    鍰45,000元部分，另諭知處罰鍰15,000元。經核原裁定並無\n    違誤，抗告意旨指摘原裁定不當，為無理由，應予駁回。\n四、據上論結，應依道路交通案件處理辦法第26條，刑事訴訟法\n    第412 條，裁定如主文。\n中    華    民    國    99    年    1     月    4     日\n                  刑事第九庭    審判長法  官  莊秋桃\n                                      法  官  田平安\n                                      法  官  范惠瑩\n以上正本證明與原本無異。\n不得再抗告。\n中    華    民    國    99    年    1     月    4     日\n                                      書記官  戴育婷",
  "structure": {
    "main": "抗告駁回。",
    "reason": "一、本件經本院審理結果，認第一審裁定認事、用法均無違誤，\n    應予維持，並引用第一審裁定之理由及證據（如附件）。\n二、本件抗告意旨：如附件抗告狀所載。\n三、經查：本件受處分人甲○○酒後騎乘重型機車違反道路交通\n    管理處罰條例第35條第1 項第1 款規定，同時涉犯刑法第18\n    5 條之3 公共危險罪嫌，刑事部分經臺灣屏東地方法院檢察\n    署檢察官為緩起訴處分，並命受處分人向指定之公益團體、\n    地方自治團體支付新臺幣（下同）3 萬元，受處分人業已支\n    付3 萬元完畢，抗告人裁處受處分人罰鍰45,000元部分，應\n    扣除上開3 萬元之緩起訴處分金，受處分人僅需補繳罰鍰15\n    ,000元等情，業據原裁定論述甚詳。原審因而撤銷原處分罰\n    鍰45,000元部分，另諭知處罰鍰15,000元。經核原裁定並無\n    違誤，抗告意旨指摘原裁定不當，為無理由，應予駁回。\n四、據上論結，應依道路交通案件處理辦法第26條，刑事訴訟法\n    第412 條，裁定如主文。"
  },
  "characters": {
    "judges": [
      "莊秋桃",
      "田平安",
      "范惠瑩"
    ],
    "prosecutors": [

    ],
    "lawyers": [

    ],
    "clerks": [

    ],
    "plaintiffs": [

    ],
    "defendants": [

    ],
    "prosecutor_office": [

    ],
    "creditors": [

    ],
    "debtors": [

    ],
    "judicial_associate_officer": [

    ]
  },
  "adjudged_at": "2010-01-04",
  "created_at": "2016-01-05 14:40:04",
  "updated_at": "2016-01-05 14:40:04"
}