{
  "identify": "KSH-97-上-133-20100105-2",
  "court": {
    "name": "臺灣高等法院",
    "code": "KSH"
  },
  "division": {
    "name": "民事",
    "code": "V"
  },
  "year": 97,
  "word": "上",
  "number": "133",
  "jcheck": "2",
  "reason": "損害賠償",
  "content": "臺灣高等法院高雄分院民事裁定           97年度上字第133號\n上  訴  人  墾丁馬爾地夫休閒興業有限公司\n法定代理人  張鈺娸\n訴訟代理人  鄭曉東律師\n            魏緒孟律師\n上列當事人與墾丁國家公園管理處間損害賠償事件，業經本院於\n98年12月9 日判決，並於同年12月17日送達判決正本予訴訟代理\n人。而上訴人法定代理人於98年4 月24日由甲○○變更為張鈺娸\n有經濟部函可稽（詳99年1 月4 日民事承受訴訟狀），因上訴人\n於本院有委任訴訟代理人，其訴訟程序固不因之當然停止，惟該\n訴訟代理權於同年12月17日判決正本送達訴訟代理人時即歸消滅\n，訴訟程序即當然停止。按訴訟程序於裁判送達後當然停止者，\n其承受訴訟之聲明，由為裁判之原法院裁定之，民事訴訟法第17\n7 條第3 項定有明文。上訴人之法定代理人張鈺娸於本院判決後\n之99年1 月4 日具狀聲明承受訴訟，依上開規定，應予准許。\n中    華    民    國    99    年    1     月    5     日\n                            民事第六庭\n                                審判長法官  許明進\n                                法      官  徐文祥\n                                法      官  張明振\n以上正本證明與原本無異。\n本件不得抗告。\n中    華    民    國    99    年    1     月    5     日\n                                書  記  官  熊惠津",
  "structure": {
  },
  "characters": {
    "judges": [
      "徐文祥",
      "張明振"
    ],
    "prosecutors": [

    ],
    "lawyers": [
      "鄭曉東",
      "魏緒孟"
    ],
    "clerks": [

    ],
    "plaintiffs": [

    ],
    "defendants": [

    ],
    "prosecutor_office": [

    ],
    "creditors": [

    ],
    "debtors": [

    ],
    "judicial_associate_officer": [

    ]
  },
  "adjudged_at": "2010-01-05",
  "created_at": "2016-01-05 15:11:25",
  "updated_at": "2016-01-05 15:11:25"
}