{
  "identify": "KSH-98-交抗-907-20100105-1",
  "court": {
    "name": "臺灣高等法院",
    "code": "KSH"
  },
  "division": {
    "name": "刑事",
    "code": "M"
  },
  "year": 98,
  "word": "交抗",
  "number": "907",
  "jcheck": "1",
  "reason": "聲明異議",
  "content": "臺灣高等法院高雄分院刑事裁定         98年度交抗字第907號\n抗  告  人  交通部公路總局高雄區監理所\n代  表  人  甲○○\n受處分  人  乙○○\n上列抗告人因受處分人違反道路交通管理處罰條例聲明異議案件\n，不服臺灣高雄地方法院中華民國98年11月30日裁定（98年度交\n聲字第3002號），提起抗告，本院裁定如下：\n    主  文\n抗告駁回。\n    理  由\n一、本件抗告意旨略以：\n(一)按緩起訴處分乃附條件之不起訴處分，本質上為不起訴處分\n    之一種，此觀諸刑事訴訟法第256 條規定自明。檢察官為緩\n    起訴處分時，依刑事訴訟法第253 條之2 第1 項規定，對被\n    告所為之指示及課予之負擔，似屬一種特殊之處遇措施，並\n    非刑罰。因此，刑事案件經檢察官為緩起訴處分確定後，視\n    同不起訴處分確定，依行政罰法第26條第2 項規定，及交通\n    部95年7 月17日交路字第0950006986號函之意旨，自得依違\n    反行政法上義務規定裁處受處分人49,500元，並無不當。\n(二)按汽車駕駛執照為駕駛汽車之許可證，我國依車輛分類區○\n    於道路交通安全規則第53條規定各類車種之駕駛執照，惟依\n    同規則第61條規定，民眾已具備較低級車類駕駛資格後，當\n    其取得高一級車類駕駛資格時，基於1 人1 照( 汽車駕駛執\n    照或機車駕駛執照) 之原則，係應換發較高一級車類之駕駛\n    執照，因其具備較低級車類之駕駛資格，故憑其換發取得較\n    高一級車類之駕駛執照，准其駕駛較低級車類之車輛。受處\n    分人違反道路交通管理處罰條例第35條第1 項第1 款「酒精\n    濃度超過規定標準」之規定，處一萬五千元以上六萬元以下\n    罰鍰，並當場移置保管該汽車及吊扣其駕駛執照一年。當吊\n    扣受處分人違規時駕駛資格之憑證。\n(三)查酒後駕車違規行為吊扣駕駛執照之目的並非僅為處罰違反\n    道路交通管理事件之行為人而已，尚有暫時禁止行為人於道\n    路上駕駛，以免造成用路人重大傷亡人。倘持職業聯結車駕\n    駛執照者酒後駕駛自用小客車違反道路交通管理處罰條例第\n    35條規定，但由於其無普通小型車駕駛執照而得以免於吊扣\n    處分，顯有違公平原則，更無異容許此不安全駕駛人仍可反\n    覆經常酒後駕駛，至對其他無辜用路人遭受危險性相對高，\n    此非對酒駕處分違規立法之目的，況以該駕駛人駕駛小客車\n    輕率酒後違規，漠視自身對保持交通安全之責任，亦不顧其\n    他用路人之生命、身體、健康之危害及他人家庭完整，生計\n    維持，自不得於酒後違規遭吊扣職業聯結車駕駛執照後，反\n    指自己工作權遭剝奪，家庭生計無法維持，豈為事理之平。\n    為加強道路交通管理，維護交通秩序，確保交通安全，請撤\n    銷原裁定等語。\n二、受處分人異議意旨略以：\n    異議人固然於上開時地酒後駕車為警查獲，但異議人因同一\n    酒駕行為，已經臺灣高雄地方法院檢察署檢察官為緩起訴處\n    分確定，異議人亦已履行緩起訴處分之條件，向國庫支付40\n    ,000元，並繳清在案，已有悔意；且異議人係職業司機，駕\n    照乃生活必須工具，又異議人現中風住院需長時間復健，為\n    此依法聲明異議，請准撤銷吊扣處分與罰款等語。\n三、經查：\n(一)原處分裁處罰鍰49,500元部分：\n(1)、按一行為同時觸犯刑事法律及違反行政法上義務規定者，依\n    刑事法律處罰之，但其行為應處以其他種類行政罰或得沒入\n    之物而未經法院宣告沒收者，亦得裁處之；前項行為如經不\n    起訴處分或為無罪、免訴、不受理、不付審理之裁判確定者\n    ，得依違反行政法上義務規定裁處之；次按汽車駕駛人，駕\n    駛汽車經測試檢定有酒精濃度超過規定標準之情形，同時違\n    反刑事法律者，經裁判確定處以罰金低於本條例第92條第3\n    項所訂最低罰鍰基準規定者，應依本條例裁決繳納不足最低\n    罰鍰之部分。行政罰法第26條定有道路交通管理處罰條例第\n    35條第1 項、第7 項、第8 項分別定有明文。\n(2)、本件異議人有於前揭時、地，飲酒後駕駛車牌號碼DY-4402\n    號自用小客貨車，經高雄縣政府警察局林園分局員警測得吐\n    氣所含酒精濃度超過每公升0.70毫克，員警乃填製本件舉發\n    通知單予以舉發，並經原處分機關裁處罰鍰49,500元、吊扣\n    駕駛執照12個月，並施以道安講習等情，為異議人所不爭執\n    ，並有酒精濃度測試單、本件舉發通知單、裁決書及其送達\n    證書各1 份在卷為憑，及原審依職權調閱臺灣高雄地方法院\n    檢察署97年度偵字第12258 號卷內之酒精測試報告表、刑法\n    第185 條之3 案件（酒後駕車）測試觀察紀錄表附於該案卷\n    內可稽，則異議人於前述時、地，確有酒精濃度超過規定標\n    準仍駕駛汽車之違規事實，堪以認定。\n(3)、異議人上開酒後駕車之行為，係屬同時觸犯刑事法律及違反\n    行政法上義務規定之行為，且前經緩起訴處分確定，異議人\n    並已支付國庫4 萬元，已產生實質刑罰之效果。揆諸前揭說\n    明，原處分機關對於異議人上開違規行為裁罰時，除依行政\n    罰法第26條第1 項但書之規定，對於其他種類行政罰即吊扣\n    駕駛執照及施以道路交通安全講習，仍得予以裁處外，就異\n    議人已支付之4 萬元部分，即不得重複裁罰，僅得依道路交\n    通管理處罰條例第35條第8 項之規定，裁決繳納不足最低罰\n    鍰之部分，即緩起訴處分所命支付國庫4 萬元與交通違規最\n    低罰鍰4 萬9,500 元之差額9,500 元之罰鍰（計算方式：4\n    萬9,500 元－4 萬元＝9,500 元），原處分機關遽為裁處受\n    處分人罰鍰4 萬9,500 元，其中4 萬元部分，顯違行政罰法\n    第26條第1 項前段關於一事不二罰之規定，自非合法。\n(二)原處分裁處吊扣駕駛執照12個月部分：\n(1)、又按汽車駕駛人飲用酒類或其他類似物後其吐氣所含酒精濃\n    度超過每公升0.25毫克以上，不得駕車；汽車駕駛人，駕駛\n    汽車經測試檢定酒精濃度超過規定標準，處汽車駕駛人1 萬\n    5 千元以上6 萬元以下罰鍰，並當場移置保管該汽車及吊扣\n    其駕駛執照1 年，道路交通安全規則第114 條第2款 、道路\n    交通管理處罰條例第35條第1 項第1 款分別定有明文。復按\n    道路交通管理處罰條例第68條業於94年12月14 日 修正，並\n    自95年3 月1 日施行，修正前之道路交通管理處罰條例第68\n    條規定：「汽車駕駛人，因違反本條例及道路交通安全規則\n    之規定，受吊扣或吊銷駕駛執照處分時，吊扣或吊銷其持有\n    各級車類之駕駛執照」，其立法意旨在於違規行為對道路交\n    通秩序之維持及道路交通安全已生較大之影響，故規定吊扣\n    或吊銷其持有各級車類之駕駛執照，以限制其繼續駕車行駛\n    道路之權利，其係屬駕駛行為之限制，並不因所持駕駛執照\n    種類不同而有所差異。而修正後之道路交通管理處罰條例第\n    68條規定：「汽車駕駛人，因違反本條例及道路交通安全規\n    則之規定，受吊銷駕駛執照處分時，吊銷其持有各級車類之\n    駕駛執照」，其立法理由略以：「原條文將違法或違規駕駛\n    人所持有各級車類之駕駛執照一併吊扣或吊銷，失之過酷，\n    影響人民工作及生活甚鉅，爰修正之」等語。故依修正後道\n    路交通管理處罰條例第68條之規定觀之，受吊扣駕駛執照處\n    分，不再吊扣其持有各級車類之駕駛執照，僅於受吊銷駕駛\n    執照處分時，始吊銷其持有各級車類之駕駛執照，而限縮修\n    正前條文之適用範圍，即受吊扣駕駛執照處分，不在本條規\n    定適用之列。是依上開規定受吊銷駕照處分者，仍維持吊銷\n    其持有各級車類之駕駛執照，至於受吊扣駕照處分者，則僅\n    吊扣其違法或違規當時所駕駛車輛之駕駛執照，不再吊扣其\n    持有各級車類之駕駛執照，其理甚明。\n(2)、本件受處分人係駕駛自小客貨車違反道路交通管理處罰條例\n    第35條第1 項第1 款之規定，揆諸前揭法律規定及說明意旨\n    ，原處分機關依法即僅能吊扣其小自客車駕駛執照，並無得\n    吊扣受處分人持有他級駕駛執照之依據，自不得因受處分人\n    未領有自小客車駕駛執照，即吊扣其職業大貨車之駕駛執照\n    以代之。是原處分機關以受處分人有上開違規行為，逕行裁\n    處吊扣受處分人之職業聯結車駕駛執照，已難謂係適法之處\n    分。又上開處置方式，雖可能產生無照駕駛之駕駛人，反而\n    較有照駕駛之駕駛人得受有毋需吊扣駕駛執照處罰利益之疑\n    慮，然行政行為，採取之方法所造成之損害不得與欲達成目\n    的之利益顯失均衡，為行政程序法第7 條第3 款所明定。\n(3)、本件受處分人並無自小客車駕駛執照可供吊扣，原處分機關\n    因此吊扣受處分人之職業大貨車駕駛執照，雖可能達成杜絕\n    受處分人將來繼續酒醉駕車之目的，惟亦同時造成剝奪受處\n    分人駕駛職業大貨車之結果，對其工作及生活影響甚大，甚\n    而危及其就業謀生問題，此所造成之損害，與欲達成目的之\n    利益顯失均衡，復與前揭道路交通管理處罰條例第68條之修\n    法意旨亦不相符合，益見其處分違法之處，自有未恰。\n(三)原處分裁處施以道路交通安全講習部分：\n    關於道路交通安全講習部分，則屬行政罰法第26條第1 項但\n    書所定罰鍰以外之其他種類行政罰之一，縱使受處分人同一\n    酒後駕駛行為業經依刑事法律處罰，惟因道路交通安全講習\n    兼具維護公共秩序之作用，仍得依道路交通管理處罰條例第\n    24條第1 項第2 款之規定予以裁處。\n四、本件受處分人酒後駕車因僅有一個交通違規行為，有關處罰\n    效果之罰鍰、吊扣駕駛執照、施以道路交通安全講習，與該\n    交通違規行為是否存在，均無從分離。法院審理時應先確定\n    異議人是否確有交通違規行為存在，再決定原處分機關所適\n    用之法律有無錯誤。受處分人如已對於原處分之一部分聲明\n    異議，法院即應就與違規行為無從分離之罰鍰、吊扣駕駛執\n    照、道路交通安全講習等全部處罰效果，併予審理。本件原\n    處分關於罰鍰4 萬9,500 元部分，其中4 萬元核係違反行政\n    罰法第26條第1 項前段之重複裁罰；吊扣職業聯結車駕駛執\n    照部分，則係違反道路交通管理處罰條例第68條之規定，均\n    非合法，原裁定以本件聲明異議，為有理由，原處分既有上\n    開可議，即無可維持，爰依道路交通案件處理辦法第20條之\n    規定，將原處分予以撤銷，且因受處分人未領有普通小型車\n    駕駛執照可供執行吊扣，命受處分人繳納不足最低罰鍰之部\n    分9,500 元之罰鍰，並施以道路交通安全講習，經核尚無不\n    合，抗告人仍執前詞提起抗告，指摘原裁定不當，為無理由\n    ，應予駁回。\n五、據上論結，應依道路交通案件處理辦法第26條，刑事訴訟法\n    第412 條，裁定如主文。\n中    華    民    國    99    年    1     月    5     日\n              刑事第六庭    審判長法  官  王憲義\n                                  法  官  邱永貴\n                                  法  官  簡志瑩\n以上正本證明與原本無異。\n不得再抗告。\n中    華    民    國    99    年    1     月    5     日\n                                  書記官  吳新貞",
  "structure": {
    "main": "抗告駁回。",
    "reason": "一、本件抗告意旨略以：\n(一)按緩起訴處分乃附條件之不起訴處分，本質上為不起訴處分\n    之一種，此觀諸刑事訴訟法第256 條規定自明。檢察官為緩\n    起訴處分時，依刑事訴訟法第253 條之2 第1 項規定，對被\n    告所為之指示及課予之負擔，似屬一種特殊之處遇措施，並\n    非刑罰。因此，刑事案件經檢察官為緩起訴處分確定後，視\n    同不起訴處分確定，依行政罰法第26條第2 項規定，及交通\n    部95年7 月17日交路字第0950006986號函之意旨，自得依違\n    反行政法上義務規定裁處受處分人49,500元，並無不當。\n(二)按汽車駕駛執照為駕駛汽車之許可證，我國依車輛分類區○\n    於道路交通安全規則第53條規定各類車種之駕駛執照，惟依\n    同規則第61條規定，民眾已具備較低級車類駕駛資格後，當\n    其取得高一級車類駕駛資格時，基於1 人1 照( 汽車駕駛執\n    照或機車駕駛執照) 之原則，係應換發較高一級車類之駕駛\n    執照，因其具備較低級車類之駕駛資格，故憑其換發取得較\n    高一級車類之駕駛執照，准其駕駛較低級車類之車輛。受處\n    分人違反道路交通管理處罰條例第35條第1 項第1 款「酒精\n    濃度超過規定標準」之規定，處一萬五千元以上六萬元以下\n    罰鍰，並當場移置保管該汽車及吊扣其駕駛執照一年。當吊\n    扣受處分人違規時駕駛資格之憑證。\n(三)查酒後駕車違規行為吊扣駕駛執照之目的並非僅為處罰違反\n    道路交通管理事件之行為人而已，尚有暫時禁止行為人於道\n    路上駕駛，以免造成用路人重大傷亡人。倘持職業聯結車駕\n    駛執照者酒後駕駛自用小客車違反道路交通管理處罰條例第\n    35條規定，但由於其無普通小型車駕駛執照而得以免於吊扣\n    處分，顯有違公平原則，更無異容許此不安全駕駛人仍可反\n    覆經常酒後駕駛，至對其他無辜用路人遭受危險性相對高，\n    此非對酒駕處分違規立法之目的，況以該駕駛人駕駛小客車\n    輕率酒後違規，漠視自身對保持交通安全之責任，亦不顧其\n    他用路人之生命、身體、健康之危害及他人家庭完整，生計\n    維持，自不得於酒後違規遭吊扣職業聯結車駕駛執照後，反\n    指自己工作權遭剝奪，家庭生計無法維持，豈為事理之平。\n    為加強道路交通管理，維護交通秩序，確保交通安全，請撤\n    銷原裁定等語。\n二、受處分人異議意旨略以：\n    異議人固然於上開時地酒後駕車為警查獲，但異議人因同一\n    酒駕行為，已經臺灣高雄地方法院檢察署檢察官為緩起訴處\n    分確定，異議人亦已履行緩起訴處分之條件，向國庫支付40\n    ,000元，並繳清在案，已有悔意；且異議人係職業司機，駕\n    照乃生活必須工具，又異議人現中風住院需長時間復健，為\n    此依法聲明異議，請准撤銷吊扣處分與罰款等語。\n三、經查：\n(一)原處分裁處罰鍰49,500元部分：\n(1)、按一行為同時觸犯刑事法律及違反行政法上義務規定者，依\n    刑事法律處罰之，但其行為應處以其他種類行政罰或得沒入\n    之物而未經法院宣告沒收者，亦得裁處之；前項行為如經不\n    起訴處分或為無罪、免訴、不受理、不付審理之裁判確定者\n    ，得依違反行政法上義務規定裁處之；次按汽車駕駛人，駕\n    駛汽車經測試檢定有酒精濃度超過規定標準之情形，同時違\n    反刑事法律者，經裁判確定處以罰金低於本條例第92條第3\n    項所訂最低罰鍰基準規定者，應依本條例裁決繳納不足最低\n    罰鍰之部分。行政罰法第26條定有道路交通管理處罰條例第\n    35條第1 項、第7 項、第8 項分別定有明文。\n(2)、本件異議人有於前揭時、地，飲酒後駕駛車牌號碼DY-4402\n    號自用小客貨車，經高雄縣政府警察局林園分局員警測得吐\n    氣所含酒精濃度超過每公升0.70毫克，員警乃填製本件舉發\n    通知單予以舉發，並經原處分機關裁處罰鍰49,500元、吊扣\n    駕駛執照12個月，並施以道安講習等情，為異議人所不爭執\n    ，並有酒精濃度測試單、本件舉發通知單、裁決書及其送達\n    證書各1 份在卷為憑，及原審依職權調閱臺灣高雄地方法院\n    檢察署97年度偵字第12258 號卷內之酒精測試報告表、刑法\n    第185 條之3 案件（酒後駕車）測試觀察紀錄表附於該案卷\n    內可稽，則異議人於前述時、地，確有酒精濃度超過規定標\n    準仍駕駛汽車之違規事實，堪以認定。\n(3)、異議人上開酒後駕車之行為，係屬同時觸犯刑事法律及違反\n    行政法上義務規定之行為，且前經緩起訴處分確定，異議人\n    並已支付國庫4 萬元，已產生實質刑罰之效果。揆諸前揭說\n    明，原處分機關對於異議人上開違規行為裁罰時，除依行政\n    罰法第26條第1 項但書之規定，對於其他種類行政罰即吊扣\n    駕駛執照及施以道路交通安全講習，仍得予以裁處外，就異\n    議人已支付之4 萬元部分，即不得重複裁罰，僅得依道路交\n    通管理處罰條例第35條第8 項之規定，裁決繳納不足最低罰\n    鍰之部分，即緩起訴處分所命支付國庫4 萬元與交通違規最\n    低罰鍰4 萬9,500 元之差額9,500 元之罰鍰（計算方式：4\n    萬9,500 元－4 萬元＝9,500 元），原處分機關遽為裁處受\n    處分人罰鍰4 萬9,500 元，其中4 萬元部分，顯違行政罰法\n    第26條第1 項前段關於一事不二罰之規定，自非合法。\n(二)原處分裁處吊扣駕駛執照12個月部分：\n(1)、又按汽車駕駛人飲用酒類或其他類似物後其吐氣所含酒精濃\n    度超過每公升0.25毫克以上，不得駕車；汽車駕駛人，駕駛\n    汽車經測試檢定酒精濃度超過規定標準，處汽車駕駛人1 萬\n    5 千元以上6 萬元以下罰鍰，並當場移置保管該汽車及吊扣\n    其駕駛執照1 年，道路交通安全規則第114 條第2款 、道路\n    交通管理處罰條例第35條第1 項第1 款分別定有明文。復按\n    道路交通管理處罰條例第68條業於94年12月14 日 修正，並\n    自95年3 月1 日施行，修正前之道路交通管理處罰條例第68\n    條規定：「汽車駕駛人，因違反本條例及道路交通安全規則\n    之規定，受吊扣或吊銷駕駛執照處分時，吊扣或吊銷其持有\n    各級車類之駕駛執照」，其立法意旨在於違規行為對道路交\n    通秩序之維持及道路交通安全已生較大之影響，故規定吊扣\n    或吊銷其持有各級車類之駕駛執照，以限制其繼續駕車行駛\n    道路之權利，其係屬駕駛行為之限制，並不因所持駕駛執照\n    種類不同而有所差異。而修正後之道路交通管理處罰條例第\n    68條規定：「汽車駕駛人，因違反本條例及道路交通安全規\n    則之規定，受吊銷駕駛執照處分時，吊銷其持有各級車類之\n    駕駛執照」，其立法理由略以：「原條文將違法或違規駕駛\n    人所持有各級車類之駕駛執照一併吊扣或吊銷，失之過酷，\n    影響人民工作及生活甚鉅，爰修正之」等語。故依修正後道\n    路交通管理處罰條例第68條之規定觀之，受吊扣駕駛執照處\n    分，不再吊扣其持有各級車類之駕駛執照，僅於受吊銷駕駛\n    執照處分時，始吊銷其持有各級車類之駕駛執照，而限縮修\n    正前條文之適用範圍，即受吊扣駕駛執照處分，不在本條規\n    定適用之列。是依上開規定受吊銷駕照處分者，仍維持吊銷\n    其持有各級車類之駕駛執照，至於受吊扣駕照處分者，則僅\n    吊扣其違法或違規當時所駕駛車輛之駕駛執照，不再吊扣其\n    持有各級車類之駕駛執照，其理甚明。\n(2)、本件受處分人係駕駛自小客貨車違反道路交通管理處罰條例\n    第35條第1 項第1 款之規定，揆諸前揭法律規定及說明意旨\n    ，原處分機關依法即僅能吊扣其小自客車駕駛執照，並無得\n    吊扣受處分人持有他級駕駛執照之依據，自不得因受處分人\n    未領有自小客車駕駛執照，即吊扣其職業大貨車之駕駛執照\n    以代之。是原處分機關以受處分人有上開違規行為，逕行裁\n    處吊扣受處分人之職業聯結車駕駛執照，已難謂係適法之處\n    分。又上開處置方式，雖可能產生無照駕駛之駕駛人，反而\n    較有照駕駛之駕駛人得受有毋需吊扣駕駛執照處罰利益之疑\n    慮，然行政行為，採取之方法所造成之損害不得與欲達成目\n    的之利益顯失均衡，為行政程序法第7 條第3 款所明定。\n(3)、本件受處分人並無自小客車駕駛執照可供吊扣，原處分機關\n    因此吊扣受處分人之職業大貨車駕駛執照，雖可能達成杜絕\n    受處分人將來繼續酒醉駕車之目的，惟亦同時造成剝奪受處\n    分人駕駛職業大貨車之結果，對其工作及生活影響甚大，甚\n    而危及其就業謀生問題，此所造成之損害，與欲達成目的之\n    利益顯失均衡，復與前揭道路交通管理處罰條例第68條之修\n    法意旨亦不相符合，益見其處分違法之處，自有未恰。\n(三)原處分裁處施以道路交通安全講習部分：\n    關於道路交通安全講習部分，則屬行政罰法第26條第1 項但\n    書所定罰鍰以外之其他種類行政罰之一，縱使受處分人同一\n    酒後駕駛行為業經依刑事法律處罰，惟因道路交通安全講習\n    兼具維護公共秩序之作用，仍得依道路交通管理處罰條例第\n    24條第1 項第2 款之規定予以裁處。\n四、本件受處分人酒後駕車因僅有一個交通違規行為，有關處罰\n    效果之罰鍰、吊扣駕駛執照、施以道路交通安全講習，與該\n    交通違規行為是否存在，均無從分離。法院審理時應先確定\n    異議人是否確有交通違規行為存在，再決定原處分機關所適\n    用之法律有無錯誤。受處分人如已對於原處分之一部分聲明\n    異議，法院即應就與違規行為無從分離之罰鍰、吊扣駕駛執\n    照、道路交通安全講習等全部處罰效果，併予審理。本件原\n    處分關於罰鍰4 萬9,500 元部分，其中4 萬元核係違反行政\n    罰法第26條第1 項前段之重複裁罰；吊扣職業聯結車駕駛執\n    照部分，則係違反道路交通管理處罰條例第68條之規定，均\n    非合法，原裁定以本件聲明異議，為有理由，原處分既有上\n    開可議，即無可維持，爰依道路交通案件處理辦法第20條之\n    規定，將原處分予以撤銷，且因受處分人未領有普通小型車\n    駕駛執照可供執行吊扣，命受處分人繳納不足最低罰鍰之部\n    分9,500 元之罰鍰，並施以道路交通安全講習，經核尚無不\n    合，抗告人仍執前詞提起抗告，指摘原裁定不當，為無理由\n    ，應予駁回。\n五、據上論結，應依道路交通案件處理辦法第26條，刑事訴訟法\n    第412 條，裁定如主文。"
  },
  "characters": {
    "judges": [
      "王憲義",
      "邱永貴",
      "簡志瑩"
    ],
    "prosecutors": [

    ],
    "lawyers": [

    ],
    "clerks": [

    ],
    "plaintiffs": [

    ],
    "defendants": [

    ],
    "prosecutor_office": [

    ],
    "creditors": [

    ],
    "debtors": [

    ],
    "judicial_associate_officer": [

    ]
  },
  "adjudged_at": "2010-01-05",
  "created_at": "2016-01-05 15:10:43",
  "updated_at": "2016-01-05 15:10:43"
}