{
  "identify": "KSH-98-交抗-912-20100104-1",
  "court": {
    "name": "臺灣高等法院",
    "code": "KSH"
  },
  "division": {
    "name": "刑事",
    "code": "M"
  },
  "year": 98,
  "word": "交抗",
  "number": "912",
  "jcheck": "1",
  "reason": "聲明異議",
  "content": "臺灣高等法院高雄分院刑事裁定         98年度交抗字第912號\n    抗  告  人  交通部公路總局高雄區監理所\n    代  表  人  乙○○\n    受  處分人  甲○○\n上列抗告人因違反道路交通管理處罰條例聲明異議案件，不服臺\n灣高雄地方法院中華民國98年12月2 日裁定（98年度交聲字第31\n47號），提起抗告，本院裁定如下：\n    主  文\n抗告駁回。\n    理  由\n一、抗告意旨略以：(一)道路交通管理處罰條例第35條第1 項「汽\n    車駕駛人，駕駛汽車經測試檢定有酒精濃度超過規定標準之\n    情形者，處1 萬5 千元以上6 萬元以下罰鍰，並當場移置保\n    管其車輛及吊扣其駕駛執照1 年；‧‧一酒精濃度超過規定\n    標準。」、次查道路交通管理處罰條例第68條新修正條文，\n    並無免除之規定。94年12月14日修正前之道路交通管理處罰\n    條例第68條則規定「汽車駕駛人，因違反本條例及道路交通\n    安全規則之規定，受吊扣或吊銷駕駛執照處分時，吊扣或吊\n    銷其持有各級車類之駕駛執照。」係配合94年12月14日公布\n    修正前同條例第65條第1 項第3 款易處吊扣駕駛執照，係針\n    對易處吊扣制度作修正，對於原處分吊扣駕照並不影響。(二)\n    酒駕違規行為吊扣駕駛執照之目的，並非僅為處罰違反道路\n    交通管理事件之行為人而已，尚有以暫時禁止行為人於道路\n    上駕駛，以免其短期內再犯之用意，倘若無考領機車駕照而\n    得以免於吊扣處分，顯有違公平原則，此非酒駕違規立法之\n    目的。(三)本案異議人以領有普通大貨車駕駛執照駕駛自用小\n    客車違規屬實，自應以違規行為時所憑之普通大貨車駕駛執\n    照執行吊扣之，故本所依規定裁處吊扣普通大貨車駕駛執照\n    12個月處分，施以道安講習，於法自無不合。為此提起抗告\n    ，請求鈞院撤銷原裁定，維持本所裁決云云。\n二、原裁定意旨略以：(一)本件異議人甲○○前於民國97年4 月26\n    日23時45分許，因酒後駕駛車牌號碼VI-4919 號自用小客車\n    ，經警攔檢，經警測試檢定酒精濃度每公升0.74毫克，為警\n    掣單舉發，並移送法辦，並經原處分機關依道路交通管理處\n    罰條例第35條第1 項第1 款規定，裁處吊扣其普通大貨車駕\n    駛執照12個月並施以道路交通安全講習，有交通部公路總局\n    高雄區監理所高監自裁字第裁80-N00000000號違反道路交通\n    管理事件裁決書、高雄縣政府警察局高警交字第NO-0000000\n    號舉發違反道路交通管理事件通知單在卷可稽，復為異議人\n    所不爭執，是上開事實，均堪認定。(二)異議人雖以原處分機\n    關吊扣駕照之裁罰違反一事不二罰原則云云置辯，然依行政\n    罰法第26條第1 項規定，行為人以一行為同時觸犯刑事法律\n    及違反行政法上義務規定者，依刑事法律處罰之，但其行為\n    應處以其他種類行政罰或得沒入之物而未經法院宣告沒收者\n    ，亦得裁處之，故行政機關應依法吊扣汽車駕駛人之駕駛執\n    照1 年，且該吊扣駕駛執照之處分，係屬達成遏止酒後駕車\n    不法行為以維道路交通安全之行政目的，兼具維護公共秩序\n    之作用，而有別於罰鍰以外之其他種類行政罰，為達行政目\n    的，原處分機關仍得併予裁處，異議人所辯情詞，尚無可採\n    。(三)異議人於本件違規時駕駛車牌號碼VI-4919 號自用小客\n    車，且其僅持有普通大貨車駕駛執照，而原處分機關上開裁\n    決所指應吊扣之異議人「普貨」駕駛執照，應係指異議人之\n    普通大貨車駕駛執照，有公路監理電子閘門證號查詢汽車駕\n    駛人及原處分機關裁決書各1 份在卷可稽，是揆諸前揭說明\n    ，本件異議人既係駕駛自用小客車違反道路交通管理處罰條\n    例第35條第1 項第1 款之規定，依法即僅能吊扣其自用小客\n    車駕駛執照，並無得吊扣異議人持有他級駕駛執照之依據，\n    原處分機關以異議人有上開違規行為，裁處吊扣異議人之普\n    通大貨車駕駛執照，已難謂係適法之處分，是本件異議為有\n    理由，原處分關於裁處吊扣普通大貨車駕駛執照12個月部分\n    ，自應由本院予以撤銷，並就此部分另為不罰之諭知等語。\n三、按汽車駕駛人飲用酒類後其吐氣所含酒精濃度超過每公升0.\n    25毫克者，不得駕車；汽車駕駛人，駕駛汽車經測試檢定有\n    酒精濃度超過規定標準者，處15,000元以上60,000元以下罰\n    鍰，並當場移置保管其車輛及吊扣其駕駛執照1 年，道路交\n    通管理處罰條例第35條第1 項第1 款，道路交通安全規則第\n    114 條第2 款、分別定有明文；又於94年12月14日修正、95\n    年3 月1 日施行之道路交通管理處罰條例第68條，原規定：\n    「汽車駕駛人，因違反本條例及道路交通安全規則之規定，\n    受吊扣或吊銷駕駛執照處分時，吊扣或吊銷其持有各級車類\n    之駕駛執照」，惟修正後業已刪除『吊扣』之規定，改為：\n    「汽車駕駛人，因違反本條例及道路交通安全規則之規定，\n    受吊銷駕駛執照處分時，吊銷其持有各級車類之駕駛執照」\n    ，其修正理由乃係舊法將違法或違規駕駛人所持有各級車類\n    之駕駛執照一併吊扣，失之過酷，影響人民工作及生活甚鉅\n    ，而刪除吊扣駕駛人駕駛執照時，應吊扣駕駛人持有各級車\n    類駕駛執照之規定，是依現行道路交通管理處罰條例，已無\n    得吊扣駕駛人所持有他級駕駛執照之依據存在，從而，於為\n    吊扣駕駛人駕駛執照之處分時，自僅得吊扣駕駛人違規時所\n    駕駛該級車類之駕駛執照，以限制其繼續駕駛該級車類行駛\n    道路之權利，若駕駛人並無該級車類之駕駛執照，即無從執\n    行吊扣駕駛執照之處分，而僅係應否依道路交通管理處罰條\n    例第22條第1 項規定處罰駕駛人之問題。\n四、經查：\n  (一)受處分人於民國97年4 月26日23時45分許，因酒後駕駛車牌\n    號碼VI-4919 號自用小客車，行經高雄縣橋頭鄉○○路過埤\n    橋前，因行車不穩，經警攔檢，經警測試檢定酒精濃度每公\n    升0.74毫克，為警掣單舉發，並移送法辦，經原審以97年度\n    審交簡字第1780號判處拘役35日，並經原處分機關依道路交\n    通管理處罰條例第35條第1 項第1 款規定，裁處吊扣其普貨\n    駕駛執照12個月並施以道安講習之事實，業據受處分人自承\n    在卷，並有高雄縣政府警察局舉發違反道路交通管理事件通\n    知單影本、原處分機關交通部公路總局高雄區監理所98年11\n    月24日高監自裁字第裁80-N00000000號違反道路交通管理事\n    件裁決書、違反道路交通管理事件不服裁決聲明異議案件移\n    送書各1 份附於原審卷可稽，堪以認定。\n  (二)受處分人於本件違規時，並無自用小客車駕駛執照，僅有普\n    通大貨車駕駛執照，而原處分機關上開裁決所指應吊扣之受\n    處分人汽車駕駛執照，係指受處分人之普通大貨車駕駛執照\n    等事實，有原處分機關違反道路交通管理事件不服裁決聲明\n    異議案件移送書1 紙在原審卷足憑。\n  (三)本件受處分人既係駕駛自用小客車違反道路交通管理處罰條\n    例第35條第1 項第1 款之規定，揆諸前揭法律規定及說明意\n    旨，原處分機關依法即僅能吊扣其自用小客車駕駛執照，並\n    無得吊扣受處分人持有他級駕駛執照之依據，自不得因受處\n    分人未領有自用小客車駕駛執照，即吊扣其普通大貨車駕駛\n    執照以代之。是原處分機關以受處分人有上開違規行為，逕\n    行裁處吊扣受處分人之普通大貨車駕駛執照，已難謂係適法\n    之處分。又上開處置方式，雖可能產生無照駕駛之駕駛人，\n    反而較有照駕駛之駕駛人得受有毋需吊扣駕駛執照處罰利益\n    之疑慮，然行政行為，採取之方法所造成之損害不得與欲達\n    成目的之利益顯失均衡，為行政程序法第7 條第3 款所明定\n    ，本件受處分人目前並無自用小客車駕駛執照可供吊扣，原\n    處分機關因此吊扣受處分人之普通大貨車駕駛執照，雖可達\n    成完全杜絕受處分人將來繼續酒醉駕車之目的，惟亦同時造\n    成剝奪受處分人駕駛普通大貨車之結果，對其生活影響甚大\n    ，甚而危及其就業謀生問題，此所造成之損害，與欲達成目\n    的之利益（限制受處分人駕駛普通大貨車，以預防酒醉駕駛\n    自用小客車造成之危害）顯失均衡，復與前揭道路交通管理\n    處罰條例第68條之修法意旨亦不相符，益見其處分違法之處\n    ，自有未恰。\n五、原審裁定審酌本件受處分人甲○○既無自用小客車駕駛執照\n    ，自不得逾越法律之規定，將受處分人之普通大貨車駕駛執\n    照予以吊扣。從而，認本件受處分人異議為有理由，而裁定\n    撤銷原處分關於裁處吊扣受處分人普通大貨車駕駛執照12個\n    月部分，經核並無違誤。抗告人抗告意旨，仍執陳詞，指摘\n    原裁定不當，為無理由，應予駁回。至原處分關於罰鍰及施\n    以道安講習之部分，異議人於原審時並未聲明異議，故不在\n    原審審究範圍內，亦不在本院之抗告範圍內，附此敘明。\n六、據上論結，應依道路交通案件處理辦法第26條，刑事訴訟法\n    第412 條，裁定如主文。\n中    華    民    國    99    年    1     月    4     日\n                  刑事第二庭  審判長法  官  林正雄\n                                    法  官  陳啟造\n                                    法  官  黃壽燕\n以上正本證明與原本無異。\n不得再抗告。\n中    華    民    國    99    年    1     月    4     日\n                                    書記官  鄭翠芬",
  "structure": {
    "main": "抗告駁回。",
    "reason": "一、抗告意旨略以：(一)道路交通管理處罰條例第35條第1 項「汽\n    車駕駛人，駕駛汽車經測試檢定有酒精濃度超過規定標準之\n    情形者，處1 萬5 千元以上6 萬元以下罰鍰，並當場移置保\n    管其車輛及吊扣其駕駛執照1 年；‧‧一酒精濃度超過規定\n    標準。」、次查道路交通管理處罰條例第68條新修正條文，\n    並無免除之規定。94年12月14日修正前之道路交通管理處罰\n    條例第68條則規定「汽車駕駛人，因違反本條例及道路交通\n    安全規則之規定，受吊扣或吊銷駕駛執照處分時，吊扣或吊\n    銷其持有各級車類之駕駛執照。」係配合94年12月14日公布\n    修正前同條例第65條第1 項第3 款易處吊扣駕駛執照，係針\n    對易處吊扣制度作修正，對於原處分吊扣駕照並不影響。(二)\n    酒駕違規行為吊扣駕駛執照之目的，並非僅為處罰違反道路\n    交通管理事件之行為人而已，尚有以暫時禁止行為人於道路\n    上駕駛，以免其短期內再犯之用意，倘若無考領機車駕照而\n    得以免於吊扣處分，顯有違公平原則，此非酒駕違規立法之\n    目的。(三)本案異議人以領有普通大貨車駕駛執照駕駛自用小\n    客車違規屬實，自應以違規行為時所憑之普通大貨車駕駛執\n    照執行吊扣之，故本所依規定裁處吊扣普通大貨車駕駛執照\n    12個月處分，施以道安講習，於法自無不合。為此提起抗告\n    ，請求鈞院撤銷原裁定，維持本所裁決云云。\n二、原裁定意旨略以：(一)本件異議人甲○○前於民國97年4 月26\n    日23時45分許，因酒後駕駛車牌號碼VI-4919 號自用小客車\n    ，經警攔檢，經警測試檢定酒精濃度每公升0.74毫克，為警\n    掣單舉發，並移送法辦，並經原處分機關依道路交通管理處\n    罰條例第35條第1 項第1 款規定，裁處吊扣其普通大貨車駕\n    駛執照12個月並施以道路交通安全講習，有交通部公路總局\n    高雄區監理所高監自裁字第裁80-N00000000號違反道路交通\n    管理事件裁決書、高雄縣政府警察局高警交字第NO-0000000\n    號舉發違反道路交通管理事件通知單在卷可稽，復為異議人\n    所不爭執，是上開事實，均堪認定。(二)異議人雖以原處分機\n    關吊扣駕照之裁罰違反一事不二罰原則云云置辯，然依行政\n    罰法第26條第1 項規定，行為人以一行為同時觸犯刑事法律\n    及違反行政法上義務規定者，依刑事法律處罰之，但其行為\n    應處以其他種類行政罰或得沒入之物而未經法院宣告沒收者\n    ，亦得裁處之，故行政機關應依法吊扣汽車駕駛人之駕駛執\n    照1 年，且該吊扣駕駛執照之處分，係屬達成遏止酒後駕車\n    不法行為以維道路交通安全之行政目的，兼具維護公共秩序\n    之作用，而有別於罰鍰以外之其他種類行政罰，為達行政目\n    的，原處分機關仍得併予裁處，異議人所辯情詞，尚無可採\n    。(三)異議人於本件違規時駕駛車牌號碼VI-4919 號自用小客\n    車，且其僅持有普通大貨車駕駛執照，而原處分機關上開裁\n    決所指應吊扣之異議人「普貨」駕駛執照，應係指異議人之\n    普通大貨車駕駛執照，有公路監理電子閘門證號查詢汽車駕\n    駛人及原處分機關裁決書各1 份在卷可稽，是揆諸前揭說明\n    ，本件異議人既係駕駛自用小客車違反道路交通管理處罰條\n    例第35條第1 項第1 款之規定，依法即僅能吊扣其自用小客\n    車駕駛執照，並無得吊扣異議人持有他級駕駛執照之依據，\n    原處分機關以異議人有上開違規行為，裁處吊扣異議人之普\n    通大貨車駕駛執照，已難謂係適法之處分，是本件異議為有\n    理由，原處分關於裁處吊扣普通大貨車駕駛執照12個月部分\n    ，自應由本院予以撤銷，並就此部分另為不罰之諭知等語。\n三、按汽車駕駛人飲用酒類後其吐氣所含酒精濃度超過每公升0.\n    25毫克者，不得駕車；汽車駕駛人，駕駛汽車經測試檢定有\n    酒精濃度超過規定標準者，處15,000元以上60,000元以下罰\n    鍰，並當場移置保管其車輛及吊扣其駕駛執照1 年，道路交\n    通管理處罰條例第35條第1 項第1 款，道路交通安全規則第\n    114 條第2 款、分別定有明文；又於94年12月14日修正、95\n    年3 月1 日施行之道路交通管理處罰條例第68條，原規定：\n    「汽車駕駛人，因違反本條例及道路交通安全規則之規定，\n    受吊扣或吊銷駕駛執照處分時，吊扣或吊銷其持有各級車類\n    之駕駛執照」，惟修正後業已刪除『吊扣』之規定，改為：\n    「汽車駕駛人，因違反本條例及道路交通安全規則之規定，\n    受吊銷駕駛執照處分時，吊銷其持有各級車類之駕駛執照」\n    ，其修正理由乃係舊法將違法或違規駕駛人所持有各級車類\n    之駕駛執照一併吊扣，失之過酷，影響人民工作及生活甚鉅\n    ，而刪除吊扣駕駛人駕駛執照時，應吊扣駕駛人持有各級車\n    類駕駛執照之規定，是依現行道路交通管理處罰條例，已無\n    得吊扣駕駛人所持有他級駕駛執照之依據存在，從而，於為\n    吊扣駕駛人駕駛執照之處分時，自僅得吊扣駕駛人違規時所\n    駕駛該級車類之駕駛執照，以限制其繼續駕駛該級車類行駛\n    道路之權利，若駕駛人並無該級車類之駕駛執照，即無從執\n    行吊扣駕駛執照之處分，而僅係應否依道路交通管理處罰條\n    例第22條第1 項規定處罰駕駛人之問題。\n四、經查：\n  (一)受處分人於民國97年4 月26日23時45分許，因酒後駕駛車牌\n    號碼VI-4919 號自用小客車，行經高雄縣橋頭鄉○○路過埤\n    橋前，因行車不穩，經警攔檢，經警測試檢定酒精濃度每公\n    升0.74毫克，為警掣單舉發，並移送法辦，經原審以97年度\n    審交簡字第1780號判處拘役35日，並經原處分機關依道路交\n    通管理處罰條例第35條第1 項第1 款規定，裁處吊扣其普貨\n    駕駛執照12個月並施以道安講習之事實，業據受處分人自承\n    在卷，並有高雄縣政府警察局舉發違反道路交通管理事件通\n    知單影本、原處分機關交通部公路總局高雄區監理所98年11\n    月24日高監自裁字第裁80-N00000000號違反道路交通管理事\n    件裁決書、違反道路交通管理事件不服裁決聲明異議案件移\n    送書各1 份附於原審卷可稽，堪以認定。\n  (二)受處分人於本件違規時，並無自用小客車駕駛執照，僅有普\n    通大貨車駕駛執照，而原處分機關上開裁決所指應吊扣之受\n    處分人汽車駕駛執照，係指受處分人之普通大貨車駕駛執照\n    等事實，有原處分機關違反道路交通管理事件不服裁決聲明\n    異議案件移送書1 紙在原審卷足憑。\n  (三)本件受處分人既係駕駛自用小客車違反道路交通管理處罰條\n    例第35條第1 項第1 款之規定，揆諸前揭法律規定及說明意\n    旨，原處分機關依法即僅能吊扣其自用小客車駕駛執照，並\n    無得吊扣受處分人持有他級駕駛執照之依據，自不得因受處\n    分人未領有自用小客車駕駛執照，即吊扣其普通大貨車駕駛\n    執照以代之。是原處分機關以受處分人有上開違規行為，逕\n    行裁處吊扣受處分人之普通大貨車駕駛執照，已難謂係適法\n    之處分。又上開處置方式，雖可能產生無照駕駛之駕駛人，\n    反而較有照駕駛之駕駛人得受有毋需吊扣駕駛執照處罰利益\n    之疑慮，然行政行為，採取之方法所造成之損害不得與欲達\n    成目的之利益顯失均衡，為行政程序法第7 條第3 款所明定\n    ，本件受處分人目前並無自用小客車駕駛執照可供吊扣，原\n    處分機關因此吊扣受處分人之普通大貨車駕駛執照，雖可達\n    成完全杜絕受處分人將來繼續酒醉駕車之目的，惟亦同時造\n    成剝奪受處分人駕駛普通大貨車之結果，對其生活影響甚大\n    ，甚而危及其就業謀生問題，此所造成之損害，與欲達成目\n    的之利益（限制受處分人駕駛普通大貨車，以預防酒醉駕駛\n    自用小客車造成之危害）顯失均衡，復與前揭道路交通管理\n    處罰條例第68條之修法意旨亦不相符，益見其處分違法之處\n    ，自有未恰。\n五、原審裁定審酌本件受處分人甲○○既無自用小客車駕駛執照\n    ，自不得逾越法律之規定，將受處分人之普通大貨車駕駛執\n    照予以吊扣。從而，認本件受處分人異議為有理由，而裁定\n    撤銷原處分關於裁處吊扣受處分人普通大貨車駕駛執照12個\n    月部分，經核並無違誤。抗告人抗告意旨，仍執陳詞，指摘\n    原裁定不當，為無理由，應予駁回。至原處分關於罰鍰及施\n    以道安講習之部分，異議人於原審時並未聲明異議，故不在\n    原審審究範圍內，亦不在本院之抗告範圍內，附此敘明。\n六、據上論結，應依道路交通案件處理辦法第26條，刑事訴訟法\n    第412 條，裁定如主文。"
  },
  "characters": {
    "judges": [
      "林正雄",
      "陳啟造",
      "黃壽燕"
    ],
    "prosecutors": [

    ],
    "lawyers": [

    ],
    "clerks": [

    ],
    "plaintiffs": [

    ],
    "defendants": [

    ],
    "prosecutor_office": [

    ],
    "creditors": [

    ],
    "debtors": [

    ],
    "judicial_associate_officer": [

    ]
  },
  "adjudged_at": "2010-01-04",
  "created_at": "2016-01-05 14:39:37",
  "updated_at": "2016-01-05 14:39:37"
}