{
  "identify": "KSH-99-上訴-801-20100512-1",
  "court": {
    "name": "臺灣高等法院",
    "code": "KSH"
  },
  "division": {
    "name": "刑事",
    "code": "M"
  },
  "year": 99,
  "word": "上訴",
  "number": "801",
  "jcheck": "1",
  "reason": "違反毒品危害防制條例等",
  "content": "臺灣高等法院高雄分院刑事判決         99年度上訴字第801號\n上  訴  人\n即  被  告  甲○○\n上列上訴人因違反毒品危害防制條例等案件，不服臺灣高雄地方\n法院98年度訴字第1608號中華民國99年3 月5 日第一審判決（起\n訴案號：臺灣高雄地方法院檢察署98年度偵字第21971 、21974\n號），提起上訴，本院判決如下：\n     主  文\n上訴駁回。\n     理  由\n一、按上訴書狀應敘述具體理由；又第二審法院認為上訴書狀未\n    敘述理由或上訴有刑事訴訟法第362 條前段之情形者，應以\n    判決駁回之，同法第361 條第2 項、第367 條前段定有明文\n    。\n二、經查，上訴人即被告甲○○於上訴期間屆滿前提出上訴書狀\n    ，復於99年3 月29日提出上訴理由狀，然上訴理由狀僅泛指\n    其目前已未再與損友往來，深知毒品戕害健康嚴重性，已有\n    悔改之心，有女友與年邁雙親需被告扶養，被告於原審已坦\n    認犯行，犯後態度良好，請求從輕量刑等語。然原判決關於\n    被告甲○○所涉犯行已審酌被告其未經許可持有制式手槍、\n    子彈，嚴重威脅社會大眾之生命、財產安全，所為誠屬不該\n    ，又明知甲基安非他命對於人體危害甚鉅，竟圖一己之私利\n    ，使人沉迷於毒癮，影響國民身心健康及社會風氣頗深，惟\n    念渠犯後均坦白承認犯行，態度尚可，並考量渠販賣毒品之\n    次數、數量及獲利金額等一切情狀，認檢察官就被告甲○○\n    非法持有手槍部分求處有期徒刑5 年6 月，販賣第二級毒品\n    部分求處各有期徒刑7 年6 月，尚嫌過重，因而對被告量處\n    如原判決所量處之刑度已然斟酌上訴意旨所述情狀而量處低\n    於檢察官之求刑，上訴意旨並未具體敘述原審判決有何不當\n    或認事用法違背法令之處，其上訴即不合法律上之程式。上\n    訴人即被告之上訴理由書狀未敘述具體理由，依上開規定，\n    顯屬違背法律上之程式，應由本院依同法第367 條前段、第\n    372 條不經言詞辯論判決如主文。\n中    華    民    國    99    年    5     月    12    日\n                  刑事第八庭    審判長法  官  洪兆隆\n                                      法  官  張盛喜\n                                      法  官  郭玫利\n以上正本證明與原本無異。\n如不服本判決應於收受本判決後10日內向本院提出上訴書狀，其\n未敘述上訴理由者，並得於提起上訴後10日內向本院補提理由書\n狀（均須按他造當事人之人數附繕本）「切勿逕送上級法院」。\n中    華    民    國    99    年    5     月    12    日\n                                      書記官  吳福連",
  "structure": {
    "main": "上訴駁回。",
    "reason": "一、按上訴書狀應敘述具體理由；又第二審法院認為上訴書狀未\n    敘述理由或上訴有刑事訴訟法第362 條前段之情形者，應以\n    判決駁回之，同法第361 條第2 項、第367 條前段定有明文\n    。\n二、經查，上訴人即被告甲○○於上訴期間屆滿前提出上訴書狀\n    ，復於99年3 月29日提出上訴理由狀，然上訴理由狀僅泛指\n    其目前已未再與損友往來，深知毒品戕害健康嚴重性，已有\n    悔改之心，有女友與年邁雙親需被告扶養，被告於原審已坦\n    認犯行，犯後態度良好，請求從輕量刑等語。然原判決關於\n    被告甲○○所涉犯行已審酌被告其未經許可持有制式手槍、\n    子彈，嚴重威脅社會大眾之生命、財產安全，所為誠屬不該\n    ，又明知甲基安非他命對於人體危害甚鉅，竟圖一己之私利\n    ，使人沉迷於毒癮，影響國民身心健康及社會風氣頗深，惟\n    念渠犯後均坦白承認犯行，態度尚可，並考量渠販賣毒品之\n    次數、數量及獲利金額等一切情狀，認檢察官就被告甲○○\n    非法持有手槍部分求處有期徒刑5 年6 月，販賣第二級毒品\n    部分求處各有期徒刑7 年6 月，尚嫌過重，因而對被告量處\n    如原判決所量處之刑度已然斟酌上訴意旨所述情狀而量處低\n    於檢察官之求刑，上訴意旨並未具體敘述原審判決有何不當\n    或認事用法違背法令之處，其上訴即不合法律上之程式。上\n    訴人即被告之上訴理由書狀未敘述具體理由，依上開規定，\n    顯屬違背法律上之程式，應由本院依同法第367 條前段、第\n    372 條不經言詞辯論判決如主文。"
  },
  "characters": {
    "judges": [
      "洪兆隆",
      "張盛喜",
      "郭玫利"
    ],
    "prosecutors": [

    ],
    "lawyers": [

    ],
    "clerks": [

    ],
    "plaintiffs": [

    ],
    "defendants": [
      "甲"
    ],
    "prosecutor_office": [

    ],
    "creditors": [

    ],
    "debtors": [

    ],
    "judicial_associate_officer": [

    ]
  },
  "adjudged_at": "2010-05-12",
  "created_at": "2016-01-05 12:02:05",
  "updated_at": "2016-01-05 12:02:05"
}