{
  "identify": "KSH-98-建上更(一)-4-20100512-1",
  "court": {
    "name": "臺灣高等法院",
    "code": "KSH"
  },
  "division": {
    "name": "民事",
    "code": "V"
  },
  "year": 98,
  "word": "建上更(一)",
  "number": "4",
  "jcheck": "1",
  "reason": "返還履約保證金",
  "content": "臺灣高等法院高雄分院民事判決       98年度建上更(一)字第4號\n上  訴  人  統帥營造工程股份有限公司\n法定代理人  丁○○\n訴訟代理人  王進勝律師\n            黃淑芬律師\n            陶德斌律師\n被上訴人    台灣高雄地方法院檢察署\n法定代理人  甲○○\n訴訟代理人  丙○○\n            乙○○\n上列當事人間請求返還履約保證金事件，上訴人對於民國96年8\n月17日臺灣高雄地方法院94年度建字第82號第一審判決提起上訴\n，經最高法院第一次發回更審，本院於99年4 月21日言詞辯論終\n結，判決如下：\n    主  文\n上訴及假執行之聲請均駁回。\n第二審及發回前第三審訴訟費用由上訴人負擔。\n    事 實 及 理 由\n一、上訴人起訴主張：伊於民國82年4 月30日向被上訴人標得「\n    南區檢察官職務宿舍及首長宿舍建築（含高雄市○○○路16\n    1 巷64弄1 號舊房舍拆除）電梯及水電工程」（下稱系爭工\n    程），並繳交履約保證金新台幣（下同）1,800 萬元予被上\n    訴人，雙方於82年5 月14日訂立工程合約書（下稱系爭契約\n    ），惟因地質因素，如依建築師之設計以鋼板樁施工，不能\n    完成施作，經定期催告被上訴人變更設計，被上訴人仍不為\n    變更設計之行為，伊不得已乃依民法第507 條規定，於83年\n    2 月24日以存證信函對被上訴人為解除系爭契約之意思表示\n    ；系爭契約既經解除，伊自得請求被上訴人返還履約保證金\n    。爰依民法第259 條規定，聲明請求被上訴人返還履約保證\n    金1,800 萬元及自84年12月20日起至清償日止，按週年利率\n    5% 計算之利息，並願供擔保請准宣告假行。\n二、被上訴人則以：上訴人於向伊標得系爭工程後，於82年5 月\n    14日與伊簽訂系爭契約，嗣上訴人於82年6 月23日申報開工\n    ，隨即以工地地質依建築師設計之鋼板樁工法不能施工為由\n    而停工，並要求變更設計，伊因認系爭工程依原設計之工法\n    並無不能施工之情形，乃通知上訴人履行系爭契約進場施工\n    ，詎上訴人非但未依系爭契約之約定進行施工，反而以存證\n    信函通知伊解除系爭契約，上訴人解除系爭契約並不合法，\n    自不得請求返還履約保證金；又系爭工程並無變更設計之條\n    件，且上訴人要求變更設計亦不符合系爭契約之約定，伊因\n    上訴人未履行系爭契約，業於84年12月19日對上訴人為解除\n    系爭契約之意思表示；再者，上開履約保證金係不履行系爭\n    契約之損害賠償，依民法第514 條第2 項規定，上訴人之返\n    還請求權已罹於消滅時效；另上訴人關於利息之請求逾5 年\n    部分，亦已罹於消滅時效等語，資為抗辯。\n三、原審經審理後，為上訴人敗訴之判決，上訴人不服，提起上\n    訴，並於本院聲明：(一)原判決廢棄；(二)被上訴人應給付上訴\n    人1,800 萬元及自89年10月26日起至清償日止按週年利率5%\n    計算之利息；(三)更審前第一、二、三審訴訟費用由被上訴人\n    負擔; (四)上訴人願供擔保請准宣告假執行。被上訴人則於本\n    院聲明：(一)上訴駁回；(二)歷審訴訟費用由上訴人負擔；(三)如\n    受不利判決，願供擔保請准宣告免為假執行。（關於上訴人\n    請求自84年12月20日起至89年10月25日止之利息部分，業經\n    更審前本院判決其敗訴確定）。\n四、兩造不爭執事項：\n  (一)上訴人於82年4 月30日以工程總價1 億8,000 萬元向被上訴\n    人標得系爭工程，於82年5 月14日與被上訴人簽訂系爭契約\n    。上訴人於82年5 月11日將其為存款人、存入金額450 萬元\n    之台灣土地銀行五甲分行（下稱土地銀行）定期存單4 紙，\n    合計1,800 萬元，交付被上訴人作為質押，而繳納履約保證\n    金。\n  (二)上訴人於82年6 月23日向被上訴人申報開工，於82年6 月30\n    日完成舊房舍之拆除，並於同日函請被上訴人在取得高雄市\n    政府工務局開工許可前暫時停工。\n  (三)上訴人於82年7 月10日、15日，會同被上訴人所屬人員及系\n    爭工程設計建築師許仲川指派之人員進行工地會勘及鋼板樁\n    試樁、試挖。\n  (四)上訴人於82年7 月15日發函被上訴人，表示依地質現況，無\n    法依原設計即鋼板樁工法施工，請准變更施工設計，並准自\n    82年7月10日起全面停工。\n  (五)兩造於82年8 月6 日召開籌建會議，會議主席即被上訴人之\n    襄閱主任檢察官董明正於會議中表示，被上訴人於同年8 月\n    3 日籌建會議中已同意上訴人停工，俟變更設計經上級機關\n    核定後再行復工，惟經電話請示上級機關，仍希就其餘可施\n    工部分先予進行，而不准全部停工。\n  (六)被上訴人於82年10月7 日函知上訴人，法務部及台灣高等法\n    院檢察署核示不准變更設計。\n  (七)高雄市政府工務局於83年1 月18日對上訴人申請法定開工，\n    依法准予備查。\n  (八)上訴人於83年2 月24日以存證信函對被上訴人為解除系爭契\n    約之意思表示。\n  (九)被上訴人以上訴人未履行系爭契約，於84年12月19日對上訴\n    人為解除系爭契約之意思表示，並於同日對訴外人土地銀行\n    實行質權，沒收上訴人繳納之履約保證金。\n  (十)被上訴人於85年5 月17日以原設計圖說及條件再行發包，由\n    訴外人啟阜建設工程股份有限公司（下稱啟阜公司）承攬。\n    啟阜公司嗣變更以預壘樁工法施作完成。\n五、兩造爭點：\n  (一)系爭工程如依建築師之設計以鋼板樁施工，是否不能完成施\n    作？\n  (二)上訴人以系爭工程需要被上訴人變更設計，始能完成，經定\n    期催告，被上訴人未於期限內變更設計為由，依民法第507\n    條規定主張解除契約，請求被上訴人返還履約保證金，有無\n    理由？\n六、系爭工程如依建築師之設計以鋼板樁施工，是否不能完成施\n    作？\n    上訴人主張系爭工程依建築師之設計以鋼板樁施工，不能完\n    成施作，無非係以其於82年6 月29日委請國立成功大學土木\n    工程研究所製作之施工安全鑑定及改善建議書（下稱成大建\n    議書）、82年11月2 日申請高雄市土木技師公會鑑定並製作\n    之評估與建議報告書（下稱高市土木技師公會報告書），及\n    系爭工程於82年7 月10日、15日進行工地會勘及鋼板樁試樁\n    或試挖之紀錄，暨系爭工程嗣經啟阜公司變更以預壘樁工法\n    施作完成之事實為其論據。惟查：\n  (一)系爭工程包含舊房舍拆除、整地及興建編號A 、B 、D 、E\n    、F 、G 、H 等7 棟建物，其中A 、B 兩棟為地下2 層、地\n    上10層，須施作擋土壁工程，其餘D 至H 等5 棟則無需開挖\n    地基施作擋土壁，此經被上訴人敘明在卷，並有工程標單在\n    卷可按（本院前審卷一第192 頁背面、第195 頁），且上訴\n    人未予爭執，自堪信實。又被上訴人就系爭工程曾委託福帝\n    工程顧問有限公司進行地質鑽探並作成地質鑽探工程報告（\n    下稱系爭地質鑽探報告，見原審卷一第186-203 頁），上訴\n    人於82年6 月29日向建築師取得系爭地質鑽探報告，並分別\n    於同日、同年11月2 日提供予成大、高市土木技師公會供為\n    鑑定之依憑各情，亦據上訴人陳明在卷，且被上訴人未予爭\n    執，堪信為真。\n  (二)成大建議書（見原審卷一第209-216 頁）「施工安全及改善\n    建議」固略稱：系爭工程區域地面以下約1 公尺至3 公尺延\n    伸至7 公尺至13公尺左右，為中等堅硬至堅硬風化泥岩，其\n    間夾雜堅硬卵礫石，7 公尺至13公尺延伸至30公尺處，皆為\n    堅硬泥岩；又系爭工程區域四周，除南側無太久舊有建築外\n    ，其餘3 側僅距離2 至8 公尺皆為舊有建物，年代由10餘年\n    至20、30年，且呈老化現象；建築師設計之擋土安全工程，\n    係以YSP III鋼板樁施工，貫入深度為離地面下16公尺深處，\n    惟使用錘擊式鋼板樁欲錘擊貫穿堅硬泥岩及卵礫石層，必須\n    超重錘擊，噪音將影響鄰近居民安寧，激烈地盤震動將影響\n    鄰近舊有建物結構導致地板、內外牆龜裂或倒塌，甚至導致\n    土層滑動、邊坡土方塌落。而認系爭工程不宜以原設計16公\n    尺鋼板樁施作擋土工程，關於A 、B 兩棟建築物建議變更使\n    用60CM厚度連續壁等詞。惟成大建議書前揭建議內容，就原\n    設計以鋼板樁施作擋土工程僅評價為「不宜」，並非完全不\n    能施作。況且，「施工安全及改善建議」末段併敘述「本施\n    工安全鑑定及改善建議書，僅依據現場勘查及所提供資料，\n    經主持人專業知識加以研判作為原設計者參考，如需細部規\n    劃，當另依本土木研究所主持之鑽孔資料以為憑」等詞，益\n    見成大建議書係依上訴人所提供之系爭地質鑽探報告等作通\n    常性研判，惟就系爭工程是否確實應為改善及其程度或方法\n    ，尚保留稱需待該校土木研究所另為進一步鑽探，始得確認\n    ，是益無從認依系爭工程施工地區之地質，原設計以鋼板樁\n    施作擋土工程係屬不能完成。\n  (三)其次，高市土木技師公會報告書固略稱：依系爭地質鑽探報\n    告顯示A 棟建地範圍內施鑽有2 孔，分別為B-7 、B-10，B-\n    7 孔地表下1.2 公尺至8 公尺為硬實稠度之沈泥質粘土，N\n    值（即打擊數）介於13至20之間，8 公尺至15.8公尺為堅硬\n    沈泥質粘土；B-10孔地表下2.5 公尺至7. 8公尺為土（\n    按系爭地質鑽探報告係記載「卵礫石」），N 值為23至大於\n    100 ，7.8 公尺至10.2公尺為堅硬沈泥質粘土，N 值為38，\n    10.2公尺以下為泥岩層，N 值大於47。以A 棟大樓設計時採\n    用13公尺鋼板樁當作擋土壁且預計開挖9 公尺深，顯然無法\n    貫入地表2.5 公尺以下石層及泥岩層，且硬打所產生之\n    噪音及震動將產生嚴重危害。依系爭地質鑽探報告顯示B 棟\n    建地範圍內施鑽有2 孔，分別為B-8 、B-9 ，B-8 孔地表下\n    1.2 公尺至11.8公尺為硬實稠度之沈泥質粘土，N 值介於10\n    至17之間，11.8公尺至19.4公尺為硬實至極硬實稠度之沈泥\n    質粘土，N 值介於10至21；B-9 孔地表下1 公尺至11.6公尺\n    為硬實稠度之沈泥質粘土，N 值介於12至17，11.6公尺至17\n    .4公尺為極硬實稠度之沈泥質粘土，N 值介於13至18，因B\n    棟四週鄰房較A 棟多且距離較近，相對受震動影響亦較大，\n    況且老舊房子對震動抵抗力甚差，故鋼板樁施工震動導致鄰\n    房損害問題亦較嚴重等詞。然以，高市土木技師公會報告書\n    就原設計之鋼板樁工法，僅評估其噪音及震動可能對鄰房產\n    生危害，惟並未認定鋼板樁工法不能施作。況且，證人即高\n    市土木技師公會執行該次鑑定之土木技師李宗欣於原審證稱\n    ：「（有沒有辦法確定鑽探的資料是否正確？）是否正確要\n    問建築師」乙語（原審卷三第34頁），而無法確認系爭鑽探\n    報告所呈現之N 值（即打擊數）等地質數據，與系爭工程區\n    域之地質全貌相符；甚者，成大建議書敘稱如需細部規劃尚\n    需以該校土木研究所另為進行之鑽探資料為依據，業如前述\n    。是自無從依高市土木技師公會報告書即認系爭工程無法以\n    鋼板樁完成擋土工作。\n  (四)再者，系爭工程於82年7 月10日、15日進行工地會勘及鋼板\n    樁試樁或試挖之紀錄，固分別記載：「試樁經過：1.原鑽探\n    報告B7位置試打鋼板樁2 支打至6.5m-7m 無法繼續貫入，地\n    面震動強烈。2.南邊圍牆40cm處試打鋼板樁2 支至6.5m-6.7\n    m 無法繼續貫入，地面震動強烈」、「試挖經過：本日於10\n    時開始於原鑽探報告鑽孔B-11北側3M處以怪手開挖，至原地\n    面9M處（GL下7.8M）到達石層，怪手挖斗無法繼續挖掘\n    而停止...10 時15分... 再於B-6 附近試挖於原地面下82CM\n    處（GL上64CM）抵達堅硬石層而停止... 」（原審卷一\n    第222 、225 頁）等詞。惟系爭工程設計需以鋼板樁施作擋\n    土壁者，係A 棟及B 棟建物之外圍，此有上訴人於82年8 月\n    13日隨函檢附於被上訴人之施工計劃第2 階段圖在卷可稽（\n    詳見原審卷一第237 頁），而前述試樁、試挖地點之B-6 、\n    B-7 、B-11及南邊圍牆40cm處，僅B-11係位在需以鋼板樁施\n    作擋土壁之外圍位置，其餘B-6 、B-7 均不在需施作擋土壁\n    之外圍處，B-6 更非在A 棟或B 棟建物之施工區域內，至南\n    邊圍牆40cm處則無任何圖示可資確認，而所在不明。又系爭\n    工程施工說明書第3 章乙、鋼板樁第(六)點明定「施工中如遇\n    土質極端堅硬時，經監工人員准許後得採用水沖法（water\n    Jet ）配合施工」（本院前審卷一第128 頁），而前述試樁\n    或試挖過程，除以錘擊方式貫入或以怪手挖鑿外，並無併以\n    水沖法施工。據上，以前述試樁、試挖之地點僅其中B-11與\n    鋼板樁施作擋土壁工程相關，且該地點試挖時僅以怪手挖鑿\n    ，並無併採系爭工程施工說明書所載之水沖法施工，自難僅\n    憑單一之鋼板樁施設地點、及未運用系爭契約容允之方式施\n    工所得致之試樁或試挖結果，而概論系爭工程不能以鋼板樁\n    工法施作擋土工程。至上訴人雖又稱：使用水沖法其沖樁長\n    度亦不得超過樁長之50% 等語，惟即使其所主張此節非虛，\n    然沖樁長度是否超過樁長之50% 需依實際施作情形判斷，上\n    訴人既未實際進場以鋼板樁施作擋土工程，如何能知沖樁長\n    度必定超過50% ，而無法使用該項工法施工；遑論前述B-11\n    點以怪手試挖未加錘擊重力，尚得達於地下9 公尺處，而系\n    爭工程擋土設施原設計之貫入深度為地下16公尺，均如前述\n    ，則該B-11點若實施沖樁，其長度亦不至達於樁長之50% （\n    1-9/16≒44%）。是上訴人該節主張自無可取。\n  (五)復者，系爭工程嗣經啟阜公司變更以預壘樁工法施作完成乙\n    節，為兩造所不爭。而啟阜公司製作之施工說明資料中關於\n    「A 、B 棟地下室施工計劃說明」內敘述：「一合約規定工\n    法：1.... 依據所提供土壤鑽探資料及本公司鑽井一口時之\n    土層狀況，得知地下室開挖面下6-8 公尺處有堅硬石層\n    。2.本工程需開挖9.1m，打設鋼板樁勢必無法穿透石層\n    ，又若勉強施打必會造成甚大震波，而影響鄰房之安全，故\n    本工程實無法採用打設鋼板樁之工法。... 二鑑於上述，本\n    公司施作工法如后：... 2.為避免因施工震動造成鄰居抗爭\n    ，本公司多方考慮後將採用無震動之施工方法，即採用預壘\n    樁之工法施工以替代打設鋼板樁... 」等詞（原審卷一第13\n    3 頁）。是以，足見啟阜公司係基於施打鋼板樁所生震動可\n    能引發鄰損爭議，而改採較無震動之施工方法，並非原設計\n    之鋼板樁工法無法完成擋土工程之施作。何況，觀諸系爭地\n    質鑽探報告，位在A 棟及B 棟大樓施工區域鑽孔點B-7 、B-\n    8 、B-9 、B-10、B-11之「土壤描述」（原審卷一第199-20\n    3 頁），均為沈泥質粘土、砂質泥岩、泥岩、卵礫石等，而\n    全無石層之記載；且證人即系爭工程設計監造建築師許\n    仲川之受僱人王清長於原審證述：啟阜公司施工說明書內說\n    有石層，（開挖後）事實上是沒有乙語明確（原審卷三\n    第79頁），足徵上開施工說明資料所稱鋼板樁無法穿透\n    石層之疑慮，經實際施工、開挖後已然證實並無石層，\n    即啟阜公司變更擋土施工方法之前提，事後發現並不存在，\n    是益無從因啟阜公司嗣後變更擋土工程之工法，而推認原設\n    計之鋼板樁無法完成擋土工程。\n  (六)上訴人另援引財政部證券管理委員會86年1 月20日(86)台財\n    證(一)第10508 號函所載：「... 依（啟阜）公司所檢附資料\n    係因原設計不當未考慮當地地質狀況，致影響臨近之鼓山國\n    宅，經地檢署報請法務部同意改變設計... 」等詞（原審卷\n    一第139-140 頁），惟財政部證券管理委員會上開函文並未\n    附具啟阜公司所檢送與該會之資料，啟阜公司究曾為如何之\n    表示，及該會如何得出「原設計不當未考慮當地地質狀況」\n    之結論，均缺乏考究之根據，是自無從僅憑上開函文之記載\n    而認依原設計之鋼板樁擋土工法不能完成施作。\n  (七)承上所述，上訴人所舉事證均無法證明系爭工程原設計之鋼\n    板樁工法不能完成擋土工程之施作。反之，證人王清長於原\n    審證述：啟阜公司承攬後，本來是用同樣的施工方法（即鋼\n    板樁），後來有居民抗議，高雄市政府發函要求提出施工說\n    明，里民強烈要求施工聲音不要太大，不要震動太大，因而\n    變更為預壘樁；開始打鋼板樁時，現場施工的聲音很大；在\n    變更為預壘樁前，沒有發生（鄰房）屋損，但聲音很大；一\n    般聲音很大，地面稍微會震動；後來啟阜公司願意用預壘樁\n    施工不追加預算，站在建築師立場，我們樂觀其成等語（原\n    審卷三第77-78 頁）。基此，以系爭工程曾以原設計之鋼板\n    樁工法施工，且施工期間並未發生鄰損，嗣後係因附近居民\n    抗爭噪音及震動，始變更採用預壘樁工法施作，足佐系爭工\n    程以原設計鋼板樁施作，並非不能完成。至上訴人另主張系\n    爭工程尚有B 棟大樓地下室牆緣侵越基地圍牆外民宅，而須\n    變更設計始得施工云云，並提出83年3 月11日存證信函為證\n    （原審卷二第78-85 頁、本院卷第80-87 頁），惟上開存證\n    信函係上訴人片面寄發予被上訴人之郵件，未經被上訴人肯\n    認有前述地下室牆緣侵越圍牆外民宅之情事，且上訴人亦未\n    另舉他證以實其說，自無足採。從而，堪認上訴人主張系爭\n    工程依建築師之設計以鋼板樁施工，係屬不能完成施作，殊\n    無可取。\n七、上訴人以系爭工程需要被上訴人變更設計，始能完成，經定\n    期催告，被上訴人未於期限內變更設計為由，依民法第507\n    條規定主張解除契約，請求被上訴人返還履約保證金，有無\n    理由？\n  (一)按工作需定作人之行為始能完成者，而定作人不為其行為時\n    ，承攬人得定相當期限，催告定作人為之。定作人不於前項\n    期限內為其行為者，承攬人得解除契約，並得請求賠償因契\n    約解除而生之損害，民法第507 條定有明文。經查，上訴人\n    主張系爭工程原設計之鋼板樁工法不當，需被上訴人變更設\n    計始能完成工作，惟系爭工程依原設計以鋼板樁工法施作擋\n    土工程，並非不能完成，已如前述，則系爭工程並無非被上\n    訴變更設計，始能完成之情事，從而，被上訴人拒絕上訴人\n    變更設計之請求，上訴人並無從依前揭規定解除系爭契約。\n  (二)至系爭工程以鋼板樁工法施作期間，曾產生大量噪音與震動\n    ，固經證人王清長證述如前。惟被上訴人於上訴人請求變更\n    設計而予否准後，對上訴人所疑慮採取鋼板樁工法預期產生\n    之噪音、震動及因此等噪音、震動對鄰房可能造成之影響，\n    已於82年12月23日邀同監造設計建築師及上訴人召開協調會\n    ，3 方經討論作成決議：「一統帥營造工程股份有限公司（\n    即上訴人），請依程序申報法定開工，儘速取得法定開工證\n    明，並進駐工地施工。二『施工過程中，如發現有事實困難\n    者』，統帥營造工程股份有限公司應即通知建築師許仲川先\n    生及業主高雄地檢署，經3 方『協商變更設計』，報請上級\n    機關核定。三經核准變更設計部分，依法定程序進行追加減\n    帳」（見原審卷二第49-50 頁）。職是，足見被上訴人亦已\n    就動工後若出現無法完成擋土工程之具體窒礙，預先表明願\n    協商變更設計，並非完全無變更設計之餘地。然高雄市政府\n    工務局於83年1 月18日對上訴人申請法定開工，依法准予備\n    查後，上訴人仍未進場施作擋土工程，經被上訴人於83年1\n    月22日、同年2 月5 日、同年2 月21日函催上訴人儘速進駐\n    工地施工（原審卷二第60、71、74頁），上訴人猶未動工施\n    作，且於同年2 月24日以存證信函表示解除系爭契約。綜觀\n    前情，足見被上訴人就系爭工程可能需定作人作為之事項，\n    均已善盡注意之責，上訴人不開工實際施作，卻一再主張系\n    爭工程需變更設計始得完成，而未據被上訴人變更，並執此\n    為由解除契約，於法顯屬未合。\n  (三)據上，堪認上訴人以系爭工程需要被上訴人變更設計，始能\n    完成，並非屬實，依民法第507 條規定，上訴人並無解除系\n    爭契約之權利，從而，上訴人對被上訴人所為解除系爭契約\n    之意思表示，自不生法律上效力；上訴人主張系爭契約經其\n    合法解除，而請求返還履約保證金，洵屬無據。反之，上訴\n    人拆除舊房舍後，即停工未再續作系爭工程，為兩造所不爭\n    ；而上訴人經被上訴人於83年1 、2 月間屢次催告，仍未進\n    場施作，已如前述，被上訴人迄至83年3 月、6 月間仍多次\n    催告或協調上訴人依約施作（原審卷二第77、86、124 頁）\n    ，惟上訴人猶未施作，核屬遲延工作，且可受歸責，則被上\n    訴人依民法第503 條、第254 條及系爭契約第23條第3 款，\n    於84年12月19日發函解除系爭契約，並於同日沒收履約保證\n    金，於法尚無不合；上訴人自無從請求返還履約保證金。併\n    此敘明。\n八、綜上所述，本件上訴人主張系爭工程依建築師之設計以鋼板\n    樁施工，係不能完成，為不足採，上訴人依民法第507 條規\n    定並無解除系爭契約之權利。上訴人遲未依約施作，且可受\n    歸責，則被上訴人依民法第503 條、第254 條及系爭契約第\n    23條第3 款，解除系爭契約並沒收履約保證金，係屬有據。\n    從而，上訴人主張本於民法第259 條契約解除後之回復原狀\n    請求權，請求被上訴人給付1,800 萬元及自89年10月26日起\n    至清償日止，按週年利率5%計算之利息，為無理由，不應准\n    許。其假執行之聲請失所依附，應併予駁回。原審為上訴人\n    敗訴之判決，並無不合。上訴意旨指摘原判決不當，求予廢\n    棄改判，為無理由，應予駁回。\n九、兩造其餘攻擊防禦方法，無礙本件勝負之判斷，爰不一一論\n    敘，附此敘明。\n十、據上論結，本件上訴為無理由，依民事訴訟法第449 條第1\n    項、第78條，判決如主文。\n中    華    民    國    99    年    5     月    12    日\n                            民事第三庭\n                                審判長法官  張國彬\n                                法      官  吳登輝\n                                法      官  甯  馨\n以上正本證明與原本無異。\n如對本判決上訴，須於判決送達後20日內向本院提出上訴狀，其\n未表明上訴理由者，應於上訴後20日內向本院提出上訴理由書（\n均須按他造當事人之人數附繕本）。上訴時應提出委任律師或具\n有律師資格之人之委任狀，並依附註條文規定辦理。\n中    華    民    國    99    年    5     月    12    日\n                                書  記  官  施耀程\n附註：\n民事訴訟法第466 條之1 ：\n對於第二審判決上訴，上訴人應委任律師為訴訟代理人，但上訴\n人或其法定代理人具有律師資格者，不在此限。\n上訴人之配偶、三親等內之血親、二親等內之姻親，或上訴人為\n法人、中央或地方機關時，其所屬專任人員具有律師資格並經法\n院認適當者，亦得為第三審訴訟代理人。\n第1 項但書及第2 項情形，應於提起上訴或委任時釋明之。",
  "structure": {
    "fact": "一、上訴人起訴主張：伊於民國82年4 月30日向被上訴人標得「\n    南區檢察官職務宿舍及首長宿舍建築（含高雄市○○○路16\n    1 巷64弄1 號舊房舍拆除）電梯及水電工程」（下稱系爭工\n    程），並繳交履約保證金新台幣（下同）1,800 萬元予被上\n    訴人，雙方於82年5 月14日訂立工程合約書（下稱系爭契約\n    ），惟因地質因素，如依建築師之設計以鋼板樁施工，不能\n    完成施作，經定期催告被上訴人變更設計，被上訴人仍不為\n    變更設計之行為，伊不得已乃依民法第507 條規定，於83年\n    2 月24日以存證信函對被上訴人為解除系爭契約之意思表示\n    ；系爭契約既經解除，伊自得請求被上訴人返還履約保證金\n    。爰依民法第259 條規定，聲明請求被上訴人返還履約保證\n    金1,800 萬元及自84年12月20日起至清償日止，按週年利率\n    5% 計算之利息，並願供擔保請准宣告假行。\n二、被上訴人則以：上訴人於向伊標得系爭工程後，於82年5 月\n    14日與伊簽訂系爭契約，嗣上訴人於82年6 月23日申報開工\n    ，隨即以工地地質依建築師設計之鋼板樁工法不能施工為由\n    而停工，並要求變更設計，伊因認系爭工程依原設計之工法\n    並無不能施工之情形，乃通知上訴人履行系爭契約進場施工\n    ，詎上訴人非但未依系爭契約之約定進行施工，反而以存證\n    信函通知伊解除系爭契約，上訴人解除系爭契約並不合法，\n    自不得請求返還履約保證金；又系爭工程並無變更設計之條\n    件，且上訴人要求變更設計亦不符合系爭契約之約定，伊因\n    上訴人未履行系爭契約，業於84年12月19日對上訴人為解除\n    系爭契約之意思表示；再者，上開履約保證金係不履行系爭\n    契約之損害賠償，依民法第514 條第2 項規定，上訴人之返\n    還請求權已罹於消滅時效；另上訴人關於利息之請求逾5 年\n    部分，亦已罹於消滅時效等語，資為抗辯。\n三、原審經審理後，為上訴人敗訴之判決，上訴人不服，提起上\n    訴，並於本院聲明：(一)原判決廢棄；(二)被上訴人應給付上訴\n    人1,800 萬元及自89年10月26日起至清償日止按週年利率5%\n    計算之利息；(三)更審前第一、二、三審訴訟費用由被上訴人\n    負擔; (四)上訴人願供擔保請准宣告假執行。被上訴人則於本\n    院聲明：(一)上訴駁回；(二)歷審訴訟費用由上訴人負擔；(三)如\n    受不利判決，願供擔保請准宣告免為假執行。（關於上訴人\n    請求自84年12月20日起至89年10月25日止之利息部分，業經\n    更審前本院判決其敗訴確定）。\n四、兩造不爭執事項：\n  (一)上訴人於82年4 月30日以工程總價1 億8,000 萬元向被上訴\n    人標得系爭工程，於82年5 月14日與被上訴人簽訂系爭契約\n    。上訴人於82年5 月11日將其為存款人、存入金額450 萬元\n    之台灣土地銀行五甲分行（下稱土地銀行）定期存單4 紙，\n    合計1,800 萬元，交付被上訴人作為質押，而繳納履約保證\n    金。\n  (二)上訴人於82年6 月23日向被上訴人申報開工，於82年6 月30\n    日完成舊房舍之拆除，並於同日函請被上訴人在取得高雄市\n    政府工務局開工許可前暫時停工。\n  (三)上訴人於82年7 月10日、15日，會同被上訴人所屬人員及系\n    爭工程設計建築師許仲川指派之人員進行工地會勘及鋼板樁\n    試樁、試挖。\n  (四)上訴人於82年7 月15日發函被上訴人，表示依地質現況，無\n    法依原設計即鋼板樁工法施工，請准變更施工設計，並准自\n    82年7月10日起全面停工。\n  (五)兩造於82年8 月6 日召開籌建會議，會議主席即被上訴人之\n    襄閱主任檢察官董明正於會議中表示，被上訴人於同年8 月\n    3 日籌建會議中已同意上訴人停工，俟變更設計經上級機關\n    核定後再行復工，惟經電話請示上級機關，仍希就其餘可施\n    工部分先予進行，而不准全部停工。\n  (六)被上訴人於82年10月7 日函知上訴人，法務部及台灣高等法\n    院檢察署核示不准變更設計。\n  (七)高雄市政府工務局於83年1 月18日對上訴人申請法定開工，\n    依法准予備查。\n  (八)上訴人於83年2 月24日以存證信函對被上訴人為解除系爭契\n    約之意思表示。\n  (九)被上訴人以上訴人未履行系爭契約，於84年12月19日對上訴\n    人為解除系爭契約之意思表示，並於同日對訴外人土地銀行\n    實行質權，沒收上訴人繳納之履約保證金。\n  (十)被上訴人於85年5 月17日以原設計圖說及條件再行發包，由\n    訴外人啟阜建設工程股份有限公司（下稱啟阜公司）承攬。\n    啟阜公司嗣變更以預壘樁工法施作完成。\n五、兩造爭點：\n  (一)系爭工程如依建築師之設計以鋼板樁施工，是否不能完成施\n    作？\n  (二)上訴人以系爭工程需要被上訴人變更設計，始能完成，經定\n    期催告，被上訴人未於期限內變更設計為由，依民法第507\n    條規定主張解除契約，請求被上訴人返還履約保證金，有無\n    理由？\n六、系爭工程如依建築師之設計以鋼板樁施工，是否不能完成施\n    作？\n    上訴人主張系爭工程依建築師之設計以鋼板樁施工，不能完\n    成施作，無非係以其於82年6 月29日委請國立成功大學土木\n    工程研究所製作之施工安全鑑定及改善建議書（下稱成大建\n    議書）、82年11月2 日申請高雄市土木技師公會鑑定並製作\n    之評估與建議報告書（下稱高市土木技師公會報告書），及\n    系爭工程於82年7 月10日、15日進行工地會勘及鋼板樁試樁\n    或試挖之紀錄，暨系爭工程嗣經啟阜公司變更以預壘樁工法\n    施作完成之事實為其論據。惟查：\n  (一)系爭工程包含舊房舍拆除、整地及興建編號A 、B 、D 、E\n    、F 、G 、H 等7 棟建物，其中A 、B 兩棟為地下2 層、地\n    上10層，須施作擋土壁工程，其餘D 至H 等5 棟則無需開挖\n    地基施作擋土壁，此經被上訴人敘明在卷，並有工程標單在\n    卷可按（本院前審卷一第192 頁背面、第195 頁），且上訴\n    人未予爭執，自堪信實。又被上訴人就系爭工程曾委託福帝\n    工程顧問有限公司進行地質鑽探並作成地質鑽探工程報告（\n    下稱系爭地質鑽探報告，見原審卷一第186-203 頁），上訴\n    人於82年6 月29日向建築師取得系爭地質鑽探報告，並分別\n    於同日、同年11月2 日提供予成大、高市土木技師公會供為\n    鑑定之依憑各情，亦據上訴人陳明在卷，且被上訴人未予爭\n    執，堪信為真。\n  (二)成大建議書（見原審卷一第209-216 頁）「施工安全及改善\n    建議」固略稱：系爭工程區域地面以下約1 公尺至3 公尺延\n    伸至7 公尺至13公尺左右，為中等堅硬至堅硬風化泥岩，其\n    間夾雜堅硬卵礫石，7 公尺至13公尺延伸至30公尺處，皆為\n    堅硬泥岩；又系爭工程區域四周，除南側無太久舊有建築外\n    ，其餘3 側僅距離2 至8 公尺皆為舊有建物，年代由10餘年\n    至20、30年，且呈老化現象；建築師設計之擋土安全工程，\n    係以YSP III鋼板樁施工，貫入深度為離地面下16公尺深處，\n    惟使用錘擊式鋼板樁欲錘擊貫穿堅硬泥岩及卵礫石層，必須\n    超重錘擊，噪音將影響鄰近居民安寧，激烈地盤震動將影響\n    鄰近舊有建物結構導致地板、內外牆龜裂或倒塌，甚至導致\n    土層滑動、邊坡土方塌落。而認系爭工程不宜以原設計16公\n    尺鋼板樁施作擋土工程，關於A 、B 兩棟建築物建議變更使\n    用60CM厚度連續壁等詞。惟成大建議書前揭建議內容，就原\n    設計以鋼板樁施作擋土工程僅評價為「不宜」，並非完全不\n    能施作。況且，「施工安全及改善建議」末段併敘述「本施\n    工安全鑑定及改善建議書，僅依據現場勘查及所提供資料，\n    經主持人專業知識加以研判作為原設計者參考，如需細部規\n    劃，當另依本土木研究所主持之鑽孔資料以為憑」等詞，益\n    見成大建議書係依上訴人所提供之系爭地質鑽探報告等作通\n    常性研判，惟就系爭工程是否確實應為改善及其程度或方法\n    ，尚保留稱需待該校土木研究所另為進一步鑽探，始得確認\n    ，是益無從認依系爭工程施工地區之地質，原設計以鋼板樁\n    施作擋土工程係屬不能完成。\n  (三)其次，高市土木技師公會報告書固略稱：依系爭地質鑽探報\n    告顯示A 棟建地範圍內施鑽有2 孔，分別為B-7 、B-10，B-\n    7 孔地表下1.2 公尺至8 公尺為硬實稠度之沈泥質粘土，N\n    值（即打擊數）介於13至20之間，8 公尺至15.8公尺為堅硬\n    沈泥質粘土；B-10孔地表下2.5 公尺至7. 8公尺為土（\n    按系爭地質鑽探報告係記載「卵礫石」），N 值為23至大於\n    100 ，7.8 公尺至10.2公尺為堅硬沈泥質粘土，N 值為38，\n    10.2公尺以下為泥岩層，N 值大於47。以A 棟大樓設計時採\n    用13公尺鋼板樁當作擋土壁且預計開挖9 公尺深，顯然無法\n    貫入地表2.5 公尺以下石層及泥岩層，且硬打所產生之\n    噪音及震動將產生嚴重危害。依系爭地質鑽探報告顯示B 棟\n    建地範圍內施鑽有2 孔，分別為B-8 、B-9 ，B-8 孔地表下\n    1.2 公尺至11.8公尺為硬實稠度之沈泥質粘土，N 值介於10\n    至17之間，11.8公尺至19.4公尺為硬實至極硬實稠度之沈泥\n    質粘土，N 值介於10至21；B-9 孔地表下1 公尺至11.6公尺\n    為硬實稠度之沈泥質粘土，N 值介於12至17，11.6公尺至17\n    .4公尺為極硬實稠度之沈泥質粘土，N 值介於13至18，因B\n    棟四週鄰房較A 棟多且距離較近，相對受震動影響亦較大，\n    況且老舊房子對震動抵抗力甚差，故鋼板樁施工震動導致鄰\n    房損害問題亦較嚴重等詞。然以，高市土木技師公會報告書\n    就原設計之鋼板樁工法，僅評估其噪音及震動可能對鄰房產\n    生危害，惟並未認定鋼板樁工法不能施作。況且，證人即高\n    市土木技師公會執行該次鑑定之土木技師李宗欣於原審證稱\n    ：「（有沒有辦法確定鑽探的資料是否正確？）是否正確要\n    問建築師」乙語（原審卷三第34頁），而無法確認系爭鑽探\n    報告所呈現之N 值（即打擊數）等地質數據，與系爭工程區\n    域之地質全貌相符；甚者，成大建議書敘稱如需細部規劃尚\n    需以該校土木研究所另為進行之鑽探資料為依據，業如前述\n    。是自無從依高市土木技師公會報告書即認系爭工程無法以\n    鋼板樁完成擋土工作。\n  (四)再者，系爭工程於82年7 月10日、15日進行工地會勘及鋼板\n    樁試樁或試挖之紀錄，固分別記載：「試樁經過：1.原鑽探\n    報告B7位置試打鋼板樁2 支打至6.5m-7m 無法繼續貫入，地\n    面震動強烈。2.南邊圍牆40cm處試打鋼板樁2 支至6.5m-6.7\n    m 無法繼續貫入，地面震動強烈」、「試挖經過：本日於10\n    時開始於原鑽探報告鑽孔B-11北側3M處以怪手開挖，至原地\n    面9M處（GL下7.8M）到達石層，怪手挖斗無法繼續挖掘\n    而停止...10 時15分... 再於B-6 附近試挖於原地面下82CM\n    處（GL上64CM）抵達堅硬石層而停止... 」（原審卷一\n    第222 、225 頁）等詞。惟系爭工程設計需以鋼板樁施作擋\n    土壁者，係A 棟及B 棟建物之外圍，此有上訴人於82年8 月\n    13日隨函檢附於被上訴人之施工計劃第2 階段圖在卷可稽（\n    詳見原審卷一第237 頁），而前述試樁、試挖地點之B-6 、\n    B-7 、B-11及南邊圍牆40cm處，僅B-11係位在需以鋼板樁施\n    作擋土壁之外圍位置，其餘B-6 、B-7 均不在需施作擋土壁\n    之外圍處，B-6 更非在A 棟或B 棟建物之施工區域內，至南\n    邊圍牆40cm處則無任何圖示可資確認，而所在不明。又系爭\n    工程施工說明書第3 章乙、鋼板樁第(六)點明定「施工中如遇\n    土質極端堅硬時，經監工人員准許後得採用水沖法（water\n    Jet ）配合施工」（本院前審卷一第128 頁），而前述試樁\n    或試挖過程，除以錘擊方式貫入或以怪手挖鑿外，並無併以\n    水沖法施工。據上，以前述試樁、試挖之地點僅其中B-11與\n    鋼板樁施作擋土壁工程相關，且該地點試挖時僅以怪手挖鑿\n    ，並無併採系爭工程施工說明書所載之水沖法施工，自難僅\n    憑單一之鋼板樁施設地點、及未運用系爭契約容允之方式施\n    工所得致之試樁或試挖結果，而概論系爭工程不能以鋼板樁\n    工法施作擋土工程。至上訴人雖又稱：使用水沖法其沖樁長\n    度亦不得超過樁長之50% 等語，惟即使其所主張此節非虛，\n    然沖樁長度是否超過樁長之50% 需依實際施作情形判斷，上\n    訴人既未實際進場以鋼板樁施作擋土工程，如何能知沖樁長\n    度必定超過50% ，而無法使用該項工法施工；遑論前述B-11\n    點以怪手試挖未加錘擊重力，尚得達於地下9 公尺處，而系\n    爭工程擋土設施原設計之貫入深度為地下16公尺，均如前述\n    ，則該B-11點若實施沖樁，其長度亦不至達於樁長之50% （\n    1-9/16≒44%）。是上訴人該節主張自無可取。\n  (五)復者，系爭工程嗣經啟阜公司變更以預壘樁工法施作完成乙\n    節，為兩造所不爭。而啟阜公司製作之施工說明資料中關於\n    「A 、B 棟地下室施工計劃說明」內敘述：「一合約規定工\n    法：1.... 依據所提供土壤鑽探資料及本公司鑽井一口時之\n    土層狀況，得知地下室開挖面下6-8 公尺處有堅硬石層\n    。2.本工程需開挖9.1m，打設鋼板樁勢必無法穿透石層\n    ，又若勉強施打必會造成甚大震波，而影響鄰房之安全，故\n    本工程實無法採用打設鋼板樁之工法。... 二鑑於上述，本\n    公司施作工法如后：... 2.為避免因施工震動造成鄰居抗爭\n    ，本公司多方考慮後將採用無震動之施工方法，即採用預壘\n    樁之工法施工以替代打設鋼板樁... 」等詞（原審卷一第13\n    3 頁）。是以，足見啟阜公司係基於施打鋼板樁所生震動可\n    能引發鄰損爭議，而改採較無震動之施工方法，並非原設計\n    之鋼板樁工法無法完成擋土工程之施作。何況，觀諸系爭地\n    質鑽探報告，位在A 棟及B 棟大樓施工區域鑽孔點B-7 、B-\n    8 、B-9 、B-10、B-11之「土壤描述」（原審卷一第199-20\n    3 頁），均為沈泥質粘土、砂質泥岩、泥岩、卵礫石等，而\n    全無石層之記載；且證人即系爭工程設計監造建築師許\n    仲川之受僱人王清長於原審證述：啟阜公司施工說明書內說\n    有石層，（開挖後）事實上是沒有乙語明確（原審卷三\n    第79頁），足徵上開施工說明資料所稱鋼板樁無法穿透\n    石層之疑慮，經實際施工、開挖後已然證實並無石層，\n    即啟阜公司變更擋土施工方法之前提，事後發現並不存在，\n    是益無從因啟阜公司嗣後變更擋土工程之工法，而推認原設\n    計之鋼板樁無法完成擋土工程。\n  (六)上訴人另援引財政部證券管理委員會86年1 月20日(86)台財\n    證(一)第10508 號函所載：「... 依（啟阜）公司所檢附資料\n    係因原設計不當未考慮當地地質狀況，致影響臨近之鼓山國\n    宅，經地檢署報請法務部同意改變設計... 」等詞（原審卷\n    一第139-140 頁），惟財政部證券管理委員會上開函文並未\n    附具啟阜公司所檢送與該會之資料，啟阜公司究曾為如何之\n    表示，及該會如何得出「原設計不當未考慮當地地質狀況」\n    之結論，均缺乏考究之根據，是自無從僅憑上開函文之記載\n    而認依原設計之鋼板樁擋土工法不能完成施作。\n  (七)承上所述，上訴人所舉事證均無法證明系爭工程原設計之鋼\n    板樁工法不能完成擋土工程之施作。反之，證人王清長於原\n    審證述：啟阜公司承攬後，本來是用同樣的施工方法（即鋼\n    板樁），後來有居民抗議，高雄市政府發函要求提出施工說\n    明，里民強烈要求施工聲音不要太大，不要震動太大，因而\n    變更為預壘樁；開始打鋼板樁時，現場施工的聲音很大；在\n    變更為預壘樁前，沒有發生（鄰房）屋損，但聲音很大；一\n    般聲音很大，地面稍微會震動；後來啟阜公司願意用預壘樁\n    施工不追加預算，站在建築師立場，我們樂觀其成等語（原\n    審卷三第77-78 頁）。基此，以系爭工程曾以原設計之鋼板\n    樁工法施工，且施工期間並未發生鄰損，嗣後係因附近居民\n    抗爭噪音及震動，始變更採用預壘樁工法施作，足佐系爭工\n    程以原設計鋼板樁施作，並非不能完成。至上訴人另主張系\n    爭工程尚有B 棟大樓地下室牆緣侵越基地圍牆外民宅，而須\n    變更設計始得施工云云，並提出83年3 月11日存證信函為證\n    （原審卷二第78-85 頁、本院卷第80-87 頁），惟上開存證\n    信函係上訴人片面寄發予被上訴人之郵件，未經被上訴人肯\n    認有前述地下室牆緣侵越圍牆外民宅之情事，且上訴人亦未\n    另舉他證以實其說，自無足採。從而，堪認上訴人主張系爭\n    工程依建築師之設計以鋼板樁施工，係屬不能完成施作，殊\n    無可取。\n七、上訴人以系爭工程需要被上訴人變更設計，始能完成，經定\n    期催告，被上訴人未於期限內變更設計為由，依民法第507\n    條規定主張解除契約，請求被上訴人返還履約保證金，有無\n    理由？\n  (一)按工作需定作人之行為始能完成者，而定作人不為其行為時\n    ，承攬人得定相當期限，催告定作人為之。定作人不於前項\n    期限內為其行為者，承攬人得解除契約，並得請求賠償因契\n    約解除而生之損害，民法第507 條定有明文。經查，上訴人\n    主張系爭工程原設計之鋼板樁工法不當，需被上訴人變更設\n    計始能完成工作，惟系爭工程依原設計以鋼板樁工法施作擋\n    土工程，並非不能完成，已如前述，則系爭工程並無非被上\n    訴變更設計，始能完成之情事，從而，被上訴人拒絕上訴人\n    變更設計之請求，上訴人並無從依前揭規定解除系爭契約。\n  (二)至系爭工程以鋼板樁工法施作期間，曾產生大量噪音與震動\n    ，固經證人王清長證述如前。惟被上訴人於上訴人請求變更\n    設計而予否准後，對上訴人所疑慮採取鋼板樁工法預期產生\n    之噪音、震動及因此等噪音、震動對鄰房可能造成之影響，\n    已於82年12月23日邀同監造設計建築師及上訴人召開協調會\n    ，3 方經討論作成決議：「一統帥營造工程股份有限公司（\n    即上訴人），請依程序申報法定開工，儘速取得法定開工證\n    明，並進駐工地施工。二『施工過程中，如發現有事實困難\n    者』，統帥營造工程股份有限公司應即通知建築師許仲川先\n    生及業主高雄地檢署，經3 方『協商變更設計』，報請上級\n    機關核定。三經核准變更設計部分，依法定程序進行追加減\n    帳」（見原審卷二第49-50 頁）。職是，足見被上訴人亦已\n    就動工後若出現無法完成擋土工程之具體窒礙，預先表明願\n    協商變更設計，並非完全無變更設計之餘地。然高雄市政府\n    工務局於83年1 月18日對上訴人申請法定開工，依法准予備\n    查後，上訴人仍未進場施作擋土工程，經被上訴人於83年1\n    月22日、同年2 月5 日、同年2 月21日函催上訴人儘速進駐\n    工地施工（原審卷二第60、71、74頁），上訴人猶未動工施\n    作，且於同年2 月24日以存證信函表示解除系爭契約。綜觀\n    前情，足見被上訴人就系爭工程可能需定作人作為之事項，\n    均已善盡注意之責，上訴人不開工實際施作，卻一再主張系\n    爭工程需變更設計始得完成，而未據被上訴人變更，並執此\n    為由解除契約，於法顯屬未合。\n  (三)據上，堪認上訴人以系爭工程需要被上訴人變更設計，始能\n    完成，並非屬實，依民法第507 條規定，上訴人並無解除系\n    爭契約之權利，從而，上訴人對被上訴人所為解除系爭契約\n    之意思表示，自不生法律上效力；上訴人主張系爭契約經其\n    合法解除，而請求返還履約保證金，洵屬無據。反之，上訴\n    人拆除舊房舍後，即停工未再續作系爭工程，為兩造所不爭\n    ；而上訴人經被上訴人於83年1 、2 月間屢次催告，仍未進\n    場施作，已如前述，被上訴人迄至83年3 月、6 月間仍多次\n    催告或協調上訴人依約施作（原審卷二第77、86、124 頁）\n    ，惟上訴人猶未施作，核屬遲延工作，且可受歸責，則被上\n    訴人依民法第503 條、第254 條及系爭契約第23條第3 款，\n    於84年12月19日發函解除系爭契約，並於同日沒收履約保證\n    金，於法尚無不合；上訴人自無從請求返還履約保證金。併\n    此敘明。\n八、綜上所述，本件上訴人主張系爭工程依建築師之設計以鋼板\n    樁施工，係不能完成，為不足採，上訴人依民法第507 條規\n    定並無解除系爭契約之權利。上訴人遲未依約施作，且可受\n    歸責，則被上訴人依民法第503 條、第254 條及系爭契約第\n    23條第3 款，解除系爭契約並沒收履約保證金，係屬有據。\n    從而，上訴人主張本於民法第259 條契約解除後之回復原狀\n    請求權，請求被上訴人給付1,800 萬元及自89年10月26日起\n    至清償日止，按週年利率5%計算之利息，為無理由，不應准\n    許。其假執行之聲請失所依附，應併予駁回。原審為上訴人\n    敗訴之判決，並無不合。上訴意旨指摘原判決不當，求予廢\n    棄改判，為無理由，應予駁回。\n九、兩造其餘攻擊防禦方法，無礙本件勝負之判斷，爰不一一論\n    敘，附此敘明。\n十、據上論結，本件上訴為無理由，依民事訴訟法第449 條第1\n    項、第78條，判決如主文。"
  },
  "characters": {
    "judges": [
      "吳登輝",
      "甯馨"
    ],
    "prosecutors": [

    ],
    "lawyers": [
      "王進勝",
      "黃淑芬",
      "陶德斌",
      "有",
      "人或其法定代理人具有"
    ],
    "clerks": [

    ],
    "plaintiffs": [

    ],
    "defendants": [

    ],
    "prosecutor_office": [

    ],
    "creditors": [

    ],
    "debtors": [

    ],
    "judicial_associate_officer": [

    ]
  },
  "adjudged_at": "2010-05-12",
  "created_at": "2016-01-05 12:03:46",
  "updated_at": "2016-01-05 12:03:46"
}