{
  "identify": "SCD-99-竹小-140-20100512-1",
  "court": {
    "name": "臺灣新竹地方法院",
    "code": "SCD"
  },
  "division": {
    "name": "民事",
    "code": "V"
  },
  "year": 99,
  "word": "竹小",
  "number": "140",
  "jcheck": "1",
  "reason": "返還消費借貸款",
  "content": "臺灣新竹地方法院民事裁定             99年度竹小字第140號\n原      告  合作金庫商業銀行股份有限公司\n法定代理人  丙○○\n訴訟代理人  戊○○\n被      告  丁○○\n            乙○○\n            甲○○\n上列當事人間請求返還消費借貸款事件，本院裁定如下：\n    主  文\n本件移送臺灣板橋地方法院。\n    理  由\n一、按訴訟，由被告住所地之法院管轄；又共同訴訟之被告數人\n    ，其住所不在一法院管轄區域內者，各該住所地之法院俱有\n    管轄權；再訴訟之全部或一部，法院認為無管轄權者，依原\n    告聲請或依職權以裁定移送其管轄法院；復小額事件當事人\n    之一造為法人或商人者，於其預定用於同類契約之條款，約\n    定債務履行地或以合意定第一審管轄法院時，不適用第12條\n    或第24條之規定。但兩造均為法人或商人者，不在此限。民\n    事訴訟法第1 條第1 項前段、第20條前段、第28條第1 項及\n    第436條之9 分別定有明文。\n二、經查，本件係因財產權發生爭執，其標的金額在新台幣100,\n    000 元以下，依民事訴訟法第436 條之8 規定，應適用小額\n    訴訟程序。且依兩造所簽立個人消費性貸款契約第20條約定\n    足悉，本件契約雖有約定如涉訟時，兩造合意以本院為第一\n    審管轄法院。惟該條但書亦已約定前開合意管轄之約定，不\n    得排除消費者保護法第47條或民事訴訟法第436 條之9 小額\n    訴訟管轄法院之適用等語，茲本件既屬小額訴訟，揆之上開\n    規定，顯不適用前開合意管轄之約定甚明。而查，本件被告\n    丁○○之住所地在台北縣鶯歌鎮○○里○○鄰○○路700 巷26\n    號、被告乙○○之住所地在台北市○○區○○里○○鄰○○路\n    ○段320 巷30弄2 號2 樓、被告甲○○之住所地則係在桃園\n    縣桃園市○○街456 巷90弄20號，此有被告之戶籍謄本附卷\n    可稽，因其等住所均非屬本院管轄區域，是本院就本件並無\n    管轄權。又原告請求被告連帶給付，核屬必要共同訴訟，因\n    本件借款之主債務人丁○○住所地之管轄法院，為被告三人\n    住所地之居中位置，為便利另二位被告應訴，自應全部由台\n    灣板橋地方法院管轄。茲原告向無管轄權之本院起訴，顯係\n    違誤。爰依聲請將本件移送於該管轄法院。\n三、依首開法條裁定如主文。\n中    華    民    國    99    年    5     月    12    日\n                    新竹簡易庭  法  官  高敏俐\n以上正本係照原本作成。\n如對本裁定抗告，須於裁定送達後10日內向本院提出抗告狀。\n中    華    民    國    99    年    5     月    12    日\n                                書記官  黎秀娟",
  "structure": {
    "main": "本件移送臺灣板橋地方法院。",
    "reason": "一、按訴訟，由被告住所地之法院管轄；又共同訴訟之被告數人\n    ，其住所不在一法院管轄區域內者，各該住所地之法院俱有\n    管轄權；再訴訟之全部或一部，法院認為無管轄權者，依原\n    告聲請或依職權以裁定移送其管轄法院；復小額事件當事人\n    之一造為法人或商人者，於其預定用於同類契約之條款，約\n    定債務履行地或以合意定第一審管轄法院時，不適用第12條\n    或第24條之規定。但兩造均為法人或商人者，不在此限。民\n    事訴訟法第1 條第1 項前段、第20條前段、第28條第1 項及\n    第436條之9 分別定有明文。\n二、經查，本件係因財產權發生爭執，其標的金額在新台幣100,\n    000 元以下，依民事訴訟法第436 條之8 規定，應適用小額\n    訴訟程序。且依兩造所簽立個人消費性貸款契約第20條約定\n    足悉，本件契約雖有約定如涉訟時，兩造合意以本院為第一\n    審管轄法院。惟該條但書亦已約定前開合意管轄之約定，不\n    得排除消費者保護法第47條或民事訴訟法第436 條之9 小額\n    訴訟管轄法院之適用等語，茲本件既屬小額訴訟，揆之上開\n    規定，顯不適用前開合意管轄之約定甚明。而查，本件被告\n    丁○○之住所地在台北縣鶯歌鎮○○里○○鄰○○路700 巷26\n    號、被告乙○○之住所地在台北市○○區○○里○○鄰○○路\n    ○段320 巷30弄2 號2 樓、被告甲○○之住所地則係在桃園\n    縣桃園市○○街456 巷90弄20號，此有被告之戶籍謄本附卷\n    可稽，因其等住所均非屬本院管轄區域，是本院就本件並無\n    管轄權。又原告請求被告連帶給付，核屬必要共同訴訟，因\n    本件借款之主債務人丁○○住所地之管轄法院，為被告三人\n    住所地之居中位置，為便利另二位被告應訴，自應全部由台\n    灣板橋地方法院管轄。茲原告向無管轄權之本院起訴，顯係\n    違誤。爰依聲請將本件移送於該管轄法院。\n三、依首開法條裁定如主文。"
  },
  "characters": {
    "judges": [
      "高敏俐"
    ],
    "prosecutors": [

    ],
    "lawyers": [

    ],
    "clerks": [

    ],
    "plaintiffs": [
      "合作金庫商業銀行股份有限公司"
    ],
    "defendants": [
      "丁○○"
    ],
    "prosecutor_office": [

    ],
    "creditors": [

    ],
    "debtors": [

    ],
    "judicial_associate_officer": [

    ]
  },
  "adjudged_at": "2010-05-12",
  "created_at": "2016-01-05 12:45:49",
  "updated_at": "2016-01-05 12:45:49"
}