{
  "identify": "SCD-99-聲-416-20100512-1",
  "court": {
    "name": "臺灣新竹地方法院",
    "code": "SCD"
  },
  "division": {
    "name": "刑事",
    "code": "M"
  },
  "year": 99,
  "word": "聲",
  "number": "416",
  "jcheck": "1",
  "reason": "聲請發還保證金",
  "content": "臺灣新竹地方法院刑事裁定  99年度聲字第416號\n聲  請  人  甲○○\n即  具保人\n被      告  乙○○\n上列聲請人即具保人因被告贓物案件，聲請發還保證金，本院裁\n定如下：\n    主  文\n聲請駁回。\n    理  由\n一、本件聲請意旨略以：被告乙○○涉嫌贓物案件，經本院以民\n    國98年度易字第167 號審理在案。茲被告已到案，聲請人前\n    繳付保證金聲請准予發還。茲聲請人已逾65歲，以打零工維\n    生，被告執行後，聲請人須扶養被告之兄所遺留2 名子女，\n    家中經濟困難，請准予發還保證金應急等語。\n二、按撤銷羈押、再執行羈押、受不起訴處分或因裁判而致羈押\n    之效力消滅者，免除具保之責任；免除具保之責任或經退保\n    者，應將保證書註銷或將未沒入之保證金發還，刑事訴訟法\n    第119 條第1 項、第3 項定有明文。是以刑事保證金於具保\n    責任免除後，始得發還，故被告除因前開事由而免除具保之\n    責任外，於起訴後，如經獲判無罪、免訴、免刑、緩刑、不\n    受理確定，或有罪判決確定經依法執行時，即應發還保證金\n    ，殆無疑義。\n三、經查，被告乙○○涉犯贓物案件，前經臺灣新竹地方法院檢\n    察官通緝到案後，准予新臺幣8,000 元具保候傳，聲請人繳\n    納保證金後，經該署檢察官釋放被告，而被告涉犯贓物罪嫌\n    ，亦經該署檢察官提起公訴，於98年2 月27日繫屬本院，現\n    仍由本院審理中等情，業據本院調閱前開卷宗核閱屬實。是\n    以被告乙○○涉犯贓物案件既尚未經判決確定，亦無從執行\n    ，且本院復未對被告乙○○再執行羈押，難認聲請人即具保\n    人之保證責任業已免除。\n四、至被告前因毒品案件，雖經本院於98年度10月20日以98年竹\n    東簡字第162 號判決判處有期徒刑6 月確定，於99年3 月15\n    日入監執行，亦有臺灣高等法院被告前案紀錄表附卷可憑。\n    惟聲請人前所繳付之保證金係為保全被告乙○○涉犯贓物案\n    件之追訴、審判或執行，與被告目前執行毒品案件無涉，尚\n    無從以被告因前案入監執行，而認具保人具保責任已免除。\n    從而，聲請人聲請發還已繳付之保證金於法不合，不應准許\n    ，應予駁回。\n四、依刑事訴訟法第220條，裁定如主文。\n中    華    民    國    99    年    5     月    12    日\n                  刑事第四庭    審判長法  官    黃美文\n                                      法  官    朱美璘\n                                      法  官    邱玉汝\n以上正本證明與原本無異。\n如不服本裁定應於送達後5日內向本院提出抗告狀。\n中    華    民    國    99    年    5     月    12    日\n                                      書記官    陳怡芳",
  "structure": {
    "main": "聲請駁回。",
    "reason": "一、本件聲請意旨略以：被告乙○○涉嫌贓物案件，經本院以民\n    國98年度易字第167 號審理在案。茲被告已到案，聲請人前\n    繳付保證金聲請准予發還。茲聲請人已逾65歲，以打零工維\n    生，被告執行後，聲請人須扶養被告之兄所遺留2 名子女，\n    家中經濟困難，請准予發還保證金應急等語。\n二、按撤銷羈押、再執行羈押、受不起訴處分或因裁判而致羈押\n    之效力消滅者，免除具保之責任；免除具保之責任或經退保\n    者，應將保證書註銷或將未沒入之保證金發還，刑事訴訟法\n    第119 條第1 項、第3 項定有明文。是以刑事保證金於具保\n    責任免除後，始得發還，故被告除因前開事由而免除具保之\n    責任外，於起訴後，如經獲判無罪、免訴、免刑、緩刑、不\n    受理確定，或有罪判決確定經依法執行時，即應發還保證金\n    ，殆無疑義。\n三、經查，被告乙○○涉犯贓物案件，前經臺灣新竹地方法院檢\n    察官通緝到案後，准予新臺幣8,000 元具保候傳，聲請人繳\n    納保證金後，經該署檢察官釋放被告，而被告涉犯贓物罪嫌\n    ，亦經該署檢察官提起公訴，於98年2 月27日繫屬本院，現\n    仍由本院審理中等情，業據本院調閱前開卷宗核閱屬實。是\n    以被告乙○○涉犯贓物案件既尚未經判決確定，亦無從執行\n    ，且本院復未對被告乙○○再執行羈押，難認聲請人即具保\n    人之保證責任業已免除。\n四、至被告前因毒品案件，雖經本院於98年度10月20日以98年竹\n    東簡字第162 號判決判處有期徒刑6 月確定，於99年3 月15\n    日入監執行，亦有臺灣高等法院被告前案紀錄表附卷可憑。\n    惟聲請人前所繳付之保證金係為保全被告乙○○涉犯贓物案\n    件之追訴、審判或執行，與被告目前執行毒品案件無涉，尚\n    無從以被告因前案入監執行，而認具保人具保責任已免除。\n    從而，聲請人聲請發還已繳付之保證金於法不合，不應准許\n    ，應予駁回。\n四、依刑事訴訟法第220條，裁定如主文。"
  },
  "characters": {
    "judges": [
      "黃美文",
      "朱美璘",
      "邱玉汝"
    ],
    "prosecutors": [

    ],
    "lawyers": [

    ],
    "clerks": [

    ],
    "plaintiffs": [

    ],
    "defendants": [
      "乙○○"
    ],
    "prosecutor_office": [
      "甲"
    ],
    "creditors": [

    ],
    "debtors": [

    ],
    "judicial_associate_officer": [

    ]
  },
  "adjudged_at": "2010-05-12",
  "created_at": "2016-01-05 12:42:03",
  "updated_at": "2016-01-05 12:42:03"
}