{
  "identify": "SCD-99-審竹簡-586-20100512-1",
  "court": {
    "name": "臺灣新竹地方法院",
    "code": "SCD"
  },
  "division": {
    "name": "刑事",
    "code": "M"
  },
  "year": 99,
  "word": "審竹簡",
  "number": "586",
  "jcheck": "1",
  "reason": "詐欺",
  "content": "臺灣新竹地方法院刑事簡易判決       99年度審竹簡字第586號\n聲  請  人  臺灣新竹地方法院檢察署檢察官\n被      告  甲○○\n上列被告因詐欺案件，經檢察官聲請以簡易判決處刑（98年度偵\n字第9124號），本院判決如下：\n    主  文\n甲○○幫助犯詐欺取財罪，處有期徒刑伍月，如易科罰金，以新\n臺幣壹仟元折算壹日。緩刑貳年，緩刑期內付保護管束，並應於\n判決確定後壹年內，向執行檢察官指定之政府機關、政府機構、\n行政法人、社區或其他符合公益目的之機構或團體，提供壹佰小\n時之義務勞務。\n    事實及證據理由\n一、本件犯罪事實：\n    甲○○明知近年來臺灣社會盛行以虛設、租賃、借用或買賣\n    人頭帳戶之方式，供詐騙集團作為詐欺他人交付財物或恐嚇\n    他人交付贖金等不法用途，亦知金融機構帳戶係個人理財之\n    重要工具，且關係個人財產、信用之表徵，應可預見他人向\n    其收購金融機構帳戶之存摺、印章、金融卡及可語音查詢個\n    人存款帳戶之密碼者，目的及手段詭異，應有持帳戶等相關\n    物件，供己詐騙或恐嚇他人錢財之意圖，其亦知悉提供帳戶\n    之存摺、金融卡供他人使用，具有幫助掩飾或藏匿他人犯罪\n    所得財物之可能性，竟仍基於縱有人以其金融帳戶實施詐欺\n    犯罪亦不違背其本意之幫助詐騙集團從事詐欺取財行為的犯\n    罪意思，於民國97年8 月13日至同月15日間之某日，在不詳\n    地點，將其於96年10月31日向臺灣中小企業銀行竹東分行所\n    申辦之帳號00000000000 號帳戶、於97年8 月13日向玉山銀\n    行桃鶯分行所申辦之帳號0000000000000 號（聲請書誤載為\n    0000000000000 號）帳戶之存摺、提款卡及密碼，同時交予\n    某真實姓名年籍不詳人士使用。嗣該真實姓名年籍不詳人士\n    所屬之詐欺集團成員出於為自己不法所有目的的犯罪意思，\n    (1)於97年8 月14日在雅虎奇摩網站刊登出售電腦零件訊息，\n    致乙○○陷於錯誤，而依指示於97年8 月15日晚上6 時3 分\n    許、同日晚上9 時2 分許，以跨行轉帳方式，分別匯款新臺\n    幣（下同）1 萬6,979 元、1 萬0,321 元至甲○○上開臺灣\n    中小企業銀行帳戶內，上開款項隨即遭提領一空；(2)又於97\n    年8 月22日凌晨1 時30分許，撥打電話予丙○○，向丙○○\n    佯稱若不付援交費用，將對其不利等等，致丙○○陷於錯誤\n    ，依該詐騙集團成員指示，於同日凌晨3 時6 分許，以轉帳\n    方式匯款2 萬9,983 元至甲○○上開玉山銀行桃鶯分行帳戶\n    內，上開款項隨即遭提領一空。嗣因乙○○、丙○○發覺有\n    異，報警處理，始循線查悉上情。\n二、證據及理由：\n（一）被告甲○○於警局詢問時及檢察官偵查中之供述。\n（二）證人即被害人乙○○於警詢時之指述，及證人即被害人丙\n      ○○於警詢時及偵查中之指述。\n（三）被告甲○○之臺灣中小企業銀行竹東分行開戶基本資料及\n      交易明細、被告之玉山銀行桃鶯分行開戶資料及交易紀錄\n      各1 份在卷可查。\n（四）被害人乙○○之自動化服務機器跨行轉帳交易明細資料、\n      被害人丙○○之台新銀行自動櫃員機交易明細表各1 份附\n      卷可查。\n（五）內政部警政署反詐騙諮詢專線紀錄表、臺南市警察局第五\n      分局立人派出所受理各類案件紀錄表、受理刑事案件報案\n      三聯單、金融機構聯防機制通報單各1 份在卷可證。\n（六）新竹縣政府警察局竹東分局99年3 月2 日竹縣東警偵字第\n      0996000974號回函附卷可證。\n（七）被告甲○○雖坦承上開2 本帳戶為其申請，惟矢口否認有\n      何提供帳戶供詐欺集團詐騙他人匯款之幫助詐欺犯行，辯\n      稱：當時遺失臺灣中小企銀、玉山銀行的存摺及上述2 本\n      的提款卡、身分證影本，並將提款密碼寫小紙條夾在玉山\n      銀行的存摺內一起遺失等等。惟查：\n  １、按金融存款帳戶，事關存戶個人財產權益之保障，一般人\n      均有妥為保管阻止他人任意使用之認識，縱係存摺遭竊，\n      理當即刻掛失止付，以防帳戶內金錢遭人竊領，甚或遭人\n      以之作為犯罪工具使用。本件被告竟然對屬個人重要之金\n      融帳戶僅空言上開存摺、提款卡及密碼不見，且被告未能\n      具體說明，上開帳戶為何會遭詐騙集團使用，若係單純不\n      見，則該帳戶應仍在某處，則詐騙集團如何取得該帳戶？\n      自與常情不合，顯見其所辯係臨訟杜撰卸責之詞，不足採\n      信。\n  ２、又各金融機構之提款卡之密碼僅係提供帳戶所有人知悉，\n      金融卡所有人亦通常會另外自行設定，他人實無從知悉該\n      密碼為何，苟單純僅係遺失帳戶存摺及提款卡，他人難以\n      使用上開帳戶作為提款之工具，況一般設定密碼，必以自\n      身熟悉而旁人無從猜測之數字組合為要，被告不僅將存摺\n      及提款卡放置於同一處所，提高遭人盜領之危險性，且將\n      提款密碼寫在小紙條，並夾在玉山銀行的存摺內，而與提\n      款卡放在一起，則形同未設密碼，豈不違背常理，啟人疑\n      竇。再被害人係因受詐騙集團之詐術而轉帳，倘詐騙集團\n      係隨機竊得被告失竊之提款卡，衡情當無罔顧業已花費大\n      量人力、物力、時間詐得被害人信任後，命被害人匯款至\n      一隨時可能因掛失止付而不能提領款項之帳戶內之理？是\n      詐騙集團於命被害人匯款入被告前揭帳戶內時，應已確信\n      被告該帳戶可供正常使用，不致因被告掛失而無法使用，\n      且已確切知悉提款卡之密碼。而就此等事務之經驗法則判\n      斷，則需被告自行提供存摺、提款卡等物，並告知提款卡\n      密碼始能達成，從而堪認被告確曾交付前揭帳戶之存摺、\n      提款卡予詐騙集團以利其詐騙他人財物，則被告所辯該帳\n      戶係遺失等等，自難採信。\n  ３、被告將上開存摺、提款卡提供予不詳姓名年籍之人使用，\n      卻無法供明有何確信不至遭利用為犯罪之情事，顯見被告\n      容任該人利用其帳戶據以詐欺取財，並不違被告之本意。\n      況邇來，詐騙集團詐欺取財之犯罪類型層出不窮，該等犯\n      罪多數係利用人頭帳戶作為出入帳戶，並經媒體多次廣為\n      披載，被告既係成年且智力成熟之人，對此應知之甚詳，\n      竟仍將其銀行之存摺、提款卡等提供該人，而該人果然據\n      以為犯詐欺取財罪之出入帳戶，足見被告有容任該人利用\n      其帳戶犯詐欺取財罪之不確定故意，允無疑義。\n  ４、綜上所述，被告上開辯解無非卸責之詞，不足採信。本件\n      事證明確，被告犯行堪以認定，應依法論科。\n三、論罪及科刑：\n（一）論罪：\n  １、按幫助犯之成立，主觀上行為人須有幫助故意，客觀上須\n      有幫助行為，亦即刑法上之幫助犯，係對於犯罪與正犯有\n      共同之認識，而以幫助之意思，對於正犯資以助力，而未\n      參與實施犯罪之行為者而言（最高法院75年度台上字第15\n      09號、84年度台上字第5998號、第6475號、88年度台上字\n      第1270號判決均同此意旨）。\n  ２、本件被告基於幫助他人詐欺取財之不確定故意，將其所有\n      之銀行存摺、提款卡及密碼提供予詐騙集團成員使用，以\n      利其誘使他人匯入款項後自該帳戶提領花用，被告所為亦\n      僅係刑法詐欺罪構成要件以外之行為，復無證據證明被告\n      有參與詐欺犯行之實施，應屬刑法第30條之幫助犯。\n  ３、查被告甲○○以一幫助行為，同時提供上開臺灣中小企銀\n      、玉山銀行帳戶之存摺、提款卡及密碼資料，為單純之一\n      幫助行為，其幫助犯罪集團分別詐取乙○○、丙○○等2\n      人之財物，應僅成立1 次幫助犯罪行為，核其所為，係犯\n      刑法第339 條第1 項、第30條第1 項前段之幫助詐欺取財\n      罪。又被告係幫助他人犯罪，爰依刑法第30條第2 項之規\n      定，按正犯之刑減輕之。\n（二）科刑：\n  １、主刑：審酌被告明知近年來國內多有詐欺、恐嚇集團犯案\n      ，均係使用人頭帳戶以作為收受不法所得款項之手段，竟\n      仍為幫助他人詐欺之犯行，以助長犯罪集團惡行，供詐欺\n      犯取得所騙財物之工具，其對於社會秩序之擾亂不言而喻\n      ，及其幫助詐欺行為對被害人造成之損害而無從求償，以\n      及被告犯罪後否認犯行等一切情狀，量處如主文所示之刑\n      ，並諭知易科罰金之折算標準，以資懲儆。\n  ２、緩刑及付保護管束：被告前未曾因故意犯罪受有期徒刑以\n      上刑之宣告，此有臺灣高等法院被告前案紀錄表及刑案資\n      料查註紀錄表各1 份在卷可查，因一時失慮致罹刑典，經\n      此次偵查程序及科刑之教訓後，應已知所警惕，相信不會\n      再犯，本院綜核各情認上開刑之宣告，已足策其自新，所\n      宣告之刑，以暫不執行為適當，爰併予宣告緩刑2 年。另\n      為使其深切反省，爰依98年9 月1 日施行之刑法第74條第\n      2 項第5 款之規定（依最高法院95年刑事庭第8 次會議決\n      議，關於緩刑之諭知，應逕以判決時之規定處斷），諭知\n      被告應於判決確定後1 年內，向執行檢察官指定之政府機\n      關、政府機構、行政法人、社區或其他符合公益目的之機\n      構或團體，提供100 小時之義務勞務，並依刑法第93條第\n      1 項第2 款諭知緩刑期內付保護管束，以啟自新，兼觀後\n      效。至於被告究應向何政府機關、政府機構、行政法人、\n      社區或其他符合公益目的之機構或團體提供義務勞務，屬\n      執行之問題，應由執行檢察官斟酌全案情節及各政府機關\n      、政府機構、行政法人、社區或其他符合公益目的之機構\n      或團體之需求，妥為指定。再者，倘被告違反上開所定負\n      擔情節重大，足認原宣告之緩刑難收其預期效果，而有執\n      行刑罰之必要，依刑法第75條之1 第1 項第4 款規定，得\n      撤銷其緩刑之宣告，併此敘明。\n四、依刑事訴訟法第449 條第1 項前段、第450 條第1 項、第45\n    4 條第1 項，刑法第339 條第1 項、第30條第1 項前段、第\n    2 項、第41條第1 項前段、第74條第1 項第1 款、第2 項第\n    5 款、第93條第1 項第2 款，刑法施行法第1 條之1 第1 項\n    、第2 項前段，逕以簡易判決處刑如主文。\n五、如不服本件判決，得自收受送達之日起10日內，向本院提起\n    上訴。\n中    華    民    國    99    年    5     月    12    日\n                    新竹簡易庭法  官          馮俊郎\n以上正本證明與原本無異。\n中    華    民    國    99    年    5     月    12    日\n                              書記官          王思穎\n附錄本案論罪科刑實體法條全文：\n刑法第339 條第1 項：\n意圖為自己或第三人不法之所有，以詐術使人將本人或第三人之\n物交付者，處5 年以下有期徒刑、拘役或科或併科1,000 元以下\n罰金。（罰金之貨幣單位改為新臺幣，並提高為30倍）\n【刑法第30條：幫助他人實行犯罪行為者，為幫助犯。雖他人\n不知幫助之情者，亦同。幫助犯之處罰，得按正犯之刑減輕之\n。】",
  "structure": {
  },
  "characters": {
    "judges": [
      "馮俊郎"
    ],
    "prosecutors": [

    ],
    "lawyers": [

    ],
    "clerks": [
      "王思穎"
    ],
    "plaintiffs": [

    ],
    "defendants": [
      "甲○○"
    ],
    "prosecutor_office": [
      "臺灣新竹地方法院檢察署檢察官"
    ],
    "creditors": [

    ],
    "debtors": [

    ],
    "judicial_associate_officer": [

    ]
  },
  "adjudged_at": "2010-05-12",
  "created_at": "2016-01-05 12:42:32",
  "updated_at": "2016-01-05 12:42:32"
}