{
  "identify": "SCD-99-審竹簡-502-20100512-1",
  "court": {
    "name": "臺灣新竹地方法院",
    "code": "SCD"
  },
  "division": {
    "name": "刑事",
    "code": "M"
  },
  "year": 99,
  "word": "審竹簡",
  "number": "502",
  "jcheck": "1",
  "reason": "詐欺",
  "content": "臺灣新竹地方法院刑事簡易判決       99年度審竹簡字第502號\n聲  請  人  臺灣新竹地方法院檢察署檢察官\n被      告  甲○○\n上列被告因詐欺案件，經檢察官聲請以簡易判決處刑（99年度偵\n字第2171號），本院判決如下：\n    主  文\n甲○○幫助犯詐欺取財罪，處有期徒刑月，如易科罰金，以新\n臺幣壹仟元折算壹日。緩刑貳年，緩刑期內付保護管束，並應於\n判決確定後壹年內，向執行檢察官指定之政府機關、政府機構、\n行政法人、社區或其他符合公益目的之機構或團體，提供肆拾小\n時之義務勞務。\n    事實及證據\n一、本件犯罪事實：\n    甲○○明知近年來臺灣社會盛行以虛設、租賃、借用或買賣\n    人頭帳戶之方式，供詐騙集團作為詐欺他人交付財物或恐嚇\n    他人交付贖金等不法用途，亦知金融機構帳戶係個人理財之\n    重要工具，且關係個人財產、信用之表徵，應可預見他人向\n    其收購金融機構帳戶之存摺、印章、金融卡及可語音查詢個\n    人存款帳戶之密碼者，目的及手段詭異，應有持帳戶等相關\n    物件，供己詐騙或恐嚇他人錢財之意圖，其亦知悉提供帳戶\n    之存摺、金融卡供他人使用，具有幫助掩飾或藏匿他人犯罪\n    所得財物之可能性，竟仍基於縱有人以其金融帳戶實施詐欺\n    犯罪亦不違背其本意之幫助詐騙集團從事詐欺取財行為的犯\n    罪意思，於民國98年4 月底某日晚上10時許，將其所有之中\n    華郵政湖口郵局（下稱湖口郵局）局號0000000 號、帳號00\n    00000 號帳戶之存摺、提款卡及密碼，在新竹縣湖口鄉湖口\n    火車站旁之「萊爾富便利商店」前，以新臺幣（下同）3,00\n    0 元之代價，出租予真實姓名年籍不詳之成年男子使用。嗣\n    該成年男子所屬之詐欺集團取得上開帳戶資料後，即出於為\n    自己不法所有目的的犯罪意思，於98年5 月12日上午11時許\n    ，撥打電話予周明財，佯稱急需用錢等等，致周明財誤為其\n    女兒來電而陷於錯誤，前往位於臺北縣三重市○○路14號之\n    中山郵局，依該詐欺集團成員指示操作，於同日下午2 時56\n    分許，匯款13萬元至甲○○上開湖口郵局帳戶內，並旋遭提\n    領。嗣因周明財察覺有異發現受騙，經報警處理，始循線查\n    悉上情。\n二、證據：\n（一）被告甲○○於警局詢問時之供述，及檢察官偵查中之自白\n      。\n（二）證人即被害人周明財於警詢時及偵查中之證述。\n（三）郵政國內匯款執據、上開湖口郵局帳戶之開戶資料及交易\n      明細各1 份附卷可查。\n三、論罪及科刑：\n（一）論罪：\n  １、按幫助犯之成立，主觀上行為人須有幫助故意，客觀上須\n      有幫助行為，亦即刑法上之幫助犯，係對於犯罪與正犯有\n      共同之認識，而以幫助之意思，對於正犯資以助力，而未\n      參與實施犯罪之行為者而言（最高法院75年度台上字第15\n      09號、84年度台上字第5998號、第6475號、88年度台上字\n      第1270號判決均同此意旨）。\n  ２、本件被告基於幫助他人詐欺取財之不確定故意，將其所有\n      之郵局存摺、提款卡及密碼提供予詐騙集團成員使用，以\n      利其誘使他人匯入款項後自該帳戶提領花用，被告所為亦\n      僅係刑法詐欺罪構成要件以外之行為，復無證據證明被告\n      有參與詐欺犯行之實施，應屬刑法第30條之幫助犯。\n  ３、核被告甲○○所為，係犯刑法第339 條第1 項、第30條第\n      1 項前段之幫助詐欺取財罪。又被告係幫助他人犯罪，爰\n      依刑法第30條第2 項之規定，按正犯之刑減輕之。\n（二）科刑：\n  １、主刑：審酌被告明知近年來國內多有詐欺、恐嚇集團犯案\n      ，均係使用人頭帳戶以作為收受不法所得款項之手段，竟\n      仍為幫助他人詐欺之犯行，以助長犯罪集團惡行，供詐欺\n      犯取得所騙財物之工具，其對於社會秩序之擾亂不言而喻\n      ，及其幫助詐欺行為對被害人造成之損害而無從求償，以\n      及被告犯後坦白承認犯行等一切情狀，量處如主文所示之\n      刑，並諭知易科罰金之折算標準，以資懲儆。\n  ２、緩刑及付保護管束：被告前未曾因故意犯罪受有期徒刑以\n      上刑之宣告，此有臺灣高等法院被告前案紀錄表及刑案資\n      料查註紀錄表各1 份在卷可查，因一時失慮致罹刑典，經\n      此次偵查程序及科刑之教訓後，應已知所警惕，相信不會\n      再犯，本院綜核各情認上開刑之宣告，已足策其自新，所\n      宣告之刑，以暫不執行為適當，爰併予宣告緩刑2 年。另\n      為使其深切反省，爰依刑法第74條第2 項第5 款之規定，\n      諭知被告應於判決確定後1 年內，向執行檢察官指定之政\n      府機關、政府機構、行政法人、社區或其他符合公益目的\n      之機構或團體，提供40小時之義務勞務，並依刑法第93條\n      第1 項第2 款諭知緩刑期內付保護管束，以啟自新，兼觀\n      後效。至於被告究應向何政府機關、政府機構、行政法人\n      、社區或其他符合公益目的之機構或團體提供義務勞務，\n      屬執行之問題，應由執行檢察官斟酌全案情節及各政府機\n      關、政府機構、行政法人、社區或其他符合公益目的之機\n      構或團體之需求，妥為指定。再者，倘被告違反上開所定\n      負擔情節重大，足認原宣告之緩刑難收其預期效果，而有\n      執行刑罰之必要，依刑法第75條之1 第1 項第4 款規定，\n      得撤銷其緩刑之宣告，併此敘明。\n四、依刑事訴訟法第449 條第1 項前段、第450 條第1 項、第45\n    4 條第1 項，刑法第339 條第1 項、第30條第1 項前段、第\n    2 項、第41條第1 項前段、第74條第1 項第1 款、第2 項第\n    5 款、第93條第1 項第2 款，刑法施行法第1 條之1 第1項\n    、第2 項前段，逕以簡易判決處刑如主文。\n五、如不服本件判決，得自收受送達之日起10日內，向本院提起\n    上訴。\n中    華    民    國    99    年    5     月    12    日\n                    新竹簡易庭法  官          馮俊郎\n以上正本證明與原本無異。\n中    華    民    國    99    年    5     月    12    日\n                              書記官          王思穎\n附錄本案論罪科刑實體法條全文：\n刑法第339 條第1 項：\n意圖為自己或第三人不法之所有，以詐術使人將本人或第三人之\n物交付者，處5 年以下有期徒刑、拘役或科或併科1,000 元以下\n罰金。（罰金之貨幣單位改為新臺幣，並提高為30倍）\n【刑法第30條：幫助他人實行犯罪行為者，為幫助犯。雖他人\n不知幫助之情者，亦同。幫助犯之處罰，得按正犯之刑減輕之\n。】",
  "structure": {
  },
  "characters": {
    "judges": [
      "馮俊郎"
    ],
    "prosecutors": [

    ],
    "lawyers": [

    ],
    "clerks": [
      "王思穎"
    ],
    "plaintiffs": [

    ],
    "defendants": [
      "甲○○"
    ],
    "prosecutor_office": [
      "臺灣新竹地方法院檢察署檢察官"
    ],
    "creditors": [

    ],
    "debtors": [

    ],
    "judicial_associate_officer": [

    ]
  },
  "adjudged_at": "2010-05-12",
  "created_at": "2016-01-05 12:42:26",
  "updated_at": "2016-01-05 12:42:26"
}