{
  "identify": "SLD-99-拍-188-20100512-1",
  "court": {
    "name": "臺灣士林地方法院",
    "code": "SLD"
  },
  "division": {
    "name": "民事",
    "code": "V"
  },
  "year": 99,
  "word": "拍",
  "number": "188",
  "jcheck": "1",
  "reason": "拍賣抵押物",
  "content": "臺灣士林地方法院民事裁定               99年度拍字第188號\n聲  請  人  合作金庫商業銀行股份有限公司\n法定代理人  丙○○\n非訟代理人  甲○○\n相  對  人  乙○○\n上列當事人間聲請拍賣抵押物事件，本院裁定如下：\n    主  文\n相對人所有如附表所示之不動產准予拍賣。\n聲請程序費用新臺幣貳仟元由相對人負擔。\n    理  由\n一、按抵押權人，於債權已屆清償期，而未受清償者，得聲請法\n    院，拍賣抵押物，就其賣得價金而受清償。民法第873 條定\n    有明文。而上開規定，為最高限額抵押權所準用，此觀諸民\n    民法第881 條之17規定自明。\n二、聲請意旨略以：相對人於民國97年6 月9 日，以其所有如附\n    表所示之不動產，為擔保對伊現在（包括過去所負現在尚未\n    清償）及將來所負一切債務之清償責任，設定新臺幣（下同\n    ）810 萬元之最高限額抵押權，擔保債權確定期日127 年6\n    月8 日，債務清償日期依照各個債務契約所定清償日期，經\n    97年6 月20日登記在案。\n三、嗣相對人於97年6 月24日向聲請人借款600 萬元，其借款期\n    間、利息暨違約金計算方式均載明於借據內，如任何一宗債\n    務不依約付息時，即喪失期限之利益，應即全部償還，並應\n    依約支付違約金。詎相對人未依約繳納本息，尚欠本金共計\n    600 萬元及利息、違約金未為清償，依上開約定，本件借款\n    應視為全部到期。聲請人為此聲請拍賣抵押物以資受償，提\n    出他項權利證明書、抵押權設定契約書、土地及建物登記謄\n    本、借據、催告通知書等影本為證，經核尚無不合，應予准\n    許。\n四、爰裁定如主文。\n中    華    民    國    99    年    5     月    12    日\n                      民事庭法  官  藍雅清\n以上正本證明與原本無異。\n如不服本裁定，應於裁定送達後10日之不變期間內，向本院提出\n抗告狀，並繳納抗告費新臺幣1,000 元。\n中    華    民    國    99    年    5     月    14    日\n                            書記官  蘇意絜",
  "structure": {
    "main": "相對人所有如附表所示之不動產准予拍賣。\n聲請程序費用新臺幣貳仟元由相對人負擔。",
    "reason": "一、按抵押權人，於債權已屆清償期，而未受清償者，得聲請法\n    院，拍賣抵押物，就其賣得價金而受清償。民法第873 條定\n    有明文。而上開規定，為最高限額抵押權所準用，此觀諸民\n    民法第881 條之17規定自明。\n二、聲請意旨略以：相對人於民國97年6 月9 日，以其所有如附\n    表所示之不動產，為擔保對伊現在（包括過去所負現在尚未\n    清償）及將來所負一切債務之清償責任，設定新臺幣（下同\n    ）810 萬元之最高限額抵押權，擔保債權確定期日127 年6\n    月8 日，債務清償日期依照各個債務契約所定清償日期，經\n    97年6 月20日登記在案。\n三、嗣相對人於97年6 月24日向聲請人借款600 萬元，其借款期\n    間、利息暨違約金計算方式均載明於借據內，如任何一宗債\n    務不依約付息時，即喪失期限之利益，應即全部償還，並應\n    依約支付違約金。詎相對人未依約繳納本息，尚欠本金共計\n    600 萬元及利息、違約金未為清償，依上開約定，本件借款\n    應視為全部到期。聲請人為此聲請拍賣抵押物以資受償，提\n    出他項權利證明書、抵押權設定契約書、土地及建物登記謄\n    本、借據、催告通知書等影本為證，經核尚無不合，應予准\n    許。\n四、爰裁定如主文。"
  },
  "characters": {
    "judges": [
      "藍雅清"
    ],
    "prosecutors": [

    ],
    "lawyers": [

    ],
    "clerks": [

    ],
    "plaintiffs": [

    ],
    "defendants": [

    ],
    "prosecutor_office": [
      "合作金庫商業銀行股份有限公司"
    ],
    "creditors": [

    ],
    "debtors": [

    ],
    "judicial_associate_officer": [

    ]
  },
  "adjudged_at": "2010-05-12",
  "created_at": "2016-01-05 12:22:00",
  "updated_at": "2016-01-05 12:22:00"
}