{
  "identify": "SLD-99-撤緩-69-20100512-1",
  "court": {
    "name": "臺灣士林地方法院",
    "code": "SLD"
  },
  "division": {
    "name": "刑事",
    "code": "M"
  },
  "year": 99,
  "word": "撤緩",
  "number": "69",
  "jcheck": "1",
  "reason": "撤銷緩刑",
  "content": "臺灣士林地方法院刑事裁定              99年度撤緩字第69號\n聲  請  人  臺灣士林地方法院檢察署檢察官\n被      告  甲○\n上列聲請人因受刑人即被告偽造文書案件，聲請撤銷緩刑之宣告\n（99年度執聲字第451 號，前審案號：本院97年度簡字第115 號\n），本院裁定如下：\n    主  文\n甲○之緩刑宣告撤銷。\n    理  由\n一、聲請意旨略以：受刑人甲○因犯偽造文書案件，經本院於民\n    國97年2 月18日以97年度簡字第115 號（96年度偵字第1412\n    7 號）判決處有期徒刑3 月，緩刑3 年，並應支付被害人陳\n    建達新台幣（下同）26萬元，自97年3 月25日起，按月於每\n    月25日以前給付1 萬3,000 元，至全部清償完畢為止，如有\n    一期未履行，視為全部到期，於97年3 月17日確定在案。經\n    查受刑人於97年4 月25日經臺灣士林地方法院檢察署檢察官\n    傳訊到案，庭呈支付給被害人1 萬3,000 元匯款單後，經臺\n    灣士林地方法院檢察署檢察官函催、傳喚，受刑人皆置之不\n    理。被害人於99年4 月29日到庭陳述受刑人僅支付97年3 月\n    至同年6 月共4 期5 萬2,000 元後，即置之不理。足認原宣\n    告之緩刑難收其預期效果，核受刑人所為，已合於刑法第75\n    條之1 第1 項第4 款所定撤銷緩刑宣告之原因，爰依刑事訴\n    訟法第476 條規定聲請撤銷緩刑等語。\n二、按緩刑之宣告，得斟酌情形，命犯罪行為人向被害人支付相\n    當數額之財產或非財產上之損害賠償；又受緩刑之宣告，違\n    反第74條第2 項第1 款至第8 款所定負擔情節重大，足認原\n    宣告之緩刑難收其預期效果，而有執行刑罰之必要者，得撤\n    銷其宣告，刑法第74條第2 項第3款、第75條之1 第1 項第4\n    款，分別定有明文。\n三、經查，受刑人即被告因犯偽造文書案件，經本院以97年度簡\n    字第115 號（96年度偵字第14127 號）判處有期徒刑6 月，\n    減為有期徒刑3 月，緩刑3 年，並自97年3 月25日起至98年\n    10月25日止，按月於每月25日給付被害人1 萬3,000 元，合\n    計26萬元之財產上損害賠償，該案於97年3 月17日確定，此\n    有卷附之上開判決書及臺灣高等法院被告前案紀錄表在卷可\n    稽。惟受刑人就上開緩刑之負擔，除於97年3 月至6 月各按\n    月支付1 萬3,000 元（共4 次）予被害人外，餘經檢察官以\n    其住居所址通知應支付被害人損害賠償26萬元並檢送支付證\n    明文件及傳喚到案說明均置之不理，亦未到案，其中其位於\n    臺北縣三重市居所址之通知書、傳票則均遭以查無此人退回\n    等情，業經被害人到庭陳述暨提出存摺影本在卷，復有受刑\n    人97年4 月25日庭提之自動櫃員機交易明細表、受刑人個人\n    基本資料查詢結果、臺灣士林地方法院檢察署送達證書影本\n    3 紙、臺灣士林地方法院檢察署函文影本2 紙在卷可參，並\n    經本院調取臺灣士林地方法院檢察署97年度執緩字第36號全\n    卷核閱無誤。受刑人於受有緩刑宣告後，本應依期限履行義\n    務，給付被害人財產上損害賠償，詎迄今仍未按期給付，不\n    聞不問，其違反判決所定負擔之情節自屬重大甚明，本院認\n    受刑人原宣告之緩刑顯難收其預期效果，而有執行刑罰之必\n    要。故聲請人主張受刑人有刑法第75條之1 第1 項第4 款之\n    事由，聲請撤銷緩刑，核無不合，應予准許。\n四、依刑事訴訟法第476 條，刑法第75條之1 第1 項第4 款，裁\n    定如主文。\n中    華    民    國    99    年    5     月    12    日\n                  刑事第七庭法  官  黎惠萍\n以上正本證明與原本無異\n如不服本裁定應於送達後5日內向本院提出抗告狀\n                            書記官  林志忠\n中    華    民    國    99    年    5     月    12    日",
  "structure": {
    "main": "甲○之緩刑宣告撤銷。",
    "reason": "一、聲請意旨略以：受刑人甲○因犯偽造文書案件，經本院於民\n    國97年2 月18日以97年度簡字第115 號（96年度偵字第1412\n    7 號）判決處有期徒刑3 月，緩刑3 年，並應支付被害人陳\n    建達新台幣（下同）26萬元，自97年3 月25日起，按月於每\n    月25日以前給付1 萬3,000 元，至全部清償完畢為止，如有\n    一期未履行，視為全部到期，於97年3 月17日確定在案。經\n    查受刑人於97年4 月25日經臺灣士林地方法院檢察署檢察官\n    傳訊到案，庭呈支付給被害人1 萬3,000 元匯款單後，經臺\n    灣士林地方法院檢察署檢察官函催、傳喚，受刑人皆置之不\n    理。被害人於99年4 月29日到庭陳述受刑人僅支付97年3 月\n    至同年6 月共4 期5 萬2,000 元後，即置之不理。足認原宣\n    告之緩刑難收其預期效果，核受刑人所為，已合於刑法第75\n    條之1 第1 項第4 款所定撤銷緩刑宣告之原因，爰依刑事訴\n    訟法第476 條規定聲請撤銷緩刑等語。\n二、按緩刑之宣告，得斟酌情形，命犯罪行為人向被害人支付相\n    當數額之財產或非財產上之損害賠償；又受緩刑之宣告，違\n    反第74條第2 項第1 款至第8 款所定負擔情節重大，足認原\n    宣告之緩刑難收其預期效果，而有執行刑罰之必要者，得撤\n    銷其宣告，刑法第74條第2 項第3款、第75條之1 第1 項第4\n    款，分別定有明文。\n三、經查，受刑人即被告因犯偽造文書案件，經本院以97年度簡\n    字第115 號（96年度偵字第14127 號）判處有期徒刑6 月，\n    減為有期徒刑3 月，緩刑3 年，並自97年3 月25日起至98年\n    10月25日止，按月於每月25日給付被害人1 萬3,000 元，合\n    計26萬元之財產上損害賠償，該案於97年3 月17日確定，此\n    有卷附之上開判決書及臺灣高等法院被告前案紀錄表在卷可\n    稽。惟受刑人就上開緩刑之負擔，除於97年3 月至6 月各按\n    月支付1 萬3,000 元（共4 次）予被害人外，餘經檢察官以\n    其住居所址通知應支付被害人損害賠償26萬元並檢送支付證\n    明文件及傳喚到案說明均置之不理，亦未到案，其中其位於\n    臺北縣三重市居所址之通知書、傳票則均遭以查無此人退回\n    等情，業經被害人到庭陳述暨提出存摺影本在卷，復有受刑\n    人97年4 月25日庭提之自動櫃員機交易明細表、受刑人個人\n    基本資料查詢結果、臺灣士林地方法院檢察署送達證書影本\n    3 紙、臺灣士林地方法院檢察署函文影本2 紙在卷可參，並\n    經本院調取臺灣士林地方法院檢察署97年度執緩字第36號全\n    卷核閱無誤。受刑人於受有緩刑宣告後，本應依期限履行義\n    務，給付被害人財產上損害賠償，詎迄今仍未按期給付，不\n    聞不問，其違反判決所定負擔之情節自屬重大甚明，本院認\n    受刑人原宣告之緩刑顯難收其預期效果，而有執行刑罰之必\n    要。故聲請人主張受刑人有刑法第75條之1 第1 項第4 款之\n    事由，聲請撤銷緩刑，核無不合，應予准許。\n四、依刑事訴訟法第476 條，刑法第75條之1 第1 項第4 款，裁\n    定如主文。"
  },
  "characters": {
    "judges": [
      "黎惠萍"
    ],
    "prosecutors": [

    ],
    "lawyers": [

    ],
    "clerks": [
      "林志忠"
    ],
    "plaintiffs": [

    ],
    "defendants": [
      "甲○"
    ],
    "prosecutor_office": [
      "臺灣士林地方法院檢察署檢察官"
    ],
    "creditors": [

    ],
    "debtors": [

    ],
    "judicial_associate_officer": [

    ]
  },
  "adjudged_at": "2010-05-12",
  "created_at": "2016-01-05 12:20:07",
  "updated_at": "2016-01-05 12:20:07"
}