{
  "identify": "SLD-98-訴-746-20100512-1",
  "court": {
    "name": "臺灣士林地方法院",
    "code": "SLD"
  },
  "division": {
    "name": "民事",
    "code": "V"
  },
  "year": 98,
  "word": "訴",
  "number": "746",
  "jcheck": "1",
  "reason": "給付代墊律師費",
  "content": "臺灣士林地方法院民事判決               98年度訴字第746號\n原      告  乙○○\n訴訟代理人  林文鵬律師\n複  代理人  曾允斌律師\n被      告  甲○○\n訴訟代理人  徐秀鳳律師\n上列當事人間給付代墊律師費等事件，本院於民國99年4 月27日\n言詞辯論終結，判決如下：\n    主  文\n被告應給付原告美金壹萬伍仟貳佰陸拾壹元，及自民國九十八年\n四月二十八日起至清償日止，按週年利率百分之五計算之利息。\n訴訟費用新臺幣伍仟陸佰貳拾元由被告負擔。\n本判決於原告以新臺幣壹拾捌萬元為被告供擔保後，得假執行；\n但被告如以新臺幣伍拾壹萬柒仟玖佰伍拾捌元為原告預供擔保或\n提存，得免為假執行。\n    事  實  及  理  由\n一、原告起訴主張：\n  (一)原告係居住在美國加州舊金山之華僑，前於被告旅居美國期\n    間，原告曾將其所有，地址327 12th Ave,San Francisco,\n    CA 94118之房屋（下稱系爭房屋）出租予被告，而訂立租賃\n    契約（下稱系爭租約），惟被告另將系爭房屋再轉租於他人\n    。嗣後，原告通知被告於民國97年2 月8 日終止系爭租約，\n    並請求被告於該日起自系爭房屋遷出。詎被告未經次承租人\n    David Rozelle （下稱David ）同意遷出，竟直接將David\n    之物品堆置於屋外，致與David 發生糾紛。因被告已返回臺\n    灣，原告即受被告委任，並依被告指示，代為接洽美國的律\n    師事務所Law Offices of Bravo & Margulies（下稱律師）\n    ，處理被告與David 間之糾紛，原告並因此為被告墊付律師\n    費用共計美金（以下未標明幣別者均同）1 萬5,261 元。上\n    開費用既係原告受任處理被告與David 間之租約爭議，且係\n    依被告指示委託律師辦理所發生，原告自得依民法第546 條\n    第1 項規定請求被告償還。縱認兩造間並無委任關係，惟原\n    告支付之律師費用係因次承租人應負責之事由所生之損害，\n    被告為承租人，依民法第444 條第2 項規定，亦應負賠償責\n    任。\n  (二)並聲明請求判決：\n    1.被告應給付原告1 萬5,261 元，及自起訴狀繕本送達翌日\n      起至清償日止，按週年利率5%計算之利息。\n    2.原告願供擔保，請准宣告假執行。\n二、被告則辯稱：\n  (一)被告係經原告同意，將系爭房屋轉租於他人（共3 人，其中\n    包括David ），被告與David 間並有口頭約定，被告應於兩\n    造終止租約或被告需返還系爭房屋予原告前30日通知David\n    ，並得終止轉租契約。嗣兩造合意終止租約，被告於返還房\n    屋前30日通知David ，並已於97年2 月8 日將系爭房屋騰空\n    返還予原告，被告已履行承租人返還租賃物之義務，與原告\n    或David 間並無租約爭議，故被告實無委任原告代為委請律\n    師處理爭議之必要。且被告既已依約返還系爭房屋，則原告\n    與David 間嗣後發生之爭議，或原告因涉訟而支出之律師費\n    用，顯與被告無關。原告訴請被告給付律師費1 萬5,261 元\n    ，顯無理由。\n  (二)並聲明請求判決：\n    1.原告之訴駁回。\n    2.如受不利判決，願供擔保請准宣告免為假執行。\n三、兩造不爭執之事實：\n  (一)兩造就系爭房屋簽訂租賃契約1 紙，有租賃契約附卷可稽（\n    本院卷第51頁至第56頁）。\n  (二)被告於97年2 月8 日，交還系爭房屋鑰匙予原告。\n  (三)原告曾於美國委任律師處理與次承租人David 之糾紛，有委\n    任契約在卷可憑（本院卷第57頁至第61頁）。\n四、本件經兩造整理並簡化後之爭點為（本院卷第104 頁）：\n  (一)被告是否委任原告在美國委請律師處理與David 的糾紛？\n  (二)原告是否因次承租人應負責之事由而受有損害？如有，其損\n    害金額為何？\n  茲分述如下：\n  (一)原告不能證明兩造間有委任契約存在：\n    1.按當事人主張有利於己之事實者，就其事實有舉證之責任\n      ，民事訴訟法第277 條前段定有明文。準此，原告主張兩\n      造間有委任契約存在乙節，既為被告所否認，則原告自應\n      就其事實舉證以實其說。\n    2.而稱委任者，謂當事人約定，一方委託他方處理事務，他\n      方允為處理之契約；受任人因處理委任事務，支出之必要\n      費用，委任人應償還之，並付自支出時起之利息。民法第\n      528 條、第546 條第1 項分別明定。又所謂委任事務，以\n      屬於委任人自己者為原則，屬於第三人之事務，亦無不可\n      ，但屬於受任人自己之事務，原則上不得為委任，最高法\n      院85年度台上字第2383號裁判可資參照。經查，David 與\n      被告間因轉租契約之終止而生糾紛，固可能致David 與被\n      告間發生金錢賠償之問題，惟原告委任律師處理「how to\n      evict him （即David ）timely」（如何及時讓David 遷\n      出原告之房屋）之事宜，則為David 占有使用原告房屋是\n      否有理由之糾紛，該糾紛實係存在於原告與David 之間。\n      原告委任律師處理David 遷出系爭房屋之糾紛，該糾紛之\n      緣起固因被告之行為所致（詳下(二)所述），惟原告係為保\n      護自己財產權利之目的，為處理自己的事務而委任律師，\n      尚非基於受任處理被告之事務之目的，為被告委任律師，\n      依上開法律及裁判意旨，已難認兩造間有委任契約存在。\n      此由系爭電子郵件所附原告原始來函中，原告表示「We\n      need to talk to the lawyer,and find the best way\n      for both of us」（我們需要與律師會談，以找出對我們\n      雙方最佳的解決方式）等語，亦足知原告確係為本身之利\n      益，而謀求與David 糾紛之解決，則原告以伊係「受任為\n      被告找律師以解決被告與David 間之糾紛」為由，主張兩\n      造間有委任契約存在，即屬無稽。\n    3.況按，原告主張兩造間成立委任契約之依據，為被告所寫\n      之電子郵件（本院卷第40頁參照，下稱系爭電子郵件），\n      被告則辯稱系爭電子郵件係轉知訴外人Alice 建議之律師\n      人選，因為原告需要找律師解決與David 間之糾紛，但原\n      告不諳英文，被告係單純幫忙等語（本院卷第75頁正面、\n      背面參照）。經查，系爭電子郵件內容，被告表示「可要\n      求找（事務所裡）會講廣東話的律師」（ask for an at-\n      torney who speaks for Cantonese ）、「記得因為第一\n      次會面是免費的，所以要把握重點，否則律師可能會開始\n      收費」（Remember since the first meeting is free\n      ,just focus on the point.Or the attorney might st-\n      art charging you. ）、「最重要的是找出與David 簽約\n      是否正確，並如何及時的讓他遷出」（The most import-\n      ant thing is to find out if it is right to have a\n      contract sign with David and how to evict him tim-\n      ely ），以及願意以電話會議之方式參加與律師之對談（\n      I can call from Taiwan and have a conference call\n      with you and the attorney ）等情，尚未可逕認係有「\n      委任」原告找律師之意思。參諸原告與David 的糾紛係因\n      被告轉租行為所致，則被告於系爭電子郵件中提供之建議\n      及表示願意參與之舉，應係基於與原告共同解決問題之協\n      力目的，尚未可逕以系爭電子郵件之內容，遽認兩造間已\n      成立委任契約之法律關係。\n    4.從而，原告以兩造間有委任契約為由，依民法第546 條第\n      1 項規定請求被告償還原告所支出之律師費用，洵無足取\n      。\n  (二)原告所支付之律師費用，係次承租人David 應負責之事由而\n    生之損害：\n    1.按承租人於租賃關係終止後，應返還租賃物，民法第455\n      條前段定有明文。兩造間之租賃契約關係業於97年2 月8\n      日終止一節，為兩造所不爭，則被告自應於租賃契約終止\n      時，將系爭房屋返還予原告。被告雖辯稱：97年2 月8日\n      已經將房子全部清空，也換過鎖，將鑰匙交還予原告，兩\n      造間系爭租約、被告與David 間之轉租契約關係均已結束\n      ，David 嗣於當天晚上又搬進系爭房屋，伊不知David 如\n      何能夠再進入，亦無須為David 之行為負責等語（本院卷\n      第75頁背面至第76頁）。惟原告則陳稱：97年2 月8 日中\n      午12時左右，被告將系爭房屋之鑰匙交給原告，並將屋內\n      物品都堆在門口，表示等一下就會將物品搬空，原告拿了\n      鑰匙便離開，當日下午4 、5 點左右，原告回到系爭房屋\n      看物品是否已經搬遷完畢，結果警察來了，因為David 又\n      搬進去並找警察來，原告才知道被告將系爭房屋轉租給他\n      人等語。\n    2.經查，David 於97年2 月8 日下午曾報警，依報警紀錄（\n      下稱系爭報警紀錄，本院卷第86頁參照）所載，David （\n      系爭報警紀錄係記載David 之姓氏「Rozelle 」）報警之\n      原因係認為自己遭他人以不合法手段自其承租之房屋中驅\n      逐（he was illegally evicted from the room he's r-\n      ented ），係鄰居Sharlow 通知其所有物都被放置在街上\n      （Sharlow informed him that all his belongings we-\n      re in the street ），David 發現系爭房屋前門換鎖了\n      （...noticed that the key cylinder lock to the fr-\n      ont door of the house had been changed）。嗣後兩造\n      亦到場，被告（即Chang ）自承：「伊於97年1 月5 日書\n      面通知David 須在97年2 月5 日以前遷出系爭房屋，更於\n      前一日（97年2 月7 日）晚間7 時左右告知David 隔日即\n      須將系爭房屋交還原告，所有東西都要清乾淨，David 則\n      表示『請便』，而伊於97年2 月8 日發現David 的東西仍\n      然在系爭房屋內，遂請來2 名搬家工人將David 的東西搬\n      出去」等語（Chang said that on January 5th,2008 s-\n      he gave a written notice to Rozelle that he was to\n      move out of the house by February 5th,2008. Chang\n      also added that she talked to Rozelle yesterday(00\n      -00- 0000)evening at approximately 19:00 hours and\n      told him, \"I need to return the house to Mr.Chen\n      tomorrow .I need everything cleaned out\".Rozelle's\n      response was,\"go ahead\".Chang checked the house t-\n      oday and saw that Rozelle 's items were in the ho-\n      use so shd said she hired two movers to move all\n      of Rozelle's belongings out of the house）。David\n      同時表示書面通知不合法，因為將他的姓名拼錯且被告未\n      簽名（Rozelle said the notice was not legitimate\n      because his name was misspelled and it was not si-\n      gned），且從未同意被告將其物品搬出系爭房屋（he ne-\n      ver gave permission to have Chang move his belong-\n      ings out of the house ）等語。核與原告所主張兩造於\n      97 年2月8 日終止系爭租約時交還房屋、鑰匙之經過相符\n      ，應認原告之主張為可採。被告未經David 同意，即逕自\n      將David 置於系爭房屋內之物品搬出堆置於屋外，而發生\n      爭議，被告顯未妥適處理與David 間之轉租契約，並致\n      David 與原告間，就David 是否有權繼續占有使用系爭房\n      屋之爭議無法解決，堪認系爭租約終止後，被告並未依債\n      之本旨返還系爭房屋予原告。從而，被告稱已依約將系爭\n      房屋、鑰匙交還原告，無法為David 嗣後又進入系爭房屋\n      之行為負責云云，洵無足取。\n    3.按因次承租人應負責事由所生之損害，承租人負賠償責任\n      ，民法第444 條第2 項定有明文。本件被告未依債之本旨\n      返還系爭房屋予原告，致原告與David 間，對於David 究\n      否有權繼續占有使用系爭房屋、原告得否或如何使David\n      遷出等節，發生法律上之爭議。而原告與David 爭議發生\n      之原因之一，為被告未依法律程序處理David 遷出事宜，\n      而未經David 同意擅自將其私人物品棄置屋外，原告為避\n      免重蹈被告以不當方式解決糾紛之覆轍，而委任律師處理\n      與David 間之糾紛，其方式自屬允當且必要，而原告所支\n      付之律師費用，即可認為係因次承租人應負責事由所生之\n      損害。原告依民法第444 條第2 項規定請求被告賠償，即\n      非無據。\n    3.原告主張律師係按每小時250 元之標準計收費用乙節，業\n      據其提出Attorney-client Fee Contract（律師／客戶費\n      用契約）附卷可憑（本院卷第57頁至第61頁），至律師之\n      工作內容、時數、費用（單價及總價），亦有費用明細單\n      附於本院98年度士簡調字第191 號卷（下稱調解卷）第6\n      頁至第15頁可資參照。被告雖否認上開單據之真正，惟依\n      系爭報警紀錄，已可認定原告與David 間確因David 應否\n      遷出系爭房屋而發生糾紛，且原告有委請律師處理相關法\n      律爭議之必要性，亦經認定如上，則被告空言否認原告有\n      支出律師費，即非可取。再徵諸原告提出之律師費用明細\n      單，97年3 月15日核算之費用明細為6,217 元（調解卷第\n      14頁至第15頁）、97年4 月15日核算之費用明細為5,180.\n      45元（調解卷第11頁至第13頁）、97年5 月15日核算之費\n      用明細為1,299.44元（調解卷第9 頁至第10頁）、97年6\n      月14日核算之費用明細為2,499.12元（調解卷第7 頁至第\n      8 頁）、97年7 月15日核算之費用明細為65元（調解卷第\n      6 頁），共計1 萬5,261.01元（原告僅請求1 萬5, 261元\n      ），核其臚列之律師工作內容，包括開會（見面）、準備\n      文件、審核文件、電話會談等，均屬解決原告與David 間\n      爭議之必要工作項目，其單項工作時數亦屬合理，另費用\n      明細單所示代墊費用（例如郵資）之償還，亦為必要之支\n      出。從而，原告請求被告給付因次承租人David 之故而支\n      出之律師費用1 萬5,261 元，與通常合理之支出金額尚無\n      悖反，應予准許。\n五、綜上所述，原告依民法第444 條第2 項規定，請求被告給付\n    1 萬5,261 元，及自起訴狀繕本送達翌日即98年4 月28日起\n    至清償日止，按週年利率5%計算之利息，為有理由。\n六、兩造陳明願供擔保，聲請宣告假執行及免為假執行，核無不\n    合，爰分別酌定相當擔保金額予以准許。並依職權定本件訴\n    訟為第1審裁判費新臺幣5,620元。\n七、本件事證已臻明確，兩造其餘主張陳述及所提出之證據，於\n    判決結果不生影響，無庸一一論述，附此敘明。\n八、據上論結，原告之訴為有理由，依民事訴訟法第78條、第87\n    條第1 項、第390 條第2 項、第392 條，判決如主文。\n中    華    民    國    99    年    5     月    12    日\n                  民事第二庭  法  官  王怡雯\n以上正本證明與原本無異。\n如對本判決上訴，應於判決送達後20日內向本院提出上訴狀。\n中    華    民    國    99    年    5     月    12    日\n                              書記官  桂大永",
  "structure": {
    "fact": "一、原告起訴主張：\n  (一)原告係居住在美國加州舊金山之華僑，前於被告旅居美國期\n    間，原告曾將其所有，地址327 12th Ave,San Francisco,\n    CA 94118之房屋（下稱系爭房屋）出租予被告，而訂立租賃\n    契約（下稱系爭租約），惟被告另將系爭房屋再轉租於他人\n    。嗣後，原告通知被告於民國97年2 月8 日終止系爭租約，\n    並請求被告於該日起自系爭房屋遷出。詎被告未經次承租人\n    David Rozelle （下稱David ）同意遷出，竟直接將David\n    之物品堆置於屋外，致與David 發生糾紛。因被告已返回臺\n    灣，原告即受被告委任，並依被告指示，代為接洽美國的律\n    師事務所Law Offices of Bravo & Margulies（下稱律師）\n    ，處理被告與David 間之糾紛，原告並因此為被告墊付律師\n    費用共計美金（以下未標明幣別者均同）1 萬5,261 元。上\n    開費用既係原告受任處理被告與David 間之租約爭議，且係\n    依被告指示委託律師辦理所發生，原告自得依民法第546 條\n    第1 項規定請求被告償還。縱認兩造間並無委任關係，惟原\n    告支付之律師費用係因次承租人應負責之事由所生之損害，\n    被告為承租人，依民法第444 條第2 項規定，亦應負賠償責\n    任。\n  (二)並聲明請求判決：\n    1.被告應給付原告1 萬5,261 元，及自起訴狀繕本送達翌日\n      起至清償日止，按週年利率5%計算之利息。\n    2.原告願供擔保，請准宣告假執行。\n二、被告則辯稱：\n  (一)被告係經原告同意，將系爭房屋轉租於他人（共3 人，其中\n    包括David ），被告與David 間並有口頭約定，被告應於兩\n    造終止租約或被告需返還系爭房屋予原告前30日通知David\n    ，並得終止轉租契約。嗣兩造合意終止租約，被告於返還房\n    屋前30日通知David ，並已於97年2 月8 日將系爭房屋騰空\n    返還予原告，被告已履行承租人返還租賃物之義務，與原告\n    或David 間並無租約爭議，故被告實無委任原告代為委請律\n    師處理爭議之必要。且被告既已依約返還系爭房屋，則原告\n    與David 間嗣後發生之爭議，或原告因涉訟而支出之律師費\n    用，顯與被告無關。原告訴請被告給付律師費1 萬5,261 元\n    ，顯無理由。\n  (二)並聲明請求判決：\n    1.原告之訴駁回。\n    2.如受不利判決，願供擔保請准宣告免為假執行。\n三、兩造不爭執之事實：\n  (一)兩造就系爭房屋簽訂租賃契約1 紙，有租賃契約附卷可稽（\n    本院卷第51頁至第56頁）。\n  (二)被告於97年2 月8 日，交還系爭房屋鑰匙予原告。\n  (三)原告曾於美國委任律師處理與次承租人David 之糾紛，有委\n    任契約在卷可憑（本院卷第57頁至第61頁）。\n四、本件經兩造整理並簡化後之爭點為（本院卷第104 頁）：\n  (一)被告是否委任原告在美國委請律師處理與David 的糾紛？\n  (二)原告是否因次承租人應負責之事由而受有損害？如有，其損\n    害金額為何？\n  茲分述如下：\n  (一)原告不能證明兩造間有委任契約存在：\n    1.按當事人主張有利於己之事實者，就其事實有舉證之責任\n      ，民事訴訟法第277 條前段定有明文。準此，原告主張兩\n      造間有委任契約存在乙節，既為被告所否認，則原告自應\n      就其事實舉證以實其說。\n    2.而稱委任者，謂當事人約定，一方委託他方處理事務，他\n      方允為處理之契約；受任人因處理委任事務，支出之必要\n      費用，委任人應償還之，並付自支出時起之利息。民法第\n      528 條、第546 條第1 項分別明定。又所謂委任事務，以\n      屬於委任人自己者為原則，屬於第三人之事務，亦無不可\n      ，但屬於受任人自己之事務，原則上不得為委任，最高法\n      院85年度台上字第2383號裁判可資參照。經查，David 與\n      被告間因轉租契約之終止而生糾紛，固可能致David 與被\n      告間發生金錢賠償之問題，惟原告委任律師處理「how to\n      evict him （即David ）timely」（如何及時讓David 遷\n      出原告之房屋）之事宜，則為David 占有使用原告房屋是\n      否有理由之糾紛，該糾紛實係存在於原告與David 之間。\n      原告委任律師處理David 遷出系爭房屋之糾紛，該糾紛之\n      緣起固因被告之行為所致（詳下(二)所述），惟原告係為保\n      護自己財產權利之目的，為處理自己的事務而委任律師，\n      尚非基於受任處理被告之事務之目的，為被告委任律師，\n      依上開法律及裁判意旨，已難認兩造間有委任契約存在。\n      此由系爭電子郵件所附原告原始來函中，原告表示「We\n      need to talk to the lawyer,and find the best way\n      for both of us」（我們需要與律師會談，以找出對我們\n      雙方最佳的解決方式）等語，亦足知原告確係為本身之利\n      益，而謀求與David 糾紛之解決，則原告以伊係「受任為\n      被告找律師以解決被告與David 間之糾紛」為由，主張兩\n      造間有委任契約存在，即屬無稽。\n    3.況按，原告主張兩造間成立委任契約之依據，為被告所寫\n      之電子郵件（本院卷第40頁參照，下稱系爭電子郵件），\n      被告則辯稱系爭電子郵件係轉知訴外人Alice 建議之律師\n      人選，因為原告需要找律師解決與David 間之糾紛，但原\n      告不諳英文，被告係單純幫忙等語（本院卷第75頁正面、\n      背面參照）。經查，系爭電子郵件內容，被告表示「可要\n      求找（事務所裡）會講廣東話的律師」（ask for an at-\n      torney who speaks for Cantonese ）、「記得因為第一\n      次會面是免費的，所以要把握重點，否則律師可能會開始\n      收費」（Remember since the first meeting is free\n      ,just focus on the point.Or the attorney might st-\n      art charging you. ）、「最重要的是找出與David 簽約\n      是否正確，並如何及時的讓他遷出」（The most import-\n      ant thing is to find out if it is right to have a\n      contract sign with David and how to evict him tim-\n      ely ），以及願意以電話會議之方式參加與律師之對談（\n      I can call from Taiwan and have a conference call\n      with you and the attorney ）等情，尚未可逕認係有「\n      委任」原告找律師之意思。參諸原告與David 的糾紛係因\n      被告轉租行為所致，則被告於系爭電子郵件中提供之建議\n      及表示願意參與之舉，應係基於與原告共同解決問題之協\n      力目的，尚未可逕以系爭電子郵件之內容，遽認兩造間已\n      成立委任契約之法律關係。\n    4.從而，原告以兩造間有委任契約為由，依民法第546 條第\n      1 項規定請求被告償還原告所支出之律師費用，洵無足取\n      。\n  (二)原告所支付之律師費用，係次承租人David 應負責之事由而\n    生之損害：\n    1.按承租人於租賃關係終止後，應返還租賃物，民法第455\n      條前段定有明文。兩造間之租賃契約關係業於97年2 月8\n      日終止一節，為兩造所不爭，則被告自應於租賃契約終止\n      時，將系爭房屋返還予原告。被告雖辯稱：97年2 月8日\n      已經將房子全部清空，也換過鎖，將鑰匙交還予原告，兩\n      造間系爭租約、被告與David 間之轉租契約關係均已結束\n      ，David 嗣於當天晚上又搬進系爭房屋，伊不知David 如\n      何能夠再進入，亦無須為David 之行為負責等語（本院卷\n      第75頁背面至第76頁）。惟原告則陳稱：97年2 月8 日中\n      午12時左右，被告將系爭房屋之鑰匙交給原告，並將屋內\n      物品都堆在門口，表示等一下就會將物品搬空，原告拿了\n      鑰匙便離開，當日下午4 、5 點左右，原告回到系爭房屋\n      看物品是否已經搬遷完畢，結果警察來了，因為David 又\n      搬進去並找警察來，原告才知道被告將系爭房屋轉租給他\n      人等語。\n    2.經查，David 於97年2 月8 日下午曾報警，依報警紀錄（\n      下稱系爭報警紀錄，本院卷第86頁參照）所載，David （\n      系爭報警紀錄係記載David 之姓氏「Rozelle 」）報警之\n      原因係認為自己遭他人以不合法手段自其承租之房屋中驅\n      逐（he was illegally evicted from the room he's r-\n      ented ），係鄰居Sharlow 通知其所有物都被放置在街上\n      （Sharlow informed him that all his belongings we-\n      re in the street ），David 發現系爭房屋前門換鎖了\n      （...noticed that the key cylinder lock to the fr-\n      ont door of the house had been changed）。嗣後兩造\n      亦到場，被告（即Chang ）自承：「伊於97年1 月5 日書\n      面通知David 須在97年2 月5 日以前遷出系爭房屋，更於\n      前一日（97年2 月7 日）晚間7 時左右告知David 隔日即\n      須將系爭房屋交還原告，所有東西都要清乾淨，David 則\n      表示『請便』，而伊於97年2 月8 日發現David 的東西仍\n      然在系爭房屋內，遂請來2 名搬家工人將David 的東西搬\n      出去」等語（Chang said that on January 5th,2008 s-\n      he gave a written notice to Rozelle that he was to\n      move out of the house by February 5th,2008. Chang\n      also added that she talked to Rozelle yesterday(00\n      -00- 0000)evening at approximately 19:00 hours and\n      told him, \"I need to return the house to Mr.Chen\n      tomorrow .I need everything cleaned out\".Rozelle's\n      response was,\"go ahead\".Chang checked the house t-\n      oday and saw that Rozelle 's items were in the ho-\n      use so shd said she hired two movers to move all\n      of Rozelle's belongings out of the house）。David\n      同時表示書面通知不合法，因為將他的姓名拼錯且被告未\n      簽名（Rozelle said the notice was not legitimate\n      because his name was misspelled and it was not si-\n      gned），且從未同意被告將其物品搬出系爭房屋（he ne-\n      ver gave permission to have Chang move his belong-\n      ings out of the house ）等語。核與原告所主張兩造於\n      97 年2月8 日終止系爭租約時交還房屋、鑰匙之經過相符\n      ，應認原告之主張為可採。被告未經David 同意，即逕自\n      將David 置於系爭房屋內之物品搬出堆置於屋外，而發生\n      爭議，被告顯未妥適處理與David 間之轉租契約，並致\n      David 與原告間，就David 是否有權繼續占有使用系爭房\n      屋之爭議無法解決，堪認系爭租約終止後，被告並未依債\n      之本旨返還系爭房屋予原告。從而，被告稱已依約將系爭\n      房屋、鑰匙交還原告，無法為David 嗣後又進入系爭房屋\n      之行為負責云云，洵無足取。\n    3.按因次承租人應負責事由所生之損害，承租人負賠償責任\n      ，民法第444 條第2 項定有明文。本件被告未依債之本旨\n      返還系爭房屋予原告，致原告與David 間，對於David 究\n      否有權繼續占有使用系爭房屋、原告得否或如何使David\n      遷出等節，發生法律上之爭議。而原告與David 爭議發生\n      之原因之一，為被告未依法律程序處理David 遷出事宜，\n      而未經David 同意擅自將其私人物品棄置屋外，原告為避\n      免重蹈被告以不當方式解決糾紛之覆轍，而委任律師處理\n      與David 間之糾紛，其方式自屬允當且必要，而原告所支\n      付之律師費用，即可認為係因次承租人應負責事由所生之\n      損害。原告依民法第444 條第2 項規定請求被告賠償，即\n      非無據。\n    3.原告主張律師係按每小時250 元之標準計收費用乙節，業\n      據其提出Attorney-client Fee Contract（律師／客戶費\n      用契約）附卷可憑（本院卷第57頁至第61頁），至律師之\n      工作內容、時數、費用（單價及總價），亦有費用明細單\n      附於本院98年度士簡調字第191 號卷（下稱調解卷）第6\n      頁至第15頁可資參照。被告雖否認上開單據之真正，惟依\n      系爭報警紀錄，已可認定原告與David 間確因David 應否\n      遷出系爭房屋而發生糾紛，且原告有委請律師處理相關法\n      律爭議之必要性，亦經認定如上，則被告空言否認原告有\n      支出律師費，即非可取。再徵諸原告提出之律師費用明細\n      單，97年3 月15日核算之費用明細為6,217 元（調解卷第\n      14頁至第15頁）、97年4 月15日核算之費用明細為5,180.\n      45元（調解卷第11頁至第13頁）、97年5 月15日核算之費\n      用明細為1,299.44元（調解卷第9 頁至第10頁）、97年6\n      月14日核算之費用明細為2,499.12元（調解卷第7 頁至第\n      8 頁）、97年7 月15日核算之費用明細為65元（調解卷第\n      6 頁），共計1 萬5,261.01元（原告僅請求1 萬5, 261元\n      ），核其臚列之律師工作內容，包括開會（見面）、準備\n      文件、審核文件、電話會談等，均屬解決原告與David 間\n      爭議之必要工作項目，其單項工作時數亦屬合理，另費用\n      明細單所示代墊費用（例如郵資）之償還，亦為必要之支\n      出。從而，原告請求被告給付因次承租人David 之故而支\n      出之律師費用1 萬5,261 元，與通常合理之支出金額尚無\n      悖反，應予准許。\n五、綜上所述，原告依民法第444 條第2 項規定，請求被告給付\n    1 萬5,261 元，及自起訴狀繕本送達翌日即98年4 月28日起\n    至清償日止，按週年利率5%計算之利息，為有理由。\n六、兩造陳明願供擔保，聲請宣告假執行及免為假執行，核無不\n    合，爰分別酌定相當擔保金額予以准許。並依職權定本件訴\n    訟為第1審裁判費新臺幣5,620元。\n七、本件事證已臻明確，兩造其餘主張陳述及所提出之證據，於\n    判決結果不生影響，無庸一一論述，附此敘明。\n八、據上論結，原告之訴為有理由，依民事訴訟法第78條、第87\n    條第1 項、第390 條第2 項、第392 條，判決如主文。"
  },
  "characters": {
    "judges": [
      "王怡雯"
    ],
    "prosecutors": [

    ],
    "lawyers": [
      "林文鵬",
      "曾允斌",
      "徐秀鳳",
      "上列當事人間給付代墊",
      "依被告指示委託",
      "告支付之",
      "原告委任",
      "被告找",
      "建議之",
      "項規定請求被告償還原告所支出之",
      "付之",
      "支出",
      "出之"
    ],
    "clerks": [

    ],
    "plaintiffs": [
      "乙"
    ],
    "defendants": [
      "甲○○"
    ],
    "prosecutor_office": [

    ],
    "creditors": [

    ],
    "debtors": [

    ],
    "judicial_associate_officer": [

    ]
  },
  "adjudged_at": "2010-05-12",
  "created_at": "2016-01-05 12:21:35",
  "updated_at": "2016-01-05 12:21:35"
}