{
  "identify": "SLD-98-消債清-52-20100512-4",
  "court": {
    "name": "臺灣士林地方法院",
    "code": "SLD"
  },
  "division": {
    "name": "民事",
    "code": "V"
  },
  "year": 98,
  "word": "消債清",
  "number": "52",
  "jcheck": "4",
  "reason": "清算事件",
  "content": "臺灣士林地方法院民事裁定            98年度消債清字第52號\n債  務  人  甲○○\n代  理  人  張金盛律師\n上列當事人聲請清算事件，本院裁定如下：\n    主  文\n債務人甲○○自中華民國九十九年五月十七日下午五時起開始清\n算程序，並同時終止清算程序。\n    理  由\n一、按債務人與金融機構協商成立者，不得聲請更生或清算，但\n    因不可歸責於己之事由，致履行顯有重大困難者，不在此限\n    。消費者債務清理條例（下稱消債條例）第151 條第5 項定\n    有明文。次按，債務人不能清償債務或有不能清償之虞，於\n    法院裁定開始更生程序或許可和解或宣告破產前，得向法院\n    聲請清算，觀諸消債條例第3 條、第80條規定自明。再按，\n    法院開始清算程序之裁定，應載明其年、月、日、時，並即\n    時發生效力；債務人之財產不敷清償清算程序之費用時，法\n    院應裁定開始清算程序，並同時終止清算程序，消債條例第\n    83條第1 項、第85條第1 項亦有明定。\n二、聲請意旨略以：伊有不能清償債務情事，前曾於民國97年間\n    向最大債權金融機構之美商乙○銀行股份有限公司（嗣分割\n    予乙○（台灣）商業銀行股份有限公司）請求協商，並協商\n    成立，協商條件為每月還款新臺幣（下同）8,806 元。惟因\n    伴有脊椎病變之頸部退化性脊椎炎術後之疾病無法久站，致\n    工作不穩，擺攤又遭取締，目前平均每月僅有1 萬5,000 元\n    之打零工收入，無力繼續繳納協商金額，故伊確係因不可歸\n    責於己之事由，致履行協商條件顯有重大困難，且伊未經法\n    院裁定開始更生程序或許可和解或宣告破產，爰向本院聲請\n    清算等語。\n三、經查，債務人所主張之上開事實，業據提出中國醫藥大學附\n    設醫院臺北分院診斷證明書（見本院卷第13頁）、前置協商\n    機制協議書及前置協商無擔保債務還款分配表暨表決結果（\n    見本院卷第14至18頁）、財團法人金融聯合徵信中心當事人\n    綜合信用報告之協商前置專用債權人清冊（見本院卷第26至\n    29頁）、債務人全戶戶籍謄本（見本院卷第34至35頁）、生\n    活支出單據（見本院卷第36至37頁、第49至50頁）、債務人\n    勞工保險被保險人投保資料表（本院卷第38至39頁）、財政\n    部臺北市國稅局96至97年度綜合所得稅各類所得資料清單及\n    財產歸屬資料清單（見本院卷第40至42頁）等為證，核閱屬\n    實，堪認為真正。是債務人主張其有不可歸責於己之事由，\n    致履行協商條件顯有困難，當為實在。此外，債務人復查無\n    消債條例第6 條第3 項、第8 條或第82條第2 項所定駁回清\n    算聲請之事由存在，則債務人聲請清算，應屬有據。再者，\n    債務人名下除車齡16年之汽車乙部外，別無其他財產，另參\n    酌本件清算程序之規模，足認債務人之財產應不敷清償清算\n    程序之費用，爰依上開規定裁定開始本件清算程序，並同時\n    終止清算程序。\n中    華    民    國    99    年    5     月    12    日\n                  民事第三庭  法      官  施月燿\n上為正本係照原本作成。\n開始清算程序之裁定不得抗告，如不服同時終止清算程序之裁定\n，應於裁定送達後10日內，以書狀向本院提出抗告，並繳納抗告\n費新臺幣1 千元。\n中    華    民    國    99    年    5     月    12    日\n                              書  記  官  朱亮彰",
  "structure": {
    "main": "債務人甲○○自中華民國九十九年五月十七日下午五時起開始清\n算程序，並同時終止清算程序。",
    "reason": "一、按債務人與金融機構協商成立者，不得聲請更生或清算，但\n    因不可歸責於己之事由，致履行顯有重大困難者，不在此限\n    。消費者債務清理條例（下稱消債條例）第151 條第5 項定\n    有明文。次按，債務人不能清償債務或有不能清償之虞，於\n    法院裁定開始更生程序或許可和解或宣告破產前，得向法院\n    聲請清算，觀諸消債條例第3 條、第80條規定自明。再按，\n    法院開始清算程序之裁定，應載明其年、月、日、時，並即\n    時發生效力；債務人之財產不敷清償清算程序之費用時，法\n    院應裁定開始清算程序，並同時終止清算程序，消債條例第\n    83條第1 項、第85條第1 項亦有明定。\n二、聲請意旨略以：伊有不能清償債務情事，前曾於民國97年間\n    向最大債權金融機構之美商乙○銀行股份有限公司（嗣分割\n    予乙○（台灣）商業銀行股份有限公司）請求協商，並協商\n    成立，協商條件為每月還款新臺幣（下同）8,806 元。惟因\n    伴有脊椎病變之頸部退化性脊椎炎術後之疾病無法久站，致\n    工作不穩，擺攤又遭取締，目前平均每月僅有1 萬5,000 元\n    之打零工收入，無力繼續繳納協商金額，故伊確係因不可歸\n    責於己之事由，致履行協商條件顯有重大困難，且伊未經法\n    院裁定開始更生程序或許可和解或宣告破產，爰向本院聲請\n    清算等語。\n三、經查，債務人所主張之上開事實，業據提出中國醫藥大學附\n    設醫院臺北分院診斷證明書（見本院卷第13頁）、前置協商\n    機制協議書及前置協商無擔保債務還款分配表暨表決結果（\n    見本院卷第14至18頁）、財團法人金融聯合徵信中心當事人\n    綜合信用報告之協商前置專用債權人清冊（見本院卷第26至\n    29頁）、債務人全戶戶籍謄本（見本院卷第34至35頁）、生\n    活支出單據（見本院卷第36至37頁、第49至50頁）、債務人\n    勞工保險被保險人投保資料表（本院卷第38至39頁）、財政\n    部臺北市國稅局96至97年度綜合所得稅各類所得資料清單及\n    財產歸屬資料清單（見本院卷第40至42頁）等為證，核閱屬\n    實，堪認為真正。是債務人主張其有不可歸責於己之事由，\n    致履行協商條件顯有困難，當為實在。此外，債務人復查無\n    消債條例第6 條第3 項、第8 條或第82條第2 項所定駁回清\n    算聲請之事由存在，則債務人聲請清算，應屬有據。再者，\n    債務人名下除車齡16年之汽車乙部外，別無其他財產，另參\n    酌本件清算程序之規模，足認債務人之財產應不敷清償清算\n    程序之費用，爰依上開規定裁定開始本件清算程序，並同時\n    終止清算程序。"
  },
  "characters": {
    "judges": [
      "施月燿"
    ],
    "prosecutors": [

    ],
    "lawyers": [
      "張金盛"
    ],
    "clerks": [

    ],
    "plaintiffs": [

    ],
    "defendants": [

    ],
    "prosecutor_office": [

    ],
    "creditors": [

    ],
    "debtors": [
      "甲"
    ],
    "judicial_associate_officer": [

    ]
  },
  "adjudged_at": "2010-05-12",
  "created_at": "2016-01-05 12:21:31",
  "updated_at": "2016-01-05 12:21:31"
}