{
  "identify": "SLD-99-消債更-61-20100512-1",
  "court": {
    "name": "臺灣士林地方法院",
    "code": "SLD"
  },
  "division": {
    "name": "民事",
    "code": "V"
  },
  "year": 99,
  "word": "消債更",
  "number": "61",
  "jcheck": "1",
  "reason": "更生事件",
  "content": "臺灣士林地方法院民事裁定            99年度消債更字第61號\n債  務  人  甲○○\n代  理  人  林淑娟律師\n上列債務人聲請更生事件，本院裁定如下：\n    主  文\n本件移送臺灣板橋地方法院。\n    理  由\n一、按更生及清算事件專屬債務人住所地之地方法院管轄，消費\n    者債務清理條例第5 條第1 項定有明文。所謂住所，係指依\n    一定事實，足認以久住之意思，住於一定之地域者，即為設\n    定其住所於該地，此觀諸民法第20條第1 項規定自明。又訴\n    訟之全部或一部，法院認為無管轄權者，依原告聲請或依職\n    權以裁定移送於其管轄法院，民事訴訟法第28條第1 項規定\n    甚明。且上開規定，於更生或清算程序準用之，消費者債務\n    清理條例第15條亦有明定。\n二、經查，債務人向本院聲請更生時，聲請狀所載住所地在臺北\n    縣新莊市○○路69巷43號4 樓，且其戶籍地址亦同該址，有\n    其戶籍謄本（見本院卷第31頁）在卷可稽。是債務人以久住\n    之意思，且有居住事實之住所地應為臺北縣新莊市址，並非\n    本院轄區。從而，本件應專屬債務人住所地之法院即臺灣板\n    橋地方法院管轄，爰依職權移送其管轄法院。\n三、爰裁定如主文。\n中    華    民    國    99    年    5     月    12    日\n                  民事第二庭  法      官  王怡雯\n上為正本係照原本作成。\n如不服本裁定，應於裁定送達後10日內，以書狀向本院提出抗告\n，並繳納抗告費新臺幣1千元。\n中    華    民    國    99    年    5     月    13    日\n                              書  記  官  周嫣蘋",
  "structure": {
    "main": "本件移送臺灣板橋地方法院。",
    "reason": "一、按更生及清算事件專屬債務人住所地之地方法院管轄，消費\n    者債務清理條例第5 條第1 項定有明文。所謂住所，係指依\n    一定事實，足認以久住之意思，住於一定之地域者，即為設\n    定其住所於該地，此觀諸民法第20條第1 項規定自明。又訴\n    訟之全部或一部，法院認為無管轄權者，依原告聲請或依職\n    權以裁定移送於其管轄法院，民事訴訟法第28條第1 項規定\n    甚明。且上開規定，於更生或清算程序準用之，消費者債務\n    清理條例第15條亦有明定。\n二、經查，債務人向本院聲請更生時，聲請狀所載住所地在臺北\n    縣新莊市○○路69巷43號4 樓，且其戶籍地址亦同該址，有\n    其戶籍謄本（見本院卷第31頁）在卷可稽。是債務人以久住\n    之意思，且有居住事實之住所地應為臺北縣新莊市址，並非\n    本院轄區。從而，本件應專屬債務人住所地之法院即臺灣板\n    橋地方法院管轄，爰依職權移送其管轄法院。\n三、爰裁定如主文。"
  },
  "characters": {
    "judges": [
      "王怡雯"
    ],
    "prosecutors": [

    ],
    "lawyers": [
      "林淑娟"
    ],
    "clerks": [

    ],
    "plaintiffs": [

    ],
    "defendants": [

    ],
    "prosecutor_office": [

    ],
    "creditors": [

    ],
    "debtors": [
      "甲"
    ],
    "judicial_associate_officer": [

    ]
  },
  "adjudged_at": "2010-05-12",
  "created_at": "2016-01-05 12:21:46",
  "updated_at": "2016-01-05 12:21:46"
}