{
  "identify": "SLD-99-聲-711-20100512-1",
  "court": {
    "name": "臺灣士林地方法院",
    "code": "SLD"
  },
  "division": {
    "name": "刑事",
    "code": "M"
  },
  "year": 99,
  "word": "聲",
  "number": "711",
  "jcheck": "1",
  "reason": "定應執行刑",
  "content": "臺灣士林地方法院刑事裁定               99年度聲字第711號\n聲  請  人  臺灣士林地方法院檢察署檢察官\n受  刑  人  甲○○\n上列聲請人因受刑人數罪併罰有二裁判以上聲請定其應執行之刑\n（99年度執聲字第492號），本院裁定如下：\n    主  文\n甲○○所犯如附表所示之罪，應執行有期徒刑拾月，如易科罰金\n，以新臺幣壹仟元折算壹日。\n    理  由\n一、聲請意旨略以：受刑人甲○○因犯駕駛業務過失傷害等案件\n    ，先後經判決確定如附表，應依刑法第53條、第51條第5款\n    之規定，應定其應執行刑，爰依刑事訴訟法第477 條第1項\n    聲請裁定等語。\n二、按司法院釋字第662 號解釋：「中華民國94年2 月2 日修正\n    公布之現行刑法第41條第2 項，關於數罪併罰，數宣告刑均\n    得易科罰金，而定應執行刑之刑逾6 個月者，排除適用同條\n    第1 項得易科罰金之規定部分，與憲法第23條規定有違，並\n    與本院釋字第366 號解釋意旨不符，應自本解釋公布之日起\n    失其效力」，故對於數罪併罰，數宣告刑均得易科罰金，而\n    定應執行之刑超過6 個月之案件，依司法院釋字第366 號、\n    第662 號解釋意旨，仍得易科罰金，此亦為98年12月30日修\n    正之刑法第41條第8 項所明定。\n三、經查：\n(一)本件受刑人因犯駕駛業務過失傷害等案件，經臺灣高等法院\n    及本院先後判處如附表所示，並均經確定在案，其中附表編\n    號1 至2 部分，業經臺灣高等法院以98年度聲字第2085號裁\n    定定應執行刑為有期徒刑8 月，有各該裁定、判決書及臺灣\n    高等法院被告前案紀錄表各1 份附卷可參。茲聲請人以本院\n    為前開案件犯罪事實最後判決之法院，聲請定其應執行之刑\n    ，經本院審核前開案卷無訛，認本件聲請為有理由。\n(二)又其所犯如附表所示之罪，其宣告刑均得易科罰金，依上開\n    解釋，縱其定應執行刑之刑逾6 月，仍得易科罰金，是檢察\n    官雖未聲請諭知易科罰金之折算標準，然本院亦應依刑法第\n    41條第1 項前段、第8 項之規定，併予就其應執行刑之刑諭\n    知易科罰金之折算標準，附此敘明。\n四、爰依刑事訴訟法第477 條第1 項，刑法第41條第1 項前段、\n    第8 項、第53條、第51條第5 款，司法院大法官會議釋字第\n    366 號、第662 號，裁定如主文。\n中    華    民    國    99    年    5     月    12    日\n                  刑事第二庭法  官  蔡明宏\n以上正本證明與原本無異。\n如不服本裁定應於送達後5日內向本院提出抗告狀\n                            書記官  簡湘雲\n中    華    民    國    99    年    5     月    12    日",
  "structure": {
    "main": "甲○○所犯如附表所示之罪，應執行有期徒刑拾月，如易科罰金\n，以新臺幣壹仟元折算壹日。",
    "reason": "一、聲請意旨略以：受刑人甲○○因犯駕駛業務過失傷害等案件\n    ，先後經判決確定如附表，應依刑法第53條、第51條第5款\n    之規定，應定其應執行刑，爰依刑事訴訟法第477 條第1項\n    聲請裁定等語。\n二、按司法院釋字第662 號解釋：「中華民國94年2 月2 日修正\n    公布之現行刑法第41條第2 項，關於數罪併罰，數宣告刑均\n    得易科罰金，而定應執行刑之刑逾6 個月者，排除適用同條\n    第1 項得易科罰金之規定部分，與憲法第23條規定有違，並\n    與本院釋字第366 號解釋意旨不符，應自本解釋公布之日起\n    失其效力」，故對於數罪併罰，數宣告刑均得易科罰金，而\n    定應執行之刑超過6 個月之案件，依司法院釋字第366 號、\n    第662 號解釋意旨，仍得易科罰金，此亦為98年12月30日修\n    正之刑法第41條第8 項所明定。\n三、經查：\n(一)本件受刑人因犯駕駛業務過失傷害等案件，經臺灣高等法院\n    及本院先後判處如附表所示，並均經確定在案，其中附表編\n    號1 至2 部分，業經臺灣高等法院以98年度聲字第2085號裁\n    定定應執行刑為有期徒刑8 月，有各該裁定、判決書及臺灣\n    高等法院被告前案紀錄表各1 份附卷可參。茲聲請人以本院\n    為前開案件犯罪事實最後判決之法院，聲請定其應執行之刑\n    ，經本院審核前開案卷無訛，認本件聲請為有理由。\n(二)又其所犯如附表所示之罪，其宣告刑均得易科罰金，依上開\n    解釋，縱其定應執行刑之刑逾6 月，仍得易科罰金，是檢察\n    官雖未聲請諭知易科罰金之折算標準，然本院亦應依刑法第\n    41條第1 項前段、第8 項之規定，併予就其應執行刑之刑諭\n    知易科罰金之折算標準，附此敘明。\n四、爰依刑事訴訟法第477 條第1 項，刑法第41條第1 項前段、\n    第8 項、第53條、第51條第5 款，司法院大法官會議釋字第\n    366 號、第662 號，裁定如主文。"
  },
  "characters": {
    "judges": [
      "蔡明宏"
    ],
    "prosecutors": [

    ],
    "lawyers": [

    ],
    "clerks": [
      "簡湘雲"
    ],
    "plaintiffs": [

    ],
    "defendants": [

    ],
    "prosecutor_office": [
      "臺灣士林地方法院檢察署檢察官"
    ],
    "creditors": [

    ],
    "debtors": [

    ],
    "judicial_associate_officer": [

    ]
  },
  "adjudged_at": "2010-05-12",
  "created_at": "2016-01-05 12:19:55",
  "updated_at": "2016-01-05 12:19:55"
}