{
  "identify": "TCH-96-建上-37-20100104-2",
  "court": {
    "name": "臺灣高等法院",
    "code": "TCH"
  },
  "division": {
    "name": "民事",
    "code": "V"
  },
  "year": 96,
  "word": "建上",
  "number": "37",
  "jcheck": "2",
  "reason": "損害賠償",
  "content": "臺灣高等法院臺中分院民事裁定  96年度建上字第37號\n上  訴  人  乙○○\n            甲○○○\n            己○○\n            戊○○\n            丁○○\n上五人共同\n送達代收人  丙○○\n上列上訴人因與被上訴人親府開發股份有限公司間請求損害賠償\n事件，不服本院民國98年12月1日所為第二審判決，提起上訴，\n本院裁定如下：\n      主  文\n上訴人應於收受本裁定正本七日內，補繳第三審裁判費新台幣壹\n拾柒萬伍仟陸佰零捌元，及委任律師或具律師資格之關係人為訴\n訟代理人之委任狀，逾期即駁回其上訴。\n      理  由\n一、本件損害賠償事件，上訴人不服本院第二審判決，提起上訴\n    ，核其訴訟標的價額為新台幣（下同）11,932,355元，第三\n    審應徵裁判費為175,608元，茲依民事訴訟法第481條、第44\n    2條第2項前段規定，限上訴人於收受本裁定正本7日內，如\n    數逕向本院補繳。\n二、按，「對於第二審判決上訴，上訴人應委任律師為訴訟代理\n    人，但上訴人或其法定代理人具有律師資格者，不在此限；\n    上訴人之配偶、三親等內之血親、二親等內之姻親，或上訴\n    人為法人、中央或地方機關時，其所屬專任人員具有律師資\n    格並經法院認為適當者，亦得為第三審訴訟代理人；第一項\n    但書及第二項情形，應於提起上訴或委任時釋明之；上訴人\n    未依第一項、第二項規定委任訴訟代理人，或雖依第二項委\n    任，法院認為不適當者，第二審法院應定期先命補正，逾期\n    未補正，亦未依第466條之2為聲請者，第二審法院應以上訴\n    不合法裁定駁回之」，民事訴訟法第466條之1定有明文。本\n    件上訴人對於本院第二審判決提起上訴，未依規定委任律師\n    或具律師資格之關係人為訴訟代理人，爰依上開規定限期命\n    補正。\n三、上訴人逾期未依本裁定補正者，即依法裁定駁回其上訴，特\n    此裁定。\n中    華    民    國    99    年    1     月    4     日\n                民事第三庭    審判長法  官  陳照德\n                                    法  官  李平勳\n                                    法  官  朱  樑\n以上正本係照原本作成。\n就核定訴訟標的金額部分得抗告，其餘不得抗告。\n如不服本裁定應於裁定送達後10日內向本院提出抗告理由狀（須\n按他造人數附具繕本），並繳納抗告裁判費新台幣1,000元。\n                                    書記官  陳妙瑋\n中    華    民    國    99    年    1     月    4     日\n                                                      Ｓ\n",
  "structure": {
    "main": "上訴人應於收受本裁定正本七日內，補繳第三審裁判費新台幣壹\n拾柒萬伍仟陸佰零捌元，及委任律師或具律師資格之關係人為訴\n訟代理人之委任狀，逾期即駁回其上訴。",
    "reason": "一、本件損害賠償事件，上訴人不服本院第二審判決，提起上訴\n    ，核其訴訟標的價額為新台幣（下同）11,932,355元，第三\n    審應徵裁判費為175,608元，茲依民事訴訟法第481條、第44\n    2條第2項前段規定，限上訴人於收受本裁定正本7日內，如\n    數逕向本院補繳。\n二、按，「對於第二審判決上訴，上訴人應委任律師為訴訟代理\n    人，但上訴人或其法定代理人具有律師資格者，不在此限；\n    上訴人之配偶、三親等內之血親、二親等內之姻親，或上訴\n    人為法人、中央或地方機關時，其所屬專任人員具有律師資\n    格並經法院認為適當者，亦得為第三審訴訟代理人；第一項\n    但書及第二項情形，應於提起上訴或委任時釋明之；上訴人\n    未依第一項、第二項規定委任訴訟代理人，或雖依第二項委\n    任，法院認為不適當者，第二審法院應定期先命補正，逾期\n    未補正，亦未依第466條之2為聲請者，第二審法院應以上訴\n    不合法裁定駁回之」，民事訴訟法第466條之1定有明文。本\n    件上訴人對於本院第二審判決提起上訴，未依規定委任律師\n    或具律師資格之關係人為訴訟代理人，爰依上開規定限期命\n    補正。\n三、上訴人逾期未依本裁定補正者，即依法裁定駁回其上訴，特\n    此裁定。"
  },
  "characters": {
    "judges": [
      "陳照德",
      "李平勳",
      "朱樑"
    ],
    "prosecutors": [

    ],
    "lawyers": [
      "或具"
    ],
    "clerks": [
      "陳妙瑋"
    ],
    "plaintiffs": [

    ],
    "defendants": [

    ],
    "prosecutor_office": [

    ],
    "creditors": [

    ],
    "debtors": [

    ],
    "judicial_associate_officer": [

    ]
  },
  "adjudged_at": "2010-01-04",
  "created_at": "2016-01-05 14:36:23",
  "updated_at": "2016-01-05 14:36:23"
}