{
  "identify": "TCH-98-上-355-20100105-1",
  "court": {
    "name": "臺灣高等法院",
    "code": "TCH"
  },
  "division": {
    "name": "民事",
    "code": "V"
  },
  "year": 98,
  "word": "上",
  "number": "355",
  "jcheck": "1",
  "reason": "返還股金",
  "content": "臺灣高等法院臺中分院民事裁定  98年度上字第355號\n聲  請  人  丙○○\n上  訴  人  甲○○\n                        4樓\n被 上 訴人  乙○○\n                        12號\n承當訴訟人  丙○○\n上列聲請人因上訴人與被上訴人間請求返還股金事件，聲請人聲\n請參加訴訟，本院裁定如下：\n      主  文\n准予聲請人參加本件訴訟。\n      理  由\n一、本件聲請意旨略以：本件訴訟之訴訟標的業於民國（下同）\n    98年8月20日全部轉讓與聲請人，並已於98年9月2日將債權\n    轉讓通知送達於債務人即上訴人，故依民事訴訟法第58條規\n    定，聲請參加訴訟等語。\n二、按就兩造之訴訟有法律上利害關係之第三人，為輔助一造起\n    見，於該訴訟繫屬中，得為參加。民事訴訟法第58條第1項\n    定有明文。本件依聲請人及被上訴人之陳述，被上訴人既已\n    將其對上訴人之債權轉讓與聲請人，則聲請人以利害關係人\n    身分聲請參加訴訟，上訴人雖表示不同意，然本院審酌上情\n    認於法並無不合，應予准許聲請人之參加訴訟。\n據上論結，本件聲請為有理由，依民事訴訟法第60條，裁定如主\n文。\n中    華    民    國    99    年    1     月    5     日\n                民事第二庭    審判長法  官  邱森樟\n                                    法  官  謝說容\n                                    法  官  蔡秉宸\n以上正本係照原本作成。\n如不服本裁定應於裁定送達後10日內向本院提出抗告理由狀（須\n按他造人數附具繕本），並繳納抗告裁判費新台幣1,000元。\n                                    書記官  洪麗華\n中    華    民    國    99    年    1     月    5     日\n                                                      Ｓ\n",
  "structure": {
    "main": "准予聲請人參加本件訴訟。",
    "reason": "一、本件聲請意旨略以：本件訴訟之訴訟標的業於民國（下同）\n    98年8月20日全部轉讓與聲請人，並已於98年9月2日將債權\n    轉讓通知送達於債務人即上訴人，故依民事訴訟法第58條規\n    定，聲請參加訴訟等語。\n二、按就兩造之訴訟有法律上利害關係之第三人，為輔助一造起\n    見，於該訴訟繫屬中，得為參加。民事訴訟法第58條第1項\n    定有明文。本件依聲請人及被上訴人之陳述，被上訴人既已\n    將其對上訴人之債權轉讓與聲請人，則聲請人以利害關係人\n    身分聲請參加訴訟，上訴人雖表示不同意，然本院審酌上情\n    認於法並無不合，應予准許聲請人之參加訴訟。\n據上論結，本件聲請為有理由，依民事訴訟法第60條，裁定如主\n文。"
  },
  "characters": {
    "judges": [
      "邱森樟",
      "謝說容",
      "蔡秉宸"
    ],
    "prosecutors": [

    ],
    "lawyers": [

    ],
    "clerks": [
      "洪麗華"
    ],
    "plaintiffs": [

    ],
    "defendants": [

    ],
    "prosecutor_office": [
      "丙"
    ],
    "creditors": [

    ],
    "debtors": [

    ],
    "judicial_associate_officer": [

    ]
  },
  "adjudged_at": "2010-01-05",
  "created_at": "2016-01-05 15:07:24",
  "updated_at": "2016-01-05 15:07:24"
}