{
  "identify": "TNH-98-上國易-6-20100105-1",
  "court": {
    "name": "臺灣高等法院",
    "code": "TNH"
  },
  "division": {
    "name": "民事",
    "code": "V"
  },
  "year": 98,
  "word": "上國易",
  "number": "6",
  "jcheck": "1",
  "reason": "國家賠償",
  "content": "臺灣高等法院臺南分院民事判決    98年度上國易字第6號\n上  訴  人  雲林縣麥寮鄉公所\n法定代理人  丙○○\n訴訟代理人  乙○○\n            甲○○\n被 上 訴人  丁○○\n上列當事人間請求國家賠償事件，上訴人對於中華民國98年9月2\n2日臺灣雲林地方法院第一審判決（98年度國字第3號）提起上訴\n，本院於98年12月22日言詞辯論終結，判決如下：\n    主  文\n上訴駁回。\n第二審訴訟費用由上訴人負擔。\n    事實及理由\n甲、程序事項：按賠償義務機關拒絕賠償，或自提出請求之日起\n    逾三十日不開始協議，或自開始協議之日起逾六十日協議不\n    成立時，請求權人得提起損害賠償之訴，國家賠償法第11條\n    第1項前段定有明文。本件上訴人係於民國（下同）97年12\n    月15日收到被上訴人國家賠償請求書，經上訴人訴訟代理人\n    陳明在卷，惟上訴人並未通知被上訴人進行協議或給予拒絕\n    賠償理由書，業經上訴人於原審98年5月5日言詞辯論時自承\n    無訛，依前開說明，被上訴人提起本訴，程序上並無不合，\n    先予敘明。\n乙、實體事項：\n壹、被上訴人主張：被上訴人之子林恭輝於96年8月1日上午駕駛\n    被上訴人所有之農用耕耘機，途經雲林縣麥寮鄉興化厝重劃\n    區○○○道路即麥寮鄉○○段416-1地號土地（下稱系爭產\n    業道路），因系爭產業道路路基被掏空，且路肩雜草叢生，\n    上訴人為管理機關，未儘速修復，亦未設置警示標誌，致被\n    上訴人之子林恭輝駕駛之耕耘機翻覆墜河，造成車毀人傷事\n    故（下稱系爭事故），被上訴人毀損之耕耘機係於95年7月7\n    日以新台幣（下同）300萬元向台中裕農農機廠有限公司（\n    下稱裕農公司）價購，因系爭事故造成毀損，經裕農公司修\n    復費用高達101萬元，爰依國家賠償法第3條第1項、第11條\n    第1項之規定，請求上訴人賠償其損害。並聲明駁回上訴（\n    被上訴人於原審請求上訴人給付110萬元，及其法定遲延利\n    息，原審判決上訴人應給付被上訴人70萬8,260元，而駁回\n    被上訴人其餘之訴，被上訴人就其敗訴部分並未提起上訴）\n    。\n貳、上訴人則以：系爭產業道路乃雲林縣台西地政事務所以內政\n    部與雲林縣政府函示，自雲林縣麥寮鄉○○段416地號土地\n    逕行分割並登記上訴人為管理機關，又系爭產業道路坐落東\n    西向，呈長條形，從地籍圖來看，系爭產業道路並未實施實\n    質農地重劃，與經重劃後整齊劃一之南北向農地有別，雲林\n    縣政府未能提出農地重劃及土地移交相關文件，難謂已移交\n    上訴人管理維護，自無農地重劃條例第37條之適用。另依雲\n    林縣麥寮鄉崙後村辦公處93年8月9日雲麥鄉崙後村字第135\n    號函，有關施厝大排土方坡面修復相關資料顯示，施厝大排\n    土方流失，呈凹洞，導致路基坍塌，其修復費用支出單位為\n    雲林縣政府，足資證明該路段上訴人非實質管理、維護機關\n    等語置辯。\n參、兩造不爭執事項：\n一、系爭產業道路為施厝大排之堤岸道路，寬度約四公尺左右，\n    於事故發生時有鋪設柏油路面，於事故發生後可看出該處路\n    面塌陷約三分之一。\n二、被上訴人所有之農用耕耘機為裕農牌、型號ＪＤ-7820、寬\n    度為244公分。\n三、上訴人係於97年12月15日收到被上訴人國家賠償請求書。\n四、第三人裕農公司於原審97年度國字第7號案件中具狀陳報，\n    被上訴人所有農用耕耘機因系爭事故毀損修理費共1,011,80\n    0元，至於該耕耘機自95年9月13日掛牌後至系爭事故發生當\n    時之折舊比率為三成。\n五、雲林縣麥寮鄉崙後村辦公處於93年8月9日以雲麥鄉崙後村字\n    第135號發函予麥寮鄉公所，就該鄉施厝大排（三盛橋上游\n    段）堤岸土方流失，路面塌陷，危及行車安全，請麥寮鄉公\n    所派員勘查修復。該次搶修之處所與本次事故處所相近，且\n    同是施厝大排南側堤岸。\n肆、兩造爭執之事項：\n一、上訴人是否為系爭產業道路之管理機關？\n二、若上訴人為管理機關，其對系爭產業道路之管理有無欠缺？\n    其欠缺與本件事故的發生，有無相當因果關係？\n三、被上訴人所主張之損害金額以多少為合理？\n伍、本院之判斷：\n一、上訴人為系爭產業道路之管理機關：\n  (一)依雲林縣政府98年5月27日府地劃字第0980701686號函說明\n    三：「復查麥寮鄉○○段416地號土地係列屬本縣興化厝農\n    地重劃區重化後新規劃農路用地，並依據農地重劃條例第37\n    條：『重劃區農路及非農田水利會管理之水路，其用地應登\n    記為該管直轄市或縣（市）所有。原登記為國有、省有及鄉\n   （鎮）有者，應辦理註銷手續。前項農路及水路，由直轄市\n    或縣（市）政府自行或指定機關、團體管理、維護之。…』\n    規定登記為雲林縣政府所有，管理者麥寮鄉公所。」次依雲\n    林縣政府98年6月29日府地劃字第0980080445號函說明二：\n    「…本府係依據農地重劃條例第37條：『重劃區農路及非農\n    田水利會管理之水路，其用地應登記為該管直轄市或縣（市\n    ）所有。原登記為國有、省有及鄉（鎮）有者，應辦理註銷\n    手續。前項農路及水路，由直轄市或縣（市）政府自行或指\n    定機關、團體管理、維護之。其費用由各該政府列入年度預\n    算。…』規定將重劃區農路移請麥寮鄉公所管理、維護，該\n    重劃區係於75年度辦竣，事隔二十餘年，移交相關文件已無\n    法調閱，惟按本縣辦理重劃區農路部分自始至今均依上開規\n    定交由公所管理維護之。」再按雲林縣政府98年8月5日府工\n    養字第0981402897號函說明二：「…，該筆坐落雲林縣麥寮\n    鄉○○段416-1地號土地興化厝農地重劃區，據本府地政處\n    府地劃字第0980080445號函表示，已於75年重劃完竣，並依\n    規定交由公所管理。至於96年8月1日鋪設於上揭土地之柏油\n    路面，並非由本府工務處出資鋪設。」可知，從75年系爭產\n    業道路重劃完竣後，雲林縣政府已將系爭產業道路交由上訴\n    人管理。\n  (二)依系爭產業道路（麥寮鄉○○段416-1地號土地）之土地登\n    記謄本記載，管理者為上訴人，則依不動產登記之公示性，\n    應認上訴人為系爭產業道路之管理機關。\n  (三)上訴人答辯所引用之雲林縣麥寮鄉崙後村辦公處93年8月9日\n    雲麥鄉崙後村字第135號函，麥寮鄉公所收受後，建設課主\n    辦技士廖育成另以簽呈請示：「主旨：位於本鄉施厝大排（\n    三盛橋上游段）土方坡面，土方流失，呈凹洞，路面塌陷，\n    危及行車安全情緊急，經電話通知縣府水利課，須進行搶\n    修，水利課長同意由公所辦理，費用由縣府支付，擬請准予\n    辦理。」經建設課長、主任秘書蓋戳層轉鄉長批示「如擬」\n    ，有上訴人提出之該簽呈影本在卷可稽。該次搶修之處所與\n    本次事故處所相近，且同是施厝大排南側堤岸，足以認定上\n    訴人對該路段確有從事管理、維護工作。\n  (四)上訴人雖抗辯稱系爭產業道路並未重劃，雲林縣政府未實質\n    移交系爭產業道路，上訴人非系爭產業道路之實質管理機關\n    ，無從管理，且系爭產業道路上之柏油路面並非上訴人所鋪\n    設，又系爭產業道路旁之大排潰堤，該修繕費用之支出單位\n    為雲林縣政府非上訴人，仍難認上訴人非系爭產業道路之管\n    理機關云云，然基於政府一體原則，上級政府補助下級政府\n    經費，乃施政運作慣例，尚不能以系爭產業道路旁之大排潰\n    堤，該修繕費用之支出單位為雲林縣政府，即認系爭產業道\n    路之管理機關為雲林縣政府，況依據農地重劃條例第37條：\n    「重劃區農路及非農田水利會管理之水路，其用地應登記為\n    該管直轄市或縣（市）所有。原登記為國有、省有及鄉（鎮\n    ）有者，應辦理註銷手續。前項農路及水路，由直轄市或縣\n    （市）政府自行或指定機關、團體管理、維護之」之規定，\n    雲林縣政府有權指定上訴人為管理機關。\n二、上訴人對系爭產業道路之管理有欠缺：\n  (一)證人邱耀煌於原審98年8月25日言詞辯論證稱：「（問：96\n    年8月1日上午你有無到雲林縣麥寮鄉施厝大排旁安西段土地\n    上的堤岸道路拖吊跌落施厝大排的耕耘機？）有。」，「（\n    問：是否記得到達的時間？）大約上午十一點左右。」，「\n    （問：你當時駕駛的吊車有多寬？）我是開113噸的吊車，\n    寬度約兩米半到三米」，「（問：耕耘機掉落的地點是在東\n    西向的道路，該道路兩端會有南北向的道路，該掉落處距離\n    較近之南北向道路，是在東邊或西邊？距離大約多遠？）我\n    是從北邊向南走，因為堤岸道路無法讓我通行，所以我是將\n    吊車開到附近民宅的空地，再將吊桿伸到耕耘機掉落處將它\n    吊起」，「（問：你要拖吊以前，有先觀察堤岸道路的狀況\n    嗎？）有」，「（問：當時堤岸道路有無崩塌？）有」，「\n    （問：崩塌處和無崩塌處寬度比例大約多少？）大約減少一\n    公尺半左右」「（問：你所說減少一公尺半，是僅指鋪柏油\n    的部分或連柏油以外的路肩也算進去？）包括路肩長草的部\n    分」等語。\n  (二)證人許建新於原審98年8月25日言詞辯論時證述：「（問：\n    96年8月1日原告的耕耘機掉落施厝大排，當天上午你有到現\n    場查看嗎？）當時我去看時，車子都已經吊好了，我只是去\n    看路面。」，「（問：你所見情形？）東西向的道路，南邊\n    有民宅，東西向路寬約四米的產業道路，南邊是民宅，水溝\n    部分雜草叢生，可能原告之子走過來不知道路基掏空才跌落\n    ，我去看時柏油路面缺壹角」，「（問：柏油路面缺損的寬\n    度及加計路肩缺損的寬度大約各為多少？）以目測，柏油路\n    連路肩少了三分之一」，「（問：剛才說四米寬的產業道路\n    ，是包括路肩嗎？）產業道路鋪柏油後，旁邊還有一點雜草\n    的部分，肇事地點已經接近南北向道路的橋，那一段的堤岸\n    道路有比較窄，往東邊才比較寬一點」等語。\n  (三)由證人邱耀煌及許建新之證詞，其二人對於系爭產業道路於\n    系爭事故發生時之路況描述相近（許建新所稱寬約四米的產\n    業道路連路肩少了三分之一，與邱耀煌所稱大約減少一公尺\n    半左右，接近），故該二人證詞之可信性頗高。其中證人許\n    建新為施厝村的村長，其對於系爭產業道路之路況應更加熟\n    悉。而據證人邱耀煌及證人許建新之上述證詞，系爭事故發\n    生當時，系爭產業道路坍塌約一公尺半或三分之一，上訴人\n    為系爭產業道路之管理機關有如前述，未及時維護或設置警\n    告標誌、路障，使用路人誤信系爭產業道路仍能通行，致生\n    事故，可見上訴人對系爭產業道路之管理為有欠缺。\n三、被上訴人之耕耘機受有損害與上訴人對系爭產業道路管理有\n    欠缺，兩者間有相當因果關係：\n    被上訴人之子駕駛耕耘機經過系爭產業道路時，因系爭產業\n    道路有部分坍塌（缺角），被上訴人之子連同耕耘機翻覆至\n    系爭產業道路旁之水溝，導致被上訴人所有之耕耘機受有損\n    害，倘若上訴人有及時維修系爭產業道路或設置警告標誌提\n    醒用路人系爭產業道路已坍塌，或設置路障避免用路人通行\n    發生意外，系爭事故當不致發生，是故，被上訴人之耕耘機\n    受有損害，與系爭產業道路管理之欠缺，兩者間自有相當因\n    果關係。\n四、上訴人應賠償之金額：\n  (一)按公有公共設施因設置或管理有欠缺，致人民之生命、身體\n    或財產受有損害者，國家應負損害賠償責任，國家賠償法第\n    3條第1項定有明文。所謂管理有欠缺者，係指公共設施於建\n    造後未善為保管，怠為修護致該物發生瑕疵，復未為必要之\n    防護措施，致使該公共設施欠缺通常應具備之安全性而言。\n    又此處之國家賠償責任，係採無過失主義，即以該公共設施\n    之設置或管理有欠缺，並因此一欠缺致人民受有損害為其構\n    成要件，並不以管理機關有過失為必要。又按，凡公共設施\n    由國家或地方自治團體設置或事實上處於管理狀態，即有國\n    家賠償法之適用（最高法院91年度台上字第858號判決意旨\n    參照）。\n  (二)上訴人為系爭產業道路之管理機關，對系爭道路未保持足以\n    維護行走安全之應有狀態，對公有公共設施管理有欠缺，致\n    被上訴人所有之耕耘機行經系爭產業道路時，因路基掏空而\n    翻覆受有損害，被上訴人自得請求上訴人負損害賠償責任。\n    查被上訴人所有之耕耘機因系爭事故毀損修理費共101萬1,8\n    00元，至於該耕耘機自95年9月13日掛牌後至系爭事故發生\n    當時之折舊比率為三成，此經第三人裕農公司於原審97年度\n    國字第7號事件中具狀陳報（見原審97年度國字第7號卷第10\n    9頁）復為兩造所不爭執，依最高法院77年度第9次民事庭會\n    議決議(一)意旨：「物被毀損時，被害人除得依民法第196條\n    請求賠償外，並不排除民法第213條至第215條之適用。依民\n    法第196條請求賠償物被毀損所減少之價額，得以修復費用\n    為估定之標準，但以必要者為限(例如：修理材料以新品換\n    舊品，應予折舊)。」，則被上訴人得請求之損害賠償金額\n    為70萬8,260元【計算式：1,011,800×0.7＝708,260】。\n五、從而，被上訴人依據國家賠償法第3條第1項規定，請求上訴\n    人給付之金額，在70萬8,260元及自被上訴人國家賠償請求\n    書送達上訴人翌日即97年12月16日起，至清償日止，按年息\n    百分之五計算之利息，為有理由，應予准許。逾此部分金額\n    之請求，則無理由，應予駁回。原審就上開應准許部分，為\n    上訴人敗訴之判決，於法並無不合。上訴意旨指摘原審此部\n    分判決不當，求予廢棄改判，為無理由，應予駁回。\n陸、據上論結，本件上訴為無理由，依民事訴訟法第449條第1項\n    、第78條、第85條第1項前段，判決如主文。\n中    華    民    國    99    年     1    月     5    日\n                  民事第三庭    審判長法  官    蘇重信\n                                      法  官    王浦傑\n                                      法  官    張世展\n上為正本係照原本作成。\n不得上訴。\n中    華    民    國    99    年     1    月     5    日\n                                      書記官    陳嘉琍",
  "structure": {
    "main": "上訴駁回。\n第二審訴訟費用由上訴人負擔。",
    "fact": "甲、程序事項：按賠償義務機關拒絕賠償，或自提出請求之日起\n    逾三十日不開始協議，或自開始協議之日起逾六十日協議不\n    成立時，請求權人得提起損害賠償之訴，國家賠償法第11條\n    第1項前段定有明文。本件上訴人係於民國（下同）97年12\n    月15日收到被上訴人國家賠償請求書，經上訴人訴訟代理人\n    陳明在卷，惟上訴人並未通知被上訴人進行協議或給予拒絕\n    賠償理由書，業經上訴人於原審98年5月5日言詞辯論時自承\n    無訛，依前開說明，被上訴人提起本訴，程序上並無不合，\n    先予敘明。\n乙、實體事項：\n壹、被上訴人主張：被上訴人之子林恭輝於96年8月1日上午駕駛\n    被上訴人所有之農用耕耘機，途經雲林縣麥寮鄉興化厝重劃\n    區○○○道路即麥寮鄉○○段416-1地號土地（下稱系爭產\n    業道路），因系爭產業道路路基被掏空，且路肩雜草叢生，\n    上訴人為管理機關，未儘速修復，亦未設置警示標誌，致被\n    上訴人之子林恭輝駕駛之耕耘機翻覆墜河，造成車毀人傷事\n    故（下稱系爭事故），被上訴人毀損之耕耘機係於95年7月7\n    日以新台幣（下同）300萬元向台中裕農農機廠有限公司（\n    下稱裕農公司）價購，因系爭事故造成毀損，經裕農公司修\n    復費用高達101萬元，爰依國家賠償法第3條第1項、第11條\n    第1項之規定，請求上訴人賠償其損害。並聲明駁回上訴（\n    被上訴人於原審請求上訴人給付110萬元，及其法定遲延利\n    息，原審判決上訴人應給付被上訴人70萬8,260元，而駁回\n    被上訴人其餘之訴，被上訴人就其敗訴部分並未提起上訴）\n    。\n貳、上訴人則以：系爭產業道路乃雲林縣台西地政事務所以內政\n    部與雲林縣政府函示，自雲林縣麥寮鄉○○段416地號土地\n    逕行分割並登記上訴人為管理機關，又系爭產業道路坐落東\n    西向，呈長條形，從地籍圖來看，系爭產業道路並未實施實\n    質農地重劃，與經重劃後整齊劃一之南北向農地有別，雲林\n    縣政府未能提出農地重劃及土地移交相關文件，難謂已移交\n    上訴人管理維護，自無農地重劃條例第37條之適用。另依雲\n    林縣麥寮鄉崙後村辦公處93年8月9日雲麥鄉崙後村字第135\n    號函，有關施厝大排土方坡面修復相關資料顯示，施厝大排\n    土方流失，呈凹洞，導致路基坍塌，其修復費用支出單位為\n    雲林縣政府，足資證明該路段上訴人非實質管理、維護機關\n    等語置辯。\n參、兩造不爭執事項：\n一、系爭產業道路為施厝大排之堤岸道路，寬度約四公尺左右，\n    於事故發生時有鋪設柏油路面，於事故發生後可看出該處路\n    面塌陷約三分之一。\n二、被上訴人所有之農用耕耘機為裕農牌、型號ＪＤ-7820、寬\n    度為244公分。\n三、上訴人係於97年12月15日收到被上訴人國家賠償請求書。\n四、第三人裕農公司於原審97年度國字第7號案件中具狀陳報，\n    被上訴人所有農用耕耘機因系爭事故毀損修理費共1,011,80\n    0元，至於該耕耘機自95年9月13日掛牌後至系爭事故發生當\n    時之折舊比率為三成。\n五、雲林縣麥寮鄉崙後村辦公處於93年8月9日以雲麥鄉崙後村字\n    第135號發函予麥寮鄉公所，就該鄉施厝大排（三盛橋上游\n    段）堤岸土方流失，路面塌陷，危及行車安全，請麥寮鄉公\n    所派員勘查修復。該次搶修之處所與本次事故處所相近，且\n    同是施厝大排南側堤岸。\n肆、兩造爭執之事項：\n一、上訴人是否為系爭產業道路之管理機關？\n二、若上訴人為管理機關，其對系爭產業道路之管理有無欠缺？\n    其欠缺與本件事故的發生，有無相當因果關係？\n三、被上訴人所主張之損害金額以多少為合理？\n伍、本院之判斷：\n一、上訴人為系爭產業道路之管理機關：\n  (一)依雲林縣政府98年5月27日府地劃字第0980701686號函說明\n    三：「復查麥寮鄉○○段416地號土地係列屬本縣興化厝農\n    地重劃區重化後新規劃農路用地，並依據農地重劃條例第37\n    條：『重劃區農路及非農田水利會管理之水路，其用地應登\n    記為該管直轄市或縣（市）所有。原登記為國有、省有及鄉\n   （鎮）有者，應辦理註銷手續。前項農路及水路，由直轄市\n    或縣（市）政府自行或指定機關、團體管理、維護之。…』\n    規定登記為雲林縣政府所有，管理者麥寮鄉公所。」次依雲\n    林縣政府98年6月29日府地劃字第0980080445號函說明二：\n    「…本府係依據農地重劃條例第37條：『重劃區農路及非農\n    田水利會管理之水路，其用地應登記為該管直轄市或縣（市\n    ）所有。原登記為國有、省有及鄉（鎮）有者，應辦理註銷\n    手續。前項農路及水路，由直轄市或縣（市）政府自行或指\n    定機關、團體管理、維護之。其費用由各該政府列入年度預\n    算。…』規定將重劃區農路移請麥寮鄉公所管理、維護，該\n    重劃區係於75年度辦竣，事隔二十餘年，移交相關文件已無\n    法調閱，惟按本縣辦理重劃區農路部分自始至今均依上開規\n    定交由公所管理維護之。」再按雲林縣政府98年8月5日府工\n    養字第0981402897號函說明二：「…，該筆坐落雲林縣麥寮\n    鄉○○段416-1地號土地興化厝農地重劃區，據本府地政處\n    府地劃字第0980080445號函表示，已於75年重劃完竣，並依\n    規定交由公所管理。至於96年8月1日鋪設於上揭土地之柏油\n    路面，並非由本府工務處出資鋪設。」可知，從75年系爭產\n    業道路重劃完竣後，雲林縣政府已將系爭產業道路交由上訴\n    人管理。\n  (二)依系爭產業道路（麥寮鄉○○段416-1地號土地）之土地登\n    記謄本記載，管理者為上訴人，則依不動產登記之公示性，\n    應認上訴人為系爭產業道路之管理機關。\n  (三)上訴人答辯所引用之雲林縣麥寮鄉崙後村辦公處93年8月9日\n    雲麥鄉崙後村字第135號函，麥寮鄉公所收受後，建設課主\n    辦技士廖育成另以簽呈請示：「主旨：位於本鄉施厝大排（\n    三盛橋上游段）土方坡面，土方流失，呈凹洞，路面塌陷，\n    危及行車安全情緊急，經電話通知縣府水利課，須進行搶\n    修，水利課長同意由公所辦理，費用由縣府支付，擬請准予\n    辦理。」經建設課長、主任秘書蓋戳層轉鄉長批示「如擬」\n    ，有上訴人提出之該簽呈影本在卷可稽。該次搶修之處所與\n    本次事故處所相近，且同是施厝大排南側堤岸，足以認定上\n    訴人對該路段確有從事管理、維護工作。\n  (四)上訴人雖抗辯稱系爭產業道路並未重劃，雲林縣政府未實質\n    移交系爭產業道路，上訴人非系爭產業道路之實質管理機關\n    ，無從管理，且系爭產業道路上之柏油路面並非上訴人所鋪\n    設，又系爭產業道路旁之大排潰堤，該修繕費用之支出單位\n    為雲林縣政府非上訴人，仍難認上訴人非系爭產業道路之管\n    理機關云云，然基於政府一體原則，上級政府補助下級政府\n    經費，乃施政運作慣例，尚不能以系爭產業道路旁之大排潰\n    堤，該修繕費用之支出單位為雲林縣政府，即認系爭產業道\n    路之管理機關為雲林縣政府，況依據農地重劃條例第37條：\n    「重劃區農路及非農田水利會管理之水路，其用地應登記為\n    該管直轄市或縣（市）所有。原登記為國有、省有及鄉（鎮\n    ）有者，應辦理註銷手續。前項農路及水路，由直轄市或縣\n    （市）政府自行或指定機關、團體管理、維護之」之規定，\n    雲林縣政府有權指定上訴人為管理機關。\n二、上訴人對系爭產業道路之管理有欠缺：\n  (一)證人邱耀煌於原審98年8月25日言詞辯論證稱：「（問：96\n    年8月1日上午你有無到雲林縣麥寮鄉施厝大排旁安西段土地\n    上的堤岸道路拖吊跌落施厝大排的耕耘機？）有。」，「（\n    問：是否記得到達的時間？）大約上午十一點左右。」，「\n    （問：你當時駕駛的吊車有多寬？）我是開113噸的吊車，\n    寬度約兩米半到三米」，「（問：耕耘機掉落的地點是在東\n    西向的道路，該道路兩端會有南北向的道路，該掉落處距離\n    較近之南北向道路，是在東邊或西邊？距離大約多遠？）我\n    是從北邊向南走，因為堤岸道路無法讓我通行，所以我是將\n    吊車開到附近民宅的空地，再將吊桿伸到耕耘機掉落處將它\n    吊起」，「（問：你要拖吊以前，有先觀察堤岸道路的狀況\n    嗎？）有」，「（問：當時堤岸道路有無崩塌？）有」，「\n    （問：崩塌處和無崩塌處寬度比例大約多少？）大約減少一\n    公尺半左右」「（問：你所說減少一公尺半，是僅指鋪柏油\n    的部分或連柏油以外的路肩也算進去？）包括路肩長草的部\n    分」等語。\n  (二)證人許建新於原審98年8月25日言詞辯論時證述：「（問：\n    96年8月1日原告的耕耘機掉落施厝大排，當天上午你有到現\n    場查看嗎？）當時我去看時，車子都已經吊好了，我只是去\n    看路面。」，「（問：你所見情形？）東西向的道路，南邊\n    有民宅，東西向路寬約四米的產業道路，南邊是民宅，水溝\n    部分雜草叢生，可能原告之子走過來不知道路基掏空才跌落\n    ，我去看時柏油路面缺壹角」，「（問：柏油路面缺損的寬\n    度及加計路肩缺損的寬度大約各為多少？）以目測，柏油路\n    連路肩少了三分之一」，「（問：剛才說四米寬的產業道路\n    ，是包括路肩嗎？）產業道路鋪柏油後，旁邊還有一點雜草\n    的部分，肇事地點已經接近南北向道路的橋，那一段的堤岸\n    道路有比較窄，往東邊才比較寬一點」等語。\n  (三)由證人邱耀煌及許建新之證詞，其二人對於系爭產業道路於\n    系爭事故發生時之路況描述相近（許建新所稱寬約四米的產\n    業道路連路肩少了三分之一，與邱耀煌所稱大約減少一公尺\n    半左右，接近），故該二人證詞之可信性頗高。其中證人許\n    建新為施厝村的村長，其對於系爭產業道路之路況應更加熟\n    悉。而據證人邱耀煌及證人許建新之上述證詞，系爭事故發\n    生當時，系爭產業道路坍塌約一公尺半或三分之一，上訴人\n    為系爭產業道路之管理機關有如前述，未及時維護或設置警\n    告標誌、路障，使用路人誤信系爭產業道路仍能通行，致生\n    事故，可見上訴人對系爭產業道路之管理為有欠缺。\n三、被上訴人之耕耘機受有損害與上訴人對系爭產業道路管理有\n    欠缺，兩者間有相當因果關係：\n    被上訴人之子駕駛耕耘機經過系爭產業道路時，因系爭產業\n    道路有部分坍塌（缺角），被上訴人之子連同耕耘機翻覆至\n    系爭產業道路旁之水溝，導致被上訴人所有之耕耘機受有損\n    害，倘若上訴人有及時維修系爭產業道路或設置警告標誌提\n    醒用路人系爭產業道路已坍塌，或設置路障避免用路人通行\n    發生意外，系爭事故當不致發生，是故，被上訴人之耕耘機\n    受有損害，與系爭產業道路管理之欠缺，兩者間自有相當因\n    果關係。\n四、上訴人應賠償之金額：\n  (一)按公有公共設施因設置或管理有欠缺，致人民之生命、身體\n    或財產受有損害者，國家應負損害賠償責任，國家賠償法第\n    3條第1項定有明文。所謂管理有欠缺者，係指公共設施於建\n    造後未善為保管，怠為修護致該物發生瑕疵，復未為必要之\n    防護措施，致使該公共設施欠缺通常應具備之安全性而言。\n    又此處之國家賠償責任，係採無過失主義，即以該公共設施\n    之設置或管理有欠缺，並因此一欠缺致人民受有損害為其構\n    成要件，並不以管理機關有過失為必要。又按，凡公共設施\n    由國家或地方自治團體設置或事實上處於管理狀態，即有國\n    家賠償法之適用（最高法院91年度台上字第858號判決意旨\n    參照）。\n  (二)上訴人為系爭產業道路之管理機關，對系爭道路未保持足以\n    維護行走安全之應有狀態，對公有公共設施管理有欠缺，致\n    被上訴人所有之耕耘機行經系爭產業道路時，因路基掏空而\n    翻覆受有損害，被上訴人自得請求上訴人負損害賠償責任。\n    查被上訴人所有之耕耘機因系爭事故毀損修理費共101萬1,8\n    00元，至於該耕耘機自95年9月13日掛牌後至系爭事故發生\n    當時之折舊比率為三成，此經第三人裕農公司於原審97年度\n    國字第7號事件中具狀陳報（見原審97年度國字第7號卷第10\n    9頁）復為兩造所不爭執，依最高法院77年度第9次民事庭會\n    議決議(一)意旨：「物被毀損時，被害人除得依民法第196條\n    請求賠償外，並不排除民法第213條至第215條之適用。依民\n    法第196條請求賠償物被毀損所減少之價額，得以修復費用\n    為估定之標準，但以必要者為限(例如：修理材料以新品換\n    舊品，應予折舊)。」，則被上訴人得請求之損害賠償金額\n    為70萬8,260元【計算式：1,011,800×0.7＝708,260】。\n五、從而，被上訴人依據國家賠償法第3條第1項規定，請求上訴\n    人給付之金額，在70萬8,260元及自被上訴人國家賠償請求\n    書送達上訴人翌日即97年12月16日起，至清償日止，按年息\n    百分之五計算之利息，為有理由，應予准許。逾此部分金額\n    之請求，則無理由，應予駁回。原審就上開應准許部分，為\n    上訴人敗訴之判決，於法並無不合。上訴意旨指摘原審此部\n    分判決不當，求予廢棄改判，為無理由，應予駁回。\n陸、據上論結，本件上訴為無理由，依民事訴訟法第449條第1項\n    、第78條、第85條第1項前段，判決如主文。",
    "reason": "甲、程序事項：按賠償義務機關拒絕賠償，或自提出請求之日起\n    逾三十日不開始協議，或自開始協議之日起逾六十日協議不\n    成立時，請求權人得提起損害賠償之訴，國家賠償法第11條\n    第1項前段定有明文。本件上訴人係於民國（下同）97年12\n    月15日收到被上訴人國家賠償請求書，經上訴人訴訟代理人\n    陳明在卷，惟上訴人並未通知被上訴人進行協議或給予拒絕\n    賠償理由書，業經上訴人於原審98年5月5日言詞辯論時自承\n    無訛，依前開說明，被上訴人提起本訴，程序上並無不合，\n    先予敘明。\n乙、實體事項：\n壹、被上訴人主張：被上訴人之子林恭輝於96年8月1日上午駕駛\n    被上訴人所有之農用耕耘機，途經雲林縣麥寮鄉興化厝重劃\n    區○○○道路即麥寮鄉○○段416-1地號土地（下稱系爭產\n    業道路），因系爭產業道路路基被掏空，且路肩雜草叢生，\n    上訴人為管理機關，未儘速修復，亦未設置警示標誌，致被\n    上訴人之子林恭輝駕駛之耕耘機翻覆墜河，造成車毀人傷事\n    故（下稱系爭事故），被上訴人毀損之耕耘機係於95年7月7\n    日以新台幣（下同）300萬元向台中裕農農機廠有限公司（\n    下稱裕農公司）價購，因系爭事故造成毀損，經裕農公司修\n    復費用高達101萬元，爰依國家賠償法第3條第1項、第11條\n    第1項之規定，請求上訴人賠償其損害。並聲明駁回上訴（\n    被上訴人於原審請求上訴人給付110萬元，及其法定遲延利\n    息，原審判決上訴人應給付被上訴人70萬8,260元，而駁回\n    被上訴人其餘之訴，被上訴人就其敗訴部分並未提起上訴）\n    。\n貳、上訴人則以：系爭產業道路乃雲林縣台西地政事務所以內政\n    部與雲林縣政府函示，自雲林縣麥寮鄉○○段416地號土地\n    逕行分割並登記上訴人為管理機關，又系爭產業道路坐落東\n    西向，呈長條形，從地籍圖來看，系爭產業道路並未實施實\n    質農地重劃，與經重劃後整齊劃一之南北向農地有別，雲林\n    縣政府未能提出農地重劃及土地移交相關文件，難謂已移交\n    上訴人管理維護，自無農地重劃條例第37條之適用。另依雲\n    林縣麥寮鄉崙後村辦公處93年8月9日雲麥鄉崙後村字第135\n    號函，有關施厝大排土方坡面修復相關資料顯示，施厝大排\n    土方流失，呈凹洞，導致路基坍塌，其修復費用支出單位為\n    雲林縣政府，足資證明該路段上訴人非實質管理、維護機關\n    等語置辯。\n參、兩造不爭執事項：\n一、系爭產業道路為施厝大排之堤岸道路，寬度約四公尺左右，\n    於事故發生時有鋪設柏油路面，於事故發生後可看出該處路\n    面塌陷約三分之一。\n二、被上訴人所有之農用耕耘機為裕農牌、型號ＪＤ-7820、寬\n    度為244公分。\n三、上訴人係於97年12月15日收到被上訴人國家賠償請求書。\n四、第三人裕農公司於原審97年度國字第7號案件中具狀陳報，\n    被上訴人所有農用耕耘機因系爭事故毀損修理費共1,011,80\n    0元，至於該耕耘機自95年9月13日掛牌後至系爭事故發生當\n    時之折舊比率為三成。\n五、雲林縣麥寮鄉崙後村辦公處於93年8月9日以雲麥鄉崙後村字\n    第135號發函予麥寮鄉公所，就該鄉施厝大排（三盛橋上游\n    段）堤岸土方流失，路面塌陷，危及行車安全，請麥寮鄉公\n    所派員勘查修復。該次搶修之處所與本次事故處所相近，且\n    同是施厝大排南側堤岸。\n肆、兩造爭執之事項：\n一、上訴人是否為系爭產業道路之管理機關？\n二、若上訴人為管理機關，其對系爭產業道路之管理有無欠缺？\n    其欠缺與本件事故的發生，有無相當因果關係？\n三、被上訴人所主張之損害金額以多少為合理？\n伍、本院之判斷：\n一、上訴人為系爭產業道路之管理機關：\n  (一)依雲林縣政府98年5月27日府地劃字第0980701686號函說明\n    三：「復查麥寮鄉○○段416地號土地係列屬本縣興化厝農\n    地重劃區重化後新規劃農路用地，並依據農地重劃條例第37\n    條：『重劃區農路及非農田水利會管理之水路，其用地應登\n    記為該管直轄市或縣（市）所有。原登記為國有、省有及鄉\n   （鎮）有者，應辦理註銷手續。前項農路及水路，由直轄市\n    或縣（市）政府自行或指定機關、團體管理、維護之。…』\n    規定登記為雲林縣政府所有，管理者麥寮鄉公所。」次依雲\n    林縣政府98年6月29日府地劃字第0980080445號函說明二：\n    「…本府係依據農地重劃條例第37條：『重劃區農路及非農\n    田水利會管理之水路，其用地應登記為該管直轄市或縣（市\n    ）所有。原登記為國有、省有及鄉（鎮）有者，應辦理註銷\n    手續。前項農路及水路，由直轄市或縣（市）政府自行或指\n    定機關、團體管理、維護之。其費用由各該政府列入年度預\n    算。…』規定將重劃區農路移請麥寮鄉公所管理、維護，該\n    重劃區係於75年度辦竣，事隔二十餘年，移交相關文件已無\n    法調閱，惟按本縣辦理重劃區農路部分自始至今均依上開規\n    定交由公所管理維護之。」再按雲林縣政府98年8月5日府工\n    養字第0981402897號函說明二：「…，該筆坐落雲林縣麥寮\n    鄉○○段416-1地號土地興化厝農地重劃區，據本府地政處\n    府地劃字第0980080445號函表示，已於75年重劃完竣，並依\n    規定交由公所管理。至於96年8月1日鋪設於上揭土地之柏油\n    路面，並非由本府工務處出資鋪設。」可知，從75年系爭產\n    業道路重劃完竣後，雲林縣政府已將系爭產業道路交由上訴\n    人管理。\n  (二)依系爭產業道路（麥寮鄉○○段416-1地號土地）之土地登\n    記謄本記載，管理者為上訴人，則依不動產登記之公示性，\n    應認上訴人為系爭產業道路之管理機關。\n  (三)上訴人答辯所引用之雲林縣麥寮鄉崙後村辦公處93年8月9日\n    雲麥鄉崙後村字第135號函，麥寮鄉公所收受後，建設課主\n    辦技士廖育成另以簽呈請示：「主旨：位於本鄉施厝大排（\n    三盛橋上游段）土方坡面，土方流失，呈凹洞，路面塌陷，\n    危及行車安全情緊急，經電話通知縣府水利課，須進行搶\n    修，水利課長同意由公所辦理，費用由縣府支付，擬請准予\n    辦理。」經建設課長、主任秘書蓋戳層轉鄉長批示「如擬」\n    ，有上訴人提出之該簽呈影本在卷可稽。該次搶修之處所與\n    本次事故處所相近，且同是施厝大排南側堤岸，足以認定上\n    訴人對該路段確有從事管理、維護工作。\n  (四)上訴人雖抗辯稱系爭產業道路並未重劃，雲林縣政府未實質\n    移交系爭產業道路，上訴人非系爭產業道路之實質管理機關\n    ，無從管理，且系爭產業道路上之柏油路面並非上訴人所鋪\n    設，又系爭產業道路旁之大排潰堤，該修繕費用之支出單位\n    為雲林縣政府非上訴人，仍難認上訴人非系爭產業道路之管\n    理機關云云，然基於政府一體原則，上級政府補助下級政府\n    經費，乃施政運作慣例，尚不能以系爭產業道路旁之大排潰\n    堤，該修繕費用之支出單位為雲林縣政府，即認系爭產業道\n    路之管理機關為雲林縣政府，況依據農地重劃條例第37條：\n    「重劃區農路及非農田水利會管理之水路，其用地應登記為\n    該管直轄市或縣（市）所有。原登記為國有、省有及鄉（鎮\n    ）有者，應辦理註銷手續。前項農路及水路，由直轄市或縣\n    （市）政府自行或指定機關、團體管理、維護之」之規定，\n    雲林縣政府有權指定上訴人為管理機關。\n二、上訴人對系爭產業道路之管理有欠缺：\n  (一)證人邱耀煌於原審98年8月25日言詞辯論證稱：「（問：96\n    年8月1日上午你有無到雲林縣麥寮鄉施厝大排旁安西段土地\n    上的堤岸道路拖吊跌落施厝大排的耕耘機？）有。」，「（\n    問：是否記得到達的時間？）大約上午十一點左右。」，「\n    （問：你當時駕駛的吊車有多寬？）我是開113噸的吊車，\n    寬度約兩米半到三米」，「（問：耕耘機掉落的地點是在東\n    西向的道路，該道路兩端會有南北向的道路，該掉落處距離\n    較近之南北向道路，是在東邊或西邊？距離大約多遠？）我\n    是從北邊向南走，因為堤岸道路無法讓我通行，所以我是將\n    吊車開到附近民宅的空地，再將吊桿伸到耕耘機掉落處將它\n    吊起」，「（問：你要拖吊以前，有先觀察堤岸道路的狀況\n    嗎？）有」，「（問：當時堤岸道路有無崩塌？）有」，「\n    （問：崩塌處和無崩塌處寬度比例大約多少？）大約減少一\n    公尺半左右」「（問：你所說減少一公尺半，是僅指鋪柏油\n    的部分或連柏油以外的路肩也算進去？）包括路肩長草的部\n    分」等語。\n  (二)證人許建新於原審98年8月25日言詞辯論時證述：「（問：\n    96年8月1日原告的耕耘機掉落施厝大排，當天上午你有到現\n    場查看嗎？）當時我去看時，車子都已經吊好了，我只是去\n    看路面。」，「（問：你所見情形？）東西向的道路，南邊\n    有民宅，東西向路寬約四米的產業道路，南邊是民宅，水溝\n    部分雜草叢生，可能原告之子走過來不知道路基掏空才跌落\n    ，我去看時柏油路面缺壹角」，「（問：柏油路面缺損的寬\n    度及加計路肩缺損的寬度大約各為多少？）以目測，柏油路\n    連路肩少了三分之一」，「（問：剛才說四米寬的產業道路\n    ，是包括路肩嗎？）產業道路鋪柏油後，旁邊還有一點雜草\n    的部分，肇事地點已經接近南北向道路的橋，那一段的堤岸\n    道路有比較窄，往東邊才比較寬一點」等語。\n  (三)由證人邱耀煌及許建新之證詞，其二人對於系爭產業道路於\n    系爭事故發生時之路況描述相近（許建新所稱寬約四米的產\n    業道路連路肩少了三分之一，與邱耀煌所稱大約減少一公尺\n    半左右，接近），故該二人證詞之可信性頗高。其中證人許\n    建新為施厝村的村長，其對於系爭產業道路之路況應更加熟\n    悉。而據證人邱耀煌及證人許建新之上述證詞，系爭事故發\n    生當時，系爭產業道路坍塌約一公尺半或三分之一，上訴人\n    為系爭產業道路之管理機關有如前述，未及時維護或設置警\n    告標誌、路障，使用路人誤信系爭產業道路仍能通行，致生\n    事故，可見上訴人對系爭產業道路之管理為有欠缺。\n三、被上訴人之耕耘機受有損害與上訴人對系爭產業道路管理有\n    欠缺，兩者間有相當因果關係：\n    被上訴人之子駕駛耕耘機經過系爭產業道路時，因系爭產業\n    道路有部分坍塌（缺角），被上訴人之子連同耕耘機翻覆至\n    系爭產業道路旁之水溝，導致被上訴人所有之耕耘機受有損\n    害，倘若上訴人有及時維修系爭產業道路或設置警告標誌提\n    醒用路人系爭產業道路已坍塌，或設置路障避免用路人通行\n    發生意外，系爭事故當不致發生，是故，被上訴人之耕耘機\n    受有損害，與系爭產業道路管理之欠缺，兩者間自有相當因\n    果關係。\n四、上訴人應賠償之金額：\n  (一)按公有公共設施因設置或管理有欠缺，致人民之生命、身體\n    或財產受有損害者，國家應負損害賠償責任，國家賠償法第\n    3條第1項定有明文。所謂管理有欠缺者，係指公共設施於建\n    造後未善為保管，怠為修護致該物發生瑕疵，復未為必要之\n    防護措施，致使該公共設施欠缺通常應具備之安全性而言。\n    又此處之國家賠償責任，係採無過失主義，即以該公共設施\n    之設置或管理有欠缺，並因此一欠缺致人民受有損害為其構\n    成要件，並不以管理機關有過失為必要。又按，凡公共設施\n    由國家或地方自治團體設置或事實上處於管理狀態，即有國\n    家賠償法之適用（最高法院91年度台上字第858號判決意旨\n    參照）。\n  (二)上訴人為系爭產業道路之管理機關，對系爭道路未保持足以\n    維護行走安全之應有狀態，對公有公共設施管理有欠缺，致\n    被上訴人所有之耕耘機行經系爭產業道路時，因路基掏空而\n    翻覆受有損害，被上訴人自得請求上訴人負損害賠償責任。\n    查被上訴人所有之耕耘機因系爭事故毀損修理費共101萬1,8\n    00元，至於該耕耘機自95年9月13日掛牌後至系爭事故發生\n    當時之折舊比率為三成，此經第三人裕農公司於原審97年度\n    國字第7號事件中具狀陳報（見原審97年度國字第7號卷第10\n    9頁）復為兩造所不爭執，依最高法院77年度第9次民事庭會\n    議決議(一)意旨：「物被毀損時，被害人除得依民法第196條\n    請求賠償外，並不排除民法第213條至第215條之適用。依民\n    法第196條請求賠償物被毀損所減少之價額，得以修復費用\n    為估定之標準，但以必要者為限(例如：修理材料以新品換\n    舊品，應予折舊)。」，則被上訴人得請求之損害賠償金額\n    為70萬8,260元【計算式：1,011,800×0.7＝708,260】。\n五、從而，被上訴人依據國家賠償法第3條第1項規定，請求上訴\n    人給付之金額，在70萬8,260元及自被上訴人國家賠償請求\n    書送達上訴人翌日即97年12月16日起，至清償日止，按年息\n    百分之五計算之利息，為有理由，應予准許。逾此部分金額\n    之請求，則無理由，應予駁回。原審就上開應准許部分，為\n    上訴人敗訴之判決，於法並無不合。上訴意旨指摘原審此部\n    分判決不當，求予廢棄改判，為無理由，應予駁回。\n陸、據上論結，本件上訴為無理由，依民事訴訟法第449條第1項\n    、第78條、第85條第1項前段，判決如主文。"
  },
  "characters": {
    "judges": [
      "蘇重信",
      "王浦傑",
      "張世展"
    ],
    "prosecutors": [

    ],
    "lawyers": [

    ],
    "clerks": [

    ],
    "plaintiffs": [

    ],
    "defendants": [

    ],
    "prosecutor_office": [

    ],
    "creditors": [

    ],
    "debtors": [

    ],
    "judicial_associate_officer": [

    ]
  },
  "adjudged_at": "2010-01-05",
  "created_at": "2016-01-05 15:08:50",
  "updated_at": "2016-01-05 15:08:50"
}