{
  "identify": "TNH-98-聲-967-20100104-1",
  "court": {
    "name": "臺灣高等法院",
    "code": "TNH"
  },
  "division": {
    "name": "刑事",
    "code": "M"
  },
  "year": 98,
  "word": "聲",
  "number": "967",
  "jcheck": "1",
  "reason": "聲明異議",
  "content": "臺灣高等法院臺南分院刑事裁定           98年度聲字第967號\n聲明異議人\n即受 刑 人  甲○○\n上列聲明異議人即受刑人對於臺灣雲林地方法院檢察署檢察官執\n行之指揮（98年度執再字第46號）聲明異議，本院裁定如下：\n    主  文\n聲明異議駁回。\n    理  由\n一、聲明異議意旨略以：聲明異議人即受刑人甲○○因詐欺案件\n    前於民國（下同）97年9月4日入雲林二監執行，嗣司法院大\n    法官會議釋字第662號解釋於98年6月19日公布，本件受刑人\n    因合於得易科罰金之要件，經監方於該號解釋公布當日釋放\n    。惟受刑人於98年10月20日至臺灣雲林地方法院檢察署執行\n    科報到，欲繳納罰金之際，卻遭檢察官否准，當場收押發監\n    執行，檢察官此舉恐與上開釋字第662號解釋意旨有違 ，爰\n    依刑事訴訟法第484條規定聲明異議云云。\n二、按依司法院大法官會議釋字第662號解釋：「中華民國94年2\n    月2日修正公布之現行刑法第41條第2項，關於數罪併罰，數\n    宣告刑均得易科罰金 ，而定應執行刑之刑逾6個月者，排除\n    適用同條第1項得易科罰金之規定部分 ，與憲法第23條規定\n    有違，並與本院釋字第366號解釋意旨不符 ，應自本解釋公\n    布之日起失其效力。」意旨，對於數罪併罰，數宣告刑均得\n    易科罰金，而定應執行之刑超過6個月之案件，仍得依修正\n    前刑法第41條第2項規定易科罰金。次按刑法第41條第1項規\n    定，犯最重本刑為5年以下有期徒刑以下之刑之罪，而受6個\n    月以下有期徒刑或拘役之宣告者，得易科罰金。但確因不執\n    行所宣告之刑，難收矯正之效，或難以維持法秩序者，不在\n    此限。故有期徒刑或拘役得易科罰金之案件，法院所諭知者\n    ，僅係如易科罰金之折算標準而已，至於是否准予易科罰金\n    ，則賦予執行檢察官視個案具體情形裁量之權限。易言之，\n    執行檢察官就受刑人是否確因不執行所宣告之刑，難收矯正\n    之效，或難以維持法秩序之情事，具有判斷之餘地，法院僅\n    得審查檢察官為刑法第41條第1項之裁量時，其判斷之程序\n    有無違背法令、事實認定有無錯誤、其審認之事實與刑法第\n    41條第1項之裁量要件有無合理關連、有無逾越或超過法律\n    規定之範圍等問題，不得自行代替檢察官判斷受刑人是否有\n    上開情事，倘有上述未依法定程序進行裁量，超越法律授權\n    裁量範圍之情事，法院始得撤銷，否則法律既已授權檢察官\n    就此部分有一定之裁量權限，即應尊重檢察官所為之專業判\n    斷。\n三、經查：\n（一）本件受刑人甲○○因犯詐欺等14罪，前後經臺灣雲林地方\n      法院96年度訴字第445號判決及本院97年度上訴字第68號\n      判決，各處以有期徒刑8月、8月、8月、8月、8月、8月、\n      8月、8月、8月、8月、8月、8月、8月、10月，各減為有\n      期徒刑4月、4月、4月、4月、4月、4月、4月、4月、4月\n      、4月、4月、4月、4月、5月，並定應執行有期徒刑3年6\n      月確定。受刑人自97年9月4日入監執行，於98年6月19日\n      因司法院釋字第662號解釋公布而出監，又經本院98年度\n      聲字第671號裁定上開14罪之宣告刑及應執行刑，如易科\n      罰金，以新臺幣1,000元折算1日。嗣受刑人依臺灣雲林地\n      方法院檢察署檢察官以98年度執再字第46號執行指揮之通\n      知，於98年10月20日遵期到案，經執行檢察官以其所為詐\n      欺等犯行達14次之多，認如不發監執行所宣告之徒刑，難\n      收矯正之效，故於98年10月20日當庭諭知不准易科罰金，\n      並予發監執行等情，業據本院調取臺灣雲林地方法院檢察\n      署98年度執再字第46號執行案卷核閱無訛，並有受刑人之\n      臺灣高等法院被告前案紀錄表1份在卷可稽。\n（二）聲明異議人即受刑人甲○○雖以本件依釋字第662號解釋\n      得易科罰金聲明異議云云，惟按檢察官如認定確因不執行\n      所宣告之刑，難收矯正之效，或難以維持法秩序，而不宜\n      易科罰金時，依刑法第41條第1項但書之規定，自可不准\n      易科罰金（司法院大法官會議釋字第662號解釋理由書參\n      照）。本件數罪併罰固屬得易科罰金之案件，然經承辦執\n      行檢察官審核結果，以受刑人係詐騙集團車手，經法院認\n      定其所為詐欺等犯行達14次之多，揆諸時下詐騙猖獗情形\n      ，為使受刑人產生就其犯行付出代價之感，倘不執行所宣\n      告之刑，顯難收矯正之效。執行檢察官依其專業判斷，於\n      法律授權範圍內依法定程序進行裁量，經核並無不當。從\n      而，受刑人執此號解釋聲明異議，即屬無據，自非可採。\n      本件聲明異議為無理由，應予駁回。\n四、據上論結，應依刑事訴訟法第486條，裁定如主文。\n中    華    民    國    99    年    1     月    4     日\n                  刑事第三庭    審判長法  官    陳義仲\n                                      法  官    宋明中\n                                      法  官    蔡勝雄\n以上正本證明與原本無異。\n不得抗告。\n                                      書記官    汪姿秀\n中    華    民    國    99    年    1     月    4     日",
  "structure": {
    "main": "聲明異議駁回。",
    "reason": "一、聲明異議意旨略以：聲明異議人即受刑人甲○○因詐欺案件\n    前於民國（下同）97年9月4日入雲林二監執行，嗣司法院大\n    法官會議釋字第662號解釋於98年6月19日公布，本件受刑人\n    因合於得易科罰金之要件，經監方於該號解釋公布當日釋放\n    。惟受刑人於98年10月20日至臺灣雲林地方法院檢察署執行\n    科報到，欲繳納罰金之際，卻遭檢察官否准，當場收押發監\n    執行，檢察官此舉恐與上開釋字第662號解釋意旨有違 ，爰\n    依刑事訴訟法第484條規定聲明異議云云。\n二、按依司法院大法官會議釋字第662號解釋：「中華民國94年2\n    月2日修正公布之現行刑法第41條第2項，關於數罪併罰，數\n    宣告刑均得易科罰金 ，而定應執行刑之刑逾6個月者，排除\n    適用同條第1項得易科罰金之規定部分 ，與憲法第23條規定\n    有違，並與本院釋字第366號解釋意旨不符 ，應自本解釋公\n    布之日起失其效力。」意旨，對於數罪併罰，數宣告刑均得\n    易科罰金，而定應執行之刑超過6個月之案件，仍得依修正\n    前刑法第41條第2項規定易科罰金。次按刑法第41條第1項規\n    定，犯最重本刑為5年以下有期徒刑以下之刑之罪，而受6個\n    月以下有期徒刑或拘役之宣告者，得易科罰金。但確因不執\n    行所宣告之刑，難收矯正之效，或難以維持法秩序者，不在\n    此限。故有期徒刑或拘役得易科罰金之案件，法院所諭知者\n    ，僅係如易科罰金之折算標準而已，至於是否准予易科罰金\n    ，則賦予執行檢察官視個案具體情形裁量之權限。易言之，\n    執行檢察官就受刑人是否確因不執行所宣告之刑，難收矯正\n    之效，或難以維持法秩序之情事，具有判斷之餘地，法院僅\n    得審查檢察官為刑法第41條第1項之裁量時，其判斷之程序\n    有無違背法令、事實認定有無錯誤、其審認之事實與刑法第\n    41條第1項之裁量要件有無合理關連、有無逾越或超過法律\n    規定之範圍等問題，不得自行代替檢察官判斷受刑人是否有\n    上開情事，倘有上述未依法定程序進行裁量，超越法律授權\n    裁量範圍之情事，法院始得撤銷，否則法律既已授權檢察官\n    就此部分有一定之裁量權限，即應尊重檢察官所為之專業判\n    斷。\n三、經查：\n（一）本件受刑人甲○○因犯詐欺等14罪，前後經臺灣雲林地方\n      法院96年度訴字第445號判決及本院97年度上訴字第68號\n      判決，各處以有期徒刑8月、8月、8月、8月、8月、8月、\n      8月、8月、8月、8月、8月、8月、8月、10月，各減為有\n      期徒刑4月、4月、4月、4月、4月、4月、4月、4月、4月\n      、4月、4月、4月、4月、5月，並定應執行有期徒刑3年6\n      月確定。受刑人自97年9月4日入監執行，於98年6月19日\n      因司法院釋字第662號解釋公布而出監，又經本院98年度\n      聲字第671號裁定上開14罪之宣告刑及應執行刑，如易科\n      罰金，以新臺幣1,000元折算1日。嗣受刑人依臺灣雲林地\n      方法院檢察署檢察官以98年度執再字第46號執行指揮之通\n      知，於98年10月20日遵期到案，經執行檢察官以其所為詐\n      欺等犯行達14次之多，認如不發監執行所宣告之徒刑，難\n      收矯正之效，故於98年10月20日當庭諭知不准易科罰金，\n      並予發監執行等情，業據本院調取臺灣雲林地方法院檢察\n      署98年度執再字第46號執行案卷核閱無訛，並有受刑人之\n      臺灣高等法院被告前案紀錄表1份在卷可稽。\n（二）聲明異議人即受刑人甲○○雖以本件依釋字第662號解釋\n      得易科罰金聲明異議云云，惟按檢察官如認定確因不執行\n      所宣告之刑，難收矯正之效，或難以維持法秩序，而不宜\n      易科罰金時，依刑法第41條第1項但書之規定，自可不准\n      易科罰金（司法院大法官會議釋字第662號解釋理由書參\n      照）。本件數罪併罰固屬得易科罰金之案件，然經承辦執\n      行檢察官審核結果，以受刑人係詐騙集團車手，經法院認\n      定其所為詐欺等犯行達14次之多，揆諸時下詐騙猖獗情形\n      ，為使受刑人產生就其犯行付出代價之感，倘不執行所宣\n      告之刑，顯難收矯正之效。執行檢察官依其專業判斷，於\n      法律授權範圍內依法定程序進行裁量，經核並無不當。從\n      而，受刑人執此號解釋聲明異議，即屬無據，自非可採。\n      本件聲明異議為無理由，應予駁回。\n四、據上論結，應依刑事訴訟法第486條，裁定如主文。"
  },
  "characters": {
    "judges": [
      "陳義仲",
      "宋明中",
      "蔡勝雄"
    ],
    "prosecutors": [

    ],
    "lawyers": [

    ],
    "clerks": [
      "汪姿秀"
    ],
    "plaintiffs": [

    ],
    "defendants": [

    ],
    "prosecutor_office": [

    ],
    "creditors": [

    ],
    "debtors": [

    ],
    "judicial_associate_officer": [

    ]
  },
  "adjudged_at": "2010-01-04",
  "created_at": "2016-01-05 14:37:53",
  "updated_at": "2016-01-05 14:37:53"
}