{
  "identify": "TNH-98-交抗-340-20100104-1",
  "court": {
    "name": "臺灣高等法院",
    "code": "TNH"
  },
  "division": {
    "name": "刑事",
    "code": "M"
  },
  "year": 98,
  "word": "交抗",
  "number": "340",
  "jcheck": "1",
  "reason": "聲明異議",
  "content": "臺灣高等法院臺南分院交通事件裁定     98年度交抗字第340號\n抗  告  人\n即受處分人  甲○○\n上列抗告人因違反道路交通管理處罰條例案件聲明異議，不服臺\n灣臺南地方法院中華民國98年11月17日所為裁定（98年交聲字第\n997號），提起抗告，本院裁定如下：\n    主  文\n抗告駁回。\n    理  由\n一、本件抗告意旨略以：\n（一）抗告人前於民國（下同）95年11月12日酒後駕車之行為，\n      業經臺灣臺南地方法院檢察署檢察官以96年度偵字第184\n      號為緩起訴處分，期間為2年，並命向罕見疾病基金會支\n      付新臺幣（下同）90,000元，抗告人已依限繳清，則依行\n      政罰法第26條所揭示之一行為不二罰原則，交通部公路總\n      局嘉義區監理所臺南監理站（下稱原處分機關）就抗告人\n      同一行為所為之49,500元罰鍰處分應予撤銷。\n（二）原處分機關98年7月23日嘉監南字第裁74-S00000000號裁\n      決書於98年7月24日送達抗告人即受處分人之戶籍地，並\n      由「曾秀碧」簽收，但曾秀碧為抗告人之大叔叔的前妻，\n      與抗告人之大叔叔已離婚6年以上，未居住該處所亦達5年\n      以上，「曾秀碧」女士確非抗告人之同居人。抗告人於98\n      年7月25日輾轉收到上開裁決書後，旋於同年7月27日前往\n      地檢署申請緩起訴處分書，並於同年8月10日收到該緩起\n      訴處分書後，透過電話與監理站人員聯繫，惟因抗告人之\n      法律知識不足及監理站人員傳達錯誤，使抗告人誤以為僅\n      須依裁決書所示之罰緩繳納期限即98年8月22日以前，至\n      監理站銷案即可，因而導致逾期提出異議。爰為此聲明異\n      議，請求撤銷原裁定云云。\n二、經查：\n（一）按受處分人 ，不服道路交通管理處罰條例第8條主管機關\n      所為之處罰，得於接到裁決書之翌日起20日內，向管轄地\n      方法院聲明異議；又依上開規定聲明異議之期間，自裁決\n      送達之翌日起算，並得依法扣除在途期間；另交通法庭認\n      聲明異議不合法律上之程式或其異議權已經喪失者，應以\n      裁定駁回之 ，道路交通管理處罰條例第87條第1項、道路\n      交通案件處理辦法第12條、第18條前段分別定有明文。又\n      按處理違反道路交通管理事件，有關文書送達之程序，依\n      行政程序法之規定，違反道路交通管理事件統一裁罰基準\n      及處理細則第5條定有明文 。再按送達，於應受送達人之\n      住居所、事務所或營業所為之。但在行政機關辦公處所或\n      他處會晤應受送達人時，得於會晤處所為之；於應送達處\n      所不獲會晤應受送達人時，得將文書付與有辨別事理能力\n      之同居人、受僱人或應送達處所之接收郵件人員，行政程\n      序法第72條第1項、第73條第1項分別定有明文。末按所謂\n      同居人，係指與應受送達人居住一處共同為生活者而言。\n      關於是否同居之認定，應以是否有居住一處並共同為生活\n      之事實為準，若由非與當事人同戶共居之親族成員所代收\n      ，又非其他法定應受送達之人時，不能視為送達於本人，\n      依法尚難認已由當事人之同居人合法代收送達，其送達之\n      效力應以代收後，實際轉交於當事人之時間為準，最高法\n      院31年上字第738號判例意旨足資參照。\n（二）抗告人即受處分人就原處分機關98年 7月23日所為之裁決\n      處分（處分案號：嘉監南字第裁74-S00000000號）聲明異\n      議，惟上開裁決書已按抗告人之住所即戶籍址「臺南市○\n      ○區○○里○○街136號」掛號郵寄， 該裁決書雖不獲會\n      晤應受送達人即抗告人， 然已於98年7月24日由其同居人\n      即抗告人之嬸嬸「曾秀碧」收受無訛，此有抗告人之個人\n      基本資料查詢結果及原處分機關送達證書各 1紙附卷可稽\n      ，依前揭說明，其送達程序自無違誤。又道路交通案件處\n      理辦法第12條規定交通案件聲明異議之在途期間，居住於\n      臺灣地區者，當事人居住於處罰機關所在之鄉、鎮、市（\n      包括縣轄市、省轄市及院轄市），不扣除在途期間，法院\n      訴訟當事人在途期間標準第4條第1項第1款亦有明文 ，而\n      抗告人之住所地係在臺南市，與處罰機關所在之臺南市，\n      係同一院轄市，因此無庸扣除在途期間。是自抗告人於98\n      年7月24日合法收受本件裁決書送達之翌日即98年7月25日\n      起算，異議期間已於98年8月13日屆滿 。然抗告人遲至98\n      年8月20日始具狀提出聲明異議，有聲明異議狀上所蓋之\n      臺灣臺南地方法院收狀章戳附卷可憑，是本件抗告人之異\n      議顯已逾越法定聲明異議不變期間，其聲明異議自不合法\n      律上程式，且無從補正，堪可認定。\n（三）抗告人雖以上揭情詞置辯，惟查：抗告人僅泛言「曾秀碧\n      」女士非抗告人之同居人，然未提出任何客觀證據以實其\n      說，尚難憑採；退一步言之，抗告人已在抗告狀內自承於\n      98年7月25日收到本件裁決書，是以縱認曾秀碧非抗告人\n      之同居人乙情屬實，本件異議期間自送達本人之翌日起算\n      ，延至98年8月14日屆滿，則抗告人遲至98年8月20日始提\n      出聲明異議，猶已逾越法定不變期間。至抗告人稱其逾期\n      乃因法律知識不足及監理站人員傳達錯誤云云，然原處分\n      機關業已於本件裁決書附記「受處分人不服處罰者，得於\n      接到裁決書之翌日起20日內，以司法狀紙提出聲明異議」\n      等救濟教示甚明，有上開裁決書在卷可稽，抗告理由仍諉\n      為不知，要無可採。\n三、揆諸上揭說明，抗告人所稱之逾期原因，均無不可歸責於抗\n    告人之事由。原審法院據此駁回抗告人之聲明異議，本院經\n    核並無違誤，抗告意旨仍執陳詞指摘原裁定不當，為無理由\n    ，應予駁回。又異議人主張本件符合一事不二罰等語，此係\n    涉及實體事項，因本件異議已逾期，原審法院及本院均無從\n    進一步為實體審查，附此敘明。\n四、據上論結，應依道路交通案件處理辦法第26條，刑事訴訟法\n    第412條，裁定如主文。\n中    華    民    國    99    年    1     月    4     日\n                  刑事第三庭    審判長法  官    陳義仲\n                                      法  官    宋明中\n                                      法  官    蔡勝雄\n以上正本證明與原本無異。\n不得再抗告。\n                                      書記官    汪姿秀\n中    華    民    國    99    年    1     月    4     日",
  "structure": {
    "main": "抗告駁回。",
    "reason": "一、本件抗告意旨略以：\n（一）抗告人前於民國（下同）95年11月12日酒後駕車之行為，\n      業經臺灣臺南地方法院檢察署檢察官以96年度偵字第184\n      號為緩起訴處分，期間為2年，並命向罕見疾病基金會支\n      付新臺幣（下同）90,000元，抗告人已依限繳清，則依行\n      政罰法第26條所揭示之一行為不二罰原則，交通部公路總\n      局嘉義區監理所臺南監理站（下稱原處分機關）就抗告人\n      同一行為所為之49,500元罰鍰處分應予撤銷。\n（二）原處分機關98年7月23日嘉監南字第裁74-S00000000號裁\n      決書於98年7月24日送達抗告人即受處分人之戶籍地，並\n      由「曾秀碧」簽收，但曾秀碧為抗告人之大叔叔的前妻，\n      與抗告人之大叔叔已離婚6年以上，未居住該處所亦達5年\n      以上，「曾秀碧」女士確非抗告人之同居人。抗告人於98\n      年7月25日輾轉收到上開裁決書後，旋於同年7月27日前往\n      地檢署申請緩起訴處分書，並於同年8月10日收到該緩起\n      訴處分書後，透過電話與監理站人員聯繫，惟因抗告人之\n      法律知識不足及監理站人員傳達錯誤，使抗告人誤以為僅\n      須依裁決書所示之罰緩繳納期限即98年8月22日以前，至\n      監理站銷案即可，因而導致逾期提出異議。爰為此聲明異\n      議，請求撤銷原裁定云云。\n二、經查：\n（一）按受處分人 ，不服道路交通管理處罰條例第8條主管機關\n      所為之處罰，得於接到裁決書之翌日起20日內，向管轄地\n      方法院聲明異議；又依上開規定聲明異議之期間，自裁決\n      送達之翌日起算，並得依法扣除在途期間；另交通法庭認\n      聲明異議不合法律上之程式或其異議權已經喪失者，應以\n      裁定駁回之 ，道路交通管理處罰條例第87條第1項、道路\n      交通案件處理辦法第12條、第18條前段分別定有明文。又\n      按處理違反道路交通管理事件，有關文書送達之程序，依\n      行政程序法之規定，違反道路交通管理事件統一裁罰基準\n      及處理細則第5條定有明文 。再按送達，於應受送達人之\n      住居所、事務所或營業所為之。但在行政機關辦公處所或\n      他處會晤應受送達人時，得於會晤處所為之；於應送達處\n      所不獲會晤應受送達人時，得將文書付與有辨別事理能力\n      之同居人、受僱人或應送達處所之接收郵件人員，行政程\n      序法第72條第1項、第73條第1項分別定有明文。末按所謂\n      同居人，係指與應受送達人居住一處共同為生活者而言。\n      關於是否同居之認定，應以是否有居住一處並共同為生活\n      之事實為準，若由非與當事人同戶共居之親族成員所代收\n      ，又非其他法定應受送達之人時，不能視為送達於本人，\n      依法尚難認已由當事人之同居人合法代收送達，其送達之\n      效力應以代收後，實際轉交於當事人之時間為準，最高法\n      院31年上字第738號判例意旨足資參照。\n（二）抗告人即受處分人就原處分機關98年 7月23日所為之裁決\n      處分（處分案號：嘉監南字第裁74-S00000000號）聲明異\n      議，惟上開裁決書已按抗告人之住所即戶籍址「臺南市○\n      ○區○○里○○街136號」掛號郵寄， 該裁決書雖不獲會\n      晤應受送達人即抗告人， 然已於98年7月24日由其同居人\n      即抗告人之嬸嬸「曾秀碧」收受無訛，此有抗告人之個人\n      基本資料查詢結果及原處分機關送達證書各 1紙附卷可稽\n      ，依前揭說明，其送達程序自無違誤。又道路交通案件處\n      理辦法第12條規定交通案件聲明異議之在途期間，居住於\n      臺灣地區者，當事人居住於處罰機關所在之鄉、鎮、市（\n      包括縣轄市、省轄市及院轄市），不扣除在途期間，法院\n      訴訟當事人在途期間標準第4條第1項第1款亦有明文 ，而\n      抗告人之住所地係在臺南市，與處罰機關所在之臺南市，\n      係同一院轄市，因此無庸扣除在途期間。是自抗告人於98\n      年7月24日合法收受本件裁決書送達之翌日即98年7月25日\n      起算，異議期間已於98年8月13日屆滿 。然抗告人遲至98\n      年8月20日始具狀提出聲明異議，有聲明異議狀上所蓋之\n      臺灣臺南地方法院收狀章戳附卷可憑，是本件抗告人之異\n      議顯已逾越法定聲明異議不變期間，其聲明異議自不合法\n      律上程式，且無從補正，堪可認定。\n（三）抗告人雖以上揭情詞置辯，惟查：抗告人僅泛言「曾秀碧\n      」女士非抗告人之同居人，然未提出任何客觀證據以實其\n      說，尚難憑採；退一步言之，抗告人已在抗告狀內自承於\n      98年7月25日收到本件裁決書，是以縱認曾秀碧非抗告人\n      之同居人乙情屬實，本件異議期間自送達本人之翌日起算\n      ，延至98年8月14日屆滿，則抗告人遲至98年8月20日始提\n      出聲明異議，猶已逾越法定不變期間。至抗告人稱其逾期\n      乃因法律知識不足及監理站人員傳達錯誤云云，然原處分\n      機關業已於本件裁決書附記「受處分人不服處罰者，得於\n      接到裁決書之翌日起20日內，以司法狀紙提出聲明異議」\n      等救濟教示甚明，有上開裁決書在卷可稽，抗告理由仍諉\n      為不知，要無可採。\n三、揆諸上揭說明，抗告人所稱之逾期原因，均無不可歸責於抗\n    告人之事由。原審法院據此駁回抗告人之聲明異議，本院經\n    核並無違誤，抗告意旨仍執陳詞指摘原裁定不當，為無理由\n    ，應予駁回。又異議人主張本件符合一事不二罰等語，此係\n    涉及實體事項，因本件異議已逾期，原審法院及本院均無從\n    進一步為實體審查，附此敘明。\n四、據上論結，應依道路交通案件處理辦法第26條，刑事訴訟法\n    第412條，裁定如主文。"
  },
  "characters": {
    "judges": [
      "陳義仲",
      "宋明中",
      "蔡勝雄"
    ],
    "prosecutors": [

    ],
    "lawyers": [

    ],
    "clerks": [
      "汪姿秀"
    ],
    "plaintiffs": [

    ],
    "defendants": [

    ],
    "prosecutor_office": [

    ],
    "creditors": [

    ],
    "debtors": [

    ],
    "judicial_associate_officer": [

    ]
  },
  "adjudged_at": "2010-01-04",
  "created_at": "2016-01-05 14:37:10",
  "updated_at": "2016-01-05 14:37:10"
}