{
  "identify": "TNH-98-抗-397-20100104-1",
  "court": {
    "name": "臺灣高等法院",
    "code": "TNH"
  },
  "division": {
    "name": "刑事",
    "code": "M"
  },
  "year": 98,
  "word": "抗",
  "number": "397",
  "jcheck": "1",
  "reason": "聲請撤銷緩刑",
  "content": "臺灣高等法院臺南分院刑事裁定          98年度抗字第397號\n抗  告  人\n即受 刑 人  甲○○\n上列抗告人因聲請撤銷緩刑案件，不服臺灣嘉義地方法院中華民\n國98年10月30日裁定（98年度撤緩字第69號），提起抗告，本院\n裁定如下：\n    主  文\n抗告駁回。\n    理  由\n一、本件抗告意旨略以：抗告人即受刑人甲○○前因對於其子楊\n    仲凱施以身體上不法侵害之家庭暴力，經臺灣嘉義地方法院\n    97年度嘉簡字第374號判決處以拘役120日及緩刑2年；抗告\n    人雖又於緩刑期內，因對於同居人楊秀秀施以精神上不法侵\n    害之家庭暴力，再次違反保護令，經臺灣嘉義地方法院98年\n    度嘉簡字第1043號判決處以拘役20日，但前後二次違反保護\n    令之對象不同，且抗告人平日甚為疼愛子女，爰不服原法院\n    撤銷緩刑之裁定，依法提出抗告云云。\n二、按受緩刑之宣告而有於緩刑前因故意犯他罪，而在緩刑期內\n    受得易科罰金之有期徒刑、拘役或罰金之宣告確定之情形，\n    足認原宣告之緩刑難收其預期效果，而有執行刑罰之必要者\n    ，得撤銷其宣告，刑法第75條之 1第1項第1款定有明文。本\n    條採用裁量撤銷主義，賦予法院撤銷與否之權限，特於第 1\n    項規定實質要件為「足認原宣告之緩刑難收其預期效果，而\n    有執行刑罰之必要」，供作審認之標準。亦即於上揭「得」\n    撤銷緩刑之情形，法官應依職權本於合目的性之裁量，妥適\n    審酌被告所犯前後數罪間，關於法益侵害之性質、再犯之原\n    因、違反法規範之情節是否重大、被告主觀犯意所顯現之惡\n    性及其反社會性等情，是否已使前案原為促使惡性輕微之被\n    告或偶發犯、初犯改過自新而宣告之緩刑，已難收其預期之\n    效果，而確有執行刑罰之必要。\n三、經查：抗告人即受刑人甲○○因違反保護令等案件，前經臺\n    灣嘉義地方法院以97年度嘉簡字第374號判決判處應執行拘\n    役120日，如易科罰金，以新臺幣（下同）1,000元折算1日\n    ，緩刑2年，緩刑期間付保護管束，於民國（下同）97年4月\n    28日確定；又於緩刑期間之98年7月19日，因違反保護令案\n    件，經臺灣嘉義地方法院以98年度嘉簡字第1043號判決判處\n    拘役20日，如易科罰金，以1,000元折算1日，於98年9月14\n    日確定等情，有上開判決正本2份及臺灣高等法院被告前案\n    紀錄表1份在卷可考，足認受刑人於緩刑期間因故意犯他罪\n    ，而在緩刑期內受6月以下之拘役宣告確定。抗告人前開於\n    緩刑期內再受刑之宣告之違反保護令案件，與前案犯罪類型\n    相同，被害人為同一人，侵害同一法益，是受刑人明知其在\n    前案緩刑期內，更應謹言慎行，且其在保護管束期間，定期\n    向觀護人報到接受輔導，理應培養正確之法律觀念，卻僅因\n    細故再次故意違反保護令為後案之犯行，其顯然未反省改過\n    悛悔，其主觀上顯現相當惡性及反社會性，足認原宣告之緩\n    刑難收其預期效果，而有執行刑罰之必要，原裁定法院認為\n    確有執行刑罰之必要，從而本件應認與刑法第75條之1第1項\n    第1款之規定相符，應撤銷受刑人緩刑之宣告。抗告人即受\n    刑人雖以前後二次違反保護令之對象不同置辯，惟抗告人前\n    次違反保護令，除對於其子楊仲凱施以身體上之不法侵害外\n    ，亦對於楊秀秀施以身體上及精神上之不法侵害，有臺灣嘉\n    義地方法院97年度嘉簡字第374號判決在卷可稽（見原審卷\n    第3至6頁），嗣後抗告人又因對於楊秀秀施以精神上之不法\n    侵害而再次違反保護令，其前後二次違反保護令之被害人均\n    包含楊秀秀，抗告人之所辯，要無可採。至抗告人另稱其平\n    日甚為疼愛子女，縱認屬實，亦非抗告人得逕自違反保護令\n    之正當理由，自不足為有利於抗告人處置之依據，抗告人之\n    抗告為無理由。\n四、綜上所述，原審法院依檢察官之聲請而撤銷抗告人緩刑之宣\n    告，於法自屬有據，本院經核其認事用法，於法尚無不合。\n    抗告人以上開各情為由，指摘原裁定不當，為無理由，應予\n    駁回。\n五、據上論結，應依刑事訴訟法第412條，裁定如主文。\n中    華    民    國    99    年    1     月    4     日\n                  刑事第三庭    審判長法  官    陳義仲\n                                      法  官    宋明中\n                                      法  官    蔡勝雄\n以上正本證明與原本無異。\n不得再抗告。\n                                      書記官    汪姿秀\n中    華    民    國    99    年    1     月    4     日",
  "structure": {
    "main": "抗告駁回。",
    "reason": "一、本件抗告意旨略以：抗告人即受刑人甲○○前因對於其子楊\n    仲凱施以身體上不法侵害之家庭暴力，經臺灣嘉義地方法院\n    97年度嘉簡字第374號判決處以拘役120日及緩刑2年；抗告\n    人雖又於緩刑期內，因對於同居人楊秀秀施以精神上不法侵\n    害之家庭暴力，再次違反保護令，經臺灣嘉義地方法院98年\n    度嘉簡字第1043號判決處以拘役20日，但前後二次違反保護\n    令之對象不同，且抗告人平日甚為疼愛子女，爰不服原法院\n    撤銷緩刑之裁定，依法提出抗告云云。\n二、按受緩刑之宣告而有於緩刑前因故意犯他罪，而在緩刑期內\n    受得易科罰金之有期徒刑、拘役或罰金之宣告確定之情形，\n    足認原宣告之緩刑難收其預期效果，而有執行刑罰之必要者\n    ，得撤銷其宣告，刑法第75條之 1第1項第1款定有明文。本\n    條採用裁量撤銷主義，賦予法院撤銷與否之權限，特於第 1\n    項規定實質要件為「足認原宣告之緩刑難收其預期效果，而\n    有執行刑罰之必要」，供作審認之標準。亦即於上揭「得」\n    撤銷緩刑之情形，法官應依職權本於合目的性之裁量，妥適\n    審酌被告所犯前後數罪間，關於法益侵害之性質、再犯之原\n    因、違反法規範之情節是否重大、被告主觀犯意所顯現之惡\n    性及其反社會性等情，是否已使前案原為促使惡性輕微之被\n    告或偶發犯、初犯改過自新而宣告之緩刑，已難收其預期之\n    效果，而確有執行刑罰之必要。\n三、經查：抗告人即受刑人甲○○因違反保護令等案件，前經臺\n    灣嘉義地方法院以97年度嘉簡字第374號判決判處應執行拘\n    役120日，如易科罰金，以新臺幣（下同）1,000元折算1日\n    ，緩刑2年，緩刑期間付保護管束，於民國（下同）97年4月\n    28日確定；又於緩刑期間之98年7月19日，因違反保護令案\n    件，經臺灣嘉義地方法院以98年度嘉簡字第1043號判決判處\n    拘役20日，如易科罰金，以1,000元折算1日，於98年9月14\n    日確定等情，有上開判決正本2份及臺灣高等法院被告前案\n    紀錄表1份在卷可考，足認受刑人於緩刑期間因故意犯他罪\n    ，而在緩刑期內受6月以下之拘役宣告確定。抗告人前開於\n    緩刑期內再受刑之宣告之違反保護令案件，與前案犯罪類型\n    相同，被害人為同一人，侵害同一法益，是受刑人明知其在\n    前案緩刑期內，更應謹言慎行，且其在保護管束期間，定期\n    向觀護人報到接受輔導，理應培養正確之法律觀念，卻僅因\n    細故再次故意違反保護令為後案之犯行，其顯然未反省改過\n    悛悔，其主觀上顯現相當惡性及反社會性，足認原宣告之緩\n    刑難收其預期效果，而有執行刑罰之必要，原裁定法院認為\n    確有執行刑罰之必要，從而本件應認與刑法第75條之1第1項\n    第1款之規定相符，應撤銷受刑人緩刑之宣告。抗告人即受\n    刑人雖以前後二次違反保護令之對象不同置辯，惟抗告人前\n    次違反保護令，除對於其子楊仲凱施以身體上之不法侵害外\n    ，亦對於楊秀秀施以身體上及精神上之不法侵害，有臺灣嘉\n    義地方法院97年度嘉簡字第374號判決在卷可稽（見原審卷\n    第3至6頁），嗣後抗告人又因對於楊秀秀施以精神上之不法\n    侵害而再次違反保護令，其前後二次違反保護令之被害人均\n    包含楊秀秀，抗告人之所辯，要無可採。至抗告人另稱其平\n    日甚為疼愛子女，縱認屬實，亦非抗告人得逕自違反保護令\n    之正當理由，自不足為有利於抗告人處置之依據，抗告人之\n    抗告為無理由。\n四、綜上所述，原審法院依檢察官之聲請而撤銷抗告人緩刑之宣\n    告，於法自屬有據，本院經核其認事用法，於法尚無不合。\n    抗告人以上開各情為由，指摘原裁定不當，為無理由，應予\n    駁回。\n五、據上論結，應依刑事訴訟法第412條，裁定如主文。"
  },
  "characters": {
    "judges": [
      "陳義仲",
      "宋明中",
      "蔡勝雄"
    ],
    "prosecutors": [

    ],
    "lawyers": [

    ],
    "clerks": [
      "汪姿秀"
    ],
    "plaintiffs": [

    ],
    "defendants": [

    ],
    "prosecutor_office": [

    ],
    "creditors": [

    ],
    "debtors": [

    ],
    "judicial_associate_officer": [

    ]
  },
  "adjudged_at": "2010-01-04",
  "created_at": "2016-01-05 14:37:22",
  "updated_at": "2016-01-05 14:37:22"
}