{
  "identify": "TNH-98-上重更(一)-300-20100512-3",
  "court": {
    "name": "臺灣高等法院",
    "code": "TNH"
  },
  "division": {
    "name": "刑事",
    "code": "M"
  },
  "year": 98,
  "word": "上重更(一)",
  "number": "300",
  "jcheck": "3",
  "reason": "毒品危害防制條例",
  "content": "臺灣高等法院臺南分院刑事裁定   98年度上重更(一)字第300號\n證      人  王駿森\n上列證人因被告違反毒品危害防制條例案件，本院裁定如下：\n    主  文\n王駿森證人經合法傳喚，無正當理由而不到場，科罰鍰新臺幣伍\n仟元。\n    理  由\n一、按證人經合法傳喚，無正當理由而不到場者，得科以新臺幣\n    三萬元以下之罰鍰，並得拘提之；再傳不到者，亦同。前項\n    科罰鍰之處分，由法院裁定之。刑事訴訟法第一百七十八條\n    第一項、第二項分別定有明文。\n二、查證人王駿森籍設高雄市○○區○○里○○街60號，有全戶\n    戶籍資料查詢結果一紙在卷可稽，其因本院98年度上重更(一)\n    字第300號被告林品宏涉嫌販賣第一級毒品案件，經被告之\n    選任辯護人聲請傳喚應於99年4月22日上午10時10分到庭接\n    受詰問，證人之傳票已於同月7日合法送達於證人王駿森之\n    上開戶籍地址，由其親自收受，有送達證書一紙在卷可參。\n    茲證人王駿森無正當理由而不到庭，亦有本院刑事報到單影\n    本一紙在卷可憑。茲本院審酌本件證人王駿森僅經合法傳喚\n    一次不到場，爰裁定如主文所示。\n三、依刑事訴訟法第一百七十八條第一項、第二項，裁定如主文\n    。\n中    華    民    國    99    年    5     月    12    日\n                  刑事第七庭  審判長法  官  李文福\n                                    法  官  顏基典\n                                    法  官  陳顯榮\n以上正本證明與原本無異。\n如不服本裁定，應於收受本裁定後五日內向本院提出抗告狀。\n                                    書記官  劉岳文\n中    華    民    國    99    年    5     月    12    日",
  "structure": {
    "main": "王駿森證人經合法傳喚，無正當理由而不到場，科罰鍰新臺幣伍\n仟元。",
    "reason": "一、按證人經合法傳喚，無正當理由而不到場者，得科以新臺幣\n    三萬元以下之罰鍰，並得拘提之；再傳不到者，亦同。前項\n    科罰鍰之處分，由法院裁定之。刑事訴訟法第一百七十八條\n    第一項、第二項分別定有明文。\n二、查證人王駿森籍設高雄市○○區○○里○○街60號，有全戶\n    戶籍資料查詢結果一紙在卷可稽，其因本院98年度上重更(一)\n    字第300號被告林品宏涉嫌販賣第一級毒品案件，經被告之\n    選任辯護人聲請傳喚應於99年4月22日上午10時10分到庭接\n    受詰問，證人之傳票已於同月7日合法送達於證人王駿森之\n    上開戶籍地址，由其親自收受，有送達證書一紙在卷可參。\n    茲證人王駿森無正當理由而不到庭，亦有本院刑事報到單影\n    本一紙在卷可憑。茲本院審酌本件證人王駿森僅經合法傳喚\n    一次不到場，爰裁定如主文所示。\n三、依刑事訴訟法第一百七十八條第一項、第二項，裁定如主文\n    。"
  },
  "characters": {
    "judges": [
      "李文福",
      "顏基典",
      "陳顯榮"
    ],
    "prosecutors": [

    ],
    "lawyers": [

    ],
    "clerks": [
      "劉岳文"
    ],
    "plaintiffs": [

    ],
    "defendants": [

    ],
    "prosecutor_office": [

    ],
    "creditors": [

    ],
    "debtors": [

    ],
    "judicial_associate_officer": [

    ]
  },
  "adjudged_at": "2010-05-12",
  "created_at": "2016-01-05 12:01:03",
  "updated_at": "2016-01-05 12:01:03"
}