{
  "identify": "TPB-98-訴更一-139-20100512-2",
  "court": {
    "name": "臺北高等行政法院",
    "code": "TPB"
  },
  "division": {
    "name": "行政",
    "code": "A"
  },
  "year": 98,
  "word": "訴更一",
  "number": "139",
  "jcheck": "2",
  "reason": "免職",
  "content": "臺北高等行政法院裁定\n                                   98年度訴更一字第139號\n上  訴  人  甲○○\n上列上訴人因與被上訴人法務部間免職事件，對於民國99年3 月\n31日本院97年度訴更一字第00139 號判決提起上訴。查本件上訴\n，依行政訴訟法第98條之2 第1 項「上訴，依第98條第2 項規定\n，加徵裁判費二分之一」、第98條第2 項前段「起訴，按件徵收\n裁判費新臺幣四千元」之規定（該規定於96年6 月5 日立法院三\n讀通過，96年7 月4 日總統公佈，並於96年8 月15日起施行）上\n訴人應繳納上訴費用6,000 元。雖發回更審再行上訴免徵裁判費\n（參照同法第98條之2 第2 項前段），但本案係修正行政訴訟法\n施行前已繫屬之事件，起訴當時免徵裁判費，經最高行政法院發\n回更審，於更審程序不補徵第一審裁判費，惟對更審判決不服，\n於施行後復提起上訴，則應依修正後規定徵收上訴裁判費。故上\n訴人應繳納上訴費用6,000 元，未據上訴人繳納，茲限上訴人於\n收受本裁定送達後5 日以內補繳，逾期不繳，即駁回上訴，特此\n裁定。\n中    華    民    國    99    年     5    月    12    日\n                    臺北高等行政法院第一庭\n                              審判長法  官  王立杰\n                                    法  官  許麗華\n                                    法  官  楊得君\n上為正本係照原本作成。\n不得抗告。\n中    華    民    國    99    年     5    月    12    日\n                                    書記官  徐子嵐\n",
  "structure": {
  },
  "characters": {
    "judges": [
      "王立杰",
      "許麗華",
      "楊得君"
    ],
    "prosecutors": [

    ],
    "lawyers": [

    ],
    "clerks": [
      "徐子嵐"
    ],
    "plaintiffs": [

    ],
    "defendants": [

    ],
    "prosecutor_office": [

    ],
    "creditors": [

    ],
    "debtors": [

    ],
    "judicial_associate_officer": [

    ]
  },
  "adjudged_at": "2010-05-12",
  "created_at": "2016-01-05 11:56:41",
  "updated_at": "2016-01-05 11:56:41"
}