{
  "identify": "TPB-99-救-47-20100512-1",
  "court": {
    "name": "臺北高等行政法院",
    "code": "TPB"
  },
  "division": {
    "name": "行政",
    "code": "A"
  },
  "year": 99,
  "word": "救",
  "number": "47",
  "jcheck": "1",
  "reason": "訴訟救助",
  "content": "臺北高等行政法院裁定\n                                        99年度救字第47號\n聲  請  人  甲○○\n相  對  人  法務部\n代  表  人  乙○○（部長）\n相  對  人  最高法院檢察署\n代  表  人  丙○○（檢察總長）\n上列聲請人因與法務部、最高法院檢察署間其他請求（本院99年\n度再字第71號）事件，聲請訴訟救助，本院裁定如下：\n    主  文\n聲請駁回。\n聲請程序費用由聲請人負擔。\n    理  由\n一、按當事人無資力支出訴訟費用者，依行政訴訟法第101條規\n    定，行政法院固應依聲請准予救助，惟此項救助之事由，依\n    同法第102條第2項及第3項規定，應提出能即時調查之證據\n    以釋明之；或由受訴行政法院管轄區域內有資力之人提出保\n    證書代之。\n二、本件聲請人聲請訴訟救助，僅記載「引用最高法院91台聲\n    108 號、台高院96聲321 號之裁定卷宗」，並未據提出能即\n    時調查之證據，以釋明其無資力支出訴訟費用之主張為真實\n    ，亦未據提出保證書以代之，其聲請即屬無從准許。\n三、依行政訴訟法第104條、民事訴訟法第95條、第78條，裁定\n    如主文。\n中    華    民    國    99    年     5    月   12     日\n                    臺北高等行政法院第七庭\n                              審判長法  官  吳慧娟\n                                    法  官  林惠瑜\n                                    法  官  畢乃俊\n上為正本係照原本作成。\n如不服本裁定，應於送達後10日內向本院提出抗告狀（須按他造\n人數附繕本）。\n中    華    民    國    99    年     5    月    12    日\n                                    書記官  簡信滇\n",
  "structure": {
    "main": "聲請駁回。\n聲請程序費用由聲請人負擔。",
    "reason": "一、按當事人無資力支出訴訟費用者，依行政訴訟法第101條規\n    定，行政法院固應依聲請准予救助，惟此項救助之事由，依\n    同法第102條第2項及第3項規定，應提出能即時調查之證據\n    以釋明之；或由受訴行政法院管轄區域內有資力之人提出保\n    證書代之。\n二、本件聲請人聲請訴訟救助，僅記載「引用最高法院91台聲\n    108 號、台高院96聲321 號之裁定卷宗」，並未據提出能即\n    時調查之證據，以釋明其無資力支出訴訟費用之主張為真實\n    ，亦未據提出保證書以代之，其聲請即屬無從准許。\n三、依行政訴訟法第104條、民事訴訟法第95條、第78條，裁定\n    如主文。"
  },
  "characters": {
    "judges": [
      "吳慧娟",
      "林惠瑜",
      "畢乃俊"
    ],
    "prosecutors": [

    ],
    "lawyers": [

    ],
    "clerks": [
      "簡信滇"
    ],
    "plaintiffs": [

    ],
    "defendants": [

    ],
    "prosecutor_office": [
      "甲"
    ],
    "creditors": [

    ],
    "debtors": [

    ],
    "judicial_associate_officer": [

    ]
  },
  "adjudged_at": "2010-05-12",
  "created_at": "2016-01-05 11:57:11",
  "updated_at": "2016-01-05 11:57:11"
}