{
  "identify": "TPB-99-訴-744-20100512-1",
  "court": {
    "name": "臺北高等行政法院",
    "code": "TPB"
  },
  "division": {
    "name": "行政",
    "code": "A"
  },
  "year": 99,
  "word": "訴",
  "number": "744",
  "jcheck": "1",
  "reason": "有關衛生事務",
  "content": "臺北高等行政法院裁定\n                                       99年度訴字第744號\n原      告  甲○○\n上列原告因有關衛生事務事件，提起行政訴訟，本院裁定如下：\n    主  文\n原告之訴駁回。\n訴訟費用由原告負擔。\n    理  由\n一、按醫院出具之診斷書，係依醫師診斷病人之結果記載其病情\n    之證明，為文書之一種。此種文書雖有真偽之分，惟其內容\n    乃本於專業知識之判斷，非行使公權力之措置，且係診斷事\n    實行為之記述，不對外發生何法律上效果，並非行政處分。\n    又其內容記述事實，不足以表彰任何權益關係，為事實關係\n    ，非法律關係。是以診斷書無論其形式或內容，均不得為行\n    政訴訟法第6 條確認訴訟之標的。若起訴請求確認診斷書為\n    無效，不合確認訴訟之要件，其起訴為不合法，又不能補正\n    ，應依行政訴訟法第107 條第1 項第10款裁定駁回之。\n二、本件原告起訴主張，原告並無精神病，94年間遭原告之姊姊\n    強制帶往臺北市立聯合醫院松德分院就醫，醫師未經診斷即\n    開立編號944946號診斷書給原告之姊姊，提出於台北縣審計\n    室資遣原告。該診斷書未經原告同意而開具，為違法無效，\n    原告依行政訴訟法第6 條規定向臺北市立聯合醫院請求確認\n    無效，逾30日未獲確答，因而起訴請求確認無效等語。經查\n    原告起訴請求確認醫院出具之診斷書為無效，參照前述規定\n    與說明，於法不合，應予駁回。\n三、依行政訴訟法第107條第1項第10款、第104條、民事訴訟法\n    第95條、第78條，裁定如主文。\n中    華    民    國    99    年    5     月    12    日\n             台北高等行政法院第八庭\n                        審判長法  官  蔡進田\n                              法  官  黃清光\n                              法  官  闕銘富\n上為正本係照原本作成。\n如不服本裁定，應於送達後10日內向本院提出抗告狀（須按他造\n人數附繕本）。\n中    華    民    國    99    年    5     月    12    日\n                              書記官  黃倩鈺",
  "structure": {
    "main": "原告之訴駁回。\n訴訟費用由原告負擔。",
    "reason": "一、按醫院出具之診斷書，係依醫師診斷病人之結果記載其病情\n    之證明，為文書之一種。此種文書雖有真偽之分，惟其內容\n    乃本於專業知識之判斷，非行使公權力之措置，且係診斷事\n    實行為之記述，不對外發生何法律上效果，並非行政處分。\n    又其內容記述事實，不足以表彰任何權益關係，為事實關係\n    ，非法律關係。是以診斷書無論其形式或內容，均不得為行\n    政訴訟法第6 條確認訴訟之標的。若起訴請求確認診斷書為\n    無效，不合確認訴訟之要件，其起訴為不合法，又不能補正\n    ，應依行政訴訟法第107 條第1 項第10款裁定駁回之。\n二、本件原告起訴主張，原告並無精神病，94年間遭原告之姊姊\n    強制帶往臺北市立聯合醫院松德分院就醫，醫師未經診斷即\n    開立編號944946號診斷書給原告之姊姊，提出於台北縣審計\n    室資遣原告。該診斷書未經原告同意而開具，為違法無效，\n    原告依行政訴訟法第6 條規定向臺北市立聯合醫院請求確認\n    無效，逾30日未獲確答，因而起訴請求確認無效等語。經查\n    原告起訴請求確認醫院出具之診斷書為無效，參照前述規定\n    與說明，於法不合，應予駁回。\n三、依行政訴訟法第107條第1項第10款、第104條、民事訴訟法\n    第95條、第78條，裁定如主文。"
  },
  "characters": {
    "judges": [
      "蔡進田",
      "黃清光",
      "闕銘富"
    ],
    "prosecutors": [

    ],
    "lawyers": [

    ],
    "clerks": [

    ],
    "plaintiffs": [
      "甲"
    ],
    "defendants": [

    ],
    "prosecutor_office": [

    ],
    "creditors": [

    ],
    "debtors": [

    ],
    "judicial_associate_officer": [

    ]
  },
  "adjudged_at": "2010-05-12",
  "created_at": "2016-01-05 11:57:57",
  "updated_at": "2016-01-05 11:57:57"
}