{
  "identify": "TPD-98-審司聲-3557-20100104-1",
  "court": {
    "name": "臺灣臺北地方法院",
    "code": "TPD"
  },
  "division": {
    "name": "民事",
    "code": "V"
  },
  "year": 98,
  "word": "審司聲",
  "number": "3557",
  "jcheck": "1",
  "reason": "返還提存物",
  "content": "臺灣臺北地方法院民事裁定          98年度審司聲字第3557號\n聲  請  人  財團法人私立親民技術學院\n法定代理人  甲○○\n上列聲請人與相對人群益食品股份有限公司間聲請返還提存物事\n件，本院裁定如下：\n    主  文\n聲請駁回。\n    理  由\n一、本件聲請人聲請返還本院96年度存字第5190號擔保提存事件\n    內之提存物。其陳述略稱：聲請人與相對人間因假處分事件\n    ，前遵本院96年度裁全字第10927號民事裁定提存上開提存\n    物而聲請對相對人為假處分在案。茲因聲請人已撤銷假處分\n    裁定及撤回假處分執行在案，並聲請本院以98年度審聲字第\n    239號函通知相對人行使權利並向本院提出行使權利之證明\n    ，該通知已合法送達相對人，惟相對人迄今仍未行使權利並\n    向本院提出已行使權利之證明，為此請求返還提存物等語。\n    並提出提存書、執行處撤銷執行命令通知、執行處執行命令\n    函、假處分裁定、撤銷假處分裁定暨確定證明書、行使權利\n    通知函等影本為證。\n二、按返還擔保金，依民事訴訟法第106條準用同法第104條之規\n    定，須符合：(一)應供擔保之原因消滅者；(二)供擔保人證明受\n    擔保利益人同意返還者；(三)訴訟終結後，供擔保人證明已定\n    20日以上之期間，催告受擔保利益人行使權利而未行使，或\n    法院依供擔保人之聲請，通知受擔保利益人於一定期間內行\n    使權利並向法院為行使權利之證明而未證明者之要件，法院\n    始得裁定返還擔保金。而所謂「訴訟終結」，在因假扣押所\n    供擔保之情形，因該擔保係為保障受擔保利益人因不當假扣\n    押所受損害而設，倘執行法院已實施假扣押之執行，則在供\n    擔保人撤回假扣押之執行前，受擔保利益人所受損害仍可能\n    繼續發生，損害額既未確定，自無強令其行使權利之理。故\n    在假扣押所供之擔保，供擔保人依民事訴訟法第106條準用\n    同法第104條第1項第3款規定，聲請以裁定命返還其擔保金\n    之場合，必待供擔保人已撤回假扣押之執行，始得謂與民事\n    訴訟法第104條第1項第3款所定之訴訟終結相當。又依此規\n    定聲請返還提存物或保證書者，係以供擔保人於訴訟終結後\n    ，已定20日以上之期間，催告受擔保利益人行使權利，以及\n    受擔保利益人受催告後，未於催告所定期間內行使權利為要\n    件。訴訟終結後定20日以上期間之催告，既屬法定要件之一\n    ，則催告必須在訴訟終結之後，否則不生催告之效力。不能\n    謂訴訟終結前之催告，自屬合法（最高法院86年度台抗字第\n    53號、87年度台抗字第234號、第454號裁定意旨參照）。\n三、經查，本件聲請人主張已於訴訟終結後定20日以上之期間催\n    告相對人行使權利而其未行使，惟執行法院係於民國98年7\n    月2日撤銷執行命令，而聲請人於98年2月即聲請本院通知相\n    對人行使權利，有聲請人提出之執行處通知影本、行使權利\n    通知函影本在卷可稽，是聲請人所為之催告，乃訴訟終結前\n    之催告，揆諸上開說明，自不生催告之效力，而不符合供擔\n    保人於訴訟終結後，法院依供擔保人之聲請，通知受擔保利\n    益人於一定期間內行使權利並向法院為行使權利之證明而未\n    證明者之要件，聲請人聲請返還提存物，於法尚有未合，不\n    應准許。\n四、如不服本裁定，應於裁定送達後10日內，以書狀向司法事務\n    官提出異議。\n中    華    民    國    99    年    1     月    4     日\n                  民事第六庭    司法事務官  侯美滿",
  "structure": {
    "main": "聲請駁回。",
    "reason": "一、本件聲請人聲請返還本院96年度存字第5190號擔保提存事件\n    內之提存物。其陳述略稱：聲請人與相對人間因假處分事件\n    ，前遵本院96年度裁全字第10927號民事裁定提存上開提存\n    物而聲請對相對人為假處分在案。茲因聲請人已撤銷假處分\n    裁定及撤回假處分執行在案，並聲請本院以98年度審聲字第\n    239號函通知相對人行使權利並向本院提出行使權利之證明\n    ，該通知已合法送達相對人，惟相對人迄今仍未行使權利並\n    向本院提出已行使權利之證明，為此請求返還提存物等語。\n    並提出提存書、執行處撤銷執行命令通知、執行處執行命令\n    函、假處分裁定、撤銷假處分裁定暨確定證明書、行使權利\n    通知函等影本為證。\n二、按返還擔保金，依民事訴訟法第106條準用同法第104條之規\n    定，須符合：(一)應供擔保之原因消滅者；(二)供擔保人證明受\n    擔保利益人同意返還者；(三)訴訟終結後，供擔保人證明已定\n    20日以上之期間，催告受擔保利益人行使權利而未行使，或\n    法院依供擔保人之聲請，通知受擔保利益人於一定期間內行\n    使權利並向法院為行使權利之證明而未證明者之要件，法院\n    始得裁定返還擔保金。而所謂「訴訟終結」，在因假扣押所\n    供擔保之情形，因該擔保係為保障受擔保利益人因不當假扣\n    押所受損害而設，倘執行法院已實施假扣押之執行，則在供\n    擔保人撤回假扣押之執行前，受擔保利益人所受損害仍可能\n    繼續發生，損害額既未確定，自無強令其行使權利之理。故\n    在假扣押所供之擔保，供擔保人依民事訴訟法第106條準用\n    同法第104條第1項第3款規定，聲請以裁定命返還其擔保金\n    之場合，必待供擔保人已撤回假扣押之執行，始得謂與民事\n    訴訟法第104條第1項第3款所定之訴訟終結相當。又依此規\n    定聲請返還提存物或保證書者，係以供擔保人於訴訟終結後\n    ，已定20日以上之期間，催告受擔保利益人行使權利，以及\n    受擔保利益人受催告後，未於催告所定期間內行使權利為要\n    件。訴訟終結後定20日以上期間之催告，既屬法定要件之一\n    ，則催告必須在訴訟終結之後，否則不生催告之效力。不能\n    謂訴訟終結前之催告，自屬合法（最高法院86年度台抗字第\n    53號、87年度台抗字第234號、第454號裁定意旨參照）。\n三、經查，本件聲請人主張已於訴訟終結後定20日以上之期間催\n    告相對人行使權利而其未行使，惟執行法院係於民國98年7\n    月2日撤銷執行命令，而聲請人於98年2月即聲請本院通知相\n    對人行使權利，有聲請人提出之執行處通知影本、行使權利\n    通知函影本在卷可稽，是聲請人所為之催告，乃訴訟終結前\n    之催告，揆諸上開說明，自不生催告之效力，而不符合供擔\n    保人於訴訟終結後，法院依供擔保人之聲請，通知受擔保利\n    益人於一定期間內行使權利並向法院為行使權利之證明而未\n    證明者之要件，聲請人聲請返還提存物，於法尚有未合，不\n    應准許。\n四、如不服本裁定，應於裁定送達後10日內，以書狀向司法事務\n    官提出異議。"
  },
  "characters": {
    "judges": [

    ],
    "prosecutors": [

    ],
    "lawyers": [

    ],
    "clerks": [

    ],
    "plaintiffs": [

    ],
    "defendants": [

    ],
    "prosecutor_office": [
      "財團法人私立親民技術學院"
    ],
    "creditors": [

    ],
    "debtors": [

    ],
    "judicial_associate_officer": [
      "侯美滿"
    ]
  },
  "adjudged_at": "2010-01-04",
  "created_at": "2016-01-05 14:48:41",
  "updated_at": "2016-01-05 14:48:41"
}