{
  "identify": "TPD-99-審訴-1545-20100512-1",
  "court": {
    "name": "臺灣臺北地方法院",
    "code": "TPD"
  },
  "division": {
    "name": "民事",
    "code": "V"
  },
  "year": 99,
  "word": "審訴",
  "number": "1545",
  "jcheck": "1",
  "reason": "清償借款",
  "content": "臺灣臺北地方法院民事判決            99年度審訴字第1545號\n    原      告  永豐商業銀行股份有限公司\n    法定代理人  乙○○\n    訴訟代理人  甲○○\n    被      告  丙○○原名黃.\n上列當事人間清償借款事件，經本院於中華民國99年5 月10日言\n詞辯論終結，判決如下：\n    主  文\n被告應給付原告新台幣陸拾陸萬肆仟伍佰拾元，及其中新台\n幣拾柒萬貳仟肆佰貳拾肆元部分，自民國九十九年一月二十七\n日起至清償日止，按年息百分之十九點九七計算之利息。\n訴訟費用新台幣柒仟貳佰柒拾元由被告負擔。\n    事實及理由\n甲、程序方面：\n一、本件依兩造簽訂之信用卡契約條款第24條約定，雙方合意以\n    臺灣臺北地方法院為第一審管轄法院，故本院自有管轄權。\n    又本件被告未於言詞辯論期日到場，核無民事訴訟法第386\n    條所列各款情形，應依原告之聲請，由其一造辯論而為判決\n    。\n二、按因合併而消滅之公司，其權利義務，應由合併後存續或另\n    立之公司承受，公司法第319 條準用同法第75條規定，定有\n    明文。查永豐信用卡股份有限公司原名為華信安泰信用卡股\n    份有限公司，前於民國89年5月1日受華信商業銀行股份有限\n    公司移轉信用卡業務及對於持卡人之債權，嗣於92年1月3日\n    更名為安信信用卡股份有限公司，又於95年11月13日再更名\n    為永豐信用卡股份有限公司，並於95年8月4日受讓台北國際\n    商業銀行股份有限公司移轉信用卡業務及其對信用卡持有人\n    之債權，而永豐信用卡股份有限公司與永豐商業銀行股份有\n    限公司經行政院金融監督管理委員會核准自98 年5月31日起\n    合併，永豐信用卡股份有限公司為消滅公司，永豐商業銀行\n    股份有限公司為存續公司，原永豐信用卡股份有限公司之權\n    利義務關係，由合併後存續之永豐商業銀行股份有限公司概\n    括承受。\n乙、實體方面：\n一、原告起訴主張：被告於92年12月間向原告申請信用卡使用（\n    卡號：0000000000000000），被告依約得於新台幣（下同）\n    36萬元循環信用額度內，持信用卡簽帳消費、參加各項分期\n    付款、預借現金、信用卡代償專案或於特約商店記帳消費，\n    並應於當期繳款截止日前全部清償，或以循環信用方式繳付\n    最低應繳金額，逾期清償者，除喪失期限利益外，應另行給\n    付按年息19.97%計算之利息。詎被告於94年8月10日繳付1,6\n    45元後即未再為清償，債務視為全部到期，尚欠664,533 元\n    （含本金372,424元、利息為284,884元、已到期費用7,225\n    元），屢經催討，未獲置理，為此提起本件訴訟。並聲明：\n    如主文所示。\n二、被告未於言詞辯論期日到場，亦未提出書狀作何聲明或陳述\n    。\n三、本件原告主張之事實，業據其提出信用卡申請書暨契約條款\n    、消費繳款資料查詢及帳務彙整資料查詢等影本為證。又被\n    告已於相當時期受合法通知，而於言詞辯論期日不到場，亦\n    未提出準備書狀爭執，依民事訴訟法第280條第3項前段準用\n    同條第1 項規定，對原告主張之前開事實，視同自認，堪信\n    為真實。從而，原告依信用卡契約之法律關係請求被告給付\n    如主文所示之本金及利息，為有理由，應予准許。\n四、本件訴訟費用額確定為7,270元。\n五、訴訟費用負擔之依據：民事訴訟法第78條。\n中    華    民    國    99    年    5     月    12    日\n                        民事第六庭法官  傅中樂\n以上正本係照原本作成。\n如對本判決上訴，須於判決送達後20日內向本院提出上訴狀。\n中    華    民    國    99    年    5     月    12    日\n                                書記官  王文心",
  "structure": {
    "main": "被告應給付原告新台幣陸拾陸萬肆仟伍佰拾元，及其中新台\n幣拾柒萬貳仟肆佰貳拾肆元部分，自民國九十九年一月二十七\n日起至清償日止，按年息百分之十九點九七計算之利息。\n訴訟費用新台幣柒仟貳佰柒拾元由被告負擔。",
    "fact": "甲、程序方面：\n一、本件依兩造簽訂之信用卡契約條款第24條約定，雙方合意以\n    臺灣臺北地方法院為第一審管轄法院，故本院自有管轄權。\n    又本件被告未於言詞辯論期日到場，核無民事訴訟法第386\n    條所列各款情形，應依原告之聲請，由其一造辯論而為判決\n    。\n二、按因合併而消滅之公司，其權利義務，應由合併後存續或另\n    立之公司承受，公司法第319 條準用同法第75條規定，定有\n    明文。查永豐信用卡股份有限公司原名為華信安泰信用卡股\n    份有限公司，前於民國89年5月1日受華信商業銀行股份有限\n    公司移轉信用卡業務及對於持卡人之債權，嗣於92年1月3日\n    更名為安信信用卡股份有限公司，又於95年11月13日再更名\n    為永豐信用卡股份有限公司，並於95年8月4日受讓台北國際\n    商業銀行股份有限公司移轉信用卡業務及其對信用卡持有人\n    之債權，而永豐信用卡股份有限公司與永豐商業銀行股份有\n    限公司經行政院金融監督管理委員會核准自98 年5月31日起\n    合併，永豐信用卡股份有限公司為消滅公司，永豐商業銀行\n    股份有限公司為存續公司，原永豐信用卡股份有限公司之權\n    利義務關係，由合併後存續之永豐商業銀行股份有限公司概\n    括承受。\n乙、實體方面：\n一、原告起訴主張：被告於92年12月間向原告申請信用卡使用（\n    卡號：0000000000000000），被告依約得於新台幣（下同）\n    36萬元循環信用額度內，持信用卡簽帳消費、參加各項分期\n    付款、預借現金、信用卡代償專案或於特約商店記帳消費，\n    並應於當期繳款截止日前全部清償，或以循環信用方式繳付\n    最低應繳金額，逾期清償者，除喪失期限利益外，應另行給\n    付按年息19.97%計算之利息。詎被告於94年8月10日繳付1,6\n    45元後即未再為清償，債務視為全部到期，尚欠664,533 元\n    （含本金372,424元、利息為284,884元、已到期費用7,225\n    元），屢經催討，未獲置理，為此提起本件訴訟。並聲明：\n    如主文所示。\n二、被告未於言詞辯論期日到場，亦未提出書狀作何聲明或陳述\n    。\n三、本件原告主張之事實，業據其提出信用卡申請書暨契約條款\n    、消費繳款資料查詢及帳務彙整資料查詢等影本為證。又被\n    告已於相當時期受合法通知，而於言詞辯論期日不到場，亦\n    未提出準備書狀爭執，依民事訴訟法第280條第3項前段準用\n    同條第1 項規定，對原告主張之前開事實，視同自認，堪信\n    為真實。從而，原告依信用卡契約之法律關係請求被告給付\n    如主文所示之本金及利息，為有理由，應予准許。\n四、本件訴訟費用額確定為7,270元。\n五、訴訟費用負擔之依據：民事訴訟法第78條。",
    "reason": "甲、程序方面：\n一、本件依兩造簽訂之信用卡契約條款第24條約定，雙方合意以\n    臺灣臺北地方法院為第一審管轄法院，故本院自有管轄權。\n    又本件被告未於言詞辯論期日到場，核無民事訴訟法第386\n    條所列各款情形，應依原告之聲請，由其一造辯論而為判決\n    。\n二、按因合併而消滅之公司，其權利義務，應由合併後存續或另\n    立之公司承受，公司法第319 條準用同法第75條規定，定有\n    明文。查永豐信用卡股份有限公司原名為華信安泰信用卡股\n    份有限公司，前於民國89年5月1日受華信商業銀行股份有限\n    公司移轉信用卡業務及對於持卡人之債權，嗣於92年1月3日\n    更名為安信信用卡股份有限公司，又於95年11月13日再更名\n    為永豐信用卡股份有限公司，並於95年8月4日受讓台北國際\n    商業銀行股份有限公司移轉信用卡業務及其對信用卡持有人\n    之債權，而永豐信用卡股份有限公司與永豐商業銀行股份有\n    限公司經行政院金融監督管理委員會核准自98 年5月31日起\n    合併，永豐信用卡股份有限公司為消滅公司，永豐商業銀行\n    股份有限公司為存續公司，原永豐信用卡股份有限公司之權\n    利義務關係，由合併後存續之永豐商業銀行股份有限公司概\n    括承受。\n乙、實體方面：\n一、原告起訴主張：被告於92年12月間向原告申請信用卡使用（\n    卡號：0000000000000000），被告依約得於新台幣（下同）\n    36萬元循環信用額度內，持信用卡簽帳消費、參加各項分期\n    付款、預借現金、信用卡代償專案或於特約商店記帳消費，\n    並應於當期繳款截止日前全部清償，或以循環信用方式繳付\n    最低應繳金額，逾期清償者，除喪失期限利益外，應另行給\n    付按年息19.97%計算之利息。詎被告於94年8月10日繳付1,6\n    45元後即未再為清償，債務視為全部到期，尚欠664,533 元\n    （含本金372,424元、利息為284,884元、已到期費用7,225\n    元），屢經催討，未獲置理，為此提起本件訴訟。並聲明：\n    如主文所示。\n二、被告未於言詞辯論期日到場，亦未提出書狀作何聲明或陳述\n    。\n三、本件原告主張之事實，業據其提出信用卡申請書暨契約條款\n    、消費繳款資料查詢及帳務彙整資料查詢等影本為證。又被\n    告已於相當時期受合法通知，而於言詞辯論期日不到場，亦\n    未提出準備書狀爭執，依民事訴訟法第280條第3項前段準用\n    同條第1 項規定，對原告主張之前開事實，視同自認，堪信\n    為真實。從而，原告依信用卡契約之法律關係請求被告給付\n    如主文所示之本金及利息，為有理由，應予准許。\n四、本件訴訟費用額確定為7,270元。\n五、訴訟費用負擔之依據：民事訴訟法第78條。"
  },
  "characters": {
    "judges": [

    ],
    "prosecutors": [

    ],
    "lawyers": [

    ],
    "clerks": [

    ],
    "plaintiffs": [
      "永豐商業銀行股份有限公司"
    ],
    "defendants": [
      "丙○○原名黃."
    ],
    "prosecutor_office": [

    ],
    "creditors": [

    ],
    "debtors": [

    ],
    "judicial_associate_officer": [

    ]
  },
  "adjudged_at": "2010-05-12",
  "created_at": "2016-01-05 12:10:35",
  "updated_at": "2016-01-05 12:10:35"
}