{
  "identify": "TPD-98-審司聲-974-20100104-2",
  "court": {
    "name": "臺灣臺北地方法院",
    "code": "TPD"
  },
  "division": {
    "name": "民事",
    "code": "V"
  },
  "year": 98,
  "word": "審司聲",
  "number": "974",
  "jcheck": "2",
  "reason": "確定訴訟費用額",
  "content": "臺灣臺北地方法院民事裁定           98年度審司聲字第974號\n聲  請  人  臺灣銀行股份有限公司\n法定代理人  張秀蓮\n代  理  人  甲○○\n相  對  人  乙○○○\n            丙○○\n上列當事人間確定訴訟費用額事件，本院裁定如下：\n    主  文\n本件應由張秀蓮為聲請人臺灣銀行股份有限公司法定代理人之承\n受訴訟人，續行程序。\n    理  由\n一、按當事人之法定代理人代理權消滅者，訴訟程序在有法定代\n    理人承受其訴訟以前，當然停止；當事人有訴訟代理人者，\n    訴訟程序不因其法定代理權消滅而當然停止，民事訴訟法第\n    170條、第173條定有明文。又第168條至第172條及前條所定\n    之承受訴訟人，於得為承受時，應即為承受之聲明；當事人\n    不聲明承受訴訟時，法院亦得依職權，以裁定命其續行訴訟\n    ，民事訴訟法第175條第1項、第178條亦有明文。\n二、經查，本件聲請人臺灣銀行股份有限公司之法定代理人原為\n    丁○○，嗣於程序中變更為張秀蓮，此有聲請人公司基本資\n    料查詢在卷可稽，茲因聲請人於本件程序中有委任代理人，\n    依前開規定，其程序自不當然停止，惟聲請人之法定代理人\n    既已變更，自應由其承受訴訟，而兩造迄未為承受訴訟之聲\n    明，為此，爰依職權命其續行本件程序。\n三、依民事訴訟法第178條，裁定如主文。\n四、如不服本裁定，應於裁定送達後10日內，以書狀向司法事務\n    官提出異議。\n中    華    民    國    99    年    1     月    4     日\n                  民事第六庭    司法事務官  侯美滿",
  "structure": {
    "main": "本件應由張秀蓮為聲請人臺灣銀行股份有限公司法定代理人之承\n受訴訟人，續行程序。",
    "reason": "一、按當事人之法定代理人代理權消滅者，訴訟程序在有法定代\n    理人承受其訴訟以前，當然停止；當事人有訴訟代理人者，\n    訴訟程序不因其法定代理權消滅而當然停止，民事訴訟法第\n    170條、第173條定有明文。又第168條至第172條及前條所定\n    之承受訴訟人，於得為承受時，應即為承受之聲明；當事人\n    不聲明承受訴訟時，法院亦得依職權，以裁定命其續行訴訟\n    ，民事訴訟法第175條第1項、第178條亦有明文。\n二、經查，本件聲請人臺灣銀行股份有限公司之法定代理人原為\n    丁○○，嗣於程序中變更為張秀蓮，此有聲請人公司基本資\n    料查詢在卷可稽，茲因聲請人於本件程序中有委任代理人，\n    依前開規定，其程序自不當然停止，惟聲請人之法定代理人\n    既已變更，自應由其承受訴訟，而兩造迄未為承受訴訟之聲\n    明，為此，爰依職權命其續行本件程序。\n三、依民事訴訟法第178條，裁定如主文。\n四、如不服本裁定，應於裁定送達後10日內，以書狀向司法事務\n    官提出異議。"
  },
  "characters": {
    "judges": [

    ],
    "prosecutors": [

    ],
    "lawyers": [

    ],
    "clerks": [

    ],
    "plaintiffs": [

    ],
    "defendants": [

    ],
    "prosecutor_office": [
      "臺灣銀行股份有限公司"
    ],
    "creditors": [

    ],
    "debtors": [

    ],
    "judicial_associate_officer": [
      "侯美滿"
    ]
  },
  "adjudged_at": "2010-01-04",
  "created_at": "2016-01-05 14:48:37",
  "updated_at": "2016-01-05 14:48:37"
}