{
  "identify": "TPD-98-簡上-592-20100104-3",
  "court": {
    "name": "臺灣臺北地方法院",
    "code": "TPD"
  },
  "division": {
    "name": "民事",
    "code": "V"
  },
  "year": 98,
  "word": "簡上",
  "number": "592",
  "jcheck": "3",
  "reason": "給付票款",
  "content": "臺灣臺北地方法院民事裁定             98年度簡上字第592號\n抗  告  人  乙○○原名蔡慧美.\n上列抗告人因與甲○○間給付票款事件，對於本院於民國98年10\n月30日本院第二審裁定提起抗告，本院裁定如下：\n    主  文\n抗告駁回。\n抗告程序費用由抗告人負擔。\n    理  由\n按對於簡易訴訟程序之第二審裁判，提起第三審上訴或抗告，須\n經原裁判法院之許可。前項許可，以訴訟事件所及之法律見解具\n有原則上之重要性者為限，民事訴訟法第436條之3第1項、第2項\n定有明文。查本件抗告人在原審提起上訴，經本院臺北簡易庭於\n民國98年9月8日以訴訟標的金額為新臺幣（下同）23,000,000元\n計算，裁定命繳納上訴費用321,600元。惟抗告人並未按期繳納\n，經本院於98年10月30日以未繳納裁判費為由，裁定駁回上訴。\n今抗告人以減縮訴訟標之金額為15,000,000元為由，請求補正裁\n判費，而提起抗告。經查，本件抗告人之上訴，已因逾期未繳納\n裁判費而經本院駁回，抗告人主張減縮訴訟標的之金額，請求另\n行補正裁判費云云，尚難認所涉及之法律見解具有原則上之重要\n性，其抗告自不應許可。據上結論，本件抗告不應許可，依民事\n訴訟法第436條之3第3項、第95條、第78條，裁定如主文。\n中    華    民    國    99    年    1     月    4     日\n                  民事第二庭  審判長法  官  張松鈞\n                                    法  官  黃呈熹\n                                    法  官  郭顏毓\n以上正本係照原本作成\n如對本裁定抗告須於裁定送達後10日內向本院提出抗告狀，並繳\n納抗告費新臺幣1,000元\n中    華    民    國    99    年    1     月    5     日\n                                    書記官  林政彬",
  "structure": {
    "main": "抗告駁回。\n抗告程序費用由抗告人負擔。",
    "reason": "按對於簡易訴訟程序之第二審裁判，提起第三審上訴或抗告，須\n經原裁判法院之許可。前項許可，以訴訟事件所及之法律見解具\n有原則上之重要性者為限，民事訴訟法第436條之3第1項、第2項\n定有明文。查本件抗告人在原審提起上訴，經本院臺北簡易庭於\n民國98年9月8日以訴訟標的金額為新臺幣（下同）23,000,000元\n計算，裁定命繳納上訴費用321,600元。惟抗告人並未按期繳納\n，經本院於98年10月30日以未繳納裁判費為由，裁定駁回上訴。\n今抗告人以減縮訴訟標之金額為15,000,000元為由，請求補正裁\n判費，而提起抗告。經查，本件抗告人之上訴，已因逾期未繳納\n裁判費而經本院駁回，抗告人主張減縮訴訟標的之金額，請求另\n行補正裁判費云云，尚難認所涉及之法律見解具有原則上之重要\n性，其抗告自不應許可。據上結論，本件抗告不應許可，依民事\n訴訟法第436條之3第3項、第95條、第78條，裁定如主文。"
  },
  "characters": {
    "judges": [
      "張松鈞",
      "黃呈熹",
      "郭顏毓"
    ],
    "prosecutors": [

    ],
    "lawyers": [

    ],
    "clerks": [

    ],
    "plaintiffs": [

    ],
    "defendants": [

    ],
    "prosecutor_office": [

    ],
    "creditors": [

    ],
    "debtors": [

    ],
    "judicial_associate_officer": [

    ]
  },
  "adjudged_at": "2010-01-04",
  "created_at": "2016-01-05 14:49:56",
  "updated_at": "2016-01-05 14:49:56"
}