{
  "identify": "TPD-99-審司聲-666-20100512-1",
  "court": {
    "name": "臺灣臺北地方法院",
    "code": "TPD"
  },
  "division": {
    "name": "民事",
    "code": "V"
  },
  "year": 99,
  "word": "審司聲",
  "number": "666",
  "jcheck": "1",
  "reason": "返還提存物",
  "content": "臺灣臺北地方法院民事裁定           99年度審司聲字第666號\n聲  請  人  甲○○\n相  對  人  乙○○\n上列聲請人聲請返還提存物事件，本院裁定如下：\n    主  文\n本院九十八年度存字第一四六七號擔保提存事件聲請人所提存之\n新臺幣伍拾萬元及台北富邦商業銀行新店分行無記名可轉讓定期\n存單面額新臺幣捌拾萬元，准予發還。\n    理  由\n一、按訴訟終結後，供擔保人證明已定20日以上之期間，催告受\n    擔保利益人行使權利而不行使者，法院應依供擔保人之聲請\n    ，以裁定命返還其提存物，民事訴訟法第104條第1項第3款\n    前段定有明文。前開規定，於其他依法令供訴訟上之擔保者\n    準用之，並為同法第106條所規定。\n二、本件聲請意旨略以：聲請人與相對人間請求假扣押事件，聲\n    請人前遵本院98年度裁全字第2244號假扣押裁定為擔保假扣\n    押，曾提供如主文所示之提存物為擔保，並以如主文所示之\n    擔保提存事件提存在案，茲因上開假扣押裁定業經臺灣高等\n    法院廢棄，執行法院已撤銷執行程序（本院98年度司執全字\n    第965號），聲請人並定20日以上之期間催告相對人即受擔\n    保利益人行使權利而未行使，為此聲請返還提存物等語。並\n    提出假扣押裁定、提存書、廢棄假扣押裁定、執行處撤銷執\n    行命令通知（以上均為影本）、存證信函暨回執等件為證。\n三、聲請人所述，經本院依職權調閱上開擔保提存卷、假扣押歷\n    審卷、98年度司執全字第965號假扣押執行卷等卷宗，查明\n    屬實，聲請人聲請返還擔保金，核無不合，應予准許。\n四、如不服本裁定，應於裁定送達後10日內，以書狀向司法事務\n    官提出異議。\n中    華    民    國    99    年    5     月    12    日\n                  民事第六庭    司法事務官  侯美滿",
  "structure": {
    "main": "本院九十八年度存字第一四六七號擔保提存事件聲請人所提存之\n新臺幣伍拾萬元及台北富邦商業銀行新店分行無記名可轉讓定期\n存單面額新臺幣捌拾萬元，准予發還。",
    "reason": "一、按訴訟終結後，供擔保人證明已定20日以上之期間，催告受\n    擔保利益人行使權利而不行使者，法院應依供擔保人之聲請\n    ，以裁定命返還其提存物，民事訴訟法第104條第1項第3款\n    前段定有明文。前開規定，於其他依法令供訴訟上之擔保者\n    準用之，並為同法第106條所規定。\n二、本件聲請意旨略以：聲請人與相對人間請求假扣押事件，聲\n    請人前遵本院98年度裁全字第2244號假扣押裁定為擔保假扣\n    押，曾提供如主文所示之提存物為擔保，並以如主文所示之\n    擔保提存事件提存在案，茲因上開假扣押裁定業經臺灣高等\n    法院廢棄，執行法院已撤銷執行程序（本院98年度司執全字\n    第965號），聲請人並定20日以上之期間催告相對人即受擔\n    保利益人行使權利而未行使，為此聲請返還提存物等語。並\n    提出假扣押裁定、提存書、廢棄假扣押裁定、執行處撤銷執\n    行命令通知（以上均為影本）、存證信函暨回執等件為證。\n三、聲請人所述，經本院依職權調閱上開擔保提存卷、假扣押歷\n    審卷、98年度司執全字第965號假扣押執行卷等卷宗，查明\n    屬實，聲請人聲請返還擔保金，核無不合，應予准許。\n四、如不服本裁定，應於裁定送達後10日內，以書狀向司法事務\n    官提出異議。"
  },
  "characters": {
    "judges": [

    ],
    "prosecutors": [

    ],
    "lawyers": [

    ],
    "clerks": [

    ],
    "plaintiffs": [

    ],
    "defendants": [

    ],
    "prosecutor_office": [
      "甲"
    ],
    "creditors": [

    ],
    "debtors": [

    ],
    "judicial_associate_officer": [
      "侯美滿"
    ]
  },
  "adjudged_at": "2010-05-12",
  "created_at": "2016-01-05 12:16:35",
  "updated_at": "2016-01-05 12:16:35"
}