{
  "identify": "TPD-98-審司聲-3319-20100104-1",
  "court": {
    "name": "臺灣臺北地方法院",
    "code": "TPD"
  },
  "division": {
    "name": "民事",
    "code": "V"
  },
  "year": 98,
  "word": "審司聲",
  "number": "3319",
  "jcheck": "1",
  "reason": "行使權利",
  "content": "臺灣臺北地方法院民事裁定          98年度審司聲字第3319號\n聲  請  人  甲○○\n上列聲請人與相對人瓏山林企業股份有限公司間聲請行使權利事\n件，本院裁定如下：\n    主  文\n聲請駁回。\n程序費用由聲請人負擔。\n    理  由\n一、按訴訟終結後，供擔保人得聲請法院通知受擔保利益人於一\n    定期間內行使權利，並向法院為行使權利之證明，以便供擔\n    保人於受擔保利益人未提出行使權利之證明時，向法院聲請\n    裁定返還其提存物，民事訴訟法第104條第1項第3款定有明\n    文。上揭規定，依民事訴訟法第106條規定，於其他依法令\n    供訴訟上之擔保者準用之。\n二、聲請意旨略以：聲請人與相對人瓏山林企業股份有限公司間\n    假扣押事件，聲請人前遵鈞院97年度裁全字第8922號民事裁\n    定，為擔保假扣押，曾提存擔保金，並以鈞院97年度存字第\n    5079號提存事件提存在案。茲因訴訟已終結，為通知相對人\n    行使權利，茲檢附相關證明，爰依民事訴訟法第104條第1項\n    第3款後段規定，聲請鈞院通知相對人即受擔保利益人於一\n    定期間內行使權利，並提出提存書、撤銷假扣押裁定及確定\n    證明書等件影本為證。\n三、查聲請人僅泛稱本件已訴訟終結，惟未具體敘明符合訴訟終\n    結之具體原因事實並提出證明，形式上尚難認已合於通知相\n    對人行使權利之前提要件。且本院於98年12月2日（發文日\n    期）通知聲請人於7日內提出訴訟終結之具體原因事實、法\n    律依據及相關證明，聲請人迄未補正。是以，聲請人聲請本\n    院通知相對人於一定期間行使權利，於法尚有未洽，不應准\n    許。\n四、如不服本裁定，應於裁定送達後10日內，以書狀向本院司法\n    事務官提出異議。\n【本件聯絡人：康股書記官（02）00000000分機6049】\n中    華    民    國    99    年    1    月    4    日\n                  民事第六庭    司法事務官  劉瑞宗",
  "structure": {
    "main": "聲請駁回。\n程序費用由聲請人負擔。",
    "reason": "一、按訴訟終結後，供擔保人得聲請法院通知受擔保利益人於一\n    定期間內行使權利，並向法院為行使權利之證明，以便供擔\n    保人於受擔保利益人未提出行使權利之證明時，向法院聲請\n    裁定返還其提存物，民事訴訟法第104條第1項第3款定有明\n    文。上揭規定，依民事訴訟法第106條規定，於其他依法令\n    供訴訟上之擔保者準用之。\n二、聲請意旨略以：聲請人與相對人瓏山林企業股份有限公司間\n    假扣押事件，聲請人前遵鈞院97年度裁全字第8922號民事裁\n    定，為擔保假扣押，曾提存擔保金，並以鈞院97年度存字第\n    5079號提存事件提存在案。茲因訴訟已終結，為通知相對人\n    行使權利，茲檢附相關證明，爰依民事訴訟法第104條第1項\n    第3款後段規定，聲請鈞院通知相對人即受擔保利益人於一\n    定期間內行使權利，並提出提存書、撤銷假扣押裁定及確定\n    證明書等件影本為證。\n三、查聲請人僅泛稱本件已訴訟終結，惟未具體敘明符合訴訟終\n    結之具體原因事實並提出證明，形式上尚難認已合於通知相\n    對人行使權利之前提要件。且本院於98年12月2日（發文日\n    期）通知聲請人於7日內提出訴訟終結之具體原因事實、法\n    律依據及相關證明，聲請人迄未補正。是以，聲請人聲請本\n    院通知相對人於一定期間行使權利，於法尚有未洽，不應准\n    許。\n四、如不服本裁定，應於裁定送達後10日內，以書狀向本院司法\n    事務官提出異議。\n【本件聯絡人：康股書記官（02）00000000分機6049】"
  },
  "characters": {
    "judges": [

    ],
    "prosecutors": [

    ],
    "lawyers": [

    ],
    "clerks": [

    ],
    "plaintiffs": [

    ],
    "defendants": [

    ],
    "prosecutor_office": [
      "甲"
    ],
    "creditors": [

    ],
    "debtors": [

    ],
    "judicial_associate_officer": [
      "劉瑞宗"
    ]
  },
  "adjudged_at": "2010-01-04",
  "created_at": "2016-01-05 14:44:35",
  "updated_at": "2016-01-05 14:44:35"
}