{
  "identify": "TPD-99-審訴-1497-20100512-1",
  "court": {
    "name": "臺灣臺北地方法院",
    "code": "TPD"
  },
  "division": {
    "name": "民事",
    "code": "V"
  },
  "year": 99,
  "word": "審訴",
  "number": "1497",
  "jcheck": "1",
  "reason": "清償借款",
  "content": "臺灣臺北地方法院民事判決            99年度審訴字第1497號\n    原      告  台新資產管理股份有限公司\n    法定代理人  乙○○\n    訴訟代理人  甲○○\n    被      告  丙○○\n上列當事人間清償借款事件，經本院於中華民國99年5月4日言詞\n辯論終結，判決如下：\n    主  文\n被告應給付原告新台幣伍拾萬陸仟肆佰陸拾壹元，及其中新台\n幣貳拾玖萬陸仟零伍拾元部分，自民國九十九年二月二十六日起\n至清償日止，按年息百分之二十計算之利息。\n訴訟費用新台幣伍仟捌佰肆拾元由被告負擔。\n    事實及理由\n一、本件依訴外人台新國際商業銀行股份有限公司（下稱台新銀\n    行）與被告簽訂之予備金信用貸款約定書（下稱約定書）第\n    23條約定，雙方合意以臺灣臺北地方法院為第一審管轄法院\n    ，故本院自有管轄權。又本件被告未於言詞辯論期日到場，\n    核無民事訴訟法第386 條所列各款情形，應依原告之聲請，\n    由其一造辯論而為判決。\n二、原告起訴主張：被告於民國92年10月14日向台新銀行申請現\n    金卡信用貸款（帳號：0000000000000000），依約被告得以\n    金融卡提款或轉帳方式動撥貸款額度之現金，但應於每月繳\n    款截止日向台新銀行清償，逾期清償者依約定書第8、9條之\n    約定，除喪失期限利益外，自應付還本日或付息日之翌日起\n    至清償日止，改依年息20% 計付遲延利息。詎被告未依約繳\n    款共積欠536,461元（含本金296,050元、利息240,411 元）\n    。嗣台新銀行將上開債權讓與原告，並依金融機構合併法第\n    15條第1項第1款及第18條第3 項規定以登報公告方式通知被\n    告，屢經催討，未獲置理，為此提起本件訴訟。並聲明：如\n    主文所示。\n三、被告未於言詞辯論期日到場，亦未提出書狀作何聲明或陳述\n    。\n四、本件原告主張之事實，已據其提出予備金申請書暨信用貸款\n    約定書、被告帳務明細、現金卡與予備金增補約定書、現金\n    卡／隨意金交易紀錄、太平洋日報登報公告及債權讓與證明\n    書等影本為證，又被告已於相當時期受合法通知，而於言詞\n    辯論期日不到場，亦未提出準備書狀爭執，依民事訴訟法第\n    280條第3項前段準用同條第1 項規定，對原告主張之前開事\n    實，視同自認，堪信為真實。從而，原告依債權讓與及現金\n    卡契約之法律關係請求被告給付如主文所示之本金及利息，\n    為有理由，應予准許。\n五、本件訴訟費用額確定為5,840元。\n六、訴訟費用負擔之依據：民事訴訟法第78條。\n中    華    民    國    99    年    5     月    12    日\n                        民事第六庭法官  傅中樂\n以上正本係照原本作成。\n如對本判決上訴，須於判決送達後20日內向本院提出上訴狀。\n中    華    民    國    99    年    5     月    12    日\n                                書記官  王文心",
  "structure": {
    "main": "被告應給付原告新台幣伍拾萬陸仟肆佰陸拾壹元，及其中新台\n幣貳拾玖萬陸仟零伍拾元部分，自民國九十九年二月二十六日起\n至清償日止，按年息百分之二十計算之利息。\n訴訟費用新台幣伍仟捌佰肆拾元由被告負擔。",
    "fact": "一、本件依訴外人台新國際商業銀行股份有限公司（下稱台新銀\n    行）與被告簽訂之予備金信用貸款約定書（下稱約定書）第\n    23條約定，雙方合意以臺灣臺北地方法院為第一審管轄法院\n    ，故本院自有管轄權。又本件被告未於言詞辯論期日到場，\n    核無民事訴訟法第386 條所列各款情形，應依原告之聲請，\n    由其一造辯論而為判決。\n二、原告起訴主張：被告於民國92年10月14日向台新銀行申請現\n    金卡信用貸款（帳號：0000000000000000），依約被告得以\n    金融卡提款或轉帳方式動撥貸款額度之現金，但應於每月繳\n    款截止日向台新銀行清償，逾期清償者依約定書第8、9條之\n    約定，除喪失期限利益外，自應付還本日或付息日之翌日起\n    至清償日止，改依年息20% 計付遲延利息。詎被告未依約繳\n    款共積欠536,461元（含本金296,050元、利息240,411 元）\n    。嗣台新銀行將上開債權讓與原告，並依金融機構合併法第\n    15條第1項第1款及第18條第3 項規定以登報公告方式通知被\n    告，屢經催討，未獲置理，為此提起本件訴訟。並聲明：如\n    主文所示。\n三、被告未於言詞辯論期日到場，亦未提出書狀作何聲明或陳述\n    。\n四、本件原告主張之事實，已據其提出予備金申請書暨信用貸款\n    約定書、被告帳務明細、現金卡與予備金增補約定書、現金\n    卡／隨意金交易紀錄、太平洋日報登報公告及債權讓與證明\n    書等影本為證，又被告已於相當時期受合法通知，而於言詞\n    辯論期日不到場，亦未提出準備書狀爭執，依民事訴訟法第\n    280條第3項前段準用同條第1 項規定，對原告主張之前開事\n    實，視同自認，堪信為真實。從而，原告依債權讓與及現金\n    卡契約之法律關係請求被告給付如主文所示之本金及利息，\n    為有理由，應予准許。\n五、本件訴訟費用額確定為5,840元。\n六、訴訟費用負擔之依據：民事訴訟法第78條。",
    "reason": "一、本件依訴外人台新國際商業銀行股份有限公司（下稱台新銀\n    行）與被告簽訂之予備金信用貸款約定書（下稱約定書）第\n    23條約定，雙方合意以臺灣臺北地方法院為第一審管轄法院\n    ，故本院自有管轄權。又本件被告未於言詞辯論期日到場，\n    核無民事訴訟法第386 條所列各款情形，應依原告之聲請，\n    由其一造辯論而為判決。\n二、原告起訴主張：被告於民國92年10月14日向台新銀行申請現\n    金卡信用貸款（帳號：0000000000000000），依約被告得以\n    金融卡提款或轉帳方式動撥貸款額度之現金，但應於每月繳\n    款截止日向台新銀行清償，逾期清償者依約定書第8、9條之\n    約定，除喪失期限利益外，自應付還本日或付息日之翌日起\n    至清償日止，改依年息20% 計付遲延利息。詎被告未依約繳\n    款共積欠536,461元（含本金296,050元、利息240,411 元）\n    。嗣台新銀行將上開債權讓與原告，並依金融機構合併法第\n    15條第1項第1款及第18條第3 項規定以登報公告方式通知被\n    告，屢經催討，未獲置理，為此提起本件訴訟。並聲明：如\n    主文所示。\n三、被告未於言詞辯論期日到場，亦未提出書狀作何聲明或陳述\n    。\n四、本件原告主張之事實，已據其提出予備金申請書暨信用貸款\n    約定書、被告帳務明細、現金卡與予備金增補約定書、現金\n    卡／隨意金交易紀錄、太平洋日報登報公告及債權讓與證明\n    書等影本為證，又被告已於相當時期受合法通知，而於言詞\n    辯論期日不到場，亦未提出準備書狀爭執，依民事訴訟法第\n    280條第3項前段準用同條第1 項規定，對原告主張之前開事\n    實，視同自認，堪信為真實。從而，原告依債權讓與及現金\n    卡契約之法律關係請求被告給付如主文所示之本金及利息，\n    為有理由，應予准許。\n五、本件訴訟費用額確定為5,840元。\n六、訴訟費用負擔之依據：民事訴訟法第78條。"
  },
  "characters": {
    "judges": [

    ],
    "prosecutors": [

    ],
    "lawyers": [

    ],
    "clerks": [

    ],
    "plaintiffs": [
      "台新資產管理股份有限公司"
    ],
    "defendants": [
      "丙○○"
    ],
    "prosecutor_office": [

    ],
    "creditors": [

    ],
    "debtors": [

    ],
    "judicial_associate_officer": [

    ]
  },
  "adjudged_at": "2010-05-12",
  "created_at": "2016-01-05 12:10:32",
  "updated_at": "2016-01-05 12:10:32"
}