{
  "identify": "TPD-99-消債核-85-20100104-1",
  "court": {
    "name": "臺灣臺北地方法院",
    "code": "TPD"
  },
  "division": {
    "name": "民事",
    "code": "V"
  },
  "year": 99,
  "word": "消債核",
  "number": "85",
  "jcheck": "1",
  "reason": "消債之前置協商認可事件",
  "content": "臺灣臺北地方法院民事裁定            99年度消債核字第85號\n聲  請  人\n即債權人    永豐商業銀行股份有限公司\n法定代理人  戊○○\n聲  請  人\n即債權人    台北富邦商業銀行股份有限公司\n法定代理人  丙○○\n聲  請  人\n即債權人    香港商香港上海豐銀行股份有限公司\n法定代理人  乙○○\n聲  請  人\n即債權人    台新國際商業銀行股份有限公司\n法定代理人  甲○○\n相  對  人\n即債務人    丁○○\n上列當事人間聲請協商認可事件，本院裁定如下：\n    主  文\n如附件所示債權人與債務人間於民國98年12月18日協商成立之債\n務清償方案，予以認可。\n    理    由\n一、按債務人對於金融機構因消費借貸、自用住宅借款、信用卡\n    或現金卡契約而負債務，在聲請更生或清算前，應提出債權\n    人清冊，以書面向最大債權金融機構請求協商債務清償方案\n    並表明共同協商之意旨，消費者債務清理條例第151條第1項\n    定有明文。又前條第一項受請求之金融機構應於協商成立之\n    翌日起七日內，將債務清償方案送請金融機構所在地之管轄\n    法院審核，但當事人就債務清償方案已依公證法第13條第 1\n    項規定，請求公證人作成公證書者，不在此限；前項債務清\n    償方案，法院應儘速審核，認與法令無牴觸者，應以裁定予\n    以認可，認與法令牴觸者，應以裁定不予認可，復為同條例\n    第152條第1項、第2項所明定。\n二、本件聲請意旨略以：債務人與全體債權人已協商成立，爰依\n    消費者債務清理條例第152條第1項之規定，聲請本院裁定認\n    可如附件所示之債務清償方案等語。\n三、查聲請人所主張之上開事實，業據提出與其所述相符之前置\n    協商機制協議書（金融機構無擔保債權）及前置協商無擔保\n    債務還款分配表暨表決結果等件為證，堪信為真實。本院審\n    查債務人與全體債權人於民國98年12月18日協商成立之債務\n    清償方案內容，並無牴觸法令之情事，爰裁定如主文。\n四、如不服本裁定，應於裁定送達後10日內，以書狀向本院司法\n    事務 官提出異議。\n中    華    民    國    99    年    1     月    4     日\n              民事庭        司法事務官    黃欣欣\n附件：前置協商機制協議書（金融機構無擔保債權）、前置協商\n      無擔保債務還款分配表暨表決結果。",
  "structure": {
    "main": "如附件所示債權人與債務人間於民國98年12月18日協商成立之債\n務清償方案，予以認可。",
    "reason": "一、按債務人對於金融機構因消費借貸、自用住宅借款、信用卡\n    或現金卡契約而負債務，在聲請更生或清算前，應提出債權\n    人清冊，以書面向最大債權金融機構請求協商債務清償方案\n    並表明共同協商之意旨，消費者債務清理條例第151條第1項\n    定有明文。又前條第一項受請求之金融機構應於協商成立之\n    翌日起七日內，將債務清償方案送請金融機構所在地之管轄\n    法院審核，但當事人就債務清償方案已依公證法第13條第 1\n    項規定，請求公證人作成公證書者，不在此限；前項債務清\n    償方案，法院應儘速審核，認與法令無牴觸者，應以裁定予\n    以認可，認與法令牴觸者，應以裁定不予認可，復為同條例\n    第152條第1項、第2項所明定。\n二、本件聲請意旨略以：債務人與全體債權人已協商成立，爰依\n    消費者債務清理條例第152條第1項之規定，聲請本院裁定認\n    可如附件所示之債務清償方案等語。\n三、查聲請人所主張之上開事實，業據提出與其所述相符之前置\n    協商機制協議書（金融機構無擔保債權）及前置協商無擔保\n    債務還款分配表暨表決結果等件為證，堪信為真實。本院審\n    查債務人與全體債權人於民國98年12月18日協商成立之債務\n    清償方案內容，並無牴觸法令之情事，爰裁定如主文。\n四、如不服本裁定，應於裁定送達後10日內，以書狀向本院司法\n    事務 官提出異議。"
  },
  "characters": {
    "judges": [

    ],
    "prosecutors": [

    ],
    "lawyers": [

    ],
    "clerks": [

    ],
    "plaintiffs": [

    ],
    "defendants": [

    ],
    "prosecutor_office": [

    ],
    "creditors": [
      "永豐商業銀行股份有限公司",
      "台北富邦商業銀行股份有限公司",
      "香港商香港上海豐銀行股份有限公司",
      "台新國際商業銀行股份有限公司"
    ],
    "debtors": [

    ],
    "judicial_associate_officer": [
      "黃欣欣"
    ]
  },
  "adjudged_at": "2010-01-04",
  "created_at": "2016-01-05 14:52:07",
  "updated_at": "2016-01-05 14:52:07"
}