{
  "identify": "TPD-98-審訴-6880-20100104-1",
  "court": {
    "name": "臺灣臺北地方法院",
    "code": "TPD"
  },
  "division": {
    "name": "民事",
    "code": "V"
  },
  "year": 98,
  "word": "審訴",
  "number": "6880",
  "jcheck": "1",
  "reason": "清償借款",
  "content": "臺灣臺北地方法院民事裁定            98年度審訴字第6880號\n原      告  中國信託商業銀行股份有限公司\n\n法定代理人  麥克迪諾馬\n\n被      告  王安華\n上列當事人間清償借款事件本院裁定如下：\n    主  文\n本件移送臺灣高雄地方法院。\n    理  由\n一、按合意管轄，如當事人之一造為法人或商人，依其預定用於\n    同類契約之條款而成立，按其情形顯失公平者，他造於為本\n    案之言詞辯論前，得聲請移送於其管轄法院，民事訴訟法第\n    28條第2項定有明文。\n二、查，兩造於信用卡約定條款第25條、簡易通信貸款約定書第\n    9條及借據約定書第11條中，固有合意以本院為管轄法院（\n    見本院卷第9頁、第28頁及第31頁背面），惟被告住所地位\n    於高雄市苓雅區，有戶籍謄本附卷可憑（見本院卷第32頁）\n    ，且原告係經營銀行業務之法人，而該條款為其預定用於同\n    類契約之條款而成立，按其情形對於被告應訴而言顯失公平\n    ，故被告於本案言詞辯論前之民國98年12月25日（見本院卷\n    第35頁之民事聲請移轉管轄狀），具狀聲請將本件移送至台\n    灣高雄地方法院（即被告住所地管轄法院），核與民事訴訟\n    法第28條第2項規定相符，應予准許。爰裁定如主文所示。\n中    華    民    國    99    年    1     月    4     日\n                  民事第六庭    法  官  吳定亞\n以上正本係照原本作成。\n如對本裁定抗告須於裁定送達後10日內向本院提出抗告狀，並繳\n納抗告費新臺幣1,000元。\n中    華    民    國    99    年    1     月    4     日\n                                書記官  張婕妤",
  "structure": {
    "main": "本件移送臺灣高雄地方法院。",
    "reason": "一、按合意管轄，如當事人之一造為法人或商人，依其預定用於\n    同類契約之條款而成立，按其情形顯失公平者，他造於為本\n    案之言詞辯論前，得聲請移送於其管轄法院，民事訴訟法第\n    28條第2項定有明文。\n二、查，兩造於信用卡約定條款第25條、簡易通信貸款約定書第\n    9條及借據約定書第11條中，固有合意以本院為管轄法院（\n    見本院卷第9頁、第28頁及第31頁背面），惟被告住所地位\n    於高雄市苓雅區，有戶籍謄本附卷可憑（見本院卷第32頁）\n    ，且原告係經營銀行業務之法人，而該條款為其預定用於同\n    類契約之條款而成立，按其情形對於被告應訴而言顯失公平\n    ，故被告於本案言詞辯論前之民國98年12月25日（見本院卷\n    第35頁之民事聲請移轉管轄狀），具狀聲請將本件移送至台\n    灣高雄地方法院（即被告住所地管轄法院），核與民事訴訟\n    法第28條第2項規定相符，應予准許。爰裁定如主文所示。"
  },
  "characters": {
    "judges": [
      "吳定亞"
    ],
    "prosecutors": [

    ],
    "lawyers": [

    ],
    "clerks": [

    ],
    "plaintiffs": [
      "中國信託商業銀行股份有限公司"
    ],
    "defendants": [
      "王安華"
    ],
    "prosecutor_office": [

    ],
    "creditors": [

    ],
    "debtors": [

    ],
    "judicial_associate_officer": [

    ]
  },
  "adjudged_at": "2010-01-04",
  "created_at": "2016-01-05 14:48:53",
  "updated_at": "2016-01-05 14:48:53"
}