{
  "identify": "TPD-98-審司聲-3604-20100104-1",
  "court": {
    "name": "臺灣臺北地方法院",
    "code": "TPD"
  },
  "division": {
    "name": "民事",
    "code": "V"
  },
  "year": 98,
  "word": "審司聲",
  "number": "3604",
  "jcheck": "1",
  "reason": "返還提存物",
  "content": "臺灣臺北地方法院民事裁定          98年度審司聲字第3604號\n聲  請  人  甲○○\n上列聲請人與相對人新偕中建設股份有限公司間聲請返還提存物\n事件，本院裁定如下：\n    主  文\n聲請駁回。\n    理  由\n一、本件聲請人聲請意旨略以：聲請人與相對人間因禁止提示付\n    款等事件，前遵本院79年度全字第1498號假處分裁定提存擔\n    保物（本院79年度存字第3103號）。茲因雙方已達成和解，\n    相對人並同意以該提存款作為其瑕疵給付賠償之一部，聲請\n    人疏未請相對人簽署同意書，故依民事訴訟法第104條第1項\n    第3款前段之規定，定20日以上之期間催告相對人行使權利\n    而相對人迄今仍未行使權利，為此請求返還提存物等語。並\n    提出裁定書、提存書、催告函、回執等影本為證。\n二、按返還擔保金，依民事訴訟法第104條之規定，須符合：(1)\n    應供擔保之原因消滅者；(2)供擔保人證明受擔保利益同意\n    返還者；(3)訴訟終結後供擔保人證明已定20日以上之期間\n    催告受擔保利益人行使權利而未行使，或法院依供擔保人之\n    聲請，通知受擔保利益人於一定期間內行使權利並向法院為\n    行使權利之證明而未證明者之要件，法院始得裁定返還擔保\n    金。所謂應供擔保原因消滅，係指必待無損害發生，或債權\n    人本案勝訴確定，或就所生之損害已經賠償時，始得謂供擔\n    保之原因消滅（最高法院53年台抗字第279號判例可資參照\n    ）。又在假扣押債權人已聲請假扣押執行，並已提起本案訴\n    訟之情形下，債權人依民事訴訟法第106條準用第104條第1\n    項第3款規定，聲請裁定返還提存物時，必待本案訴訟已終\n    結，並已撤銷假扣押裁定及撤回假扣押執行，始得謂與該條\n    款所定之「訴訟終結」相當（最高法院96年台抗字第753號\n    裁定可資參照）；民事訴訟法第104條乃有關訴訟費用擔保\n    物返還之規定，其第1項第3款所謂訴訟終結，當係指訴訟費\n    用所屬本案訴訟之終結，至於保全程序之擔保，依同法第10\n    6條準用前開規定，所謂訴訟終結，應係指保全程序之終結\n    ，要與保全程序所保全請求之本案訴訟終結無涉。而保全程\n    序始於保全裁定之取得，迄於保全程序之執行，是保全程序\n    之終結，即應包括保全裁定之撤銷及其執行程序之撤回。惟\n    若保全裁定依強制執行法第132條第3項規定，已不得再聲請\n    執行者，則無再為撤銷之必要（臺灣高等法院暨所屬法院95\n    年法律座談會民事類提案第23號研討結果可資參照）。又訴\n    訟終結後定20日以上期間之催告，既屬法定要件之一，則催\n    告必須在訴訟終結之後，否則不生催告之效力。不能謂訴訟\n    終結前之催告，自屬合法。\n三、本件聲請人主張雙方已達成和解，相對人並同意以該提存款\n    作為其瑕疵給付賠償之一部，惟未舉證以實其說，故尚難認\n    聲請人已證明相對人無損害發生或就所生之損害已賠償，而\n    聲請人亦未證明已就假處分所欲保全之請求獲得本案全部勝\n    訴，依上開判例意旨，自難謂其應供擔保之原因消滅。聲請\n    人另主張已催告相對人行使權利而未行使等語，惟未證明已\n    撤回假處分執行，依上開說明，即與訴訟終結要件不合，其\n    所為之催告亦不合法。此外，聲請人復未舉證證明相對人已\n    同意返還擔保金之情形，從而，聲請人聲請返還提存物，於\n    法尚有未合，不應准許。\n四、如不服本裁定，應於裁定送達後10日內，以書狀向司法事務\n    官提出異議。\n中    華    民    國    99    年    1     月    4     日\n                  民事第六庭    司法事務官  侯美滿",
  "structure": {
    "main": "聲請駁回。",
    "reason": "一、本件聲請人聲請意旨略以：聲請人與相對人間因禁止提示付\n    款等事件，前遵本院79年度全字第1498號假處分裁定提存擔\n    保物（本院79年度存字第3103號）。茲因雙方已達成和解，\n    相對人並同意以該提存款作為其瑕疵給付賠償之一部，聲請\n    人疏未請相對人簽署同意書，故依民事訴訟法第104條第1項\n    第3款前段之規定，定20日以上之期間催告相對人行使權利\n    而相對人迄今仍未行使權利，為此請求返還提存物等語。並\n    提出裁定書、提存書、催告函、回執等影本為證。\n二、按返還擔保金，依民事訴訟法第104條之規定，須符合：(1)\n    應供擔保之原因消滅者；(2)供擔保人證明受擔保利益同意\n    返還者；(3)訴訟終結後供擔保人證明已定20日以上之期間\n    催告受擔保利益人行使權利而未行使，或法院依供擔保人之\n    聲請，通知受擔保利益人於一定期間內行使權利並向法院為\n    行使權利之證明而未證明者之要件，法院始得裁定返還擔保\n    金。所謂應供擔保原因消滅，係指必待無損害發生，或債權\n    人本案勝訴確定，或就所生之損害已經賠償時，始得謂供擔\n    保之原因消滅（最高法院53年台抗字第279號判例可資參照\n    ）。又在假扣押債權人已聲請假扣押執行，並已提起本案訴\n    訟之情形下，債權人依民事訴訟法第106條準用第104條第1\n    項第3款規定，聲請裁定返還提存物時，必待本案訴訟已終\n    結，並已撤銷假扣押裁定及撤回假扣押執行，始得謂與該條\n    款所定之「訴訟終結」相當（最高法院96年台抗字第753號\n    裁定可資參照）；民事訴訟法第104條乃有關訴訟費用擔保\n    物返還之規定，其第1項第3款所謂訴訟終結，當係指訴訟費\n    用所屬本案訴訟之終結，至於保全程序之擔保，依同法第10\n    6條準用前開規定，所謂訴訟終結，應係指保全程序之終結\n    ，要與保全程序所保全請求之本案訴訟終結無涉。而保全程\n    序始於保全裁定之取得，迄於保全程序之執行，是保全程序\n    之終結，即應包括保全裁定之撤銷及其執行程序之撤回。惟\n    若保全裁定依強制執行法第132條第3項規定，已不得再聲請\n    執行者，則無再為撤銷之必要（臺灣高等法院暨所屬法院95\n    年法律座談會民事類提案第23號研討結果可資參照）。又訴\n    訟終結後定20日以上期間之催告，既屬法定要件之一，則催\n    告必須在訴訟終結之後，否則不生催告之效力。不能謂訴訟\n    終結前之催告，自屬合法。\n三、本件聲請人主張雙方已達成和解，相對人並同意以該提存款\n    作為其瑕疵給付賠償之一部，惟未舉證以實其說，故尚難認\n    聲請人已證明相對人無損害發生或就所生之損害已賠償，而\n    聲請人亦未證明已就假處分所欲保全之請求獲得本案全部勝\n    訴，依上開判例意旨，自難謂其應供擔保之原因消滅。聲請\n    人另主張已催告相對人行使權利而未行使等語，惟未證明已\n    撤回假處分執行，依上開說明，即與訴訟終結要件不合，其\n    所為之催告亦不合法。此外，聲請人復未舉證證明相對人已\n    同意返還擔保金之情形，從而，聲請人聲請返還提存物，於\n    法尚有未合，不應准許。\n四、如不服本裁定，應於裁定送達後10日內，以書狀向司法事務\n    官提出異議。"
  },
  "characters": {
    "judges": [

    ],
    "prosecutors": [

    ],
    "lawyers": [

    ],
    "clerks": [

    ],
    "plaintiffs": [

    ],
    "defendants": [

    ],
    "prosecutor_office": [
      "甲"
    ],
    "creditors": [

    ],
    "debtors": [

    ],
    "judicial_associate_officer": [
      "侯美滿"
    ]
  },
  "adjudged_at": "2010-01-04",
  "created_at": "2016-01-05 14:48:44",
  "updated_at": "2016-01-05 14:48:44"
}