{
  "identify": "TPD-98-整抗更(一)-2-20100104-1",
  "court": {
    "name": "臺灣臺北地方法院",
    "code": "TPD"
  },
  "division": {
    "name": "民事",
    "code": "V"
  },
  "year": 98,
  "word": "整抗更(一)",
  "number": "2",
  "jcheck": "1",
  "reason": "公司重整",
  "content": "臺灣臺北地方法院民事裁定           98年度整抗更(一)字第2號\n抗  告  人  壬○○\n            乙○○\n            己○○\n            甲○○\n            丑○○\n            丙○○\n            庚○○\n            癸○○\n共同代理人  李淑寶律師\n相  對  人  德寶營造股份有限公司\n法定代理人\n即重整人    子○○\n            辛○○\n            戊○○\n訴訟代理人  丁○○\n上列當事人間因重整債權聲明異議事件，抗告人對於中華民國97\n年2月15日本院95年度整字第2號第一審裁定提起抗告，經臺灣高\n等法院廢棄原裁定，本院更為裁定如下：\n    主  文\n抗告駁回。\n抗告程序費用新臺幣壹仟元由抗告人負擔。\n    理  由\n一、抗告意旨略以：抗告人前因損害賠償事件，而與相對人爭訟\n    （案號：95年度訴字第4183號），原審依此既肯認抗告人為\n    可知之公司債權人，相對人理應依公司法第286條之規定，\n    將重整裁定以書面送達予抗告人，詎伊等自始均未收到任何\n    准許相對人重整之裁定；兩造於前開訴訟事件中，自始即爭\n    執關於房屋於開工前是否已然傾斜，而相對人是否應負損害\n    賠償責任等事，為釐清責任歸屬，並委託台北市結構工程工\n    業技師公會進行鑑定，故可知兩造對於上開訴訟應否負責仍\n    存在爭執，並非不爭執，原審率認兩造就損害賠償請求權不\n    爭執，亦有違誤；查臺北市結構工程工業技師公會係於原審\n    准予相對人重整裁定之後，方於95年12月26日做出鑑定報告\n    ，足認本件債權乃發生在重整裁定之後，應屬重整債務；且\n    所謂重整債權係以財產上請求為限，今抗告人另有請求相對\n    人負擔扶正系爭房屋之作為義務，非屬財產上請求權至明，\n    故系爭申報債權案件，應無公司法第5章第10節公司重整規\n    定之適用。原裁定指抗告人至遲於96年3月28日即已知悉相\n    對人經准予重整情事，竟遲誤補申報債權期間，否准抗告人\n    申報債權，顯無理由，爰依法提起抗告。\n三、就本院是否已踐行法定通知程序部分\n  (一)按「法院為重整裁定後，應即公告左列事項：一、重整裁定\n    之主文及其年、月、日。二、重整監督人、重整人之姓名或\n    名稱、住址或處所。三、第二百八十九條第一項所定期間、\n    期日及場所。四、公司債權人及持有無記名股票之股東怠於\n    申報權利時，其法律效果。法院對於重整監督人、重整人、\n    公司、已知之公司債權人及股東，仍應將前項裁定及所列各\n    事項，以書面送達之」，公司法第291條第1、2項定有明文\n    。所謂「已知之公司債權人」，係指當時依重整案件卷內資\n    料已知其為債權人者，此觀公司法就重整債權之申報程序係\n    規定由重整公司提出債權人清冊，法院公告並送達重整裁定\n    ，由重整債權人申報債權，重整監督人初步審查，再由法院\n    審查債權，並無由法院職權調查之規定，即可得知。是以於\n    重整程序中，法院尚無依職權調查公司尚有何其他未經重整\n    公司列於債權人清冊，亦未遵期申報債權之重整債權人之義\n    務。縱債權人因另案與公司涉訟中，然若該債權人或公司均\n    未向法院陳報，依重整卷內資料，法院尚無從得知此一債權\n    人，自不能認為受理重整案件之法院已知此債權人，此債權\n    人不屬公司法第291條第2項所稱之「已知債權人」，法院亦\n    無庸對其送達重整裁定，合先敘明。\n  (二)經本院依職權調閱95年度整字第2號卷宗，相對人於重整程\n    序中所陳報之債權人名冊，並未將本件抗告人列於其內。抗\n    告人雖以其與相對人、第三人臺北市政府都市發展局間因承\n    攬工程瑕疵損害賠償事件涉訟，尚由本院以95年度訴字第\n    4183號案件審理中，抗告人應為相對人已知之公司債權人云\n    云，然查，於本院裁定准相對人重整時，相對人向本院陳報\n    之債權人清冊中，並未將抗告人列名其上，而抗告人亦未主\n    動向本院陳報其債權，自無從認為抗告人為公司法第291條\n    第2項所稱之「已知債權人」，是以本院未對其送達重整裁\n    定，尚無不合。至於本院因審理95年度訴字第4183號案件，\n    曾於96年3月23日以公函通知抗告人本件重整情事，並非重\n    整程序內所為之通知，尚不能執此認為抗告人為「已知債權\n    人」，併此敘明。\n四、就抗告人是否已遵期申報債權部分\n  (一)按「重整債權人，應提出足資證明其權利存在之文件，向重\n    整監督人申報，經申報者，其時效中斷；未經申報者，不得\n    依重整程序受清償。公司記名股東之權利，依股東名簿之記\n    載；無記名股東之權利，應準用前項規定申報，未經申報者\n    ，不得依重整程序，行使其權利。前二項應為申報之人，因\n    不可歸責於自己之事由，致未依限申報者，得於事由終止後\n    十五日內補報之。但重整計劃已經關係人會議可決時，不得\n    補報」，公司法第297條定有明文。\n  (二)本院95年度訴字第4183號案件曾於96年3月23日以公函通知\n    抗告人「被告德寶營造股份有限公司已經本院95年度整字第\n    2號裁定重整，依公司法第294條規定，本件訴訟程序應停止\n    ，請台端自行審酌重整程序之相關規定，以保障自身權益」\n    ，該函業於同月27日送達抗告人該案之訴訟代理人李淑寶律\n    師，業經本院依職權調閱95年度訴字第4183號案件卷宗審核\n    無誤。雖抗告人該案之訴訟代理人李淑寶律師當時並未受有\n    關重整案件之委任，惟就95年度訴字第4183號案件因重整而\n    停止訴訟程序一節，乃屬95年度訴字第4183號案件相關事項\n    ，法院就此對抗告人該案訴訟代理人李淑寶律師所為之通知\n    ，應認為亦已對抗告人發生效力，且依該通知之內容，業已\n    足使抗告人得悉重整裁定之存在，堪認抗告人至遲於96年3\n    月27日即知悉相對人業經裁定重整一事。而抗告人係於96\n    年7月11日始補行申報債權，顯已逾上開債權申報期間及補\n    報之15日，是以原裁定以抗告人係逾期申報債權，其補行申\n    報於法不合為由予以駁回，經核尚無不合。\n四、抗告人之債權需否適用重整程序部分\n  (一)對公司之債權，在重整裁定前成立者，為重整債權，公司法\n    第296條第1項定有明文。\n  (二)本件抗告人以相對人及第三人臺北市政府都市發展局造成其\n    房屋損害，請求扶正，係於95年4月10日即向本院起訴，經\n    本院以95年度訴字第4183號案件審理中。抗告人雖以本院係\n    於95年12月19日裁定准予相對人重整，而95年度訴字第4183\n    號案件係於95年12月26日始由鑑定人作成鑑定報告為由，主\n    張其債權成立於重整裁定後云云，然鑑定報告僅在確認損害\n    之有無及回復原狀之方法，以佐證抗告人於該案件之主張有\n    無理由而已，抗告人之債權若屬存在，亦係於房屋受損時即\n    已成立，並非因鑑定報告之作成始成立。抗告人既早於95\n    年4月10日即向本院起訴，顯見其房屋受損時間遠早於重整\n    裁定作成時，斷非重整裁定後使成立之債權，是以抗告人此\n    一主張顯屬無據。\n  (三)本件抗告人於原審申報之債權金額為400萬元，此有李淑寶\n    律師事務所函可考（見原審卷第10至11頁），核屬財產權訴\n    訟，且依抗告人起訴時間為95年4月10日及其起訴事實係因\n    其等向第三人臺北市政府都市發展局購買之房屋有繼續傾斜\n    之情事，相對人施工亦使房屋牆面等部位裂縫增大，依侵權\n    行為法律關係請求相對人及第三人臺北市政府都市發展局負\n    損害賠償責任，請求回復原狀（見原審卷第12至14頁），其\n    訴之聲明內容雖係請求扶正抗告人之房屋，並非請求給付金\n    錢，然所謂財產權訴訟，原不限於請求給付金錢或給付特定\n    財產，例如本於所有權請求拆屋還地、依公寓大廈管理條例\n    請求修復漏水，其請求之內容均屬特定作為，仍屬財產權訴\n    訟無疑。抗告人於95年度訴字第4183號案件之訴訟標的仍係\n    依民法第184條、第185條、第213條、第767條請求回復其房\n    屋所受損害之原狀，此有該案件起訴狀可稽，是抗告人主張\n    其所申報之債權係非財產權訴訟，不適用公司法第5章第10\n    節公司重整規定云云，亦有未洽。\n五、綜上所述，原審以抗告人未依限申報債權為由，將其申報之\n    債權全數予以剔除，洵無違誤。抗告意旨猶執前詞，指摘原\n    裁定不當，為無理由，應予駁回。\n六、據上論結，本件抗告為無理由，依非訟事件法第21條第2項\n    、第24條第1項、第46條、民事訴訟法第495條之1第1項、第\n    449條第1項、第78條，裁定如主文。\n中    華    民    國    99    年    1     月    4     日\n              民事第三庭    審判長法官  丁蓓蓓\n                                法  官  黃明發\n                                法  官  陳怡雯\n以上正本係照原本作成。\n本裁定除以適用法規顯有錯誤為理由，並經本院許可外，不得再\n抗告。如提起再抗告，應於收受後10日內委任律師為訴訟代理人\n向本院提出再抗告狀，並繳納再抗告費新台幣1,000元。\n中    華    民    國    99    年    1     月    4     日\n                                 書記官  鄭美華",
  "structure": {
    "main": "抗告駁回。\n抗告程序費用新臺幣壹仟元由抗告人負擔。",
    "reason": "一、抗告意旨略以：抗告人前因損害賠償事件，而與相對人爭訟\n    （案號：95年度訴字第4183號），原審依此既肯認抗告人為\n    可知之公司債權人，相對人理應依公司法第286條之規定，\n    將重整裁定以書面送達予抗告人，詎伊等自始均未收到任何\n    准許相對人重整之裁定；兩造於前開訴訟事件中，自始即爭\n    執關於房屋於開工前是否已然傾斜，而相對人是否應負損害\n    賠償責任等事，為釐清責任歸屬，並委託台北市結構工程工\n    業技師公會進行鑑定，故可知兩造對於上開訴訟應否負責仍\n    存在爭執，並非不爭執，原審率認兩造就損害賠償請求權不\n    爭執，亦有違誤；查臺北市結構工程工業技師公會係於原審\n    准予相對人重整裁定之後，方於95年12月26日做出鑑定報告\n    ，足認本件債權乃發生在重整裁定之後，應屬重整債務；且\n    所謂重整債權係以財產上請求為限，今抗告人另有請求相對\n    人負擔扶正系爭房屋之作為義務，非屬財產上請求權至明，\n    故系爭申報債權案件，應無公司法第5章第10節公司重整規\n    定之適用。原裁定指抗告人至遲於96年3月28日即已知悉相\n    對人經准予重整情事，竟遲誤補申報債權期間，否准抗告人\n    申報債權，顯無理由，爰依法提起抗告。\n三、就本院是否已踐行法定通知程序部分\n  (一)按「法院為重整裁定後，應即公告左列事項：一、重整裁定\n    之主文及其年、月、日。二、重整監督人、重整人之姓名或\n    名稱、住址或處所。三、第二百八十九條第一項所定期間、\n    期日及場所。四、公司債權人及持有無記名股票之股東怠於\n    申報權利時，其法律效果。法院對於重整監督人、重整人、\n    公司、已知之公司債權人及股東，仍應將前項裁定及所列各\n    事項，以書面送達之」，公司法第291條第1、2項定有明文\n    。所謂「已知之公司債權人」，係指當時依重整案件卷內資\n    料已知其為債權人者，此觀公司法就重整債權之申報程序係\n    規定由重整公司提出債權人清冊，法院公告並送達重整裁定\n    ，由重整債權人申報債權，重整監督人初步審查，再由法院\n    審查債權，並無由法院職權調查之規定，即可得知。是以於\n    重整程序中，法院尚無依職權調查公司尚有何其他未經重整\n    公司列於債權人清冊，亦未遵期申報債權之重整債權人之義\n    務。縱債權人因另案與公司涉訟中，然若該債權人或公司均\n    未向法院陳報，依重整卷內資料，法院尚無從得知此一債權\n    人，自不能認為受理重整案件之法院已知此債權人，此債權\n    人不屬公司法第291條第2項所稱之「已知債權人」，法院亦\n    無庸對其送達重整裁定，合先敘明。\n  (二)經本院依職權調閱95年度整字第2號卷宗，相對人於重整程\n    序中所陳報之債權人名冊，並未將本件抗告人列於其內。抗\n    告人雖以其與相對人、第三人臺北市政府都市發展局間因承\n    攬工程瑕疵損害賠償事件涉訟，尚由本院以95年度訴字第\n    4183號案件審理中，抗告人應為相對人已知之公司債權人云\n    云，然查，於本院裁定准相對人重整時，相對人向本院陳報\n    之債權人清冊中，並未將抗告人列名其上，而抗告人亦未主\n    動向本院陳報其債權，自無從認為抗告人為公司法第291條\n    第2項所稱之「已知債權人」，是以本院未對其送達重整裁\n    定，尚無不合。至於本院因審理95年度訴字第4183號案件，\n    曾於96年3月23日以公函通知抗告人本件重整情事，並非重\n    整程序內所為之通知，尚不能執此認為抗告人為「已知債權\n    人」，併此敘明。\n四、就抗告人是否已遵期申報債權部分\n  (一)按「重整債權人，應提出足資證明其權利存在之文件，向重\n    整監督人申報，經申報者，其時效中斷；未經申報者，不得\n    依重整程序受清償。公司記名股東之權利，依股東名簿之記\n    載；無記名股東之權利，應準用前項規定申報，未經申報者\n    ，不得依重整程序，行使其權利。前二項應為申報之人，因\n    不可歸責於自己之事由，致未依限申報者，得於事由終止後\n    十五日內補報之。但重整計劃已經關係人會議可決時，不得\n    補報」，公司法第297條定有明文。\n  (二)本院95年度訴字第4183號案件曾於96年3月23日以公函通知\n    抗告人「被告德寶營造股份有限公司已經本院95年度整字第\n    2號裁定重整，依公司法第294條規定，本件訴訟程序應停止\n    ，請台端自行審酌重整程序之相關規定，以保障自身權益」\n    ，該函業於同月27日送達抗告人該案之訴訟代理人李淑寶律\n    師，業經本院依職權調閱95年度訴字第4183號案件卷宗審核\n    無誤。雖抗告人該案之訴訟代理人李淑寶律師當時並未受有\n    關重整案件之委任，惟就95年度訴字第4183號案件因重整而\n    停止訴訟程序一節，乃屬95年度訴字第4183號案件相關事項\n    ，法院就此對抗告人該案訴訟代理人李淑寶律師所為之通知\n    ，應認為亦已對抗告人發生效力，且依該通知之內容，業已\n    足使抗告人得悉重整裁定之存在，堪認抗告人至遲於96年3\n    月27日即知悉相對人業經裁定重整一事。而抗告人係於96\n    年7月11日始補行申報債權，顯已逾上開債權申報期間及補\n    報之15日，是以原裁定以抗告人係逾期申報債權，其補行申\n    報於法不合為由予以駁回，經核尚無不合。\n四、抗告人之債權需否適用重整程序部分\n  (一)對公司之債權，在重整裁定前成立者，為重整債權，公司法\n    第296條第1項定有明文。\n  (二)本件抗告人以相對人及第三人臺北市政府都市發展局造成其\n    房屋損害，請求扶正，係於95年4月10日即向本院起訴，經\n    本院以95年度訴字第4183號案件審理中。抗告人雖以本院係\n    於95年12月19日裁定准予相對人重整，而95年度訴字第4183\n    號案件係於95年12月26日始由鑑定人作成鑑定報告為由，主\n    張其債權成立於重整裁定後云云，然鑑定報告僅在確認損害\n    之有無及回復原狀之方法，以佐證抗告人於該案件之主張有\n    無理由而已，抗告人之債權若屬存在，亦係於房屋受損時即\n    已成立，並非因鑑定報告之作成始成立。抗告人既早於95\n    年4月10日即向本院起訴，顯見其房屋受損時間遠早於重整\n    裁定作成時，斷非重整裁定後使成立之債權，是以抗告人此\n    一主張顯屬無據。\n  (三)本件抗告人於原審申報之債權金額為400萬元，此有李淑寶\n    律師事務所函可考（見原審卷第10至11頁），核屬財產權訴\n    訟，且依抗告人起訴時間為95年4月10日及其起訴事實係因\n    其等向第三人臺北市政府都市發展局購買之房屋有繼續傾斜\n    之情事，相對人施工亦使房屋牆面等部位裂縫增大，依侵權\n    行為法律關係請求相對人及第三人臺北市政府都市發展局負\n    損害賠償責任，請求回復原狀（見原審卷第12至14頁），其\n    訴之聲明內容雖係請求扶正抗告人之房屋，並非請求給付金\n    錢，然所謂財產權訴訟，原不限於請求給付金錢或給付特定\n    財產，例如本於所有權請求拆屋還地、依公寓大廈管理條例\n    請求修復漏水，其請求之內容均屬特定作為，仍屬財產權訴\n    訟無疑。抗告人於95年度訴字第4183號案件之訴訟標的仍係\n    依民法第184條、第185條、第213條、第767條請求回復其房\n    屋所受損害之原狀，此有該案件起訴狀可稽，是抗告人主張\n    其所申報之債權係非財產權訴訟，不適用公司法第5章第10\n    節公司重整規定云云，亦有未洽。\n五、綜上所述，原審以抗告人未依限申報債權為由，將其申報之\n    債權全數予以剔除，洵無違誤。抗告意旨猶執前詞，指摘原\n    裁定不當，為無理由，應予駁回。\n六、據上論結，本件抗告為無理由，依非訟事件法第21條第2項\n    、第24條第1項、第46條、民事訴訟法第495條之1第1項、第\n    449條第1項、第78條，裁定如主文。"
  },
  "characters": {
    "judges": [
      "黃明發",
      "陳怡雯"
    ],
    "prosecutors": [

    ],
    "lawyers": [
      "李淑寶"
    ],
    "clerks": [

    ],
    "plaintiffs": [

    ],
    "defendants": [

    ],
    "prosecutor_office": [

    ],
    "creditors": [

    ],
    "debtors": [

    ],
    "judicial_associate_officer": [

    ]
  },
  "adjudged_at": "2010-01-04",
  "created_at": "2016-01-05 14:55:58",
  "updated_at": "2016-01-05 14:55:58"
}