{
  "identify": "TPD-98-審司聲-3425-20100104-1",
  "court": {
    "name": "臺灣臺北地方法院",
    "code": "TPD"
  },
  "division": {
    "name": "民事",
    "code": "V"
  },
  "year": 98,
  "word": "審司聲",
  "number": "3425",
  "jcheck": "1",
  "reason": "公示送達",
  "content": "臺灣臺北地方法院民事裁定          98年度審司聲字第3425號\n聲  請  人  寰辰資產管理股份有限公司\n法定代理人  丙○○\n代  理  人  乙○○\n相  對  人  甲○○\n上列聲請人聲請對相對人為公示送達事件，本院裁定如下：\n    主  文\n准將聲請人對相對人如附件所示意思表示之通知為公示送達。\n聲請費用新臺幣壹仟元及程序費用由相對人負擔。\n    理  由\n一、按表意人非因自己之過失不知相對人居所者，得依民事訴訟\n    法公示送達之規定，以公示送達為意思表示之通知，民法第\n    97條定有明文。\n二、本件聲請意旨略以：聲請人對相對人設籍地址寄發債權讓與\n    通知函，經郵務機構以招領逾期為由退回，爰聲請裁定准為\n    公示送達，並提出債權讓與證明書影本、債權讓與通知函、\n    信封、掛號郵件收件回執及戶籍謄本等件為證。\n三、經本院函請臺北市政府警察局文山第二分局派員查訪，相對\n    人僅設籍於戶籍址，惟未居住於該址，有該分局民國98年12\n    月21日北市警文二分戶字第09832515000號函在卷可稽。是\n    相對人之住居所已處於不明之狀態，從而，本件聲請核與首\n    揭法條規定相符，應予准許。\n四、依非訟事件法第21條第2項、第24條第1項、民事訴訟法第95\n    條及第78條，裁定如主文。\n五、如對本裁定抗告須於裁定送達後10日內向本院提出抗告狀，\n    並繳納抗告費新臺幣1,000元。\n【本件聯絡人：康股書記官（02）00000000分機6049】\n中    華    民    國    99    年    1    月    4    日\n                  民事第六庭    司法事務官  劉瑞宗",
  "structure": {
    "main": "准將聲請人對相對人如附件所示意思表示之通知為公示送達。\n聲請費用新臺幣壹仟元及程序費用由相對人負擔。",
    "reason": "一、按表意人非因自己之過失不知相對人居所者，得依民事訴訟\n    法公示送達之規定，以公示送達為意思表示之通知，民法第\n    97條定有明文。\n二、本件聲請意旨略以：聲請人對相對人設籍地址寄發債權讓與\n    通知函，經郵務機構以招領逾期為由退回，爰聲請裁定准為\n    公示送達，並提出債權讓與證明書影本、債權讓與通知函、\n    信封、掛號郵件收件回執及戶籍謄本等件為證。\n三、經本院函請臺北市政府警察局文山第二分局派員查訪，相對\n    人僅設籍於戶籍址，惟未居住於該址，有該分局民國98年12\n    月21日北市警文二分戶字第09832515000號函在卷可稽。是\n    相對人之住居所已處於不明之狀態，從而，本件聲請核與首\n    揭法條規定相符，應予准許。\n四、依非訟事件法第21條第2項、第24條第1項、民事訴訟法第95\n    條及第78條，裁定如主文。\n五、如對本裁定抗告須於裁定送達後10日內向本院提出抗告狀，\n    並繳納抗告費新臺幣1,000元。\n【本件聯絡人：康股書記官（02）00000000分機6049】"
  },
  "characters": {
    "judges": [

    ],
    "prosecutors": [

    ],
    "lawyers": [

    ],
    "clerks": [

    ],
    "plaintiffs": [

    ],
    "defendants": [

    ],
    "prosecutor_office": [
      "寰辰資產管理股份有限公司"
    ],
    "creditors": [

    ],
    "debtors": [

    ],
    "judicial_associate_officer": [
      "劉瑞宗"
    ]
  },
  "adjudged_at": "2010-01-04",
  "created_at": "2016-01-05 14:54:50",
  "updated_at": "2016-01-05 14:54:50"
}