{
  "identify": "TPD-99-聲-1074-20100512-1",
  "court": {
    "name": "臺灣臺北地方法院",
    "code": "TPD"
  },
  "division": {
    "name": "刑事",
    "code": "M"
  },
  "year": 99,
  "word": "聲",
  "number": "1074",
  "jcheck": "1",
  "reason": "聲請交付保護管束",
  "content": "臺灣臺北地方法院刑事裁定              99年度聲字第1074號\n聲  請  人  臺灣臺北地方法院檢察署檢察官\n受  刑  人  甲○○\n上列受刑人因聲請交付保護管束案件，經聲請人聲請付保護管束\n，本院裁定如下：\n    主  文\n甲○○假釋中付保護管束。\n    理  由\n一、聲請意旨略以：受刑人因搶奪等案件，經法院判處有期徒刑\n    7月、10月、6月、6月及有期徒刑4月，經定刑後，目前在臺\n    灣雲林第二監獄執行有期徒刑2年7月中。受刑人於民國99年\n    4月23日經法務部法矯字第0999015565號核准假釋在案，依\n    刑法第93條第2項之規定，其假釋中應付保護管束。爰依刑\n    事訴訟法第481條聲請裁定。\n二、本院審核相關文件，認聲請為正當。爰依刑事訴訟法第481\n    條第1項、刑法第93條第2項、第96條但書規定，裁定如主文\n    。\n中    華    民    國    99    年    5     月    12    日\n                  刑事第四庭    法  官  李桂英\n上正本證明與原本無異。\n如不服本裁定，應於送達後5日內向本院提出抗告狀。\n                                書記官  嚴君珮\n中    華    民    國    99    年    5     月    12    日",
  "structure": {
    "main": "甲○○假釋中付保護管束。",
    "reason": "一、聲請意旨略以：受刑人因搶奪等案件，經法院判處有期徒刑\n    7月、10月、6月、6月及有期徒刑4月，經定刑後，目前在臺\n    灣雲林第二監獄執行有期徒刑2年7月中。受刑人於民國99年\n    4月23日經法務部法矯字第0999015565號核准假釋在案，依\n    刑法第93條第2項之規定，其假釋中應付保護管束。爰依刑\n    事訴訟法第481條聲請裁定。\n二、本院審核相關文件，認聲請為正當。爰依刑事訴訟法第481\n    條第1項、刑法第93條第2項、第96條但書規定，裁定如主文\n    。"
  },
  "characters": {
    "judges": [
      "李桂英"
    ],
    "prosecutors": [

    ],
    "lawyers": [

    ],
    "clerks": [
      "嚴君珮"
    ],
    "plaintiffs": [

    ],
    "defendants": [

    ],
    "prosecutor_office": [
      "臺灣臺北地方法院檢察署檢察官"
    ],
    "creditors": [

    ],
    "debtors": [

    ],
    "judicial_associate_officer": [

    ]
  },
  "adjudged_at": "2010-05-12",
  "created_at": "2016-01-05 12:05:02",
  "updated_at": "2016-01-05 12:05:02"
}