{
  "identify": "TPD-98-審補-1099-20100512-2",
  "court": {
    "name": "臺灣臺北地方法院",
    "code": "TPD"
  },
  "division": {
    "name": "民事",
    "code": "V"
  },
  "year": 98,
  "word": "審補",
  "number": "1099",
  "jcheck": "2",
  "reason": "塗銷勞工名卡記載",
  "content": "臺灣臺北地方法院民事裁定            98年度審補字第1099號\n原      告  乙○○\n被      告  華南商業銀行股份有限公司\n法定代理人  甲○○\n上列當事人間因塗銷勞工名卡記載事件，原告起訴未據繳納裁判\n費，查本件原告聲明請求：(一)被告於民國83年12月7 日以人二\n字第9342號函對原告所為申誡一次處分應予塗銷；(二)被告於90年\n1 月16日以人一字第00600 號函考核評列原告丙等，應予塗銷\n；(三)被告於91年2 月7 日以(91)人一字第01500 號函考核評列原\n告丙等，應予塗銷；(四)被告於92年1 月28日以(92)人一字第0080\n0 號函考核評列原告丙等，應予塗銷；(五)被告於92年10月23日所\n發(92)人二字第10639 號函（限期催告原告自請退休）、於92年\n11月28日所發(92)人二字第12075 號函（資遣原告），應予塗銷\n，以回復原告未受上開各處分之狀態，因原告前開請求均涉及原\n告身為勞工之人格權或身分關係，屬非因財產權涉訟，依民事訴\n訟法第77條之14第1 項規定，應各徵裁判費新台幣（下同）3,00\n0 元，合計應徵裁判費15,000元。茲依民事訴訟法第249 條第1\n項但書之規定，限原告於收受本裁定送達5 日內補繳，逾期不繳\n，即駁回其訴，特此裁定。\n中    華    民    國    99    年    5     月    12    日\n                  民事第六庭法  官  蔡和憲\n上為正本係照原本作成。\n如不服本裁定關於核定訴訟標的價額部分，應於送達後10日內向\n本院提出抗告狀，並繳納抗告費新臺幣1,000 元；其餘關於命補\n繳裁判費部分，不得抗告。\n中    華    民    國    99    年    5     月    12    日\n                            書記官  廖素芳",
  "structure": {
  },
  "characters": {
    "judges": [
      "蔡和憲"
    ],
    "prosecutors": [

    ],
    "lawyers": [

    ],
    "clerks": [

    ],
    "plaintiffs": [
      "乙○○"
    ],
    "defendants": [
      "華南商業銀行股份有限公司"
    ],
    "prosecutor_office": [

    ],
    "creditors": [

    ],
    "debtors": [

    ],
    "judicial_associate_officer": [

    ]
  },
  "adjudged_at": "2010-05-12",
  "created_at": "2016-01-05 12:11:15",
  "updated_at": "2016-01-05 12:11:15"
}