{
  "identify": "TPD-99-撤緩-44-20100512-1",
  "court": {
    "name": "臺灣臺北地方法院",
    "code": "TPD"
  },
  "division": {
    "name": "刑事",
    "code": "M"
  },
  "year": 99,
  "word": "撤緩",
  "number": "44",
  "jcheck": "1",
  "reason": "聲請撤銷緩刑",
  "content": "臺灣臺北地方法院刑事裁定              99年度撤緩字第44號\n聲  請  人  臺灣臺北地方法院檢察署檢察官\n受  刑  人  甲○○\n上列聲請人因受刑人甲○○妨害兵役治罪條例案件（九十七年度\n簡字第三一四０號），聲請撤銷緩刑之宣告（九十九年度執聲字\n第八００號、九十七年度執他字第三七三五號），本院裁定如下\n：\n    主  文\n甲○○之緩刑宣告撤銷。\n    理  由\n一、本件聲請意旨略以：受刑人甲○○因犯妨害兵役治罪條例案\n    件，經本院於民國九十七年八月二十日，以九十七年度簡字\n    第三一四０號（臺灣臺北地方法院檢察署九十六年度偵字第\n    二三四三一號）判處有期徒刑二月、緩刑二年，於九十七年\n    九月二十二日確定在案。竟又於緩刑期內即九十八年五月間\n    更犯竊盜罪，情節非微，經臺灣臺中地方法院於九十九年一\n    月二十九日，以九十九年度中簡字第六三號判決處有期徒刑\n    三月，並於九十九年三月二十五日確定。足見受刑人並非一\n    時失慮，且更違反先前以受刑人「經此教訓，當知所惕勵，\n    應無再犯之虞」而判決緩刑之基本目的，而有刑法第七十五\n    條之一「足認原宣告之緩刑難收其預期效果，而有執行刑罰\n    之必要」甚明，得撤銷先前之緩刑宣告，爰依刑事訴訟法第\n    四百七十六條規定聲請撤銷先前之緩刑宣告。\n二、按刑法第七十五條之一第一項明文：「受緩刑之宣告而有下\n    列情形之一，足認原宣告之緩刑難收其預期效果，而有執行\n    刑罰之必要者，得撤銷其宣告：一、緩刑前因故意犯他罪，\n    而在緩刑期內受得易科罰金之有期徒刑、拘役或罰金之宣告\n    確定者。二、緩刑期內因故意犯他罪，而在緩刑期內受得易\n    科罰金之有期徒刑、拘役或罰金之宣告確定者。三、緩刑期\n    內因過失更犯罪，而在緩刑期內受有期徒刑之宣告確定者。\n    ……」。經查，本件受刑人犯罪後，前經本院於九十七年八\n    月二十日，以九十七年度簡字第三一四０號刑事簡易判決處\n    有期徒刑二月，緩刑二年，於九十七年九月二十二日確定。\n    惟其於緩刑期內即九十八年五月五日更犯竊盜罪，並經臺灣\n    臺中地方法院於九十九年一月二十九日，以九十九年度中簡\n    字第六三號刑事簡易判決處有期徒刑三月，並於九十九年三\n    月二十五日確定，此有上開臺灣臺中地方法院、本院刑事簡\n    易判決及臺灣高等法院被告前案紀錄表在卷可稽。復查受刑\n    人尚因竊盜案，於九十八年十一月十九日，經臺灣臺中地方\n    法院以九十八年度中簡字第三五三三號刑事簡易判決處應執\n    行有期徒刑三月確定，亦有前開臺灣高等法院被告前案紀錄\n    表及臺灣臺中地方法院刑事簡易判決各一紙附卷可佐，此雖\n    未經聲請人據為聲請理由之一，惟均足認受刑人確於緩刑期\n    內故意犯他罪，而在緩刑期內受得易科罰金之有期徒刑之宣\n    告確定。爰審酌受刑人前犯役齡男子意圖避免徵兵處理，徵\n    兵檢查無故不到罪，經原審法院認係一時失慮偶罹刑章，此\n    後應能知所警惕，信無再犯之虞，詎受刑人竟於緩刑期內，\n    又分別於九十八年四月三日、四月十一日、五月五日多次再\n    犯竊盜罪，顯見原宣告之緩刑難收其預期效果，而有執行刑\n    罰之必要，符合刑法第七十五條之一第一項第二款之規定，\n    得撤銷其緩刑之宣告，因認本件聲請係屬正當，應予准許，\n    爰裁定如主文所示。\n三、據上論斷，應依刑事訴訟法第四百七十六條，刑法第七十五\n    條之一第一項第二款，裁定如主文。\n中    華    民    國    99    年    5     月    12    日\n                  刑事第八庭    法  官  詹慶堂\n以上正本證明與原本無異。\n如不服本裁定，應於裁定送達後5 日內向本院提出抗告狀。\n                                書記官  蔡易霖\n中    華    民    國    99    年    5     月    12    日",
  "structure": {
    "main": "甲○○之緩刑宣告撤銷。",
    "reason": "一、本件聲請意旨略以：受刑人甲○○因犯妨害兵役治罪條例案\n    件，經本院於民國九十七年八月二十日，以九十七年度簡字\n    第三一四０號（臺灣臺北地方法院檢察署九十六年度偵字第\n    二三四三一號）判處有期徒刑二月、緩刑二年，於九十七年\n    九月二十二日確定在案。竟又於緩刑期內即九十八年五月間\n    更犯竊盜罪，情節非微，經臺灣臺中地方法院於九十九年一\n    月二十九日，以九十九年度中簡字第六三號判決處有期徒刑\n    三月，並於九十九年三月二十五日確定。足見受刑人並非一\n    時失慮，且更違反先前以受刑人「經此教訓，當知所惕勵，\n    應無再犯之虞」而判決緩刑之基本目的，而有刑法第七十五\n    條之一「足認原宣告之緩刑難收其預期效果，而有執行刑罰\n    之必要」甚明，得撤銷先前之緩刑宣告，爰依刑事訴訟法第\n    四百七十六條規定聲請撤銷先前之緩刑宣告。\n二、按刑法第七十五條之一第一項明文：「受緩刑之宣告而有下\n    列情形之一，足認原宣告之緩刑難收其預期效果，而有執行\n    刑罰之必要者，得撤銷其宣告：一、緩刑前因故意犯他罪，\n    而在緩刑期內受得易科罰金之有期徒刑、拘役或罰金之宣告\n    確定者。二、緩刑期內因故意犯他罪，而在緩刑期內受得易\n    科罰金之有期徒刑、拘役或罰金之宣告確定者。三、緩刑期\n    內因過失更犯罪，而在緩刑期內受有期徒刑之宣告確定者。\n    ……」。經查，本件受刑人犯罪後，前經本院於九十七年八\n    月二十日，以九十七年度簡字第三一四０號刑事簡易判決處\n    有期徒刑二月，緩刑二年，於九十七年九月二十二日確定。\n    惟其於緩刑期內即九十八年五月五日更犯竊盜罪，並經臺灣\n    臺中地方法院於九十九年一月二十九日，以九十九年度中簡\n    字第六三號刑事簡易判決處有期徒刑三月，並於九十九年三\n    月二十五日確定，此有上開臺灣臺中地方法院、本院刑事簡\n    易判決及臺灣高等法院被告前案紀錄表在卷可稽。復查受刑\n    人尚因竊盜案，於九十八年十一月十九日，經臺灣臺中地方\n    法院以九十八年度中簡字第三五三三號刑事簡易判決處應執\n    行有期徒刑三月確定，亦有前開臺灣高等法院被告前案紀錄\n    表及臺灣臺中地方法院刑事簡易判決各一紙附卷可佐，此雖\n    未經聲請人據為聲請理由之一，惟均足認受刑人確於緩刑期\n    內故意犯他罪，而在緩刑期內受得易科罰金之有期徒刑之宣\n    告確定。爰審酌受刑人前犯役齡男子意圖避免徵兵處理，徵\n    兵檢查無故不到罪，經原審法院認係一時失慮偶罹刑章，此\n    後應能知所警惕，信無再犯之虞，詎受刑人竟於緩刑期內，\n    又分別於九十八年四月三日、四月十一日、五月五日多次再\n    犯竊盜罪，顯見原宣告之緩刑難收其預期效果，而有執行刑\n    罰之必要，符合刑法第七十五條之一第一項第二款之規定，\n    得撤銷其緩刑之宣告，因認本件聲請係屬正當，應予准許，\n    爰裁定如主文所示。\n三、據上論斷，應依刑事訴訟法第四百七十六條，刑法第七十五\n    條之一第一項第二款，裁定如主文。"
  },
  "characters": {
    "judges": [
      "詹慶堂"
    ],
    "prosecutors": [

    ],
    "lawyers": [

    ],
    "clerks": [
      "蔡易霖"
    ],
    "plaintiffs": [

    ],
    "defendants": [

    ],
    "prosecutor_office": [
      "臺灣臺北地方法院檢察署檢察官"
    ],
    "creditors": [

    ],
    "debtors": [

    ],
    "judicial_associate_officer": [

    ]
  },
  "adjudged_at": "2010-05-12",
  "created_at": "2016-01-05 12:04:58",
  "updated_at": "2016-01-05 12:04:58"
}