{
  "identify": "TPD-99-撤緩-47-20100512-1",
  "court": {
    "name": "臺灣臺北地方法院",
    "code": "TPD"
  },
  "division": {
    "name": "刑事",
    "code": "M"
  },
  "year": 99,
  "word": "撤緩",
  "number": "47",
  "jcheck": "1",
  "reason": "聲請撤銷緩刑",
  "content": "臺灣臺北地方法院刑事裁定              99年度撤緩字第47號\n聲  請  人  臺灣臺北地方法院檢察署檢察官\n受  刑  人  甲○○\n上列聲請人因聲請撤銷受刑人甲○○所受緩刑宣告案件，本院裁\n定如下：\n    主  文\n甲○○之緩刑宣告撤銷。\n    理  由\n一、本件聲請意旨略以：受刑人甲○○因犯妨害性自主罪案件，\n    經臺灣板橋地方法院於民國99年1 月13日以98年訴字第4451\n    號刑事判決(98年偵字第31267號) 判處有期徒刑7月，緩刑3\n    年，並向被害人張宇婷支付新臺幣(下同)20萬元(99年4月22\n    日前支付5萬元，其後每月5日前各支付1萬元），嗣於99年2\n    月22日確定在案。嗣經臺灣板橋地方法院檢察署以99年度執\n    緩字第106 號案件，函請受刑人依判決履行給付，竟置之不\n    理，且被害人具狀陳報檢察官聲請撤銷緩刑，足見受刑人並\n    非一時失慮，且違反判決緩刑之基本目的，而有刑法第74條\n    第2項第3款且情節重大之情形，得撤銷緩刑宣告之原因。核\n    該受刑人所為，已合於刑法第75條之1第1 項第4款所定得撤\n    銷緩刑宣告之原因，爰依刑事訴訟法第476 條規定，聲請撤\n    銷等語。\n二、按刑法第75條之1第1項規定「受緩刑之宣告而有下列情形之\n    一，足認原宣告之緩刑難收其預期效果，而有執行刑罰之必\n    要者，得撤銷其宣告：一、緩刑前因故意犯他罪，而在緩刑\n    期內受得易科罰金之有期徒刑、拘役或罰金之宣告確定者。\n    二、緩刑期內因故意犯他罪，而在緩刑期內受得易科罰金之\n    有期徒刑、拘役或罰金之宣告確定者。三、緩刑期內因過失\n    更犯罪，而在緩刑期內受有期徒刑之宣告確定者。四、違反\n    第74條第2 項第1款至第8款所定負擔情節重大者」，且「緩\n    刑之宣告應撤銷者，由受刑人所在地或其最後住所地之地方\n    法院檢察官聲請該法院裁定之」，亦為刑事訴訟法第476 條\n    之明文。\n三、經查：本件受刑人甲○○因犯妨害性自主罪案件，經臺灣板\n    橋地方法院於99年1月13日以98年訴字第4451號刑事判決(臺\n    灣板橋地方法院檢察署98年偵字第31267號）判處有期徒刑7\n    月，緩刑3年，並應向被害人張宇婷支付20萬元（99年4月22\n    日前支付5萬元，其後每月5日前各支付1萬元），嗣於99年2\n    月22日確定確定(即緩刑期間之起算)在案；惟其後迭經臺灣\n    板橋地方法院檢察署以99年度執緩字第106 號案件，函請受\n    刑人依判決履行給付，被害人具狀陳報檢察官聲請撤銷緩刑\n    ，均未見受刑人履行其給付義務，此有前述妨害性自主罪案\n    件判決、臺灣高等法院被告前案紀錄表、臺灣板橋地方法院\n    檢察署催請受刑人履行給付函併送達證書及被害人申請撤銷\n    被告緩刑狀在卷足憑，足認受刑人違反負擔情節重大，所受\n    前開宣告之緩刑，已難收其預期效果，當有執行刑罰之必要\n    ，故核與刑法第75條之1第1 項第4款之規定相符，自應撤銷\n    其緩刑之宣告。是聲請人之聲請，核屬允當，受刑人前開緩\n    刑之宣告應予以撤銷。\n四、依刑事訴訟法第476條，裁定如主文。\n中    華    民    國    99    年    5     月    12    日\n                  刑事第四庭    法  官  呂政燁\n以上正本證明與原本無異。\n如不服本裁定，應於送達後5日內，向本院提出抗告狀。\n                                書記官  呂欣穎\n中    華    民    國    99    年    5     月    12    日",
  "structure": {
    "main": "甲○○之緩刑宣告撤銷。",
    "reason": "一、本件聲請意旨略以：受刑人甲○○因犯妨害性自主罪案件，\n    經臺灣板橋地方法院於民國99年1 月13日以98年訴字第4451\n    號刑事判決(98年偵字第31267號) 判處有期徒刑7月，緩刑3\n    年，並向被害人張宇婷支付新臺幣(下同)20萬元(99年4月22\n    日前支付5萬元，其後每月5日前各支付1萬元），嗣於99年2\n    月22日確定在案。嗣經臺灣板橋地方法院檢察署以99年度執\n    緩字第106 號案件，函請受刑人依判決履行給付，竟置之不\n    理，且被害人具狀陳報檢察官聲請撤銷緩刑，足見受刑人並\n    非一時失慮，且違反判決緩刑之基本目的，而有刑法第74條\n    第2項第3款且情節重大之情形，得撤銷緩刑宣告之原因。核\n    該受刑人所為，已合於刑法第75條之1第1 項第4款所定得撤\n    銷緩刑宣告之原因，爰依刑事訴訟法第476 條規定，聲請撤\n    銷等語。\n二、按刑法第75條之1第1項規定「受緩刑之宣告而有下列情形之\n    一，足認原宣告之緩刑難收其預期效果，而有執行刑罰之必\n    要者，得撤銷其宣告：一、緩刑前因故意犯他罪，而在緩刑\n    期內受得易科罰金之有期徒刑、拘役或罰金之宣告確定者。\n    二、緩刑期內因故意犯他罪，而在緩刑期內受得易科罰金之\n    有期徒刑、拘役或罰金之宣告確定者。三、緩刑期內因過失\n    更犯罪，而在緩刑期內受有期徒刑之宣告確定者。四、違反\n    第74條第2 項第1款至第8款所定負擔情節重大者」，且「緩\n    刑之宣告應撤銷者，由受刑人所在地或其最後住所地之地方\n    法院檢察官聲請該法院裁定之」，亦為刑事訴訟法第476 條\n    之明文。\n三、經查：本件受刑人甲○○因犯妨害性自主罪案件，經臺灣板\n    橋地方法院於99年1月13日以98年訴字第4451號刑事判決(臺\n    灣板橋地方法院檢察署98年偵字第31267號）判處有期徒刑7\n    月，緩刑3年，並應向被害人張宇婷支付20萬元（99年4月22\n    日前支付5萬元，其後每月5日前各支付1萬元），嗣於99年2\n    月22日確定確定(即緩刑期間之起算)在案；惟其後迭經臺灣\n    板橋地方法院檢察署以99年度執緩字第106 號案件，函請受\n    刑人依判決履行給付，被害人具狀陳報檢察官聲請撤銷緩刑\n    ，均未見受刑人履行其給付義務，此有前述妨害性自主罪案\n    件判決、臺灣高等法院被告前案紀錄表、臺灣板橋地方法院\n    檢察署催請受刑人履行給付函併送達證書及被害人申請撤銷\n    被告緩刑狀在卷足憑，足認受刑人違反負擔情節重大，所受\n    前開宣告之緩刑，已難收其預期效果，當有執行刑罰之必要\n    ，故核與刑法第75條之1第1 項第4款之規定相符，自應撤銷\n    其緩刑之宣告。是聲請人之聲請，核屬允當，受刑人前開緩\n    刑之宣告應予以撤銷。\n四、依刑事訴訟法第476條，裁定如主文。"
  },
  "characters": {
    "judges": [
      "呂政燁"
    ],
    "prosecutors": [

    ],
    "lawyers": [

    ],
    "clerks": [
      "呂欣穎"
    ],
    "plaintiffs": [

    ],
    "defendants": [

    ],
    "prosecutor_office": [
      "臺灣臺北地方法院檢察署檢察官"
    ],
    "creditors": [

    ],
    "debtors": [

    ],
    "judicial_associate_officer": [

    ]
  },
  "adjudged_at": "2010-05-12",
  "created_at": "2016-01-05 12:04:37",
  "updated_at": "2016-01-05 12:04:37"
}