{
  "identify": "TPD-98-審司聲-3391-20100104-1",
  "court": {
    "name": "臺灣臺北地方法院",
    "code": "TPD"
  },
  "division": {
    "name": "民事",
    "code": "V"
  },
  "year": 98,
  "word": "審司聲",
  "number": "3391",
  "jcheck": "1",
  "reason": "返還提存物",
  "content": "臺灣臺北地方法院民事裁定          98年度審司聲字第3391號\n聲  請  人  華南商業銀行股份有限公司\n法定代理人  甲○○\n代  理  人  乙○○\n相  對  人  佳鑫國際多媒體有限公司\n兼法定代理  丙○○\n人\n相  對  人  丁○○\n上列聲請人聲請返還提存物事件，本院裁定如下：\n    主  文\n臺灣板橋地方法院九十八年度存字第三一○五號提存事件，聲請\n人所提存之新臺幣肆拾柒萬元整，准予返還。\n    理  由\n一、按供擔保人證明受擔保利益人同意返還者，法院應依供擔保\n    人之聲請，以裁定命返還其提存物，民事訴訟法第104條第1\n    項第2款定有明文。上開規定，於其他依法令供訴訟上之擔\n    保者準用之，並為同法第106條所明定。\n二、本件聲請意旨略以：聲請人前遵鈞院98年度裁全字第6449號\n    民事裁定，為擔保假扣押，曾提存新臺幣47萬元，並以臺灣\n    板橋地方法院（下稱板橋地院）98年度存字第3105號提存事\n    件提存在案；茲因相對人出具同意書及印鑑證明書予聲請人\n    ，同意聲請人領回其所提存之上開提存物，爰聲請返還本件\n    提存物。\n三、聲請人上開聲請，業據提出提存書影本、同意書、公司變更\n    登記表及印鑑證明等件為證，並經本院依職權調閱板橋地院\n    98年度存字第3105號卷宗，核無不合，是本件聲請應予准許\n    。\n四、如不服本裁定，應於裁定送達後10日內，以書狀向本院司法\n    事務官提出異議。\n【本件聯絡人：康股書記官（02）00000000分機6049】\n中    華    民    國    99    年    1    月    4    日\n                  民事第六庭    司法事務官  劉瑞宗",
  "structure": {
    "main": "臺灣板橋地方法院九十八年度存字第三一○五號提存事件，聲請\n人所提存之新臺幣肆拾柒萬元整，准予返還。",
    "reason": "一、按供擔保人證明受擔保利益人同意返還者，法院應依供擔保\n    人之聲請，以裁定命返還其提存物，民事訴訟法第104條第1\n    項第2款定有明文。上開規定，於其他依法令供訴訟上之擔\n    保者準用之，並為同法第106條所明定。\n二、本件聲請意旨略以：聲請人前遵鈞院98年度裁全字第6449號\n    民事裁定，為擔保假扣押，曾提存新臺幣47萬元，並以臺灣\n    板橋地方法院（下稱板橋地院）98年度存字第3105號提存事\n    件提存在案；茲因相對人出具同意書及印鑑證明書予聲請人\n    ，同意聲請人領回其所提存之上開提存物，爰聲請返還本件\n    提存物。\n三、聲請人上開聲請，業據提出提存書影本、同意書、公司變更\n    登記表及印鑑證明等件為證，並經本院依職權調閱板橋地院\n    98年度存字第3105號卷宗，核無不合，是本件聲請應予准許\n    。\n四、如不服本裁定，應於裁定送達後10日內，以書狀向本院司法\n    事務官提出異議。\n【本件聯絡人：康股書記官（02）00000000分機6049】"
  },
  "characters": {
    "judges": [

    ],
    "prosecutors": [

    ],
    "lawyers": [

    ],
    "clerks": [

    ],
    "plaintiffs": [

    ],
    "defendants": [

    ],
    "prosecutor_office": [
      "華南商業銀行股份有限公司"
    ],
    "creditors": [

    ],
    "debtors": [

    ],
    "judicial_associate_officer": [
      "劉瑞宗"
    ]
  },
  "adjudged_at": "2010-01-04",
  "created_at": "2016-01-05 14:44:39",
  "updated_at": "2016-01-05 14:44:39"
}