{
  "identify": "TPD-99-審重訴-153-20100512-2",
  "court": {
    "name": "臺灣臺北地方法院",
    "code": "TPD"
  },
  "division": {
    "name": "民事",
    "code": "V"
  },
  "year": 99,
  "word": "審重訴",
  "number": "153",
  "jcheck": "2",
  "reason": "清償借款",
  "content": "臺灣臺北地方法院民事判決           99年度審重訴字第153號\n    原      告  合作金庫商業銀行股份有限公司\n    法定代理人  丁○○\n    訴訟代理人  乙○○\n    被      告  歐庄國際企業有限公司\n  兼法定代理人  甲○○\n    被      告  丙○○原名陳.\n上列當事人間清償借款事件，經本院於中華民國99年5月4日言詞\n辯論終結，判決如下：\n    主  文\n被告應連帶給付原告美金貳拾萬壹仟玖佰壹拾玖元角，及如\n附表編號一、二所示之利息及違約金。\n被告應連帶給付原告新台幣佰萬元，及如附表編號三所示之利\n息及違約金。\n訴訟費用新台幣壹拾萬肆仟零柒拾貳元由被告連帶負擔。\n    事實及理由\n一、本件依兩造簽訂之授信約定書第14條及連帶保證書之約定，\n    雙方合意以臺灣臺北地方法院為第一審管轄法院，故本院自\n    有管轄權。又本件被告未於言詞辯論期日到場，核無民事訴\n    訟法第386 條所列各款情形，應依原告之聲請，由其一造辯\n    論而為判決。\n二、原告起訴主張：被告歐庄國際企業有限公司（下稱歐庄公司\n    ）邀同被告甲○○及丙○○為連帶保證人，分別於民國98年\n    2月25日及98年9月28日與原告簽訂進口遠期信用狀借款契約\n    ，約定對於被告歐庄公司在與原告銀行辦理遠期信用狀方式\n    之進口，向國外採購物資分別以美金14萬元及美金10萬元為\n    限額，借款期間分別自98年2月25日起至99年7月25日止及自\n    98年9月28日起至99年9月28日止，每筆遠期信用狀項下匯票\n    或借款期限，自發票日起或原告國外代理銀行付款之日起算\n    ，最長不得超過150 日，利息自原告或原告國外代理銀行付\n    款之日起至借款到期日止，按原告通知利率支付，並得依照\n    原告借入外匯資金成本加碼利率隨時調整之，到期不履行時\n    ，即喪失期限利益，其債務視為全部到期，除按原告通知之\n    一般外匯授信利率支付遲延利息外，逾期在6 個月以內部分\n    ，按上開約定利率10%，逾期超過6個月部分，按上開約定利\n    率20 %加付違約金。嗣被告歐庄公司分別於98年6月2日、90\n    年7月10日、98年7月16日、98年7月29日、98年7月29日、98\n    年8月27日、98年9月28日、98年10月23日、98年5月18日、9\n    8年6月2日、98年6月19日、98年6月24日、98 年9月3日簽立\n    開發信用狀申請書，到單金額分別為美金13,622元、美金12\n    ,134元、美金8,412元、美金6,577元、美金22,986元、美金\n    12,524元、美金37,013.8元、美金21,846元、美金12,819元\n    、美金25,522.5元、美金9,150元、美金43,495元及美金5,8\n    18元。被告歐庄公司另邀同被告甲○○及丙○○為連帶保證\n    人，約定在新台幣2,000 萬元限額內負連帶償還責任，嗣被\n    告歐庄公司於98年9月25日起至99年9月25日止，並依原告定\n    儲指數利率加碼年息4.39 %機動計息，遲延履行時，除均按\n    上開利率計息外，逾期在6個月以內，按上開利息10%，逾期\n    超過6個月部分，則按上開利息20%加計違約金，並喪失期限\n    利益，債務視同全部到期。詎被告歐庄公司於98年11月27日\n    經票據交換所公告為拒絕往來戶，尚積欠新台幣300 萬元、\n    美金231,919.30元及如附表所示之利息及違約金，屢經催討\n    ，未獲置理，為此提起本件訴訟等情。並聲明：如主文所示\n    。\n三、被告未於言詞辯論期日到場，亦未提出書狀作何聲明或陳述\n    。\n四、本件原告主張之事實，已據其提出本票、進口遠期信用狀借\n    款契約、授信約定書、連帶保證書、開發信用狀申請書暨進\n    口單據到達處理紀錄單及原告定儲指數利率變動表等影本為\n    證，經核與其所述情節相符，堪信為真實。從而，原告依消\n    費借貸及連帶保證之法律關係請求被告連帶給付如主文所示\n    之本金、利息及違約金，為有理由，應予准許。\n五、本件訴訟費用額確定為新台幣104,072元。\n六、訴訟費用負擔之依據：民事訴訟法第85條第2項。\n中    華    民    國    99    年    5     月    12    日\n                        民事第六庭法官  傅中樂\n以上正本係照原本作成。\n如對本判決上訴，須於判決送達後20日內向本院提出上訴狀。\n中    華    民    國    99    年    5     月    12    日\n                                書記官  王文心",
  "structure": {
    "main": "被告應連帶給付原告美金貳拾萬壹仟玖佰壹拾玖元角，及如\n附表編號一、二所示之利息及違約金。\n被告應連帶給付原告新台幣佰萬元，及如附表編號三所示之利\n息及違約金。\n訴訟費用新台幣壹拾萬肆仟零柒拾貳元由被告連帶負擔。",
    "fact": "一、本件依兩造簽訂之授信約定書第14條及連帶保證書之約定，\n    雙方合意以臺灣臺北地方法院為第一審管轄法院，故本院自\n    有管轄權。又本件被告未於言詞辯論期日到場，核無民事訴\n    訟法第386 條所列各款情形，應依原告之聲請，由其一造辯\n    論而為判決。\n二、原告起訴主張：被告歐庄國際企業有限公司（下稱歐庄公司\n    ）邀同被告甲○○及丙○○為連帶保證人，分別於民國98年\n    2月25日及98年9月28日與原告簽訂進口遠期信用狀借款契約\n    ，約定對於被告歐庄公司在與原告銀行辦理遠期信用狀方式\n    之進口，向國外採購物資分別以美金14萬元及美金10萬元為\n    限額，借款期間分別自98年2月25日起至99年7月25日止及自\n    98年9月28日起至99年9月28日止，每筆遠期信用狀項下匯票\n    或借款期限，自發票日起或原告國外代理銀行付款之日起算\n    ，最長不得超過150 日，利息自原告或原告國外代理銀行付\n    款之日起至借款到期日止，按原告通知利率支付，並得依照\n    原告借入外匯資金成本加碼利率隨時調整之，到期不履行時\n    ，即喪失期限利益，其債務視為全部到期，除按原告通知之\n    一般外匯授信利率支付遲延利息外，逾期在6 個月以內部分\n    ，按上開約定利率10%，逾期超過6個月部分，按上開約定利\n    率20 %加付違約金。嗣被告歐庄公司分別於98年6月2日、90\n    年7月10日、98年7月16日、98年7月29日、98年7月29日、98\n    年8月27日、98年9月28日、98年10月23日、98年5月18日、9\n    8年6月2日、98年6月19日、98年6月24日、98 年9月3日簽立\n    開發信用狀申請書，到單金額分別為美金13,622元、美金12\n    ,134元、美金8,412元、美金6,577元、美金22,986元、美金\n    12,524元、美金37,013.8元、美金21,846元、美金12,819元\n    、美金25,522.5元、美金9,150元、美金43,495元及美金5,8\n    18元。被告歐庄公司另邀同被告甲○○及丙○○為連帶保證\n    人，約定在新台幣2,000 萬元限額內負連帶償還責任，嗣被\n    告歐庄公司於98年9月25日起至99年9月25日止，並依原告定\n    儲指數利率加碼年息4.39 %機動計息，遲延履行時，除均按\n    上開利率計息外，逾期在6個月以內，按上開利息10%，逾期\n    超過6個月部分，則按上開利息20%加計違約金，並喪失期限\n    利益，債務視同全部到期。詎被告歐庄公司於98年11月27日\n    經票據交換所公告為拒絕往來戶，尚積欠新台幣300 萬元、\n    美金231,919.30元及如附表所示之利息及違約金，屢經催討\n    ，未獲置理，為此提起本件訴訟等情。並聲明：如主文所示\n    。\n三、被告未於言詞辯論期日到場，亦未提出書狀作何聲明或陳述\n    。\n四、本件原告主張之事實，已據其提出本票、進口遠期信用狀借\n    款契約、授信約定書、連帶保證書、開發信用狀申請書暨進\n    口單據到達處理紀錄單及原告定儲指數利率變動表等影本為\n    證，經核與其所述情節相符，堪信為真實。從而，原告依消\n    費借貸及連帶保證之法律關係請求被告連帶給付如主文所示\n    之本金、利息及違約金，為有理由，應予准許。\n五、本件訴訟費用額確定為新台幣104,072元。\n六、訴訟費用負擔之依據：民事訴訟法第85條第2項。",
    "reason": "一、本件依兩造簽訂之授信約定書第14條及連帶保證書之約定，\n    雙方合意以臺灣臺北地方法院為第一審管轄法院，故本院自\n    有管轄權。又本件被告未於言詞辯論期日到場，核無民事訴\n    訟法第386 條所列各款情形，應依原告之聲請，由其一造辯\n    論而為判決。\n二、原告起訴主張：被告歐庄國際企業有限公司（下稱歐庄公司\n    ）邀同被告甲○○及丙○○為連帶保證人，分別於民國98年\n    2月25日及98年9月28日與原告簽訂進口遠期信用狀借款契約\n    ，約定對於被告歐庄公司在與原告銀行辦理遠期信用狀方式\n    之進口，向國外採購物資分別以美金14萬元及美金10萬元為\n    限額，借款期間分別自98年2月25日起至99年7月25日止及自\n    98年9月28日起至99年9月28日止，每筆遠期信用狀項下匯票\n    或借款期限，自發票日起或原告國外代理銀行付款之日起算\n    ，最長不得超過150 日，利息自原告或原告國外代理銀行付\n    款之日起至借款到期日止，按原告通知利率支付，並得依照\n    原告借入外匯資金成本加碼利率隨時調整之，到期不履行時\n    ，即喪失期限利益，其債務視為全部到期，除按原告通知之\n    一般外匯授信利率支付遲延利息外，逾期在6 個月以內部分\n    ，按上開約定利率10%，逾期超過6個月部分，按上開約定利\n    率20 %加付違約金。嗣被告歐庄公司分別於98年6月2日、90\n    年7月10日、98年7月16日、98年7月29日、98年7月29日、98\n    年8月27日、98年9月28日、98年10月23日、98年5月18日、9\n    8年6月2日、98年6月19日、98年6月24日、98 年9月3日簽立\n    開發信用狀申請書，到單金額分別為美金13,622元、美金12\n    ,134元、美金8,412元、美金6,577元、美金22,986元、美金\n    12,524元、美金37,013.8元、美金21,846元、美金12,819元\n    、美金25,522.5元、美金9,150元、美金43,495元及美金5,8\n    18元。被告歐庄公司另邀同被告甲○○及丙○○為連帶保證\n    人，約定在新台幣2,000 萬元限額內負連帶償還責任，嗣被\n    告歐庄公司於98年9月25日起至99年9月25日止，並依原告定\n    儲指數利率加碼年息4.39 %機動計息，遲延履行時，除均按\n    上開利率計息外，逾期在6個月以內，按上開利息10%，逾期\n    超過6個月部分，則按上開利息20%加計違約金，並喪失期限\n    利益，債務視同全部到期。詎被告歐庄公司於98年11月27日\n    經票據交換所公告為拒絕往來戶，尚積欠新台幣300 萬元、\n    美金231,919.30元及如附表所示之利息及違約金，屢經催討\n    ，未獲置理，為此提起本件訴訟等情。並聲明：如主文所示\n    。\n三、被告未於言詞辯論期日到場，亦未提出書狀作何聲明或陳述\n    。\n四、本件原告主張之事實，已據其提出本票、進口遠期信用狀借\n    款契約、授信約定書、連帶保證書、開發信用狀申請書暨進\n    口單據到達處理紀錄單及原告定儲指數利率變動表等影本為\n    證，經核與其所述情節相符，堪信為真實。從而，原告依消\n    費借貸及連帶保證之法律關係請求被告連帶給付如主文所示\n    之本金、利息及違約金，為有理由，應予准許。\n五、本件訴訟費用額確定為新台幣104,072元。\n六、訴訟費用負擔之依據：民事訴訟法第85條第2項。"
  },
  "characters": {
    "judges": [

    ],
    "prosecutors": [

    ],
    "lawyers": [

    ],
    "clerks": [

    ],
    "plaintiffs": [
      "合作金庫商業銀行股份有限公司"
    ],
    "defendants": [
      "歐庄國際企業有限公司",
      "丙○○原名陳."
    ],
    "prosecutor_office": [

    ],
    "creditors": [

    ],
    "debtors": [

    ],
    "judicial_associate_officer": [

    ]
  },
  "adjudged_at": "2010-05-12",
  "created_at": "2016-01-05 12:13:26",
  "updated_at": "2016-01-05 12:13:26"
}