{
  "identify": "TPD-98-勞簡上-80-20100512-1",
  "court": {
    "name": "臺灣臺北地方法院",
    "code": "TPD"
  },
  "division": {
    "name": "民事",
    "code": "V"
  },
  "year": 98,
  "word": "勞簡上",
  "number": "80",
  "jcheck": "1",
  "reason": "給付工資等",
  "content": "臺灣臺北地方法院民事判決            98年度勞簡上字第80號\n上  訴  人  丙○○\n訴訟代理人  李初東律師\n複代理人    乙○○\n被上訴人    岳陞投資開發有限公司\n法定代理人  丁○○\n上列當事人間請求給付工資等事件，上訴人對於中華民國98年10\n月26日本院臺北簡易庭98年度北勞簡字第185 號第一審判決提起\n上訴，本院於99年4月21日辯論終結，判決如下：\n    主      文\n上訴駁回。\n第二審訴訟費用由上訴人負擔。\n    事實及理由\n一、上訴人起訴主張伊自國97年3 月19日起受僱於被上訴人，迄\n    98年4 月28日經被上訴人要求於同月底離職。離職前伊平均\n    工資為新臺幣（下同）2 萬2000元，被上訴人終止勞動契約\n    後尚短付伊未休特別假4 日工資2900元、20日預告期間工資\n    1 萬4667元、資遣費1 萬2834元。又被上訴人未依就業保險\n    法規定為伊投保就業保險，致伊遭解僱後未能申領失業給付\n    。被上訴人違反就業服務法之保護他人法律，應依民法第\n    184 條第2 項規定，賠償上訴人原可領取6 個月，按每月投\n    保薪資2 萬2000元六成計算之失業給付共計7 萬9200元。爰\n    依兩造間勞動契約法律關係及民法第184 條第2 項規定，訴\n    請被上訴人給付上開短付之未休特別假工資、預告期間工資\n    、資遣費及損害賠償金合計10萬9634元等情。\n二、原審判命被上訴人給付上訴人1 萬4887元（含未休特別假4\n    日工資2933元、預告期間工資1 萬2467元、資遣費1 萬2320\n    元，扣除已付資遣費1 萬2833元），及自98年7 月30日起至\n    清償日止按年息5%計算之利息，而駁回上訴人其餘請求。上\n    訴人就原審駁回其依民法第184 條第2 項請求被上訴人賠償\n    7 萬9200元部分，聲明不服，提起上訴，其上訴聲明為：(一)\n    原判決關於駁回上訴人損害賠償請求（7 萬9200元）部分廢\n    棄；(二)上開廢棄部分，被上訴人應再給付上訴人7 萬9200元\n    ，及自98年7 月30日起至清償日止，按年息5%計算之利息。\n三、被上訴人則辯稱上訴人初到職即以其欠稅50多萬元為由，央\n    請被上訴人勿為其投保勞健保，避免遭法院強制執行，被上\n    訴人應其所請而未為其投保，應不負賠償責任，且上訴人亦\n    未證明其符合請領失業給付之要件，其請求被上訴人賠償失\n    業給付之損害為無理由等語，並聲明請求駁回其上訴。\n四、經查：\n  (一)上訴人僅就未能領取失業給付之損害賠償請求敗訴部分，提\n    起上訴，是本件上訴程序僅就此範圍審理，先予敘明。\n  (二)上訴人指稱被上訴人未為其投保就業保險，係違反保護他人\n    之法律，應依民法第184 條第2 項規定，賠償上訴人未能領\n    取失業給付之損害。惟按民法第184 條第2 項雖規定「違反\n    保護他人之法律，致生損害於他人者，負賠償責任」，然此\n    項侵權責任之成立，以行為人違反保護他人法律之行為具備\n    違法性，且無違法阻卻事由，為其要件。依就業保險法第5\n    條第1 項、第6 條第3 項規定，雇主或投保單位應於勞工到\n    職日，為所屬勞工申報參加就業保險。此規定旨在保障勞工\n    失業一定期間之基本生活，雇主違反此規定，未為所屬勞工\n    投保就業保險，雖可認係違反保護他人之法律，惟雇主未為\n    勞工投保，若是基於勞工之請求，本於「得被害人同意所為\n    財產法益之侵害得阻卻違法」之法理，雇主自不成立民法第\n    184 條第2 項所定之侵權責任。被上訴人辯稱上訴人到職之\n    初，即以其欠稅50餘萬元為由，央請被上訴人勿為其投保，\n    以免遭法院強制執行等情，與證人即被上訴人前職員甲○○\n    到庭具結所證：「公司是97年4 月1 日成立，同時成立勞健\n    保投保單位，因為會既還沒有到職，所以暫時由我代理，當\n    時有徵詢每個員工的投保資格與身分，負責人告訴我原告（\n    即上訴人）因為有稅務的問題無法投保，我在私底下有問過\n    丙○○，她告知她以前開設的餐廳有欠稅五十至六十萬元，\n    所以無法參加公司勞保、健保」等語相符。證人甲○○作證\n    時與被上訴人並無僱傭關係，且於供前具結，應無甘冒偽證\n    處罰以迴護被告之情。又本院向財政部臺北市國稅局查詢上\n    訴人之欠稅狀況，經該局函覆：至99年3 月15日止，確有以\n    上訴人為負責人之獨資營利事業「佐渡島餐坊」，欠繳6 筆\n    稅款，金額共計48萬7914元，有該覆函在卷可稽（見本院卷\n    第44頁），亦核與甲○○所證情節相符。而上訴人經營餐坊\n    欠繳稅款之事，並非外人所能得知，衡情若非上訴人告知，\n    證人應無得知之理。可見證人甲○○上詞所證，應屬非虛。\n    上訴人據以辯稱係因上訴人請求，始未為其投保等情，堪予\n    採信。則被上訴人未為上訴人申辦就業保險，係基於被上訴\n    人之請求，依諸前揭說明，自不能課上訴人民法第184 條第\n    2 項所定之侵權責任。從而，上訴人依上開侵權行為之規定\n    請求被上訴人賠償未能領取失業給付之損害7 萬9200元，自\n    不應准許。原審駁回上訴人此部分請求，核無違誤。上訴意\n    旨指摘原判決不當，求予廢棄改判，為無理由，應予駁回。\n五、據上論結，本件上訴為無理由，依民事訴訟法第436 條之1\n    第3 項、第449 條第1 項、第78條，判決如主文。\n中    華    民    國    99    年    5     月    12    日\n                  勞工法庭    審判長法  官  丁蓓蓓\n                                    法  官  魏式瑜\n                                    法  官  黃明發\n以上正本係照原本作成。\n本判決不得上訴。\n中    華    民    國    99    年    5     月    12    日\n                                    書記官  陳怡如",
  "structure": {
    "main": "上訴駁回。\n第二審訴訟費用由上訴人負擔。",
    "fact": "一、上訴人起訴主張伊自國97年3 月19日起受僱於被上訴人，迄\n    98年4 月28日經被上訴人要求於同月底離職。離職前伊平均\n    工資為新臺幣（下同）2 萬2000元，被上訴人終止勞動契約\n    後尚短付伊未休特別假4 日工資2900元、20日預告期間工資\n    1 萬4667元、資遣費1 萬2834元。又被上訴人未依就業保險\n    法規定為伊投保就業保險，致伊遭解僱後未能申領失業給付\n    。被上訴人違反就業服務法之保護他人法律，應依民法第\n    184 條第2 項規定，賠償上訴人原可領取6 個月，按每月投\n    保薪資2 萬2000元六成計算之失業給付共計7 萬9200元。爰\n    依兩造間勞動契約法律關係及民法第184 條第2 項規定，訴\n    請被上訴人給付上開短付之未休特別假工資、預告期間工資\n    、資遣費及損害賠償金合計10萬9634元等情。\n二、原審判命被上訴人給付上訴人1 萬4887元（含未休特別假4\n    日工資2933元、預告期間工資1 萬2467元、資遣費1 萬2320\n    元，扣除已付資遣費1 萬2833元），及自98年7 月30日起至\n    清償日止按年息5%計算之利息，而駁回上訴人其餘請求。上\n    訴人就原審駁回其依民法第184 條第2 項請求被上訴人賠償\n    7 萬9200元部分，聲明不服，提起上訴，其上訴聲明為：(一)\n    原判決關於駁回上訴人損害賠償請求（7 萬9200元）部分廢\n    棄；(二)上開廢棄部分，被上訴人應再給付上訴人7 萬9200元\n    ，及自98年7 月30日起至清償日止，按年息5%計算之利息。\n三、被上訴人則辯稱上訴人初到職即以其欠稅50多萬元為由，央\n    請被上訴人勿為其投保勞健保，避免遭法院強制執行，被上\n    訴人應其所請而未為其投保，應不負賠償責任，且上訴人亦\n    未證明其符合請領失業給付之要件，其請求被上訴人賠償失\n    業給付之損害為無理由等語，並聲明請求駁回其上訴。\n四、經查：\n  (一)上訴人僅就未能領取失業給付之損害賠償請求敗訴部分，提\n    起上訴，是本件上訴程序僅就此範圍審理，先予敘明。\n  (二)上訴人指稱被上訴人未為其投保就業保險，係違反保護他人\n    之法律，應依民法第184 條第2 項規定，賠償上訴人未能領\n    取失業給付之損害。惟按民法第184 條第2 項雖規定「違反\n    保護他人之法律，致生損害於他人者，負賠償責任」，然此\n    項侵權責任之成立，以行為人違反保護他人法律之行為具備\n    違法性，且無違法阻卻事由，為其要件。依就業保險法第5\n    條第1 項、第6 條第3 項規定，雇主或投保單位應於勞工到\n    職日，為所屬勞工申報參加就業保險。此規定旨在保障勞工\n    失業一定期間之基本生活，雇主違反此規定，未為所屬勞工\n    投保就業保險，雖可認係違反保護他人之法律，惟雇主未為\n    勞工投保，若是基於勞工之請求，本於「得被害人同意所為\n    財產法益之侵害得阻卻違法」之法理，雇主自不成立民法第\n    184 條第2 項所定之侵權責任。被上訴人辯稱上訴人到職之\n    初，即以其欠稅50餘萬元為由，央請被上訴人勿為其投保，\n    以免遭法院強制執行等情，與證人即被上訴人前職員甲○○\n    到庭具結所證：「公司是97年4 月1 日成立，同時成立勞健\n    保投保單位，因為會既還沒有到職，所以暫時由我代理，當\n    時有徵詢每個員工的投保資格與身分，負責人告訴我原告（\n    即上訴人）因為有稅務的問題無法投保，我在私底下有問過\n    丙○○，她告知她以前開設的餐廳有欠稅五十至六十萬元，\n    所以無法參加公司勞保、健保」等語相符。證人甲○○作證\n    時與被上訴人並無僱傭關係，且於供前具結，應無甘冒偽證\n    處罰以迴護被告之情。又本院向財政部臺北市國稅局查詢上\n    訴人之欠稅狀況，經該局函覆：至99年3 月15日止，確有以\n    上訴人為負責人之獨資營利事業「佐渡島餐坊」，欠繳6 筆\n    稅款，金額共計48萬7914元，有該覆函在卷可稽（見本院卷\n    第44頁），亦核與甲○○所證情節相符。而上訴人經營餐坊\n    欠繳稅款之事，並非外人所能得知，衡情若非上訴人告知，\n    證人應無得知之理。可見證人甲○○上詞所證，應屬非虛。\n    上訴人據以辯稱係因上訴人請求，始未為其投保等情，堪予\n    採信。則被上訴人未為上訴人申辦就業保險，係基於被上訴\n    人之請求，依諸前揭說明，自不能課上訴人民法第184 條第\n    2 項所定之侵權責任。從而，上訴人依上開侵權行為之規定\n    請求被上訴人賠償未能領取失業給付之損害7 萬9200元，自\n    不應准許。原審駁回上訴人此部分請求，核無違誤。上訴意\n    旨指摘原判決不當，求予廢棄改判，為無理由，應予駁回。\n五、據上論結，本件上訴為無理由，依民事訴訟法第436 條之1\n    第3 項、第449 條第1 項、第78條，判決如主文。",
    "reason": "一、上訴人起訴主張伊自國97年3 月19日起受僱於被上訴人，迄\n    98年4 月28日經被上訴人要求於同月底離職。離職前伊平均\n    工資為新臺幣（下同）2 萬2000元，被上訴人終止勞動契約\n    後尚短付伊未休特別假4 日工資2900元、20日預告期間工資\n    1 萬4667元、資遣費1 萬2834元。又被上訴人未依就業保險\n    法規定為伊投保就業保險，致伊遭解僱後未能申領失業給付\n    。被上訴人違反就業服務法之保護他人法律，應依民法第\n    184 條第2 項規定，賠償上訴人原可領取6 個月，按每月投\n    保薪資2 萬2000元六成計算之失業給付共計7 萬9200元。爰\n    依兩造間勞動契約法律關係及民法第184 條第2 項規定，訴\n    請被上訴人給付上開短付之未休特別假工資、預告期間工資\n    、資遣費及損害賠償金合計10萬9634元等情。\n二、原審判命被上訴人給付上訴人1 萬4887元（含未休特別假4\n    日工資2933元、預告期間工資1 萬2467元、資遣費1 萬2320\n    元，扣除已付資遣費1 萬2833元），及自98年7 月30日起至\n    清償日止按年息5%計算之利息，而駁回上訴人其餘請求。上\n    訴人就原審駁回其依民法第184 條第2 項請求被上訴人賠償\n    7 萬9200元部分，聲明不服，提起上訴，其上訴聲明為：(一)\n    原判決關於駁回上訴人損害賠償請求（7 萬9200元）部分廢\n    棄；(二)上開廢棄部分，被上訴人應再給付上訴人7 萬9200元\n    ，及自98年7 月30日起至清償日止，按年息5%計算之利息。\n三、被上訴人則辯稱上訴人初到職即以其欠稅50多萬元為由，央\n    請被上訴人勿為其投保勞健保，避免遭法院強制執行，被上\n    訴人應其所請而未為其投保，應不負賠償責任，且上訴人亦\n    未證明其符合請領失業給付之要件，其請求被上訴人賠償失\n    業給付之損害為無理由等語，並聲明請求駁回其上訴。\n四、經查：\n  (一)上訴人僅就未能領取失業給付之損害賠償請求敗訴部分，提\n    起上訴，是本件上訴程序僅就此範圍審理，先予敘明。\n  (二)上訴人指稱被上訴人未為其投保就業保險，係違反保護他人\n    之法律，應依民法第184 條第2 項規定，賠償上訴人未能領\n    取失業給付之損害。惟按民法第184 條第2 項雖規定「違反\n    保護他人之法律，致生損害於他人者，負賠償責任」，然此\n    項侵權責任之成立，以行為人違反保護他人法律之行為具備\n    違法性，且無違法阻卻事由，為其要件。依就業保險法第5\n    條第1 項、第6 條第3 項規定，雇主或投保單位應於勞工到\n    職日，為所屬勞工申報參加就業保險。此規定旨在保障勞工\n    失業一定期間之基本生活，雇主違反此規定，未為所屬勞工\n    投保就業保險，雖可認係違反保護他人之法律，惟雇主未為\n    勞工投保，若是基於勞工之請求，本於「得被害人同意所為\n    財產法益之侵害得阻卻違法」之法理，雇主自不成立民法第\n    184 條第2 項所定之侵權責任。被上訴人辯稱上訴人到職之\n    初，即以其欠稅50餘萬元為由，央請被上訴人勿為其投保，\n    以免遭法院強制執行等情，與證人即被上訴人前職員甲○○\n    到庭具結所證：「公司是97年4 月1 日成立，同時成立勞健\n    保投保單位，因為會既還沒有到職，所以暫時由我代理，當\n    時有徵詢每個員工的投保資格與身分，負責人告訴我原告（\n    即上訴人）因為有稅務的問題無法投保，我在私底下有問過\n    丙○○，她告知她以前開設的餐廳有欠稅五十至六十萬元，\n    所以無法參加公司勞保、健保」等語相符。證人甲○○作證\n    時與被上訴人並無僱傭關係，且於供前具結，應無甘冒偽證\n    處罰以迴護被告之情。又本院向財政部臺北市國稅局查詢上\n    訴人之欠稅狀況，經該局函覆：至99年3 月15日止，確有以\n    上訴人為負責人之獨資營利事業「佐渡島餐坊」，欠繳6 筆\n    稅款，金額共計48萬7914元，有該覆函在卷可稽（見本院卷\n    第44頁），亦核與甲○○所證情節相符。而上訴人經營餐坊\n    欠繳稅款之事，並非外人所能得知，衡情若非上訴人告知，\n    證人應無得知之理。可見證人甲○○上詞所證，應屬非虛。\n    上訴人據以辯稱係因上訴人請求，始未為其投保等情，堪予\n    採信。則被上訴人未為上訴人申辦就業保險，係基於被上訴\n    人之請求，依諸前揭說明，自不能課上訴人民法第184 條第\n    2 項所定之侵權責任。從而，上訴人依上開侵權行為之規定\n    請求被上訴人賠償未能領取失業給付之損害7 萬9200元，自\n    不應准許。原審駁回上訴人此部分請求，核無違誤。上訴意\n    旨指摘原判決不當，求予廢棄改判，為無理由，應予駁回。\n五、據上論結，本件上訴為無理由，依民事訴訟法第436 條之1\n    第3 項、第449 條第1 項、第78條，判決如主文。"
  },
  "characters": {
    "judges": [
      "丁蓓蓓",
      "魏式瑜",
      "黃明發"
    ],
    "prosecutors": [

    ],
    "lawyers": [
      "李初東"
    ],
    "clerks": [

    ],
    "plaintiffs": [

    ],
    "defendants": [

    ],
    "prosecutor_office": [

    ],
    "creditors": [

    ],
    "debtors": [

    ],
    "judicial_associate_officer": [

    ]
  },
  "adjudged_at": "2010-05-12",
  "created_at": "2016-01-05 12:10:58",
  "updated_at": "2016-01-05 12:10:58"
}