{
  "identify": "TPD-99-審司聲-1152-20100512-1",
  "court": {
    "name": "臺灣臺北地方法院",
    "code": "TPD"
  },
  "division": {
    "name": "民事",
    "code": "V"
  },
  "year": 99,
  "word": "審司聲",
  "number": "1152",
  "jcheck": "1",
  "reason": "公示送達",
  "content": "臺灣臺北地方法院民事裁定          99年度審司聲字第1152號\n聲  請  人  寰辰資產管理股份有限公司\n法定代理人  乙○○\n代  理  人  丙○○\n相  對  人  丁○○    原住臺北.\n            甲○○    原住同上.\n上列聲請人聲請對相對人為公示送達事件，本院裁定如下：\n    主  文\n准將聲請人對相對人如附件所示意思表示之通知為公示送達。\n聲請費新臺幣壹仟元及程序費用由相對人負擔。\n    理  由\n一、按表意人非因自己之過失不知相對人居所者，得依民事訴訟\n    法公示送達之規定，以公示送達為意思表示之通知，民法第\n    97條定有明文。\n二、本件聲請人以寄送相對人之存證信函因查無此人，以致原件\n    退回，為此聲請裁定准為公示送達，並提出債權讓與證明書\n    影本、債權憑證影本、債權讓與通知函、戶籍謄本、退回信\n    封影本等件為證，又相對人現籍業經逕為住址變更登記至臺\n    北縣新店市戶政事務所，亦有聲請人所提戶籍謄本為證，可\n    知相對人現已所在不明，聲請人顯無法依通常方法將意思表\n    示送達相對人，是聲請人聲請為公示送達，經核與首揭法條\n    規定相符，應予准許。\n三、依非訟事件法第21條第2項、第24條第1項、民事訴訟法第95\n    條及第78條，裁定如主文。\n四、如不服本裁定，應於裁定送達後10日內向本院提出抗告狀，\n    並繳納抗告費新臺幣1,000元。\n中    華    民    國    99    年    5     月    12    日\n                  民事第六庭    司法事務官  侯美滿",
  "structure": {
    "main": "准將聲請人對相對人如附件所示意思表示之通知為公示送達。\n聲請費新臺幣壹仟元及程序費用由相對人負擔。",
    "reason": "一、按表意人非因自己之過失不知相對人居所者，得依民事訴訟\n    法公示送達之規定，以公示送達為意思表示之通知，民法第\n    97條定有明文。\n二、本件聲請人以寄送相對人之存證信函因查無此人，以致原件\n    退回，為此聲請裁定准為公示送達，並提出債權讓與證明書\n    影本、債權憑證影本、債權讓與通知函、戶籍謄本、退回信\n    封影本等件為證，又相對人現籍業經逕為住址變更登記至臺\n    北縣新店市戶政事務所，亦有聲請人所提戶籍謄本為證，可\n    知相對人現已所在不明，聲請人顯無法依通常方法將意思表\n    示送達相對人，是聲請人聲請為公示送達，經核與首揭法條\n    規定相符，應予准許。\n三、依非訟事件法第21條第2項、第24條第1項、民事訴訟法第95\n    條及第78條，裁定如主文。\n四、如不服本裁定，應於裁定送達後10日內向本院提出抗告狀，\n    並繳納抗告費新臺幣1,000元。"
  },
  "characters": {
    "judges": [

    ],
    "prosecutors": [

    ],
    "lawyers": [

    ],
    "clerks": [

    ],
    "plaintiffs": [

    ],
    "defendants": [

    ],
    "prosecutor_office": [
      "寰辰資產管理股份有限公司"
    ],
    "creditors": [

    ],
    "debtors": [

    ],
    "judicial_associate_officer": [
      "侯美滿"
    ]
  },
  "adjudged_at": "2010-05-12",
  "created_at": "2016-01-05 12:10:17",
  "updated_at": "2016-01-05 12:10:17"
}