{
  "identify": "TPD-99-審聲-196-20100512-1",
  "court": {
    "name": "臺灣臺北地方法院",
    "code": "TPD"
  },
  "division": {
    "name": "民事",
    "code": "V"
  },
  "year": 99,
  "word": "審聲",
  "number": "196",
  "jcheck": "1",
  "reason": "行使權利",
  "content": "臺灣臺北地方法院民事裁定             99年度審聲字第196號\n聲  請  人  華義國際數位娛樂股份有限公司\n法定代理人  乙○○\n代  理  人  翁祖立律師\n相  對  人  高遠科技有限公司\n法定代理人  甲○○\n上列當事人間行使權利事件，本院裁定如下：\n    主  文\n本件移送臺灣士林地方法院。\n    理  由\n一、本件聲請意旨略以：聲請人前遵臺灣士林地方法院91年度裁\n    全字第4248號民事裁定為擔保假扣押，曾提供擔保，並以臺\n    灣士林地方法院91年度存字第2091號擔保提存事件提存在案\n    。茲因聲請人已聲請撤銷假扣押裁定及撤回假扣押執行，爰\n    依民事訴訟法第104條第1項第3款後段規定聲請通知相對人\n    行使權利等語。\n二、按訴訟之全部或一部，法院認為無管轄權者，得依職權以裁\n    定移送於其管轄法院，民事訴訟法第28條第1項定有明文。\n    此項條文規定在民事訴訟法總則編，於依民事訴訟法所為之\n    聲請事件，除有特別規定者外，亦適用之。次按供擔保人請\n    求法院依據民事訴訟法第104條第1項第3款後段規定通知受\n    擔保利益人行使權利，其目的即將來得領回擔保金，又供擔\n    保人依據民事訴訟法第104條第1項規定聲請返還提存物或保\n    證書者，應向命供擔保之法院為之，則供擔保人依上開規定\n    請求法院通知受擔保利益人於一定期間行使權利之聲請事件\n    ，亦應由命供擔保之法院管轄（最高法院86年度台抗字第55\n    號裁定要旨、臺灣高等法院暨所屬法院96年法律座談會民事\n    類提案第19號研討結果可資參照）。\n三、經查，本件聲請人係依臺灣士林地方法院91年度裁全字第\n    4248號假扣押裁定而供擔保，揆諸上開說明，本件自應由命\n    供擔保之臺灣士林地方法院管轄，茲聲請人向無管轄權之本\n    院提出聲請，顯係違誤，應依職權將本件移送該管轄法院。\n四、依首開法條裁定如主文。\n中    華    民    國    99    年    5    月    12    日\n                  民事第六庭    法    官  朱漢寶\n以上正本係照原本作成\n如不服本裁定應於送達後10日內向本院提出抗告狀，並繳納抗告\n費新臺幣1,000元。\n中    華    民    國    99    年    5    月    12    日\n                                書記官  陳素卿",
  "structure": {
    "main": "本件移送臺灣士林地方法院。",
    "reason": "一、本件聲請意旨略以：聲請人前遵臺灣士林地方法院91年度裁\n    全字第4248號民事裁定為擔保假扣押，曾提供擔保，並以臺\n    灣士林地方法院91年度存字第2091號擔保提存事件提存在案\n    。茲因聲請人已聲請撤銷假扣押裁定及撤回假扣押執行，爰\n    依民事訴訟法第104條第1項第3款後段規定聲請通知相對人\n    行使權利等語。\n二、按訴訟之全部或一部，法院認為無管轄權者，得依職權以裁\n    定移送於其管轄法院，民事訴訟法第28條第1項定有明文。\n    此項條文規定在民事訴訟法總則編，於依民事訴訟法所為之\n    聲請事件，除有特別規定者外，亦適用之。次按供擔保人請\n    求法院依據民事訴訟法第104條第1項第3款後段規定通知受\n    擔保利益人行使權利，其目的即將來得領回擔保金，又供擔\n    保人依據民事訴訟法第104條第1項規定聲請返還提存物或保\n    證書者，應向命供擔保之法院為之，則供擔保人依上開規定\n    請求法院通知受擔保利益人於一定期間行使權利之聲請事件\n    ，亦應由命供擔保之法院管轄（最高法院86年度台抗字第55\n    號裁定要旨、臺灣高等法院暨所屬法院96年法律座談會民事\n    類提案第19號研討結果可資參照）。\n三、經查，本件聲請人係依臺灣士林地方法院91年度裁全字第\n    4248號假扣押裁定而供擔保，揆諸上開說明，本件自應由命\n    供擔保之臺灣士林地方法院管轄，茲聲請人向無管轄權之本\n    院提出聲請，顯係違誤，應依職權將本件移送該管轄法院。\n四、依首開法條裁定如主文。"
  },
  "characters": {
    "judges": [
      "朱漢寶"
    ],
    "prosecutors": [

    ],
    "lawyers": [
      "翁祖立"
    ],
    "clerks": [

    ],
    "plaintiffs": [

    ],
    "defendants": [

    ],
    "prosecutor_office": [
      "華義國際數位娛樂股份有限公司"
    ],
    "creditors": [

    ],
    "debtors": [

    ],
    "judicial_associate_officer": [

    ]
  },
  "adjudged_at": "2010-05-12",
  "created_at": "2016-01-05 12:19:18",
  "updated_at": "2016-01-05 12:19:18"
}