{
  "identify": "TPD-98-消債核-29568-20100104-1",
  "court": {
    "name": "臺灣臺北地方法院",
    "code": "TPD"
  },
  "division": {
    "name": "民事",
    "code": "V"
  },
  "year": 98,
  "word": "消債核",
  "number": "29568",
  "jcheck": "1",
  "reason": "消債之前置協商認可事件",
  "content": "臺灣臺北地方法院民事裁定         98年度消債核字第29568號\n聲  請  人\n即債權人    台北富邦商業銀行股份有限公司\n法定代理人  丙○○\n聲  請  人\n即債權人    國泰世華商業銀行股份有限公司\n法定代理人  甲○○\n聲  請  人\n即債權人    渣打國際商業銀行股份有限公司\n法定代理人  戊○○\n聲  請  人\n即債權人    中國信託商業銀行股份有限公司\n法定代理人  丁○○○○\n相  對  人\n即債務人    乙○○\n上列當事人間債務協商事件，本院裁定如下：\n    主  文\n如附件所示債權人與債務人間於民國98年12月22日協商成立之債\n務清償方案，予以認可。\n    理  由\n一、按債務人對於金融機構因消費借貸、自用住宅借款、信用卡\n    或現金卡契約而負債務，在聲請更生或清算前，應提出債權\n    人清冊，以書面向最大債權金融機構請求協商債務清償方案\n    並表明共同協商之意旨，消費者債務清理條例第151條第1項\n    定有明文。又前條第一項受請求之金融機構應於協商成立之\n    翌日起七日內，將債務清償方案送請金融機構所在地之管轄\n    法院審核，但當事人就債務清償方案已依公證法第13條第1\n    項規定，請求公證人作成公證書者，不在此限；前項債務清\n    償方案，法院應儘速審核，認與法令無牴觸者，應以裁定予\n    以認可，認與法令牴觸者，應以裁定不予認可，復為同條例\n    第152條第1項、第2項所明定。\n二、本件聲請意旨略以：債務人因消費借貸等契約而對金融機構\n    負有債務，並在聲請更生或清算前，提出債權人清冊，以書\n    面向聲請人即最大債權金融機構請求共同協商債務清償方案\n    ，茲因債務人與全體債權人已於民國（下同）98年12月22日\n    協商成立，爰將協商成立之債務清償方案送請本院審核，請\n    求裁定予以認可等語。\n三、查聲請人主張之上開事實，業據提出與其所述相符之債務人\n    向金融機構辦理前置協商申請書、前置協商機制協議書等資\n    料等為證，堪信為真實。再觀諸債務人與全體債權人上開協\n    商成立之債務清償方案內容，並無牴觸法令之情事，爰裁定\n    如主文。\n四、如不服本裁定，應於裁定送達後10日內，以書狀向本院司法\n    事務官提出異議。\n中    華    民    國    99    年     1    月     4    日\n                      民事庭司法事務官  吳佳育\n附件：前置協商機制協議書及前置協商無擔保債務還款分配表暨\n      表決結果各乙份。",
  "structure": {
    "main": "如附件所示債權人與債務人間於民國98年12月22日協商成立之債\n務清償方案，予以認可。",
    "reason": "一、按債務人對於金融機構因消費借貸、自用住宅借款、信用卡\n    或現金卡契約而負債務，在聲請更生或清算前，應提出債權\n    人清冊，以書面向最大債權金融機構請求協商債務清償方案\n    並表明共同協商之意旨，消費者債務清理條例第151條第1項\n    定有明文。又前條第一項受請求之金融機構應於協商成立之\n    翌日起七日內，將債務清償方案送請金融機構所在地之管轄\n    法院審核，但當事人就債務清償方案已依公證法第13條第1\n    項規定，請求公證人作成公證書者，不在此限；前項債務清\n    償方案，法院應儘速審核，認與法令無牴觸者，應以裁定予\n    以認可，認與法令牴觸者，應以裁定不予認可，復為同條例\n    第152條第1項、第2項所明定。\n二、本件聲請意旨略以：債務人因消費借貸等契約而對金融機構\n    負有債務，並在聲請更生或清算前，提出債權人清冊，以書\n    面向聲請人即最大債權金融機構請求共同協商債務清償方案\n    ，茲因債務人與全體債權人已於民國（下同）98年12月22日\n    協商成立，爰將協商成立之債務清償方案送請本院審核，請\n    求裁定予以認可等語。\n三、查聲請人主張之上開事實，業據提出與其所述相符之債務人\n    向金融機構辦理前置協商申請書、前置協商機制協議書等資\n    料等為證，堪信為真實。再觀諸債務人與全體債權人上開協\n    商成立之債務清償方案內容，並無牴觸法令之情事，爰裁定\n    如主文。\n四、如不服本裁定，應於裁定送達後10日內，以書狀向本院司法\n    事務官提出異議。"
  },
  "characters": {
    "judges": [

    ],
    "prosecutors": [

    ],
    "lawyers": [

    ],
    "clerks": [

    ],
    "plaintiffs": [

    ],
    "defendants": [

    ],
    "prosecutor_office": [

    ],
    "creditors": [
      "台北富邦商業銀行股份有限公司",
      "國泰世華商業銀行股份有限公司",
      "渣打國際商業銀行股份有限公司",
      "中國信託商業銀行股份有限公司"
    ],
    "debtors": [

    ],
    "judicial_associate_officer": [
      "吳佳育"
    ]
  },
  "adjudged_at": "2010-01-04",
  "created_at": "2016-01-05 14:44:26",
  "updated_at": "2016-01-05 14:44:26"
}