{
  "identify": "TPD-99-簡上-131-20100512-1",
  "court": {
    "name": "臺灣臺北地方法院",
    "code": "TPD"
  },
  "division": {
    "name": "民事",
    "code": "V"
  },
  "year": 99,
  "word": "簡上",
  "number": "131",
  "jcheck": "1",
  "reason": "損害賠償",
  "content": "臺灣臺北地方法院民事判決             99年度簡上字第131號\n上  訴  人  甲○○\n被上訴人    乙○○\n            倢運通運有限公司\n上  一  人\n法定代理人  丙○○\n                        號\n上列當事人間請求侵權行為損害賠償事件，上訴人對於中華民國\n99年1 月11日本院新店簡易庭98年度店簡字第1801號第一審判決\n提起上訴，本院於99年4 月21日言詞辯論終結，判決如下：\n    主  文\n上訴駁回。\n第二審訴訟費用由上訴人負擔。\n    事實及理由\n壹、程序方面：\n一、按解散之公司，除因合併、破產解散者外，應行清算；解散\n    之公司，於清算範圍內，視為尚未解散，公司法第24條、第\n    25條分別定有明文。次按公司之清算，以全體股東為清算人\n    ，但本法或章程另有規定或經股東決議，另選清算人者，不\n    在此限，同法第79條亦定有明文，此規定，依同法第113 條\n    規定，亦為有限公司所準用。本件被上訴人倢運通運有限公\n    司（下稱倢運公司）雖已向經濟部為解散登記，有經濟部函\n    暨公司變更登記表各1 份在卷可稽（見原審卷第60-62 頁）\n    ，然其並未向管轄法院陳報清算案件，按諸上揭規定，應視\n    為該公司尚未解散，又該公司為一人公司，董事為丙○○，\n    自應以其為清算人，為本件訴訟之法定代理人。\n二、按當事人在第二審不得提出新攻擊或防禦方法，但如不許其\n    提出顯失公平者，不在此限，此觀民事訴訟法第447 條第1\n    項第6 款規定即明。又此項規定，依同法第436 條之1 第3\n    項、第446 條第1 項規定亦於簡易訴訟第二審程序準用之。\n    本件侵權行為損害賠償請求權若已罹於2 年時效而消滅，被\n    上訴人自得不附任何理由主張時效抗辯而拒絕給付，因第二\n    審仍為事實審，如不許被上訴人於第二審法院為主張，限制\n    被上訴人合法權利之行使，顯失公平，其抗辯應予審酌，自\n    應許被上訴人得於本院提出時效抗辯而拒絕給付，以維護法\n    律賦予之權益。故上訴人主張被上訴人於原審程序中未提出\n    時效抗辯之攻擊防禦方法，已不得於本院程序中提出云云，\n    委無足取，先予敘明。\n貳、實體方面：\n一、上訴人主張：被上訴人乙○○於民國96年7月11日18時57分\n    ，駕駛被上訴人倢運公司所有車號2438-NT 號自小貨車，行\n    經國道三號公路南向20公里處時，因未保持安全距離，追撞\n    前方伊所駕駛之1896-EL 號自小客貨車（下稱系爭車輛），\n    系爭車輛復往前推撞由訴外人張怡廣所駕駛之車號DM-9296\n    自小客車，致系爭車輛之車頭及車尾受有損害。伊為回復該\n    車原狀，共支出修理費用新台幣（下同）196,000 元（零件\n    部分為92,972元，工資93,605元），另修車期間支出代步車\n    費16,000元、拖車費3,300 元及480 元、計程車資440 元、\n    車輛價值減損鑑定費3,500 元，且系爭車輛因系爭事故減損\n    價值100,000 元，共計受有35萬6,488 元之損害，伊自得依\n    侵權行為之法則，請求被上訴人乙○○賠償上開金額；又被\n    上訴人倢運公司為乙○○之僱用人，應與乙○○負連帶賠償\n    之責等語。\n二、被上訴人則以：本件上訴人之侵權行為損害賠償請求權已罹\n    於2 年請求權時效，被上訴人自得拒絕給付。又系爭車輛更\n    換新零件本即應折舊，原審判決並無違誤等語置辯。\n三、原審為上訴人部分勝訴之判決，判命被上訴人應連帶給付上\n    訴人278,015 元，及被上訴人乙○○部分自98年12月8 日起\n    ，被上訴人倢運通運有限公司部分自98年11月26日起，均至\n    清償日止，按週年利率5%計算之利息，並依職權為准免假執\n    行之宣告，另駁回被上訴人其餘請求。上訴人對原審判決敗\n    訴部分提起上訴，並於本院為上訴聲明：(一)原判決不利於上\n    訴人部分廢棄。(二)上開廢棄部分，被上訴人乙○○、倢運通\n    運有限公司應再連帶給付上訴人78,473元，及均自98年12月\n    8 日起至清償日止，按週年利率5%計算之利息。及就原審判\n    命連帶給付278,015 元部分，乙○○應再給付自96年8 月2\n    日起至98年12月7 日止，倢運通運有限公司應再給付自96年\n    8 月2 日起至98年11月25日止，均按週年利率5%計算之利息\n    。被上訴人乙○○、倢運公司則答辯聲明：上訴駁回。\n四、兩造不爭執事項：\n  (一)被上訴人乙○○於96年7 月11日18時57分，駕駛被上訴人倢\n    運通運有限公司所有車號2438-NT 號自小貨車，行經國道三\n    號公路南向20公里處時，因未保持安全距離，追撞前方伊所\n    駕駛之系爭自小客貨車，系爭車輛往前推撞由訴外人張怡廣\n    駕駛之車號DM-9296 自小客車，致系爭車輛之車頭及車尾受\n    有損害。\n  (二)上訴人因回復該車原狀共支出修理費用196,000 元（零件部\n    分為92,972元，工資93,605元）、代步車費16,000元、拖車\n    費3,300 元及480 元、計程車資440 元、車輛價值減損鑑定\n    費3,500 元。\n  (三)系爭車輛因本次事故減損價值100,000元。\n五、本件上訴人請求被上訴人連帶賠償其因前開車禍事故所生之\n    損害，然為被上訴人所否認，並以前揭情詞置辯，是本件之\n    爭點厥為：(一)上訴人之侵權行為損害賠償請求權是否已罹於\n    時效？(二)若否，則被上訴人賠償上訴人回復原狀之必要費用\n    時，零件部分應否予以折舊？(三)上訴人請求加計自侵權行為\n    發生時起至起訴狀繕本送達翌日前之法定遲延利息，是否有\n    據？\n  (一)上訴人之侵權行為損害賠償請求權是否已罹於時效？\n  (1)按消滅時效，自請求權可行使時起算。時效完成後，債務人\n    得拒絕給付。又因侵權行為所生之損害賠償請求權，自請求\n    權人知有損害及賠償義務人時起，2 年間不行使而消滅。民\n    法第128 條前段、第144 條第1 項及同法第197 條第1 項前\n    段分別定有明文。查本件被上訴人乙○○於96年7 月11日，\n    在前開地點駕駛被上訴人倢運公司所有之車號2438-NT 號自\n    小貨車自後追撞上訴人所有之系爭車輛，並致上訴人之車輛\n    再往前推撞由訴外人張怡廣駕駛之車號DM-9296 自小客車等\n    情，為兩造所不爭執，已如前述，且本件車禍事故發生後，\n    上訴人之配偶旋即撥打電話報警前往處理，嗣後上訴人、被\n    上訴人乙○○及張怡廣等人復於當日下午7 時30分許，同至\n    國道公路警察局木柵分隊製作筆錄乙情，亦有渠等3 人之國\n    道公路警察局道路交通事故調查筆錄在卷可憑（見原審卷第\n    42-46 頁），顯見上訴人當場已知悉系爭車禍之發生係遭被\n    上訴人乙○○駕車自後追撞所致。再參諸上訴人於製作調查\n    筆錄時陳稱：我當時已煞車停等車道上，突然被一部車號24\n    38-NT 號自小貨車由後方追撞到我車後車尾，…，我車前後\n    保險桿及後車燈破損，…我保留告訴等語，堪認上訴人於事\n    故發生時，應已明確知悉其車輛受有損害，且被上訴人乙○\n    ○即為車禍肇事之侵權行為人無誤，故上訴人對被上訴人乙\n    ○○之侵權行為請求權時效應於斯時起開始起算，惟上訴人\n    遲至98年11月20日，始向本院訴請賠償，有98年11月20日本\n    院收狀戳1 枚（見原審卷第1 頁）在卷可佐，則上訴人對於\n    被上訴人乙○○之侵權行為損害賠償請求權應已罹於2 年之\n    消滅時效，當屬無疑。從而，被上訴人乙○○抗辯本件時效\n    已完成，其得拒絕給付等語，自為可取。\n  (二)再按，連帶債務人中之1 人消滅時效已完成者，依民法第27\n    6 條第2 項規定，固僅該債務人應分擔之部分，他債務人同\n    免其責任，惟民法第188 條第3 項規定，僱用人賠償損害時\n    ，對於侵權行為之受僱人有求償權，則僱用人與受僱人間並\n    無應分擔部分可言，倘被害人對為侵權行為之受僱人之損害\n    賠償請求權消滅時效業已完成，僱用人自得援用該受僱人之\n    時效利益，拒絕全部給付，不以該受僱人已為時效抗辯為必\n    要，有最高法院95年度台上字第1235號判決要旨可資參照。\n    則揆諸前開說明，本件被上訴人倢運公司就被上訴人乙○○\n    得拒絕給付部分，亦援用受僱人之時效利益，而拒絕全部之\n    給付，核屬有據。從而，上訴人依侵權行為之法律關係，請\n    求被上訴人乙○○、倢運通運有限公司除原審判命給付之金\n    額外，連帶賠償其零件折舊部分之損失，併請求一審勝訴部\n    分之本金再加計自損害發生時起至起訴狀繕本送達翌日前之\n    法定遲延利息云云，洵非正當，不應准許。\n六、綜上所述，上訴人依侵權行為之法律關係，訴請被上訴人乙\n    ○○、倢運公司再連帶給付上訴人78,473元，及均自98年12\n    月8 日起至清償日止，按週年利率5%計算之利息；及就原審\n    判命連帶給付278,015 元部分，乙○○應再給付自96年8 月\n    2 日起至98年12月7 日止，倢運通運有限公司應再給付自96\n    年8 月2 日起至98年11月25日止，均按週年利率5%計算之利\n    息，為無理由，應予駁回。原審為上訴人此部分敗訴之判決\n    ，其理由雖有不同，惟結論並無二致，上訴意旨指摘原判決\n    不當，求予廢棄改判，仍應認為無理由，應予駁回。\n七、本件事證已臻明確，兩造其餘攻擊防禦方法，經審酌後與本\n    院前揭判斷不生影響，毋庸再予審酌，併此敘明。\n八、據上論結：本件上訴為無理由，依民事訴訟法第436條之一\n    第3項、第449條第1項、第78條，判決如主文。\n中    華    民    國    99    年    5     月    12    日\n                  民事第五庭  審判長法  官  薛中興\n                                    法  官  胡宏文\n                                    法  官  吳佳薇\n以上正本係照原本作成。\n本判決不得上訴。\n中    華    民    國    99    年    5     月    12    日\n                                    書記官  黃曼琳",
  "structure": {
    "main": "上訴駁回。\n第二審訴訟費用由上訴人負擔。",
    "fact": "壹、程序方面：\n一、按解散之公司，除因合併、破產解散者外，應行清算；解散\n    之公司，於清算範圍內，視為尚未解散，公司法第24條、第\n    25條分別定有明文。次按公司之清算，以全體股東為清算人\n    ，但本法或章程另有規定或經股東決議，另選清算人者，不\n    在此限，同法第79條亦定有明文，此規定，依同法第113 條\n    規定，亦為有限公司所準用。本件被上訴人倢運通運有限公\n    司（下稱倢運公司）雖已向經濟部為解散登記，有經濟部函\n    暨公司變更登記表各1 份在卷可稽（見原審卷第60-62 頁）\n    ，然其並未向管轄法院陳報清算案件，按諸上揭規定，應視\n    為該公司尚未解散，又該公司為一人公司，董事為丙○○，\n    自應以其為清算人，為本件訴訟之法定代理人。\n二、按當事人在第二審不得提出新攻擊或防禦方法，但如不許其\n    提出顯失公平者，不在此限，此觀民事訴訟法第447 條第1\n    項第6 款規定即明。又此項規定，依同法第436 條之1 第3\n    項、第446 條第1 項規定亦於簡易訴訟第二審程序準用之。\n    本件侵權行為損害賠償請求權若已罹於2 年時效而消滅，被\n    上訴人自得不附任何理由主張時效抗辯而拒絕給付，因第二\n    審仍為事實審，如不許被上訴人於第二審法院為主張，限制\n    被上訴人合法權利之行使，顯失公平，其抗辯應予審酌，自\n    應許被上訴人得於本院提出時效抗辯而拒絕給付，以維護法\n    律賦予之權益。故上訴人主張被上訴人於原審程序中未提出\n    時效抗辯之攻擊防禦方法，已不得於本院程序中提出云云，\n    委無足取，先予敘明。\n貳、實體方面：\n一、上訴人主張：被上訴人乙○○於民國96年7月11日18時57分\n    ，駕駛被上訴人倢運公司所有車號2438-NT 號自小貨車，行\n    經國道三號公路南向20公里處時，因未保持安全距離，追撞\n    前方伊所駕駛之1896-EL 號自小客貨車（下稱系爭車輛），\n    系爭車輛復往前推撞由訴外人張怡廣所駕駛之車號DM-9296\n    自小客車，致系爭車輛之車頭及車尾受有損害。伊為回復該\n    車原狀，共支出修理費用新台幣（下同）196,000 元（零件\n    部分為92,972元，工資93,605元），另修車期間支出代步車\n    費16,000元、拖車費3,300 元及480 元、計程車資440 元、\n    車輛價值減損鑑定費3,500 元，且系爭車輛因系爭事故減損\n    價值100,000 元，共計受有35萬6,488 元之損害，伊自得依\n    侵權行為之法則，請求被上訴人乙○○賠償上開金額；又被\n    上訴人倢運公司為乙○○之僱用人，應與乙○○負連帶賠償\n    之責等語。\n二、被上訴人則以：本件上訴人之侵權行為損害賠償請求權已罹\n    於2 年請求權時效，被上訴人自得拒絕給付。又系爭車輛更\n    換新零件本即應折舊，原審判決並無違誤等語置辯。\n三、原審為上訴人部分勝訴之判決，判命被上訴人應連帶給付上\n    訴人278,015 元，及被上訴人乙○○部分自98年12月8 日起\n    ，被上訴人倢運通運有限公司部分自98年11月26日起，均至\n    清償日止，按週年利率5%計算之利息，並依職權為准免假執\n    行之宣告，另駁回被上訴人其餘請求。上訴人對原審判決敗\n    訴部分提起上訴，並於本院為上訴聲明：(一)原判決不利於上\n    訴人部分廢棄。(二)上開廢棄部分，被上訴人乙○○、倢運通\n    運有限公司應再連帶給付上訴人78,473元，及均自98年12月\n    8 日起至清償日止，按週年利率5%計算之利息。及就原審判\n    命連帶給付278,015 元部分，乙○○應再給付自96年8 月2\n    日起至98年12月7 日止，倢運通運有限公司應再給付自96年\n    8 月2 日起至98年11月25日止，均按週年利率5%計算之利息\n    。被上訴人乙○○、倢運公司則答辯聲明：上訴駁回。\n四、兩造不爭執事項：\n  (一)被上訴人乙○○於96年7 月11日18時57分，駕駛被上訴人倢\n    運通運有限公司所有車號2438-NT 號自小貨車，行經國道三\n    號公路南向20公里處時，因未保持安全距離，追撞前方伊所\n    駕駛之系爭自小客貨車，系爭車輛往前推撞由訴外人張怡廣\n    駕駛之車號DM-9296 自小客車，致系爭車輛之車頭及車尾受\n    有損害。\n  (二)上訴人因回復該車原狀共支出修理費用196,000 元（零件部\n    分為92,972元，工資93,605元）、代步車費16,000元、拖車\n    費3,300 元及480 元、計程車資440 元、車輛價值減損鑑定\n    費3,500 元。\n  (三)系爭車輛因本次事故減損價值100,000元。\n五、本件上訴人請求被上訴人連帶賠償其因前開車禍事故所生之\n    損害，然為被上訴人所否認，並以前揭情詞置辯，是本件之\n    爭點厥為：(一)上訴人之侵權行為損害賠償請求權是否已罹於\n    時效？(二)若否，則被上訴人賠償上訴人回復原狀之必要費用\n    時，零件部分應否予以折舊？(三)上訴人請求加計自侵權行為\n    發生時起至起訴狀繕本送達翌日前之法定遲延利息，是否有\n    據？\n  (一)上訴人之侵權行為損害賠償請求權是否已罹於時效？\n  (1)按消滅時效，自請求權可行使時起算。時效完成後，債務人\n    得拒絕給付。又因侵權行為所生之損害賠償請求權，自請求\n    權人知有損害及賠償義務人時起，2 年間不行使而消滅。民\n    法第128 條前段、第144 條第1 項及同法第197 條第1 項前\n    段分別定有明文。查本件被上訴人乙○○於96年7 月11日，\n    在前開地點駕駛被上訴人倢運公司所有之車號2438-NT 號自\n    小貨車自後追撞上訴人所有之系爭車輛，並致上訴人之車輛\n    再往前推撞由訴外人張怡廣駕駛之車號DM-9296 自小客車等\n    情，為兩造所不爭執，已如前述，且本件車禍事故發生後，\n    上訴人之配偶旋即撥打電話報警前往處理，嗣後上訴人、被\n    上訴人乙○○及張怡廣等人復於當日下午7 時30分許，同至\n    國道公路警察局木柵分隊製作筆錄乙情，亦有渠等3 人之國\n    道公路警察局道路交通事故調查筆錄在卷可憑（見原審卷第\n    42-46 頁），顯見上訴人當場已知悉系爭車禍之發生係遭被\n    上訴人乙○○駕車自後追撞所致。再參諸上訴人於製作調查\n    筆錄時陳稱：我當時已煞車停等車道上，突然被一部車號24\n    38-NT 號自小貨車由後方追撞到我車後車尾，…，我車前後\n    保險桿及後車燈破損，…我保留告訴等語，堪認上訴人於事\n    故發生時，應已明確知悉其車輛受有損害，且被上訴人乙○\n    ○即為車禍肇事之侵權行為人無誤，故上訴人對被上訴人乙\n    ○○之侵權行為請求權時效應於斯時起開始起算，惟上訴人\n    遲至98年11月20日，始向本院訴請賠償，有98年11月20日本\n    院收狀戳1 枚（見原審卷第1 頁）在卷可佐，則上訴人對於\n    被上訴人乙○○之侵權行為損害賠償請求權應已罹於2 年之\n    消滅時效，當屬無疑。從而，被上訴人乙○○抗辯本件時效\n    已完成，其得拒絕給付等語，自為可取。\n  (二)再按，連帶債務人中之1 人消滅時效已完成者，依民法第27\n    6 條第2 項規定，固僅該債務人應分擔之部分，他債務人同\n    免其責任，惟民法第188 條第3 項規定，僱用人賠償損害時\n    ，對於侵權行為之受僱人有求償權，則僱用人與受僱人間並\n    無應分擔部分可言，倘被害人對為侵權行為之受僱人之損害\n    賠償請求權消滅時效業已完成，僱用人自得援用該受僱人之\n    時效利益，拒絕全部給付，不以該受僱人已為時效抗辯為必\n    要，有最高法院95年度台上字第1235號判決要旨可資參照。\n    則揆諸前開說明，本件被上訴人倢運公司就被上訴人乙○○\n    得拒絕給付部分，亦援用受僱人之時效利益，而拒絕全部之\n    給付，核屬有據。從而，上訴人依侵權行為之法律關係，請\n    求被上訴人乙○○、倢運通運有限公司除原審判命給付之金\n    額外，連帶賠償其零件折舊部分之損失，併請求一審勝訴部\n    分之本金再加計自損害發生時起至起訴狀繕本送達翌日前之\n    法定遲延利息云云，洵非正當，不應准許。\n六、綜上所述，上訴人依侵權行為之法律關係，訴請被上訴人乙\n    ○○、倢運公司再連帶給付上訴人78,473元，及均自98年12\n    月8 日起至清償日止，按週年利率5%計算之利息；及就原審\n    判命連帶給付278,015 元部分，乙○○應再給付自96年8 月\n    2 日起至98年12月7 日止，倢運通運有限公司應再給付自96\n    年8 月2 日起至98年11月25日止，均按週年利率5%計算之利\n    息，為無理由，應予駁回。原審為上訴人此部分敗訴之判決\n    ，其理由雖有不同，惟結論並無二致，上訴意旨指摘原判決\n    不當，求予廢棄改判，仍應認為無理由，應予駁回。\n七、本件事證已臻明確，兩造其餘攻擊防禦方法，經審酌後與本\n    院前揭判斷不生影響，毋庸再予審酌，併此敘明。\n八、據上論結：本件上訴為無理由，依民事訴訟法第436條之一\n    第3項、第449條第1項、第78條，判決如主文。",
    "reason": "壹、程序方面：\n一、按解散之公司，除因合併、破產解散者外，應行清算；解散\n    之公司，於清算範圍內，視為尚未解散，公司法第24條、第\n    25條分別定有明文。次按公司之清算，以全體股東為清算人\n    ，但本法或章程另有規定或經股東決議，另選清算人者，不\n    在此限，同法第79條亦定有明文，此規定，依同法第113 條\n    規定，亦為有限公司所準用。本件被上訴人倢運通運有限公\n    司（下稱倢運公司）雖已向經濟部為解散登記，有經濟部函\n    暨公司變更登記表各1 份在卷可稽（見原審卷第60-62 頁）\n    ，然其並未向管轄法院陳報清算案件，按諸上揭規定，應視\n    為該公司尚未解散，又該公司為一人公司，董事為丙○○，\n    自應以其為清算人，為本件訴訟之法定代理人。\n二、按當事人在第二審不得提出新攻擊或防禦方法，但如不許其\n    提出顯失公平者，不在此限，此觀民事訴訟法第447 條第1\n    項第6 款規定即明。又此項規定，依同法第436 條之1 第3\n    項、第446 條第1 項規定亦於簡易訴訟第二審程序準用之。\n    本件侵權行為損害賠償請求權若已罹於2 年時效而消滅，被\n    上訴人自得不附任何理由主張時效抗辯而拒絕給付，因第二\n    審仍為事實審，如不許被上訴人於第二審法院為主張，限制\n    被上訴人合法權利之行使，顯失公平，其抗辯應予審酌，自\n    應許被上訴人得於本院提出時效抗辯而拒絕給付，以維護法\n    律賦予之權益。故上訴人主張被上訴人於原審程序中未提出\n    時效抗辯之攻擊防禦方法，已不得於本院程序中提出云云，\n    委無足取，先予敘明。\n貳、實體方面：\n一、上訴人主張：被上訴人乙○○於民國96年7月11日18時57分\n    ，駕駛被上訴人倢運公司所有車號2438-NT 號自小貨車，行\n    經國道三號公路南向20公里處時，因未保持安全距離，追撞\n    前方伊所駕駛之1896-EL 號自小客貨車（下稱系爭車輛），\n    系爭車輛復往前推撞由訴外人張怡廣所駕駛之車號DM-9296\n    自小客車，致系爭車輛之車頭及車尾受有損害。伊為回復該\n    車原狀，共支出修理費用新台幣（下同）196,000 元（零件\n    部分為92,972元，工資93,605元），另修車期間支出代步車\n    費16,000元、拖車費3,300 元及480 元、計程車資440 元、\n    車輛價值減損鑑定費3,500 元，且系爭車輛因系爭事故減損\n    價值100,000 元，共計受有35萬6,488 元之損害，伊自得依\n    侵權行為之法則，請求被上訴人乙○○賠償上開金額；又被\n    上訴人倢運公司為乙○○之僱用人，應與乙○○負連帶賠償\n    之責等語。\n二、被上訴人則以：本件上訴人之侵權行為損害賠償請求權已罹\n    於2 年請求權時效，被上訴人自得拒絕給付。又系爭車輛更\n    換新零件本即應折舊，原審判決並無違誤等語置辯。\n三、原審為上訴人部分勝訴之判決，判命被上訴人應連帶給付上\n    訴人278,015 元，及被上訴人乙○○部分自98年12月8 日起\n    ，被上訴人倢運通運有限公司部分自98年11月26日起，均至\n    清償日止，按週年利率5%計算之利息，並依職權為准免假執\n    行之宣告，另駁回被上訴人其餘請求。上訴人對原審判決敗\n    訴部分提起上訴，並於本院為上訴聲明：(一)原判決不利於上\n    訴人部分廢棄。(二)上開廢棄部分，被上訴人乙○○、倢運通\n    運有限公司應再連帶給付上訴人78,473元，及均自98年12月\n    8 日起至清償日止，按週年利率5%計算之利息。及就原審判\n    命連帶給付278,015 元部分，乙○○應再給付自96年8 月2\n    日起至98年12月7 日止，倢運通運有限公司應再給付自96年\n    8 月2 日起至98年11月25日止，均按週年利率5%計算之利息\n    。被上訴人乙○○、倢運公司則答辯聲明：上訴駁回。\n四、兩造不爭執事項：\n  (一)被上訴人乙○○於96年7 月11日18時57分，駕駛被上訴人倢\n    運通運有限公司所有車號2438-NT 號自小貨車，行經國道三\n    號公路南向20公里處時，因未保持安全距離，追撞前方伊所\n    駕駛之系爭自小客貨車，系爭車輛往前推撞由訴外人張怡廣\n    駕駛之車號DM-9296 自小客車，致系爭車輛之車頭及車尾受\n    有損害。\n  (二)上訴人因回復該車原狀共支出修理費用196,000 元（零件部\n    分為92,972元，工資93,605元）、代步車費16,000元、拖車\n    費3,300 元及480 元、計程車資440 元、車輛價值減損鑑定\n    費3,500 元。\n  (三)系爭車輛因本次事故減損價值100,000元。\n五、本件上訴人請求被上訴人連帶賠償其因前開車禍事故所生之\n    損害，然為被上訴人所否認，並以前揭情詞置辯，是本件之\n    爭點厥為：(一)上訴人之侵權行為損害賠償請求權是否已罹於\n    時效？(二)若否，則被上訴人賠償上訴人回復原狀之必要費用\n    時，零件部分應否予以折舊？(三)上訴人請求加計自侵權行為\n    發生時起至起訴狀繕本送達翌日前之法定遲延利息，是否有\n    據？\n  (一)上訴人之侵權行為損害賠償請求權是否已罹於時效？\n  (1)按消滅時效，自請求權可行使時起算。時效完成後，債務人\n    得拒絕給付。又因侵權行為所生之損害賠償請求權，自請求\n    權人知有損害及賠償義務人時起，2 年間不行使而消滅。民\n    法第128 條前段、第144 條第1 項及同法第197 條第1 項前\n    段分別定有明文。查本件被上訴人乙○○於96年7 月11日，\n    在前開地點駕駛被上訴人倢運公司所有之車號2438-NT 號自\n    小貨車自後追撞上訴人所有之系爭車輛，並致上訴人之車輛\n    再往前推撞由訴外人張怡廣駕駛之車號DM-9296 自小客車等\n    情，為兩造所不爭執，已如前述，且本件車禍事故發生後，\n    上訴人之配偶旋即撥打電話報警前往處理，嗣後上訴人、被\n    上訴人乙○○及張怡廣等人復於當日下午7 時30分許，同至\n    國道公路警察局木柵分隊製作筆錄乙情，亦有渠等3 人之國\n    道公路警察局道路交通事故調查筆錄在卷可憑（見原審卷第\n    42-46 頁），顯見上訴人當場已知悉系爭車禍之發生係遭被\n    上訴人乙○○駕車自後追撞所致。再參諸上訴人於製作調查\n    筆錄時陳稱：我當時已煞車停等車道上，突然被一部車號24\n    38-NT 號自小貨車由後方追撞到我車後車尾，…，我車前後\n    保險桿及後車燈破損，…我保留告訴等語，堪認上訴人於事\n    故發生時，應已明確知悉其車輛受有損害，且被上訴人乙○\n    ○即為車禍肇事之侵權行為人無誤，故上訴人對被上訴人乙\n    ○○之侵權行為請求權時效應於斯時起開始起算，惟上訴人\n    遲至98年11月20日，始向本院訴請賠償，有98年11月20日本\n    院收狀戳1 枚（見原審卷第1 頁）在卷可佐，則上訴人對於\n    被上訴人乙○○之侵權行為損害賠償請求權應已罹於2 年之\n    消滅時效，當屬無疑。從而，被上訴人乙○○抗辯本件時效\n    已完成，其得拒絕給付等語，自為可取。\n  (二)再按，連帶債務人中之1 人消滅時效已完成者，依民法第27\n    6 條第2 項規定，固僅該債務人應分擔之部分，他債務人同\n    免其責任，惟民法第188 條第3 項規定，僱用人賠償損害時\n    ，對於侵權行為之受僱人有求償權，則僱用人與受僱人間並\n    無應分擔部分可言，倘被害人對為侵權行為之受僱人之損害\n    賠償請求權消滅時效業已完成，僱用人自得援用該受僱人之\n    時效利益，拒絕全部給付，不以該受僱人已為時效抗辯為必\n    要，有最高法院95年度台上字第1235號判決要旨可資參照。\n    則揆諸前開說明，本件被上訴人倢運公司就被上訴人乙○○\n    得拒絕給付部分，亦援用受僱人之時效利益，而拒絕全部之\n    給付，核屬有據。從而，上訴人依侵權行為之法律關係，請\n    求被上訴人乙○○、倢運通運有限公司除原審判命給付之金\n    額外，連帶賠償其零件折舊部分之損失，併請求一審勝訴部\n    分之本金再加計自損害發生時起至起訴狀繕本送達翌日前之\n    法定遲延利息云云，洵非正當，不應准許。\n六、綜上所述，上訴人依侵權行為之法律關係，訴請被上訴人乙\n    ○○、倢運公司再連帶給付上訴人78,473元，及均自98年12\n    月8 日起至清償日止，按週年利率5%計算之利息；及就原審\n    判命連帶給付278,015 元部分，乙○○應再給付自96年8 月\n    2 日起至98年12月7 日止，倢運通運有限公司應再給付自96\n    年8 月2 日起至98年11月25日止，均按週年利率5%計算之利\n    息，為無理由，應予駁回。原審為上訴人此部分敗訴之判決\n    ，其理由雖有不同，惟結論並無二致，上訴意旨指摘原判決\n    不當，求予廢棄改判，仍應認為無理由，應予駁回。\n七、本件事證已臻明確，兩造其餘攻擊防禦方法，經審酌後與本\n    院前揭判斷不生影響，毋庸再予審酌，併此敘明。\n八、據上論結：本件上訴為無理由，依民事訴訟法第436條之一\n    第3項、第449條第1項、第78條，判決如主文。"
  },
  "characters": {
    "judges": [
      "薛中興",
      "胡宏文",
      "吳佳薇"
    ],
    "prosecutors": [

    ],
    "lawyers": [

    ],
    "clerks": [

    ],
    "plaintiffs": [

    ],
    "defendants": [

    ],
    "prosecutor_office": [

    ],
    "creditors": [

    ],
    "debtors": [

    ],
    "judicial_associate_officer": [

    ]
  },
  "adjudged_at": "2010-05-12",
  "created_at": "2016-01-05 12:13:59",
  "updated_at": "2016-01-05 12:13:59"
}