{
  "identify": "TPD-99-司拍-110-20100512-2",
  "court": {
    "name": "臺灣臺北地方法院",
    "code": "TPD"
  },
  "division": {
    "name": "民事",
    "code": "V"
  },
  "year": 99,
  "word": "司拍",
  "number": "110",
  "jcheck": "2",
  "reason": "拍賣抵押物",
  "content": "臺灣臺北地方法院民事裁定             99年度司拍字第110號\n聲  請  人  國泰人壽保險股份有限公司\n法定代理人  甲○○\n相  對  人  乙○○\n上列當事人間聲請拍賣抵押物事件，本院裁定如下：\n    主  文\n相對人所有如附表所示之不動產，准予拍賣。\n聲請程序費用新臺幣貳仟元由相對人負擔。\n    理  由\n一、按抵押權人，於債權已屆清償期，而未受清償者，得聲請法\n    院，拍賣抵押物，就其賣得價金而受清償，上開規定於最高\n    限額抵押權亦準用之，民法第873 條、第881 條之17分別定\n    有明文。\n二、本件聲請意旨略以：相對人於民國96年2 月8 日，以其所有\n    如附表所示之不動產，為擔保其對聲請人所負之債務，設定\n    新臺幣（下同）6,480,000 元之最高限額抵押權，存續期間\n    自96年2 月8 日起至131 年2 月7 日止，債務清償期依照各\n    個債務契約所定清償日期，經登記在案。嗣相對人於96年2\n    月13日向聲請人借用5,400,000 元，約定前3 年按期付息不\n    還本金，後17年共分204 期，每期攤還部分本金及按借款餘\n    額計算之利息，如未依約履行，全部債務視為到期。詎相對\n    人未依約履行，尚欠4,300,000 元，依約應清償全部積欠債\n    務，為此聲請拍賣抵押物以資受償等語。\n三、經查聲請人上開主張，業據其提出抵押權設定契約書影本、\n    他項權利證明書影本、土地及建物登記謄本正本、其他約定\n    事項影本、借據及約定書影本等件為證。又經本院於99 年3\n    月18日發函通知相對人就本件聲請陳述意見，其迄未表示意\n    見，應認聲請人主張為可採。揆諸首揭規定，聲請人聲請拍\n    賣如附表所示之抵押物，洵屬有據，應予准許。\n四、依非訟事件法第21條第2 項、第24條第1 項、民事訴訟法第\n    78條，裁定如主文。\n五、如不服本裁定，應於裁定送達後10日內向本院提出抗告狀，\n    並繳納抗告費新臺幣1,000 元。\n中    華    民    國    99    年    5     月    12    日\n                  簡易庭司法事務官  鄧仁誠",
  "structure": {
    "main": "相對人所有如附表所示之不動產，准予拍賣。\n聲請程序費用新臺幣貳仟元由相對人負擔。",
    "reason": "一、按抵押權人，於債權已屆清償期，而未受清償者，得聲請法\n    院，拍賣抵押物，就其賣得價金而受清償，上開規定於最高\n    限額抵押權亦準用之，民法第873 條、第881 條之17分別定\n    有明文。\n二、本件聲請意旨略以：相對人於民國96年2 月8 日，以其所有\n    如附表所示之不動產，為擔保其對聲請人所負之債務，設定\n    新臺幣（下同）6,480,000 元之最高限額抵押權，存續期間\n    自96年2 月8 日起至131 年2 月7 日止，債務清償期依照各\n    個債務契約所定清償日期，經登記在案。嗣相對人於96年2\n    月13日向聲請人借用5,400,000 元，約定前3 年按期付息不\n    還本金，後17年共分204 期，每期攤還部分本金及按借款餘\n    額計算之利息，如未依約履行，全部債務視為到期。詎相對\n    人未依約履行，尚欠4,300,000 元，依約應清償全部積欠債\n    務，為此聲請拍賣抵押物以資受償等語。\n三、經查聲請人上開主張，業據其提出抵押權設定契約書影本、\n    他項權利證明書影本、土地及建物登記謄本正本、其他約定\n    事項影本、借據及約定書影本等件為證。又經本院於99 年3\n    月18日發函通知相對人就本件聲請陳述意見，其迄未表示意\n    見，應認聲請人主張為可採。揆諸首揭規定，聲請人聲請拍\n    賣如附表所示之抵押物，洵屬有據，應予准許。\n四、依非訟事件法第21條第2 項、第24條第1 項、民事訴訟法第\n    78條，裁定如主文。\n五、如不服本裁定，應於裁定送達後10日內向本院提出抗告狀，\n    並繳納抗告費新臺幣1,000 元。"
  },
  "characters": {
    "judges": [

    ],
    "prosecutors": [

    ],
    "lawyers": [

    ],
    "clerks": [

    ],
    "plaintiffs": [

    ],
    "defendants": [

    ],
    "prosecutor_office": [
      "國泰人壽保險股份有限公司"
    ],
    "creditors": [

    ],
    "debtors": [

    ],
    "judicial_associate_officer": [
      "鄧仁誠"
    ]
  },
  "adjudged_at": "2010-05-12",
  "created_at": "2016-01-05 12:11:17",
  "updated_at": "2016-01-05 12:11:17"
}