{
  "identify": "TPD-99-審聲-197-20100512-2",
  "court": {
    "name": "臺灣臺北地方法院",
    "code": "TPD"
  },
  "division": {
    "name": "民事",
    "code": "V"
  },
  "year": 99,
  "word": "審聲",
  "number": "197",
  "jcheck": "2",
  "reason": "公示送達",
  "content": "臺灣臺北地方法院民事裁定             99年度審聲字第197號\n聲  請  人  茂潁實業股份有限公司\n法定代理人  甲○○\n相  對  人  乙○○\n上列當事人間聲請公示送達事件，本院裁定如下：\n    主  文\n本件移送臺灣士林地方法院。\n    理  由\n一、按民法第97條之聲請公示送達事件，不知相對人之居所者，\n    由相對人最後住所地之法院管轄，非訟事件法第66條定有明\n    文。次按訴訟之全部或一部，法院認為無管轄權者，依原告\n    聲請或依職權以裁定移送於其管轄法院，民事訴訟法第28條\n    第1項亦有明定；此項規定於非訟事件準用之，非訟事件法\n    第5條規定甚明。\n二、本件聲請人聲請向相對人乙○○為意思表示公示送達，惟查\n    ，相對人乙○○最後住所地係設於臺北市南港區，有戶籍謄\n    本附卷可稽。揆諸首揭法條規定，本件自應由臺灣士林地方\n    法院管轄，茲聲請人向無管轄權之本院聲請，顯有違誤，依\n    非訴事件法第5條之規定，應依職權裁定移送管轄法院即臺\n    灣士林地方法院。\n三、依首開法條裁定如主文。\n中    華    民    國    99    年    5    月    12    日\n                  民事第六庭    法    官  朱漢寶\n以上正本係照原本作成\n如不服本裁定應於送達後10日內向本院提出抗告狀，並繳納抗告\n費新臺幣1,000元。\n中    華    民    國    99    年    5    月    12    日\n                                書記官  陳素卿",
  "structure": {
    "main": "本件移送臺灣士林地方法院。",
    "reason": "一、按民法第97條之聲請公示送達事件，不知相對人之居所者，\n    由相對人最後住所地之法院管轄，非訟事件法第66條定有明\n    文。次按訴訟之全部或一部，法院認為無管轄權者，依原告\n    聲請或依職權以裁定移送於其管轄法院，民事訴訟法第28條\n    第1項亦有明定；此項規定於非訟事件準用之，非訟事件法\n    第5條規定甚明。\n二、本件聲請人聲請向相對人乙○○為意思表示公示送達，惟查\n    ，相對人乙○○最後住所地係設於臺北市南港區，有戶籍謄\n    本附卷可稽。揆諸首揭法條規定，本件自應由臺灣士林地方\n    法院管轄，茲聲請人向無管轄權之本院聲請，顯有違誤，依\n    非訴事件法第5條之規定，應依職權裁定移送管轄法院即臺\n    灣士林地方法院。\n三、依首開法條裁定如主文。"
  },
  "characters": {
    "judges": [
      "朱漢寶"
    ],
    "prosecutors": [

    ],
    "lawyers": [

    ],
    "clerks": [

    ],
    "plaintiffs": [

    ],
    "defendants": [

    ],
    "prosecutor_office": [
      "茂潁實業股份有限公司"
    ],
    "creditors": [

    ],
    "debtors": [

    ],
    "judicial_associate_officer": [

    ]
  },
  "adjudged_at": "2010-05-12",
  "created_at": "2016-01-05 12:10:40",
  "updated_at": "2016-01-05 12:10:40"
}