{
  "identify": "TPD-99-審聲-203-20100512-1",
  "court": {
    "name": "臺灣臺北地方法院",
    "code": "TPD"
  },
  "division": {
    "name": "民事",
    "code": "V"
  },
  "year": 99,
  "word": "審聲",
  "number": "203",
  "jcheck": "1",
  "reason": "公示送達",
  "content": "臺灣臺北地方法院民事裁定             99年度審聲字第203號\n聲  請  人  台北國寶資產管理有限公司\n法定代理人  乙○○\n相  對  人  甲○○\n上列聲請人聲請對相對人為公示送達事件，本院裁定如下：\n    主  文\n本件移送臺灣士林地方法院。\n    理  由\n一、按民法第九十七條之聲請公示送達事件，不知相對人之姓名\n    時，由表意人住所地之法院管轄；不知相對人之居所者，由\n    相對人最後住所地之法院管轄，非訟事件法第66條定有明文\n    。次按，訴訟之全部或一部，法院認為無管轄權者，依原告\n    聲請或依職權以裁定移送其管轄法院，民事訴訟法第28條第\n    1項亦有明文，上開規定依非訟事件法第5條規定，於非訟事\n    件準用之。\n二、本件聲請人聲請對相對人甲○○為公示送達，查相對人最後\n    登記之戶籍所在地在臺北市○○區○○路171巷28弄4號5樓\n    ，經臺北市南港區戶政事務所民國94年5月16日核准逕為住\n    址變更至臺北市○○路○段360號4樓（即臺北市南港戶政事\n    務所），揆諸首開法條規定，本件自應由臺灣士林地方法院\n    管轄，玆聲請人向無管轄權之本院提出聲請，顯係違誤。爰\n    依職權將本件移送於該管轄法院。\n三、依非訟事件法第5條、民事訴訟法第28條第1項，裁定如主文\n    。\n中    華    民    國    99    年    5    月    12   日\n                  民事第六庭法   官  朱漢寶\n以上正本係照原本作成。\n如不服本裁定應於送達後10日內向本院提出抗告狀，並繳納抗告\n費新臺幣1,000元。\n中    華    民    國    99    年    5    月    12   日\n                            書記官  陳素卿",
  "structure": {
    "main": "本件移送臺灣士林地方法院。",
    "reason": "一、按民法第九十七條之聲請公示送達事件，不知相對人之姓名\n    時，由表意人住所地之法院管轄；不知相對人之居所者，由\n    相對人最後住所地之法院管轄，非訟事件法第66條定有明文\n    。次按，訴訟之全部或一部，法院認為無管轄權者，依原告\n    聲請或依職權以裁定移送其管轄法院，民事訴訟法第28條第\n    1項亦有明文，上開規定依非訟事件法第5條規定，於非訟事\n    件準用之。\n二、本件聲請人聲請對相對人甲○○為公示送達，查相對人最後\n    登記之戶籍所在地在臺北市○○區○○路171巷28弄4號5樓\n    ，經臺北市南港區戶政事務所民國94年5月16日核准逕為住\n    址變更至臺北市○○路○段360號4樓（即臺北市南港戶政事\n    務所），揆諸首開法條規定，本件自應由臺灣士林地方法院\n    管轄，玆聲請人向無管轄權之本院提出聲請，顯係違誤。爰\n    依職權將本件移送於該管轄法院。\n三、依非訟事件法第5條、民事訴訟法第28條第1項，裁定如主文\n    。"
  },
  "characters": {
    "judges": [
      "朱漢寶"
    ],
    "prosecutors": [

    ],
    "lawyers": [

    ],
    "clerks": [

    ],
    "plaintiffs": [

    ],
    "defendants": [

    ],
    "prosecutor_office": [
      "台北國寶資產管理有限公司"
    ],
    "creditors": [

    ],
    "debtors": [

    ],
    "judicial_associate_officer": [

    ]
  },
  "adjudged_at": "2010-05-12",
  "created_at": "2016-01-05 12:10:44",
  "updated_at": "2016-01-05 12:10:44"
}