{
  "identify": "TPD-98-審司聲-1841-20100104-2",
  "court": {
    "name": "臺灣臺北地方法院",
    "code": "TPD"
  },
  "division": {
    "name": "民事",
    "code": "V"
  },
  "year": 98,
  "word": "審司聲",
  "number": "1841",
  "jcheck": "2",
  "reason": "確定訴訟費用額",
  "content": "臺灣臺北地方法院民事裁定          98年度審司聲字第1841號\n聲  請  人  丙○○原名廖送進.\n相  對  人  新光人壽保險股份有限公司\n法定代理人  甲○○\n相  對  人  三商美邦人壽股份有限公司\n法定代理人  乙○○\n相  對  人  富邦人壽保險股份有限公司（原名美商美國安泰人\n            壽保險股份有限公司）\n法定代理人  戊○○\n相  對  人  國泰人壽保險股份有限公司\n法定代理人  丁○○\n上列當事人間聲請確定訴訟費用額事件，本院於民國九十八年十\n二月十八日所為之裁定，應裁定更正如下：\n    主  文\n原裁定主文欄關於「相對人應負擔之訴訟費用額確定為新臺幣壹\n萬捌仟柒佰貳拾壹元，及自本裁定送達相對人之翌日起至清償日\n止，按年息百分之五計算之利息」之記載，應更正為「相對人新\n光人壽保險股份有限公司應負擔之訴訟費用額確定為新臺幣陸萬\n捌仟陸佰陸拾捌元，及自本裁定送達相對人之翌日起至清償日止\n，按年息百分之五計算之利息。相對人富邦人壽保險股份有限公\n司應負擔之訴訟費用額確定為新臺幣貳拾伍萬捌仟佰貳拾貳元\n，及自本裁定送達相對人之翌日起至清償日止，按年息百分之五\n計算之利息。相對人三商美邦人壽股份有限公司應負擔之訴訟費\n用額確定為新臺幣肆萬肆仟玖佰柒拾陸元，及自本裁定送達相對\n人之翌日起至清償日止，按年息百分之五計算之利息。相對人國\n泰人壽保險股份有限公司應負擔之訴訟費用額確定為新臺幣肆萬\n仟柒佰肆拾元，及自本裁定送達相對人之翌日起至清償日止，\n按年息百分之五計算之利息」。\n    理  由\n一、按判決如有誤寫、誤算或其他類此之顯然錯誤者，法院得隨\n    時或依聲請以裁定更正之，民事訴訟法第232條第1項定有明\n    文。此於裁定準用之，同法第239條亦定有明文。\n二、查本院前開之裁定有如主文所示之顯然錯誤，應予更正。\n三、依首開規定裁定如主文。\n四、如不服本裁定，應於裁定送達後10日內，以書狀向司法事務\n    官提出異議。\n中    華    民    國    99    年    1     月    4     日\n                  民事第六庭    司法事務官  侯美滿",
  "structure": {
    "main": "原裁定主文欄關於「相對人應負擔之訴訟費用額確定為新臺幣壹\n萬捌仟柒佰貳拾壹元，及自本裁定送達相對人之翌日起至清償日\n止，按年息百分之五計算之利息」之記載，應更正為「相對人新\n光人壽保險股份有限公司應負擔之訴訟費用額確定為新臺幣陸萬\n捌仟陸佰陸拾捌元，及自本裁定送達相對人之翌日起至清償日止\n，按年息百分之五計算之利息。相對人富邦人壽保險股份有限公\n司應負擔之訴訟費用額確定為新臺幣貳拾伍萬捌仟佰貳拾貳元\n，及自本裁定送達相對人之翌日起至清償日止，按年息百分之五\n計算之利息。相對人三商美邦人壽股份有限公司應負擔之訴訟費\n用額確定為新臺幣肆萬肆仟玖佰柒拾陸元，及自本裁定送達相對\n人之翌日起至清償日止，按年息百分之五計算之利息。相對人國\n泰人壽保險股份有限公司應負擔之訴訟費用額確定為新臺幣肆萬\n仟柒佰肆拾元，及自本裁定送達相對人之翌日起至清償日止，\n按年息百分之五計算之利息」。",
    "reason": "一、按判決如有誤寫、誤算或其他類此之顯然錯誤者，法院得隨\n    時或依聲請以裁定更正之，民事訴訟法第232條第1項定有明\n    文。此於裁定準用之，同法第239條亦定有明文。\n二、查本院前開之裁定有如主文所示之顯然錯誤，應予更正。\n三、依首開規定裁定如主文。\n四、如不服本裁定，應於裁定送達後10日內，以書狀向司法事務\n    官提出異議。"
  },
  "characters": {
    "judges": [

    ],
    "prosecutors": [

    ],
    "lawyers": [

    ],
    "clerks": [

    ],
    "plaintiffs": [

    ],
    "defendants": [

    ],
    "prosecutor_office": [
      "丙"
    ],
    "creditors": [

    ],
    "debtors": [

    ],
    "judicial_associate_officer": [
      "侯美滿"
    ]
  },
  "adjudged_at": "2010-01-04",
  "created_at": "2016-01-05 14:48:39",
  "updated_at": "2016-01-05 14:48:39"
}