{
  "identify": "TPD-98-審司聲-3607-20100512-1",
  "court": {
    "name": "臺灣臺北地方法院",
    "code": "TPD"
  },
  "division": {
    "name": "民事",
    "code": "V"
  },
  "year": 98,
  "word": "審司聲",
  "number": "3607",
  "jcheck": "1",
  "reason": "返還提存物",
  "content": "臺灣臺北地方法院民事裁定          98年度審司聲字第3607號\n聲  請  人  玉山商業銀行股份有限公司\n法定代理人  戊○○\n代  理  人  甲○○\n相  對  人  丁○○\n            丙○○\n            乙○○\n上列聲請人聲請返還提存物事件，本院裁定如下：\n    主  文\n本院九十七年度存字第一四九七號擔保提存事件聲請人所提存之\n中央政府建設公債九十年度甲類第一期登錄債券面額新臺幣壹佰\n萬元，准予發還。\n    理  由\n一、按訴訟終結後，法院依供擔保人之聲請，通知受擔保利益人\n    於一定期間內行使權利並向法院為行使權利之證明而未證明\n    者，法院應依供擔保人之聲請，以裁定命返還其提存物，民\n    事訴訟法第104條第1項第3款後段定有明文。前開規定，於\n    其他依法令供訴訟上之擔保者準用之，並為同法第106條所\n    規定。\n二、聲請意旨略以：聲請人與相對人間請求假扣押事件，聲請人\n    前遵本院97年度裁全字第2468號假扣押裁定為擔保假扣押，\n    曾提供如主文所示之提存物為擔保，並以如主文所示之擔保\n    提存事件提存在案，茲因聲請人已撤回假扣押執行在案，並\n    聲請本院以98年度審司聲字第1293號函通知相對人於25日內\n    ，對聲請人行使權利並向本院提出行使權利之證明，該通知\n    業已合法送達相對人，惟相對人迄今仍未行使權利並向本院\n    提出已行使權利之證明，為此聲請返還提存物等語。並提出\n    假扣押裁定、提存書、撤回執行狀、行使權利通知函（以上\n    均為影本）等件為證。\n三、聲請人所述，經本院依職權調閱上開行使權利卷、擔保提存\n    卷、假扣押卷、本院97年度執全字第893號假扣押執行卷等\n    卷宗，查明屬實，聲請人聲請返還擔保金，核無不合，應予\n    准許。\n四、如不服本裁定，應於裁定送達後10日內，以書狀向司法事務\n    官提出異議。\n中    華    民    國    99    年    5     月    12    日\n                  民事第六庭    司法事務官  侯美滿",
  "structure": {
    "main": "本院九十七年度存字第一四九七號擔保提存事件聲請人所提存之\n中央政府建設公債九十年度甲類第一期登錄債券面額新臺幣壹佰\n萬元，准予發還。",
    "reason": "一、按訴訟終結後，法院依供擔保人之聲請，通知受擔保利益人\n    於一定期間內行使權利並向法院為行使權利之證明而未證明\n    者，法院應依供擔保人之聲請，以裁定命返還其提存物，民\n    事訴訟法第104條第1項第3款後段定有明文。前開規定，於\n    其他依法令供訴訟上之擔保者準用之，並為同法第106條所\n    規定。\n二、聲請意旨略以：聲請人與相對人間請求假扣押事件，聲請人\n    前遵本院97年度裁全字第2468號假扣押裁定為擔保假扣押，\n    曾提供如主文所示之提存物為擔保，並以如主文所示之擔保\n    提存事件提存在案，茲因聲請人已撤回假扣押執行在案，並\n    聲請本院以98年度審司聲字第1293號函通知相對人於25日內\n    ，對聲請人行使權利並向本院提出行使權利之證明，該通知\n    業已合法送達相對人，惟相對人迄今仍未行使權利並向本院\n    提出已行使權利之證明，為此聲請返還提存物等語。並提出\n    假扣押裁定、提存書、撤回執行狀、行使權利通知函（以上\n    均為影本）等件為證。\n三、聲請人所述，經本院依職權調閱上開行使權利卷、擔保提存\n    卷、假扣押卷、本院97年度執全字第893號假扣押執行卷等\n    卷宗，查明屬實，聲請人聲請返還擔保金，核無不合，應予\n    准許。\n四、如不服本裁定，應於裁定送達後10日內，以書狀向司法事務\n    官提出異議。"
  },
  "characters": {
    "judges": [

    ],
    "prosecutors": [

    ],
    "lawyers": [

    ],
    "clerks": [

    ],
    "plaintiffs": [

    ],
    "defendants": [

    ],
    "prosecutor_office": [
      "玉山商業銀行股份有限公司"
    ],
    "creditors": [

    ],
    "debtors": [

    ],
    "judicial_associate_officer": [
      "侯美滿"
    ]
  },
  "adjudged_at": "2010-05-12",
  "created_at": "2016-01-05 12:16:14",
  "updated_at": "2016-01-05 12:16:14"
}