{
  "identify": "TPD-99-審聲-135-20100512-1",
  "court": {
    "name": "臺灣臺北地方法院",
    "code": "TPD"
  },
  "division": {
    "name": "民事",
    "code": "V"
  },
  "year": 99,
  "word": "審聲",
  "number": "135",
  "jcheck": "1",
  "reason": "選任特別代理人",
  "content": "臺灣臺北地方法院民事裁定             99年度審聲字第135號\n聲  請  人  中華電信股份有限公司臺灣北區電信分公司\n法定代理人  甲○○\n上列聲請人聲請選任相對人昶臣實業股份有限公司特別代理人事\n件，本院裁定如下：\n   主  文\n聲請駁回。\n聲請程序費用新台幣壹仟元由聲請人負擔。\n    理  由\n一、本件聲請意旨略以：相對人昶臣實業股份有限公司（下稱昶\n    臣公司）因積欠聲請人電信費用，經聲請人提起督促程序，\n    現由本院以99年度司促字第2611號審理在案，惟相對人昶臣\n    公司之原法定代理人孔文生業已死亡，無人擔任法定代理人\n    ，致程序無法進行，爰依法聲請選任特別代理人云云。\n二、按對於無訴訟能力人為訴訟行為，因其無法定代理人，或其\n    法定代理人不能行代理權，恐放久延而受損害者，得聲請受\n    訴法院之審判長選任特別代理人；本法關於法定代理人之規\n    定，於法人之代表人準用之，民事訴訟法第51條第1項、第5\n    2條定有明文。又按股份有限公司之董事長對內為股東會、\n    董事會及常務董事會主席，對外代表公司。董事長請假或因\n    故不能行使職權時，由副董事長代理之；無副董事長或副董\n    事長亦請假或因故不能行使職權時，由董事長指定常務董事\n    1人代理之；其未設常務董事者，指定董事1人代理之；董事\n    長未指定代理人者，由常務董事或董事互推1人代理之，公\n    司法第208條第3項定有明文。如常務董事或董事未互推1人\n    代理，則依同法第8條第1項規定意旨，應由全體常務董事或\n    全體董事代表公司（最高法院97年度台聲字第595號裁定參\n    照）。\n三、經查，本件聲請人雖主張相對人昶臣公司之法定代理人孔文\n    生已於民國98年9月22日死亡，有戶籍謄本1紙附卷可稽，然\n    該公司董事尚有蔡萬水及潘台雲2人，亦有昶臣公司變更登\n    記表在卷可佐，縱該2名董事未能互推1人代理董事長，惟揆\n    諸上開說明，即應由全體董事代表公司，是聲請人與昶臣公\n    司間本院99年度司促字第2611號督促程序事件，即無聲請選\n    任特別代理人之必要。從而，本件聲請人聲請選任相對人昶\n    臣公司之特別代理人，核與民事訴訟法第51條第2項規定之\n    要件不符，不能准許，應予駁回。\n四、依非訟事件法第21條第1項前段、第24條、民事訴訟法第95\n    條、第78條，裁定如主文。\n中    華    民    國    99    年    5     月    12    日\n                  民事第六庭    法  官  陶亞琴\n以上正本係照原本作成\n如對本裁定抗告須於裁定送達後10日內向本院提出抗告狀，並繳\n納抗告費新台幣1,000元\n中    華    民    國    99    年    5     月    12    日\n                                書記官  曹瓊文",
  "structure": {
    "main": "聲請駁回。\n聲請程序費用新台幣壹仟元由聲請人負擔。",
    "reason": "一、本件聲請意旨略以：相對人昶臣實業股份有限公司（下稱昶\n    臣公司）因積欠聲請人電信費用，經聲請人提起督促程序，\n    現由本院以99年度司促字第2611號審理在案，惟相對人昶臣\n    公司之原法定代理人孔文生業已死亡，無人擔任法定代理人\n    ，致程序無法進行，爰依法聲請選任特別代理人云云。\n二、按對於無訴訟能力人為訴訟行為，因其無法定代理人，或其\n    法定代理人不能行代理權，恐放久延而受損害者，得聲請受\n    訴法院之審判長選任特別代理人；本法關於法定代理人之規\n    定，於法人之代表人準用之，民事訴訟法第51條第1項、第5\n    2條定有明文。又按股份有限公司之董事長對內為股東會、\n    董事會及常務董事會主席，對外代表公司。董事長請假或因\n    故不能行使職權時，由副董事長代理之；無副董事長或副董\n    事長亦請假或因故不能行使職權時，由董事長指定常務董事\n    1人代理之；其未設常務董事者，指定董事1人代理之；董事\n    長未指定代理人者，由常務董事或董事互推1人代理之，公\n    司法第208條第3項定有明文。如常務董事或董事未互推1人\n    代理，則依同法第8條第1項規定意旨，應由全體常務董事或\n    全體董事代表公司（最高法院97年度台聲字第595號裁定參\n    照）。\n三、經查，本件聲請人雖主張相對人昶臣公司之法定代理人孔文\n    生已於民國98年9月22日死亡，有戶籍謄本1紙附卷可稽，然\n    該公司董事尚有蔡萬水及潘台雲2人，亦有昶臣公司變更登\n    記表在卷可佐，縱該2名董事未能互推1人代理董事長，惟揆\n    諸上開說明，即應由全體董事代表公司，是聲請人與昶臣公\n    司間本院99年度司促字第2611號督促程序事件，即無聲請選\n    任特別代理人之必要。從而，本件聲請人聲請選任相對人昶\n    臣公司之特別代理人，核與民事訴訟法第51條第2項規定之\n    要件不符，不能准許，應予駁回。\n四、依非訟事件法第21條第1項前段、第24條、民事訴訟法第95\n    條、第78條，裁定如主文。"
  },
  "characters": {
    "judges": [
      "陶亞琴"
    ],
    "prosecutors": [

    ],
    "lawyers": [

    ],
    "clerks": [

    ],
    "plaintiffs": [

    ],
    "defendants": [

    ],
    "prosecutor_office": [
      "中華電信股份有限公司臺灣北區電信分公司"
    ],
    "creditors": [

    ],
    "debtors": [

    ],
    "judicial_associate_officer": [

    ]
  },
  "adjudged_at": "2010-05-12",
  "created_at": "2016-01-05 12:15:51",
  "updated_at": "2016-01-05 12:15:51"
}