{
  "identify": "TPD-99-消債核-5931-20100512-1",
  "court": {
    "name": "臺灣臺北地方法院",
    "code": "TPD"
  },
  "division": {
    "name": "民事",
    "code": "V"
  },
  "year": 99,
  "word": "消債核",
  "number": "5931",
  "jcheck": "1",
  "reason": "消債之前置協商認可事件",
  "content": "臺灣臺北地方法院民事裁定          99年度消債核字第5931號\n聲  請  人\n即債權人    甲○（台灣）商業銀行股份有限公司\n法定代理人  癸○○\n聲  請  人\n即債權人    華南商業銀行股份有限公司\n法定代理人  丙○○\n聲  請  人\n即債權人    己○（台灣）商業銀行股份有限公司\n法定代理人  丁○○\n聲  請  人\n即債權人    澳商澳盛銀行集團股份有限公司\n法定代理人  壬○○\n聲  請  人\n即債權人    元大商業銀行股份有限公司\n法定代理人  子○○\n聲  請  人\n即債權人    台新國際商業銀行股份有限公司\n法定代理人  戊○○\n聲  請  人\n即債權人    日盛國際商業銀行股份有限公司\n法定代理人  庚○\n聲  請  人\n即債權人    中國信託商業銀行股份有限公司\n法定代理人  辛○○○○\n相  對  人\n即債務人    乙○○\n上列當事人間債務協商事件，本院裁定如下：\n    主  文\n如附件所示債權人與債務人間於民國99年5月3日協商成立之債務\n清償方案，予以認可。\n    理  由\n一、按債務人對於金融機構因消費借貸、自用住宅借款、信用卡\n    或現金卡契約而負債務，在聲請更生或清算前，應提出債權\n    人清冊，以書面向最大債權金融機構請求協商債務清償方案\n    並表明共同協商之意旨，消費者債務清理條例第151條第1項\n    定有明文。又前條第一項受請求之金融機構應於協商成立之\n    翌日起七日內，將債務清償方案送請金融機構所在地之管轄\n    法院審核，但當事人就債務清償方案已依公證法第13條第1\n    項規定，請求公證人作成公證書者，不在此限；前項債務清\n    償方案，法院應儘速審核，認與法令無牴觸者，應以裁定予\n    以認可，認與法令牴觸者，應以裁定不予認可，復為同條例\n    第152條第1項、第2項所明定。\n二、本件聲請意旨略以：債務人因消費借貸等契約而對金融機構\n    負有債務，並在聲請更生或清算前，提出債權人清冊，以書\n    面向聲請人即最大債權金融機構請求共同協商債務清償方案\n    ，茲因債務人與全體債權人已於民國99年5月3日協商成立，\n    爰將協商成立之債務清償方案送請本院審核，請求裁定予以\n    認可等語。\n三、查聲請人主張之上開事實，業據提出與其所述相符之前置協\n    商機制協議書（金融機構無擔保債權）等件為證，堪信為真\n    實。再觀諸債務人與全體債權人上開協商成立之債務清償方\n    案內容，並無牴觸法令之情事，爰裁定如主文。\n四、如不服本裁定，應於裁定送達後10日內，以書狀向本院司法\n    事務官提出異議。\n中    華    民    國    99    年    5     月    12    日\n                      民事庭司法事務官  廖益伶\n附件：前置協商機制協議書（金融機構無擔保債權）及前置協商\n      無擔保債務還款分配表暨表決結果各乙份。",
  "structure": {
    "main": "如附件所示債權人與債務人間於民國99年5月3日協商成立之債務\n清償方案，予以認可。",
    "reason": "一、按債務人對於金融機構因消費借貸、自用住宅借款、信用卡\n    或現金卡契約而負債務，在聲請更生或清算前，應提出債權\n    人清冊，以書面向最大債權金融機構請求協商債務清償方案\n    並表明共同協商之意旨，消費者債務清理條例第151條第1項\n    定有明文。又前條第一項受請求之金融機構應於協商成立之\n    翌日起七日內，將債務清償方案送請金融機構所在地之管轄\n    法院審核，但當事人就債務清償方案已依公證法第13條第1\n    項規定，請求公證人作成公證書者，不在此限；前項債務清\n    償方案，法院應儘速審核，認與法令無牴觸者，應以裁定予\n    以認可，認與法令牴觸者，應以裁定不予認可，復為同條例\n    第152條第1項、第2項所明定。\n二、本件聲請意旨略以：債務人因消費借貸等契約而對金融機構\n    負有債務，並在聲請更生或清算前，提出債權人清冊，以書\n    面向聲請人即最大債權金融機構請求共同協商債務清償方案\n    ，茲因債務人與全體債權人已於民國99年5月3日協商成立，\n    爰將協商成立之債務清償方案送請本院審核，請求裁定予以\n    認可等語。\n三、查聲請人主張之上開事實，業據提出與其所述相符之前置協\n    商機制協議書（金融機構無擔保債權）等件為證，堪信為真\n    實。再觀諸債務人與全體債權人上開協商成立之債務清償方\n    案內容，並無牴觸法令之情事，爰裁定如主文。\n四、如不服本裁定，應於裁定送達後10日內，以書狀向本院司法\n    事務官提出異議。"
  },
  "characters": {
    "judges": [

    ],
    "prosecutors": [

    ],
    "lawyers": [

    ],
    "clerks": [

    ],
    "plaintiffs": [

    ],
    "defendants": [

    ],
    "prosecutor_office": [

    ],
    "creditors": [
      "甲",
      "華南商業銀行股份有限公司",
      "己",
      "澳商澳盛銀行集團股份有限公司",
      "元大商業銀行股份有限公司",
      "台新國際商業銀行股份有限公司",
      "日盛國際商業銀行股份有限公司",
      "中國信託商業銀行股份有限公司"
    ],
    "debtors": [

    ],
    "judicial_associate_officer": [
      "廖益伶"
    ]
  },
  "adjudged_at": "2010-05-12",
  "created_at": "2016-01-05 12:16:54",
  "updated_at": "2016-01-05 12:16:54"
}