{
  "identify": "TPD-98-家救-161-20100104-1",
  "court": {
    "name": "臺灣臺北地方法院",
    "code": "TPD"
  },
  "division": {
    "name": "民事",
    "code": "V"
  },
  "year": 98,
  "word": "家救",
  "number": "161",
  "jcheck": "1",
  "reason": "訴訟救助",
  "content": "臺灣臺北地方法院民事裁定             98年度家救字第161號\n聲  請  人  甲○○\n代  理  人  陳鴻興律師\n上列聲請人因與相對人鄭淑芬間終止收養關係事件（本院九十八\n年度親字第一七六號），聲請人聲請訴訟救助，本院裁定如下：\n    主  文\n准予訴訟救助。\n    理  由\n一、按「經分會（法律扶助基金會分會）准予法律扶助之無資力\n    者，其於訴訟程序中，向法院聲請訴訟救助時，應准予訴訟\n    救助。但另有不符法律扶助事實之證明者，不在此限。」，\n    法律扶助法第六十二條定有明文。又「當事人無資力支出訴\n    訟費用者，法院應依聲請，以裁定准予訴訟救助。但顯無勝\n    訴之望者，不在此限。」，民事訴訟法第一百零七條規定甚\n    明。\n二、經查，本件聲請人終止收養關係事件，因無資力，經向財團\n    法人法律扶助基金會台北分會申請法律扶助，經該分會審查\n    後准予法律扶助，扶助種類係訴訟代理及辯護，民事通常程\n    序第一審，有該分會審查表等資料影本附卷可稽。本件聲請\n    人無資力，既已獲訴訟代理之救助，且訴訟非顯無勝訴之望\n    ，本件聲請於法即無不合，應予准許。\n三、依法律扶助法第六十二條、民事訴訟法第一百零七條，裁定\n    如主文。\n中    華    民    國    99    年    1     月    4     日\n                        家事法庭法  官  文衍正\n以上正本係照原本作成。\n如對本裁定抗告，須於裁定送達後10日之不變期間內，向本院提\n出抗告狀，並繳納抗告費新臺幣1,000元\n中    華    民    國    99    年    1     月    4     日\n                                書記官  陳俐妙",
  "structure": {
    "main": "准予訴訟救助。",
    "reason": "一、按「經分會（法律扶助基金會分會）准予法律扶助之無資力\n    者，其於訴訟程序中，向法院聲請訴訟救助時，應准予訴訟\n    救助。但另有不符法律扶助事實之證明者，不在此限。」，\n    法律扶助法第六十二條定有明文。又「當事人無資力支出訴\n    訟費用者，法院應依聲請，以裁定准予訴訟救助。但顯無勝\n    訴之望者，不在此限。」，民事訴訟法第一百零七條規定甚\n    明。\n二、經查，本件聲請人終止收養關係事件，因無資力，經向財團\n    法人法律扶助基金會台北分會申請法律扶助，經該分會審查\n    後准予法律扶助，扶助種類係訴訟代理及辯護，民事通常程\n    序第一審，有該分會審查表等資料影本附卷可稽。本件聲請\n    人無資力，既已獲訴訟代理之救助，且訴訟非顯無勝訴之望\n    ，本件聲請於法即無不合，應予准許。\n三、依法律扶助法第六十二條、民事訴訟法第一百零七條，裁定\n    如主文。"
  },
  "characters": {
    "judges": [
      "文衍正"
    ],
    "prosecutors": [

    ],
    "lawyers": [
      "陳鴻興"
    ],
    "clerks": [

    ],
    "plaintiffs": [

    ],
    "defendants": [

    ],
    "prosecutor_office": [
      "甲"
    ],
    "creditors": [

    ],
    "debtors": [

    ],
    "judicial_associate_officer": [

    ]
  },
  "adjudged_at": "2010-01-04",
  "created_at": "2016-01-05 14:49:40",
  "updated_at": "2016-01-05 14:49:40"
}