{
  "identify": "TPD-98-勞簡上-85-20100512-1",
  "court": {
    "name": "臺灣臺北地方法院",
    "code": "TPD"
  },
  "division": {
    "name": "民事",
    "code": "V"
  },
  "year": 98,
  "word": "勞簡上",
  "number": "85",
  "jcheck": "1",
  "reason": "給付資遣費",
  "content": "臺灣臺北地方法院民事判決            98年度勞簡上字第85號\n上  訴  人  甲○○\n訴訟代理人  吳秀娥律師\n被  上訴人  丙○○即大漢和風地政士事務所\n訴訟代理人  丁○○\n上列當事人間請求給付資遣費事件，上訴人對於中華民國98年11\n月24日本院臺北簡易庭98年度店勞簡字第21號第一審判決提起上\n訴，本院於99年4月28日言詞辯論終結，判決如下：\n    主      文\n上訴駁回。\n第二審訴訟費用由上訴人負擔。\n    事實及理由\n一、上訴人起訴主張：上訴人自民國92年11月1日起至97年11月\n    14日止任職被上訴人大漢和風地政士事務所。上訴人於97年\n    10月間妊娠早期因併發陰道出血及先兆性流產，分別於同年\n    10月23日、10月27日及10月30日於蕭仁哲婦產專科醫院，接\n    受口服藥及針劑安胎治療，然情況未見明顯改善遂再至臺大\n    醫院進行相關追蹤診療。被上訴人明知上訴人懷孕並有多次\n    至醫院安胎之紀錄，為規避上訴人之病假及產假，欲逼迫上\n    訴人離開職場，先以事務所業務減縮為由，於97年11月14日\n    表示要將上訴人工作地點由新店調至東森房屋，如此調動對\n    一般已在相同工作地點任職5年之員工尚屬困難，遑論上訴\n    人剛於1個月內頻繁至醫院安胎3次且於臺大醫院繼續追蹤治\n    療，如此調動對一位妊娠初期之孕婦屬惡意刁難。被上訴人\n    無故為調職未得上訴人同意，實係被上訴人單方更改勞動條\n    件，已違反勞動契約及違反勞動基準法（以下簡稱勞基法）\n    第14條第1項第6款之規定，故上訴人自知悉其情形之日起30\n    日內，依法終止勞動契約。被上訴人自92年11月1日起至97\n    年11月14日上訴人不同意調職而終止勞動契約止，上訴人前\n    6個月平均工資為4萬2950元，因跨勞保新舊制，被上訴人應\n    給付上訴人資遣費為14萬5643元，被上訴人另應給付上訴人\n    應休未休特別假之獎金1萬4005元，以上金額共計15萬9648\n    元，爰依法起訴請求，並聲明：被上訴人應給付上訴人15萬\n    9648元，及自訴狀繕本送達之翌日起至清償日止依年息5％\n    計算之利息。\n二、被上訴人則以：被上訴人不知上訴人懷孕，本件係因被上訴\n    人在深坑及安坑兩地之簽約量變多，故詢問所有員工是否有\n    人願常駐深坑或安坑的辦公室，並非針對上訴人而為，亦未\n    決定是否要員工前往深坑及安坑，遑論將上訴人違法調職。\n    詎上訴人於97年11月14日主動向主管乙○○辭職，並要求為\n    其爭取資遣費，實無理由等語置辯。\n三、原審判命被上訴人應給付上訴人應休未休特別假獎金1萬400\n    5元，而駁回關於資遣費之請求，並依職權宣告假執行及供\n    擔保免為假執行。被上訴人就原審判命給付部分未聲明上訴\n    ，業已確定；上訴人則就原審敗訴部分不服提起本件上訴，\n    並於本院聲明：（一）原判決不利上訴人部分廢棄；（二）\n    上開廢棄部分，被上訴人應再給付上訴人資遣費14萬5643\n    元，及自訴狀繕本送達翌日起至清償日止，按年息5％計算\n    之利息。被上訴人答辯聲明：駁回上訴。\n四、經查，上訴人主張被上訴人因其懷孕，而非法調動上訴人之\n    工作地點，而有勞基法第14條第1項第6款規定事由，上訴人\n    自得終止勞動契約並請求被上訴人給付資遣費云云，此為被\n    上訴人所否認，並以前詞置辯。是本件爭點厥為被上訴人是\n    否非法調動上訴人工作地點，故上訴人得終止勞動契約並請\n    求資遣費？\n（一）按當事人主張有利於己之事實者，就其事實有舉證之責任\n      ，民事訴訟法第277條前段定有明文。又按民事訴訟如係\n      由原告主張權利者，應先由原告負舉證之責，若原告先不\n      能舉證，以證實自己主張之事實為真實，則被告就其抗辯\n      事實即令不能舉證，或其所舉證據尚有疵累，亦應駁回原\n      告之請求，最高法院74年度臺上字第913號裁判可資參照\n      。\n（二）上訴人於本院中主張證人乙○○在會議室內，以上訴人懷\n      孕為由，表示要將上訴人調至深坑鄉，故違反勞基法第14\n      條第1項第6款等語，上訴人就此利己事實，自負有舉證責\n      任。經查，上訴人對此固以會議室有錄音、錄影設備，要\n      求被上訴人提供對談之錄音資料為證云云，經原審命被上\n      訴人提出錄音資料，被上訴人以簽約室之錄音錄影設備硬\n      碟容量有限，故資料僅保存半年，故無法提出等語置辯，\n      另證人即上訴人主管乙○○則於本院中證稱：伊確曾與上\n      訴人討論調動工作地點之事，但此非針對上訴人，而係詢\n      問代書部門所有人員，因被上訴人在安坑業務量增加，代\n      書常須新店、安坑兩地往返，被上訴人想另設置辦公處所\n      ，派駐常駐代書，就不需兩地往返，故詢問代書部門人員\n      是否有人願意調動，但只在調查階段，亦未將上訴人調至\n      該部門。嗣上訴人到伊辦公室說要離職，伊詢問原因，上\n      訴人未告知，嗣伊在簽約室再度詢問上訴人是否確定離職\n      ，上訴人說是，並希望伊幫忙爭取資遣費，伊告知若員工\n      自己要離職，並無資遣費，上訴人稱她工作這麼久，伊係\n      主管，可否幫忙爭取，並寫了一些數字還有計算式，金額\n      大約是10幾萬元，伊告知上訴人金額這麼多，不知如何向\n      被上訴人開口，需要想一想。又再問上訴人是否確定要離\n      職，如果要離職，須辦手續，當天上訴人就去辦離職手續\n      ，並與交接人員簽立交接單。上訴人離職當天，有簽「辭\n      職簽呈」及交接單，伊有在交接單上簽名，而辭職簽呈並\n      非例稿，因每個人離職原因不同，伊請上訴人寫簽呈時，\n      上訴人說她不會打，遂請上訴人去找人事部門人員按她的\n      意思繕打，但不知上訴人為何在簽呈上另手寫「公司政策\n      」4字。伊並未要求上訴人離職，況詢問調動意願結果，\n      每個代書都拒絕，被上訴人本係體恤代書，不願他們兩地\n      往返，既然無人願意常駐，被上訴人也不須多花錢設立辦\n      公室，故伊並未要求上訴人離職，因每個人都不願意調動\n      。不知道上訴人懷孕，也不會因懷孕而解僱上訴人，因上\n      訴人第一胎也是在事務所懷孕，且事務所並非只有上訴人\n      1人懷孕。只要係上班時間，簽約室的錄音、錄影設備就\n      會開啟，但記憶體有限，新資料會覆蓋舊資料，之前調錄\n      音資料都是近1、兩個月的資料，從未超過半年，故上訴\n      人請求的資料已被覆蓋，並非不願提供等語明確（見本院\n      卷第26頁背面、第27頁），上訴人亦不爭執第一胎確實是\n      在事務所工作時懷孕等語（見本院卷第27頁背面），足見\n      被上訴人並非因上訴人懷孕之故，而針對上訴人1人進行\n      調動之詢問，遑論已確定將上訴人調往不同之工作地點，\n      況亦無其他員工因拒絕調職而遭到解僱之不利待遇。復查\n      ，上訴人確於97年11月14日簽署「辭職簽呈」，表明係上\n      訴人申請離職，有辭職簽呈在卷可稽（見原審卷第29頁）\n      ，雖該簽呈上另註明：「因公司政策原因申請離職」等語\n      ，然何謂「公司政策」，其意不明，上訴人迄本院言詞辯\n      論終結前，亦未舉證以明被上訴人究有何違法調職之情事\n      ，則其逕以此為由，主張被上訴人有勞基法第14條第1項\n      第6款事由，故終止勞動契約而請求資遣費云云，顯非可\n      採。\n五、綜上所述，上訴人並未舉證證明被上訴人有何單方將上訴人\n    調職而變更勞動條件情事，上訴人顯係自請離職，故上訴人\n    主張被上訴人違反勞基法第14條第1項第6款，故依法請求給\n    付資遣費14萬5643元，及自訴狀繕本翌日起至清償日止按年\n    息5％計算之利息，即屬無據，不應准許。原審此部分為上\n    訴人敗訴之判決，其認事用法均無不合。上訴意旨指摘原判\n    決不當，求予廢棄改判，為無理由，應駁回其上訴。\n六、本判決之基礎已臻明確，兩造之其餘攻擊防禦方法及舉證，\n    核與判決無影響，毋庸一一論列，並此敘明。\n七、據上論結，本件上訴無理由，依民事訴訟法第436條之1第3\n    項、第449條第1項、第78條，判決如主文。\n中    華    民    國    99    年    5    月    12    日\n                  勞工法庭  審判長法  官  丁蓓蓓\n                                  法  官  黃明發\n                                  法  官  孫正華\n以上正本係照原本作成。\n本判決不得上訴。\n中    華    民    國    99    年    5     月    12    日\n                                  書記官  林秀娥",
  "structure": {
    "main": "上訴駁回。\n第二審訴訟費用由上訴人負擔。",
    "fact": "一、上訴人起訴主張：上訴人自民國92年11月1日起至97年11月\n    14日止任職被上訴人大漢和風地政士事務所。上訴人於97年\n    10月間妊娠早期因併發陰道出血及先兆性流產，分別於同年\n    10月23日、10月27日及10月30日於蕭仁哲婦產專科醫院，接\n    受口服藥及針劑安胎治療，然情況未見明顯改善遂再至臺大\n    醫院進行相關追蹤診療。被上訴人明知上訴人懷孕並有多次\n    至醫院安胎之紀錄，為規避上訴人之病假及產假，欲逼迫上\n    訴人離開職場，先以事務所業務減縮為由，於97年11月14日\n    表示要將上訴人工作地點由新店調至東森房屋，如此調動對\n    一般已在相同工作地點任職5年之員工尚屬困難，遑論上訴\n    人剛於1個月內頻繁至醫院安胎3次且於臺大醫院繼續追蹤治\n    療，如此調動對一位妊娠初期之孕婦屬惡意刁難。被上訴人\n    無故為調職未得上訴人同意，實係被上訴人單方更改勞動條\n    件，已違反勞動契約及違反勞動基準法（以下簡稱勞基法）\n    第14條第1項第6款之規定，故上訴人自知悉其情形之日起30\n    日內，依法終止勞動契約。被上訴人自92年11月1日起至97\n    年11月14日上訴人不同意調職而終止勞動契約止，上訴人前\n    6個月平均工資為4萬2950元，因跨勞保新舊制，被上訴人應\n    給付上訴人資遣費為14萬5643元，被上訴人另應給付上訴人\n    應休未休特別假之獎金1萬4005元，以上金額共計15萬9648\n    元，爰依法起訴請求，並聲明：被上訴人應給付上訴人15萬\n    9648元，及自訴狀繕本送達之翌日起至清償日止依年息5％\n    計算之利息。\n二、被上訴人則以：被上訴人不知上訴人懷孕，本件係因被上訴\n    人在深坑及安坑兩地之簽約量變多，故詢問所有員工是否有\n    人願常駐深坑或安坑的辦公室，並非針對上訴人而為，亦未\n    決定是否要員工前往深坑及安坑，遑論將上訴人違法調職。\n    詎上訴人於97年11月14日主動向主管乙○○辭職，並要求為\n    其爭取資遣費，實無理由等語置辯。\n三、原審判命被上訴人應給付上訴人應休未休特別假獎金1萬400\n    5元，而駁回關於資遣費之請求，並依職權宣告假執行及供\n    擔保免為假執行。被上訴人就原審判命給付部分未聲明上訴\n    ，業已確定；上訴人則就原審敗訴部分不服提起本件上訴，\n    並於本院聲明：（一）原判決不利上訴人部分廢棄；（二）\n    上開廢棄部分，被上訴人應再給付上訴人資遣費14萬5643\n    元，及自訴狀繕本送達翌日起至清償日止，按年息5％計算\n    之利息。被上訴人答辯聲明：駁回上訴。\n四、經查，上訴人主張被上訴人因其懷孕，而非法調動上訴人之\n    工作地點，而有勞基法第14條第1項第6款規定事由，上訴人\n    自得終止勞動契約並請求被上訴人給付資遣費云云，此為被\n    上訴人所否認，並以前詞置辯。是本件爭點厥為被上訴人是\n    否非法調動上訴人工作地點，故上訴人得終止勞動契約並請\n    求資遣費？\n（一）按當事人主張有利於己之事實者，就其事實有舉證之責任\n      ，民事訴訟法第277條前段定有明文。又按民事訴訟如係\n      由原告主張權利者，應先由原告負舉證之責，若原告先不\n      能舉證，以證實自己主張之事實為真實，則被告就其抗辯\n      事實即令不能舉證，或其所舉證據尚有疵累，亦應駁回原\n      告之請求，最高法院74年度臺上字第913號裁判可資參照\n      。\n（二）上訴人於本院中主張證人乙○○在會議室內，以上訴人懷\n      孕為由，表示要將上訴人調至深坑鄉，故違反勞基法第14\n      條第1項第6款等語，上訴人就此利己事實，自負有舉證責\n      任。經查，上訴人對此固以會議室有錄音、錄影設備，要\n      求被上訴人提供對談之錄音資料為證云云，經原審命被上\n      訴人提出錄音資料，被上訴人以簽約室之錄音錄影設備硬\n      碟容量有限，故資料僅保存半年，故無法提出等語置辯，\n      另證人即上訴人主管乙○○則於本院中證稱：伊確曾與上\n      訴人討論調動工作地點之事，但此非針對上訴人，而係詢\n      問代書部門所有人員，因被上訴人在安坑業務量增加，代\n      書常須新店、安坑兩地往返，被上訴人想另設置辦公處所\n      ，派駐常駐代書，就不需兩地往返，故詢問代書部門人員\n      是否有人願意調動，但只在調查階段，亦未將上訴人調至\n      該部門。嗣上訴人到伊辦公室說要離職，伊詢問原因，上\n      訴人未告知，嗣伊在簽約室再度詢問上訴人是否確定離職\n      ，上訴人說是，並希望伊幫忙爭取資遣費，伊告知若員工\n      自己要離職，並無資遣費，上訴人稱她工作這麼久，伊係\n      主管，可否幫忙爭取，並寫了一些數字還有計算式，金額\n      大約是10幾萬元，伊告知上訴人金額這麼多，不知如何向\n      被上訴人開口，需要想一想。又再問上訴人是否確定要離\n      職，如果要離職，須辦手續，當天上訴人就去辦離職手續\n      ，並與交接人員簽立交接單。上訴人離職當天，有簽「辭\n      職簽呈」及交接單，伊有在交接單上簽名，而辭職簽呈並\n      非例稿，因每個人離職原因不同，伊請上訴人寫簽呈時，\n      上訴人說她不會打，遂請上訴人去找人事部門人員按她的\n      意思繕打，但不知上訴人為何在簽呈上另手寫「公司政策\n      」4字。伊並未要求上訴人離職，況詢問調動意願結果，\n      每個代書都拒絕，被上訴人本係體恤代書，不願他們兩地\n      往返，既然無人願意常駐，被上訴人也不須多花錢設立辦\n      公室，故伊並未要求上訴人離職，因每個人都不願意調動\n      。不知道上訴人懷孕，也不會因懷孕而解僱上訴人，因上\n      訴人第一胎也是在事務所懷孕，且事務所並非只有上訴人\n      1人懷孕。只要係上班時間，簽約室的錄音、錄影設備就\n      會開啟，但記憶體有限，新資料會覆蓋舊資料，之前調錄\n      音資料都是近1、兩個月的資料，從未超過半年，故上訴\n      人請求的資料已被覆蓋，並非不願提供等語明確（見本院\n      卷第26頁背面、第27頁），上訴人亦不爭執第一胎確實是\n      在事務所工作時懷孕等語（見本院卷第27頁背面），足見\n      被上訴人並非因上訴人懷孕之故，而針對上訴人1人進行\n      調動之詢問，遑論已確定將上訴人調往不同之工作地點，\n      況亦無其他員工因拒絕調職而遭到解僱之不利待遇。復查\n      ，上訴人確於97年11月14日簽署「辭職簽呈」，表明係上\n      訴人申請離職，有辭職簽呈在卷可稽（見原審卷第29頁）\n      ，雖該簽呈上另註明：「因公司政策原因申請離職」等語\n      ，然何謂「公司政策」，其意不明，上訴人迄本院言詞辯\n      論終結前，亦未舉證以明被上訴人究有何違法調職之情事\n      ，則其逕以此為由，主張被上訴人有勞基法第14條第1項\n      第6款事由，故終止勞動契約而請求資遣費云云，顯非可\n      採。\n五、綜上所述，上訴人並未舉證證明被上訴人有何單方將上訴人\n    調職而變更勞動條件情事，上訴人顯係自請離職，故上訴人\n    主張被上訴人違反勞基法第14條第1項第6款，故依法請求給\n    付資遣費14萬5643元，及自訴狀繕本翌日起至清償日止按年\n    息5％計算之利息，即屬無據，不應准許。原審此部分為上\n    訴人敗訴之判決，其認事用法均無不合。上訴意旨指摘原判\n    決不當，求予廢棄改判，為無理由，應駁回其上訴。\n六、本判決之基礎已臻明確，兩造之其餘攻擊防禦方法及舉證，\n    核與判決無影響，毋庸一一論列，並此敘明。\n七、據上論結，本件上訴無理由，依民事訴訟法第436條之1第3\n    項、第449條第1項、第78條，判決如主文。",
    "reason": "一、上訴人起訴主張：上訴人自民國92年11月1日起至97年11月\n    14日止任職被上訴人大漢和風地政士事務所。上訴人於97年\n    10月間妊娠早期因併發陰道出血及先兆性流產，分別於同年\n    10月23日、10月27日及10月30日於蕭仁哲婦產專科醫院，接\n    受口服藥及針劑安胎治療，然情況未見明顯改善遂再至臺大\n    醫院進行相關追蹤診療。被上訴人明知上訴人懷孕並有多次\n    至醫院安胎之紀錄，為規避上訴人之病假及產假，欲逼迫上\n    訴人離開職場，先以事務所業務減縮為由，於97年11月14日\n    表示要將上訴人工作地點由新店調至東森房屋，如此調動對\n    一般已在相同工作地點任職5年之員工尚屬困難，遑論上訴\n    人剛於1個月內頻繁至醫院安胎3次且於臺大醫院繼續追蹤治\n    療，如此調動對一位妊娠初期之孕婦屬惡意刁難。被上訴人\n    無故為調職未得上訴人同意，實係被上訴人單方更改勞動條\n    件，已違反勞動契約及違反勞動基準法（以下簡稱勞基法）\n    第14條第1項第6款之規定，故上訴人自知悉其情形之日起30\n    日內，依法終止勞動契約。被上訴人自92年11月1日起至97\n    年11月14日上訴人不同意調職而終止勞動契約止，上訴人前\n    6個月平均工資為4萬2950元，因跨勞保新舊制，被上訴人應\n    給付上訴人資遣費為14萬5643元，被上訴人另應給付上訴人\n    應休未休特別假之獎金1萬4005元，以上金額共計15萬9648\n    元，爰依法起訴請求，並聲明：被上訴人應給付上訴人15萬\n    9648元，及自訴狀繕本送達之翌日起至清償日止依年息5％\n    計算之利息。\n二、被上訴人則以：被上訴人不知上訴人懷孕，本件係因被上訴\n    人在深坑及安坑兩地之簽約量變多，故詢問所有員工是否有\n    人願常駐深坑或安坑的辦公室，並非針對上訴人而為，亦未\n    決定是否要員工前往深坑及安坑，遑論將上訴人違法調職。\n    詎上訴人於97年11月14日主動向主管乙○○辭職，並要求為\n    其爭取資遣費，實無理由等語置辯。\n三、原審判命被上訴人應給付上訴人應休未休特別假獎金1萬400\n    5元，而駁回關於資遣費之請求，並依職權宣告假執行及供\n    擔保免為假執行。被上訴人就原審判命給付部分未聲明上訴\n    ，業已確定；上訴人則就原審敗訴部分不服提起本件上訴，\n    並於本院聲明：（一）原判決不利上訴人部分廢棄；（二）\n    上開廢棄部分，被上訴人應再給付上訴人資遣費14萬5643\n    元，及自訴狀繕本送達翌日起至清償日止，按年息5％計算\n    之利息。被上訴人答辯聲明：駁回上訴。\n四、經查，上訴人主張被上訴人因其懷孕，而非法調動上訴人之\n    工作地點，而有勞基法第14條第1項第6款規定事由，上訴人\n    自得終止勞動契約並請求被上訴人給付資遣費云云，此為被\n    上訴人所否認，並以前詞置辯。是本件爭點厥為被上訴人是\n    否非法調動上訴人工作地點，故上訴人得終止勞動契約並請\n    求資遣費？\n（一）按當事人主張有利於己之事實者，就其事實有舉證之責任\n      ，民事訴訟法第277條前段定有明文。又按民事訴訟如係\n      由原告主張權利者，應先由原告負舉證之責，若原告先不\n      能舉證，以證實自己主張之事實為真實，則被告就其抗辯\n      事實即令不能舉證，或其所舉證據尚有疵累，亦應駁回原\n      告之請求，最高法院74年度臺上字第913號裁判可資參照\n      。\n（二）上訴人於本院中主張證人乙○○在會議室內，以上訴人懷\n      孕為由，表示要將上訴人調至深坑鄉，故違反勞基法第14\n      條第1項第6款等語，上訴人就此利己事實，自負有舉證責\n      任。經查，上訴人對此固以會議室有錄音、錄影設備，要\n      求被上訴人提供對談之錄音資料為證云云，經原審命被上\n      訴人提出錄音資料，被上訴人以簽約室之錄音錄影設備硬\n      碟容量有限，故資料僅保存半年，故無法提出等語置辯，\n      另證人即上訴人主管乙○○則於本院中證稱：伊確曾與上\n      訴人討論調動工作地點之事，但此非針對上訴人，而係詢\n      問代書部門所有人員，因被上訴人在安坑業務量增加，代\n      書常須新店、安坑兩地往返，被上訴人想另設置辦公處所\n      ，派駐常駐代書，就不需兩地往返，故詢問代書部門人員\n      是否有人願意調動，但只在調查階段，亦未將上訴人調至\n      該部門。嗣上訴人到伊辦公室說要離職，伊詢問原因，上\n      訴人未告知，嗣伊在簽約室再度詢問上訴人是否確定離職\n      ，上訴人說是，並希望伊幫忙爭取資遣費，伊告知若員工\n      自己要離職，並無資遣費，上訴人稱她工作這麼久，伊係\n      主管，可否幫忙爭取，並寫了一些數字還有計算式，金額\n      大約是10幾萬元，伊告知上訴人金額這麼多，不知如何向\n      被上訴人開口，需要想一想。又再問上訴人是否確定要離\n      職，如果要離職，須辦手續，當天上訴人就去辦離職手續\n      ，並與交接人員簽立交接單。上訴人離職當天，有簽「辭\n      職簽呈」及交接單，伊有在交接單上簽名，而辭職簽呈並\n      非例稿，因每個人離職原因不同，伊請上訴人寫簽呈時，\n      上訴人說她不會打，遂請上訴人去找人事部門人員按她的\n      意思繕打，但不知上訴人為何在簽呈上另手寫「公司政策\n      」4字。伊並未要求上訴人離職，況詢問調動意願結果，\n      每個代書都拒絕，被上訴人本係體恤代書，不願他們兩地\n      往返，既然無人願意常駐，被上訴人也不須多花錢設立辦\n      公室，故伊並未要求上訴人離職，因每個人都不願意調動\n      。不知道上訴人懷孕，也不會因懷孕而解僱上訴人，因上\n      訴人第一胎也是在事務所懷孕，且事務所並非只有上訴人\n      1人懷孕。只要係上班時間，簽約室的錄音、錄影設備就\n      會開啟，但記憶體有限，新資料會覆蓋舊資料，之前調錄\n      音資料都是近1、兩個月的資料，從未超過半年，故上訴\n      人請求的資料已被覆蓋，並非不願提供等語明確（見本院\n      卷第26頁背面、第27頁），上訴人亦不爭執第一胎確實是\n      在事務所工作時懷孕等語（見本院卷第27頁背面），足見\n      被上訴人並非因上訴人懷孕之故，而針對上訴人1人進行\n      調動之詢問，遑論已確定將上訴人調往不同之工作地點，\n      況亦無其他員工因拒絕調職而遭到解僱之不利待遇。復查\n      ，上訴人確於97年11月14日簽署「辭職簽呈」，表明係上\n      訴人申請離職，有辭職簽呈在卷可稽（見原審卷第29頁）\n      ，雖該簽呈上另註明：「因公司政策原因申請離職」等語\n      ，然何謂「公司政策」，其意不明，上訴人迄本院言詞辯\n      論終結前，亦未舉證以明被上訴人究有何違法調職之情事\n      ，則其逕以此為由，主張被上訴人有勞基法第14條第1項\n      第6款事由，故終止勞動契約而請求資遣費云云，顯非可\n      採。\n五、綜上所述，上訴人並未舉證證明被上訴人有何單方將上訴人\n    調職而變更勞動條件情事，上訴人顯係自請離職，故上訴人\n    主張被上訴人違反勞基法第14條第1項第6款，故依法請求給\n    付資遣費14萬5643元，及自訴狀繕本翌日起至清償日止按年\n    息5％計算之利息，即屬無據，不應准許。原審此部分為上\n    訴人敗訴之判決，其認事用法均無不合。上訴意旨指摘原判\n    決不當，求予廢棄改判，為無理由，應駁回其上訴。\n六、本判決之基礎已臻明確，兩造之其餘攻擊防禦方法及舉證，\n    核與判決無影響，毋庸一一論列，並此敘明。\n七、據上論結，本件上訴無理由，依民事訴訟法第436條之1第3\n    項、第449條第1項、第78條，判決如主文。"
  },
  "characters": {
    "judges": [
      "丁蓓蓓",
      "黃明發",
      "孫正華"
    ],
    "prosecutors": [

    ],
    "lawyers": [
      "吳秀娥"
    ],
    "clerks": [

    ],
    "plaintiffs": [

    ],
    "defendants": [

    ],
    "prosecutor_office": [

    ],
    "creditors": [

    ],
    "debtors": [

    ],
    "judicial_associate_officer": [

    ]
  },
  "adjudged_at": "2010-05-12",
  "created_at": "2016-01-05 12:14:13",
  "updated_at": "2016-01-05 12:14:13"
}