{
  "identify": "TPD-99-審小上-74-20100512-1",
  "court": {
    "name": "臺灣臺北地方法院",
    "code": "TPD"
  },
  "division": {
    "name": "民事",
    "code": "V"
  },
  "year": 99,
  "word": "審小上",
  "number": "74",
  "jcheck": "1",
  "reason": "給付管理費",
  "content": "臺灣臺北地方法院民事裁定            99年度審小上字第74號\n上  訴  人  乙○○\n被 上訴 人  敦化賓士大廈管理委員會\n法定代理人  甲○○\n當事人間請求給付管理費事件，上訴人對於中華民國99年3 月26\n日本院臺北簡易庭99年度北小字第367 號第一審小額民事判決提\n起上訴，本院裁定如下：\n    主  文\n上訴駁回。\n第二審訴訟費用新台幣壹仟伍佰元由上訴人負擔。\n    理  由\n一、按對於小額訴訟之第一審裁判提起上訴或抗告，非以其違背\n    法令為理由，不得為之；又上訴狀內未表明上訴理由者，上\n    訴人應於提起上訴後二十日內，提出理由書於原第二審法院\n    ，未提出者毋庸命其補正，由第二審法院以裁定駁回之，民\n    事訴訟法第四百三十六條之二十四第二項、第四百三十六條\n    之三十二第二項準用同法第四百七十一條第一項分別定有明\n    文。\n二、本件上訴人於民國99年4 月16日提起上訴後，迄未表明上訴\n    理由，亦未於上訴狀中載明原審判決有何違背法令之處，揆\n    諸首開法條規定，上訴人提起上訴，為不合法，且本院無庸\n    命其補正，即應予駁回。\n三、訴訟費用之負擔：本件上訴裁判費為新台幣1,500 元，應由\n    上訴人負擔，爰確定如主文第二項所載。\n四、據上論結，本件上訴為不合法，依民事訴訟法第四百三十六\n    條之三十二第二項、第四百四十四條第一項前段、第四百三\n    十六條之十九第一項、第九十五條、第七十八條，裁定如主\n    文。\n中    華    民    國    99    年    5     月    12    日\n                  民事第六庭審判長法  官  朱漢寶\n                                  法  官  劉又菁\n                                  法  官  賴錦華\n以上為正本係照原本作成。\n本裁定不得抗告\n中    華    民    國    99    年    5     月    12    日\n                                  書記官  沈世儒",
  "structure": {
    "main": "上訴駁回。\n第二審訴訟費用新台幣壹仟伍佰元由上訴人負擔。",
    "reason": "一、按對於小額訴訟之第一審裁判提起上訴或抗告，非以其違背\n    法令為理由，不得為之；又上訴狀內未表明上訴理由者，上\n    訴人應於提起上訴後二十日內，提出理由書於原第二審法院\n    ，未提出者毋庸命其補正，由第二審法院以裁定駁回之，民\n    事訴訟法第四百三十六條之二十四第二項、第四百三十六條\n    之三十二第二項準用同法第四百七十一條第一項分別定有明\n    文。\n二、本件上訴人於民國99年4 月16日提起上訴後，迄未表明上訴\n    理由，亦未於上訴狀中載明原審判決有何違背法令之處，揆\n    諸首開法條規定，上訴人提起上訴，為不合法，且本院無庸\n    命其補正，即應予駁回。\n三、訴訟費用之負擔：本件上訴裁判費為新台幣1,500 元，應由\n    上訴人負擔，爰確定如主文第二項所載。\n四、據上論結，本件上訴為不合法，依民事訴訟法第四百三十六\n    條之三十二第二項、第四百四十四條第一項前段、第四百三\n    十六條之十九第一項、第九十五條、第七十八條，裁定如主\n    文。"
  },
  "characters": {
    "judges": [
      "朱漢寶",
      "劉又菁",
      "賴錦華"
    ],
    "prosecutors": [

    ],
    "lawyers": [

    ],
    "clerks": [

    ],
    "plaintiffs": [

    ],
    "defendants": [

    ],
    "prosecutor_office": [

    ],
    "creditors": [

    ],
    "debtors": [

    ],
    "judicial_associate_officer": [

    ]
  },
  "adjudged_at": "2010-05-12",
  "created_at": "2016-01-05 12:18:37",
  "updated_at": "2016-01-05 12:18:37"
}