{
  "identify": "TPH-98-交抗-2919-20100105-1",
  "court": {
    "name": "臺灣高等法院",
    "code": "TPH"
  },
  "division": {
    "name": "刑事",
    "code": "M"
  },
  "year": 98,
  "word": "交抗",
  "number": "2919",
  "jcheck": "1",
  "reason": "違反道路交通管理處罰條例",
  "content": "臺灣高等法院交通事件裁定            98年度交抗字第2919號\n抗  告  人\n即受處分人  甲○○\n上列抗告人因違反道路交通管理處罰條例案件，不服臺灣新竹地\n方法院，中華民國98年11月25日所為裁定（98年度交聲字第713\n號），提起抗告，本院裁定如下：\n    主  文\n抗告駁回。\n    理  由\n一、原裁定意旨略以：受處分人甲○○所有之車牌號碼V8-6203\n    號自用一般小客車於民國（下同）98年7月10日9時34分許，\n    行經國道一號公路南下86公里處時，因未保持行車安全距離\n    ，經內政部警政署國道公路警察局第二警察隊楊梅分隊員警\n    賴弘敏填掣公警局交字第ZBA123676號舉發違反道路交通管\n    理事件通知單（下稱舉發通知單）逕行舉發。嗣受處分人向\n    原處分機關交通部公路總局新竹區監理所提出陳述，由原處\n    分機關函請原舉發單位調查，仍認其有前揭違規行為，而依\n    道路交通管理處罰條例第33條第1項第2款規定，於98年9月\n    15 日以竹監自字第裁50-ZBA123676號違反道路交通管理事\n    件裁決書裁處抗告人罰鍰新台幣（下同）3,000元，並依同\n    條例第63條第1項第1款記違規點數1點。且受處分人亦不否\n    認有前揭違規行為等情，有受處分人聲明異議狀及交通部公\n    路總局新竹區監理所陳述單、舉發採證照片1張及錄影光碟\n    擷取畫面照片10幀在卷可佐。是本件違規事實事證明確。又\n    受處分人甲○○至98年11月24日始陳明舉發當日是由其配偶\n    魏肇廷駕駛上開自用一般小客車，顯已逾道路交通管理處罰\n    條例第85條第1項所定之應於舉發通知單上所載之應到案日\n    期（即98年8月29日），向處罰機關告知應歸責人之規定，\n    故原處分機關依前揭法律規定，處罰汽車所有人甲○○於法\n    有據，且無當事人不適格之情形。原審因認原處分機關交通\n    部公路總局新竹區監理所，裁處受處分人罰鍰3,000元，並\n    記違規點數1點，核無違誤，受處分人聲明異議為無理由，\n    應予駁回等語。\n二、抗告意旨略以：本件駕駛人為避免因慢速被取締，故於駕車\n    時盡力維持車速時速90公里之速度。且倘如原審裁定所述，\n    取締當時車流量尚未達壅塞之程度，則駕駛人自應依高速公\n    路及快速公路交通管制規則第8條第第1項第3款規定，以最\n    高限速行駛於內側車道，否則即會受罰。是以，與前車保持\n    安全距離以及行車速度不得低於最低速限之規定二者實難兼\n    顧，為此提起抗告云云。\n三、經查：\n  (一)按汽車行駛於高速公路，不遵守管制規則而有未保持安全距\n    離者，處汽車駕駛人3,000元以上6,000元以下罰鍰，並記違\n    規點數1點，道路交通管理處罰條例第33條第1項第2款、第\n    63條第1項第1款分別定有明文。再按汽車行駛高速公路，前\n    後兩車間之行車安全距離，在正常天候狀況下，小型車：車\n    輛速率之每小時公里數值除以二，單位為公尺，高速公路及\n    快速公路交通管制規則第6條第1項定有明文。\n  (二)觀諸前揭舉發採證照片及錄影光碟擷取畫面，本件抗告人所\n    有之小客車於98年7月10日9時34分許，在國道一號公路南下\n    86公里處，行經國道一號公路南下86公里路段，時速91公里\n    ，則其與前車之安全間距應係45.5公尺（即91除以2），又\n    舉發當時係正常天候，車流量尚未達壅塞之程度，抗告人所\n    有之車輛後方亦無其他來車靠近，且該車之時速仍可達每小\n    時91公里，顯見交通尚屬順暢，並無不得保持行車安全距離\n    之因素存在。又舉發地點路面設有車道線，線段長4公尺，\n    間距6公尺，此有內政部警政署國道公路警察局第二警察隊\n    98年11月12日公警二交字第0980272390號函1份在卷可參，\n    依此標準比對前揭舉發採證照片及錄影光碟擷取畫面，抗告\n    人車輛與前車之間距約僅20公尺，明顯未合於前開45.5 公\n    尺之安全距離，是抗告人違規事實事證明確，應堪認定。\n  (三)至抗告人雖以前詞置辯，惟高速公路及快速公路交通管制規\n    則第8條第1項第3款係規定：「內側車道為超車道，但小型\n    車於不堵塞行車之狀況下，得以該路段容許之最高速限行駛\n    於內車道」，此種情形，僅係容許小型車「得」以該路段容\n    許之最高速限行駛於內車道，並非「應」以該路段容許之最\n    高速限行駛於內車道，且並未排除上開應保持安全距離規定\n    之適用。而小型車安全距離之計算，係依車輛之行車速率之\n    每小時公里數值除以二計算，已如上述，倘前車車速放慢，\n    則後車為保持安全間距，亦應隨之放慢行車速度，車速減慢\n    之同時，應維持之安全間距也可隨之減短，駕駛人衡須視自\n    身車速，機動調整與前車之間距，以保持安全距離。至同規\n    則第5條第1項前段規定：「汽車行駛高速公路及快速公路，\n    應依速限標誌指示」，不得低於最低速限，乃行駛任一車道\n    均有適用，非僅適用於內線車道行駛之情形。是抗告人上開\n    辯解，要無可採。\n  (四)綜上，抗告人指摘原裁定不當，為無理由，應予駁回。\n四、據上論結，應依道路交通管理處罰條例第89條，刑事訴訟法\n    第412條，裁定如主文。\n中    華    民    國    99    年    1    月    5    日\n            刑事第十七庭  審判長法  官 王聰明\n                                法  官 黃雅芬\n                                法  官 陳世宗\n以上正本證明與原本無異。\n不得再抗告。\n                                書記官 魏汝萍\n中    華    民    國    99    年    1     月    6     日\n",
  "structure": {
    "main": "抗告駁回。",
    "reason": "一、原裁定意旨略以：受處分人甲○○所有之車牌號碼V8-6203\n    號自用一般小客車於民國（下同）98年7月10日9時34分許，\n    行經國道一號公路南下86公里處時，因未保持行車安全距離\n    ，經內政部警政署國道公路警察局第二警察隊楊梅分隊員警\n    賴弘敏填掣公警局交字第ZBA123676號舉發違反道路交通管\n    理事件通知單（下稱舉發通知單）逕行舉發。嗣受處分人向\n    原處分機關交通部公路總局新竹區監理所提出陳述，由原處\n    分機關函請原舉發單位調查，仍認其有前揭違規行為，而依\n    道路交通管理處罰條例第33條第1項第2款規定，於98年9月\n    15 日以竹監自字第裁50-ZBA123676號違反道路交通管理事\n    件裁決書裁處抗告人罰鍰新台幣（下同）3,000元，並依同\n    條例第63條第1項第1款記違規點數1點。且受處分人亦不否\n    認有前揭違規行為等情，有受處分人聲明異議狀及交通部公\n    路總局新竹區監理所陳述單、舉發採證照片1張及錄影光碟\n    擷取畫面照片10幀在卷可佐。是本件違規事實事證明確。又\n    受處分人甲○○至98年11月24日始陳明舉發當日是由其配偶\n    魏肇廷駕駛上開自用一般小客車，顯已逾道路交通管理處罰\n    條例第85條第1項所定之應於舉發通知單上所載之應到案日\n    期（即98年8月29日），向處罰機關告知應歸責人之規定，\n    故原處分機關依前揭法律規定，處罰汽車所有人甲○○於法\n    有據，且無當事人不適格之情形。原審因認原處分機關交通\n    部公路總局新竹區監理所，裁處受處分人罰鍰3,000元，並\n    記違規點數1點，核無違誤，受處分人聲明異議為無理由，\n    應予駁回等語。\n二、抗告意旨略以：本件駕駛人為避免因慢速被取締，故於駕車\n    時盡力維持車速時速90公里之速度。且倘如原審裁定所述，\n    取締當時車流量尚未達壅塞之程度，則駕駛人自應依高速公\n    路及快速公路交通管制規則第8條第第1項第3款規定，以最\n    高限速行駛於內側車道，否則即會受罰。是以，與前車保持\n    安全距離以及行車速度不得低於最低速限之規定二者實難兼\n    顧，為此提起抗告云云。\n三、經查：\n  (一)按汽車行駛於高速公路，不遵守管制規則而有未保持安全距\n    離者，處汽車駕駛人3,000元以上6,000元以下罰鍰，並記違\n    規點數1點，道路交通管理處罰條例第33條第1項第2款、第\n    63條第1項第1款分別定有明文。再按汽車行駛高速公路，前\n    後兩車間之行車安全距離，在正常天候狀況下，小型車：車\n    輛速率之每小時公里數值除以二，單位為公尺，高速公路及\n    快速公路交通管制規則第6條第1項定有明文。\n  (二)觀諸前揭舉發採證照片及錄影光碟擷取畫面，本件抗告人所\n    有之小客車於98年7月10日9時34分許，在國道一號公路南下\n    86公里處，行經國道一號公路南下86公里路段，時速91公里\n    ，則其與前車之安全間距應係45.5公尺（即91除以2），又\n    舉發當時係正常天候，車流量尚未達壅塞之程度，抗告人所\n    有之車輛後方亦無其他來車靠近，且該車之時速仍可達每小\n    時91公里，顯見交通尚屬順暢，並無不得保持行車安全距離\n    之因素存在。又舉發地點路面設有車道線，線段長4公尺，\n    間距6公尺，此有內政部警政署國道公路警察局第二警察隊\n    98年11月12日公警二交字第0980272390號函1份在卷可參，\n    依此標準比對前揭舉發採證照片及錄影光碟擷取畫面，抗告\n    人車輛與前車之間距約僅20公尺，明顯未合於前開45.5 公\n    尺之安全距離，是抗告人違規事實事證明確，應堪認定。\n  (三)至抗告人雖以前詞置辯，惟高速公路及快速公路交通管制規\n    則第8條第1項第3款係規定：「內側車道為超車道，但小型\n    車於不堵塞行車之狀況下，得以該路段容許之最高速限行駛\n    於內車道」，此種情形，僅係容許小型車「得」以該路段容\n    許之最高速限行駛於內車道，並非「應」以該路段容許之最\n    高速限行駛於內車道，且並未排除上開應保持安全距離規定\n    之適用。而小型車安全距離之計算，係依車輛之行車速率之\n    每小時公里數值除以二計算，已如上述，倘前車車速放慢，\n    則後車為保持安全間距，亦應隨之放慢行車速度，車速減慢\n    之同時，應維持之安全間距也可隨之減短，駕駛人衡須視自\n    身車速，機動調整與前車之間距，以保持安全距離。至同規\n    則第5條第1項前段規定：「汽車行駛高速公路及快速公路，\n    應依速限標誌指示」，不得低於最低速限，乃行駛任一車道\n    均有適用，非僅適用於內線車道行駛之情形。是抗告人上開\n    辯解，要無可採。\n  (四)綜上，抗告人指摘原裁定不當，為無理由，應予駁回。\n四、據上論結，應依道路交通管理處罰條例第89條，刑事訴訟法\n    第412條，裁定如主文。"
  },
  "characters": {
    "judges": [
      "王聰明",
      "黃雅芬",
      "陳世宗"
    ],
    "prosecutors": [

    ],
    "lawyers": [

    ],
    "clerks": [
      "魏汝萍"
    ],
    "plaintiffs": [

    ],
    "defendants": [

    ],
    "prosecutor_office": [

    ],
    "creditors": [

    ],
    "debtors": [

    ],
    "judicial_associate_officer": [

    ]
  },
  "adjudged_at": "2010-01-05",
  "created_at": "2016-01-05 15:00:47",
  "updated_at": "2016-01-05 15:00:47"
}