{
  "identify": "TPH-98-抗-1748-20100512-2",
  "court": {
    "name": "臺灣高等法院",
    "code": "TPH"
  },
  "division": {
    "name": "民事",
    "code": "V"
  },
  "year": 98,
  "word": "抗",
  "number": "1748",
  "jcheck": "2",
  "reason": "損害賠償",
  "content": "臺灣高等法院民事裁定                  98年度抗字第1748號\n再抗告人  甲○○\n上列再抗告人因與相對人乙○○等間損害賠償事件，對於中華民\n國98年12月30日本院裁定再為抗告，本院裁定如下：\n    主    文\n再抗告駁回。\n再抗告訴訟費用由再抗告人負擔。\n    理    由\n一、按提起抗告應於裁定送達後10日之不變期間內為之，民事訴\n    訟法第487條第1項前段定有明文；此項抗告，應包括再抗告\n    在內。又提起再抗告如逾再抗告期間者，原法院應以裁定駁\n    回之，民事訴訟法第495條之1第2項準用第481條、第442條\n    第1項亦有明定。\n二、查本院98年度抗字第1748號裁定已於民國99年1月11日送達\n    於再抗告人，有送達證書在卷可稽（見本院卷第32頁）。再\n    抗告期間自送達裁定翌日起算，至99年1月21日即已屆滿，\n    再抗告人遲至99年1月29日始提起再抗告，已逾再抗告期間\n    ，依上開說明，其再抗告自非合法，應予駁回。\n三、據上論結，本件再抗告為不合法，爰裁定如主文。\n中    華    民    國    99    年    5     月    12    日\n                    民事第十一庭\n                        審判長法  官  鄭雅萍\n                              法  官  劉坤典\n                              法  官  徐福晉\n正本係照原本作成。\n不得抗告。\n中    華    民    國    99    年    5     月    14    日\n                              書記官  黃瑞芬",
  "structure": {
    "main": "再抗告駁回。\n再抗告訴訟費用由再抗告人負擔。",
    "reason": "一、按提起抗告應於裁定送達後10日之不變期間內為之，民事訴\n    訟法第487條第1項前段定有明文；此項抗告，應包括再抗告\n    在內。又提起再抗告如逾再抗告期間者，原法院應以裁定駁\n    回之，民事訴訟法第495條之1第2項準用第481條、第442條\n    第1項亦有明定。\n二、查本院98年度抗字第1748號裁定已於民國99年1月11日送達\n    於再抗告人，有送達證書在卷可稽（見本院卷第32頁）。再\n    抗告期間自送達裁定翌日起算，至99年1月21日即已屆滿，\n    再抗告人遲至99年1月29日始提起再抗告，已逾再抗告期間\n    ，依上開說明，其再抗告自非合法，應予駁回。\n三、據上論結，本件再抗告為不合法，爰裁定如主文。"
  },
  "characters": {
    "judges": [
      "鄭雅萍",
      "劉坤典",
      "徐福晉"
    ],
    "prosecutors": [

    ],
    "lawyers": [

    ],
    "clerks": [

    ],
    "plaintiffs": [

    ],
    "defendants": [

    ],
    "prosecutor_office": [

    ],
    "creditors": [

    ],
    "debtors": [

    ],
    "judicial_associate_officer": [

    ]
  },
  "adjudged_at": "2010-05-12",
  "created_at": "2016-01-05 11:55:46",
  "updated_at": "2016-01-05 11:55:46"
}