{
  "identify": "TPH-99-上訴-22-20100104-1",
  "court": {
    "name": "臺灣高等法院",
    "code": "TPH"
  },
  "division": {
    "name": "刑事",
    "code": "M"
  },
  "year": 99,
  "word": "上訴",
  "number": "22",
  "jcheck": "1",
  "reason": "違反槍砲彈藥刀械管制條例",
  "content": "臺灣高等法院刑事判決                  99年度上訴字第22號\n上  訴  人\n即  被  告  甲○○\n上列上訴人因違反槍砲彈藥刀械管制條例案件，不服臺灣桃園地\n方法院98年度訴字第796號，中華民國98年10月14日第一審判決\n（起訴案號：臺灣桃園地方法院檢察署97年度偵字第12483號）\n，提起上訴，本院判決如下：\n    主  文\n上訴駁回。\n    理  由\n一、按第三百六十七條規定，不服地方法院之第一審判決而上訴\n    者，須提出上訴書狀，並應敘述具體理由，為上訴必備之程\n    式；其所提出之書狀未敘述上訴理由，或僅曾以言詞陳述上\n    訴理由者，均應於上訴期間屆滿後二十日內補提理由書於第\n    一審法院。第一審法院經形式審查，認逾期未補提上訴理由\n    者，應定期間先命補正；逾期未補正者，為上訴不合法律上\n    之程式，第二審法院應以判決駁回之。刑事訴訟法第三百五\n    十條、第三百六十一條、第三百六十二條、第三百六十七條\n    規定分別定有明文。\n二、本件上訴人即被告甲○○不服台灣桃園地方法院九十八年度\n    訴字第七九六號判決，提起上訴，其上訴狀未敘述上訴理由\n    ，經原審法院於民國九十八年十二月二日，依刑事訴訟法第\n    三百六十一條第二項規定，裁定命被告於裁定送達後七日內\n    補正，該裁定於九十八年十二月七日，送達至桃園縣楊梅鎮\n    ○○路○段一四七巷十二弄十二號被告住處，並交予被告之\n    弟劉明皓收執，有原審送達證書附卷可稽（卷原審卷第五十\n    一頁），被告迄未補具上訴理由具體指摘原判決關於認定事\n    實、適用法律及量刑等項，有何違法或不當之處。依前開說\n    明，其上訴程序顯不合法，爰不經言詞辯論，依刑事訴訟法\n    第第三百七十二條，第三百六十七條規定，判決如主文。\n中    華    民    國    99    年    1     月    4     日\n                      刑事第十八庭審判長法  官  吳鴻章\n                                        法  官  曾淑華\n                                        法  官  汪梅芬\n以上正本證明與原本無異。\n如不服本判決，應於收受送達後10日內向本院提出上訴書狀，其\n未敘述上訴之理由者並得於提起上訴後10日內向本院補提理由書\n（均須按他造當事人之人數附繕本）「切勿逕送上級法院」。\n                                        書記官  劉寶鈴\n中    華    民    國    99    年    1     月    4     日\n",
  "structure": {
    "main": "上訴駁回。",
    "reason": "一、按第三百六十七條規定，不服地方法院之第一審判決而上訴\n    者，須提出上訴書狀，並應敘述具體理由，為上訴必備之程\n    式；其所提出之書狀未敘述上訴理由，或僅曾以言詞陳述上\n    訴理由者，均應於上訴期間屆滿後二十日內補提理由書於第\n    一審法院。第一審法院經形式審查，認逾期未補提上訴理由\n    者，應定期間先命補正；逾期未補正者，為上訴不合法律上\n    之程式，第二審法院應以判決駁回之。刑事訴訟法第三百五\n    十條、第三百六十一條、第三百六十二條、第三百六十七條\n    規定分別定有明文。\n二、本件上訴人即被告甲○○不服台灣桃園地方法院九十八年度\n    訴字第七九六號判決，提起上訴，其上訴狀未敘述上訴理由\n    ，經原審法院於民國九十八年十二月二日，依刑事訴訟法第\n    三百六十一條第二項規定，裁定命被告於裁定送達後七日內\n    補正，該裁定於九十八年十二月七日，送達至桃園縣楊梅鎮\n    ○○路○段一四七巷十二弄十二號被告住處，並交予被告之\n    弟劉明皓收執，有原審送達證書附卷可稽（卷原審卷第五十\n    一頁），被告迄未補具上訴理由具體指摘原判決關於認定事\n    實、適用法律及量刑等項，有何違法或不當之處。依前開說\n    明，其上訴程序顯不合法，爰不經言詞辯論，依刑事訴訟法\n    第第三百七十二條，第三百六十七條規定，判決如主文。"
  },
  "characters": {
    "judges": [
      "吳鴻章",
      "曾淑華",
      "汪梅芬"
    ],
    "prosecutors": [

    ],
    "lawyers": [

    ],
    "clerks": [
      "劉寶鈴"
    ],
    "plaintiffs": [

    ],
    "defendants": [
      "甲"
    ],
    "prosecutor_office": [

    ],
    "creditors": [

    ],
    "debtors": [

    ],
    "judicial_associate_officer": [

    ]
  },
  "adjudged_at": "2010-01-04",
  "created_at": "2016-01-05 14:35:19",
  "updated_at": "2016-01-05 14:35:19"
}