{
  "identify": "TPH-99-聲-155-20100512-1",
  "court": {
    "name": "臺灣高等法院",
    "code": "TPH"
  },
  "division": {
    "name": "民事",
    "code": "V"
  },
  "year": 99,
  "word": "聲",
  "number": "155",
  "jcheck": "1",
  "reason": "停止執行",
  "content": "臺灣高等法院民事裁定                   99年度聲字第155號\n聲  請  人  甲○○\n相  對  人  乙○○\n上列聲請人因與相對人乙○○間強制執行事件，聲請停止執行，\n本院裁定如下：\n    主      文\n聲請駁回。\n聲請費用由聲請人負擔。\n    理      由\n一、聲請意旨略以：相對人以本院98年度上字第32號容忍修繕等\n    事件民事確定判決（下稱系爭確定判決）為執行名義聲請強\n    制執行，業經臺灣臺北地方法院以99年度司執丁字第18633\n    號（下稱系爭執行事件）受理在案，惟伊已對系爭確定判決\n    提起再審之訴。再者，相對人所有門牌號碼臺北市○○區○\n    ○街121號7樓房屋室內裝潢確已完成且已出租他人使用中，\n    並無漏水情事，其強制執行確無必要，爰依強制執行法第18\n    條規定，請求准予免供擔保，停止系爭執行事件之強制執行\n    程序等語。\n二、按債務人提起再審時，法院因必要情形或依聲請定相當並確\n    實之擔保，得為停止強制執行之裁定，強制執行第18條第2\n    項固定有明文。惟「再審以不停止強制執行為原則，非有特\n    別必要情形，法院不得為停止執行之裁判。」（最高法院18\n    年抗字第85號判例參照）。是債務人聲請再審或提起再審之\n    訴，如經法院判決或裁定駁回，則法院對債務人所為停止強\n    制執行之聲請，即應予駁回，殆無疑義。\n三、經查，聲請人就系爭確定判決向本院提起再審之訴，業經本\n    院於民國99年5月11日以99年度再字第14號判決認在法律上\n    顯無理由，而駁回其再審之訴，揆諸上開說明，聲請人提起\n    再審之訴，既經本院判決駁回，則其聲請停止強制執行，自\n    屬無理由，應予駁回。\n據上論結，本件聲請為無理由，爰裁定如主文。\n中    華    民    國    99    年    5     月    12    日\n                    民事第三庭\n                        審判長法  官  林敬修\n                              法  官  吳青蓉\n                              法  官  黃騰耀\n正本係照原本作成。\n如不服本裁定，應於收受送達後10日內向本院提出抗告狀，並應\n繳納抗告費新台幣１千元。\n中    華    民    國    99    年    5     月    12    日\n                              書記官  潘大鵬",
  "structure": {
    "main": "聲請駁回。\n聲請費用由聲請人負擔。",
    "reason": "一、聲請意旨略以：相對人以本院98年度上字第32號容忍修繕等\n    事件民事確定判決（下稱系爭確定判決）為執行名義聲請強\n    制執行，業經臺灣臺北地方法院以99年度司執丁字第18633\n    號（下稱系爭執行事件）受理在案，惟伊已對系爭確定判決\n    提起再審之訴。再者，相對人所有門牌號碼臺北市○○區○\n    ○街121號7樓房屋室內裝潢確已完成且已出租他人使用中，\n    並無漏水情事，其強制執行確無必要，爰依強制執行法第18\n    條規定，請求准予免供擔保，停止系爭執行事件之強制執行\n    程序等語。\n二、按債務人提起再審時，法院因必要情形或依聲請定相當並確\n    實之擔保，得為停止強制執行之裁定，強制執行第18條第2\n    項固定有明文。惟「再審以不停止強制執行為原則，非有特\n    別必要情形，法院不得為停止執行之裁判。」（最高法院18\n    年抗字第85號判例參照）。是債務人聲請再審或提起再審之\n    訴，如經法院判決或裁定駁回，則法院對債務人所為停止強\n    制執行之聲請，即應予駁回，殆無疑義。\n三、經查，聲請人就系爭確定判決向本院提起再審之訴，業經本\n    院於民國99年5月11日以99年度再字第14號判決認在法律上\n    顯無理由，而駁回其再審之訴，揆諸上開說明，聲請人提起\n    再審之訴，既經本院判決駁回，則其聲請停止強制執行，自\n    屬無理由，應予駁回。\n據上論結，本件聲請為無理由，爰裁定如主文。"
  },
  "characters": {
    "judges": [
      "林敬修",
      "吳青蓉",
      "黃騰耀"
    ],
    "prosecutors": [

    ],
    "lawyers": [

    ],
    "clerks": [

    ],
    "plaintiffs": [

    ],
    "defendants": [

    ],
    "prosecutor_office": [
      "甲"
    ],
    "creditors": [

    ],
    "debtors": [

    ],
    "judicial_associate_officer": [

    ]
  },
  "adjudged_at": "2010-05-12",
  "created_at": "2016-01-05 11:55:32",
  "updated_at": "2016-01-05 11:55:32"
}