{
  "identify": "TPH-99-聲-1309-20100512-1",
  "court": {
    "name": "臺灣高等法院",
    "code": "TPH"
  },
  "division": {
    "name": "刑事",
    "code": "M"
  },
  "year": 99,
  "word": "聲",
  "number": "1309",
  "jcheck": "1",
  "reason": "聲請解除限制出境",
  "content": "臺灣高等法院刑事裁定                  99年度聲字第1309號\n聲  請  人\n即  被  告  甲○○\n上列聲請人因違反銀行法案件（本院99年度金上重訴字第21號）\n，聲請解除限制出境，本院裁定如下：\n    主  文\n聲請駁回。\n    理  由\n一、聲請意旨如附件所示。\n二、經查：\n（一）聲請人即被告甲○○涉嫌犯銀行法第125條第1項前段違反\n      第29條之非銀行辦理匯兌罪，經臺灣臺北地方法院檢察署\n      檢察官以98年度偵字第2557號提起公訴。\n（二）經臺灣臺北地方法院以98年度金重訴字第11號審理後，於\n      民國99年2月4日判決「甲○○共同違反非銀行不得經營辦\n      理國內外匯兌業務之規定，處有期徒刑肆年陸月。」，量\n      刑匪輕。\n（三）檢察官及被告甲○○均不服上訴，本院以99年度金上重訴\n      字第21號受理，正積極進行中，審酌本案牽涉複雜，應調\n      查、審理之事項仍夥，關於被告是否需負刑責，尚待辯論\n      、審理釐清，為免不必要拖延，於判決確定前認仍有限制\n      出境之必要。本件聲請，應予駁回。\n中    華    民    國    99    年    5     月    12    日\n                  刑事第一庭審判長法  官  葉騰瑞\n                                  法  官  莊明彰\n                                  法  官  王炳梁\n以上正本證明與原本無異。\n如不服本裁定，應於收受送達後五日內向本院提出抗告狀。\n                                  書記官  陳佳伶\n中    華    民    國    99    年    5     月    12    日",
  "structure": {
    "main": "聲請駁回。",
    "reason": "一、聲請意旨如附件所示。\n二、經查：\n（一）聲請人即被告甲○○涉嫌犯銀行法第125條第1項前段違反\n      第29條之非銀行辦理匯兌罪，經臺灣臺北地方法院檢察署\n      檢察官以98年度偵字第2557號提起公訴。\n（二）經臺灣臺北地方法院以98年度金重訴字第11號審理後，於\n      民國99年2月4日判決「甲○○共同違反非銀行不得經營辦\n      理國內外匯兌業務之規定，處有期徒刑肆年陸月。」，量\n      刑匪輕。\n（三）檢察官及被告甲○○均不服上訴，本院以99年度金上重訴\n      字第21號受理，正積極進行中，審酌本案牽涉複雜，應調\n      查、審理之事項仍夥，關於被告是否需負刑責，尚待辯論\n      、審理釐清，為免不必要拖延，於判決確定前認仍有限制\n      出境之必要。本件聲請，應予駁回。"
  },
  "characters": {
    "judges": [
      "葉騰瑞",
      "莊明彰",
      "王炳梁"
    ],
    "prosecutors": [

    ],
    "lawyers": [

    ],
    "clerks": [
      "陳佳伶"
    ],
    "plaintiffs": [

    ],
    "defendants": [
      "甲"
    ],
    "prosecutor_office": [

    ],
    "creditors": [

    ],
    "debtors": [

    ],
    "judicial_associate_officer": [

    ]
  },
  "adjudged_at": "2010-05-12",
  "created_at": "2016-01-05 11:53:37",
  "updated_at": "2016-01-05 11:53:37"
}