{
  "identify": "TPH-98-上訴-5115-20100104-1",
  "court": {
    "name": "臺灣高等法院",
    "code": "TPH"
  },
  "division": {
    "name": "刑事",
    "code": "M"
  },
  "year": 98,
  "word": "上訴",
  "number": "5115",
  "jcheck": "1",
  "reason": "毒品危害防制條例",
  "content": "臺灣高等法院刑事判決                98年度上訴字第5115號\n上  訴  人\n即  被  告  甲○○\n上列上訴人因違反毒品危害防制條例案件，不服臺灣板橋地方法\n院98年度訴字第3683號，中華民國98年11月16日第一審判決（起\n訴案號：臺灣板橋地方法院檢察署98年度毒偵字第6079號，嗣於\n原審準備程序進行中，被告就被訴事實為有罪之陳述，經原審告\n知簡式審判程序意旨，並聽取當事人意見後，原審合議裁定依簡\n式審判程序進行），提起上訴，本院判決如下：\n    主  文\n上訴駁回。\n    理  由\n一、依刑事訴訟法第350條、第361條、第362條、第367條規定，\n    不服地方法院之第一審判決而上訴者，須提出上訴書狀，並\n    應敘述具體理由，此為上訴必備之程式；其所提出之書狀未\n    敘述上訴理由，或僅曾以言詞陳述上訴理由者，均應於上訴\n    期間屆滿後20日內補提理由書於第一審法院。第一審法院經\n    形式審查，認逾期未補提上訴理由者，應定期間先命補正；\n    逾期未補正者，為上訴不合法律上之程式，應以裁定駁回。\n    倘已提出上訴理由，但所提非屬具體理由者，則由第二審法\n    院以上訴不合法律上之程式，判決駁回。而所謂具體理由，\n    必係依據卷內既有訴訟資料或提出新事證，指摘或表明第一\n    審判決有何採證認事、用法或量刑等足以影響判決本旨之不\n    當或違法，而構成應予撤銷之具體事由，始克當之（例如：\n    依憑證據法則具體指出所採證據何以不具證據能力，或依憑\n    卷證資料，明確指出所為證據證明力之判斷如何違背經驗、\n    論理法則）；倘僅泛言原判決認定事實錯誤、違背法令、量\n    刑失之過重或輕縱，而未依上揭意旨指出具體事由，或形式\n    上雖已指出具體事由，然該事由縱使屬實，亦不足以認為原\n    判決有何不當或違法者，皆難謂係具體理由（參照最高法院\n    97年台上字第892號判決意旨）。\n二、查本件原判決以被告甲○○於原審審理時之自白，臺北市政\n    府警察局中正第一分局扣押筆錄、扣案物品照片、偵查報告\n    、臺灣尖端先進生技醫藥股份有限公司出具之驗尿報告、交\n    通部民用航空局航空醫務中心出具查獲毒品之毒品鑑定書、\n    扣案之毒品海洛因1包（驗後淨重0.372公克，鑑驗時取樣0.\n    0014公克，驗餘淨重0.3706公克）、注射針筒2支，被告有\n    如事實及理由欄一所示之觀察、勒戒執行完畢及於該觀察、\n    勒戒執行完畢5年內再犯施用毒品，經法院判處罪刑確定等\n    情，有本院被告前案紀錄表在卷可稽，非屬毒品危害防制條\n    第20條第3項所定「5年後再犯」之情形，認被告犯本案施用\n    第一級毒品之罪，事證明確，應依法論科。核本件被告上開\n    所為，係犯毒品危害防制條例第10條第1項之施用第一級毒\n    品罪。其施用毒品前之持有毒品行為，應為其後施用行為所\n    吸收，不另論罪。又被告前曾於96年間因犯施用毒品案件，\n    經臺灣士林地方法院以96年度訴字第32號判決，判處有期徒\n    刑8月確定，其後復經減刑減為有期徒刑4月，執行後於96年\n    7月16日易科執行完畢出監，有本院被告前案紀錄表在卷可\n    稽，被告前受有期徒刑執行完畢後，於5年以內故意再犯本\n    件有期徒刑以上之罪，為累犯，應依刑法第47條第1項規定\n    ，加重其刑。爰審酌被告之素行、再犯施用毒品情節、所生\n    危害及犯罪後坦承之態度等一切情狀，量處有期徒刑10月。\n    又扣案之毒品海洛因驗餘淨重0.3706公克，係查獲之毒品，\n    依法不問屬於犯人與否，均應宣告沒收銷燬；又盛裝上開毒\n    品海洛因包裝袋1只、注射針筒2支等物，則係被告所有供施\n    用第一級毒品犯罪所用之物，另依刑法第38條第1項第2款規\n    定，併予宣告沒收。被告不服，提起本件上訴，略以：吸食\n    毒品屬個人行為偏差，係自戕自身健康，世界各國衛生組織\n    均將吸毒者當病人對待，國內實施減害計畫中，早有美沙冬\n    替代療法，或由檢察機關裁處緩起訴處分，惟上訴人未受有\n    上開權益，實難甘服，為此請本院從輕量刑，以啟自新云云\n    ，經查：本件被告施用毒品犯行已合於毒品危害防制條例所\n    規定之處罰條件，且經檢察官依法追訴，法院自當依法判決\n    ，至於檢察官是否裁處緩起訴等處分，本非法院職權審酌之\n    範圍。又量刑輕重，係屬事實審法院得依職權自由裁量之事\n    項，而原審量刑時，均已審酌刑法第57條各款所列情狀，既\n    未逾越法定範圍，又未濫用其職權，量刑至為妥適。是被告\n    空言指摘原審量刑過重云云，自屬無據，從而，被告所提上\n    訴理由，均未具體指摘原判決認事用法究有何不當或違法之\n    處，自非屬得上訴第二審之具體理由。依上揭說明，本件上\n    訴未敘述具體理由，其上訴自屬不合法律上之程式，應予判\n    決駁回，並不經言詞辯論為之。\n據上論斷，應依刑事訴訟法第367條前段、第372條判決如主文。\n中    華    民    國    99    年      1   月  4    日\n                  刑事第八庭審判長法  官  張傳栗\n                                  法  官  郭豫珍\n                                  法  官  劉嶽承\n以上正本證明與原本無異。\n如不服本判決，應於收受送達後十日內向本院提出上訴書狀，其\n未敘述上訴之理由者並得於提起上訴後十日內向本院補提理由書\n（均須按他造當事人之人數附繕本）。「切勿逕送上級法院」。\n                                  書記官  何仁崴\n中    華    民    國    99    年    1     月    4     日\n",
  "structure": {
    "main": "上訴駁回。",
    "reason": "一、依刑事訴訟法第350條、第361條、第362條、第367條規定，\n    不服地方法院之第一審判決而上訴者，須提出上訴書狀，並\n    應敘述具體理由，此為上訴必備之程式；其所提出之書狀未\n    敘述上訴理由，或僅曾以言詞陳述上訴理由者，均應於上訴\n    期間屆滿後20日內補提理由書於第一審法院。第一審法院經\n    形式審查，認逾期未補提上訴理由者，應定期間先命補正；\n    逾期未補正者，為上訴不合法律上之程式，應以裁定駁回。\n    倘已提出上訴理由，但所提非屬具體理由者，則由第二審法\n    院以上訴不合法律上之程式，判決駁回。而所謂具體理由，\n    必係依據卷內既有訴訟資料或提出新事證，指摘或表明第一\n    審判決有何採證認事、用法或量刑等足以影響判決本旨之不\n    當或違法，而構成應予撤銷之具體事由，始克當之（例如：\n    依憑證據法則具體指出所採證據何以不具證據能力，或依憑\n    卷證資料，明確指出所為證據證明力之判斷如何違背經驗、\n    論理法則）；倘僅泛言原判決認定事實錯誤、違背法令、量\n    刑失之過重或輕縱，而未依上揭意旨指出具體事由，或形式\n    上雖已指出具體事由，然該事由縱使屬實，亦不足以認為原\n    判決有何不當或違法者，皆難謂係具體理由（參照最高法院\n    97年台上字第892號判決意旨）。\n二、查本件原判決以被告甲○○於原審審理時之自白，臺北市政\n    府警察局中正第一分局扣押筆錄、扣案物品照片、偵查報告\n    、臺灣尖端先進生技醫藥股份有限公司出具之驗尿報告、交\n    通部民用航空局航空醫務中心出具查獲毒品之毒品鑑定書、\n    扣案之毒品海洛因1包（驗後淨重0.372公克，鑑驗時取樣0.\n    0014公克，驗餘淨重0.3706公克）、注射針筒2支，被告有\n    如事實及理由欄一所示之觀察、勒戒執行完畢及於該觀察、\n    勒戒執行完畢5年內再犯施用毒品，經法院判處罪刑確定等\n    情，有本院被告前案紀錄表在卷可稽，非屬毒品危害防制條\n    第20條第3項所定「5年後再犯」之情形，認被告犯本案施用\n    第一級毒品之罪，事證明確，應依法論科。核本件被告上開\n    所為，係犯毒品危害防制條例第10條第1項之施用第一級毒\n    品罪。其施用毒品前之持有毒品行為，應為其後施用行為所\n    吸收，不另論罪。又被告前曾於96年間因犯施用毒品案件，\n    經臺灣士林地方法院以96年度訴字第32號判決，判處有期徒\n    刑8月確定，其後復經減刑減為有期徒刑4月，執行後於96年\n    7月16日易科執行完畢出監，有本院被告前案紀錄表在卷可\n    稽，被告前受有期徒刑執行完畢後，於5年以內故意再犯本\n    件有期徒刑以上之罪，為累犯，應依刑法第47條第1項規定\n    ，加重其刑。爰審酌被告之素行、再犯施用毒品情節、所生\n    危害及犯罪後坦承之態度等一切情狀，量處有期徒刑10月。\n    又扣案之毒品海洛因驗餘淨重0.3706公克，係查獲之毒品，\n    依法不問屬於犯人與否，均應宣告沒收銷燬；又盛裝上開毒\n    品海洛因包裝袋1只、注射針筒2支等物，則係被告所有供施\n    用第一級毒品犯罪所用之物，另依刑法第38條第1項第2款規\n    定，併予宣告沒收。被告不服，提起本件上訴，略以：吸食\n    毒品屬個人行為偏差，係自戕自身健康，世界各國衛生組織\n    均將吸毒者當病人對待，國內實施減害計畫中，早有美沙冬\n    替代療法，或由檢察機關裁處緩起訴處分，惟上訴人未受有\n    上開權益，實難甘服，為此請本院從輕量刑，以啟自新云云\n    ，經查：本件被告施用毒品犯行已合於毒品危害防制條例所\n    規定之處罰條件，且經檢察官依法追訴，法院自當依法判決\n    ，至於檢察官是否裁處緩起訴等處分，本非法院職權審酌之\n    範圍。又量刑輕重，係屬事實審法院得依職權自由裁量之事\n    項，而原審量刑時，均已審酌刑法第57條各款所列情狀，既\n    未逾越法定範圍，又未濫用其職權，量刑至為妥適。是被告\n    空言指摘原審量刑過重云云，自屬無據，從而，被告所提上\n    訴理由，均未具體指摘原判決認事用法究有何不當或違法之\n    處，自非屬得上訴第二審之具體理由。依上揭說明，本件上\n    訴未敘述具體理由，其上訴自屬不合法律上之程式，應予判\n    決駁回，並不經言詞辯論為之。\n據上論斷，應依刑事訴訟法第367條前段、第372條判決如主文。"
  },
  "characters": {
    "judges": [
      "張傳栗",
      "郭豫珍",
      "劉嶽承"
    ],
    "prosecutors": [

    ],
    "lawyers": [

    ],
    "clerks": [
      "何仁崴"
    ],
    "plaintiffs": [

    ],
    "defendants": [
      "甲"
    ],
    "prosecutor_office": [

    ],
    "creditors": [

    ],
    "debtors": [

    ],
    "judicial_associate_officer": [

    ]
  },
  "adjudged_at": "2010-01-04",
  "created_at": "2016-01-05 14:34:19",
  "updated_at": "2016-01-05 14:34:19"
}