{
  "identify": "TPH-99-聲-170-20100512-1",
  "court": {
    "name": "臺灣高等法院",
    "code": "TPH"
  },
  "division": {
    "name": "民事",
    "code": "V"
  },
  "year": 99,
  "word": "聲",
  "number": "170",
  "jcheck": "1",
  "reason": "訴訟救助",
  "content": "臺灣高等法院民事裁定                   99年度聲字第170號\n聲  請  人  乙○○\n上列聲請人因與相對人甲○○間遷讓房屋事件，聲請訴訟救助，\n本院裁定如下：\n    主  文\n准予訴訟救助。\n    理  由\n一、按當事人無資力支出訴訟費用者，法院應依聲請，以裁定准\n    予訴訟救助，但顯無勝訴之望者，不在此限；法院認定前項\n    資力時，應斟酌當事人及其共同生活親屬基本生活之需要，\n    民事訴訟法第一百零七條定有明文。\n二、本件聲請意旨略以：聲請人原於民國 (下同)93 年11月10日\n    與訴外人孫合章簽訂租賃契約，租期十年且預付租金，而相\n    對人於向法院拍得聲請人租賃之房屋後，訴請聲請遷讓房屋\n    並給付相當於租金之不當得利，聲請人刻正以本院99年度上\n    字第484號上訴中。因聲請人二十年來獨立撫養兩名子女 ，\n    既無恆產亦無固定收入，家庭生活費全賴親友接濟及打零工\n    所得，實無資力支出本件訴訟費用，爰求為准予訴訟救助等\n    語，並提出聲請人及子女三人之96及97年度綜合所得稅各類\n    所得資料清單、聲請人財產歸屬清單、桃園縣桃園市中路里\n    里長出具清寒證明書可資為證（本院卷4第至11頁）。\n三、查本件相對人訴請聲請人遷讓返還房屋，依民事訴訟法第77\n    條之1、第77條之13規定， 其訴訟標的價額即該房屋拍定金\n    額新臺幣(下同)195萬3千元，聲請人提起上訴應繳之裁判費\n    計為30,606元。惟依聲請人聲請人及子女羅培華、羅培元所\n    得資料清單所示，其三人於96及97年度均無所得。聲請人名\n    下雖有座落花蓮縣玉里鎮三民里15鄰三民184號、面積14.45\n    平方公尺之房屋一棟，及車號AE- 8701之1992年份汽車一部\n    ，惟聲請人並無房屋所在基地之所有權，且面積狹小地處偏\n    遠，出租或變賣均屬困難，另汽車亦已老舊，已無什交換價\n    值，揆諸首揭說明，斟酌聲請人及其共同生活親屬之基本生\n    活需要，應可認伊已窘於生活且缺乏經濟上之信用。聲請人\n    主張其無資力支出本件訴訟費用，堪予採信，其聲請訴訟救\n    ，核無不合，應予准許。\n四、據上論結，本件聲請為有理由，爰裁定如主文。\n中    華    民    國    99    年    5     月    12    日\n                  民事第三庭\n                        審判長法  官 林敬修\n                              法  官 吳青蓉\n                              法  官 張靜女\n正本係照原本作成。\n如不服本裁定，應於收受送達後10日內向本院提出抗告狀，並應\n繳納抗告費新台幣１千元。\n中    華    民    國    99    年    5     月    12    日\n                              書記官 蕭麗珍",
  "structure": {
    "main": "准予訴訟救助。",
    "reason": "一、按當事人無資力支出訴訟費用者，法院應依聲請，以裁定准\n    予訴訟救助，但顯無勝訴之望者，不在此限；法院認定前項\n    資力時，應斟酌當事人及其共同生活親屬基本生活之需要，\n    民事訴訟法第一百零七條定有明文。\n二、本件聲請意旨略以：聲請人原於民國 (下同)93 年11月10日\n    與訴外人孫合章簽訂租賃契約，租期十年且預付租金，而相\n    對人於向法院拍得聲請人租賃之房屋後，訴請聲請遷讓房屋\n    並給付相當於租金之不當得利，聲請人刻正以本院99年度上\n    字第484號上訴中。因聲請人二十年來獨立撫養兩名子女 ，\n    既無恆產亦無固定收入，家庭生活費全賴親友接濟及打零工\n    所得，實無資力支出本件訴訟費用，爰求為准予訴訟救助等\n    語，並提出聲請人及子女三人之96及97年度綜合所得稅各類\n    所得資料清單、聲請人財產歸屬清單、桃園縣桃園市中路里\n    里長出具清寒證明書可資為證（本院卷4第至11頁）。\n三、查本件相對人訴請聲請人遷讓返還房屋，依民事訴訟法第77\n    條之1、第77條之13規定， 其訴訟標的價額即該房屋拍定金\n    額新臺幣(下同)195萬3千元，聲請人提起上訴應繳之裁判費\n    計為30,606元。惟依聲請人聲請人及子女羅培華、羅培元所\n    得資料清單所示，其三人於96及97年度均無所得。聲請人名\n    下雖有座落花蓮縣玉里鎮三民里15鄰三民184號、面積14.45\n    平方公尺之房屋一棟，及車號AE- 8701之1992年份汽車一部\n    ，惟聲請人並無房屋所在基地之所有權，且面積狹小地處偏\n    遠，出租或變賣均屬困難，另汽車亦已老舊，已無什交換價\n    值，揆諸首揭說明，斟酌聲請人及其共同生活親屬之基本生\n    活需要，應可認伊已窘於生活且缺乏經濟上之信用。聲請人\n    主張其無資力支出本件訴訟費用，堪予採信，其聲請訴訟救\n    ，核無不合，應予准許。\n四、據上論結，本件聲請為有理由，爰裁定如主文。"
  },
  "characters": {
    "judges": [
      "林敬修",
      "吳青蓉",
      "張靜女"
    ],
    "prosecutors": [

    ],
    "lawyers": [

    ],
    "clerks": [

    ],
    "plaintiffs": [

    ],
    "defendants": [

    ],
    "prosecutor_office": [
      "乙"
    ],
    "creditors": [

    ],
    "debtors": [

    ],
    "judicial_associate_officer": [

    ]
  },
  "adjudged_at": "2010-05-12",
  "created_at": "2016-01-05 11:55:34",
  "updated_at": "2016-01-05 11:55:34"
}