{
  "identify": "TPH-99-上訴-9-20100105-1",
  "court": {
    "name": "臺灣高等法院",
    "code": "TPH"
  },
  "division": {
    "name": "刑事",
    "code": "M"
  },
  "year": 99,
  "word": "上訴",
  "number": "9",
  "jcheck": "1",
  "reason": "毒品危害防制條例",
  "content": "臺灣高等法院刑事判決                   99年度上訴字第9號\n上  訴  人\n即  被  告  甲○○\n上列上訴人因違反毒品危害防制條例案件，不服臺灣桃園地方法\n院98年度審訴字第2157號，中華民國98年11月30日第一審判決（\n起訴案號：臺灣桃園地方法院檢察署98年度毒偵字第3622號，移\n送併辦案號：臺灣桃園地方法院檢察署98年度毒偵字第4547號）\n，提起上訴，本院判決如下：\n    主  文\n上訴駁回。\n    理  由\n一、按不服地方法院之第一審判決而上訴者，應向管轄第二審之\n    高等法院為之。上訴書狀應敘述具體理由。上訴書狀未敘述\n    上訴理由者，應於上訴期間屆滿後20日內補提理由書於原審\n    法院，逾期未補提者，原審法院應定期間先命補正。第二審\n    法院認為上訴書狀未敘述理由或上訴有第362條前段之情形\n    者，應以判決駁回之，但其情形可以補正而未經原審法院命\n    其補正者，審判長應定期間先命補正。刑事訴訟法第361條\n    及第367條分別定有明文。所謂不服第一審判決之具體理由\n    ，係指依據卷內訴訟資料，具體指摘第一審判決關於認定事\n    實、適用法律及量刑等項，有違法或不當之情形而言，此為\n    提起第二審上訴之法定要件。倘上訴人之上訴書狀或補提之\n    上訴理由書，雖有敘述上訴理由，惟並未具體敘述第一審判\n    決有上述違法、不當情形，即與未敘述具體理由無異，所為\n    上訴，即不符合上訴之法定要件。\n二、經查：\n  (一)本件原審適用簡式審判程序，並以上訴人即被告甲○○於原\n    審之自白、臺灣桃園地方法院檢察署施用毒品犯受保護管束\n    人採尿報到編號表、臺灣桃園地方法院檢察署受保護管束人\n    尿液檢體監管紀錄表、臺灣尖端先進生技醫藥股份有限公司\n    濫用藥物檢驗報告、桃園縣政府警察局桃園分局檢體監管紀\n    錄表及臺灣檢驗科技股份有限公司濫用藥物檢驗報告等為據\n    ，認定被告確有施用第二級毒品甲基安非他命2次及施用第\n    一級毒品海洛因1次之犯行，均為累犯，各量處有期徒刑6月\n    、6月及9月，應執行有期徒刑1年5月。從形式上審查，其採\n    證認事及用法，並未違反法令或悖離經驗法則、論理法則，\n    量刑亦屬允當。\n  (二)被告上訴理由對於原審判決採證認事、用法均無爭執，僅以\n    ：原審量刑太重，懇請本院能給予自新機會、從輕量刑等語\n    。\n  (三)按量刑輕重，係屬事實審法院得依職權自由裁量之事項，苟\n    其量刑已以行為人之責任為基礎，並斟酌刑法第57條各款所\n    列情狀，而未逾越法定刑度或有濫用權限情事，即不得任意\n    指為違法（最高法院75年臺上字第7033號判例、98年度臺上\n    字第5002號判決意旨參照）。本件原判決於量刑時依刑法第\n    57條規定審酌被告相關一切情狀稱：「爰審酌被告犯後坦承\n    犯行而態度尚可、施用毒品係戕害自身健康，對他人並不生\n    重大危害等一切情狀」，已就量刑刑度詳為審酌並敘明理由\n    ，既未逾越法定刑度，復未濫用自由裁量之權限，且原審所\n    定應執行之刑，亦係在各刑中之最長期以上，各刑合併之刑\n    期以下，合於刑法第51條第5款規定所定之外部界限，亦未\n    逾自由裁量之內部界限。上訴意旨復未具體指摘原審判決關\n    於認定事實、適用法律及量刑等事項，究竟有何違法或不當\n    之具體情形。揆諸上開說明，本件上訴未敘述具體理由，屬\n    不合法律上之程式，應予駁回，並不經言詞辯論為之。\n據上論斷，依刑事訴訟法第367條前段、第372條，判決如主文。\n中    華    民    國    99    年    1     月    5     日\n                刑事第十三庭    審判長法  官   曾德水\n                                      法  官   陳恆寬\n                                      法  官   崔玲琦\n以上正本證明與原本無異。\n施用第一級毒品部分，如不服本判決，應於收受送達後10日內向\n本院提出上訴書狀，其未敘述上訴之理由者並得於提起上訴後10\n日內向本院補提理由書（均須按他造當事人之人數附繕本）「切\n勿逕送上級法院」。\n施用第二級毒品部分，不得上訴。\n                                     書記官    馬佳瑩\n中    華    民    國    99    年    1     月    7     日\n",
  "structure": {
    "main": "上訴駁回。",
    "reason": "一、按不服地方法院之第一審判決而上訴者，應向管轄第二審之\n    高等法院為之。上訴書狀應敘述具體理由。上訴書狀未敘述\n    上訴理由者，應於上訴期間屆滿後20日內補提理由書於原審\n    法院，逾期未補提者，原審法院應定期間先命補正。第二審\n    法院認為上訴書狀未敘述理由或上訴有第362條前段之情形\n    者，應以判決駁回之，但其情形可以補正而未經原審法院命\n    其補正者，審判長應定期間先命補正。刑事訴訟法第361條\n    及第367條分別定有明文。所謂不服第一審判決之具體理由\n    ，係指依據卷內訴訟資料，具體指摘第一審判決關於認定事\n    實、適用法律及量刑等項，有違法或不當之情形而言，此為\n    提起第二審上訴之法定要件。倘上訴人之上訴書狀或補提之\n    上訴理由書，雖有敘述上訴理由，惟並未具體敘述第一審判\n    決有上述違法、不當情形，即與未敘述具體理由無異，所為\n    上訴，即不符合上訴之法定要件。\n二、經查：\n  (一)本件原審適用簡式審判程序，並以上訴人即被告甲○○於原\n    審之自白、臺灣桃園地方法院檢察署施用毒品犯受保護管束\n    人採尿報到編號表、臺灣桃園地方法院檢察署受保護管束人\n    尿液檢體監管紀錄表、臺灣尖端先進生技醫藥股份有限公司\n    濫用藥物檢驗報告、桃園縣政府警察局桃園分局檢體監管紀\n    錄表及臺灣檢驗科技股份有限公司濫用藥物檢驗報告等為據\n    ，認定被告確有施用第二級毒品甲基安非他命2次及施用第\n    一級毒品海洛因1次之犯行，均為累犯，各量處有期徒刑6月\n    、6月及9月，應執行有期徒刑1年5月。從形式上審查，其採\n    證認事及用法，並未違反法令或悖離經驗法則、論理法則，\n    量刑亦屬允當。\n  (二)被告上訴理由對於原審判決採證認事、用法均無爭執，僅以\n    ：原審量刑太重，懇請本院能給予自新機會、從輕量刑等語\n    。\n  (三)按量刑輕重，係屬事實審法院得依職權自由裁量之事項，苟\n    其量刑已以行為人之責任為基礎，並斟酌刑法第57條各款所\n    列情狀，而未逾越法定刑度或有濫用權限情事，即不得任意\n    指為違法（最高法院75年臺上字第7033號判例、98年度臺上\n    字第5002號判決意旨參照）。本件原判決於量刑時依刑法第\n    57條規定審酌被告相關一切情狀稱：「爰審酌被告犯後坦承\n    犯行而態度尚可、施用毒品係戕害自身健康，對他人並不生\n    重大危害等一切情狀」，已就量刑刑度詳為審酌並敘明理由\n    ，既未逾越法定刑度，復未濫用自由裁量之權限，且原審所\n    定應執行之刑，亦係在各刑中之最長期以上，各刑合併之刑\n    期以下，合於刑法第51條第5款規定所定之外部界限，亦未\n    逾自由裁量之內部界限。上訴意旨復未具體指摘原審判決關\n    於認定事實、適用法律及量刑等事項，究竟有何違法或不當\n    之具體情形。揆諸上開說明，本件上訴未敘述具體理由，屬\n    不合法律上之程式，應予駁回，並不經言詞辯論為之。\n據上論斷，依刑事訴訟法第367條前段、第372條，判決如主文。"
  },
  "characters": {
    "judges": [
      "曾德水",
      "陳恆寬",
      "崔玲琦"
    ],
    "prosecutors": [

    ],
    "lawyers": [

    ],
    "clerks": [
      "馬佳瑩"
    ],
    "plaintiffs": [

    ],
    "defendants": [
      "甲"
    ],
    "prosecutor_office": [

    ],
    "creditors": [

    ],
    "debtors": [

    ],
    "judicial_associate_officer": [

    ]
  },
  "adjudged_at": "2010-01-05",
  "created_at": "2016-01-05 15:01:24",
  "updated_at": "2016-01-05 15:01:24"
}