{
  "identify": "TPH-98-非再抗-6-20100105-3",
  "court": {
    "name": "臺灣高等法院",
    "code": "TPH"
  },
  "division": {
    "name": "民事",
    "code": "V"
  },
  "year": 98,
  "word": "非再抗",
  "number": "6",
  "jcheck": "3",
  "reason": "解散清算",
  "content": "臺灣高等法院民事裁定                 98年度非再抗字第6號\n聲  請  人  鉑鈾科技股份有限公司\n法定代理人  乙○○\n再審聲請人因與相對人甲○○間解散清算事件，對於中華民國98\n年11月16日本院所為98年度非再抗字第6號裁定，聲明異議，本\n院裁定如下：\n    主  文\n異議駁回。\n異議程序費用由異議人負擔。\n    理  由\n一、按非訟事件依非訟事件法並無再審及準用民事訴訟法關於再\n    審之規定，自不得對於非訟事件之裁定聲請再審 (最高法院\n    67年台聲字第60號、66年台抗字第248號及59年台抗字第387\n    號判例意旨參照)。又按非訟事件法第46條固規定，抗告及\n    再抗告，除該法另有規定外，準用民事訴訟法關於抗告程序\n    之規定，然民事訴訟法亦未設有終審法院所為之裁定得為抗\n    告或異議之規定，是當事人自不得對於終審裁定提起抗告或\n    聲明異議。\n二、經查，本件異議人前對臺灣臺北地方法院（下簡稱原法院）\n    民國(下同)95年6月26日95年度司字第97號裁定提起抗告，\n    經原法院於96年11月22日以95年度抗字第568號裁定駁回抗\n    告，異議人旋提起再抗告，經原法院於97年8月27日以95年\n    抗字第568號駁回其再抗告，異議人不服，對該裁定提起抗\n    告，經本院於98年2月25日以98年度非抗字第10號裁定廢棄\n    原裁定，原法院乃另於98年6月9日裁定命伊於7日內補正律\n    師為代理人，經異議人補正律師為代理人後，原法院遂以不\n    合法為由而裁定駁回再抗告，異議人因而抗告，嗣經98年8\n    月31日本院98年度非抗字第86號裁定駁回抗告，聲請人即抗\n    告人乃就本院上開裁定聲請再審，但經本院於98年10月30日\n    以98年度非再抗字第6號裁定駁回其聲請，異議人不服再提\n    出抗告，經本院於98年11月16日以本院駁回異議人對再審之\n    聲請，核屬不得提起抗告之裁定為由駁回異議人之抗告等情\n    ，業經本院查核屬實，並有裁定附卷可稽。是本件解散清算\n    已歷三審審級。揆諸首揭規定及說明，異議人對本院終審裁\n    定聲明異議，於法無據，不應准許。\n三、據上論結，本件異議為不合法，爰裁定如主文。\n中    華    民    國    99    年    1    月    5      日\n                    民事第五庭\n                        審判長法  官  李錦美\n                              法  官  陳博享\n                              法  官  黃雯惠\n正本係照原本作成。\n不得抗告。\n中    華    民    國    99    年    1    月    5      日\n                              書記官  秦慧榮",
  "structure": {
    "main": "異議駁回。\n異議程序費用由異議人負擔。",
    "reason": "一、按非訟事件依非訟事件法並無再審及準用民事訴訟法關於再\n    審之規定，自不得對於非訟事件之裁定聲請再審 (最高法院\n    67年台聲字第60號、66年台抗字第248號及59年台抗字第387\n    號判例意旨參照)。又按非訟事件法第46條固規定，抗告及\n    再抗告，除該法另有規定外，準用民事訴訟法關於抗告程序\n    之規定，然民事訴訟法亦未設有終審法院所為之裁定得為抗\n    告或異議之規定，是當事人自不得對於終審裁定提起抗告或\n    聲明異議。\n二、經查，本件異議人前對臺灣臺北地方法院（下簡稱原法院）\n    民國(下同)95年6月26日95年度司字第97號裁定提起抗告，\n    經原法院於96年11月22日以95年度抗字第568號裁定駁回抗\n    告，異議人旋提起再抗告，經原法院於97年8月27日以95年\n    抗字第568號駁回其再抗告，異議人不服，對該裁定提起抗\n    告，經本院於98年2月25日以98年度非抗字第10號裁定廢棄\n    原裁定，原法院乃另於98年6月9日裁定命伊於7日內補正律\n    師為代理人，經異議人補正律師為代理人後，原法院遂以不\n    合法為由而裁定駁回再抗告，異議人因而抗告，嗣經98年8\n    月31日本院98年度非抗字第86號裁定駁回抗告，聲請人即抗\n    告人乃就本院上開裁定聲請再審，但經本院於98年10月30日\n    以98年度非再抗字第6號裁定駁回其聲請，異議人不服再提\n    出抗告，經本院於98年11月16日以本院駁回異議人對再審之\n    聲請，核屬不得提起抗告之裁定為由駁回異議人之抗告等情\n    ，業經本院查核屬實，並有裁定附卷可稽。是本件解散清算\n    已歷三審審級。揆諸首揭規定及說明，異議人對本院終審裁\n    定聲明異議，於法無據，不應准許。\n三、據上論結，本件異議為不合法，爰裁定如主文。"
  },
  "characters": {
    "judges": [
      "李錦美",
      "陳博享",
      "黃雯惠"
    ],
    "prosecutors": [

    ],
    "lawyers": [

    ],
    "clerks": [

    ],
    "plaintiffs": [

    ],
    "defendants": [

    ],
    "prosecutor_office": [
      "鉑鈾科技股份有限公司"
    ],
    "creditors": [

    ],
    "debtors": [

    ],
    "judicial_associate_officer": [

    ]
  },
  "adjudged_at": "2010-01-05",
  "created_at": "2016-01-05 15:02:08",
  "updated_at": "2016-01-05 15:02:08"
}