{
  "identify": "TPH-98-聲再-505-20100104-1",
  "court": {
    "name": "臺灣高等法院",
    "code": "TPH"
  },
  "division": {
    "name": "刑事",
    "code": "M"
  },
  "year": 98,
  "word": "聲再",
  "number": "505",
  "jcheck": "1",
  "reason": "偽造文書等",
  "content": "臺灣高等法院刑事裁定                 98年度聲再字第505號\n再審聲請人\n即受判決人  甲○○\n上列聲請人因偽造文書等案件，對於本院98年度上訴字第1535號\n，中華民國98年6月30日第二審確定判決（原審案號：臺灣板橋\n地方法院98年度訴緝字第196號，起訴案號：臺灣板橋地方法院\n檢察署91年度偵字第16292號、第9564號、第12459號），聲請再\n審，本院裁定如下：\n    主  文\n再審之聲請駁回。\n    理  由\n一、按，再審係為原確定判決認定事實錯誤而設之救濟程序，是\n    聲請再審之對象應為確定之實體判決。倘屬程序上判決，因\n    不具實體之確定力，縱經判決確定，仍不得以之為聲請再審\n    之客體。此項得否作為聲請再審之客體，以及再審之聲請是\n    否具備合法條件，受理再審聲請法院，應先加審查，若其聲\n    請再審之程序違背規定時，即應以其聲請不合法，依刑事訴\n    訟法第433條規定裁定駁回之；必再審之客體無誤，聲請合\n    法，始能進而審究其再審有無理由（最高法院97年度台抗字\n    第375號判決參照）。次按，再審係對於實體上確定判決聲\n    請救濟之方法，對於程序上之判決要無再審可言。經下級審\n    判決後，雖提起上訴，但因上訴不合法經程序判決駁回確定\n    者，因上級審並未涉及實體上裁判，仍以原下級審法院之判\n    決為實體確定判決，如聲請再審，應以該下級審之確定判決\n    為對象，向該下級審法院為之，始為正辦（最高法院94年台\n    抗字第27號裁定參照)。\n二、經查，本院98年度上訴字第1535號確定判決係以聲請人上訴\n    逾期，依刑事訴訟法第367條前段，以上訴不合法駁回之，\n    有該案判決書在卷可參，顯係程序判決而非實體判決。又前\n    揭確定判決既屬程序上判決，依上開說明，自不具實體確定\n    力，縱經判決確定，仍不得以之為聲請再審之客體，聲請人\n    對本院上開程序判決聲請再審，即不合法律上之程序，應予\n    駁回。\n據上論斷，應依刑事訴訟法第433條，裁定如主文。\n中    華    民    國    99    年    1     月    4     日\n                  刑事第九庭  審判長法  官  陳貽男\n                                    法  官  周盈文\n                                    法  官  詹駿鴻\n以上正本證明與原本無異。\n如不服本裁定，應於收受送達後五日內向本院提出抗告狀。\n                                    書記官  梁淑時\n中    華    民    國    99    年    1     月    5     日\n",
  "structure": {
    "main": "再審之聲請駁回。",
    "reason": "一、按，再審係為原確定判決認定事實錯誤而設之救濟程序，是\n    聲請再審之對象應為確定之實體判決。倘屬程序上判決，因\n    不具實體之確定力，縱經判決確定，仍不得以之為聲請再審\n    之客體。此項得否作為聲請再審之客體，以及再審之聲請是\n    否具備合法條件，受理再審聲請法院，應先加審查，若其聲\n    請再審之程序違背規定時，即應以其聲請不合法，依刑事訴\n    訟法第433條規定裁定駁回之；必再審之客體無誤，聲請合\n    法，始能進而審究其再審有無理由（最高法院97年度台抗字\n    第375號判決參照）。次按，再審係對於實體上確定判決聲\n    請救濟之方法，對於程序上之判決要無再審可言。經下級審\n    判決後，雖提起上訴，但因上訴不合法經程序判決駁回確定\n    者，因上級審並未涉及實體上裁判，仍以原下級審法院之判\n    決為實體確定判決，如聲請再審，應以該下級審之確定判決\n    為對象，向該下級審法院為之，始為正辦（最高法院94年台\n    抗字第27號裁定參照)。\n二、經查，本院98年度上訴字第1535號確定判決係以聲請人上訴\n    逾期，依刑事訴訟法第367條前段，以上訴不合法駁回之，\n    有該案判決書在卷可參，顯係程序判決而非實體判決。又前\n    揭確定判決既屬程序上判決，依上開說明，自不具實體確定\n    力，縱經判決確定，仍不得以之為聲請再審之客體，聲請人\n    對本院上開程序判決聲請再審，即不合法律上之程序，應予\n    駁回。\n據上論斷，應依刑事訴訟法第433條，裁定如主文。"
  },
  "characters": {
    "judges": [
      "陳貽男",
      "周盈文",
      "詹駿鴻"
    ],
    "prosecutors": [

    ],
    "lawyers": [

    ],
    "clerks": [
      "梁淑時"
    ],
    "plaintiffs": [

    ],
    "defendants": [

    ],
    "prosecutor_office": [

    ],
    "creditors": [

    ],
    "debtors": [

    ],
    "judicial_associate_officer": [

    ]
  },
  "adjudged_at": "2010-01-04",
  "created_at": "2016-01-05 14:35:04",
  "updated_at": "2016-01-05 14:35:04"
}