{
  "identify": "TPH-99-聲再-172-20100512-1",
  "court": {
    "name": "臺灣高等法院",
    "code": "TPH"
  },
  "division": {
    "name": "刑事",
    "code": "M"
  },
  "year": 99,
  "word": "聲再",
  "number": "172",
  "jcheck": "1",
  "reason": "聲明異議",
  "content": "臺灣高等法院刑事裁定                 99年度聲再字第172號\n再審聲請人\n即受判決人  甲○○\n上列聲請人因強盜殺人等案件，對於本院99年度聲字第115 號，\n中華民國99年1 月14日刑事裁定（最高法院99年度台抗字第214\n號駁回抗告確定），聲請再審，本院裁定如下：\n    主  文\n再審之聲請駁回。\n    理  由\n一、聲請意旨詳如附件聲請狀所載。\n二、按再審程序係就已確定之刑事確定判決發現事實上錯誤或有\n    錯誤之虞時所設之救濟方法，此刑事訴訟法上之確定判決，\n    係指法院已就實體為裁判，具實體之確定力之有罪、無罪、\n    免訴判決或不受理之確定判決而言，故聲請再審之客體，應\n    限於「確定判決」，而不及於「確定裁定」，據此，刑事裁\n    定不論關於程序上或實體上事項，除得依刑事訴訟法相關程\n    序救濟外，均不得為再審對象。最高法院80年度台抗字第64\n    2號、84年度台抗字第135號裁定意旨可資參照。是法院認為\n    聲請再審之程序違背規定者，應以裁定駁回之，刑事訴訟法\n    第433條定有明文。次按聲請再審，應以再審書狀敘述理由\n    ，附具原判決之繕本及證據，提出於管轄法院為之，刑事訴\n    訟法第429條定有明文。此再審書狀應敘述理由，附具原判\n    決之繕本及證據之規定，為法定聲請之程式，且刑事訴訟法\n    第5編所規定之再審程序，並無得準用同法第2編第1審程序\n    中關於同法第252條第3項之規定，亦即此項再審程式若有欠\n    缺並非可以補正，如有違背，法院自亦應依上開規定，以裁\n    定駁回其再審之聲請（最高法院88年度台抗字第41 6號判決\n    參照）。\n三、經查：\n  (一)按有罪之判決確定後，有再審之原因，為受判決人之利益，\n    固得聲請再審。惟其聲請再審之客體，限於實體之確定判決\n    ，倘屬程序上之判決，因不具實體之確定力，縱經判決確定\n    ，仍不得作為聲請再審之客體。而此項得否作為聲請再審之\n    客體，又屬首應調查、審認之事項，必也於聲請再審之確定\n    判決，得作為聲請再審客體之條件下，始得進而為其他程序\n    及實體上審查。\n  (二)查聲請人認檢察官之指揮執行有所不當，具狀向臺灣臺北地\n    方法院聲明不服，經臺灣臺北地方法院檢察署民國98年10月\n    30日北檢玲離98執聲他1267號字第79882 號函轉知並向本院\n    提起聲明異議後，本院以99年度聲字第115 號裁定予以駁回\n    ，復經最高法院以99年度台抗字第214 號裁定駁回而確定，\n    有被告前案紀錄表在卷可稽，故聲請人即以本院99年度聲字\n    第115 號刑事裁定，提起再審之聲請。惟聲請再審之客體，\n    應限於實體之確定判決，而程序上判決，因不具實體之確定\n    力，縱經確定，仍不得以之為聲請再審之客體。且刑事訴訟\n    法有關再審程序之規定，對於檢察官指揮執行認有不當之聲\n    明異議案件，並未適用，其對檢察官所為之處分聲明異議，\n    經法院所為之裁定確定後，自無再審規定之適用。是上開原\n    確定裁定係關於訴訟程序之事項，與案件之實體事項無關，\n    聲請人以本院99年度聲字第115 號刑事裁定，作為聲請再審\n    之對象，而非以確定判決為再審之對象，此與聲請再審者應\n    以確定判決為限之規定不符。\n  (三)另聲請再審之程式，應以再審書狀敘述理由，附具原判決之\n    繕本及證據，提出於管轄法院為之。所謂「原判決之繕本」\n    ，乃指原確定判決之繕本。查本件聲請人聲請狀內並未附該\n    聲請再審之客體之繕本，然聲請人據以聲請再審之客體既已\n    非法所許，遑論其未提出原判決之繕本，揆諸上開說明，其\n    聲請再審為不合法，應予駁回。\n據上論斷，應依刑事訴訟法第433 條第1 項，裁定如主文。\n中    華    民    國    99    年    5    月    12     日\n                刑事第十五庭  審判長法  官  吳昭瑩\n                                    法  官  蘇隆惠\n                                    法  官  吳炳桂\n以上正本證明與原本無異。\n如不服本裁定，應於收受送達後五日內向本院提出抗告狀。\n                                    書記官  洪雅蔓\n中    華    民    國    99    年    5     月    13    日",
  "structure": {
    "main": "再審之聲請駁回。",
    "reason": "一、聲請意旨詳如附件聲請狀所載。\n二、按再審程序係就已確定之刑事確定判決發現事實上錯誤或有\n    錯誤之虞時所設之救濟方法，此刑事訴訟法上之確定判決，\n    係指法院已就實體為裁判，具實體之確定力之有罪、無罪、\n    免訴判決或不受理之確定判決而言，故聲請再審之客體，應\n    限於「確定判決」，而不及於「確定裁定」，據此，刑事裁\n    定不論關於程序上或實體上事項，除得依刑事訴訟法相關程\n    序救濟外，均不得為再審對象。最高法院80年度台抗字第64\n    2號、84年度台抗字第135號裁定意旨可資參照。是法院認為\n    聲請再審之程序違背規定者，應以裁定駁回之，刑事訴訟法\n    第433條定有明文。次按聲請再審，應以再審書狀敘述理由\n    ，附具原判決之繕本及證據，提出於管轄法院為之，刑事訴\n    訟法第429條定有明文。此再審書狀應敘述理由，附具原判\n    決之繕本及證據之規定，為法定聲請之程式，且刑事訴訟法\n    第5編所規定之再審程序，並無得準用同法第2編第1審程序\n    中關於同法第252條第3項之規定，亦即此項再審程式若有欠\n    缺並非可以補正，如有違背，法院自亦應依上開規定，以裁\n    定駁回其再審之聲請（最高法院88年度台抗字第41 6號判決\n    參照）。\n三、經查：\n  (一)按有罪之判決確定後，有再審之原因，為受判決人之利益，\n    固得聲請再審。惟其聲請再審之客體，限於實體之確定判決\n    ，倘屬程序上之判決，因不具實體之確定力，縱經判決確定\n    ，仍不得作為聲請再審之客體。而此項得否作為聲請再審之\n    客體，又屬首應調查、審認之事項，必也於聲請再審之確定\n    判決，得作為聲請再審客體之條件下，始得進而為其他程序\n    及實體上審查。\n  (二)查聲請人認檢察官之指揮執行有所不當，具狀向臺灣臺北地\n    方法院聲明不服，經臺灣臺北地方法院檢察署民國98年10月\n    30日北檢玲離98執聲他1267號字第79882 號函轉知並向本院\n    提起聲明異議後，本院以99年度聲字第115 號裁定予以駁回\n    ，復經最高法院以99年度台抗字第214 號裁定駁回而確定，\n    有被告前案紀錄表在卷可稽，故聲請人即以本院99年度聲字\n    第115 號刑事裁定，提起再審之聲請。惟聲請再審之客體，\n    應限於實體之確定判決，而程序上判決，因不具實體之確定\n    力，縱經確定，仍不得以之為聲請再審之客體。且刑事訴訟\n    法有關再審程序之規定，對於檢察官指揮執行認有不當之聲\n    明異議案件，並未適用，其對檢察官所為之處分聲明異議，\n    經法院所為之裁定確定後，自無再審規定之適用。是上開原\n    確定裁定係關於訴訟程序之事項，與案件之實體事項無關，\n    聲請人以本院99年度聲字第115 號刑事裁定，作為聲請再審\n    之對象，而非以確定判決為再審之對象，此與聲請再審者應\n    以確定判決為限之規定不符。\n  (三)另聲請再審之程式，應以再審書狀敘述理由，附具原判決之\n    繕本及證據，提出於管轄法院為之。所謂「原判決之繕本」\n    ，乃指原確定判決之繕本。查本件聲請人聲請狀內並未附該\n    聲請再審之客體之繕本，然聲請人據以聲請再審之客體既已\n    非法所許，遑論其未提出原判決之繕本，揆諸上開說明，其\n    聲請再審為不合法，應予駁回。\n據上論斷，應依刑事訴訟法第433 條第1 項，裁定如主文。"
  },
  "characters": {
    "judges": [
      "吳昭瑩",
      "蘇隆惠",
      "吳炳桂"
    ],
    "prosecutors": [

    ],
    "lawyers": [

    ],
    "clerks": [
      "洪雅蔓"
    ],
    "plaintiffs": [

    ],
    "defendants": [

    ],
    "prosecutor_office": [

    ],
    "creditors": [

    ],
    "debtors": [

    ],
    "judicial_associate_officer": [

    ]
  },
  "adjudged_at": "2010-05-12",
  "created_at": "2016-01-05 11:54:03",
  "updated_at": "2016-01-05 11:54:03"
}