{
  "identify": "TPH-97-智上-15-20100105-2",
  "court": {
    "name": "臺灣高等法院",
    "code": "TPH"
  },
  "division": {
    "name": "民事",
    "code": "V"
  },
  "year": 97,
  "word": "智上",
  "number": "15",
  "jcheck": "2",
  "reason": "損害賠償",
  "content": "臺灣高等法院民事判決                    97年度智上字第15號\n上訴人即附\n帶被上訴人    熱品工業股份有限公司\n兼法定代理人  乙○○\n共      同\n訴訟代理人    周嬿容律師\n被上訴人即\n附帶上訴人    欣友興業有限公司\n兼法定代理人  甲○○\n共      同\n訴訟代理人    吳尚昆律師\n              李怡卿律師\n              洪榮彬律師\n上列當事人間請求損害賠償事件，上訴人對於中華民國97年1月1\n8日臺灣板橋地方法院中華民國94年度智(一)字第43號第一審判決\n提起上訴，被上訴人並為附帶上訴，本院於98年12月22日言詞辯\n論終結，判決如下：\n          主  文\n原判決關於(一)駁回上訴人熱品工業股份有限公司後開第二項之訴\n部分，及該部分假執行之聲請。(二)命被上訴人連帶給付上訴人乙\n○○新台幣佰萬元本息部分，及該部分假執行之宣告。(三)暨各\n該部分訴訟費用之裁判，均廢棄。\n被上訴人應連帶給付上訴人熱品工業股份有限公司新台幣佰萬\n元，及自民國九十四年十二月一日起至清償日止，按週年利率百\n分之五計算之利息。\n上訴人乙○○之上訴駁回。\n關於廢棄改判部分第一、二審訴訟費用由被上訴人連帶負擔四分\n之三，餘由上訴人乙○○負擔。附帶上訴訴訟費用由上訴人乙○\n○負擔。\n本判決所命給付，上訴人熱品工業股份有限公司提供新台幣壹佰\n萬元後得假執行，但被上訴人如以新台幣佰萬元為上訴人熱品\n工業股份有限公司預供擔保，得免為假執行。\n    事實及理由\n一、上訴人主張：上訴人乙○○（以下簡稱乙○○）擁有中華民\n    國新型第194763號名稱「微動型水力發電機」專利權（以下\n    簡稱系爭專利），專利期間自民國90年9月24日至102年2月\n    26日止。乙○○並專屬授權予上訴人熱品工業股份有限公司\n    （以下簡稱熱品公司）實施系爭專利。詎被上訴人欣友興業\n    有限公司（以下簡稱欣友公司）為圖不法利益，竟大量仿製\n    銷售「瓦斯熱水器水力發電裝置」(以下簡稱系爭裝置)，經\n    上訴人發現原審共同被告麒毓公司及莊頭北工業股份有限公\n    司（原審判決上訴人此部分敗訴，上訴人聲明不服提起上訴\n    後撤回起訴）分別販售欣友公司生產之系爭裝置，並公然於\n    網站上刊登廣告行銷。經上訴人將系爭裝置送中國生產力中\n    心（以下簡稱生產力中心）鑑定，認欣友公司製造之系爭裝\n    置落入系爭專利申請之專利範圍。則熱品公司基於專屬被授\n    權人地位，取得專利法第84條第1項所定之損害賠償請求權\n    而有訴訟實施權。爰依專利法第108條準用第84條第1項、第\n    2項之規定請求欣友公司負賠償責任。而被上訴人甲○○(以\n    下簡稱甲○○)為欣友公司之代表人，欣友公司侵害上訴人\n    專利權，甲○○自應依民法第28條(應為公司法第23條規定)\n    負連帶賠償責任。起訴聲明：(一)被上訴人應連帶賠償熱品公\n    司新台幣（下同）300萬元，及自起訴狀繕本送達翌日起至\n    清償日止，按週年利率百分之五計算之利息；(二)被上訴人應\n    連帶賠償乙○○信譽損害100萬元，自起訴狀繕本送達翌日\n    起至清償日止，按週年利率百分之五計算之利息。(三)願供擔\n    保請准宣告假執行。原審判命：被上訴人應連帶給付乙○○\n    300萬元，及自94年12月1日起至清償日止，按週年利率百分\n    之五計算之利息(原審此部分為訴外裁判，見本院卷(二)第57\n    頁反面、第58頁)。並為准、免假執行之宣告，及駁回上訴\n    人其餘之訴(上訴人於原審另請求禁止欣友公司製造、銷售\n    及委託製造，與起訴狀原證二鑑定報告中之待鑑定物相同之\n    發電機，或與本件專利權範圍相同之產品，及禁止被上訴人\n    欣友公司印製、委託印製、散布任何就前開侵害本件系爭專\n    利之產品之產品簡介、廣告手冊或其他文件；欣友公司應交\n    付上訴人從事侵害系爭專利行為之模具供為上訴人銷燬；被\n    上訴人應共同於中國時報及經濟日報（星期一至星期五）第\n    一版連續3天以如附件1之版面，刊登道歉啟事等，均經原審\n    判決後，於本院撤回起訴）。上訴人就就其敗訴部分聲明不\n    服提起上訴；被上訴人就其敗訴部分提起附帶上訴。上訴聲\n    明：(一)原判決關於駁回上訴人後開第二、三項之訴部分廢棄\n    。(二)上開廢棄部分，被上訴人應連帶賠償乙○○業務上信譽\n    損害100萬元，及自94年12月1日起至清償日止，按週年利率\n    百分之五計算之利息。(三)被上訴人應連帶賠償熱品公司300\n    萬元，及自94年12月1日起至清償日止按週年利率百分之五\n    計算之利息。(四)願供擔保請准宣告假執行。就被上訴人附帶\n    上訴，聲明：附帶上訴駁回。\n二、被上訴人則以：上訴人提出生產力中心製作之專利鑑定報告\n    ，未經查證即稱待鑑物品係被上訴人公司之產品，且未對待\n    鑑定物品所有元件為分析，鑑定結果不足採信。另被上訴人\n    亦將系爭裝置送請中國機械工程學會（以下簡稱工程學會）\n    鑑定，認待鑑物與系爭專利申請範圍不相同。至原審函請工\n    研院鑑定認待鑑定物品與系爭專利案之申請專利範圍實質相\n    同。然系爭裝置係被上訴人公司依新型專利證書第M259073\n    號「瓦斯熱水器水力發電裝置」所製造，而依經濟部智慧財\n    產局（以下簡稱智慧局）94年12月30日智專二(三)02033字\n    第0944232330號新型專利技術報告，所引用第1份文獻即為\n    系爭專利，經比對結果為「無法發現足以否定其新穎性等要\n    件之先前技術文獻等」，顯見系爭裝置與系爭專利無關，被\n    上訴人並無侵害上訴人專利權之故意或過失。又上訴人生產\n    之微動型水力發電機，均未在其主張之專利物品上或其包裝\n    上標示專利證書號數，自不得請求損害賠償。再者，本件專\n    利權人並非熱品公司，而乙○○並非法人，並無製造相關產\n    品，自無任何業務上信譽或損害。至欣友公司自92年至95年\n    整體營業並無獲利，上訴人未能就專利法第85條第1項第2款\n    要件具體舉證，亦未扣除成本及必要費用，徒以被上訴人向\n    國稅局申報所有營業稅資料，主張被上訴人侵害其專利權所\n    獲利益總額為5,910,739元，顯無理由等語，資為抗辯。答\n    辯聲明：上訴駁回。附帶上訴聲明：(一)原判決關於命被上訴\n    人連帶給付乙○○300萬元本息部分廢棄。(二)上廢棄部分，\n    被上訴人在第一審之訴及假執行聲請均駁回。就上訴人之上\n    訴，答辯聲明：上訴駁回。\n三、上訴人主張乙○○擁有系爭專利權，專利期間自90年9月24\n    日至102年2月26日止，乙○○並專屬授權予熱品公司實施系\n    爭專利，詎欣友公司為圖不法利益，竟大量仿製銷售侵害系\n    爭專利之系爭裝置等語。惟為被上訴人所否認，並以前詞置\n    辯。查：\n  (一)系爭裝置是否落入系爭專利範圍？\n  1.按鑑定為一種調查證據方法，所得結果係供作法院依自由心\n    證判斷事實真偽之證據資料。當事人就其可處分之事項，對\n    於鑑定人之人選、鑑定結果及於事實認定之效力，本得於起\n    訴前以證據契約之形式為約定、於證據保全程序中依民事訴\n    訟法第376條之1第1項規定成立協議，或於訴訟進行中依同\n    法第326條第2項前段、第270條之1第1項第3款規定達成指定\n    合意或爭點簡化協議。倘無此證據契約、指定合意或爭點簡\n    化協議，法院即不受鑑定結果之拘束，仍應踐行調查證據之\n    程序而後定其取捨。\n  2.本件原審依兩造於95年2月14日、95年3月28日言詞辯論之協\n    議委請工研院鑑定（見原審卷第221頁、第223頁至第224頁\n    ），兩造合意所選定之鑑定機關，其鑑定結果縱不能作為法\n    院事實認定之唯一基礎，然既經兩造及法院為使訴訟有利於\n    終結，而於訴訟程序中所擇定之鑑定機關，仍應認其就專業\n    所為之鑑定，對於兩造具有一定之拘束力，除有顯失公平或\n    類似之情形外（民事訴訟法第270條之1第3項），不得徒以\n    結果不利某一造，而任意指摘其鑑定結果為不可採，方符訴\n    訟上誠信原則。基此，兩造合意選定之鑑定機關工研院依原\n    法院檢附之「水力發電機」實物樣品（「待鑑定物」實物（\n    \" 編號1物品\"1個，\"編號2物品\"2個)及專利證書新型第1947\n    63號「微動型水力發電機」專利案之專利說明書與專利申請\n    範圍進行分析。並依智慧局制定之「專利侵害鑑定要點進行\n    鑑定」所為之鑑定結果，認：待鑑定物與系爭專利之申請專\n    利範圍獨立項相較，應不符合「文意讀取」。惟待鑑定物與\n    系爭專利兩者之技術手術、技術特徵、技術手段所達成之功\n    效應為實質相同；並依均等論分析比較，待鑑定物與系爭專\n    利符合均等論之成立要件，待鑑定物與系爭專利之申請專利\n    範圍應為實質相同，亦即待鑑定物與專利證書新型第194763\n    號「微動型水力發電機」專利案之申請專利範圍應為實質相\n    同，有工研院95年9月20日工研轉字第13197號函附鑑定報\n    告在卷可憑(見原審卷第222頁至第274頁)。嗣本院再送請補\n    充鑑定結果，亦認本件應未具有符合「禁反言」及「先前技\n    術阻卻」成立之要件；亦即應不適用禁反言或先前技術阻鑑\n    ；因此，「待鑑定物」應已落入系爭專利（均等）範圍，有\n    工研究院97年12月4日工研轉字第0970015128號函送補充鑑\n    定報告在卷可證（見本院卷(一)第339頁至第343頁）。是欣友\n    公司製造生產之系爭裝置確有侵害系爭專利之情事。\n  3.另智慧局於93年10月5日以經授智字第09320031110號函送，\n    經司法院已於93年11月2日以秘台廳民一字第0930024793號\n    函送各法官供鑑定時參考之「專利侵害鑑定要點」下篇第壹\n    部分「發明（或新型）專利侵害之鑑定原則」第2章第1節「\n    鑑定流程概述」:就專利侵害之鑑定流程曾提出下列參考準\n    據：專利侵害之鑑定流程分為兩階段：I解釋申請專利範\n    圍；及II比對解釋後之申請專利範圍與待鑑定對象（物或方\n    法）。比對解釋後之申請專利範圍與待鑑定對象包括下列\n    步驟：I解析申請專利範圍之技術特徵II解析待鑑定對象之\n    技術內容III基於全要件原則（all-elementsrule/all-limi\n    tations rule），判斷待鑑定對象是否符合「文義讀取」。\n    若待鑑定對象符合「文義讀取」，且被上訴人主張適用「逆\n    均等論」（reverse doctrine ofequivalents），應再比對\n    待鑑定對象是否適用「逆均等論」；若待鑑定對象不適用「\n    逆均等論」，則應判斷待鑑定對象落入專利權（文義）範圍\n    。觀諸本件工研院鑑定報告之方式，與前開「專利侵害鑑定\n    要點」所揭示「發明（或新型）專利侵害之鑑定原則」相符\n    ，是該鑑定報告所採鑑定流程自無何不當之處。則本院認工\n    研院所為鑑定既未悖離「專利侵害鑑定要點」所揭示之鑑定\n    原則，且該鑑定單位亦係經兩造合意選定之鑑定機關，其所\n    為之鑑定結果自可採用。\n  4.綜上，被上訴人欣友公司生產系爭裝置，經兩造合意選定之\n    鑑定機關所為之鑑定結果，認與系爭專利之專利權範圍相同\n    ，欣友公司確有侵害上訴人系爭新型第194763號專利權，應\n    堪認定。\n  5.被上訴人雖抗辯稱其亦將系爭裝置送請工程學會鑑定結果，\n    認並無侵害系爭專利情事云云。惟被上訴人送請工程學會鑑\n    定之樣品是否確為系爭裝置，未經上訴人是認，縱經鑑定結\n    果認無侵害系爭專利，亦未能認定系爭裝置無侵害系爭專利\n    之情事。上訴人據以抗辯系爭裝置並無侵害專利之情事，要\n    屬無據。\n  (二)被上訴人就侵害系爭專利是否有故意或過失?\n  1.專利權係採登記及公告制度，處於任何人均可得知之狀態。\n    故該發明或創作所屬技術或技藝領域中，具有通常知識者，\n    自不得諉稱不知專利權之存在，據以抗辯其無失。再者，智\n    慧財產權已成為現代企業經營所應面臨之風險下，事業於從\n    事生產、製造與銷售之際，較以往而言，應負有更高之風險\n    意識與注意義務，避免侵害他人之智慧財產權。因此，對於\n    具有一般風險識之事業而言，其從事生產、銷售行為之際，\n    自應就其所實施之技術作最低限度的專利權查證，倘未查證\n    者，即有過失。本件欣友公司所營事業包括消防安全設備批\n    發業、國際貿易業、五金批發業、廚房器具批發業，瓦斯器\n    材及其零件製造業等，有公司基本資料查詢表在卷可憑（見\n    本院卷(二)第142頁)。是以欣友公司具有製造瓦斯器材、零件\n    之專業知識，而系爭專利為一種微動型水力發電機，係由一\n    水流通件結合一發電機組所構成；該水流為內部設有容室、\n    而外部設有雙向開口及進出水管的殼體，該容室可供容置鬆\n    配有磁環之葉片軸，該殼體一開口（容室端口）再設有膜片\n    及彈簧後與一設有出水管之蓋體對接，而殼之另側開口則結\n    一另設有磁鐵之發電機組；藉水流帶動葉片軸以令二磁鐵間\n    藉磁性力互吸作而達自動平衡定位，且形成磁激式發電，以\n    無軸心傳動而減少傳動損失，又發電機組可更換故可得不同\n    之供電量者，有90年9月21日新型專利公報在卷可憑(見原審\n    卷第217頁至第220頁)。是以欣友公司製造系爭裝置即瓦斯\n    熱水器水力發電裝置時，理應應就其所實施之技術作最低限\n    度的專利權查證、或於網路上檢索相同專利或物品之資訊，\n    即得輕易發現其所製造經銷之系爭裝置已屬乙○○申請專利\n    之範圍。詎欣友公司未善盡查證義務，遽以製造、銷售系爭\n    裝置，欣友公司就生產、銷售系爭裝置有侵害系爭專利之過\n    失至明。\n  2.被上訴人抗辯欣友公司生產之系爭裝置與第M259073號專利\n    範圍相符，因此，被上訴人無侵害系爭專利之故意或過失云\n    云，固聲請本院函請工研院鑑定。惟該送請鑑定之樣品，上\n    訴人否認為系爭裝置，是以鑑定結果雖認該待鑑定物落入第\n    M259073號獨立項申請專利權（文義）範圍，待鑑定物與第M\n    259073號專利申請範圍相符，有工研院98年05月26日工研轉\n    字第0980006427號函附鑑定報告在卷可參（見本院卷(二)第55\n    頁、證物外放），亦不得據為欣友公司無過失侵害系爭專利\n    之依據。\n  3.另被上訴人抗辯稱第M259073號專利權說明書中已引用乙○\n    ○所有之第104763號專利權申請專利說明書，並向智慧局申\n    請新型專利技術報告，已經該局核發94年12月30日(94)智專\n    二（三）02033字第0944232330號新型專利技術報告在案（\n    見原審卷第181頁至第197頁）。是以系爭裝置援用第M25907\n    3號專利，並無過失云云。惟按新型專利採形式審查，由於\n    未對是否合於專利要件進行實體審查，導致新型專利權的權\n    利內容存在著相當的不安定性及不確定性。而技術報告在功\n    能上具有公眾審查之性質，以釐清該新型專利是否合於專利\n    要件之疑義，惟該新型專利技術報告之性質，係屬機關無拘\n    束力之報告，並非行政處分，僅作為權利行使或技術利用之\n    參酌。若任何人認該新型專利有不應核准專利之事由，應依\n    專利法107條規定提起舉發撤銷該新型專利權。本件訴外人\n    黃彩固申請M259073號專利說明書，該專利說明書已經熱品\n    公司舉發，雖經智慧局審定為「舉發不成立」，惟嗣經熱品\n    公司提起訴願，已經經濟部撤銷原處分，黃彩不服提起行政\n    訴訟，復經智慧財產法院確認第M259073號專利權不具進步\n    性而不存在，而以97年行專訴字第00001號判決駁回黃彩之\n    訴，黃彩未聲明不服而告確定在案，有該判決在卷可證（見\n    本院卷(二)第33頁至第46頁)。核該判決記載M259073號專利之\n    兩組磁錠與保持環組合之技術特徵，乃熟悉發電裝置技術領\n    域者組合系爭專利與90年11月11日、90年2月22日公告之000\n    00000、00000000號專利可輕易完成者，足見倘系爭裝置係\n    依M259073號專利製造，則M259073號專利權既係組合系爭專\n    利而成之裝置，已如前述，則欣友公司理應知悉M259073號\n    專利有利用系爭專利甚明。詎欣友公司仍援引M259073號專\n    利，據以製造系爭裝置，自有過失，被上訴人抗辯其援用M2\n    59073號專利製造系爭裝置而無過失云云，殊屬無據。\n  (三)乙○○得否請求被上訴人賠償？\n  1.乙○○主張其將所有系爭專利權專屬授權予熱品公司，業經\n    聲請訊問當事人乙○○為證（見本院卷(二)第94頁正、反面)\n    ，且有授權書在卷可憑(見本院卷第66頁)。被上訴人雖抗辯\n    稱該證據為不得於第二審所提出新攻擊防禦方法云云。惟上\n    訴人於原審即起訴主張系爭專利為乙○○所有，且專屬授權\n    予熱品公司（見原審卷第5頁至第6頁)，是以上訴人提出前\n    揭新證據方法，僅是就其所於原審主張之事實，提出新攻擊\n    方法為補充，揆諸民事訴訟法第447條第1項第3款規定，應\n    予准許。\n  2.按除前項規定外，發明專利權人之業務上信譽，因侵害而致\n    減損時，得另請求賠償相當金額，此規定於新型專利準用之\n    ，專利法第85條第2項、第108條定有明文。本件乙○○主張\n    被上訴人侵害其所有系爭專利，其因而受有信譽損害云云，\n    惟專利權人業務上信譽之減損，其性質屬於非財產之損害，\n    固亦得請求損害賠償。但乙○○僅為熱品公司法定代理人，\n    執行熱品公司業務，是上訴人侵害系爭專利，乙○○究有何\n    致其「業務上信譽減損」之情事，未能舉證以明其實，是以\n    乙○○據以請求被上訴人連帶賠償100萬元本息，要無所據\n    ，不應准許。\n  (四)熱品公司得否請求被上訴人連帶賠償？其金額為何？\n  1.按發明專利權受侵害時，專利權人得請求賠償損害，並得請\n    求排除其侵害，有侵害之虞者，得請求防止之。專屬被授權\n    人亦得為前項請求。但契約另有約定者，從其約定。此規定\n    於新型專利準用之，專利法第84條第1項、第2項、第108條\n    定有明文。本件乙○○將系爭專利專屬授權予熱品公司，已\n    如前述，是以熱品公司自得向侵權行為人請求損害賠償（98\n    年智慧財產法院法律座談會第15號研討意見)。復按「公司\n    負責人對於公司業務之執行，如有違反法令致他人受有損害\n    時，對他人應與公司負連帶賠償之責」，公司法第23條第2\n    項規定甚明。而甲○○係欣友公司之負責人，有欣友公司變\n    更登記表附卷可稽(見本院卷(二)第142頁)，欣友公司產品之\n    製造及銷售事項，均屬公司負責人執行業務之範圍，是欣友\n    公司生產銷售侵害系爭專利之產品，自屬其負責執行公司之\n    業務而侵害專利權人權利之行為，則熱品公司請求甲○○與\n    欣友公司應對熱品公司之損害負連帶賠償責任，洵屬有據。\n  2.又發明專利權人以其發明專利權讓與、信託、授權他人實施\n    或設定質權，非經向專利專責機關登記，不得對抗第三人。\n    此規定於新型專利準用之，專利法第59條、第108條定有明\n    文。被上訴人雖抗辯稱乙○○就專屬授權未向智慧局辦理登\n    記，依前揭規定不得請求損害賠償云云。惟核閱前揭規定僅\n    係專利權讓與未經向智慧局登記，不得對抗第三人，核非不\n    得請求損害賠償之規定。被上訴人據為熱品公司不得請求損\n    害賠償之規定云云，不足為採。\n  3.另發明專利權人應在專利物品或其包裝上標示專利證書號數\n    ，並得要求被授權人或特許實施權人為之；其未附加標示者\n    ，不得請求損害賠償。但侵權人明知或有事實足證其可得而\n    知為專利物品者，不在此限。此規定於新型專利準用之，專\n    利法第79條、第108條定有明文。被上訴人抗辯稱上訴人未\n    在其產品上標示系爭專利證書號數，不得請求損害賠償云云\n    。惟熱品公司已提出用以標示專利證書字號之標籤與照片為\n    證（見原審卷第516頁至第517頁），被上訴人抗辯熱品公司\n    未於產品標示系爭專利證書號數，並不得請求損害賠償云云\n    ，不足為採。況倘被上訴人抗辯欣友公司產品係依黃彩聲請\n    M259073號專利權實施製造，則M259073號專利權技術報告中\n    已援引系爭專利，已如前述，則被上訴人依理可得而知系爭\n    專利權存在，揆諸前揭但書規定，熱品公司縱未將系爭專利\n    證書號書標示於產品上，亦得請求被上訴人負損害賠償之責\n    ，被上訴人抗辯熱品公司不得請求損害賠償云云，不足為採\n    。\n  (五)熱品公司請求被上訴人連帶賠償之金額為何？\n  1.按發明專利權受侵害時，專利權人得請求賠償損害，依前條\n    請求損害賠償時，得就下列各款擇一計算其損害：「1、依\n    民法第216條之規定。但不能提供證據方法以證明其損害時\n    ，發明專利權人得就其實施專利權通常所可獲得之利益，減\n    除受害後實施同一專利權所得之利益，以其差額為所受損害\n    。2、依侵害人因侵害行為所得之利益。於侵害人不能就其\n    成本或必要費用舉證時，以銷售該項物品全部收入為所得利\n    益」，此規定於新型專利準用之，專利法第85條第1項、第1\n    08條定有明文。\n  2.原審向財政部臺灣省北區國稅局新莊稽徵所調閱之被上訴人\n    欣友公司92年至95年「營業人銷售額與稅額申報書」，有財\n    政部臺灣省北區國稅局新莊稽徵所96年9月6日北區國稅新莊\n    三字第0961022840號函可憑（見原審卷第406之1頁至第426\n    頁），依該申報書記載欣友公司銷售額、進項及費用詳如附\n    表示，熱品公司請求就欣友公司於92年11月、12月、93年5\n    月至6月、94年5至12月、95年1月、2月、5至8月、11至12月\n    部分銷售額33,883,670元，扣除總進項成本27,972,931元，\n    而主張被上訴人欣友公司、甲○○侵害系爭專利獲利總額為\n    5,910,739元，詳如附表所示，並僅請求其中3,000,000元，\n    認為欣友公司因侵害系爭專利所得之利益，及自起訴狀繕本\n    送達翌日即94年12月1日起至清償日止，按週年利率百分之\n    五計算之法定利息，為有理由，應予准許。\n  3.被上訴人抗辯稱熱品公司僅就欣友公司獲利之月份為請求，\n    就未獲利之月份，熱品公司均未扣除，其據以計算欣友公司\n    之獲利云云，不足採信云云。惟當事人因妨礙他造使用，故\n    意將證據滅失、隱匿或致礙難使用者，法院得審酌情形認他\n    造關於該證據之主張或依該證據應證之事實為真實，民事訴\n    訟法第282條之1定有明文。本件熱品公司就欣友公司侵害系\n    爭專利之獲利，已為前揭之舉證，應盡舉證之責。而被上訴\n    人對其主張如抗辯不實並提出反對之主張者，則被上訴人對\n    其反對之主張，亦應負證明之責，此為舉證責任分擔之原則\n    。而本件欣友公司抗辯其獲利未如熱品公司所主張之金額，\n    但就其製造、銷售系爭裝置侵害熱品公司系爭專利之獲利為\n    何，於原審已遲未能就其成本或必要費用為舉證，且詳原本\n    記載屢經本院請被上訴人提出該公司之營業內容、銷售事項\n    、銷售金額之資料（見本院卷(二)第93頁反面)，被上訴人復\n    均未提出，甚且陳明無法提出該資料（見本院卷(二)第109頁)\n    ，揆諸前揭說明，應認熱品公司主張欣友公司前揭銷售有獲\n    利之月份，為侵害系爭專利所得之利益，其餘月份縱有虧損\n    ，亦非應扣除銷售系爭裝置之虧損，應可採信。被上訴人抗\n    辯欣友公司獲利未有300萬元云云，為無理由，不足採信。\n四、綜上所述，熱品公司主張欣友公司生產銷售系爭裝置落入系\n    爭專利範圍，熱品公司依專利法第84條第1項、第2項、第10\n    8條及公司法第23條第2項規定，請求被上訴人連帶賠償上訴\n    人熱品公司300萬元，及自起訴狀繕本送達翌日即94年12月1\n    日起至清償日止，按週年利率百分之五計算之法定遲延利息\n    ，為有理由，應予准許；乙○○請求被上訴人連帶賠償100\n    萬元本息，則屬無據，應予駁回。兩造分別陳明願供擔保准\n    、免假執行宣告，就前開應准許部分，於法並無不合，爰分\n    別酌定相當擔保准許之。至於乙○○敗訴部分，其假執行之\n    聲請失所附麗，應併駁回。原審駁回熱品公司上開應准許部\n    分，另訴外裁判判准被上訴人應連帶給付乙○○300萬元本\n    息，均有未洽，熱品公司上訴、被上訴人附帶上訴，指摘原\n    判決不當，請求廢棄改判，為有理由，爰由本院予以廢棄，\n    其中熱品公司請求部分並改判如主文第二項所示，並依聲請\n    為附條件之准、免假執行宣告。至原審駁回乙○○請求被上\n    訴人連帶給付100萬元本息及假執行之聲請，並無不合。乙\n    ○○上訴意旨指摘原判決此部分不當，求予廢棄改判，為無\n    理由，應予駁回。\n五、本件事證已明，兩造其餘攻擊防禦方法及未經援用之證據，\n    經本院審酌後，核與本件之結論，不生影響，爰不一一贅述\n    ，附此敘明。\n六、據上論結，本件熱品公司上訴、被上訴人附帶上訴，均為有\n    理由，乙○○上訴無理由，依民事訴訟法第450條、第449條\n    第1項、第79條、第85條第2項、第390第2項、第392條第2項\n    、第463條，判決如主文。\n中    華    民    國    99    年     1    月     5    日\n                    民事第八庭\n                        審判長法  官  劉勝吉\n                              法  官  鄭威莉\n                              法  官  蘇芹英\n正本係照原本作成。\n如不服本判決，應於收受送達後20日內向本院提出上訴書狀，其\n未表明上訴理由者，應於提出上訴後20日內向本院補提理由書狀\n（均須按他造當事人之人數附繕本）上訴時應提出委任律師或具\n有律師資格之人之委任狀；委任有律師資格者，另應附具律師資\n格證書及釋明委任人與受任人有民事訴訟法第466條之1第1項但\n書或第2項（詳附註）所定關係之釋明文書影本。\n中    華    民    國    99    年     1    月     5    日\n                              書記官  林初枝\n附註：\n民事訴訟法第466條之1（第1項、第2項）：\n對於第二審判決上訴，上訴人應委任律師為訴訟代理人。但上訴\n人或其他法定代理人具有律師資格者，不在此限。\n上訴人之配偶、三親等內之血親、二親等內之姻親，或上訴人為\n法人、中央或地方機關時，其所屬專任人員具有律師資格並經法\n院認為適當者，亦得為第三審訴訟代理人。",
  "structure": {
    "main": "原判決關於(一)駁回上訴人熱品工業股份有限公司後開第二項之訴\n部分，及該部分假執行之聲請。(二)命被上訴人連帶給付上訴人乙\n○○新台幣佰萬元本息部分，及該部分假執行之宣告。(三)暨各\n該部分訴訟費用之裁判，均廢棄。\n被上訴人應連帶給付上訴人熱品工業股份有限公司新台幣佰萬\n元，及自民國九十四年十二月一日起至清償日止，按週年利率百\n分之五計算之利息。\n上訴人乙○○之上訴駁回。\n關於廢棄改判部分第一、二審訴訟費用由被上訴人連帶負擔四分\n之三，餘由上訴人乙○○負擔。附帶上訴訴訟費用由上訴人乙○\n○負擔。\n本判決所命給付，上訴人熱品工業股份有限公司提供新台幣壹佰\n萬元後得假執行，但被上訴人如以新台幣佰萬元為上訴人熱品\n工業股份有限公司預供擔保，得免為假執行。",
    "fact": "一、上訴人主張：上訴人乙○○（以下簡稱乙○○）擁有中華民\n    國新型第194763號名稱「微動型水力發電機」專利權（以下\n    簡稱系爭專利），專利期間自民國90年9月24日至102年2月\n    26日止。乙○○並專屬授權予上訴人熱品工業股份有限公司\n    （以下簡稱熱品公司）實施系爭專利。詎被上訴人欣友興業\n    有限公司（以下簡稱欣友公司）為圖不法利益，竟大量仿製\n    銷售「瓦斯熱水器水力發電裝置」(以下簡稱系爭裝置)，經\n    上訴人發現原審共同被告麒毓公司及莊頭北工業股份有限公\n    司（原審判決上訴人此部分敗訴，上訴人聲明不服提起上訴\n    後撤回起訴）分別販售欣友公司生產之系爭裝置，並公然於\n    網站上刊登廣告行銷。經上訴人將系爭裝置送中國生產力中\n    心（以下簡稱生產力中心）鑑定，認欣友公司製造之系爭裝\n    置落入系爭專利申請之專利範圍。則熱品公司基於專屬被授\n    權人地位，取得專利法第84條第1項所定之損害賠償請求權\n    而有訴訟實施權。爰依專利法第108條準用第84條第1項、第\n    2項之規定請求欣友公司負賠償責任。而被上訴人甲○○(以\n    下簡稱甲○○)為欣友公司之代表人，欣友公司侵害上訴人\n    專利權，甲○○自應依民法第28條(應為公司法第23條規定)\n    負連帶賠償責任。起訴聲明：(一)被上訴人應連帶賠償熱品公\n    司新台幣（下同）300萬元，及自起訴狀繕本送達翌日起至\n    清償日止，按週年利率百分之五計算之利息；(二)被上訴人應\n    連帶賠償乙○○信譽損害100萬元，自起訴狀繕本送達翌日\n    起至清償日止，按週年利率百分之五計算之利息。(三)願供擔\n    保請准宣告假執行。原審判命：被上訴人應連帶給付乙○○\n    300萬元，及自94年12月1日起至清償日止，按週年利率百分\n    之五計算之利息(原審此部分為訴外裁判，見本院卷(二)第57\n    頁反面、第58頁)。並為准、免假執行之宣告，及駁回上訴\n    人其餘之訴(上訴人於原審另請求禁止欣友公司製造、銷售\n    及委託製造，與起訴狀原證二鑑定報告中之待鑑定物相同之\n    發電機，或與本件專利權範圍相同之產品，及禁止被上訴人\n    欣友公司印製、委託印製、散布任何就前開侵害本件系爭專\n    利之產品之產品簡介、廣告手冊或其他文件；欣友公司應交\n    付上訴人從事侵害系爭專利行為之模具供為上訴人銷燬；被\n    上訴人應共同於中國時報及經濟日報（星期一至星期五）第\n    一版連續3天以如附件1之版面，刊登道歉啟事等，均經原審\n    判決後，於本院撤回起訴）。上訴人就就其敗訴部分聲明不\n    服提起上訴；被上訴人就其敗訴部分提起附帶上訴。上訴聲\n    明：(一)原判決關於駁回上訴人後開第二、三項之訴部分廢棄\n    。(二)上開廢棄部分，被上訴人應連帶賠償乙○○業務上信譽\n    損害100萬元，及自94年12月1日起至清償日止，按週年利率\n    百分之五計算之利息。(三)被上訴人應連帶賠償熱品公司300\n    萬元，及自94年12月1日起至清償日止按週年利率百分之五\n    計算之利息。(四)願供擔保請准宣告假執行。就被上訴人附帶\n    上訴，聲明：附帶上訴駁回。\n二、被上訴人則以：上訴人提出生產力中心製作之專利鑑定報告\n    ，未經查證即稱待鑑物品係被上訴人公司之產品，且未對待\n    鑑定物品所有元件為分析，鑑定結果不足採信。另被上訴人\n    亦將系爭裝置送請中國機械工程學會（以下簡稱工程學會）\n    鑑定，認待鑑物與系爭專利申請範圍不相同。至原審函請工\n    研院鑑定認待鑑定物品與系爭專利案之申請專利範圍實質相\n    同。然系爭裝置係被上訴人公司依新型專利證書第M259073\n    號「瓦斯熱水器水力發電裝置」所製造，而依經濟部智慧財\n    產局（以下簡稱智慧局）94年12月30日智專二(三)02033字\n    第0944232330號新型專利技術報告，所引用第1份文獻即為\n    系爭專利，經比對結果為「無法發現足以否定其新穎性等要\n    件之先前技術文獻等」，顯見系爭裝置與系爭專利無關，被\n    上訴人並無侵害上訴人專利權之故意或過失。又上訴人生產\n    之微動型水力發電機，均未在其主張之專利物品上或其包裝\n    上標示專利證書號數，自不得請求損害賠償。再者，本件專\n    利權人並非熱品公司，而乙○○並非法人，並無製造相關產\n    品，自無任何業務上信譽或損害。至欣友公司自92年至95年\n    整體營業並無獲利，上訴人未能就專利法第85條第1項第2款\n    要件具體舉證，亦未扣除成本及必要費用，徒以被上訴人向\n    國稅局申報所有營業稅資料，主張被上訴人侵害其專利權所\n    獲利益總額為5,910,739元，顯無理由等語，資為抗辯。答\n    辯聲明：上訴駁回。附帶上訴聲明：(一)原判決關於命被上訴\n    人連帶給付乙○○300萬元本息部分廢棄。(二)上廢棄部分，\n    被上訴人在第一審之訴及假執行聲請均駁回。就上訴人之上\n    訴，答辯聲明：上訴駁回。\n三、上訴人主張乙○○擁有系爭專利權，專利期間自90年9月24\n    日至102年2月26日止，乙○○並專屬授權予熱品公司實施系\n    爭專利，詎欣友公司為圖不法利益，竟大量仿製銷售侵害系\n    爭專利之系爭裝置等語。惟為被上訴人所否認，並以前詞置\n    辯。查：\n  (一)系爭裝置是否落入系爭專利範圍？\n  1.按鑑定為一種調查證據方法，所得結果係供作法院依自由心\n    證判斷事實真偽之證據資料。當事人就其可處分之事項，對\n    於鑑定人之人選、鑑定結果及於事實認定之效力，本得於起\n    訴前以證據契約之形式為約定、於證據保全程序中依民事訴\n    訟法第376條之1第1項規定成立協議，或於訴訟進行中依同\n    法第326條第2項前段、第270條之1第1項第3款規定達成指定\n    合意或爭點簡化協議。倘無此證據契約、指定合意或爭點簡\n    化協議，法院即不受鑑定結果之拘束，仍應踐行調查證據之\n    程序而後定其取捨。\n  2.本件原審依兩造於95年2月14日、95年3月28日言詞辯論之協\n    議委請工研院鑑定（見原審卷第221頁、第223頁至第224頁\n    ），兩造合意所選定之鑑定機關，其鑑定結果縱不能作為法\n    院事實認定之唯一基礎，然既經兩造及法院為使訴訟有利於\n    終結，而於訴訟程序中所擇定之鑑定機關，仍應認其就專業\n    所為之鑑定，對於兩造具有一定之拘束力，除有顯失公平或\n    類似之情形外（民事訴訟法第270條之1第3項），不得徒以\n    結果不利某一造，而任意指摘其鑑定結果為不可採，方符訴\n    訟上誠信原則。基此，兩造合意選定之鑑定機關工研院依原\n    法院檢附之「水力發電機」實物樣品（「待鑑定物」實物（\n    \" 編號1物品\"1個，\"編號2物品\"2個)及專利證書新型第1947\n    63號「微動型水力發電機」專利案之專利說明書與專利申請\n    範圍進行分析。並依智慧局制定之「專利侵害鑑定要點進行\n    鑑定」所為之鑑定結果，認：待鑑定物與系爭專利之申請專\n    利範圍獨立項相較，應不符合「文意讀取」。惟待鑑定物與\n    系爭專利兩者之技術手術、技術特徵、技術手段所達成之功\n    效應為實質相同；並依均等論分析比較，待鑑定物與系爭專\n    利符合均等論之成立要件，待鑑定物與系爭專利之申請專利\n    範圍應為實質相同，亦即待鑑定物與專利證書新型第194763\n    號「微動型水力發電機」專利案之申請專利範圍應為實質相\n    同，有工研院95年9月20日工研轉字第13197號函附鑑定報\n    告在卷可憑(見原審卷第222頁至第274頁)。嗣本院再送請補\n    充鑑定結果，亦認本件應未具有符合「禁反言」及「先前技\n    術阻卻」成立之要件；亦即應不適用禁反言或先前技術阻鑑\n    ；因此，「待鑑定物」應已落入系爭專利（均等）範圍，有\n    工研究院97年12月4日工研轉字第0970015128號函送補充鑑\n    定報告在卷可證（見本院卷(一)第339頁至第343頁）。是欣友\n    公司製造生產之系爭裝置確有侵害系爭專利之情事。\n  3.另智慧局於93年10月5日以經授智字第09320031110號函送，\n    經司法院已於93年11月2日以秘台廳民一字第0930024793號\n    函送各法官供鑑定時參考之「專利侵害鑑定要點」下篇第壹\n    部分「發明（或新型）專利侵害之鑑定原則」第2章第1節「\n    鑑定流程概述」:就專利侵害之鑑定流程曾提出下列參考準\n    據：專利侵害之鑑定流程分為兩階段：I解釋申請專利範\n    圍；及II比對解釋後之申請專利範圍與待鑑定對象（物或方\n    法）。比對解釋後之申請專利範圍與待鑑定對象包括下列\n    步驟：I解析申請專利範圍之技術特徵II解析待鑑定對象之\n    技術內容III基於全要件原則（all-elementsrule/all-limi\n    tations rule），判斷待鑑定對象是否符合「文義讀取」。\n    若待鑑定對象符合「文義讀取」，且被上訴人主張適用「逆\n    均等論」（reverse doctrine ofequivalents），應再比對\n    待鑑定對象是否適用「逆均等論」；若待鑑定對象不適用「\n    逆均等論」，則應判斷待鑑定對象落入專利權（文義）範圍\n    。觀諸本件工研院鑑定報告之方式，與前開「專利侵害鑑定\n    要點」所揭示「發明（或新型）專利侵害之鑑定原則」相符\n    ，是該鑑定報告所採鑑定流程自無何不當之處。則本院認工\n    研院所為鑑定既未悖離「專利侵害鑑定要點」所揭示之鑑定\n    原則，且該鑑定單位亦係經兩造合意選定之鑑定機關，其所\n    為之鑑定結果自可採用。\n  4.綜上，被上訴人欣友公司生產系爭裝置，經兩造合意選定之\n    鑑定機關所為之鑑定結果，認與系爭專利之專利權範圍相同\n    ，欣友公司確有侵害上訴人系爭新型第194763號專利權，應\n    堪認定。\n  5.被上訴人雖抗辯稱其亦將系爭裝置送請工程學會鑑定結果，\n    認並無侵害系爭專利情事云云。惟被上訴人送請工程學會鑑\n    定之樣品是否確為系爭裝置，未經上訴人是認，縱經鑑定結\n    果認無侵害系爭專利，亦未能認定系爭裝置無侵害系爭專利\n    之情事。上訴人據以抗辯系爭裝置並無侵害專利之情事，要\n    屬無據。\n  (二)被上訴人就侵害系爭專利是否有故意或過失?\n  1.專利權係採登記及公告制度，處於任何人均可得知之狀態。\n    故該發明或創作所屬技術或技藝領域中，具有通常知識者，\n    自不得諉稱不知專利權之存在，據以抗辯其無失。再者，智\n    慧財產權已成為現代企業經營所應面臨之風險下，事業於從\n    事生產、製造與銷售之際，較以往而言，應負有更高之風險\n    意識與注意義務，避免侵害他人之智慧財產權。因此，對於\n    具有一般風險識之事業而言，其從事生產、銷售行為之際，\n    自應就其所實施之技術作最低限度的專利權查證，倘未查證\n    者，即有過失。本件欣友公司所營事業包括消防安全設備批\n    發業、國際貿易業、五金批發業、廚房器具批發業，瓦斯器\n    材及其零件製造業等，有公司基本資料查詢表在卷可憑（見\n    本院卷(二)第142頁)。是以欣友公司具有製造瓦斯器材、零件\n    之專業知識，而系爭專利為一種微動型水力發電機，係由一\n    水流通件結合一發電機組所構成；該水流為內部設有容室、\n    而外部設有雙向開口及進出水管的殼體，該容室可供容置鬆\n    配有磁環之葉片軸，該殼體一開口（容室端口）再設有膜片\n    及彈簧後與一設有出水管之蓋體對接，而殼之另側開口則結\n    一另設有磁鐵之發電機組；藉水流帶動葉片軸以令二磁鐵間\n    藉磁性力互吸作而達自動平衡定位，且形成磁激式發電，以\n    無軸心傳動而減少傳動損失，又發電機組可更換故可得不同\n    之供電量者，有90年9月21日新型專利公報在卷可憑(見原審\n    卷第217頁至第220頁)。是以欣友公司製造系爭裝置即瓦斯\n    熱水器水力發電裝置時，理應應就其所實施之技術作最低限\n    度的專利權查證、或於網路上檢索相同專利或物品之資訊，\n    即得輕易發現其所製造經銷之系爭裝置已屬乙○○申請專利\n    之範圍。詎欣友公司未善盡查證義務，遽以製造、銷售系爭\n    裝置，欣友公司就生產、銷售系爭裝置有侵害系爭專利之過\n    失至明。\n  2.被上訴人抗辯欣友公司生產之系爭裝置與第M259073號專利\n    範圍相符，因此，被上訴人無侵害系爭專利之故意或過失云\n    云，固聲請本院函請工研院鑑定。惟該送請鑑定之樣品，上\n    訴人否認為系爭裝置，是以鑑定結果雖認該待鑑定物落入第\n    M259073號獨立項申請專利權（文義）範圍，待鑑定物與第M\n    259073號專利申請範圍相符，有工研院98年05月26日工研轉\n    字第0980006427號函附鑑定報告在卷可參（見本院卷(二)第55\n    頁、證物外放），亦不得據為欣友公司無過失侵害系爭專利\n    之依據。\n  3.另被上訴人抗辯稱第M259073號專利權說明書中已引用乙○\n    ○所有之第104763號專利權申請專利說明書，並向智慧局申\n    請新型專利技術報告，已經該局核發94年12月30日(94)智專\n    二（三）02033字第0944232330號新型專利技術報告在案（\n    見原審卷第181頁至第197頁）。是以系爭裝置援用第M25907\n    3號專利，並無過失云云。惟按新型專利採形式審查，由於\n    未對是否合於專利要件進行實體審查，導致新型專利權的權\n    利內容存在著相當的不安定性及不確定性。而技術報告在功\n    能上具有公眾審查之性質，以釐清該新型專利是否合於專利\n    要件之疑義，惟該新型專利技術報告之性質，係屬機關無拘\n    束力之報告，並非行政處分，僅作為權利行使或技術利用之\n    參酌。若任何人認該新型專利有不應核准專利之事由，應依\n    專利法107條規定提起舉發撤銷該新型專利權。本件訴外人\n    黃彩固申請M259073號專利說明書，該專利說明書已經熱品\n    公司舉發，雖經智慧局審定為「舉發不成立」，惟嗣經熱品\n    公司提起訴願，已經經濟部撤銷原處分，黃彩不服提起行政\n    訴訟，復經智慧財產法院確認第M259073號專利權不具進步\n    性而不存在，而以97年行專訴字第00001號判決駁回黃彩之\n    訴，黃彩未聲明不服而告確定在案，有該判決在卷可證（見\n    本院卷(二)第33頁至第46頁)。核該判決記載M259073號專利之\n    兩組磁錠與保持環組合之技術特徵，乃熟悉發電裝置技術領\n    域者組合系爭專利與90年11月11日、90年2月22日公告之000\n    00000、00000000號專利可輕易完成者，足見倘系爭裝置係\n    依M259073號專利製造，則M259073號專利權既係組合系爭專\n    利而成之裝置，已如前述，則欣友公司理應知悉M259073號\n    專利有利用系爭專利甚明。詎欣友公司仍援引M259073號專\n    利，據以製造系爭裝置，自有過失，被上訴人抗辯其援用M2\n    59073號專利製造系爭裝置而無過失云云，殊屬無據。\n  (三)乙○○得否請求被上訴人賠償？\n  1.乙○○主張其將所有系爭專利權專屬授權予熱品公司，業經\n    聲請訊問當事人乙○○為證（見本院卷(二)第94頁正、反面)\n    ，且有授權書在卷可憑(見本院卷第66頁)。被上訴人雖抗辯\n    稱該證據為不得於第二審所提出新攻擊防禦方法云云。惟上\n    訴人於原審即起訴主張系爭專利為乙○○所有，且專屬授權\n    予熱品公司（見原審卷第5頁至第6頁)，是以上訴人提出前\n    揭新證據方法，僅是就其所於原審主張之事實，提出新攻擊\n    方法為補充，揆諸民事訴訟法第447條第1項第3款規定，應\n    予准許。\n  2.按除前項規定外，發明專利權人之業務上信譽，因侵害而致\n    減損時，得另請求賠償相當金額，此規定於新型專利準用之\n    ，專利法第85條第2項、第108條定有明文。本件乙○○主張\n    被上訴人侵害其所有系爭專利，其因而受有信譽損害云云，\n    惟專利權人業務上信譽之減損，其性質屬於非財產之損害，\n    固亦得請求損害賠償。但乙○○僅為熱品公司法定代理人，\n    執行熱品公司業務，是上訴人侵害系爭專利，乙○○究有何\n    致其「業務上信譽減損」之情事，未能舉證以明其實，是以\n    乙○○據以請求被上訴人連帶賠償100萬元本息，要無所據\n    ，不應准許。\n  (四)熱品公司得否請求被上訴人連帶賠償？其金額為何？\n  1.按發明專利權受侵害時，專利權人得請求賠償損害，並得請\n    求排除其侵害，有侵害之虞者，得請求防止之。專屬被授權\n    人亦得為前項請求。但契約另有約定者，從其約定。此規定\n    於新型專利準用之，專利法第84條第1項、第2項、第108條\n    定有明文。本件乙○○將系爭專利專屬授權予熱品公司，已\n    如前述，是以熱品公司自得向侵權行為人請求損害賠償（98\n    年智慧財產法院法律座談會第15號研討意見)。復按「公司\n    負責人對於公司業務之執行，如有違反法令致他人受有損害\n    時，對他人應與公司負連帶賠償之責」，公司法第23條第2\n    項規定甚明。而甲○○係欣友公司之負責人，有欣友公司變\n    更登記表附卷可稽(見本院卷(二)第142頁)，欣友公司產品之\n    製造及銷售事項，均屬公司負責人執行業務之範圍，是欣友\n    公司生產銷售侵害系爭專利之產品，自屬其負責執行公司之\n    業務而侵害專利權人權利之行為，則熱品公司請求甲○○與\n    欣友公司應對熱品公司之損害負連帶賠償責任，洵屬有據。\n  2.又發明專利權人以其發明專利權讓與、信託、授權他人實施\n    或設定質權，非經向專利專責機關登記，不得對抗第三人。\n    此規定於新型專利準用之，專利法第59條、第108條定有明\n    文。被上訴人雖抗辯稱乙○○就專屬授權未向智慧局辦理登\n    記，依前揭規定不得請求損害賠償云云。惟核閱前揭規定僅\n    係專利權讓與未經向智慧局登記，不得對抗第三人，核非不\n    得請求損害賠償之規定。被上訴人據為熱品公司不得請求損\n    害賠償之規定云云，不足為採。\n  3.另發明專利權人應在專利物品或其包裝上標示專利證書號數\n    ，並得要求被授權人或特許實施權人為之；其未附加標示者\n    ，不得請求損害賠償。但侵權人明知或有事實足證其可得而\n    知為專利物品者，不在此限。此規定於新型專利準用之，專\n    利法第79條、第108條定有明文。被上訴人抗辯稱上訴人未\n    在其產品上標示系爭專利證書號數，不得請求損害賠償云云\n    。惟熱品公司已提出用以標示專利證書字號之標籤與照片為\n    證（見原審卷第516頁至第517頁），被上訴人抗辯熱品公司\n    未於產品標示系爭專利證書號數，並不得請求損害賠償云云\n    ，不足為採。況倘被上訴人抗辯欣友公司產品係依黃彩聲請\n    M259073號專利權實施製造，則M259073號專利權技術報告中\n    已援引系爭專利，已如前述，則被上訴人依理可得而知系爭\n    專利權存在，揆諸前揭但書規定，熱品公司縱未將系爭專利\n    證書號書標示於產品上，亦得請求被上訴人負損害賠償之責\n    ，被上訴人抗辯熱品公司不得請求損害賠償云云，不足為採\n    。\n  (五)熱品公司請求被上訴人連帶賠償之金額為何？\n  1.按發明專利權受侵害時，專利權人得請求賠償損害，依前條\n    請求損害賠償時，得就下列各款擇一計算其損害：「1、依\n    民法第216條之規定。但不能提供證據方法以證明其損害時\n    ，發明專利權人得就其實施專利權通常所可獲得之利益，減\n    除受害後實施同一專利權所得之利益，以其差額為所受損害\n    。2、依侵害人因侵害行為所得之利益。於侵害人不能就其\n    成本或必要費用舉證時，以銷售該項物品全部收入為所得利\n    益」，此規定於新型專利準用之，專利法第85條第1項、第1\n    08條定有明文。\n  2.原審向財政部臺灣省北區國稅局新莊稽徵所調閱之被上訴人\n    欣友公司92年至95年「營業人銷售額與稅額申報書」，有財\n    政部臺灣省北區國稅局新莊稽徵所96年9月6日北區國稅新莊\n    三字第0961022840號函可憑（見原審卷第406之1頁至第426\n    頁），依該申報書記載欣友公司銷售額、進項及費用詳如附\n    表示，熱品公司請求就欣友公司於92年11月、12月、93年5\n    月至6月、94年5至12月、95年1月、2月、5至8月、11至12月\n    部分銷售額33,883,670元，扣除總進項成本27,972,931元，\n    而主張被上訴人欣友公司、甲○○侵害系爭專利獲利總額為\n    5,910,739元，詳如附表所示，並僅請求其中3,000,000元，\n    認為欣友公司因侵害系爭專利所得之利益，及自起訴狀繕本\n    送達翌日即94年12月1日起至清償日止，按週年利率百分之\n    五計算之法定利息，為有理由，應予准許。\n  3.被上訴人抗辯稱熱品公司僅就欣友公司獲利之月份為請求，\n    就未獲利之月份，熱品公司均未扣除，其據以計算欣友公司\n    之獲利云云，不足採信云云。惟當事人因妨礙他造使用，故\n    意將證據滅失、隱匿或致礙難使用者，法院得審酌情形認他\n    造關於該證據之主張或依該證據應證之事實為真實，民事訴\n    訟法第282條之1定有明文。本件熱品公司就欣友公司侵害系\n    爭專利之獲利，已為前揭之舉證，應盡舉證之責。而被上訴\n    人對其主張如抗辯不實並提出反對之主張者，則被上訴人對\n    其反對之主張，亦應負證明之責，此為舉證責任分擔之原則\n    。而本件欣友公司抗辯其獲利未如熱品公司所主張之金額，\n    但就其製造、銷售系爭裝置侵害熱品公司系爭專利之獲利為\n    何，於原審已遲未能就其成本或必要費用為舉證，且詳原本\n    記載屢經本院請被上訴人提出該公司之營業內容、銷售事項\n    、銷售金額之資料（見本院卷(二)第93頁反面)，被上訴人復\n    均未提出，甚且陳明無法提出該資料（見本院卷(二)第109頁)\n    ，揆諸前揭說明，應認熱品公司主張欣友公司前揭銷售有獲\n    利之月份，為侵害系爭專利所得之利益，其餘月份縱有虧損\n    ，亦非應扣除銷售系爭裝置之虧損，應可採信。被上訴人抗\n    辯欣友公司獲利未有300萬元云云，為無理由，不足採信。\n四、綜上所述，熱品公司主張欣友公司生產銷售系爭裝置落入系\n    爭專利範圍，熱品公司依專利法第84條第1項、第2項、第10\n    8條及公司法第23條第2項規定，請求被上訴人連帶賠償上訴\n    人熱品公司300萬元，及自起訴狀繕本送達翌日即94年12月1\n    日起至清償日止，按週年利率百分之五計算之法定遲延利息\n    ，為有理由，應予准許；乙○○請求被上訴人連帶賠償100\n    萬元本息，則屬無據，應予駁回。兩造分別陳明願供擔保准\n    、免假執行宣告，就前開應准許部分，於法並無不合，爰分\n    別酌定相當擔保准許之。至於乙○○敗訴部分，其假執行之\n    聲請失所附麗，應併駁回。原審駁回熱品公司上開應准許部\n    分，另訴外裁判判准被上訴人應連帶給付乙○○300萬元本\n    息，均有未洽，熱品公司上訴、被上訴人附帶上訴，指摘原\n    判決不當，請求廢棄改判，為有理由，爰由本院予以廢棄，\n    其中熱品公司請求部分並改判如主文第二項所示，並依聲請\n    為附條件之准、免假執行宣告。至原審駁回乙○○請求被上\n    訴人連帶給付100萬元本息及假執行之聲請，並無不合。乙\n    ○○上訴意旨指摘原判決此部分不當，求予廢棄改判，為無\n    理由，應予駁回。\n五、本件事證已明，兩造其餘攻擊防禦方法及未經援用之證據，\n    經本院審酌後，核與本件之結論，不生影響，爰不一一贅述\n    ，附此敘明。\n六、據上論結，本件熱品公司上訴、被上訴人附帶上訴，均為有\n    理由，乙○○上訴無理由，依民事訴訟法第450條、第449條\n    第1項、第79條、第85條第2項、第390第2項、第392條第2項\n    、第463條，判決如主文。",
    "reason": "一、上訴人主張：上訴人乙○○（以下簡稱乙○○）擁有中華民\n    國新型第194763號名稱「微動型水力發電機」專利權（以下\n    簡稱系爭專利），專利期間自民國90年9月24日至102年2月\n    26日止。乙○○並專屬授權予上訴人熱品工業股份有限公司\n    （以下簡稱熱品公司）實施系爭專利。詎被上訴人欣友興業\n    有限公司（以下簡稱欣友公司）為圖不法利益，竟大量仿製\n    銷售「瓦斯熱水器水力發電裝置」(以下簡稱系爭裝置)，經\n    上訴人發現原審共同被告麒毓公司及莊頭北工業股份有限公\n    司（原審判決上訴人此部分敗訴，上訴人聲明不服提起上訴\n    後撤回起訴）分別販售欣友公司生產之系爭裝置，並公然於\n    網站上刊登廣告行銷。經上訴人將系爭裝置送中國生產力中\n    心（以下簡稱生產力中心）鑑定，認欣友公司製造之系爭裝\n    置落入系爭專利申請之專利範圍。則熱品公司基於專屬被授\n    權人地位，取得專利法第84條第1項所定之損害賠償請求權\n    而有訴訟實施權。爰依專利法第108條準用第84條第1項、第\n    2項之規定請求欣友公司負賠償責任。而被上訴人甲○○(以\n    下簡稱甲○○)為欣友公司之代表人，欣友公司侵害上訴人\n    專利權，甲○○自應依民法第28條(應為公司法第23條規定)\n    負連帶賠償責任。起訴聲明：(一)被上訴人應連帶賠償熱品公\n    司新台幣（下同）300萬元，及自起訴狀繕本送達翌日起至\n    清償日止，按週年利率百分之五計算之利息；(二)被上訴人應\n    連帶賠償乙○○信譽損害100萬元，自起訴狀繕本送達翌日\n    起至清償日止，按週年利率百分之五計算之利息。(三)願供擔\n    保請准宣告假執行。原審判命：被上訴人應連帶給付乙○○\n    300萬元，及自94年12月1日起至清償日止，按週年利率百分\n    之五計算之利息(原審此部分為訴外裁判，見本院卷(二)第57\n    頁反面、第58頁)。並為准、免假執行之宣告，及駁回上訴\n    人其餘之訴(上訴人於原審另請求禁止欣友公司製造、銷售\n    及委託製造，與起訴狀原證二鑑定報告中之待鑑定物相同之\n    發電機，或與本件專利權範圍相同之產品，及禁止被上訴人\n    欣友公司印製、委託印製、散布任何就前開侵害本件系爭專\n    利之產品之產品簡介、廣告手冊或其他文件；欣友公司應交\n    付上訴人從事侵害系爭專利行為之模具供為上訴人銷燬；被\n    上訴人應共同於中國時報及經濟日報（星期一至星期五）第\n    一版連續3天以如附件1之版面，刊登道歉啟事等，均經原審\n    判決後，於本院撤回起訴）。上訴人就就其敗訴部分聲明不\n    服提起上訴；被上訴人就其敗訴部分提起附帶上訴。上訴聲\n    明：(一)原判決關於駁回上訴人後開第二、三項之訴部分廢棄\n    。(二)上開廢棄部分，被上訴人應連帶賠償乙○○業務上信譽\n    損害100萬元，及自94年12月1日起至清償日止，按週年利率\n    百分之五計算之利息。(三)被上訴人應連帶賠償熱品公司300\n    萬元，及自94年12月1日起至清償日止按週年利率百分之五\n    計算之利息。(四)願供擔保請准宣告假執行。就被上訴人附帶\n    上訴，聲明：附帶上訴駁回。\n二、被上訴人則以：上訴人提出生產力中心製作之專利鑑定報告\n    ，未經查證即稱待鑑物品係被上訴人公司之產品，且未對待\n    鑑定物品所有元件為分析，鑑定結果不足採信。另被上訴人\n    亦將系爭裝置送請中國機械工程學會（以下簡稱工程學會）\n    鑑定，認待鑑物與系爭專利申請範圍不相同。至原審函請工\n    研院鑑定認待鑑定物品與系爭專利案之申請專利範圍實質相\n    同。然系爭裝置係被上訴人公司依新型專利證書第M259073\n    號「瓦斯熱水器水力發電裝置」所製造，而依經濟部智慧財\n    產局（以下簡稱智慧局）94年12月30日智專二(三)02033字\n    第0944232330號新型專利技術報告，所引用第1份文獻即為\n    系爭專利，經比對結果為「無法發現足以否定其新穎性等要\n    件之先前技術文獻等」，顯見系爭裝置與系爭專利無關，被\n    上訴人並無侵害上訴人專利權之故意或過失。又上訴人生產\n    之微動型水力發電機，均未在其主張之專利物品上或其包裝\n    上標示專利證書號數，自不得請求損害賠償。再者，本件專\n    利權人並非熱品公司，而乙○○並非法人，並無製造相關產\n    品，自無任何業務上信譽或損害。至欣友公司自92年至95年\n    整體營業並無獲利，上訴人未能就專利法第85條第1項第2款\n    要件具體舉證，亦未扣除成本及必要費用，徒以被上訴人向\n    國稅局申報所有營業稅資料，主張被上訴人侵害其專利權所\n    獲利益總額為5,910,739元，顯無理由等語，資為抗辯。答\n    辯聲明：上訴駁回。附帶上訴聲明：(一)原判決關於命被上訴\n    人連帶給付乙○○300萬元本息部分廢棄。(二)上廢棄部分，\n    被上訴人在第一審之訴及假執行聲請均駁回。就上訴人之上\n    訴，答辯聲明：上訴駁回。\n三、上訴人主張乙○○擁有系爭專利權，專利期間自90年9月24\n    日至102年2月26日止，乙○○並專屬授權予熱品公司實施系\n    爭專利，詎欣友公司為圖不法利益，竟大量仿製銷售侵害系\n    爭專利之系爭裝置等語。惟為被上訴人所否認，並以前詞置\n    辯。查：\n  (一)系爭裝置是否落入系爭專利範圍？\n  1.按鑑定為一種調查證據方法，所得結果係供作法院依自由心\n    證判斷事實真偽之證據資料。當事人就其可處分之事項，對\n    於鑑定人之人選、鑑定結果及於事實認定之效力，本得於起\n    訴前以證據契約之形式為約定、於證據保全程序中依民事訴\n    訟法第376條之1第1項規定成立協議，或於訴訟進行中依同\n    法第326條第2項前段、第270條之1第1項第3款規定達成指定\n    合意或爭點簡化協議。倘無此證據契約、指定合意或爭點簡\n    化協議，法院即不受鑑定結果之拘束，仍應踐行調查證據之\n    程序而後定其取捨。\n  2.本件原審依兩造於95年2月14日、95年3月28日言詞辯論之協\n    議委請工研院鑑定（見原審卷第221頁、第223頁至第224頁\n    ），兩造合意所選定之鑑定機關，其鑑定結果縱不能作為法\n    院事實認定之唯一基礎，然既經兩造及法院為使訴訟有利於\n    終結，而於訴訟程序中所擇定之鑑定機關，仍應認其就專業\n    所為之鑑定，對於兩造具有一定之拘束力，除有顯失公平或\n    類似之情形外（民事訴訟法第270條之1第3項），不得徒以\n    結果不利某一造，而任意指摘其鑑定結果為不可採，方符訴\n    訟上誠信原則。基此，兩造合意選定之鑑定機關工研院依原\n    法院檢附之「水力發電機」實物樣品（「待鑑定物」實物（\n    \" 編號1物品\"1個，\"編號2物品\"2個)及專利證書新型第1947\n    63號「微動型水力發電機」專利案之專利說明書與專利申請\n    範圍進行分析。並依智慧局制定之「專利侵害鑑定要點進行\n    鑑定」所為之鑑定結果，認：待鑑定物與系爭專利之申請專\n    利範圍獨立項相較，應不符合「文意讀取」。惟待鑑定物與\n    系爭專利兩者之技術手術、技術特徵、技術手段所達成之功\n    效應為實質相同；並依均等論分析比較，待鑑定物與系爭專\n    利符合均等論之成立要件，待鑑定物與系爭專利之申請專利\n    範圍應為實質相同，亦即待鑑定物與專利證書新型第194763\n    號「微動型水力發電機」專利案之申請專利範圍應為實質相\n    同，有工研院95年9月20日工研轉字第13197號函附鑑定報\n    告在卷可憑(見原審卷第222頁至第274頁)。嗣本院再送請補\n    充鑑定結果，亦認本件應未具有符合「禁反言」及「先前技\n    術阻卻」成立之要件；亦即應不適用禁反言或先前技術阻鑑\n    ；因此，「待鑑定物」應已落入系爭專利（均等）範圍，有\n    工研究院97年12月4日工研轉字第0970015128號函送補充鑑\n    定報告在卷可證（見本院卷(一)第339頁至第343頁）。是欣友\n    公司製造生產之系爭裝置確有侵害系爭專利之情事。\n  3.另智慧局於93年10月5日以經授智字第09320031110號函送，\n    經司法院已於93年11月2日以秘台廳民一字第0930024793號\n    函送各法官供鑑定時參考之「專利侵害鑑定要點」下篇第壹\n    部分「發明（或新型）專利侵害之鑑定原則」第2章第1節「\n    鑑定流程概述」:就專利侵害之鑑定流程曾提出下列參考準\n    據：專利侵害之鑑定流程分為兩階段：I解釋申請專利範\n    圍；及II比對解釋後之申請專利範圍與待鑑定對象（物或方\n    法）。比對解釋後之申請專利範圍與待鑑定對象包括下列\n    步驟：I解析申請專利範圍之技術特徵II解析待鑑定對象之\n    技術內容III基於全要件原則（all-elementsrule/all-limi\n    tations rule），判斷待鑑定對象是否符合「文義讀取」。\n    若待鑑定對象符合「文義讀取」，且被上訴人主張適用「逆\n    均等論」（reverse doctrine ofequivalents），應再比對\n    待鑑定對象是否適用「逆均等論」；若待鑑定對象不適用「\n    逆均等論」，則應判斷待鑑定對象落入專利權（文義）範圍\n    。觀諸本件工研院鑑定報告之方式，與前開「專利侵害鑑定\n    要點」所揭示「發明（或新型）專利侵害之鑑定原則」相符\n    ，是該鑑定報告所採鑑定流程自無何不當之處。則本院認工\n    研院所為鑑定既未悖離「專利侵害鑑定要點」所揭示之鑑定\n    原則，且該鑑定單位亦係經兩造合意選定之鑑定機關，其所\n    為之鑑定結果自可採用。\n  4.綜上，被上訴人欣友公司生產系爭裝置，經兩造合意選定之\n    鑑定機關所為之鑑定結果，認與系爭專利之專利權範圍相同\n    ，欣友公司確有侵害上訴人系爭新型第194763號專利權，應\n    堪認定。\n  5.被上訴人雖抗辯稱其亦將系爭裝置送請工程學會鑑定結果，\n    認並無侵害系爭專利情事云云。惟被上訴人送請工程學會鑑\n    定之樣品是否確為系爭裝置，未經上訴人是認，縱經鑑定結\n    果認無侵害系爭專利，亦未能認定系爭裝置無侵害系爭專利\n    之情事。上訴人據以抗辯系爭裝置並無侵害專利之情事，要\n    屬無據。\n  (二)被上訴人就侵害系爭專利是否有故意或過失?\n  1.專利權係採登記及公告制度，處於任何人均可得知之狀態。\n    故該發明或創作所屬技術或技藝領域中，具有通常知識者，\n    自不得諉稱不知專利權之存在，據以抗辯其無失。再者，智\n    慧財產權已成為現代企業經營所應面臨之風險下，事業於從\n    事生產、製造與銷售之際，較以往而言，應負有更高之風險\n    意識與注意義務，避免侵害他人之智慧財產權。因此，對於\n    具有一般風險識之事業而言，其從事生產、銷售行為之際，\n    自應就其所實施之技術作最低限度的專利權查證，倘未查證\n    者，即有過失。本件欣友公司所營事業包括消防安全設備批\n    發業、國際貿易業、五金批發業、廚房器具批發業，瓦斯器\n    材及其零件製造業等，有公司基本資料查詢表在卷可憑（見\n    本院卷(二)第142頁)。是以欣友公司具有製造瓦斯器材、零件\n    之專業知識，而系爭專利為一種微動型水力發電機，係由一\n    水流通件結合一發電機組所構成；該水流為內部設有容室、\n    而外部設有雙向開口及進出水管的殼體，該容室可供容置鬆\n    配有磁環之葉片軸，該殼體一開口（容室端口）再設有膜片\n    及彈簧後與一設有出水管之蓋體對接，而殼之另側開口則結\n    一另設有磁鐵之發電機組；藉水流帶動葉片軸以令二磁鐵間\n    藉磁性力互吸作而達自動平衡定位，且形成磁激式發電，以\n    無軸心傳動而減少傳動損失，又發電機組可更換故可得不同\n    之供電量者，有90年9月21日新型專利公報在卷可憑(見原審\n    卷第217頁至第220頁)。是以欣友公司製造系爭裝置即瓦斯\n    熱水器水力發電裝置時，理應應就其所實施之技術作最低限\n    度的專利權查證、或於網路上檢索相同專利或物品之資訊，\n    即得輕易發現其所製造經銷之系爭裝置已屬乙○○申請專利\n    之範圍。詎欣友公司未善盡查證義務，遽以製造、銷售系爭\n    裝置，欣友公司就生產、銷售系爭裝置有侵害系爭專利之過\n    失至明。\n  2.被上訴人抗辯欣友公司生產之系爭裝置與第M259073號專利\n    範圍相符，因此，被上訴人無侵害系爭專利之故意或過失云\n    云，固聲請本院函請工研院鑑定。惟該送請鑑定之樣品，上\n    訴人否認為系爭裝置，是以鑑定結果雖認該待鑑定物落入第\n    M259073號獨立項申請專利權（文義）範圍，待鑑定物與第M\n    259073號專利申請範圍相符，有工研院98年05月26日工研轉\n    字第0980006427號函附鑑定報告在卷可參（見本院卷(二)第55\n    頁、證物外放），亦不得據為欣友公司無過失侵害系爭專利\n    之依據。\n  3.另被上訴人抗辯稱第M259073號專利權說明書中已引用乙○\n    ○所有之第104763號專利權申請專利說明書，並向智慧局申\n    請新型專利技術報告，已經該局核發94年12月30日(94)智專\n    二（三）02033字第0944232330號新型專利技術報告在案（\n    見原審卷第181頁至第197頁）。是以系爭裝置援用第M25907\n    3號專利，並無過失云云。惟按新型專利採形式審查，由於\n    未對是否合於專利要件進行實體審查，導致新型專利權的權\n    利內容存在著相當的不安定性及不確定性。而技術報告在功\n    能上具有公眾審查之性質，以釐清該新型專利是否合於專利\n    要件之疑義，惟該新型專利技術報告之性質，係屬機關無拘\n    束力之報告，並非行政處分，僅作為權利行使或技術利用之\n    參酌。若任何人認該新型專利有不應核准專利之事由，應依\n    專利法107條規定提起舉發撤銷該新型專利權。本件訴外人\n    黃彩固申請M259073號專利說明書，該專利說明書已經熱品\n    公司舉發，雖經智慧局審定為「舉發不成立」，惟嗣經熱品\n    公司提起訴願，已經經濟部撤銷原處分，黃彩不服提起行政\n    訴訟，復經智慧財產法院確認第M259073號專利權不具進步\n    性而不存在，而以97年行專訴字第00001號判決駁回黃彩之\n    訴，黃彩未聲明不服而告確定在案，有該判決在卷可證（見\n    本院卷(二)第33頁至第46頁)。核該判決記載M259073號專利之\n    兩組磁錠與保持環組合之技術特徵，乃熟悉發電裝置技術領\n    域者組合系爭專利與90年11月11日、90年2月22日公告之000\n    00000、00000000號專利可輕易完成者，足見倘系爭裝置係\n    依M259073號專利製造，則M259073號專利權既係組合系爭專\n    利而成之裝置，已如前述，則欣友公司理應知悉M259073號\n    專利有利用系爭專利甚明。詎欣友公司仍援引M259073號專\n    利，據以製造系爭裝置，自有過失，被上訴人抗辯其援用M2\n    59073號專利製造系爭裝置而無過失云云，殊屬無據。\n  (三)乙○○得否請求被上訴人賠償？\n  1.乙○○主張其將所有系爭專利權專屬授權予熱品公司，業經\n    聲請訊問當事人乙○○為證（見本院卷(二)第94頁正、反面)\n    ，且有授權書在卷可憑(見本院卷第66頁)。被上訴人雖抗辯\n    稱該證據為不得於第二審所提出新攻擊防禦方法云云。惟上\n    訴人於原審即起訴主張系爭專利為乙○○所有，且專屬授權\n    予熱品公司（見原審卷第5頁至第6頁)，是以上訴人提出前\n    揭新證據方法，僅是就其所於原審主張之事實，提出新攻擊\n    方法為補充，揆諸民事訴訟法第447條第1項第3款規定，應\n    予准許。\n  2.按除前項規定外，發明專利權人之業務上信譽，因侵害而致\n    減損時，得另請求賠償相當金額，此規定於新型專利準用之\n    ，專利法第85條第2項、第108條定有明文。本件乙○○主張\n    被上訴人侵害其所有系爭專利，其因而受有信譽損害云云，\n    惟專利權人業務上信譽之減損，其性質屬於非財產之損害，\n    固亦得請求損害賠償。但乙○○僅為熱品公司法定代理人，\n    執行熱品公司業務，是上訴人侵害系爭專利，乙○○究有何\n    致其「業務上信譽減損」之情事，未能舉證以明其實，是以\n    乙○○據以請求被上訴人連帶賠償100萬元本息，要無所據\n    ，不應准許。\n  (四)熱品公司得否請求被上訴人連帶賠償？其金額為何？\n  1.按發明專利權受侵害時，專利權人得請求賠償損害，並得請\n    求排除其侵害，有侵害之虞者，得請求防止之。專屬被授權\n    人亦得為前項請求。但契約另有約定者，從其約定。此規定\n    於新型專利準用之，專利法第84條第1項、第2項、第108條\n    定有明文。本件乙○○將系爭專利專屬授權予熱品公司，已\n    如前述，是以熱品公司自得向侵權行為人請求損害賠償（98\n    年智慧財產法院法律座談會第15號研討意見)。復按「公司\n    負責人對於公司業務之執行，如有違反法令致他人受有損害\n    時，對他人應與公司負連帶賠償之責」，公司法第23條第2\n    項規定甚明。而甲○○係欣友公司之負責人，有欣友公司變\n    更登記表附卷可稽(見本院卷(二)第142頁)，欣友公司產品之\n    製造及銷售事項，均屬公司負責人執行業務之範圍，是欣友\n    公司生產銷售侵害系爭專利之產品，自屬其負責執行公司之\n    業務而侵害專利權人權利之行為，則熱品公司請求甲○○與\n    欣友公司應對熱品公司之損害負連帶賠償責任，洵屬有據。\n  2.又發明專利權人以其發明專利權讓與、信託、授權他人實施\n    或設定質權，非經向專利專責機關登記，不得對抗第三人。\n    此規定於新型專利準用之，專利法第59條、第108條定有明\n    文。被上訴人雖抗辯稱乙○○就專屬授權未向智慧局辦理登\n    記，依前揭規定不得請求損害賠償云云。惟核閱前揭規定僅\n    係專利權讓與未經向智慧局登記，不得對抗第三人，核非不\n    得請求損害賠償之規定。被上訴人據為熱品公司不得請求損\n    害賠償之規定云云，不足為採。\n  3.另發明專利權人應在專利物品或其包裝上標示專利證書號數\n    ，並得要求被授權人或特許實施權人為之；其未附加標示者\n    ，不得請求損害賠償。但侵權人明知或有事實足證其可得而\n    知為專利物品者，不在此限。此規定於新型專利準用之，專\n    利法第79條、第108條定有明文。被上訴人抗辯稱上訴人未\n    在其產品上標示系爭專利證書號數，不得請求損害賠償云云\n    。惟熱品公司已提出用以標示專利證書字號之標籤與照片為\n    證（見原審卷第516頁至第517頁），被上訴人抗辯熱品公司\n    未於產品標示系爭專利證書號數，並不得請求損害賠償云云\n    ，不足為採。況倘被上訴人抗辯欣友公司產品係依黃彩聲請\n    M259073號專利權實施製造，則M259073號專利權技術報告中\n    已援引系爭專利，已如前述，則被上訴人依理可得而知系爭\n    專利權存在，揆諸前揭但書規定，熱品公司縱未將系爭專利\n    證書號書標示於產品上，亦得請求被上訴人負損害賠償之責\n    ，被上訴人抗辯熱品公司不得請求損害賠償云云，不足為採\n    。\n  (五)熱品公司請求被上訴人連帶賠償之金額為何？\n  1.按發明專利權受侵害時，專利權人得請求賠償損害，依前條\n    請求損害賠償時，得就下列各款擇一計算其損害：「1、依\n    民法第216條之規定。但不能提供證據方法以證明其損害時\n    ，發明專利權人得就其實施專利權通常所可獲得之利益，減\n    除受害後實施同一專利權所得之利益，以其差額為所受損害\n    。2、依侵害人因侵害行為所得之利益。於侵害人不能就其\n    成本或必要費用舉證時，以銷售該項物品全部收入為所得利\n    益」，此規定於新型專利準用之，專利法第85條第1項、第1\n    08條定有明文。\n  2.原審向財政部臺灣省北區國稅局新莊稽徵所調閱之被上訴人\n    欣友公司92年至95年「營業人銷售額與稅額申報書」，有財\n    政部臺灣省北區國稅局新莊稽徵所96年9月6日北區國稅新莊\n    三字第0961022840號函可憑（見原審卷第406之1頁至第426\n    頁），依該申報書記載欣友公司銷售額、進項及費用詳如附\n    表示，熱品公司請求就欣友公司於92年11月、12月、93年5\n    月至6月、94年5至12月、95年1月、2月、5至8月、11至12月\n    部分銷售額33,883,670元，扣除總進項成本27,972,931元，\n    而主張被上訴人欣友公司、甲○○侵害系爭專利獲利總額為\n    5,910,739元，詳如附表所示，並僅請求其中3,000,000元，\n    認為欣友公司因侵害系爭專利所得之利益，及自起訴狀繕本\n    送達翌日即94年12月1日起至清償日止，按週年利率百分之\n    五計算之法定利息，為有理由，應予准許。\n  3.被上訴人抗辯稱熱品公司僅就欣友公司獲利之月份為請求，\n    就未獲利之月份，熱品公司均未扣除，其據以計算欣友公司\n    之獲利云云，不足採信云云。惟當事人因妨礙他造使用，故\n    意將證據滅失、隱匿或致礙難使用者，法院得審酌情形認他\n    造關於該證據之主張或依該證據應證之事實為真實，民事訴\n    訟法第282條之1定有明文。本件熱品公司就欣友公司侵害系\n    爭專利之獲利，已為前揭之舉證，應盡舉證之責。而被上訴\n    人對其主張如抗辯不實並提出反對之主張者，則被上訴人對\n    其反對之主張，亦應負證明之責，此為舉證責任分擔之原則\n    。而本件欣友公司抗辯其獲利未如熱品公司所主張之金額，\n    但就其製造、銷售系爭裝置侵害熱品公司系爭專利之獲利為\n    何，於原審已遲未能就其成本或必要費用為舉證，且詳原本\n    記載屢經本院請被上訴人提出該公司之營業內容、銷售事項\n    、銷售金額之資料（見本院卷(二)第93頁反面)，被上訴人復\n    均未提出，甚且陳明無法提出該資料（見本院卷(二)第109頁)\n    ，揆諸前揭說明，應認熱品公司主張欣友公司前揭銷售有獲\n    利之月份，為侵害系爭專利所得之利益，其餘月份縱有虧損\n    ，亦非應扣除銷售系爭裝置之虧損，應可採信。被上訴人抗\n    辯欣友公司獲利未有300萬元云云，為無理由，不足採信。\n四、綜上所述，熱品公司主張欣友公司生產銷售系爭裝置落入系\n    爭專利範圍，熱品公司依專利法第84條第1項、第2項、第10\n    8條及公司法第23條第2項規定，請求被上訴人連帶賠償上訴\n    人熱品公司300萬元，及自起訴狀繕本送達翌日即94年12月1\n    日起至清償日止，按週年利率百分之五計算之法定遲延利息\n    ，為有理由，應予准許；乙○○請求被上訴人連帶賠償100\n    萬元本息，則屬無據，應予駁回。兩造分別陳明願供擔保准\n    、免假執行宣告，就前開應准許部分，於法並無不合，爰分\n    別酌定相當擔保准許之。至於乙○○敗訴部分，其假執行之\n    聲請失所附麗，應併駁回。原審駁回熱品公司上開應准許部\n    分，另訴外裁判判准被上訴人應連帶給付乙○○300萬元本\n    息，均有未洽，熱品公司上訴、被上訴人附帶上訴，指摘原\n    判決不當，請求廢棄改判，為有理由，爰由本院予以廢棄，\n    其中熱品公司請求部分並改判如主文第二項所示，並依聲請\n    為附條件之准、免假執行宣告。至原審駁回乙○○請求被上\n    訴人連帶給付100萬元本息及假執行之聲請，並無不合。乙\n    ○○上訴意旨指摘原判決此部分不當，求予廢棄改判，為無\n    理由，應予駁回。\n五、本件事證已明，兩造其餘攻擊防禦方法及未經援用之證據，\n    經本院審酌後，核與本件之結論，不生影響，爰不一一贅述\n    ，附此敘明。\n六、據上論結，本件熱品公司上訴、被上訴人附帶上訴，均為有\n    理由，乙○○上訴無理由，依民事訴訟法第450條、第449條\n    第1項、第79條、第85條第2項、第390第2項、第392條第2項\n    、第463條，判決如主文。"
  },
  "characters": {
    "judges": [
      "劉勝吉",
      "鄭威莉",
      "蘇芹英"
    ],
    "prosecutors": [

    ],
    "lawyers": [
      "周嬿容",
      "吳尚昆",
      "李怡卿",
      "洪榮彬",
      "有",
      "人或其他法定代理人具有"
    ],
    "clerks": [
      "林初枝"
    ],
    "plaintiffs": [

    ],
    "defendants": [

    ],
    "prosecutor_office": [

    ],
    "creditors": [

    ],
    "debtors": [

    ],
    "judicial_associate_officer": [

    ]
  },
  "adjudged_at": "2010-01-05",
  "created_at": "2016-01-05 15:04:54",
  "updated_at": "2016-01-05 15:04:54"
}