{
  "identify": "TPH-99-家抗-58-20100512-1",
  "court": {
    "name": "臺灣高等法院",
    "code": "TPH"
  },
  "division": {
    "name": "民事",
    "code": "V"
  },
  "year": 99,
  "word": "家抗",
  "number": "58",
  "jcheck": "1",
  "reason": "保全證據",
  "content": "臺灣高等法院民事裁定                  99年度家抗字第58號\n抗  告  人  甲○○\n代  理  人  尤英夫律師\n            黃宗哲律師\n上列抗告人與相對人乙○○間聲請保全證據事件，對於中華民國\n99年3月31日臺灣臺北地方法院99年度聲字第165號所為裁定提起\n抗告，本院裁定如下：\n    主  文\n抗告駁回。\n抗告訴訟費用由抗告人負擔。\n    理  由\n一、按證據有滅失或礙難使用之虞，或經他造同意者，得向法院\n    聲請保全；就確定事、物之現狀有法律上利益並有必要時，\n    亦得聲請為鑑定、勘驗或保全書證，民事訴訟法第368條第1\n    項定有明文。其立法意旨，係鑑於證據之調查，本應於訴訟\n    繫屬後已達調查之程度，且有調查必要者，始得為之，但於\n    此之前，如該證據有滅失或有礙難使用之虞，卻不能立即調\n    查，將因證據之滅失或情事變更而礙難使用，致影響日後裁\n    判之正確性，故特設此制以為預防。又所謂有滅失之虞，乃\n    指證據有毀滅、喪失之危險，如證人現罹重病，危在旦夕，\n    或機關保管之文書將依法銷毀，證物將因天然或因他造當事\n    人之行為消滅或變更之虞之謂；而所謂礙難使用之虞，係指\n    證據雖未滅失，而因其他客觀情事，致有不及調查之危險之\n    謂，如證人將遠行，或證物將為他造當事人或第三人攜帶出\n    國，雖尚非到達滅失之程度，但已難以使用。\n二、本件抗告人於原法院聲請意旨略以：就原法院99年度重家訴\n    字第3號分配剩餘財產事件，因抗告人家族事業為證人姜鏡\n    泉創立，抗告人名下美國財產大部分實為姜鏡泉所有，僅係\n    借名登記或由姜鏡泉贈與，而證人姜鏡泉已高齡95餘歲，健\n    康狀況不佳，經另案法院屢傳均無法到庭，隨時有喪失陳述\n    能力或猝死之可能，且借名登記並無書面，故此證人為不可\n    取代之證據方法，有保全證據必要等語，固據提出原法院隆\n    家諧98年度婚字第101-0118號函、診斷證明書、委託書、照\n    片等件影本（見本院卷第6、22至27頁）以為釋明，惟抗告\n    人所提診斷證明書，僅得證明證人姜鏡泉年事已高而罹患急\n    性胃腸炎等疾病，惟醫師囑言均僅「宜門診追蹤治療」（見\n    本院卷第23至26頁）；至於上開照片及委託書（見本院卷第\n    22、27頁），亦僅足證明抗告人委任之案外人蔡鴻鈞因相對\n    人之阻隔無法探視證人姜鏡泉，均無法釋明證據有滅失或礙\n    難使用之虞。再者，原法院於另案98年度婚字第101號事件\n    審判長就訊問證人姜鏡泉，雖曾定於99年1月18日前往就訊\n    ，惟因該案離婚部分嗣後成立調解，抗告人已捨棄聲請人證\n    之調查（見本院卷第11至17頁）。況本案（原法院99 年度\n    重家訴字第3號）既已繫屬原法院審理中，已達於可調查證\n    據之程度，抗告人本得於本案隨時聲請訊問證人姜鏡泉，抗\n    告人竟未於本案程序中聲請訊問證人姜鏡泉，有本院公務電\n    話查詢紀錄表1紙附卷可稽（見本院卷第19頁)，反於本件為\n    保全證據之聲請，顯無必要，且有違首揭法條規定之立法意\n    旨。從而，抗告人為本件聲請，與保全證據之要件尚有未合\n    ，不應准許。原法院駁回抗告人之聲請，核無不合，抗告人\n    仍執陳詞，指摘原裁定不當，為無理由，應予駁回。\n四、據上論結，本件抗告為無理由，爰裁定如主文。\n中    華    民    國    99    年    5     月    12    日\n                    民事第十一庭\n                        審判長法  官  鄭雅萍\n                              法  官  劉坤典\n                              法  官  徐福晉\n正本係照原本作成。\n本裁定除以適用法規顯有錯誤為理由外，不得再抗告。如提起再\n抗告，應於收受後10日內委任律師為代理人向本院提出再抗告狀\n。並繳納再抗告費新台幣1000元。\n中    華    民    國    99    年    5     月    14    日\n                              書記官  黃瑞芬",
  "structure": {
    "main": "抗告駁回。\n抗告訴訟費用由抗告人負擔。",
    "reason": "一、按證據有滅失或礙難使用之虞，或經他造同意者，得向法院\n    聲請保全；就確定事、物之現狀有法律上利益並有必要時，\n    亦得聲請為鑑定、勘驗或保全書證，民事訴訟法第368條第1\n    項定有明文。其立法意旨，係鑑於證據之調查，本應於訴訟\n    繫屬後已達調查之程度，且有調查必要者，始得為之，但於\n    此之前，如該證據有滅失或有礙難使用之虞，卻不能立即調\n    查，將因證據之滅失或情事變更而礙難使用，致影響日後裁\n    判之正確性，故特設此制以為預防。又所謂有滅失之虞，乃\n    指證據有毀滅、喪失之危險，如證人現罹重病，危在旦夕，\n    或機關保管之文書將依法銷毀，證物將因天然或因他造當事\n    人之行為消滅或變更之虞之謂；而所謂礙難使用之虞，係指\n    證據雖未滅失，而因其他客觀情事，致有不及調查之危險之\n    謂，如證人將遠行，或證物將為他造當事人或第三人攜帶出\n    國，雖尚非到達滅失之程度，但已難以使用。\n二、本件抗告人於原法院聲請意旨略以：就原法院99年度重家訴\n    字第3號分配剩餘財產事件，因抗告人家族事業為證人姜鏡\n    泉創立，抗告人名下美國財產大部分實為姜鏡泉所有，僅係\n    借名登記或由姜鏡泉贈與，而證人姜鏡泉已高齡95餘歲，健\n    康狀況不佳，經另案法院屢傳均無法到庭，隨時有喪失陳述\n    能力或猝死之可能，且借名登記並無書面，故此證人為不可\n    取代之證據方法，有保全證據必要等語，固據提出原法院隆\n    家諧98年度婚字第101-0118號函、診斷證明書、委託書、照\n    片等件影本（見本院卷第6、22至27頁）以為釋明，惟抗告\n    人所提診斷證明書，僅得證明證人姜鏡泉年事已高而罹患急\n    性胃腸炎等疾病，惟醫師囑言均僅「宜門診追蹤治療」（見\n    本院卷第23至26頁）；至於上開照片及委託書（見本院卷第\n    22、27頁），亦僅足證明抗告人委任之案外人蔡鴻鈞因相對\n    人之阻隔無法探視證人姜鏡泉，均無法釋明證據有滅失或礙\n    難使用之虞。再者，原法院於另案98年度婚字第101號事件\n    審判長就訊問證人姜鏡泉，雖曾定於99年1月18日前往就訊\n    ，惟因該案離婚部分嗣後成立調解，抗告人已捨棄聲請人證\n    之調查（見本院卷第11至17頁）。況本案（原法院99 年度\n    重家訴字第3號）既已繫屬原法院審理中，已達於可調查證\n    據之程度，抗告人本得於本案隨時聲請訊問證人姜鏡泉，抗\n    告人竟未於本案程序中聲請訊問證人姜鏡泉，有本院公務電\n    話查詢紀錄表1紙附卷可稽（見本院卷第19頁)，反於本件為\n    保全證據之聲請，顯無必要，且有違首揭法條規定之立法意\n    旨。從而，抗告人為本件聲請，與保全證據之要件尚有未合\n    ，不應准許。原法院駁回抗告人之聲請，核無不合，抗告人\n    仍執陳詞，指摘原裁定不當，為無理由，應予駁回。\n四、據上論結，本件抗告為無理由，爰裁定如主文。"
  },
  "characters": {
    "judges": [
      "鄭雅萍",
      "劉坤典",
      "徐福晉"
    ],
    "prosecutors": [

    ],
    "lawyers": [
      "尤英夫",
      "黃宗哲"
    ],
    "clerks": [

    ],
    "plaintiffs": [

    ],
    "defendants": [

    ],
    "prosecutor_office": [

    ],
    "creditors": [

    ],
    "debtors": [

    ],
    "judicial_associate_officer": [

    ]
  },
  "adjudged_at": "2010-05-12",
  "created_at": "2016-01-05 11:56:27",
  "updated_at": "2016-01-05 11:56:27"
}