{
  "identify": "TPH-98-上易-715-20100105-1",
  "court": {
    "name": "臺灣高等法院",
    "code": "TPH"
  },
  "division": {
    "name": "民事",
    "code": "V"
  },
  "year": 98,
  "word": "上易",
  "number": "715",
  "jcheck": "1",
  "reason": "損害賠償",
  "content": "臺灣高等法院民事判決                 98年度上易字第715號\n上  訴  人  乙○○\n訴訟代理人  吳茂雄律師\n            吳雨學律師\n被 上 訴人  丁○○\n            丙○○\n共      同\n訴訟代理人  高涌誠律師\n            許樹欣律師\n            黃旭田律師\n上列當事人間請求損害賠償事件，上訴人對於中華民國98年6月\n10日臺灣臺北地方法院98年度訴字第113號第一審判決提起上訴\n，本院於98年12月22日言詞辯論終結，判決如下：\n    主  文\n上訴駁回。\n第二審訴訟費用由上訴人負擔。\n    事實及理由\n一、上訴人主張：伊先父王殷周於民國九十年六月二十九日過世\n    ，伊受全體繼承人委託處理王殷周所留坐落臺北市南港區及\n    臺北縣深坑鄉等四十四筆土地（下稱系爭土地）之遺產繼承\n    事宜，乃於九十一年一月三日委託被上訴人辦理遺產申報及\n    繼承登記。嗣被上訴人告知需繳納遺產稅新臺幣（下同）一\n    千一百三十六萬六千六百三十四元，雖經伊當面質疑農牧用\n    地應免繳遺產稅，然被上訴人堅稱一定要繳納，伊不得已以\n    現金及等值土地作價抵稅。其後伊解除兩造間之委任契約，\n    另委任訴外人李戈登代書接手辦理，經多方奔波，終經稅捐\n    機關核定免徵遺產稅，並將繳稅現金及抵稅土地返還予伊。\n    被上訴人均為執業多年之土地代書，具專業素養，理應熟稔\n    土地登記及稅務相關法規，未予詳查，執意系爭土地需繳納\n    遺產稅，事後又未協助爭取抵稅土地之歸還，被上訴人處理\n    委任事務顯有過失，不法侵害伊之權利，致伊受有二百萬元\n    之損害。爰依民法第五百四十四條、第一百八十四條第一項\n    前段之規定，求為命被上訴人應給付（原判決誤載為連帶給\n    付）上訴人二百萬元之判決等語。\n二、被上訴人則以：上訴人於九十一年間委託訴外人潘耀明（即\n    被上訴人丁○○之弟、丙○○之兄）辦理系爭土地之遺產繼\n    承登記相關事宜，伊二人僅係潘耀明事務所內處理聯絡、送\n    件、領件等行政事務之員工，兩造間並無委任關係存在。遑\n    論被上訴人丁○○並無地政士之資格，亦未加入任何地政士\n    公會，無從接受上訴人委託處理上開事宜。而於潘耀明受委\n    任期間，上訴人從未提出系爭土地係供農業使用之證明書，\n    實因有繼承人表示第三人欲購買部分系爭土地，為求迅速辦\n    理繼承登記以便出售，全體繼承人方同意辦理等值土地作價\n    抵稅，潘耀明亦無任何違法或疏失之處。而上訴人對其所受\n    損害均未舉證證明，且稅捐機關早於九十六年間即將繳稅之\n    現金、抵稅土地返還上訴人，自未發生任何損害等語，資為\n    抗辯。\n三、原審判決上訴人全部敗訴，上訴人就原審駁回其請求七十萬\n    元損害賠償部分不服，提起上訴，其於本院上訴聲明為：(一)\n    原判決關於駁回上訴人後開第二項之訴部分廢棄。(二)被上訴\n    人應給付上訴人七十萬元。被上訴人於本院答辯聲明為：上\n    訴駁回。\n四、兩造不爭執事實：\n  (一)九十年六月間被繼承人王殷周死亡，上訴人等繼承人共同繼\n    承系爭土地之遺產。\n  (二)上訴人等繼承人於九十一年一月委託辦理遺產申報及繼承登\n    記後，計算應繳納遺產稅一千一百三十六萬六千六百三十四\n    元，上訴人等繼承人繳納現金四十二萬一千二百六十六元，\n    其餘一千零九十四萬五千三百六十八元則以系爭土地中坐落\n    臺北市○○區○○段三小段五六二地號之土地抵繳。\n  (三)上訴人等繼承人應納稅額嗣經上訴人申請更正後已核定遺產\n    淨額為０元，前開繳納之現金及抵稅土地均經稅捐單位返還\n    。\n五、上訴人主張兩造間就系爭土地繼承登記相關事宜存在委任契\n    約關係，被上訴人於處理遺產稅額核定及繳納有過失，致伊\n    另行委任代書辦理，支出代書費五萬元，五年期間內往返各\n    行政單位支出交通、食宿費二十五萬元，另其精神上倍受痛\n    苦，受有非財產上之損害四十萬元，依委任契約、侵權行為\n    之法律關係，其得請求被上訴人賠償上開合計七十萬元之損\n    害等情，為被上訴人所否認，並以前開情詞置辯。是以本件\n    首應審究之爭點厥為兩造間就系爭土地繼承登記相關事宜有\n    無存在委任契約關係？茲詳述如下：\n  (一)按當事人主張有利於己之事實者，就其事實有舉證之責任，\n    民事訴訟法第二百七十七條定有明文。又主張法律關係存在\n    之當事人，就該法律關係發生所須具備之特別要件，應負舉\n    證之責任，原告就其主張之事實，不舉證證明者，被告無須\n    就其抗辯之事實，負舉證之責任，此為舉證責任分擔原則。\n    本件上訴人主張其委任被上訴人處理系爭土地繼承登記相關\n    事宜，兩造間存在委任契約之法律關係，依上說明，自應就\n    此事實負舉證責任。\n  (二)上訴人主張其與被上訴人間有委任契約關係存在，無非以其\n    僅認識被上訴人丁○○，不認識潘耀明，其於九十一年間持\n    系爭土地權狀至「潘代書」事務所委請被上訴人丁○○處理\n    系爭土地繼承登記事宜，眾所皆知「潘代書」即指被上訴人\n    丁○○，並有被上訴人丁○○親書之同意書可稽，復經證人\n    甲○○○證述在卷，另被上訴人丁○○於當時仍具地政士資\n    格，且於臺灣臺北地方法院檢察署九十七年度偵字第一一二\n    六號刑事背信案件偵查中陳稱上訴人與伊接洽，要辦理遺產\n    事宜，伊有辦理完成等語，甚且於地政士公會協調時認錯道\n    歉為據。查，依上訴人提出之同意書（見本院卷第21頁），\n    僅足證明被上訴人丁○○書寫該份文書，然被上訴人丁○○\n    乃在潘耀明事務所內處理聯絡、送件、領件等行政事務之員\n    工（詳後述），非無可能書立該份文書。而證人甲○○○證\n    稱去過潘代書事務所二次，是丁○○通知的，第一次是拿所\n    有權狀回來，第二次是繳交辦理本件相關費用。丁○○坐在\n    最大位置，伊小嬸說潘代書就是丁○○。丁○○有說馬上可\n    以辦好了，就可以分錢等語（見本院卷65、66頁），亦僅足\n    證明被上訴人丁○○有經辦本件繼承登記相關事務，惟尚不\n    足據以證明上訴人與被上訴人丁○○間或兩造間存在本件委\n    任契約關係。又上訴人主張「潘代書」即被上訴人丁○○，\n    為眾所週知之事實，惟為被上訴人所否認，上訴人未提出證\n    據證明此屬週知事實，已非無疑。縱上訴人主張「潘代書」\n    即為被上訴人丁○○，上訴人至「潘代書」事務所首先與被\n    上訴人丁○○接洽屬實，然此與將本件繼承事務委任辦理成\n    立委任契約，核屬兩事，尚不得據此推定委任契約之存在。\n    另上訴人主張被上訴人丁○○於前開背信案件偵查中陳稱上\n    訴人與其接洽，要辦理遺產事宜，其有辦理完成，並於地政\n    士公會協調時認錯道歉，足以證明其與被上訴人間成立委任\n    契約等語，然前開臺灣臺北地方法院檢察署九十七年度偵字\n    第一一二六號案件係上訴人就本件辦理系爭土地繼承登記同\n    一事實對潘耀明及被上訴人丙○○、丁○○提出背信告訴，\n    被上訴人丁○○於該偵查案件中係供稱：沒有簽契約，是伊\n    跟上訴人接洽的，就是口頭上上訴人把資料拿給伊辦遺產事\n    宜，後來伊有幫他辦理完成，伊弟弟潘耀明是主辦，複代理\n    人是丙○○等語，此經原審依職權調閱該卷宗核對（見前開\n    偵查卷第176頁）無訛，可見被上訴人丁○○於偵查案件中\n    亦否認委任契約關係存在，上訴人截取部分說詞所為單方之\n    陳述，不足據為有利於上訴人之認定。而被上訴人丁○○於\n    地政士公會協調時縱有道歉認錯之情，係出於曾接洽辦理系\n    爭土地繼承事宜而為，上訴人據以認定與被上訴人潘玉惠間\n    有委任契約關係，尚非可採。\n  (三)至上訴人主張其與被上訴人丙○○間存在委任契約關係部分\n    ，係以申請土地登記時有被上訴人丙○○印章（見原審卷第\n    143頁）為據，顯見上訴人亦肯認土地登記申請書之真正。\n    依被上訴人提出本件土地登記申請書（見原審卷第47頁）記\n    載「……(7)委任關係：本土地登記之申請委託潘耀明代理，\n    丙○○複代理……」；又依前開背信偵查案件內財政部臺灣\n    省北區國稅局新店稽徵所九十六年六月二十日北區國稅新店\n    一字第０九六０００七四八七號函所附本件遺產稅案件申報\n    委任書上記載「……茲為被繼承人王殷周遺產稅案，特委任\n    潘耀明君處理下列事務：一代為辦理遺產稅申報之一切事宜\n    。二代理受領遺產稅繳款書、核定通知書、繳清證明書及其\n    他有關文件.……」，並蓋有上訴人之印文（見該偵查卷第\n    34頁），可見上訴人確係委任潘耀明處理系爭土地繼承相關\n    事宜。上訴人雖主張該委任書係由被上訴人丁○○自行蓋印\n    ，不足據為認定委任契約關係之存在云云。惟上訴人對於委\n    任書上之自己與其他共同繼承人印文之真正均不爭執，就用\n    印人為被上訴人丁○○且違反上訴人意思所為之事實，均未\n    能舉證以實其說，自不足證明委任書為被上訴人丁○○逾越\n    上訴人授權範圍所為，而否定上訴人與潘耀明間有委任契約\n    關係存在。再參諸上訴人為智慮成熟的成年人，對於交付印\n    章予他人「在遺產稅申報委任書上蓋印」，代表「授權該人\n    辦理遺產稅事宜」不可謂不知，上訴人既蓋印同意授權潘耀\n    明辦理，卻又主張係口頭委任被上訴人丁○○辦理，但對於\n    如何口頭上委任被上訴人丁○○之事實，僅上訴人片面之詞\n    ，且主張口頭委任之事實，復與其依前開土地登記申請書主\n    張與被上訴人丙○○間存在委任契約關係不相容，是上訴人\n    主張即有矛盾，而不足採信。\n  (四)又本件上訴人委由潘耀明辦理繼承登記事宜時，被上訴人丁\n    ○○雖具有開業地政士身分，然被上訴人抗辯渠等受僱於潘\n    耀明，協助潘耀明聯絡當事人、送件、領件及處理文書業務\n    ，已據被上訴人提出勞工保險加報申報表為證（見原審卷第\n    50頁），堪信被上訴人二人均係潘代書事務所之員工，尚非\n    主辦系爭遺產繼承之人。雖委任契約非為要式契約，縱被上\n    訴人於本件繼承登記事宜處理過程中曾與上訴人或其他繼承\n    人有接洽，乃本於員工身分所為，並非不可能，自不得據此\n    即否定上訴人與潘耀明間之委任關係，而認委任契約應存在\n    於兩造間。\n  (五)是則，依上訴人提出之證據尚不足證明其口頭委任被上訴人\n    丁○○處理本件遺產繼承登記事務，或其與被上訴人二人間\n    存在本件處理遺產繼承登記委任契約關係。被上訴人抗辯委\n    任契約存在於上訴人與潘耀明之間，尚屬非虛。\n六、本件上訴人未能證明兩造間存在遺產繼承委任契約關係，關\n    於被上訴人處理遺產繼承事務，是否有過失，並致上訴人受\n    有損害，均無庸審究。縱假設被上訴人受上訴人委任處理本\n    件遺產繼承事務，系爭土地中之臺北市○○區○○段三小段\n    五六二地號土地為農地，然上訴人未提出農地作農業使用之\n    證明書，亦未委請申辦農業使用之證明，以免繳遺產稅，已\n    據上訴人於偵查中陳述明確（見前開偵查案不起訴處分書，\n    原審卷第75頁）。而上訴人主張其曾向被上訴人丁○○質疑\n    農地免繳遺產稅等語，既為被上訴人所否認，上訴人復未能\n    舉證證明，尚難信實。且被上訴人抗辯有部分繼承人表示第\n    三人擬購買系爭土地中坐落臺北縣深坑鄉○○段大坪小段一\n    之九地號等數筆土地，希迅速辦理繼承登記以便出售，亦非\n    無可能。則被上訴人於辦理遺產申報及繼承登記時，將前開\n    農地用以抵繳遺產稅，顯係基於相關稅法規定之正常處理方\n    式，難謂有何過失。且依上訴人所陳於解除委任契約後，另\n    委任訴外人李戈登代書處理，就前開農地委請申辦農業使用\n    證明書並獲准（見上訴人提出之相關資料，原審卷第115 至\n    137頁），因而免繳遺產稅，亦係依相關法規所為，上訴人\n    等全體繼承人業已取得退還之稅款現金四十二萬一千二百六\n    十六元及前開農地之所有權，難謂上訴人受有損害，並與被\n    上訴人之行為間有因果關係。上訴人依民法第五百四十四條\n    、第一百八十四條第一項規定，請求被上訴人賠償支出代書\n    費五萬元，五年期間內往返各行政單位所支出交通、食宿費\n    二十五萬元，及慰撫金四十萬元，均非有據，併予敘明。\n七、綜上所述，上訴人主張本於民法第五百四十四條委任契約之\n    法律關係與同法第一百八十四條第一項前段之侵權行為法律\n    關係，請求被上訴人給付七十萬元，為無理由，不應准許。\n    原審就此為上訴人敗訴之判決，並無不合。上訴意旨指摘原\n    判決此部分不當，求予廢棄改判，為無理由，應予駁回。\n八、本件兩造間無處理系爭土地遺產繼承登記委任契約關係存在\n    之事實已明，兩造其餘攻擊防禦方法及未經援用之證據，經\n    審酌後核與判決結果不生影響，爰不一一論述，附此敘明。\n據上論結，本件上訴為無理由。依民事訴訟法第四百四十九條第\n一項、第七十八條，判決如主文。\n中    華    民    國    99    年    1     月    5     日\n                  民事第十庭\n                        審判長法  官  黃豐澤\n                              法  官  吳謀焰\n                              法  官  林麗玲\n正本係照原本作成。\n不得上訴。\n中    華    民    國    99    年    1     月    5     日\n                              書記官  陶美玲",
  "structure": {
    "main": "上訴駁回。\n第二審訴訟費用由上訴人負擔。",
    "fact": "一、上訴人主張：伊先父王殷周於民國九十年六月二十九日過世\n    ，伊受全體繼承人委託處理王殷周所留坐落臺北市南港區及\n    臺北縣深坑鄉等四十四筆土地（下稱系爭土地）之遺產繼承\n    事宜，乃於九十一年一月三日委託被上訴人辦理遺產申報及\n    繼承登記。嗣被上訴人告知需繳納遺產稅新臺幣（下同）一\n    千一百三十六萬六千六百三十四元，雖經伊當面質疑農牧用\n    地應免繳遺產稅，然被上訴人堅稱一定要繳納，伊不得已以\n    現金及等值土地作價抵稅。其後伊解除兩造間之委任契約，\n    另委任訴外人李戈登代書接手辦理，經多方奔波，終經稅捐\n    機關核定免徵遺產稅，並將繳稅現金及抵稅土地返還予伊。\n    被上訴人均為執業多年之土地代書，具專業素養，理應熟稔\n    土地登記及稅務相關法規，未予詳查，執意系爭土地需繳納\n    遺產稅，事後又未協助爭取抵稅土地之歸還，被上訴人處理\n    委任事務顯有過失，不法侵害伊之權利，致伊受有二百萬元\n    之損害。爰依民法第五百四十四條、第一百八十四條第一項\n    前段之規定，求為命被上訴人應給付（原判決誤載為連帶給\n    付）上訴人二百萬元之判決等語。\n二、被上訴人則以：上訴人於九十一年間委託訴外人潘耀明（即\n    被上訴人丁○○之弟、丙○○之兄）辦理系爭土地之遺產繼\n    承登記相關事宜，伊二人僅係潘耀明事務所內處理聯絡、送\n    件、領件等行政事務之員工，兩造間並無委任關係存在。遑\n    論被上訴人丁○○並無地政士之資格，亦未加入任何地政士\n    公會，無從接受上訴人委託處理上開事宜。而於潘耀明受委\n    任期間，上訴人從未提出系爭土地係供農業使用之證明書，\n    實因有繼承人表示第三人欲購買部分系爭土地，為求迅速辦\n    理繼承登記以便出售，全體繼承人方同意辦理等值土地作價\n    抵稅，潘耀明亦無任何違法或疏失之處。而上訴人對其所受\n    損害均未舉證證明，且稅捐機關早於九十六年間即將繳稅之\n    現金、抵稅土地返還上訴人，自未發生任何損害等語，資為\n    抗辯。\n三、原審判決上訴人全部敗訴，上訴人就原審駁回其請求七十萬\n    元損害賠償部分不服，提起上訴，其於本院上訴聲明為：(一)\n    原判決關於駁回上訴人後開第二項之訴部分廢棄。(二)被上訴\n    人應給付上訴人七十萬元。被上訴人於本院答辯聲明為：上\n    訴駁回。\n四、兩造不爭執事實：\n  (一)九十年六月間被繼承人王殷周死亡，上訴人等繼承人共同繼\n    承系爭土地之遺產。\n  (二)上訴人等繼承人於九十一年一月委託辦理遺產申報及繼承登\n    記後，計算應繳納遺產稅一千一百三十六萬六千六百三十四\n    元，上訴人等繼承人繳納現金四十二萬一千二百六十六元，\n    其餘一千零九十四萬五千三百六十八元則以系爭土地中坐落\n    臺北市○○區○○段三小段五六二地號之土地抵繳。\n  (三)上訴人等繼承人應納稅額嗣經上訴人申請更正後已核定遺產\n    淨額為０元，前開繳納之現金及抵稅土地均經稅捐單位返還\n    。\n五、上訴人主張兩造間就系爭土地繼承登記相關事宜存在委任契\n    約關係，被上訴人於處理遺產稅額核定及繳納有過失，致伊\n    另行委任代書辦理，支出代書費五萬元，五年期間內往返各\n    行政單位支出交通、食宿費二十五萬元，另其精神上倍受痛\n    苦，受有非財產上之損害四十萬元，依委任契約、侵權行為\n    之法律關係，其得請求被上訴人賠償上開合計七十萬元之損\n    害等情，為被上訴人所否認，並以前開情詞置辯。是以本件\n    首應審究之爭點厥為兩造間就系爭土地繼承登記相關事宜有\n    無存在委任契約關係？茲詳述如下：\n  (一)按當事人主張有利於己之事實者，就其事實有舉證之責任，\n    民事訴訟法第二百七十七條定有明文。又主張法律關係存在\n    之當事人，就該法律關係發生所須具備之特別要件，應負舉\n    證之責任，原告就其主張之事實，不舉證證明者，被告無須\n    就其抗辯之事實，負舉證之責任，此為舉證責任分擔原則。\n    本件上訴人主張其委任被上訴人處理系爭土地繼承登記相關\n    事宜，兩造間存在委任契約之法律關係，依上說明，自應就\n    此事實負舉證責任。\n  (二)上訴人主張其與被上訴人間有委任契約關係存在，無非以其\n    僅認識被上訴人丁○○，不認識潘耀明，其於九十一年間持\n    系爭土地權狀至「潘代書」事務所委請被上訴人丁○○處理\n    系爭土地繼承登記事宜，眾所皆知「潘代書」即指被上訴人\n    丁○○，並有被上訴人丁○○親書之同意書可稽，復經證人\n    甲○○○證述在卷，另被上訴人丁○○於當時仍具地政士資\n    格，且於臺灣臺北地方法院檢察署九十七年度偵字第一一二\n    六號刑事背信案件偵查中陳稱上訴人與伊接洽，要辦理遺產\n    事宜，伊有辦理完成等語，甚且於地政士公會協調時認錯道\n    歉為據。查，依上訴人提出之同意書（見本院卷第21頁），\n    僅足證明被上訴人丁○○書寫該份文書，然被上訴人丁○○\n    乃在潘耀明事務所內處理聯絡、送件、領件等行政事務之員\n    工（詳後述），非無可能書立該份文書。而證人甲○○○證\n    稱去過潘代書事務所二次，是丁○○通知的，第一次是拿所\n    有權狀回來，第二次是繳交辦理本件相關費用。丁○○坐在\n    最大位置，伊小嬸說潘代書就是丁○○。丁○○有說馬上可\n    以辦好了，就可以分錢等語（見本院卷65、66頁），亦僅足\n    證明被上訴人丁○○有經辦本件繼承登記相關事務，惟尚不\n    足據以證明上訴人與被上訴人丁○○間或兩造間存在本件委\n    任契約關係。又上訴人主張「潘代書」即被上訴人丁○○，\n    為眾所週知之事實，惟為被上訴人所否認，上訴人未提出證\n    據證明此屬週知事實，已非無疑。縱上訴人主張「潘代書」\n    即為被上訴人丁○○，上訴人至「潘代書」事務所首先與被\n    上訴人丁○○接洽屬實，然此與將本件繼承事務委任辦理成\n    立委任契約，核屬兩事，尚不得據此推定委任契約之存在。\n    另上訴人主張被上訴人丁○○於前開背信案件偵查中陳稱上\n    訴人與其接洽，要辦理遺產事宜，其有辦理完成，並於地政\n    士公會協調時認錯道歉，足以證明其與被上訴人間成立委任\n    契約等語，然前開臺灣臺北地方法院檢察署九十七年度偵字\n    第一一二六號案件係上訴人就本件辦理系爭土地繼承登記同\n    一事實對潘耀明及被上訴人丙○○、丁○○提出背信告訴，\n    被上訴人丁○○於該偵查案件中係供稱：沒有簽契約，是伊\n    跟上訴人接洽的，就是口頭上上訴人把資料拿給伊辦遺產事\n    宜，後來伊有幫他辦理完成，伊弟弟潘耀明是主辦，複代理\n    人是丙○○等語，此經原審依職權調閱該卷宗核對（見前開\n    偵查卷第176頁）無訛，可見被上訴人丁○○於偵查案件中\n    亦否認委任契約關係存在，上訴人截取部分說詞所為單方之\n    陳述，不足據為有利於上訴人之認定。而被上訴人丁○○於\n    地政士公會協調時縱有道歉認錯之情，係出於曾接洽辦理系\n    爭土地繼承事宜而為，上訴人據以認定與被上訴人潘玉惠間\n    有委任契約關係，尚非可採。\n  (三)至上訴人主張其與被上訴人丙○○間存在委任契約關係部分\n    ，係以申請土地登記時有被上訴人丙○○印章（見原審卷第\n    143頁）為據，顯見上訴人亦肯認土地登記申請書之真正。\n    依被上訴人提出本件土地登記申請書（見原審卷第47頁）記\n    載「……(7)委任關係：本土地登記之申請委託潘耀明代理，\n    丙○○複代理……」；又依前開背信偵查案件內財政部臺灣\n    省北區國稅局新店稽徵所九十六年六月二十日北區國稅新店\n    一字第０九六０００七四八七號函所附本件遺產稅案件申報\n    委任書上記載「……茲為被繼承人王殷周遺產稅案，特委任\n    潘耀明君處理下列事務：一代為辦理遺產稅申報之一切事宜\n    。二代理受領遺產稅繳款書、核定通知書、繳清證明書及其\n    他有關文件.……」，並蓋有上訴人之印文（見該偵查卷第\n    34頁），可見上訴人確係委任潘耀明處理系爭土地繼承相關\n    事宜。上訴人雖主張該委任書係由被上訴人丁○○自行蓋印\n    ，不足據為認定委任契約關係之存在云云。惟上訴人對於委\n    任書上之自己與其他共同繼承人印文之真正均不爭執，就用\n    印人為被上訴人丁○○且違反上訴人意思所為之事實，均未\n    能舉證以實其說，自不足證明委任書為被上訴人丁○○逾越\n    上訴人授權範圍所為，而否定上訴人與潘耀明間有委任契約\n    關係存在。再參諸上訴人為智慮成熟的成年人，對於交付印\n    章予他人「在遺產稅申報委任書上蓋印」，代表「授權該人\n    辦理遺產稅事宜」不可謂不知，上訴人既蓋印同意授權潘耀\n    明辦理，卻又主張係口頭委任被上訴人丁○○辦理，但對於\n    如何口頭上委任被上訴人丁○○之事實，僅上訴人片面之詞\n    ，且主張口頭委任之事實，復與其依前開土地登記申請書主\n    張與被上訴人丙○○間存在委任契約關係不相容，是上訴人\n    主張即有矛盾，而不足採信。\n  (四)又本件上訴人委由潘耀明辦理繼承登記事宜時，被上訴人丁\n    ○○雖具有開業地政士身分，然被上訴人抗辯渠等受僱於潘\n    耀明，協助潘耀明聯絡當事人、送件、領件及處理文書業務\n    ，已據被上訴人提出勞工保險加報申報表為證（見原審卷第\n    50頁），堪信被上訴人二人均係潘代書事務所之員工，尚非\n    主辦系爭遺產繼承之人。雖委任契約非為要式契約，縱被上\n    訴人於本件繼承登記事宜處理過程中曾與上訴人或其他繼承\n    人有接洽，乃本於員工身分所為，並非不可能，自不得據此\n    即否定上訴人與潘耀明間之委任關係，而認委任契約應存在\n    於兩造間。\n  (五)是則，依上訴人提出之證據尚不足證明其口頭委任被上訴人\n    丁○○處理本件遺產繼承登記事務，或其與被上訴人二人間\n    存在本件處理遺產繼承登記委任契約關係。被上訴人抗辯委\n    任契約存在於上訴人與潘耀明之間，尚屬非虛。\n六、本件上訴人未能證明兩造間存在遺產繼承委任契約關係，關\n    於被上訴人處理遺產繼承事務，是否有過失，並致上訴人受\n    有損害，均無庸審究。縱假設被上訴人受上訴人委任處理本\n    件遺產繼承事務，系爭土地中之臺北市○○區○○段三小段\n    五六二地號土地為農地，然上訴人未提出農地作農業使用之\n    證明書，亦未委請申辦農業使用之證明，以免繳遺產稅，已\n    據上訴人於偵查中陳述明確（見前開偵查案不起訴處分書，\n    原審卷第75頁）。而上訴人主張其曾向被上訴人丁○○質疑\n    農地免繳遺產稅等語，既為被上訴人所否認，上訴人復未能\n    舉證證明，尚難信實。且被上訴人抗辯有部分繼承人表示第\n    三人擬購買系爭土地中坐落臺北縣深坑鄉○○段大坪小段一\n    之九地號等數筆土地，希迅速辦理繼承登記以便出售，亦非\n    無可能。則被上訴人於辦理遺產申報及繼承登記時，將前開\n    農地用以抵繳遺產稅，顯係基於相關稅法規定之正常處理方\n    式，難謂有何過失。且依上訴人所陳於解除委任契約後，另\n    委任訴外人李戈登代書處理，就前開農地委請申辦農業使用\n    證明書並獲准（見上訴人提出之相關資料，原審卷第115 至\n    137頁），因而免繳遺產稅，亦係依相關法規所為，上訴人\n    等全體繼承人業已取得退還之稅款現金四十二萬一千二百六\n    十六元及前開農地之所有權，難謂上訴人受有損害，並與被\n    上訴人之行為間有因果關係。上訴人依民法第五百四十四條\n    、第一百八十四條第一項規定，請求被上訴人賠償支出代書\n    費五萬元，五年期間內往返各行政單位所支出交通、食宿費\n    二十五萬元，及慰撫金四十萬元，均非有據，併予敘明。\n七、綜上所述，上訴人主張本於民法第五百四十四條委任契約之\n    法律關係與同法第一百八十四條第一項前段之侵權行為法律\n    關係，請求被上訴人給付七十萬元，為無理由，不應准許。\n    原審就此為上訴人敗訴之判決，並無不合。上訴意旨指摘原\n    判決此部分不當，求予廢棄改判，為無理由，應予駁回。\n八、本件兩造間無處理系爭土地遺產繼承登記委任契約關係存在\n    之事實已明，兩造其餘攻擊防禦方法及未經援用之證據，經\n    審酌後核與判決結果不生影響，爰不一一論述，附此敘明。\n據上論結，本件上訴為無理由。依民事訴訟法第四百四十九條第\n一項、第七十八條，判決如主文。",
    "reason": "一、上訴人主張：伊先父王殷周於民國九十年六月二十九日過世\n    ，伊受全體繼承人委託處理王殷周所留坐落臺北市南港區及\n    臺北縣深坑鄉等四十四筆土地（下稱系爭土地）之遺產繼承\n    事宜，乃於九十一年一月三日委託被上訴人辦理遺產申報及\n    繼承登記。嗣被上訴人告知需繳納遺產稅新臺幣（下同）一\n    千一百三十六萬六千六百三十四元，雖經伊當面質疑農牧用\n    地應免繳遺產稅，然被上訴人堅稱一定要繳納，伊不得已以\n    現金及等值土地作價抵稅。其後伊解除兩造間之委任契約，\n    另委任訴外人李戈登代書接手辦理，經多方奔波，終經稅捐\n    機關核定免徵遺產稅，並將繳稅現金及抵稅土地返還予伊。\n    被上訴人均為執業多年之土地代書，具專業素養，理應熟稔\n    土地登記及稅務相關法規，未予詳查，執意系爭土地需繳納\n    遺產稅，事後又未協助爭取抵稅土地之歸還，被上訴人處理\n    委任事務顯有過失，不法侵害伊之權利，致伊受有二百萬元\n    之損害。爰依民法第五百四十四條、第一百八十四條第一項\n    前段之規定，求為命被上訴人應給付（原判決誤載為連帶給\n    付）上訴人二百萬元之判決等語。\n二、被上訴人則以：上訴人於九十一年間委託訴外人潘耀明（即\n    被上訴人丁○○之弟、丙○○之兄）辦理系爭土地之遺產繼\n    承登記相關事宜，伊二人僅係潘耀明事務所內處理聯絡、送\n    件、領件等行政事務之員工，兩造間並無委任關係存在。遑\n    論被上訴人丁○○並無地政士之資格，亦未加入任何地政士\n    公會，無從接受上訴人委託處理上開事宜。而於潘耀明受委\n    任期間，上訴人從未提出系爭土地係供農業使用之證明書，\n    實因有繼承人表示第三人欲購買部分系爭土地，為求迅速辦\n    理繼承登記以便出售，全體繼承人方同意辦理等值土地作價\n    抵稅，潘耀明亦無任何違法或疏失之處。而上訴人對其所受\n    損害均未舉證證明，且稅捐機關早於九十六年間即將繳稅之\n    現金、抵稅土地返還上訴人，自未發生任何損害等語，資為\n    抗辯。\n三、原審判決上訴人全部敗訴，上訴人就原審駁回其請求七十萬\n    元損害賠償部分不服，提起上訴，其於本院上訴聲明為：(一)\n    原判決關於駁回上訴人後開第二項之訴部分廢棄。(二)被上訴\n    人應給付上訴人七十萬元。被上訴人於本院答辯聲明為：上\n    訴駁回。\n四、兩造不爭執事實：\n  (一)九十年六月間被繼承人王殷周死亡，上訴人等繼承人共同繼\n    承系爭土地之遺產。\n  (二)上訴人等繼承人於九十一年一月委託辦理遺產申報及繼承登\n    記後，計算應繳納遺產稅一千一百三十六萬六千六百三十四\n    元，上訴人等繼承人繳納現金四十二萬一千二百六十六元，\n    其餘一千零九十四萬五千三百六十八元則以系爭土地中坐落\n    臺北市○○區○○段三小段五六二地號之土地抵繳。\n  (三)上訴人等繼承人應納稅額嗣經上訴人申請更正後已核定遺產\n    淨額為０元，前開繳納之現金及抵稅土地均經稅捐單位返還\n    。\n五、上訴人主張兩造間就系爭土地繼承登記相關事宜存在委任契\n    約關係，被上訴人於處理遺產稅額核定及繳納有過失，致伊\n    另行委任代書辦理，支出代書費五萬元，五年期間內往返各\n    行政單位支出交通、食宿費二十五萬元，另其精神上倍受痛\n    苦，受有非財產上之損害四十萬元，依委任契約、侵權行為\n    之法律關係，其得請求被上訴人賠償上開合計七十萬元之損\n    害等情，為被上訴人所否認，並以前開情詞置辯。是以本件\n    首應審究之爭點厥為兩造間就系爭土地繼承登記相關事宜有\n    無存在委任契約關係？茲詳述如下：\n  (一)按當事人主張有利於己之事實者，就其事實有舉證之責任，\n    民事訴訟法第二百七十七條定有明文。又主張法律關係存在\n    之當事人，就該法律關係發生所須具備之特別要件，應負舉\n    證之責任，原告就其主張之事實，不舉證證明者，被告無須\n    就其抗辯之事實，負舉證之責任，此為舉證責任分擔原則。\n    本件上訴人主張其委任被上訴人處理系爭土地繼承登記相關\n    事宜，兩造間存在委任契約之法律關係，依上說明，自應就\n    此事實負舉證責任。\n  (二)上訴人主張其與被上訴人間有委任契約關係存在，無非以其\n    僅認識被上訴人丁○○，不認識潘耀明，其於九十一年間持\n    系爭土地權狀至「潘代書」事務所委請被上訴人丁○○處理\n    系爭土地繼承登記事宜，眾所皆知「潘代書」即指被上訴人\n    丁○○，並有被上訴人丁○○親書之同意書可稽，復經證人\n    甲○○○證述在卷，另被上訴人丁○○於當時仍具地政士資\n    格，且於臺灣臺北地方法院檢察署九十七年度偵字第一一二\n    六號刑事背信案件偵查中陳稱上訴人與伊接洽，要辦理遺產\n    事宜，伊有辦理完成等語，甚且於地政士公會協調時認錯道\n    歉為據。查，依上訴人提出之同意書（見本院卷第21頁），\n    僅足證明被上訴人丁○○書寫該份文書，然被上訴人丁○○\n    乃在潘耀明事務所內處理聯絡、送件、領件等行政事務之員\n    工（詳後述），非無可能書立該份文書。而證人甲○○○證\n    稱去過潘代書事務所二次，是丁○○通知的，第一次是拿所\n    有權狀回來，第二次是繳交辦理本件相關費用。丁○○坐在\n    最大位置，伊小嬸說潘代書就是丁○○。丁○○有說馬上可\n    以辦好了，就可以分錢等語（見本院卷65、66頁），亦僅足\n    證明被上訴人丁○○有經辦本件繼承登記相關事務，惟尚不\n    足據以證明上訴人與被上訴人丁○○間或兩造間存在本件委\n    任契約關係。又上訴人主張「潘代書」即被上訴人丁○○，\n    為眾所週知之事實，惟為被上訴人所否認，上訴人未提出證\n    據證明此屬週知事實，已非無疑。縱上訴人主張「潘代書」\n    即為被上訴人丁○○，上訴人至「潘代書」事務所首先與被\n    上訴人丁○○接洽屬實，然此與將本件繼承事務委任辦理成\n    立委任契約，核屬兩事，尚不得據此推定委任契約之存在。\n    另上訴人主張被上訴人丁○○於前開背信案件偵查中陳稱上\n    訴人與其接洽，要辦理遺產事宜，其有辦理完成，並於地政\n    士公會協調時認錯道歉，足以證明其與被上訴人間成立委任\n    契約等語，然前開臺灣臺北地方法院檢察署九十七年度偵字\n    第一一二六號案件係上訴人就本件辦理系爭土地繼承登記同\n    一事實對潘耀明及被上訴人丙○○、丁○○提出背信告訴，\n    被上訴人丁○○於該偵查案件中係供稱：沒有簽契約，是伊\n    跟上訴人接洽的，就是口頭上上訴人把資料拿給伊辦遺產事\n    宜，後來伊有幫他辦理完成，伊弟弟潘耀明是主辦，複代理\n    人是丙○○等語，此經原審依職權調閱該卷宗核對（見前開\n    偵查卷第176頁）無訛，可見被上訴人丁○○於偵查案件中\n    亦否認委任契約關係存在，上訴人截取部分說詞所為單方之\n    陳述，不足據為有利於上訴人之認定。而被上訴人丁○○於\n    地政士公會協調時縱有道歉認錯之情，係出於曾接洽辦理系\n    爭土地繼承事宜而為，上訴人據以認定與被上訴人潘玉惠間\n    有委任契約關係，尚非可採。\n  (三)至上訴人主張其與被上訴人丙○○間存在委任契約關係部分\n    ，係以申請土地登記時有被上訴人丙○○印章（見原審卷第\n    143頁）為據，顯見上訴人亦肯認土地登記申請書之真正。\n    依被上訴人提出本件土地登記申請書（見原審卷第47頁）記\n    載「……(7)委任關係：本土地登記之申請委託潘耀明代理，\n    丙○○複代理……」；又依前開背信偵查案件內財政部臺灣\n    省北區國稅局新店稽徵所九十六年六月二十日北區國稅新店\n    一字第０九六０００七四八七號函所附本件遺產稅案件申報\n    委任書上記載「……茲為被繼承人王殷周遺產稅案，特委任\n    潘耀明君處理下列事務：一代為辦理遺產稅申報之一切事宜\n    。二代理受領遺產稅繳款書、核定通知書、繳清證明書及其\n    他有關文件.……」，並蓋有上訴人之印文（見該偵查卷第\n    34頁），可見上訴人確係委任潘耀明處理系爭土地繼承相關\n    事宜。上訴人雖主張該委任書係由被上訴人丁○○自行蓋印\n    ，不足據為認定委任契約關係之存在云云。惟上訴人對於委\n    任書上之自己與其他共同繼承人印文之真正均不爭執，就用\n    印人為被上訴人丁○○且違反上訴人意思所為之事實，均未\n    能舉證以實其說，自不足證明委任書為被上訴人丁○○逾越\n    上訴人授權範圍所為，而否定上訴人與潘耀明間有委任契約\n    關係存在。再參諸上訴人為智慮成熟的成年人，對於交付印\n    章予他人「在遺產稅申報委任書上蓋印」，代表「授權該人\n    辦理遺產稅事宜」不可謂不知，上訴人既蓋印同意授權潘耀\n    明辦理，卻又主張係口頭委任被上訴人丁○○辦理，但對於\n    如何口頭上委任被上訴人丁○○之事實，僅上訴人片面之詞\n    ，且主張口頭委任之事實，復與其依前開土地登記申請書主\n    張與被上訴人丙○○間存在委任契約關係不相容，是上訴人\n    主張即有矛盾，而不足採信。\n  (四)又本件上訴人委由潘耀明辦理繼承登記事宜時，被上訴人丁\n    ○○雖具有開業地政士身分，然被上訴人抗辯渠等受僱於潘\n    耀明，協助潘耀明聯絡當事人、送件、領件及處理文書業務\n    ，已據被上訴人提出勞工保險加報申報表為證（見原審卷第\n    50頁），堪信被上訴人二人均係潘代書事務所之員工，尚非\n    主辦系爭遺產繼承之人。雖委任契約非為要式契約，縱被上\n    訴人於本件繼承登記事宜處理過程中曾與上訴人或其他繼承\n    人有接洽，乃本於員工身分所為，並非不可能，自不得據此\n    即否定上訴人與潘耀明間之委任關係，而認委任契約應存在\n    於兩造間。\n  (五)是則，依上訴人提出之證據尚不足證明其口頭委任被上訴人\n    丁○○處理本件遺產繼承登記事務，或其與被上訴人二人間\n    存在本件處理遺產繼承登記委任契約關係。被上訴人抗辯委\n    任契約存在於上訴人與潘耀明之間，尚屬非虛。\n六、本件上訴人未能證明兩造間存在遺產繼承委任契約關係，關\n    於被上訴人處理遺產繼承事務，是否有過失，並致上訴人受\n    有損害，均無庸審究。縱假設被上訴人受上訴人委任處理本\n    件遺產繼承事務，系爭土地中之臺北市○○區○○段三小段\n    五六二地號土地為農地，然上訴人未提出農地作農業使用之\n    證明書，亦未委請申辦農業使用之證明，以免繳遺產稅，已\n    據上訴人於偵查中陳述明確（見前開偵查案不起訴處分書，\n    原審卷第75頁）。而上訴人主張其曾向被上訴人丁○○質疑\n    農地免繳遺產稅等語，既為被上訴人所否認，上訴人復未能\n    舉證證明，尚難信實。且被上訴人抗辯有部分繼承人表示第\n    三人擬購買系爭土地中坐落臺北縣深坑鄉○○段大坪小段一\n    之九地號等數筆土地，希迅速辦理繼承登記以便出售，亦非\n    無可能。則被上訴人於辦理遺產申報及繼承登記時，將前開\n    農地用以抵繳遺產稅，顯係基於相關稅法規定之正常處理方\n    式，難謂有何過失。且依上訴人所陳於解除委任契約後，另\n    委任訴外人李戈登代書處理，就前開農地委請申辦農業使用\n    證明書並獲准（見上訴人提出之相關資料，原審卷第115 至\n    137頁），因而免繳遺產稅，亦係依相關法規所為，上訴人\n    等全體繼承人業已取得退還之稅款現金四十二萬一千二百六\n    十六元及前開農地之所有權，難謂上訴人受有損害，並與被\n    上訴人之行為間有因果關係。上訴人依民法第五百四十四條\n    、第一百八十四條第一項規定，請求被上訴人賠償支出代書\n    費五萬元，五年期間內往返各行政單位所支出交通、食宿費\n    二十五萬元，及慰撫金四十萬元，均非有據，併予敘明。\n七、綜上所述，上訴人主張本於民法第五百四十四條委任契約之\n    法律關係與同法第一百八十四條第一項前段之侵權行為法律\n    關係，請求被上訴人給付七十萬元，為無理由，不應准許。\n    原審就此為上訴人敗訴之判決，並無不合。上訴意旨指摘原\n    判決此部分不當，求予廢棄改判，為無理由，應予駁回。\n八、本件兩造間無處理系爭土地遺產繼承登記委任契約關係存在\n    之事實已明，兩造其餘攻擊防禦方法及未經援用之證據，經\n    審酌後核與判決結果不生影響，爰不一一論述，附此敘明。\n據上論結，本件上訴為無理由。依民事訴訟法第四百四十九條第\n一項、第七十八條，判決如主文。"
  },
  "characters": {
    "judges": [
      "黃豐澤",
      "吳謀焰",
      "林麗玲"
    ],
    "prosecutors": [

    ],
    "lawyers": [
      "吳茂雄",
      "吳雨學",
      "高涌誠",
      "許樹欣",
      "黃旭田"
    ],
    "clerks": [

    ],
    "plaintiffs": [

    ],
    "defendants": [

    ],
    "prosecutor_office": [

    ],
    "creditors": [

    ],
    "debtors": [

    ],
    "judicial_associate_officer": [

    ]
  },
  "adjudged_at": "2010-01-05",
  "created_at": "2016-01-05 15:03:32",
  "updated_at": "2016-01-05 15:03:32"
}