{
  "identify": "TPH-99-抗-624-20100512-1",
  "court": {
    "name": "臺灣高等法院",
    "code": "TPH"
  },
  "division": {
    "name": "民事",
    "code": "V"
  },
  "year": 99,
  "word": "抗",
  "number": "624",
  "jcheck": "1",
  "reason": "假扣押",
  "content": "臺灣高等法院民事裁定                 99年度抗字第624號\n抗  告  人  甲○○\n抗告人因與相對人乙○○間假扣押事件，抗告人對於中華民國\n99年4月14日臺灣臺北地方法院99年度裁全字第1290號所為裁定\n提起抗告，本院裁定如下：\n    主      文\n抗告駁回。\n抗告訴訟費用由抗告人負擔。\n    理      由\n一、按請求及假扣押之原因，應釋明之。前項釋明如有不足，而\n    債權人陳明願供擔保或法院認為適當者，法院得定相當之擔\n    保，命供擔保後為假扣押。民事訴訟法第526條第1項、第2\n    項定有明文。所謂假扣押之原因，即債務人有日後不能強制\n    執行或甚難執行之虞，或應在外國為強制執行者，同法第52\n    3條亦定有明文。是債權人就請求及假扣押之原因，即因請\n    求標的之現狀變更，有日後不能強制執行，或甚難執行之情\n    事，如債務人浪費財產、增加負擔，或就財產為不利益處分\n    ，將成為無資力之狀態，或將移往遠地、逃匿無蹤、隱匿財\n    產等，應提出可使法院信其主張為真之證據釋明之，必待釋\n    明有所不足，而債權人陳明願供擔保以補釋明之不足，始得\n    准為假扣押。倘債權人不能釋明假扣押之原因存在，即無就\n    金錢之請求保全強制執行之必要，尚不能因債權人陳明願供\n    擔保，即認足補釋明之欠缺，而為假扣押。\n二、本件抗告人於原法院聲請意旨略以：抗告人所有臺北市○○\n    區○○里○○鄰○○街178號1至5樓房屋（下稱系爭房屋）應\n    有部分6/120。因系爭房屋1樓出租他人營利，每月收取租金\n    新台幣（下同）130,000元，則按抗告人應有部分分得5,000\n    元。以往係由相對人代表收受租金後再分發其他共有人。詎\n    抗告人所有系爭房屋，在未經抗告人同意下，遭他人以贈與\n    方式移轉予抗告人之母謝郭琴，相對人並直接將租金交予謝\n    郭琴。抗告人為保全其後4個月租金收取權益計20,000元，\n    爰聲請對相對人財產20,000元內為假扣押，並陳明願供擔保\n    等語。固提出建物改良登記簿、土地登記聲請書、贈與所有\n    權移轉契約書、登記清冊建物標示為證。惟查上開證據僅足\n    釋明抗告人曾為系爭房屋共有人，或對系爭房屋1樓之租金\n    有收取權，但就相對人是否有浪費財產、增加負擔，或就財\n    產為不利益處分，將成為無資力之狀態，或將移往遠地、逃\n    匿無蹤、隱匿財產等，有日後不能強制執行，或甚難強制執\n    行之假扣押原因，仍未盡釋明之責。抗告意旨雖再陳明系爭\n    房屋1樓承租人李淑芬可為佐證云云，仍未就假扣押之原因\n    提出本院可及時調查之證據釋明之。原裁定依首開規定，認\n    無保全假扣押之必要，據以駁回抗告人假扣押之聲請，要無\n    不合，抗告意旨指摘原裁定不當，請求廢棄，為無理由，應\n    予駁回。\n三、據上論結，本件抗告為無理由，爰裁定如主文。\n中    華    民    國    99    年   5    月     12    日\n                    民事第八庭\n                        審判長法  官 劉勝吉\n                              法  官 連正義\n                              法  官 蘇芹英\n正本係照原本作成。\n不得再抗告。\n中    華    民    國    99    年    5     月    13    日\n                              書記官 林初枝",
  "structure": {
    "main": "抗告駁回。\n抗告訴訟費用由抗告人負擔。",
    "reason": "一、按請求及假扣押之原因，應釋明之。前項釋明如有不足，而\n    債權人陳明願供擔保或法院認為適當者，法院得定相當之擔\n    保，命供擔保後為假扣押。民事訴訟法第526條第1項、第2\n    項定有明文。所謂假扣押之原因，即債務人有日後不能強制\n    執行或甚難執行之虞，或應在外國為強制執行者，同法第52\n    3條亦定有明文。是債權人就請求及假扣押之原因，即因請\n    求標的之現狀變更，有日後不能強制執行，或甚難執行之情\n    事，如債務人浪費財產、增加負擔，或就財產為不利益處分\n    ，將成為無資力之狀態，或將移往遠地、逃匿無蹤、隱匿財\n    產等，應提出可使法院信其主張為真之證據釋明之，必待釋\n    明有所不足，而債權人陳明願供擔保以補釋明之不足，始得\n    准為假扣押。倘債權人不能釋明假扣押之原因存在，即無就\n    金錢之請求保全強制執行之必要，尚不能因債權人陳明願供\n    擔保，即認足補釋明之欠缺，而為假扣押。\n二、本件抗告人於原法院聲請意旨略以：抗告人所有臺北市○○\n    區○○里○○鄰○○街178號1至5樓房屋（下稱系爭房屋）應\n    有部分6/120。因系爭房屋1樓出租他人營利，每月收取租金\n    新台幣（下同）130,000元，則按抗告人應有部分分得5,000\n    元。以往係由相對人代表收受租金後再分發其他共有人。詎\n    抗告人所有系爭房屋，在未經抗告人同意下，遭他人以贈與\n    方式移轉予抗告人之母謝郭琴，相對人並直接將租金交予謝\n    郭琴。抗告人為保全其後4個月租金收取權益計20,000元，\n    爰聲請對相對人財產20,000元內為假扣押，並陳明願供擔保\n    等語。固提出建物改良登記簿、土地登記聲請書、贈與所有\n    權移轉契約書、登記清冊建物標示為證。惟查上開證據僅足\n    釋明抗告人曾為系爭房屋共有人，或對系爭房屋1樓之租金\n    有收取權，但就相對人是否有浪費財產、增加負擔，或就財\n    產為不利益處分，將成為無資力之狀態，或將移往遠地、逃\n    匿無蹤、隱匿財產等，有日後不能強制執行，或甚難強制執\n    行之假扣押原因，仍未盡釋明之責。抗告意旨雖再陳明系爭\n    房屋1樓承租人李淑芬可為佐證云云，仍未就假扣押之原因\n    提出本院可及時調查之證據釋明之。原裁定依首開規定，認\n    無保全假扣押之必要，據以駁回抗告人假扣押之聲請，要無\n    不合，抗告意旨指摘原裁定不當，請求廢棄，為無理由，應\n    予駁回。\n三、據上論結，本件抗告為無理由，爰裁定如主文。"
  },
  "characters": {
    "judges": [
      "劉勝吉",
      "連正義",
      "蘇芹英"
    ],
    "prosecutors": [

    ],
    "lawyers": [

    ],
    "clerks": [

    ],
    "plaintiffs": [

    ],
    "defendants": [

    ],
    "prosecutor_office": [

    ],
    "creditors": [

    ],
    "debtors": [

    ],
    "judicial_associate_officer": [

    ]
  },
  "adjudged_at": "2010-05-12",
  "created_at": "2016-01-05 11:56:29",
  "updated_at": "2016-01-05 11:56:29"
}