{
  "identify": "TPH-98-上-142-20100512-2",
  "court": {
    "name": "臺灣高等法院",
    "code": "TPH"
  },
  "division": {
    "name": "民事",
    "code": "V"
  },
  "year": 98,
  "word": "上",
  "number": "142",
  "jcheck": "2",
  "reason": "侵權行為損害賠償",
  "content": "臺灣高等法院民事裁定                   98年度上字第142號\n上  訴  人  乙○○\n訴訟代理人  王勝彥律師\n上  訴  人  甲○○\n訴訟代理人  羅惠民律師\n上列當事人間請求侵權行為損害賠償事件，本院裁定如下：\n    主  文\n本件於臺灣屏東地方法院九十六年度訴字第六一二號請求清償債\n務事件民事訴訟終結前，停止訴訟程序。\n    理  由\n一按訴訟全部或一部之裁判，以他訴訟之法律關係是否成立為據\n  者，法院得在他訴訟終結前，以裁定停止訴訟程序，民事訴訟\n  法第一百八十二條第一項定有明文。\n二本件上訴人依侵權行為損害賠償請求權請求被上訴人賠償損害\n  ，被上訴人則以受讓訴外人通益國際有限公司對上訴人之債權\n  為抵銷抗辯，而被上訴人主張抵銷之債權是否存在，現繫屬臺\n  灣高等法院高雄分院（第一審案號為臺灣屏東地方法院九十六\n  年度訴字第六一二號清償債務事件），尚未確定，則本件民事\n  訴訟之裁判，以上開事件訴訟之法律關係是否成立為據，本院\n  認有裁定停止本件民事訴訟程序之必要。\n三、依首開法條裁定如主文。\n中    華    民    國    99    年    5     月    12    日\n                    民事第九庭\n                        審判長法  官  黃熙嫣\n                              法  官  陳玉完\n                              法  官  鄭傑夫\n正本係照原本作成。\n如不服本裁定，應於收受送達後10日內向本院提出抗告狀，並應\n繳納抗告費新台幣１千元。\n中    華    民    國    99    年    5     月    12    日\n                              書記官  廖逸柔",
  "structure": {
    "main": "本件於臺灣屏東地方法院九十六年度訴字第六一二號請求清償債\n務事件民事訴訟終結前，停止訴訟程序。",
    "reason": "一按訴訟全部或一部之裁判，以他訴訟之法律關係是否成立為據\n  者，法院得在他訴訟終結前，以裁定停止訴訟程序，民事訴訟\n  法第一百八十二條第一項定有明文。\n二本件上訴人依侵權行為損害賠償請求權請求被上訴人賠償損害\n  ，被上訴人則以受讓訴外人通益國際有限公司對上訴人之債權\n  為抵銷抗辯，而被上訴人主張抵銷之債權是否存在，現繫屬臺\n  灣高等法院高雄分院（第一審案號為臺灣屏東地方法院九十六\n  年度訴字第六一二號清償債務事件），尚未確定，則本件民事\n  訴訟之裁判，以上開事件訴訟之法律關係是否成立為據，本院\n  認有裁定停止本件民事訴訟程序之必要。\n三、依首開法條裁定如主文。"
  },
  "characters": {
    "judges": [
      "黃熙嫣",
      "陳玉完",
      "鄭傑夫"
    ],
    "prosecutors": [

    ],
    "lawyers": [
      "王勝彥",
      "羅惠民"
    ],
    "clerks": [

    ],
    "plaintiffs": [

    ],
    "defendants": [

    ],
    "prosecutor_office": [

    ],
    "creditors": [

    ],
    "debtors": [

    ],
    "judicial_associate_officer": [

    ]
  },
  "adjudged_at": "2010-05-12",
  "created_at": "2016-01-05 11:55:01",
  "updated_at": "2016-01-05 11:55:01"
}