{
  "identify": "TPH-99-上訴-45-20100105-1",
  "court": {
    "name": "臺灣高等法院",
    "code": "TPH"
  },
  "division": {
    "name": "刑事",
    "code": "M"
  },
  "year": 99,
  "word": "上訴",
  "number": "45",
  "jcheck": "1",
  "reason": "毒品危害防制條例",
  "content": "臺灣高等法院刑事判決                  99年度上訴字第45號\n上  訴  人    甲○○\n即  被  告\n                        （另案在臺北分監執行中）\n上列上訴人即被告因違反毒品危害防制條例案件，不服臺灣板橋\n地方法院九十八年度訴字第三０八三號，中華民國九十八年九月\n廿九日第一審判決（起訴案號：臺灣板橋地方法院檢察署九十八\n年度毒偵字第四九九四號），提起上訴，本院判決如下：\n    主  文\n上訴駁回。\n    理  由\n一、按刑事訴訟法第三百六十一條及第三百六十七條於民國九十\n    六年六月十五日修正通過，同年七月四日經公布生效，修正\n    後分別規定：「不服地方法院之第一審判決而上訴者，應向\n    管轄第二審之高等法院為之。上訴書狀應敘述具體理由。上\n    訴書狀未敘述上訴理由者，應於上訴期間屆滿後二十日內補\n    提理由書於原審法院。逾期未補提者，原審法院應定期間先\n    命補正。」及「第二審法院認為上訴書狀未敘述理由或上訴\n    有第三百六十二條前段之情形者，應以判決駁回之。但其情\n    形可以補正而未經原審法院命其補正者，審判長應定期間先\n    命補正。」\n二、經查，本案上訴人即被告甲○○之原審判決，於民國九十八\n    年十月五日由被告親自收受送達，雖被告於同年月十二日即\n    遞狀提起上訴，惟上訴狀僅稱不服判決，理由容後補呈，而\n    未依法附具理由。旋經原審先後二次裁定通知補正具體上訴\n    理由，該二通知亦分別於同年十月廿二日及十二月十五日由\n    被告親收，此有原審前開送達証書二紙在卷可稽，是早已逾\n    補提理由書之期間，惟被告迄未補正，揆諸前揭規定，被告\n    上訴不合法律程式，乃不經言詞辯論，逕予駁回。\n三、據上論斷，應依刑事訴訟法第三百六十七條前段、第三百七\n    十二條，判決如主文。\n中    華    民    國    九十九   年   一   月    五    日\n                  刑事第四庭審判長法  官  陳筱珮\n                                  法  官  孫惠琳\n                                  法  官  陳玉雲\n以上正本證明與原本無異。\n如不服本判決，應於收受送達後10日內向本院提出上訴書狀，其\n未敘述上訴之理由者並得於提起上訴後10日內向本院補提理由書\n（均須按他造當事人之人數附繕本）「切勿逕送上級法院」。\n                                  書記官  陳思云\n中    華    民    國    99    年    1     月    6     日\n",
  "structure": {
    "main": "上訴駁回。",
    "reason": "一、按刑事訴訟法第三百六十一條及第三百六十七條於民國九十\n    六年六月十五日修正通過，同年七月四日經公布生效，修正\n    後分別規定：「不服地方法院之第一審判決而上訴者，應向\n    管轄第二審之高等法院為之。上訴書狀應敘述具體理由。上\n    訴書狀未敘述上訴理由者，應於上訴期間屆滿後二十日內補\n    提理由書於原審法院。逾期未補提者，原審法院應定期間先\n    命補正。」及「第二審法院認為上訴書狀未敘述理由或上訴\n    有第三百六十二條前段之情形者，應以判決駁回之。但其情\n    形可以補正而未經原審法院命其補正者，審判長應定期間先\n    命補正。」\n二、經查，本案上訴人即被告甲○○之原審判決，於民國九十八\n    年十月五日由被告親自收受送達，雖被告於同年月十二日即\n    遞狀提起上訴，惟上訴狀僅稱不服判決，理由容後補呈，而\n    未依法附具理由。旋經原審先後二次裁定通知補正具體上訴\n    理由，該二通知亦分別於同年十月廿二日及十二月十五日由\n    被告親收，此有原審前開送達証書二紙在卷可稽，是早已逾\n    補提理由書之期間，惟被告迄未補正，揆諸前揭規定，被告\n    上訴不合法律程式，乃不經言詞辯論，逕予駁回。\n三、據上論斷，應依刑事訴訟法第三百六十七條前段、第三百七\n    十二條，判決如主文。"
  },
  "characters": {
    "judges": [
      "陳筱珮",
      "孫惠琳",
      "陳玉雲"
    ],
    "prosecutors": [

    ],
    "lawyers": [

    ],
    "clerks": [
      "陳思云"
    ],
    "plaintiffs": [

    ],
    "defendants": [

    ],
    "prosecutor_office": [

    ],
    "creditors": [

    ],
    "debtors": [

    ],
    "judicial_associate_officer": [

    ]
  },
  "adjudged_at": "2010-01-05",
  "created_at": "2016-01-05 15:01:14",
  "updated_at": "2016-01-05 15:01:14"
}