{
  "identify": "TPH-99-交抗-1165-20100512-1",
  "court": {
    "name": "臺灣高等法院",
    "code": "TPH"
  },
  "division": {
    "name": "刑事",
    "code": "M"
  },
  "year": 99,
  "word": "交抗",
  "number": "1165",
  "jcheck": "1",
  "reason": "違反道路交通管理處罰條例",
  "content": "臺灣高等法院交通事件裁定            99年度交抗字第1165號\n抗 告 人即\n原處分機關  交通部公路總局臺北區監理所板橋監理站\n受 處 分人  甲○○\n上列抗告人因受處分人違反道路交通管理處罰條例案件，不服臺\n灣板橋地方法院，中華民國99年4月14日所為裁定（99年度交聲\n字第183號），提起抗告，本院裁定如下：\n    主  文\n原裁定及原處分均撤銷。\n甲○○汽車駕駛人，駕駛汽車經測試檢定酒精濃度超過規定標準\n，於一年內不得考領輕型機車駕駛執照，並應接受道路交通安全\n講習。\n    理  由\n一、原處分意旨略以：受處分人甲○○於民國98年11月26日下午\n    4時50分許，騎乘車牌號碼QWH-961號輕型機車，行經臺北縣\n    新莊市後川圳與裕民街103巷口時，因酒後駕車，呼氣酒精\n    濃度0.60MG/L，經警當場製單舉發，爰依道路交通管理處罰\n    條例第35條第1項第1款規定，裁處受處分人罰鍰新臺幣（下\n    同）45,000元，自99年1月14日起1年內不得考領駕駛執照，\n    並施以道安講習。\n二、原裁定意旨略以：受處分人確有駕駛汽車經測試檢定酒精濃\n    度超過規定標準之違規行為，然受處分人之同一違規行為既\n    經檢察官為緩起訴處分確定，並命向國庫支付20,000元，在\n    緩起訴處分期間尚未期滿而未實質確定前，仍有受刑事處罰\n    之可能，原處分機關裁處受處分人罰鍰45,000元部分，有違\n    行政罰法第26條一事不二罰原則。雖原處分機關裁處吊扣駕\n    駛執照12個月及施以道安講習部分，未據受處分人聲明異議\n    ，然因酒後駕車僅有一交通違規行為，有關之處罰效果之罰\n    鍰、吊扣駕駛執照及施以道路交通安全講習等與該交通違規\n    行為是否存在，均無從分離，自應就原處分全部加以審理。\n    因而撤銷原處分，並另裁處吊扣受處分人駕駛執照12個月及\n    施以道路交通安全講習。\n三、抗告意旨略以：受處分人甲○○於上揭時地，有酒後騎乘車\n    牌號碼QWH-961號輕型機車，呼氣酒精達濃度0.60MG/L之違\n    規，經查並無考領機車及汽車駕駛執照之紀錄，是以裁處自\n    99年1月14日起1年內不得考領駕駛執照，本部分裁決為受處\n    分人所不爭執。原審未詳查，未依受處分人未考領機車及汽\n    車駕駛執照之事實及相關法律，據而裁定吊扣受處分人輕型\n    機車駕駛執照12個月及接受道路交通安全講習，應非妥適，\n    請撤銷原裁定，維持原裁決等語。\n四、經查：\n（一）按汽車駕駛人飲用酒類或其他類似物後其吐氣所含酒精濃\n      度超過每公升0.25毫克或血液中酒精濃度超過百分之0.05\n      以上，不得駕車；又汽車駕駛人，駕駛汽車經測試檢定有\n      酒精濃度超過規定標準之情形者，處新臺幣15,000元以上\n      60,000元以下罰鍰，並當場移置保管該汽車及吊扣其駕駛\n      執照1年，並應接受道路交通安全講習，道路交通安全規\n      則第114條第2款、道路交通管理處罰條例第35條第1項第1\n      款、第24條第1項第2款分別定有明文。又汽車駕駛人違反\n      本條例規定，應受吊扣駕駛執照處分，於汽車駕駛人係無\n      駕駛執照駕車者，在所規定最長吊扣期間內，不得考領駕\n      駛執照，同條例第67條第6項亦定有明文。\n（二）受處分人未領有任何之汽、機車駕駛執照，有汽、機車駕\n      照基本資料附卷可稽（見本院卷第16頁），並確實有前開\n      酒精濃度超過規定標準駕車之違規事實，且為受處分人聲\n      明異議狀所不爭執，有台北市政府警察局C00000000號舉\n      發違反道路交通管理事件通知單、酒測值單、交通部公路\n      總局臺北區監理所板橋監理站板監裁字第裁41-Ｚ00000000\n      0號裁決書、送達證書、聲明異議狀（原審卷第3頁至第6\n      頁、第8頁）在卷可按，則受處分人依法應受之處分乃限\n      制其駕駛輕型機車之權利，惟因受處分人並未持有輕型機\n      車駕駛執照供吊扣，揆諸上開規定，對該吊扣駕駛執照之\n      處罰，應裁處以禁止其在該規定最長吊扣期間內考領駕駛\n      執照。原裁定誤以受處分人有輕型機車駕駛執照，就此部\n      分為吊扣輕型機車駕照12個月之處分，尚有未合。是抗告\n      人指摘原裁定不當，尚非全無理由。至抗告意旨另稱受處\n      分人未就原處分關於吊扣駕照、接受道路交通安全講習部\n      分聲明異議，然本案係單一之交通違規行為，罰鍰處分、\n      吊扣駕駛執照、吊扣期間不得考領駕駛執照及應接受道路\n      交通安全講習部分無從區分。從而，本院自應將原裁定及\n      原處分均撤銷，並自為裁定，除罰鍰部分外，就吊照及安\n      全講習等處罰，一併重新諭知如主文第二項所示。至受處\n      分人酒醉駕車罰鍰部分，應俟緩起訴期間屆滿未經撤銷確\n      定，或受處分人經撤銷緩起訴受刑事訴追處罰後，另為適\n      法之處分，併此說明。\n據上論斷，應依道路交通管理處罰條例第89條、第35條第1項第1\n款、第67條第6項、第24條第1項第2款，道路交通案件處理辦法\n第26條及刑事訴訟法第413條，裁定如主文。\n中    華    民    國    99    年    5     月    12    日\n                  刑事第七庭審判長法  官  宋明蒼\n                                  法  官  游紅桃\n                                  法  官  趙功恒\n以上正本證明與原本無異。\n不得再抗告。\n                                  書記官  潘文賢\n中    華    民    國    99    年    5     月    12    日",
  "structure": {
    "main": "原裁定及原處分均撤銷。\n甲○○汽車駕駛人，駕駛汽車經測試檢定酒精濃度超過規定標準\n，於一年內不得考領輕型機車駕駛執照，並應接受道路交通安全\n講習。",
    "reason": "一、原處分意旨略以：受處分人甲○○於民國98年11月26日下午\n    4時50分許，騎乘車牌號碼QWH-961號輕型機車，行經臺北縣\n    新莊市後川圳與裕民街103巷口時，因酒後駕車，呼氣酒精\n    濃度0.60MG/L，經警當場製單舉發，爰依道路交通管理處罰\n    條例第35條第1項第1款規定，裁處受處分人罰鍰新臺幣（下\n    同）45,000元，自99年1月14日起1年內不得考領駕駛執照，\n    並施以道安講習。\n二、原裁定意旨略以：受處分人確有駕駛汽車經測試檢定酒精濃\n    度超過規定標準之違規行為，然受處分人之同一違規行為既\n    經檢察官為緩起訴處分確定，並命向國庫支付20,000元，在\n    緩起訴處分期間尚未期滿而未實質確定前，仍有受刑事處罰\n    之可能，原處分機關裁處受處分人罰鍰45,000元部分，有違\n    行政罰法第26條一事不二罰原則。雖原處分機關裁處吊扣駕\n    駛執照12個月及施以道安講習部分，未據受處分人聲明異議\n    ，然因酒後駕車僅有一交通違規行為，有關之處罰效果之罰\n    鍰、吊扣駕駛執照及施以道路交通安全講習等與該交通違規\n    行為是否存在，均無從分離，自應就原處分全部加以審理。\n    因而撤銷原處分，並另裁處吊扣受處分人駕駛執照12個月及\n    施以道路交通安全講習。\n三、抗告意旨略以：受處分人甲○○於上揭時地，有酒後騎乘車\n    牌號碼QWH-961號輕型機車，呼氣酒精達濃度0.60MG/L之違\n    規，經查並無考領機車及汽車駕駛執照之紀錄，是以裁處自\n    99年1月14日起1年內不得考領駕駛執照，本部分裁決為受處\n    分人所不爭執。原審未詳查，未依受處分人未考領機車及汽\n    車駕駛執照之事實及相關法律，據而裁定吊扣受處分人輕型\n    機車駕駛執照12個月及接受道路交通安全講習，應非妥適，\n    請撤銷原裁定，維持原裁決等語。\n四、經查：\n（一）按汽車駕駛人飲用酒類或其他類似物後其吐氣所含酒精濃\n      度超過每公升0.25毫克或血液中酒精濃度超過百分之0.05\n      以上，不得駕車；又汽車駕駛人，駕駛汽車經測試檢定有\n      酒精濃度超過規定標準之情形者，處新臺幣15,000元以上\n      60,000元以下罰鍰，並當場移置保管該汽車及吊扣其駕駛\n      執照1年，並應接受道路交通安全講習，道路交通安全規\n      則第114條第2款、道路交通管理處罰條例第35條第1項第1\n      款、第24條第1項第2款分別定有明文。又汽車駕駛人違反\n      本條例規定，應受吊扣駕駛執照處分，於汽車駕駛人係無\n      駕駛執照駕車者，在所規定最長吊扣期間內，不得考領駕\n      駛執照，同條例第67條第6項亦定有明文。\n（二）受處分人未領有任何之汽、機車駕駛執照，有汽、機車駕\n      照基本資料附卷可稽（見本院卷第16頁），並確實有前開\n      酒精濃度超過規定標準駕車之違規事實，且為受處分人聲\n      明異議狀所不爭執，有台北市政府警察局C00000000號舉\n      發違反道路交通管理事件通知單、酒測值單、交通部公路\n      總局臺北區監理所板橋監理站板監裁字第裁41-Ｚ00000000\n      0號裁決書、送達證書、聲明異議狀（原審卷第3頁至第6\n      頁、第8頁）在卷可按，則受處分人依法應受之處分乃限\n      制其駕駛輕型機車之權利，惟因受處分人並未持有輕型機\n      車駕駛執照供吊扣，揆諸上開規定，對該吊扣駕駛執照之\n      處罰，應裁處以禁止其在該規定最長吊扣期間內考領駕駛\n      執照。原裁定誤以受處分人有輕型機車駕駛執照，就此部\n      分為吊扣輕型機車駕照12個月之處分，尚有未合。是抗告\n      人指摘原裁定不當，尚非全無理由。至抗告意旨另稱受處\n      分人未就原處分關於吊扣駕照、接受道路交通安全講習部\n      分聲明異議，然本案係單一之交通違規行為，罰鍰處分、\n      吊扣駕駛執照、吊扣期間不得考領駕駛執照及應接受道路\n      交通安全講習部分無從區分。從而，本院自應將原裁定及\n      原處分均撤銷，並自為裁定，除罰鍰部分外，就吊照及安\n      全講習等處罰，一併重新諭知如主文第二項所示。至受處\n      分人酒醉駕車罰鍰部分，應俟緩起訴期間屆滿未經撤銷確\n      定，或受處分人經撤銷緩起訴受刑事訴追處罰後，另為適\n      法之處分，併此說明。\n據上論斷，應依道路交通管理處罰條例第89條、第35條第1項第1\n款、第67條第6項、第24條第1項第2款，道路交通案件處理辦法\n第26條及刑事訴訟法第413條，裁定如主文。"
  },
  "characters": {
    "judges": [
      "宋明蒼",
      "游紅桃",
      "趙功恒"
    ],
    "prosecutors": [

    ],
    "lawyers": [

    ],
    "clerks": [
      "潘文賢"
    ],
    "plaintiffs": [

    ],
    "defendants": [

    ],
    "prosecutor_office": [

    ],
    "creditors": [

    ],
    "debtors": [

    ],
    "judicial_associate_officer": [

    ]
  },
  "adjudged_at": "2010-05-12",
  "created_at": "2016-01-05 11:53:24",
  "updated_at": "2016-01-05 11:53:24"
}