{
  "identify": "TPH-99-抗-631-20100512-1",
  "court": {
    "name": "臺灣高等法院",
    "code": "TPH"
  },
  "division": {
    "name": "民事",
    "code": "V"
  },
  "year": 99,
  "word": "抗",
  "number": "631",
  "jcheck": "1",
  "reason": "清償債務",
  "content": "臺灣高等法院民事裁定                   99年度抗字第631號\n抗  告  人  丙○○\n            乙○○\n            甲○○\n上列抗告人因與相對人丁○○等間清償債務事件，不服臺灣臺北\n地方法院99年度審訴字第1355號裁定提起抗告，本院裁定如下：\n    主  文\n抗告駁回。\n抗告費用由抗告人負擔。\n    理  由\n一、本件起訴及抗告意旨略以：相對人丁○○與戊○○（原名廖\n    秀惠）向伊等借款合計新臺幣（下同）77萬2,000元（下稱\n    系爭借款），惟僅交付發票人為輝壁實業有限公司、票號\n    CSA0000000、到期日為民國（下同）98年5月27日、面額為\n    22萬2,000元之支票乙紙作為借款之擔保，詎相對人於屆期\n    後，並未清償，嗣該支票亦因存款不足而遭退票，雖經伊等\n    屢次催討，均拒不置理，乃訴請相對人等返還系爭借款。原\n    法院以相對人丁○○之住所在高雄、戊○○之住所在雲林，\n    原法院無管轄權為由，而裁定移轉管轄至臺灣高雄地方法院\n    （下稱高雄地院）審理，然因相對人等向伊等借款之行為地\n    點在臺北市，且伊等匯款地亦在臺北市，故期以原法院為管\n    轄法院等語。\n二、按訴訟由被告住所地之法院管轄；因契約涉訟者，如經當事\n    人定有債務履行地，得由該履行地之法院管轄；共同訴訟之\n    被告數人，其住所不在一法院管轄區域內者，各該住所地之\n    法院俱有管轄權；訴訟之全部或一部，法院認為無管轄權者\n    ，依原告聲請或依職權以裁定移送於其管轄法院，民事訴訟\n    法第1條第1項前段、第12條、第20條及第28條第1項分別定\n    有明文。\n三、經查，相對人丁○○之住所在高雄、戊○○之住所在雲林，\n    有戶籍謄本附卷可稽。揆諸上開所述，高雄地院及臺灣雲林\n    地方法院（下稱雲林地院）就本件清償借款事件俱有管轄權\n    。而兩造於借貸系爭借款時，並未特別約定債務履行地，自\n    無從以抗告人所述借款及匯款地點在臺北市即認定臺北市為\n    債務履行地，故原法院應無管轄權。惟抗告人竟向無管轄權\n    之原法院提起訴訟，因而原法院裁定移送於有管轄權之高雄\n    地院，於法核無違誤。抗告意旨指摘原裁定不當，求予廢棄\n    ，為無理由，應予駁回。\n據上論結，本件抗告為無理由，爰裁定如主文。\n中    華    民    國    99    年    5     月    12    日\n                    民事第三庭\n                        審判長法  官  林敬修\n                              法  官  吳青蓉\n                              法  官  黃騰耀\n正本係照原本作成。\n不得再抗告。\n中    華    民    國    99    年    5     月    12    日\n                              書記官  潘大鵬",
  "structure": {
    "main": "抗告駁回。\n抗告費用由抗告人負擔。",
    "reason": "一、本件起訴及抗告意旨略以：相對人丁○○與戊○○（原名廖\n    秀惠）向伊等借款合計新臺幣（下同）77萬2,000元（下稱\n    系爭借款），惟僅交付發票人為輝壁實業有限公司、票號\n    CSA0000000、到期日為民國（下同）98年5月27日、面額為\n    22萬2,000元之支票乙紙作為借款之擔保，詎相對人於屆期\n    後，並未清償，嗣該支票亦因存款不足而遭退票，雖經伊等\n    屢次催討，均拒不置理，乃訴請相對人等返還系爭借款。原\n    法院以相對人丁○○之住所在高雄、戊○○之住所在雲林，\n    原法院無管轄權為由，而裁定移轉管轄至臺灣高雄地方法院\n    （下稱高雄地院）審理，然因相對人等向伊等借款之行為地\n    點在臺北市，且伊等匯款地亦在臺北市，故期以原法院為管\n    轄法院等語。\n二、按訴訟由被告住所地之法院管轄；因契約涉訟者，如經當事\n    人定有債務履行地，得由該履行地之法院管轄；共同訴訟之\n    被告數人，其住所不在一法院管轄區域內者，各該住所地之\n    法院俱有管轄權；訴訟之全部或一部，法院認為無管轄權者\n    ，依原告聲請或依職權以裁定移送於其管轄法院，民事訴訟\n    法第1條第1項前段、第12條、第20條及第28條第1項分別定\n    有明文。\n三、經查，相對人丁○○之住所在高雄、戊○○之住所在雲林，\n    有戶籍謄本附卷可稽。揆諸上開所述，高雄地院及臺灣雲林\n    地方法院（下稱雲林地院）就本件清償借款事件俱有管轄權\n    。而兩造於借貸系爭借款時，並未特別約定債務履行地，自\n    無從以抗告人所述借款及匯款地點在臺北市即認定臺北市為\n    債務履行地，故原法院應無管轄權。惟抗告人竟向無管轄權\n    之原法院提起訴訟，因而原法院裁定移送於有管轄權之高雄\n    地院，於法核無違誤。抗告意旨指摘原裁定不當，求予廢棄\n    ，為無理由，應予駁回。\n據上論結，本件抗告為無理由，爰裁定如主文。"
  },
  "characters": {
    "judges": [
      "林敬修",
      "吳青蓉",
      "黃騰耀"
    ],
    "prosecutors": [

    ],
    "lawyers": [

    ],
    "clerks": [

    ],
    "plaintiffs": [

    ],
    "defendants": [

    ],
    "prosecutor_office": [

    ],
    "creditors": [

    ],
    "debtors": [

    ],
    "judicial_associate_officer": [

    ]
  },
  "adjudged_at": "2010-05-12",
  "created_at": "2016-01-05 11:55:24",
  "updated_at": "2016-01-05 11:55:24"
}