{
  "identify": "TPH-98-聲-512-20100104-1",
  "court": {
    "name": "臺灣高等法院",
    "code": "TPH"
  },
  "division": {
    "name": "民事",
    "code": "V"
  },
  "year": 98,
  "word": "聲",
  "number": "512",
  "jcheck": "1",
  "reason": "訴訟救助",
  "content": "臺灣高等法院民事裁定                   98年度聲字第512號\n聲  請  人  乙○○\n            甲○○\n相  對  人  丙○○\n上列聲請人因與相對人丙○○間請求返還房屋事件，聲請訴訟救\n助，本院裁定如下：\n    主  文\n聲請駁回。\n    理  由\n一、按當事人無資力支出訴訟費用者，依民事訴訟法第107條規\n    定，法院應依聲請以裁定准予救助。所謂無資力，係指窘於\n    生活，且缺乏經濟信用者而言，最高法院43年台抗字第152\n    號著有判例可參。又聲請訴訟救助，依民事訴訟法第109條\n    第2項、第284條規定，應提出能即時調查之證據，以釋明請\n    求救助之事由。法院調查聲請人是否無資力支出訴訟費用，\n    專就聲請人提出之證據為之，如聲請人並未提出證據，或依\n    其提出之證據，未能信其無資力支出訴訟費用之主張為真實\n    ，即應將其聲請駁回，並無派員調查之必要。\n二、本件聲請人因與相對人丙○○間請求返還房屋事件（本院98\n    年上易字第1225號），聲請人即上訴人聲請訴訟救助，主張\n    其無資力，無非提出身心障礙手冊為據，然身心障礙手冊僅\n    係個人健康之證明而已，並非有無資力之證明。聲請人既未\n    能提出即時調查之證據，以釋明其無資力支出訴訟費用之主\n    張為真實，其聲請即屬無從准許，爰裁定如主文。\n中    華    民    國    99    年    1    月    4      日\n                  民事第十庭\n                        審判長法  官  黃豐澤\n                              法  官  林麗玲\n                              法  官  吳謀焰\n正本係照原本作成。\n不得抗告。\n中    華    民    國    99    年    1     月    4     日\n                              書記官  鄭淑昀",
  "structure": {
    "main": "聲請駁回。",
    "reason": "一、按當事人無資力支出訴訟費用者，依民事訴訟法第107條規\n    定，法院應依聲請以裁定准予救助。所謂無資力，係指窘於\n    生活，且缺乏經濟信用者而言，最高法院43年台抗字第152\n    號著有判例可參。又聲請訴訟救助，依民事訴訟法第109條\n    第2項、第284條規定，應提出能即時調查之證據，以釋明請\n    求救助之事由。法院調查聲請人是否無資力支出訴訟費用，\n    專就聲請人提出之證據為之，如聲請人並未提出證據，或依\n    其提出之證據，未能信其無資力支出訴訟費用之主張為真實\n    ，即應將其聲請駁回，並無派員調查之必要。\n二、本件聲請人因與相對人丙○○間請求返還房屋事件（本院98\n    年上易字第1225號），聲請人即上訴人聲請訴訟救助，主張\n    其無資力，無非提出身心障礙手冊為據，然身心障礙手冊僅\n    係個人健康之證明而已，並非有無資力之證明。聲請人既未\n    能提出即時調查之證據，以釋明其無資力支出訴訟費用之主\n    張為真實，其聲請即屬無從准許，爰裁定如主文。"
  },
  "characters": {
    "judges": [
      "黃豐澤",
      "林麗玲",
      "吳謀焰"
    ],
    "prosecutors": [

    ],
    "lawyers": [

    ],
    "clerks": [

    ],
    "plaintiffs": [

    ],
    "defendants": [

    ],
    "prosecutor_office": [
      "乙"
    ],
    "creditors": [

    ],
    "debtors": [

    ],
    "judicial_associate_officer": [

    ]
  },
  "adjudged_at": "2010-01-04",
  "created_at": "2016-01-05 14:35:28",
  "updated_at": "2016-01-05 14:35:28"
}