{
  "identify": "TPH-98-交抗-2816-20100104-1",
  "court": {
    "name": "臺灣高等法院",
    "code": "TPH"
  },
  "division": {
    "name": "刑事",
    "code": "M"
  },
  "year": 98,
  "word": "交抗",
  "number": "2816",
  "jcheck": "1",
  "reason": "違反道路交通管理處罰條例",
  "content": "臺灣高等法院交通事件裁定            98年度交抗字第2816號\n抗  告  人\n即受處分人  甲○○\n上列抗告人因違反道路交通管理處罰條例案件，不服臺灣士林地\n方法院98年度交聲字第1163號，中華民國98年10月30日裁定（原\n處分案號：北市裁催字第裁22-S00000000號），提起抗告，本院\n裁定如下：\n    主  文\n抗告駁回。\n    理    由\n一、原裁定意旨略以：本件異議人即受處分人甲○○所有車牌號\n    碼4289─QM號自用一般小客車，於民國（下同）96年10月15\n    日15時54分許，停放在設有禁止停車標線之臺南市○○○街\n    12號前，為臺南市政府警察局交通警察大隊員警逕行舉發「\n    在設有禁止停車標線之處所停車（黃線停車）」，並拍照存\n    證後予以拖吊，受處分人逾變更後之應到案期限（ 98年5月\n    27日）60日以上未到案，經原處分機關於 98年8月19日以受\n    處分人確有上開違規情事，逾越應到案期限60日以上，依道\n    路交通管理處罰條例第56條第1項第4款及違反道路交通管理\n    事件統一裁罰基準表等規定，裁處受處分人新臺幣 1,200元\n    罰鍰。原處分核無違誤，受處分人之異議為無理由，應予駁\n    回等語。\n二、抗告意旨略以：\n  (一)現場交通標線不依法定規則，又不明顯清晰，可否停車辨識\n    困難，讓伊誤認，影響伊停車權益，顯有不當。\n  (二)伊自始依規定申訴，並向臺南市政府提起訴願，且過程中多\n    次以陳情書或訴願書送臺北市交通事件裁決所，惟其間未告\n    知或函覆不合程序，而一再催伊繳交罰款，要求限期提出異\n    議狀，並逕行提高罰款。\n  (三)拖吊車於政府機關與民間拖吊公司合約約定範圍外執行拖吊\n    ，係屬違法拖吊，與市警局加強取締、拖吊之區域無關，政\n    府雖編制拖車或委託民間拖吊，惟其拖吊區域範圍應符合合\n    約約定範圍。\n  (四)原審法院於審理時僅依政府函覆為裁定，未能訊問伊諸多異\n    議實情及現場狀況，致影響正確裁定。鈞院實有重新審理之\n    必要，並請擇期訊問伊詳細實情，俾據為重新裁定等語。\n三、按黃實線設於路側者，用以禁止停車，道路交通標誌標線號\n    誌設置規則第149條第1項第1款第4目定有明文；又設有禁止\n    停車標誌、標線之處所不得停車，道路交通安全規則第 112\n    條第1項第4款亦有明文。次按在設有禁止停車標誌、標線之\n    處所停車者，處新臺幣600元以上1,200元以下罰鍰，道路交\n    通管理處罰條例第56條第1項第4款復有明文規定。又違反道\n    路交通管理事件行為人，未依規定自動繳納罰鍰，或未依規\n    定到案聽候裁決，處罰機關應依違反道路交通管理事件統一\n    裁罰基準表於舉發違反道路交通管理事件通知單送達且逾越\n    應到案期限60日之 3個月內，逕行裁決之，違反道路交通管\n    理事件統一裁罰基準及處理細則第44條第 1項前段亦規定明\n    確。\n四、本院經查：\n  (一)本件抗告人即受處分人甲○○所有車牌號碼4289─QM號自用\n    一般小客車，於96年10月15日15時54分許，停放在設有禁止\n    停車標線之臺南市○○○街12號前，為臺南市政府警察局交\n    通警察大隊員警逕行舉發「在設有禁止停車標線之處所停車\n    （黃線停車）」，並拍照存證後予以拖吊等情，有臺北市交\n    通事件裁決所北市裁催字第裁22-S00000000號違反道路交通\n    管理事件裁決書 1份、臺北市交通事件裁決所98年10月13日\n    北市裁申字第 09842388900號函及其所附臺南市警察局南市\n    警交字第S00000000號舉發違反道路交通管理事件通知單1份\n    、彩色採證照片1張附卷（見原審卷第9頁、第47頁、第49頁\n    ）可稽，是抗告人所有上開自小客車停放於設有禁止停車標\n    誌、標線處所之違規事實，洵堪認定。\n  (二)抗告人抗告意旨雖指稱現場交通標線不明顯清晰，可否停車\n    辨識困難，讓伊誤認，影響伊停車權益，顯有不當云云，惟\n    觀諸臺北市交通事件裁決所所檢附之彩色採證照片內容所示\n    ，舉發地點明顯劃設黃線，並無不明顯清晰、辨識困難之情\n    形，有該照片 1張附卷（見原審卷第49頁）可稽，是抗告人\n    上開所指，顯係其個人推諉卸責之詞，要無足採。又按道路\n    主管機關於法令授權範圍內，基於權責對於各項行政措施，\n    包括道路設計、交通號誌、標誌、標線之設置、更動，為具\n    體裁量、規劃，以求達成道路充分有效能利用、維持交通秩\n    序、保障道路使用人往來便利與安全之行政目的，除有違背\n    法令或明顯矛盾、錯誤外，縱司法機關亦不得涉入此行政權\n    核心領域。又不論交通號誌、標誌、標線之設置當否，或有\n    無造成用路人之不便，乃公路主管機關之職權範圍，一般人\n    均可向主管機關表達意見、建議，抗告人如認本件標線劃設\n    不當，亦應向主管交通設施工程之機關請求改善，在改善前\n    ，對於現有之交通標線仍應共同遵守，以建立行車秩序，不\n    得藉詞交通標線設置不當，而解免違規之責任。是抗告人抗\n    告意旨僅憑一己之判斷空言指摘現場交通標線不依法定規則\n    設置云云，亦非可採。至於抗告人抗告意旨另指稱原審法院\n    未能訊問伊實情及現場狀況，致影響正確裁定云云，惟依上\n    揭裁決書、舉發通知單及彩色採證照片等資料已足認定抗告\n    人之違規事實，實無再訊問之必要，抗告人執陳詞指摘原裁\n    定，亦屬無據。\n  (三)次查，臺南市警察局分別於 96年11月30日、98年7月27日，\n    臺北市交通裁決所分別於 98年2月3日、同年3月30日、同年\n    4月16日、同年4月29日、同年9月1日，均以函覆通知受處分\n    人：依道路交通管理處罰條例第87條第 1項規定，受處分人\n    不服第 8條主管機關所為之處罰，得於接到裁決書之翌日起\n    20日內，以司法狀紙撰狀，向管轄地方法院聲明異議，此有\n    臺南市警察局 96年11月30日南市警交字第09650396200號函\n    、臺南市警察局98年7月27日南市警交字第09850248760號函\n    、臺北市交通裁決所 98年2月3日北市裁申字第09830101600\n    號函、臺北市交通裁決所98年3月30日北市裁申字第0983276\n    2800號函、臺北市交通裁決所98年4月16日北市裁申字第098\n    34167200號函、臺北市交通裁決所 98年4月29日北市裁申字\n    第09834893000號函、臺北市交通裁決所 98年9月1日北市裁\n    申字第09840302800號函影本各1份附卷（見原審卷第28頁、\n    第32至39頁、第43頁、第52頁）可稽，且據臺北市交通裁決\n    所98年4月29日北市裁管字第09834893000號函說明二所示：\n    「抗告人駕駛車輛違反道路交通管理處罰條例一案係辦理移\n    轉案件，為確保台端權益，違規通知單之應到案日期改為98\n    年 5月27日，…請依據前揭新應到案日期持本函（或以郵政\n    匯票新臺幣 900元整隨函寄交）至本所，採低額繳納罰鍰結\n    案或至即時連線銷案之超商多媒體機或臺北富邦銀行繳款，\n    逾期則依到案日期依法逕行裁決」，有該函影本 1份在卷（\n    見原審卷第52頁）可參，可知抗告人提起訴願之原處分機關\n    臺南市警察局及主管機關臺北市交通裁決所已數度通知抗告\n    人就交通違規案件不服處罰之救濟程序，且於移轉後為確保\n    抗告人之權益而將應到案日期變更，並告知逾期繳納之效果\n    ，然抗告人捨上開救濟方式而不為，僅一再陳情、申訴，致\n    逾越應到案期限60日以上，臺北市交通裁決所依此逕予裁處\n    罰鍰新臺幣 1,200元，經核尚無不合，是抗告人抗告意旨指\n    稱原處分機關未告知或函覆不合程序，而一再催伊繳交罰款\n    ，要求限期提出異議狀，並逕行提高罰款云云，顯與卷證內\n    容不符，委無可採。\n  (四)末查，按道路交通管理處罰條例第87條第 1項規定，得向法\n    院聲明異議者，僅得針對原處分機關之「處罰事項」，然執\n    行違規車輛之拖吊措施部分，係民間拖吊公司為輔助警察機\n    關執行違規事項之行政行為，該部分是否合法，本非原處分\n    之範圍，是關於此部分之爭執，本院自毋庸審究，是抗告人\n    抗告意旨另以拖吊車於政府機關與民間拖吊公司合約約定範\n    圍外執行拖吊係屬違法拖吊等語指摘原裁定，容有誤會，自\n    非可採。\n  (五)綜上，抗告人確有將其所有上開自小客車停放於設有禁止停\n    車標誌、標線處所之違規行為，原審法院因認原處分機關就\n    抗告人之上開違規行為，依據道路交通管理處罰條例第56條\n    第1項第4款及違反道路交通管理事件統一裁罰基準表等規定\n    ，裁處新臺幣 1,200元罰鍰，核無違誤，而駁回抗告人於原\n    審法院之聲明異議，經核並無不合，抗告人猶執陳詞空言否\n    認有違規行為，提起抗告，為無理由，應予駁回。\n五、據上論結，應依道路交通案件處理辦法第26條，刑事訴訟法\n    第412條，裁定如主文。\n中    華    民    國    99    年    1     月    4     日\n                  刑事第二庭審判長法  官  洪光燦\n                                  法  官  林恆吉\n                                  法  官  宋明蒼\n以上正本證明與原本無異。\n不得再抗告。\n                                  書記官  駱麗君\n中    華    民    國    99    年    1     月    4     日\n",
  "structure": {
    "main": "抗告駁回。",
    "reason": "一、原裁定意旨略以：本件異議人即受處分人甲○○所有車牌號\n    碼4289─QM號自用一般小客車，於民國（下同）96年10月15\n    日15時54分許，停放在設有禁止停車標線之臺南市○○○街\n    12號前，為臺南市政府警察局交通警察大隊員警逕行舉發「\n    在設有禁止停車標線之處所停車（黃線停車）」，並拍照存\n    證後予以拖吊，受處分人逾變更後之應到案期限（ 98年5月\n    27日）60日以上未到案，經原處分機關於 98年8月19日以受\n    處分人確有上開違規情事，逾越應到案期限60日以上，依道\n    路交通管理處罰條例第56條第1項第4款及違反道路交通管理\n    事件統一裁罰基準表等規定，裁處受處分人新臺幣 1,200元\n    罰鍰。原處分核無違誤，受處分人之異議為無理由，應予駁\n    回等語。\n二、抗告意旨略以：\n  (一)現場交通標線不依法定規則，又不明顯清晰，可否停車辨識\n    困難，讓伊誤認，影響伊停車權益，顯有不當。\n  (二)伊自始依規定申訴，並向臺南市政府提起訴願，且過程中多\n    次以陳情書或訴願書送臺北市交通事件裁決所，惟其間未告\n    知或函覆不合程序，而一再催伊繳交罰款，要求限期提出異\n    議狀，並逕行提高罰款。\n  (三)拖吊車於政府機關與民間拖吊公司合約約定範圍外執行拖吊\n    ，係屬違法拖吊，與市警局加強取締、拖吊之區域無關，政\n    府雖編制拖車或委託民間拖吊，惟其拖吊區域範圍應符合合\n    約約定範圍。\n  (四)原審法院於審理時僅依政府函覆為裁定，未能訊問伊諸多異\n    議實情及現場狀況，致影響正確裁定。鈞院實有重新審理之\n    必要，並請擇期訊問伊詳細實情，俾據為重新裁定等語。\n三、按黃實線設於路側者，用以禁止停車，道路交通標誌標線號\n    誌設置規則第149條第1項第1款第4目定有明文；又設有禁止\n    停車標誌、標線之處所不得停車，道路交通安全規則第 112\n    條第1項第4款亦有明文。次按在設有禁止停車標誌、標線之\n    處所停車者，處新臺幣600元以上1,200元以下罰鍰，道路交\n    通管理處罰條例第56條第1項第4款復有明文規定。又違反道\n    路交通管理事件行為人，未依規定自動繳納罰鍰，或未依規\n    定到案聽候裁決，處罰機關應依違反道路交通管理事件統一\n    裁罰基準表於舉發違反道路交通管理事件通知單送達且逾越\n    應到案期限60日之 3個月內，逕行裁決之，違反道路交通管\n    理事件統一裁罰基準及處理細則第44條第 1項前段亦規定明\n    確。\n四、本院經查：\n  (一)本件抗告人即受處分人甲○○所有車牌號碼4289─QM號自用\n    一般小客車，於96年10月15日15時54分許，停放在設有禁止\n    停車標線之臺南市○○○街12號前，為臺南市政府警察局交\n    通警察大隊員警逕行舉發「在設有禁止停車標線之處所停車\n    （黃線停車）」，並拍照存證後予以拖吊等情，有臺北市交\n    通事件裁決所北市裁催字第裁22-S00000000號違反道路交通\n    管理事件裁決書 1份、臺北市交通事件裁決所98年10月13日\n    北市裁申字第 09842388900號函及其所附臺南市警察局南市\n    警交字第S00000000號舉發違反道路交通管理事件通知單1份\n    、彩色採證照片1張附卷（見原審卷第9頁、第47頁、第49頁\n    ）可稽，是抗告人所有上開自小客車停放於設有禁止停車標\n    誌、標線處所之違規事實，洵堪認定。\n  (二)抗告人抗告意旨雖指稱現場交通標線不明顯清晰，可否停車\n    辨識困難，讓伊誤認，影響伊停車權益，顯有不當云云，惟\n    觀諸臺北市交通事件裁決所所檢附之彩色採證照片內容所示\n    ，舉發地點明顯劃設黃線，並無不明顯清晰、辨識困難之情\n    形，有該照片 1張附卷（見原審卷第49頁）可稽，是抗告人\n    上開所指，顯係其個人推諉卸責之詞，要無足採。又按道路\n    主管機關於法令授權範圍內，基於權責對於各項行政措施，\n    包括道路設計、交通號誌、標誌、標線之設置、更動，為具\n    體裁量、規劃，以求達成道路充分有效能利用、維持交通秩\n    序、保障道路使用人往來便利與安全之行政目的，除有違背\n    法令或明顯矛盾、錯誤外，縱司法機關亦不得涉入此行政權\n    核心領域。又不論交通號誌、標誌、標線之設置當否，或有\n    無造成用路人之不便，乃公路主管機關之職權範圍，一般人\n    均可向主管機關表達意見、建議，抗告人如認本件標線劃設\n    不當，亦應向主管交通設施工程之機關請求改善，在改善前\n    ，對於現有之交通標線仍應共同遵守，以建立行車秩序，不\n    得藉詞交通標線設置不當，而解免違規之責任。是抗告人抗\n    告意旨僅憑一己之判斷空言指摘現場交通標線不依法定規則\n    設置云云，亦非可採。至於抗告人抗告意旨另指稱原審法院\n    未能訊問伊實情及現場狀況，致影響正確裁定云云，惟依上\n    揭裁決書、舉發通知單及彩色採證照片等資料已足認定抗告\n    人之違規事實，實無再訊問之必要，抗告人執陳詞指摘原裁\n    定，亦屬無據。\n  (三)次查，臺南市警察局分別於 96年11月30日、98年7月27日，\n    臺北市交通裁決所分別於 98年2月3日、同年3月30日、同年\n    4月16日、同年4月29日、同年9月1日，均以函覆通知受處分\n    人：依道路交通管理處罰條例第87條第 1項規定，受處分人\n    不服第 8條主管機關所為之處罰，得於接到裁決書之翌日起\n    20日內，以司法狀紙撰狀，向管轄地方法院聲明異議，此有\n    臺南市警察局 96年11月30日南市警交字第09650396200號函\n    、臺南市警察局98年7月27日南市警交字第09850248760號函\n    、臺北市交通裁決所 98年2月3日北市裁申字第09830101600\n    號函、臺北市交通裁決所98年3月30日北市裁申字第0983276\n    2800號函、臺北市交通裁決所98年4月16日北市裁申字第098\n    34167200號函、臺北市交通裁決所 98年4月29日北市裁申字\n    第09834893000號函、臺北市交通裁決所 98年9月1日北市裁\n    申字第09840302800號函影本各1份附卷（見原審卷第28頁、\n    第32至39頁、第43頁、第52頁）可稽，且據臺北市交通裁決\n    所98年4月29日北市裁管字第09834893000號函說明二所示：\n    「抗告人駕駛車輛違反道路交通管理處罰條例一案係辦理移\n    轉案件，為確保台端權益，違規通知單之應到案日期改為98\n    年 5月27日，…請依據前揭新應到案日期持本函（或以郵政\n    匯票新臺幣 900元整隨函寄交）至本所，採低額繳納罰鍰結\n    案或至即時連線銷案之超商多媒體機或臺北富邦銀行繳款，\n    逾期則依到案日期依法逕行裁決」，有該函影本 1份在卷（\n    見原審卷第52頁）可參，可知抗告人提起訴願之原處分機關\n    臺南市警察局及主管機關臺北市交通裁決所已數度通知抗告\n    人就交通違規案件不服處罰之救濟程序，且於移轉後為確保\n    抗告人之權益而將應到案日期變更，並告知逾期繳納之效果\n    ，然抗告人捨上開救濟方式而不為，僅一再陳情、申訴，致\n    逾越應到案期限60日以上，臺北市交通裁決所依此逕予裁處\n    罰鍰新臺幣 1,200元，經核尚無不合，是抗告人抗告意旨指\n    稱原處分機關未告知或函覆不合程序，而一再催伊繳交罰款\n    ，要求限期提出異議狀，並逕行提高罰款云云，顯與卷證內\n    容不符，委無可採。\n  (四)末查，按道路交通管理處罰條例第87條第 1項規定，得向法\n    院聲明異議者，僅得針對原處分機關之「處罰事項」，然執\n    行違規車輛之拖吊措施部分，係民間拖吊公司為輔助警察機\n    關執行違規事項之行政行為，該部分是否合法，本非原處分\n    之範圍，是關於此部分之爭執，本院自毋庸審究，是抗告人\n    抗告意旨另以拖吊車於政府機關與民間拖吊公司合約約定範\n    圍外執行拖吊係屬違法拖吊等語指摘原裁定，容有誤會，自\n    非可採。\n  (五)綜上，抗告人確有將其所有上開自小客車停放於設有禁止停\n    車標誌、標線處所之違規行為，原審法院因認原處分機關就\n    抗告人之上開違規行為，依據道路交通管理處罰條例第56條\n    第1項第4款及違反道路交通管理事件統一裁罰基準表等規定\n    ，裁處新臺幣 1,200元罰鍰，核無違誤，而駁回抗告人於原\n    審法院之聲明異議，經核並無不合，抗告人猶執陳詞空言否\n    認有違規行為，提起抗告，為無理由，應予駁回。\n五、據上論結，應依道路交通案件處理辦法第26條，刑事訴訟法\n    第412條，裁定如主文。"
  },
  "characters": {
    "judges": [
      "洪光燦",
      "林恆吉",
      "宋明蒼"
    ],
    "prosecutors": [

    ],
    "lawyers": [

    ],
    "clerks": [
      "駱麗君"
    ],
    "plaintiffs": [

    ],
    "defendants": [

    ],
    "prosecutor_office": [

    ],
    "creditors": [

    ],
    "debtors": [

    ],
    "judicial_associate_officer": [

    ]
  },
  "adjudged_at": "2010-01-04",
  "created_at": "2016-01-05 14:34:26",
  "updated_at": "2016-01-05 14:34:26"
}