{
  "identify": "TPH-98-交抗-2903-20100104-1",
  "court": {
    "name": "臺灣高等法院",
    "code": "TPH"
  },
  "division": {
    "name": "刑事",
    "code": "M"
  },
  "year": 98,
  "word": "交抗",
  "number": "2903",
  "jcheck": "1",
  "reason": "違反道路交通管理處罰條例",
  "content": "臺灣高等法院交通事件裁定            98年度交抗字第2903號\n抗   告   人\n即原處分機關  交通部公路總局臺北區監理所板橋監理所\n抗   告   人\n即 受處分 人  甲○\n上列抗告人因違反道路交通管理處罰條例案件，不服臺灣板橋地\n方法院98年度交聲字第3837號，中華民國98年11月24日裁定（原\n處分案號：板監裁字裁41-C00000000號），提起抗告，本院裁定\n如下：\n    主  文\n原裁定撤銷。\n甲○汽車駕駛人，行經有燈光號誌管制之交岔路口闖紅燈，處罰\n鍰新臺幣肆仟伍佰元，並記違規點數參點。\n    理  由\n一、原裁定意旨略以：異議人即受處分人甲○駕駛車號FVP─249\n    號重型機車，於97年9月9日下午 4時20分許，在臺北縣板橋\n    市○○○路、實踐路路口處，確有因「駕車行經有燈光號誌\n    管制之交岔路口闖紅燈」之違規行為，應堪認定。惟查，受\n    處分人於本件違規情節尚非重大，所生影響亦非甚鉅，而原\n    處分機關竟不予詳察上情，以及審酌違反道路交通管理事件\n    統一裁罰基準及處理細則第43條第 1項規定即：「違反道路\n    交通管理事件之裁決，應參酌舉發違規事實、違反情節、稽\n    查人員處理意見及受處分人陳述，依基準表裁處，不得枉縱\n    或偏頗。」而對受處分人為適當之裁處，僅依受處分人有逾\n    越應到案期限60日以上之單一裁量要素而逕為此一違規行為\n    中之機器腳踏車之違規而為高額之罰鍰金額新臺幣 4,500元\n    及記違規點數 3點之裁罰，其適用法律所為之行政裁量已達\n    濫用程度，而屬違法，故原處分機關於行政裁量部分則難認\n    有理由，當認受處分人此部分所指原處分機關所為之裁決顯\n    有瑕疵及違背法令等語，尚非無據，尚可認有理由，故本件\n    自應由原審法院將原處分予以撤銷。然本件受處分人既有前\n    開駕車闖紅燈（左轉）之違規事實，則依道路交通案件處理\n    辦法第20條規定，即受處分人之聲明異議雖部分無理由而原\n    處分違法，原審法院自得將原處分予以撤銷，改依道路交通\n    管理處罰條例第53條第1項、第63條第1項第 3款之規定，並\n    參以行政罰法第18條第一項規定裁量要素而審酌受處分人之\n    違規情節、所生危害、否認違規行為、態度難謂良好、應受\n    責難程度、所生影響等一切情狀，改諭知受處分人罰鍰新臺\n    幣3,000元，並記違規點數3點之處罰，以資適法等語。\n二、受處分人之抗告意旨略以：\n  (一)伊無紅燈左轉之情事，員警所言毫無證據，且反於事實，伊\n    要求員警舉證，員警不但當場無法舉證，亦未說明無法舉證\n    之原因，原裁定以此作為處罰之依據，顯有違誤。又伊要求\n    員警舉證後才簽收，而非當場拒簽拒收，原裁定亦有違誤。\n  (二)員警證稱：受處分人與另一輛重型機車於館前東路紅燈時一\n    起左轉實踐路，而另一輛重型機車逆向逃逸，當時無法立刻\n    給受處分人看照片係因還拍到其他機車車牌等語，然照片僅\n    拍到伊，未見另一輛機車車牌，伊係看見該機車閃過員警直\n    衝而去而非逆向逃逸，員警所言與照片不符，且單純車牌並\n    無所謂隱私或秘密性，員警所言顯係推諉卸責、詭辯之詞。\n  (三)員警證稱：伊有告知受處分人可申訴之管道，並跟受處分人\n    解釋如何違規，受處分人請求我們不要開或罰少一點等語，\n    惟依錄音內容，該員警從未向伊提及如何申訴，伊亦無未對\n    該員警請求。又員警證稱：伊告知受處分人如拒簽收紅單，\n    監理站不會另行寄發舉發通知單，且期限係 9月24日前至監\n    理站，警方告知視同已收受等語，然依錄音內容，該員警當\n    場並未清楚告知。\n  (四)員警雖證稱當時實踐路已經綠燈好幾秒等語，然有可能伊係\n    闖黃燈或綠燈末尾，員警心中秒數並不客觀，可能僅差 0.1\n    秒，伊並不算闖紅燈。原審未詳查物理現象，亦未勘查現場\n    實際狀況，單以照片上實踐路之綠燈，便直接推測伊闖紅燈\n    ，違反經驗法則、論理法則及物理法則。且員警所舉照片之\n    內容乃受處分人於實踐路上，當時該路段號誌為綠燈，然是\n    否只要被拍到身後之號誌為綠燈，均認為闖紅燈？以該照片\n    實不能認受處分人有闖紅燈之行為。又員警所舉照片，除編\n    號5之照片為事發當天之照片外，其餘均係事發1年後員警於\n    同地點另行拍照之照片，其內容已與事發現場有別，原裁定\n    以此照片佐證，有違證據法則。\n  (五)原審法官與員警係相交甚篤？或係熟悉觀人眉宇之術？竟可\n    對員警之性格斷然認定其無編織不實舉發之原因及理由，且\n    無證據可證明員警所言之真偽，單憑員警之職業即逕認其無\n    說謊之可能，法官已有偏頗，令伊難以信服，況員警為逃避\n    執法失當之懲處，而編織謊言合法化自己行為亦不無可能，\n    實務上不乏員警造假、捏造、誣陷之情事，法官斷然認定員\n    警所言為真，原裁定無客觀性，非公平裁定。又員警可能因\n    績效壓力或獎金激勵，導致其積極為取締之行為，甚至進一\n    步羅織罪名，原裁定未察，逕認員警行為合法，實有違誤。\n  (六)交通事件依道路交通管理處罰條例之規定，係準用刑事訴訟\n    法，則員警係控訴者之角色，應負舉證責任，惟本件員警顯\n    未盡舉證責任。如依原裁定所言，員警有證人資格，則應跳\n    脫控訴者之角色，避免控訴之詞作為證人之證詞，又同時作\n    為證據，毫無中立可言，此等控訴者兼人證係證據上之循環\n    論證，原裁定係誤認員警之角色與責任。又員警基於身分所\n    製作之文書，形式上屬公文書性質，惟公文書之內容，涉及\n    控訴人民之權利，損害財產權之實體內容，應經對質詰問取\n    得證據能力，無法因身分上製作之文書逕自取得證據能力，\n    故原裁定亦有違誤。\n  (七)拒簽及拒收理由均屬法定應記載事項，係為避免警察以幽靈\n    抗辯或主張而違法開單，及事後可知當初拒簽情事，故未記\n    載拒簽及拒收理由，足以推知員警之舉發行為顯有瑕疵，且\n    未載明應記載事項之文書，其效力亦有疑義，原裁定稱未記\n    載拒簽及拒收理由與案情無重大關係，顯有違誤等語。\n三、原處分機關之抗告意旨略以：本案受處分人甲○於前揭時間\n    ，騎乘上開重型機車，行經在臺北縣板橋市○○○路、實踐\n    路路口處，經臺北縣政府警察局板橋交通分隊執勤員警，以\n    北縣警交字第 C00000000號違反道路交通管理事件通知單，\n    攔停後當場舉發其有違反道路交通管理處罰條例第53條第 1\n    項紅燈左轉之違規行為，並為原審法院所認定，本案因逾應\n    到案日期60日以上仍未繳納罰鍰，本站依違反道路交通管理\n    事件統一裁罰基準表所訂裁罰基準處罰新臺幣 4,500元，於\n    法並無不合，原審法院撤銷原處分，改處罰鍰新臺幣 3,000\n    元，應非妥適，請鈞院撤銷原裁定，維持本站裁決，以維護\n    道路交通管理處罰條例第53條處罰之公正性等語。\n四、按駕駛人駕駛汽車，應遵守道路交通標誌、標線、號誌之指\n    示，道路交通安全規則第90條前段定有明文。又道路交通標\n    誌標線號誌設置規則第206條第5款第 1目規定「圓形紅燈」\n    之行車管制號誌係表示禁止車輛通行，並不得超越停止線或\n    進入路口。如汽車駕駛人，行經有燈光號誌管制之交岔路口\n    闖紅燈者，處新臺幣1,800元以上5,400元以下罰鍰；又汽車\n    駕駛人有第53條所規定之情形者，除依原條款處罰鍰外，並\n    予記違規點數3點，道路交通管理處罰條例第53條第1項、第\n    63條第1項第3款分別定有明文。\n五、本院經查：\n  (一)本件抗告人即受處分人甲○於前揭時間，騎乘上開重型機車\n    ，行經有燈光號誌管制之臺北縣板橋市○○○路與實踐路路\n    口時，闖紅燈進入交岔路口等情，業據證人即舉發員警楊松\n    樺於原審法院訊問時證述：「當天我是執勤下午3時至5時之\n    取締交通違規勤務，當時定點取締，於板橋市○○○路及實\n    踐路，於實踐路地政事務所前，當時只有我一人執勤，主要\n    是稽查任何交通違規勤務。當天下午 4時20分左右，受處分\n    人與另一輛重機車於館前東路紅燈時一起左轉實踐路，我就\n    當場攔停並吹哨音，另一輛違規機車就逆向逃逸，我立刻用\n    相機拍照存證，兩輛機車都有拍照，受處分人的機車我是拍\n    照正面，當時無法立刻給受處分人看照片是因為還有拍到他\n    人的機車車牌，基於隱私所以不能給受處分人，我有告知他\n    可以去申訴的管道。有拍到兩輛已經違規左轉的機車，當場\n    受處分人就口頭提出異議，我有跟他解釋如何的違規，他也\n    明白情形，有請求我們不要開或罰少一點，我們有蒐證，所\n    以必須依法行政，我還是開紅燈左轉，但他拒絕簽收紅單，\n    我就告知如果拒絕簽收紅單，監理站不會另行寄發舉發通知\n    單給他，我有跟他說必須於期限即 9月24日之前到監理站，\n    並告知他如果警方告知就視同已收受」、「當時我距離地政\n    事務所約50公尺，我站的位置可以清楚看到實踐路口燈號的\n    變換情形，實踐路口燈號變換情形有 3個時相，當時受處分\n    人左轉至實踐路時，我所看到實踐路的時相是綠燈，表示館\n    前東路號誌是紅燈，當時實踐路綠燈已經好幾秒了，我們不\n    會馬上變換燈號馬上攔停，那邊只能綠燈直行」、「庭呈編\n    號 1照片就是以受處分人騎車過來要左轉的角度，當時應該\n    要停在停止線後方，編號 2照片就是我攔查點的地方，我當\n    時機車就放在轉角，我人站的攔檢點距離事發路口只有50、\n    60公尺左右，並沒有受處分人所說的100、200公尺那麼遠，\n    編號3照片是我特意拉遠鏡頭把整個路口拍攝進去，編號4照\n    片是我攔檢站立的位置往前方拍攝，編號 5照片是當天的情\n    形，當時還有另一輛機車看到我站在那邊就逆向逃走，後來\n    我也舉發那輛機車，本張照片亦可清楚看出號誌轉換情形」\n    等語（原審卷第19頁、第19頁背面、第34頁背面參見）明確\n    ，並有證人結文2紙、臺北縣政府警察局北縣警交字第C0000\n    0000號舉發違反道路交通管理事件通知單、交通部公路總局\n    臺北區監理所板橋監理站板監裁字裁41-C00000000號違反道\n    路交通管理事件裁決書影本、違規地點標示圖各1份及照片5\n    張附卷（原審卷第 9頁至第11頁、第21頁、第36頁至第39頁\n    參見）可稽，是受處分人騎乘機車行經有燈光號誌管制之交\n    岔路口闖紅燈之違規事實，洵堪認定。\n  (二)按法院受理交通事件，準用刑事訴訟法之規定；其處理辦法\n    ，由司法院會同行政院定之，道路交通管理處罰條例第89條\n    定有明文。又聲明異議案件之處理，除準用刑事訴訟法有關\n    規定外，依道路交通案件處理辦法之規定處理之；交通法庭\n    就聲明異議之案件，必要時得訊問受處分人及其他關係人，\n    並得傳喚證人，命行鑑定，實施勘驗，亦為該辦法第4條第2\n    項及第16條所明定。又員警舉發交通違規案件，並不以舉發\n    照片為唯一證明方法（道路交通管理處罰條例第7條、第7條\n    之1、第 7條之2規定參照）。是依現行法律規定，法院處理\n    交通事件，並不限於科學儀器所採證據，惟仍須就事件所涉\n    相關證據資料，包括供述及非供述證據，依據證據法則，憑\n    以認定行為人交通違規行為之有無。此乃因交通違規事件之\n    特性，行為態樣甚多，復有瞬間即逝行為，實無法於有交通\n    違規同時，全部得以即時利用科學儀器，取得證據資料；即\n    使屬於方便以科學儀器採證之交通違規行為，普遍採用，不\n    但所費不貲，也有實際困難。若舉發員警係親眼見聞違規經\n    過，並以證人身分具結後在法院證述，仍不失為認定交通違\n    規事實有無之證據方法。況執勤員警舉發交通違規，係依道\n    路交通管理處罰條例授權所為之職權行使。而汽車駕駛人闖\n    紅燈、違規迴轉等違規行為之取締，揆其行為本質，多係發\n    生於瞬間，通常多委由當場執行取締違規公務員之認識及判\n    斷，且必須為立即之取締作為，此為達成維持交通秩序目的\n    所必要。且依道路交通管理處罰條例之規定，此種立即性之\n    舉發違規，多依員警之認知判斷已足，並無必須另有其他積\n    極佐證：如其他目擊證人或必須拍攝照片等，始構成處分要\n    件之規定。此係因執行職務之公務員，通常多具有一定之考\n    選資格與專業訓練，且其執法之對象係不特定之大眾，故其\n    立場經立法機關推定，應具有客觀、公正與公平之特質，而\n    無故意偏頗之虞。本件受處分人未就執勤員警之舉發有誤，\n    提出明確事證以供調查，並依舉發員警於原審法院審理時當\n    庭所呈之現場照片所示，其當時執行欄檢所處之位置，確可\n    清楚辨明該交岔路口之燈號及行車動態，且經核無任何其他\n    相關證據，足資證明舉發員警確有捏造事實違法取締之情形\n    ，而員警就本件違規事實之前開證述內容，經查亦無不合常\n    理之處，故證人本其維護交通秩序及行車安全等職責所為之\n    本件交通違規舉發，自應予以採信。是受處分人空言指稱員\n    警所言毫無證據，且反於事實，原審法院據此認定伊有違規\n    事實，顯有違誤，而單憑員警之職業即逕認其無說謊之可能\n    ，亦難以信服云云，自無可採。又受處分人另以伊通過該路\n    口時可能係闖黃燈或綠燈末尾，且員警可能因績效壓力或獎\n    金激勵，導致其積極為取締之行為，甚至進一步羅織罪名，\n    而員警為逃避執法失當之懲處，編織謊言合法化自己行為，\n    亦不無可能等詞置辯，然其均屬受處分人個人主觀臆測之詞\n    ，並無根據，亦難憑信。\n  (三)復按交通警察掣單舉發違反道路交通管理處罰條例所列之違\n    規事實，本質上為行政處分，係公務員基於職務上之公權力\n    ，依法就特定之具體事件所為之具公法上效果之單方面行政\n    行為，如無形式上顯然之瑕疵可指，基於公務員為公法上行\n    為，具有公信力之原則，該行政行為當可被推定為真正，其\n    據以依法處分之事實認定亦為正確無誤，此與民事訴訟法第\n    355條第2項規定「文書依其程式及意旨得認作公文書，推定\n    其為真正」之情形相同。本此公信原則，立法者乃賦予行政\n    機關制定違反道路交通事件統一裁罰基準及處理細則，使執\n    行勤務員警得當機處分，以達其維護交通秩序、安全之行政\n    目的。反之，若謂公務員一切行政行為均需預留證據以證其\n    實，則國家行政勢必窒礙難行，準此，刑事訴訟法就犯罪證\n    據所列有關之規定與屬於行政秩序罰之交通違規裁罰本質不\n    合之部分，自不在準用之列。從而，交通違規行政爭訟之舉\n    證責任原理，應非如刑事案件中，必須超越任何合理懷疑，\n    始可為有罪判決之嚴格程度，而係應與民事訴訟之舉證責任\n    原理相類似，亦即基本上應就行政機關與人民所各自主張有\n    利於己之事實，分配其應盡之舉證責任，而非逕予準用刑事\n    訴訟上之「無罪推定」原則，此觀諸行政訴訟法第 136條規\n    定行政訴訟程序準用民事訴訟法第 277條舉證責任分配原則\n    之立法意旨亦明。查本件違規事實業經舉發員警提出臺北縣\n    政府警察局北縣警交字第 C00000000號舉發違反道路交通管\n    理事件通知單1份、違規地點標示圖1份及採證照片 5張等為\n    證，並於原審法院結證前揭舉發之經過，則員警雖未當場提\n    出採證照片，尚難謂其未盡舉證之責任。受處分人之抗告意\n    旨再指稱員警當場無法舉證，未盡舉證責任，且交通事件準\n    用刑事訴訟法之規定，員警應跳脫控訴者之角色，其基於身\n    分所製作之文書，未經詰問，亦應無證據能力，原裁定斷然\n    認定員警舉發為真，有違無罪推定原則云云，容有誤會，均\n    無可採。\n  (四)又觀諸員警於原審法院審理時庭呈之編號 5照片內容所示，\n    一部機車朝員警照相位置正面行駛，另一部機車則往員警照\n    相位置逆向駛離，有該照片附卷（原審卷第39頁參見）可稽\n    ，足證員警於原審法院所證稱：「…受處分人與另一輛重機\n    車於館前東路紅燈時一起左轉實踐路，我就當場攔停並吹哨\n    音，另一輛違規機車就逆向逃逸，我立刻用相機拍照存證，\n    兩輛機車都有拍照，受處分人的機車我是拍照正面」等語（\n    原審卷第19頁參見）正確無訛，是受處分人抗告意旨辯稱照\n    片僅拍到伊，未見另一輛機車，伊係看見該機車閃過員警直\n    衝而去而非逆向逃逸，員警所言與照片不符云云，與上開卷\n    證內容不符，殊無可信。又參酌上開編號 5照片內容及員警\n    之上開證述，可知員警僅係就當時由館前東路左轉進入至實\n    踐路之車輛予以攔停舉發，並非以任何於實踐路上號誌為綠\n    燈時通行之車輛，均認為闖紅燈，是受處分人執此辯稱該照\n    片不能證明其有闖紅燈之行為，顯非可採。再者，員警所舉\n    照片編號1至4之照片雖係事發 1年後員警於同地點另行拍照\n    之照片，惟該等照片僅在佐證該交叉路口之車輛通行方向、\n    交通號誌之變換狀態及員警舉發當時所處之攔檢位置，縱周\n    邊環境略有改變，亦不影響本件違規事實之認定，受處分人\n    抗告意旨執此指摘原裁定，亦屬無據。\n  (五)另據原審法院審理時當庭勘驗員警於事發現場以錄音筆錄製\n    之現場舉發錄音經過情形結果，認為：「全片錄音 6分23秒\n    ，全程連續錄音，內容大致如員警於原審法院所證述，受處\n    分人當時係與證人爭執有無違規闖紅燈之事實，待員警要製\n    開舉發通知單，受處分人表示不願簽收，證人並有告知應於\n    97 年9月24日前自行至監理站繳納，並表示警方及監理站不\n    會再另行寄發舉發通知單。」等語（原審卷第19頁背面參見\n    ）明確，是受處分人抗告意旨指摘員警當場並未告知應到案\n    時間及處所及如何申訴云云，亦與卷證內容不符，委無可採\n    。再按行為人有違反道路交通管理處罰條例之情形，應填製\n    舉發通知單，並於被通知人欄予以勾記，其係當場舉發者，\n    應填記駕駛人或行為人姓名、性別、出生年月日、地址、身\n    分證統一編號及車主姓名、地址、車牌號碼、車輛種類。被\n    查獲之駕駛人或行為人為受處分人時，應於填記通知單後將\n    通知聯交付該駕駛人或行為人簽名或蓋章收受之；拒絕簽章\n    者，仍應將通知聯交付該駕駛人或行為人收受，並記明其事\n    由及交付之時間；拒絕收受者，應告知其應到案時間及處所\n    ，並記明事由與告知事項，視為已收受，違反道路交通管理\n    事件統一裁罰基準及處理細則第11條第1項第1款有明文可參\n    。由其文義可知，所謂記明其事由，係指記明拒絕簽章或拒\n    絕收受等語，而非應記明受處分人拒絕簽章或拒絕收受之原\n    因或理由，是受處分人抗告意旨指稱伊因員警無法當場舉證\n    ，遂拒簽、拒收，而舉發通知單上未記載其拒簽及拒收之理\n    由，員警之舉發行為自有瑕疵，其效力亦有疑義云云，容有\n    誤會，顯係其個人推諉卸責之詞，要無足採。\n  (六)末查，本件原裁定係以原處分機關僅依受處分人有逾越應到\n    案期限60日以上之單一裁量要素而逕就機器腳踏車之違規為\n    高額之罰鍰金額新臺幣4,500元及記違規點數3點之裁罰，其\n    適用法律所為之行政裁量已達濫用程度，係屬違法，而撤銷\n    原處分，固非無見。惟按司法院大法官會議釋字第 511號解\n    釋：「為加強道路交通管理，維護交通秩序，確保道路交通\n    安全，道路交通管理處罰條例對違反該條例之行為定有各項\n    行政罰。同條例第9條第1項規定應受罰鍰處罰之行為人接獲\n    違反道路交通管理事件通知單後，得於15日內逕依各該條款\n    罰鍰最低額，自動繳納結案。依同條例第92條授權訂定之違\n    反道路交通管理事件統一裁罰標準及處理細則第41條第 1項\n    及48條第 1項僅係就上開意旨為具體細節之規定，並未逾越\n    母法之授權，與法律保留原則亦無違背，就此部分與司法院\n    釋字第423號解釋所涉聲請事件尚屬有間。至上開細則第 41\n    條第 2項規定，行為人逾指定應到案日期後到案，另同細則\n    第44條第 1項規定違反道路交通管理事件行為人未依規定自\n    動繳納罰鍰或未依規定到案聽候裁決者，處罰機關一律依標\n    準表規定之金額處以罰鍰，此屬法律授權主管機關就裁罰事\n    宜所訂定之裁量基準，其罰鍰之額度並未逾越法律明定得裁\n    罰之上限，且寓有避免各行政機關於相同事件恣意為不同裁\n    罰之功能，亦非法所不許。上開細則於憲法保障人民財產權\n    之意旨並無牴觸。」，又除行政機關行使裁量權之過程或結\n    果，有逾越權限或濫用權力之情形，應以違法論者外，本於\n    權力分立原則，法院基本上應尊重行政機關之裁量決定而作\n    有限之司法審查。本件受處分人未於應到案日期前自動繳納\n    罰款，亦未依規定到案聽候裁決，而本件之裁決時間為98年\n    10月13日，已逾應到案期限（97年9月24日前） 60日以上，\n    原處分機關遂依違反道路交通管理事件統一裁罰標準及處理\n    細則第44條第 1項規定，一律依「違反道路交通管理事件統\n    一裁罰基準表」逕行裁決處罰鍰新臺幣 4,500元，核其罰鍰\n    之額度並未逾越母法，即道路交通管理處罰條例第53條明定\n    得裁罰之上限新臺幣 5,400元，且寓有避免各行政機關於相\n    同事件恣意為不同裁罰之功能，非法所不許，此為前揭解釋\n    所揭櫫，則原處分機關據上開規定嗣後對受處分人逕行裁處\n    最高額罰鍰之裁罰處分，其適用法律並未逾越權限或濫用權\n    力而有違法之情事，原裁定就上開情形未予審酌，認原處分\n    裁罰違法，似有未洽。是原處分機關抗告意旨認受處分人因\n    逾應到案日期60日以上仍未繳納罰鍰，逕依違反道路交通管\n    理事件統一裁罰基準表所訂裁罰基準處罰新臺幣 4,500元，\n    於法並無不合云云，尚非無理由。\n  (七)綜上，受處分人確有於上述時地騎乘機車行經有燈光號誌管\n    制之交岔路口闖紅燈之違規行為，原裁定認甲○汽車駕駛人\n    行經有燈光號誌管制之交岔路口闖紅燈部分，經核並無違誤\n    ，受處分人此部分之抗告為無理由。惟原裁定諭知受處分人\n    處罰鍰新臺幣3,000 元部分既有上開可議之處，自屬無可維\n    持，本院應予撤銷，以期適法，且受處分人上開違規行為事\n    證已明，無再發回調查之必要，再按依道路交通管理處罰條\n    例第89條規定，法院受理有關交通事件，準用刑事訴訟法之\n    規定，依刑事訴訟法第370 條前段規定：「由被告上訴或為\n    被告利益而上訴者，第二審法院不得諭知較重於原審判決之\n    刑」，即所謂「不利益變更禁止原則」，惟該原則僅限於原\n    判決適用法條並無不當時始有其適用，苟原判決有適用法條\n    不當之情形時，第二審法院即得撤銷原判決，另為適法之判\n    決而諭知較原審法院為重之刑，此參諸刑事訴訟法第370 條\n    後段自明。又原處分機關之抗告意旨雖未就原裁定關於記違\n    規點數部分提起抗告，然本案係單獨之交通違規行為，罰鍰\n    處分及記違規點數部分無從區分，另查受處分人抗告雖無理\n    由，然原裁定既有上揭可議之處，本院自應將原裁定撤銷，\n    並自為裁罰，就罰鍰及記違規點數等處罰，一併重新諭知如\n    主文第2 項所示。\n六、據上論斷，應依道路交通案件處理辦法第26條，道路交通管\n    理處罰條例第89條、第53條第1項、第63條第1項第 3款，刑\n    事訴訟法第413條，裁定如主文。\n中    華    民    國    99    年    1     月    4     日\n                  刑事第二庭審判長法  官  洪光燦\n                                  法  官  林恆吉\n                                  法  官  宋明蒼\n以上正本證明與原本無異。\n不得再抗告。\n                                  書記官  駱麗君\n中    華    民    國    99    年    1     月    4     日\n",
  "structure": {
    "main": "原裁定撤銷。\n甲○汽車駕駛人，行經有燈光號誌管制之交岔路口闖紅燈，處罰\n鍰新臺幣肆仟伍佰元，並記違規點數參點。",
    "reason": "一、原裁定意旨略以：異議人即受處分人甲○駕駛車號FVP─249\n    號重型機車，於97年9月9日下午 4時20分許，在臺北縣板橋\n    市○○○路、實踐路路口處，確有因「駕車行經有燈光號誌\n    管制之交岔路口闖紅燈」之違規行為，應堪認定。惟查，受\n    處分人於本件違規情節尚非重大，所生影響亦非甚鉅，而原\n    處分機關竟不予詳察上情，以及審酌違反道路交通管理事件\n    統一裁罰基準及處理細則第43條第 1項規定即：「違反道路\n    交通管理事件之裁決，應參酌舉發違規事實、違反情節、稽\n    查人員處理意見及受處分人陳述，依基準表裁處，不得枉縱\n    或偏頗。」而對受處分人為適當之裁處，僅依受處分人有逾\n    越應到案期限60日以上之單一裁量要素而逕為此一違規行為\n    中之機器腳踏車之違規而為高額之罰鍰金額新臺幣 4,500元\n    及記違規點數 3點之裁罰，其適用法律所為之行政裁量已達\n    濫用程度，而屬違法，故原處分機關於行政裁量部分則難認\n    有理由，當認受處分人此部分所指原處分機關所為之裁決顯\n    有瑕疵及違背法令等語，尚非無據，尚可認有理由，故本件\n    自應由原審法院將原處分予以撤銷。然本件受處分人既有前\n    開駕車闖紅燈（左轉）之違規事實，則依道路交通案件處理\n    辦法第20條規定，即受處分人之聲明異議雖部分無理由而原\n    處分違法，原審法院自得將原處分予以撤銷，改依道路交通\n    管理處罰條例第53條第1項、第63條第1項第 3款之規定，並\n    參以行政罰法第18條第一項規定裁量要素而審酌受處分人之\n    違規情節、所生危害、否認違規行為、態度難謂良好、應受\n    責難程度、所生影響等一切情狀，改諭知受處分人罰鍰新臺\n    幣3,000元，並記違規點數3點之處罰，以資適法等語。\n二、受處分人之抗告意旨略以：\n  (一)伊無紅燈左轉之情事，員警所言毫無證據，且反於事實，伊\n    要求員警舉證，員警不但當場無法舉證，亦未說明無法舉證\n    之原因，原裁定以此作為處罰之依據，顯有違誤。又伊要求\n    員警舉證後才簽收，而非當場拒簽拒收，原裁定亦有違誤。\n  (二)員警證稱：受處分人與另一輛重型機車於館前東路紅燈時一\n    起左轉實踐路，而另一輛重型機車逆向逃逸，當時無法立刻\n    給受處分人看照片係因還拍到其他機車車牌等語，然照片僅\n    拍到伊，未見另一輛機車車牌，伊係看見該機車閃過員警直\n    衝而去而非逆向逃逸，員警所言與照片不符，且單純車牌並\n    無所謂隱私或秘密性，員警所言顯係推諉卸責、詭辯之詞。\n  (三)員警證稱：伊有告知受處分人可申訴之管道，並跟受處分人\n    解釋如何違規，受處分人請求我們不要開或罰少一點等語，\n    惟依錄音內容，該員警從未向伊提及如何申訴，伊亦無未對\n    該員警請求。又員警證稱：伊告知受處分人如拒簽收紅單，\n    監理站不會另行寄發舉發通知單，且期限係 9月24日前至監\n    理站，警方告知視同已收受等語，然依錄音內容，該員警當\n    場並未清楚告知。\n  (四)員警雖證稱當時實踐路已經綠燈好幾秒等語，然有可能伊係\n    闖黃燈或綠燈末尾，員警心中秒數並不客觀，可能僅差 0.1\n    秒，伊並不算闖紅燈。原審未詳查物理現象，亦未勘查現場\n    實際狀況，單以照片上實踐路之綠燈，便直接推測伊闖紅燈\n    ，違反經驗法則、論理法則及物理法則。且員警所舉照片之\n    內容乃受處分人於實踐路上，當時該路段號誌為綠燈，然是\n    否只要被拍到身後之號誌為綠燈，均認為闖紅燈？以該照片\n    實不能認受處分人有闖紅燈之行為。又員警所舉照片，除編\n    號5之照片為事發當天之照片外，其餘均係事發1年後員警於\n    同地點另行拍照之照片，其內容已與事發現場有別，原裁定\n    以此照片佐證，有違證據法則。\n  (五)原審法官與員警係相交甚篤？或係熟悉觀人眉宇之術？竟可\n    對員警之性格斷然認定其無編織不實舉發之原因及理由，且\n    無證據可證明員警所言之真偽，單憑員警之職業即逕認其無\n    說謊之可能，法官已有偏頗，令伊難以信服，況員警為逃避\n    執法失當之懲處，而編織謊言合法化自己行為亦不無可能，\n    實務上不乏員警造假、捏造、誣陷之情事，法官斷然認定員\n    警所言為真，原裁定無客觀性，非公平裁定。又員警可能因\n    績效壓力或獎金激勵，導致其積極為取締之行為，甚至進一\n    步羅織罪名，原裁定未察，逕認員警行為合法，實有違誤。\n  (六)交通事件依道路交通管理處罰條例之規定，係準用刑事訴訟\n    法，則員警係控訴者之角色，應負舉證責任，惟本件員警顯\n    未盡舉證責任。如依原裁定所言，員警有證人資格，則應跳\n    脫控訴者之角色，避免控訴之詞作為證人之證詞，又同時作\n    為證據，毫無中立可言，此等控訴者兼人證係證據上之循環\n    論證，原裁定係誤認員警之角色與責任。又員警基於身分所\n    製作之文書，形式上屬公文書性質，惟公文書之內容，涉及\n    控訴人民之權利，損害財產權之實體內容，應經對質詰問取\n    得證據能力，無法因身分上製作之文書逕自取得證據能力，\n    故原裁定亦有違誤。\n  (七)拒簽及拒收理由均屬法定應記載事項，係為避免警察以幽靈\n    抗辯或主張而違法開單，及事後可知當初拒簽情事，故未記\n    載拒簽及拒收理由，足以推知員警之舉發行為顯有瑕疵，且\n    未載明應記載事項之文書，其效力亦有疑義，原裁定稱未記\n    載拒簽及拒收理由與案情無重大關係，顯有違誤等語。\n三、原處分機關之抗告意旨略以：本案受處分人甲○於前揭時間\n    ，騎乘上開重型機車，行經在臺北縣板橋市○○○路、實踐\n    路路口處，經臺北縣政府警察局板橋交通分隊執勤員警，以\n    北縣警交字第 C00000000號違反道路交通管理事件通知單，\n    攔停後當場舉發其有違反道路交通管理處罰條例第53條第 1\n    項紅燈左轉之違規行為，並為原審法院所認定，本案因逾應\n    到案日期60日以上仍未繳納罰鍰，本站依違反道路交通管理\n    事件統一裁罰基準表所訂裁罰基準處罰新臺幣 4,500元，於\n    法並無不合，原審法院撤銷原處分，改處罰鍰新臺幣 3,000\n    元，應非妥適，請鈞院撤銷原裁定，維持本站裁決，以維護\n    道路交通管理處罰條例第53條處罰之公正性等語。\n四、按駕駛人駕駛汽車，應遵守道路交通標誌、標線、號誌之指\n    示，道路交通安全規則第90條前段定有明文。又道路交通標\n    誌標線號誌設置規則第206條第5款第 1目規定「圓形紅燈」\n    之行車管制號誌係表示禁止車輛通行，並不得超越停止線或\n    進入路口。如汽車駕駛人，行經有燈光號誌管制之交岔路口\n    闖紅燈者，處新臺幣1,800元以上5,400元以下罰鍰；又汽車\n    駕駛人有第53條所規定之情形者，除依原條款處罰鍰外，並\n    予記違規點數3點，道路交通管理處罰條例第53條第1項、第\n    63條第1項第3款分別定有明文。\n五、本院經查：\n  (一)本件抗告人即受處分人甲○於前揭時間，騎乘上開重型機車\n    ，行經有燈光號誌管制之臺北縣板橋市○○○路與實踐路路\n    口時，闖紅燈進入交岔路口等情，業據證人即舉發員警楊松\n    樺於原審法院訊問時證述：「當天我是執勤下午3時至5時之\n    取締交通違規勤務，當時定點取締，於板橋市○○○路及實\n    踐路，於實踐路地政事務所前，當時只有我一人執勤，主要\n    是稽查任何交通違規勤務。當天下午 4時20分左右，受處分\n    人與另一輛重機車於館前東路紅燈時一起左轉實踐路，我就\n    當場攔停並吹哨音，另一輛違規機車就逆向逃逸，我立刻用\n    相機拍照存證，兩輛機車都有拍照，受處分人的機車我是拍\n    照正面，當時無法立刻給受處分人看照片是因為還有拍到他\n    人的機車車牌，基於隱私所以不能給受處分人，我有告知他\n    可以去申訴的管道。有拍到兩輛已經違規左轉的機車，當場\n    受處分人就口頭提出異議，我有跟他解釋如何的違規，他也\n    明白情形，有請求我們不要開或罰少一點，我們有蒐證，所\n    以必須依法行政，我還是開紅燈左轉，但他拒絕簽收紅單，\n    我就告知如果拒絕簽收紅單，監理站不會另行寄發舉發通知\n    單給他，我有跟他說必須於期限即 9月24日之前到監理站，\n    並告知他如果警方告知就視同已收受」、「當時我距離地政\n    事務所約50公尺，我站的位置可以清楚看到實踐路口燈號的\n    變換情形，實踐路口燈號變換情形有 3個時相，當時受處分\n    人左轉至實踐路時，我所看到實踐路的時相是綠燈，表示館\n    前東路號誌是紅燈，當時實踐路綠燈已經好幾秒了，我們不\n    會馬上變換燈號馬上攔停，那邊只能綠燈直行」、「庭呈編\n    號 1照片就是以受處分人騎車過來要左轉的角度，當時應該\n    要停在停止線後方，編號 2照片就是我攔查點的地方，我當\n    時機車就放在轉角，我人站的攔檢點距離事發路口只有50、\n    60公尺左右，並沒有受處分人所說的100、200公尺那麼遠，\n    編號3照片是我特意拉遠鏡頭把整個路口拍攝進去，編號4照\n    片是我攔檢站立的位置往前方拍攝，編號 5照片是當天的情\n    形，當時還有另一輛機車看到我站在那邊就逆向逃走，後來\n    我也舉發那輛機車，本張照片亦可清楚看出號誌轉換情形」\n    等語（原審卷第19頁、第19頁背面、第34頁背面參見）明確\n    ，並有證人結文2紙、臺北縣政府警察局北縣警交字第C0000\n    0000號舉發違反道路交通管理事件通知單、交通部公路總局\n    臺北區監理所板橋監理站板監裁字裁41-C00000000號違反道\n    路交通管理事件裁決書影本、違規地點標示圖各1份及照片5\n    張附卷（原審卷第 9頁至第11頁、第21頁、第36頁至第39頁\n    參見）可稽，是受處分人騎乘機車行經有燈光號誌管制之交\n    岔路口闖紅燈之違規事實，洵堪認定。\n  (二)按法院受理交通事件，準用刑事訴訟法之規定；其處理辦法\n    ，由司法院會同行政院定之，道路交通管理處罰條例第89條\n    定有明文。又聲明異議案件之處理，除準用刑事訴訟法有關\n    規定外，依道路交通案件處理辦法之規定處理之；交通法庭\n    就聲明異議之案件，必要時得訊問受處分人及其他關係人，\n    並得傳喚證人，命行鑑定，實施勘驗，亦為該辦法第4條第2\n    項及第16條所明定。又員警舉發交通違規案件，並不以舉發\n    照片為唯一證明方法（道路交通管理處罰條例第7條、第7條\n    之1、第 7條之2規定參照）。是依現行法律規定，法院處理\n    交通事件，並不限於科學儀器所採證據，惟仍須就事件所涉\n    相關證據資料，包括供述及非供述證據，依據證據法則，憑\n    以認定行為人交通違規行為之有無。此乃因交通違規事件之\n    特性，行為態樣甚多，復有瞬間即逝行為，實無法於有交通\n    違規同時，全部得以即時利用科學儀器，取得證據資料；即\n    使屬於方便以科學儀器採證之交通違規行為，普遍採用，不\n    但所費不貲，也有實際困難。若舉發員警係親眼見聞違規經\n    過，並以證人身分具結後在法院證述，仍不失為認定交通違\n    規事實有無之證據方法。況執勤員警舉發交通違規，係依道\n    路交通管理處罰條例授權所為之職權行使。而汽車駕駛人闖\n    紅燈、違規迴轉等違規行為之取締，揆其行為本質，多係發\n    生於瞬間，通常多委由當場執行取締違規公務員之認識及判\n    斷，且必須為立即之取締作為，此為達成維持交通秩序目的\n    所必要。且依道路交通管理處罰條例之規定，此種立即性之\n    舉發違規，多依員警之認知判斷已足，並無必須另有其他積\n    極佐證：如其他目擊證人或必須拍攝照片等，始構成處分要\n    件之規定。此係因執行職務之公務員，通常多具有一定之考\n    選資格與專業訓練，且其執法之對象係不特定之大眾，故其\n    立場經立法機關推定，應具有客觀、公正與公平之特質，而\n    無故意偏頗之虞。本件受處分人未就執勤員警之舉發有誤，\n    提出明確事證以供調查，並依舉發員警於原審法院審理時當\n    庭所呈之現場照片所示，其當時執行欄檢所處之位置，確可\n    清楚辨明該交岔路口之燈號及行車動態，且經核無任何其他\n    相關證據，足資證明舉發員警確有捏造事實違法取締之情形\n    ，而員警就本件違規事實之前開證述內容，經查亦無不合常\n    理之處，故證人本其維護交通秩序及行車安全等職責所為之\n    本件交通違規舉發，自應予以採信。是受處分人空言指稱員\n    警所言毫無證據，且反於事實，原審法院據此認定伊有違規\n    事實，顯有違誤，而單憑員警之職業即逕認其無說謊之可能\n    ，亦難以信服云云，自無可採。又受處分人另以伊通過該路\n    口時可能係闖黃燈或綠燈末尾，且員警可能因績效壓力或獎\n    金激勵，導致其積極為取締之行為，甚至進一步羅織罪名，\n    而員警為逃避執法失當之懲處，編織謊言合法化自己行為，\n    亦不無可能等詞置辯，然其均屬受處分人個人主觀臆測之詞\n    ，並無根據，亦難憑信。\n  (三)復按交通警察掣單舉發違反道路交通管理處罰條例所列之違\n    規事實，本質上為行政處分，係公務員基於職務上之公權力\n    ，依法就特定之具體事件所為之具公法上效果之單方面行政\n    行為，如無形式上顯然之瑕疵可指，基於公務員為公法上行\n    為，具有公信力之原則，該行政行為當可被推定為真正，其\n    據以依法處分之事實認定亦為正確無誤，此與民事訴訟法第\n    355條第2項規定「文書依其程式及意旨得認作公文書，推定\n    其為真正」之情形相同。本此公信原則，立法者乃賦予行政\n    機關制定違反道路交通事件統一裁罰基準及處理細則，使執\n    行勤務員警得當機處分，以達其維護交通秩序、安全之行政\n    目的。反之，若謂公務員一切行政行為均需預留證據以證其\n    實，則國家行政勢必窒礙難行，準此，刑事訴訟法就犯罪證\n    據所列有關之規定與屬於行政秩序罰之交通違規裁罰本質不\n    合之部分，自不在準用之列。從而，交通違規行政爭訟之舉\n    證責任原理，應非如刑事案件中，必須超越任何合理懷疑，\n    始可為有罪判決之嚴格程度，而係應與民事訴訟之舉證責任\n    原理相類似，亦即基本上應就行政機關與人民所各自主張有\n    利於己之事實，分配其應盡之舉證責任，而非逕予準用刑事\n    訴訟上之「無罪推定」原則，此觀諸行政訴訟法第 136條規\n    定行政訴訟程序準用民事訴訟法第 277條舉證責任分配原則\n    之立法意旨亦明。查本件違規事實業經舉發員警提出臺北縣\n    政府警察局北縣警交字第 C00000000號舉發違反道路交通管\n    理事件通知單1份、違規地點標示圖1份及採證照片 5張等為\n    證，並於原審法院結證前揭舉發之經過，則員警雖未當場提\n    出採證照片，尚難謂其未盡舉證之責任。受處分人之抗告意\n    旨再指稱員警當場無法舉證，未盡舉證責任，且交通事件準\n    用刑事訴訟法之規定，員警應跳脫控訴者之角色，其基於身\n    分所製作之文書，未經詰問，亦應無證據能力，原裁定斷然\n    認定員警舉發為真，有違無罪推定原則云云，容有誤會，均\n    無可採。\n  (四)又觀諸員警於原審法院審理時庭呈之編號 5照片內容所示，\n    一部機車朝員警照相位置正面行駛，另一部機車則往員警照\n    相位置逆向駛離，有該照片附卷（原審卷第39頁參見）可稽\n    ，足證員警於原審法院所證稱：「…受處分人與另一輛重機\n    車於館前東路紅燈時一起左轉實踐路，我就當場攔停並吹哨\n    音，另一輛違規機車就逆向逃逸，我立刻用相機拍照存證，\n    兩輛機車都有拍照，受處分人的機車我是拍照正面」等語（\n    原審卷第19頁參見）正確無訛，是受處分人抗告意旨辯稱照\n    片僅拍到伊，未見另一輛機車，伊係看見該機車閃過員警直\n    衝而去而非逆向逃逸，員警所言與照片不符云云，與上開卷\n    證內容不符，殊無可信。又參酌上開編號 5照片內容及員警\n    之上開證述，可知員警僅係就當時由館前東路左轉進入至實\n    踐路之車輛予以攔停舉發，並非以任何於實踐路上號誌為綠\n    燈時通行之車輛，均認為闖紅燈，是受處分人執此辯稱該照\n    片不能證明其有闖紅燈之行為，顯非可採。再者，員警所舉\n    照片編號1至4之照片雖係事發 1年後員警於同地點另行拍照\n    之照片，惟該等照片僅在佐證該交叉路口之車輛通行方向、\n    交通號誌之變換狀態及員警舉發當時所處之攔檢位置，縱周\n    邊環境略有改變，亦不影響本件違規事實之認定，受處分人\n    抗告意旨執此指摘原裁定，亦屬無據。\n  (五)另據原審法院審理時當庭勘驗員警於事發現場以錄音筆錄製\n    之現場舉發錄音經過情形結果，認為：「全片錄音 6分23秒\n    ，全程連續錄音，內容大致如員警於原審法院所證述，受處\n    分人當時係與證人爭執有無違規闖紅燈之事實，待員警要製\n    開舉發通知單，受處分人表示不願簽收，證人並有告知應於\n    97 年9月24日前自行至監理站繳納，並表示警方及監理站不\n    會再另行寄發舉發通知單。」等語（原審卷第19頁背面參見\n    ）明確，是受處分人抗告意旨指摘員警當場並未告知應到案\n    時間及處所及如何申訴云云，亦與卷證內容不符，委無可採\n    。再按行為人有違反道路交通管理處罰條例之情形，應填製\n    舉發通知單，並於被通知人欄予以勾記，其係當場舉發者，\n    應填記駕駛人或行為人姓名、性別、出生年月日、地址、身\n    分證統一編號及車主姓名、地址、車牌號碼、車輛種類。被\n    查獲之駕駛人或行為人為受處分人時，應於填記通知單後將\n    通知聯交付該駕駛人或行為人簽名或蓋章收受之；拒絕簽章\n    者，仍應將通知聯交付該駕駛人或行為人收受，並記明其事\n    由及交付之時間；拒絕收受者，應告知其應到案時間及處所\n    ，並記明事由與告知事項，視為已收受，違反道路交通管理\n    事件統一裁罰基準及處理細則第11條第1項第1款有明文可參\n    。由其文義可知，所謂記明其事由，係指記明拒絕簽章或拒\n    絕收受等語，而非應記明受處分人拒絕簽章或拒絕收受之原\n    因或理由，是受處分人抗告意旨指稱伊因員警無法當場舉證\n    ，遂拒簽、拒收，而舉發通知單上未記載其拒簽及拒收之理\n    由，員警之舉發行為自有瑕疵，其效力亦有疑義云云，容有\n    誤會，顯係其個人推諉卸責之詞，要無足採。\n  (六)末查，本件原裁定係以原處分機關僅依受處分人有逾越應到\n    案期限60日以上之單一裁量要素而逕就機器腳踏車之違規為\n    高額之罰鍰金額新臺幣4,500元及記違規點數3點之裁罰，其\n    適用法律所為之行政裁量已達濫用程度，係屬違法，而撤銷\n    原處分，固非無見。惟按司法院大法官會議釋字第 511號解\n    釋：「為加強道路交通管理，維護交通秩序，確保道路交通\n    安全，道路交通管理處罰條例對違反該條例之行為定有各項\n    行政罰。同條例第9條第1項規定應受罰鍰處罰之行為人接獲\n    違反道路交通管理事件通知單後，得於15日內逕依各該條款\n    罰鍰最低額，自動繳納結案。依同條例第92條授權訂定之違\n    反道路交通管理事件統一裁罰標準及處理細則第41條第 1項\n    及48條第 1項僅係就上開意旨為具體細節之規定，並未逾越\n    母法之授權，與法律保留原則亦無違背，就此部分與司法院\n    釋字第423號解釋所涉聲請事件尚屬有間。至上開細則第 41\n    條第 2項規定，行為人逾指定應到案日期後到案，另同細則\n    第44條第 1項規定違反道路交通管理事件行為人未依規定自\n    動繳納罰鍰或未依規定到案聽候裁決者，處罰機關一律依標\n    準表規定之金額處以罰鍰，此屬法律授權主管機關就裁罰事\n    宜所訂定之裁量基準，其罰鍰之額度並未逾越法律明定得裁\n    罰之上限，且寓有避免各行政機關於相同事件恣意為不同裁\n    罰之功能，亦非法所不許。上開細則於憲法保障人民財產權\n    之意旨並無牴觸。」，又除行政機關行使裁量權之過程或結\n    果，有逾越權限或濫用權力之情形，應以違法論者外，本於\n    權力分立原則，法院基本上應尊重行政機關之裁量決定而作\n    有限之司法審查。本件受處分人未於應到案日期前自動繳納\n    罰款，亦未依規定到案聽候裁決，而本件之裁決時間為98年\n    10月13日，已逾應到案期限（97年9月24日前） 60日以上，\n    原處分機關遂依違反道路交通管理事件統一裁罰標準及處理\n    細則第44條第 1項規定，一律依「違反道路交通管理事件統\n    一裁罰基準表」逕行裁決處罰鍰新臺幣 4,500元，核其罰鍰\n    之額度並未逾越母法，即道路交通管理處罰條例第53條明定\n    得裁罰之上限新臺幣 5,400元，且寓有避免各行政機關於相\n    同事件恣意為不同裁罰之功能，非法所不許，此為前揭解釋\n    所揭櫫，則原處分機關據上開規定嗣後對受處分人逕行裁處\n    最高額罰鍰之裁罰處分，其適用法律並未逾越權限或濫用權\n    力而有違法之情事，原裁定就上開情形未予審酌，認原處分\n    裁罰違法，似有未洽。是原處分機關抗告意旨認受處分人因\n    逾應到案日期60日以上仍未繳納罰鍰，逕依違反道路交通管\n    理事件統一裁罰基準表所訂裁罰基準處罰新臺幣 4,500元，\n    於法並無不合云云，尚非無理由。\n  (七)綜上，受處分人確有於上述時地騎乘機車行經有燈光號誌管\n    制之交岔路口闖紅燈之違規行為，原裁定認甲○汽車駕駛人\n    行經有燈光號誌管制之交岔路口闖紅燈部分，經核並無違誤\n    ，受處分人此部分之抗告為無理由。惟原裁定諭知受處分人\n    處罰鍰新臺幣3,000 元部分既有上開可議之處，自屬無可維\n    持，本院應予撤銷，以期適法，且受處分人上開違規行為事\n    證已明，無再發回調查之必要，再按依道路交通管理處罰條\n    例第89條規定，法院受理有關交通事件，準用刑事訴訟法之\n    規定，依刑事訴訟法第370 條前段規定：「由被告上訴或為\n    被告利益而上訴者，第二審法院不得諭知較重於原審判決之\n    刑」，即所謂「不利益變更禁止原則」，惟該原則僅限於原\n    判決適用法條並無不當時始有其適用，苟原判決有適用法條\n    不當之情形時，第二審法院即得撤銷原判決，另為適法之判\n    決而諭知較原審法院為重之刑，此參諸刑事訴訟法第370 條\n    後段自明。又原處分機關之抗告意旨雖未就原裁定關於記違\n    規點數部分提起抗告，然本案係單獨之交通違規行為，罰鍰\n    處分及記違規點數部分無從區分，另查受處分人抗告雖無理\n    由，然原裁定既有上揭可議之處，本院自應將原裁定撤銷，\n    並自為裁罰，就罰鍰及記違規點數等處罰，一併重新諭知如\n    主文第2 項所示。\n六、據上論斷，應依道路交通案件處理辦法第26條，道路交通管\n    理處罰條例第89條、第53條第1項、第63條第1項第 3款，刑\n    事訴訟法第413條，裁定如主文。"
  },
  "characters": {
    "judges": [
      "洪光燦",
      "林恆吉",
      "宋明蒼"
    ],
    "prosecutors": [

    ],
    "lawyers": [

    ],
    "clerks": [
      "駱麗君"
    ],
    "plaintiffs": [

    ],
    "defendants": [

    ],
    "prosecutor_office": [

    ],
    "creditors": [

    ],
    "debtors": [

    ],
    "judicial_associate_officer": [

    ]
  },
  "adjudged_at": "2010-01-04",
  "created_at": "2016-01-05 14:34:29",
  "updated_at": "2016-01-05 14:34:29"
}