{
  "identify": "TPH-99-重上更(二)-65-20100512-1",
  "court": {
    "name": "臺灣高等法院",
    "code": "TPH"
  },
  "division": {
    "name": "刑事",
    "code": "M"
  },
  "year": 99,
  "word": "重上更(二)",
  "number": "65",
  "jcheck": "1",
  "reason": "違反槍砲彈藥刀械管制條例",
  "content": "臺灣高等法院刑事判決            99年度重上更(二)字第65號\n上  訴  人\n即  被  告  乙○○\n指定辯護人  本院公設辯護人李廣澤\n上列上訴人因違反槍砲彈藥刀械管制條例案件，不服臺灣臺北地\n方法院93年度訴字第126號，中華民國94年8月16日第一審判決（\n起訴案號：臺灣臺北地方法院檢察署92年度偵字第24956號），\n提起上訴，判決後經最高法院第二次發回更審，本院判決如下：\n    主  文\n原判決關於乙○○未經許可，持有可發射子彈，具有殺傷力之改\n造槍枝部分撤銷。\n乙○○共同未經許可，持有可發射子彈具有殺傷力之改造手槍，\n處有期徒刑壹年貳月，併科罰金新臺幣拾伍萬元，罰金如易服勞\n役，以新臺幣壹仟元折算壹日；減為有期徒刑柒月，併科罰金新\n臺幣柒萬伍仟元，罰金如易服勞役，以新臺幣壹仟元折算壹日。\n扣案之仿GLOCK廠拾柒型半自動手槍製造之改造手槍（槍枝管制\n編號0000000000）壹支、口徑玖mm制式子彈顆，均沒收。\n    事  實\n壹、乙○○之友人馬豫瑞（所犯未經許可持有可發射子彈具有殺\n    傷力之改造手槍罪，業另經本院判處有期徒刑1年6月，併科\n    罰金新臺幣20萬元確定），於民國92年12月14日或15日，將\n    其所購得可發射子彈具有殺傷力之仿克拉克改造手槍1支（\n    槍枝管制編號0000000000）及口徑9mm制式子彈3顆，持至臺\n    北縣新店市○○路87巷22號乙○○之鐵工廠，欲利用工具，\n    加以改造。乙○○與馬豫瑞即基於共同之犯意，未經許可，\n    持有該槍彈，並將該改造手槍置於屋內工作檯上；子彈則由\n    乙○○藏置於房間內。嗣於92年12月16日，為警持搜索票前\n    往上址搜索，乙○○僱用之張秋月（所犯隱匿關係他人刑事\n    被告案件證據罪，經判處有期徒刑6月確定）將置於工作檯\n    上之改造手槍丟入浴室浴缸內，仍為警當場查獲，並在乙○\n    ○使用之房間內扣得9mm制式子彈3顆。\n貳、案經臺北縣政府警察局金山分局報請臺灣臺北地方法院檢察\n    署檢察官偵查起訴。\n    理  由\n壹、證據能力部分：\n一、刑事訴訟法第287條之2規定，法院就被告本人之案件調查共\n    同被告時，該共同被告準用有關人證之規定。同法第159條\n    之2規定，被告以外之人（含共同被告、共犯、證人、鑑定\n    人、被害人）於檢察事務官、司法警察官或司法警察調查中\n    所為之陳述，與審判中不符時，其先前之陳述具有較可信之\n    特別情況，且為證明犯罪事實存否所必要者，得為證據。所\n    謂具有較可信之特別情況，係指其陳述係在特別可信為真實\n    之情況下所為者而言。例如被告以外之人出於自然之發言、\n    臨終前之陳述，或違反自己利益之陳述等特別情形均屬之。\n    蓋被告以外之人在類此特別情況下所為之陳述，就通常而言\n    ，虛偽可能性偏低，可信程度較高，若該項陳述為證明犯罪\n    事實存否所必要，自得構成傳聞法則之例外，承認具有證據\n    能力。本件同案被告張秋月於警詢當場指認經警查獲的改造\n    手槍是馬豫瑞所有；同案被告馬豫祥於警詢亦稱：在浴室澡\n    堂內查獲1把GLOCK廠牌改造槍支、制式子彈3顆是我弟弟馬\n    豫瑞和朋友乙○○所有等語，核與張秋月及馬豫祥於原審以\n    證人身分證稱：克拉克17型的那枝槍，我在地檢等候交保時\n    ，乙○○說是綽號「地瓜」楊志平拿去給他修理的，就是偵\n    查卷第179頁左上角那枝等語；及張秋月於原審以證人身分\n    證稱：查獲前一天綽號「地瓜」者拿槍來要乙○○修理好，\n    乙○○有說他不會，他把槍放在工作檯上等語不符。然張秋\n    月及馬豫祥於警詢係在自由意志下陳述，張秋月係受僱於被\n    告；馬瑞祥與馬瑞豫係親生兄弟，倘該槍彈係地瓜任意放置\n    於被告居處，張秋月及馬豫瑞自無於警詢指稱係馬豫瑞所有\n    ；馬豫祥陳稱係馬豫瑞所有，更係違反自己利益，足見二人\n    於警詢陳述顯具有較可信之特別情況，並為證明本件被告犯\n    罪事實存否所必要，自得為證據。\n二、被告以外之人於審判外向法官所為之陳述，得為證據。被告\n    以外之人於偵查中向檢察官所為之陳述，除顯有不可信之情\n    況者外，得為證據。刑事訴訟法第159條之1定有明文，考其\n    立法理由：被告以外之人（含共同被告、共犯、被害人、證\n    人等）於法官面前所為之陳述（含書面及言詞），因其陳述\n    係在法官面前為之，故不問係其他刑事案件之準備程序、審\n    判期日或民事事件或其他訴訟程序之陳述，均係在任意陳述\n    之信用性已受確定保障之情況下所為，因此該等陳述應得作\n    為證據。檢察官職司追訴犯罪，必須對於被告之犯罪事實負\n    舉證之責。就審判程序之訴訟構造言，檢察官係屬與被告相\n    對立之當事人一方（參照本法第三條），是故偵查中對被告\n    以外之人所為之偵查筆錄，或被告以外之人向檢察官所提之\n    書面陳述，性質上均屬傳聞證據，且常為認定被告有罪之證\n    據，自理論上言，如未予被告反對詰問、適當辯解之機會，\n    一律准其為證據，似與當事人進行主義之精神不無扞格之處\n    ，對被告之防禦權亦有所妨礙；然而現階段刑事訴訟法規定\n    檢察官代表國家偵查犯罪、實施公訴，依法其有訊問被告、\n    證人及鑑定人之權，證人、鑑定人且須具結，而實務運作時\n    ，偵查中檢察官向被告以外之人所取得之陳述，原則上均能\n    遵守法律規定，不致違法取供，其可信性極高，為兼顧理論\n    與實務，爰於第二項明定被告以外之人於偵查中向檢察官所\n    為陳述，除顯有不可信之情況者外，得為證據。本件共同正\n    犯馬豫瑞所陳述就被告乙○○部分，亦屬被告以外之人，基\n    於偵查中於檢察官被告身分訊問時，坦承持有本案扣案之槍\n    枝，到被告乙○○處改造。於原審法院法官在聲請羈押庭及\n    起訴移審分別於法官訊問時，仍為同一陳述。雖於其後於原\n    審改稱，未與被告共同持有該槍彈云云。但其不利於已又不\n    利於共犯（乙○○）之陳述，經調查其他證據結果又與事實\n    相符，且其共同持有槍彈部分，也經有罪判決確定，於法官\n    前所為陳述有證據能力，於檢察官偵查中所為陳述，並無顯\n    不可信之情況，亦得為證據。\n貳、實體部分：\n一、訊之上訴人即被告乙○○，矢口否認持有具殺傷力改造手槍\n    及子彈犯行，辯稱：警方在其臺北縣新店市○○路87巷22號\n    工廠搜索時，扣得改造手槍一把及制式子彈3顆，是馬豫瑞\n    的，他要我幫他改造，但我不同意，他放在我這裡，我未持\n    有云云。其於更審前上訴審則辯稱：該槍枝係楊志平即綽號\n    「地瓜」之人所有，帶至居處強迫我修理，我並未同意下，\n    楊志平即將槍彈留下離去，我並無持有之意思云云。\n二、經查：\n（一）被告於警詢時已自白犯行，供稱：我與馬豫祥、馬豫瑞、\n      張秋月係朋友關係，馬豫瑞在我工廠使用車床改造槍械約\n      有20天左右，沙發旁工作檯上的槍枝是馬豫瑞帶來的，警\n      察來時，張秋月可能因為害怕而將工作檯上的槍往門後丟\n      。馬豫瑞要我幫他改造槍械，所以將改造槍械的工具放在\n      我房間。屋內改造手槍的成品、半成品都是馬豫瑞的，改\n      造槍械器具、材料都是我提供的等語（見偵查卷第6頁至\n      第13頁、第202頁至第204頁）。於檢察官偵查中仍坦承：\n      工廠裡的車床、鑽孔機等工具是我的，我在使用，馬豫瑞\n      有用車床在我工廠改造槍械約20天了，為警查獲前的一、\n      二天前，馬豫瑞拿扣案的槍枝來放在工作檯抽屜，我把他\n      收起來放等語（見偵查卷第109頁）。於檢察官向法院聲\n      請羈押時，於原審法院法官訊問時，亦自白供述：我知道\n      馬豫瑞在我工廠改造槍械，我默許他做槍械。（見原審聲\n      羈字卷第12頁）。被告於警詢、偵查中、原審法院羈押庭\n      之自白扣案槍枝係馬豫瑞於警查獲前一、二天攜來其居處\n      及工廠，要被告代為修改之事實。而在被告房內查獲之子\n      彈、被告於上訴本院亦坦承由其藏放房間內（見本院上訴\n      字卷第69頁最後二行）。又已判決確定之共犯馬豫瑞於檢\n      察官訊問時，以被告身分自白供承：經乙○○同意，到乙\n      ○○工廠去改造槍械（見偵查卷第20頁、第21頁），於檢\n      察官聲請羈押時，於法官訊問時仍為同一自白，供承該槍\n      械為其所有，至乙○○處改造（見原審聲羈字卷第12頁）\n      。另於檢察官起訴移審原審法院訊問時，仍自白其偵查中\n      所述為實在（見原審訴字卷第一宗第30頁）。核與同案被\n      告張秋月於警詢當場指認經警查獲的改造手槍是馬豫瑞所\n      有（見偵查卷第24-1頁）。又證人馬豫瑞之兄馬豫祥於警\n      詢陳稱：在台北縣新店市○○路87巷22號工廠浴室澡堂內\n      查獲1把GLOCK廠牌改造槍支、制式子彈3顆是我弟弟馬豫\n      瑞和朋友乙○○所有等語（見偵查卷第16頁）。於檢察官\n      偵查中亦陳稱：我曾勸過我弟弟（馬豫瑞），不要作改造\n      槍的事（見偵查卷第113頁）相互所述，均相符合。又證\n      人即到場搜索之警員竇忠國於原審證稱：改造槍枝是在工\n      廠最後面浴缸裡找到的，馬豫瑞坦承是他的，有提示給馬\n      豫瑞確認。所有在場人都站在證物前面，逐一看證物，逐\n      一簽名。刑事警察局93年5月6日函所附照片一，槍托上有\n      馬豫瑞簽名、蓋印是回到分局之後，交給馬豫瑞看，他說\n      是他的，並簽名、蓋印，之後我們再貼在槍托上等語（見\n      原審卷第二宗第138頁至第146頁）。\n（二）證人楊志平於原審證稱：（偵查卷第179頁鑑定書槍枝上\n      照片）我有買過與照片上同型的手槍，可是不是打17，我\n      買的上面是打18，形狀看起來外表是一樣的。原先我是想\n      要自己用，之後1天我就拿到工廠給馬豫祥。我是在乙○\n      ○的工廠92年12月16日被警方搜索前1、2個月拿給馬豫祥\n      的，查獲前1、2天我沒有到過乙○○的工廠，差不多有1\n      、2個星期沒有去，在搜索的那一天我剛好有經過被警方\n      攔下來，我跟警察說要去前面修理廠找人就走了，但沒有\n      進去乙○○工廠。我拿去的不包含照片上的3顆子彈等語\n      （見原審卷第二宗第150頁至第152頁）。證人楊志平於原\n      審明確指證未曾將扣案槍彈交付被告。另證人甲○○於原\n      審證稱：楊志平曾來我店裡買克拉克17Ｃ型同款灌瓦斯打\n      BB彈的玩具槍，我所販售槍枝沒有殺傷力，（提示偵卷第\n      179頁）同款式的槍枝市面上很多，只看圖片沒有辦法看\n      出是不是我賣出的。子彈不是我出售的等語（見原審卷第\n      二宗第146頁背面至149頁正面）。原審雖未進一步調取槍\n      枝由甲○○指認，本院傳喚拘提甲○○無著，未就原槍枝\n      分辨，然縱楊志平曾向甲○○購買克拉克玩具槍，於查獲\n      前一、二個月帶至被告工廠，要被告改造或交給馬豫祥，\n      但與本案馬豫瑞所帶至被告工廠，查獲扣案之改造手槍無\n      關。\n（三）雖被告於法院審理中翻異改稱：警詢、偵查係為不實之自\n      白云云。證人馬豫祥於原審改稱：克拉克17型的那枝槍，\n      我在地檢署等候交保時，乙○○說是綽號「地瓜」楊志平\n      拿去給他修理的，我介紹「地瓜」去市○○道一家玩具模\n      型玩具槍店去買的，就是偵查卷第179頁左上角那枝云云\n      。證人張秋月於原審亦改稱：查獲前一天綽號「地瓜」者\n      拿槍來要乙○○作並且說不管，就留在那裡，乙○○有說\n      他不會，他把槍放在工作檯上云云（見原審卷第二宗第7\n      頁、第12頁、第15頁至第20頁）。惟馬豫祥僅係聽聞被告\n      告知，並未親眼目睹綽號「地瓜」楊志平交付被告扣案槍\n      彈；自無從為被告有利之依據。再被告及張秋月於警詢精\n      神狀況正常、良好、意識清楚，筆錄亦經詳閱後始行簽名\n      ，並有錄音，核無何強暴、脅迫之事，業據證人即製作筆\n      錄之警員嚴戊坤、羅國粹、郭進興、李錦煌、鄭坤源於原\n      審證述屬實。另證人馬豫祥於警詢精神狀況良好，筆錄亦\n      依馬豫祥意思記載，並親白簽名，亦據證人即製作筆錄之\n      警員竇忠國於原審證述無誤。而被告及張秋月、馬豫祥等\n      人於查獲次日旋即解送臺灣臺北地方法院檢察署檢察官訊\n      問時，亦均未指稱警詢意識不清或警詢筆錄係違反本人意\n      願下所為，被告並自承扣案改造手槍係馬豫瑞攜帶前來（\n      見偵查卷第107頁至第114頁）。被告、馬豫祥於同日經原\n      審聲羈庭訊問時，復均供稱偵查中所言實在（見92年聲羈\n      字第407號卷第12頁、第13頁），足見被告警詢自白及張\n      秋月、馬豫祥警詢所稱，均在自由意志下陳述無疑。馬豫\n      祥與馬豫瑞係親生兄弟，被告與馬豫瑞則為朋友關係，另\n      張秋月則受雇於被告，彼等間亦無嫌隙，設扣案槍彈係綽\n      號「地瓜」所擅自放置，張秋月自無虛構係馬豫瑞所有攜\n      帶。證人馬豫祥更無誣指馬豫瑞與被告共有之可能；被告\n      及共犯馬豫瑞亦無於警詢、偵查中及原審聲羈庭自承被告\n      乙○○與馬豫瑞共同持有扣案槍枝之理。況非法持有槍枝\n      ，政府查緝甚嚴，並屬有期徒刑3年以上10年以下重罪，\n      綽號「地瓜」之人當無任意將扣案槍、彈置於被告居處。\n      足見被告辯稱扣案槍彈係綽號「地瓜」任意放置，殊無可\n      採。證人張秋月、馬豫祥於原審證稱扣案槍彈係「地瓜」\n      交付，均屬事後翻供迴護被告及迴護馬豫瑞之詞，不足憑\n      信。另證人黃光瑩於原審證稱：查獲前曾見「地瓜」去被\n      告工廠，我聽被告他說「地瓜」拿槍來，但並無看到地瓜\n      拿過來的東西等語（見原審卷第二宗第21頁、第22頁）。\n      證人黃光瑩既未親眼目睹綽號「地瓜」交付被告扣案改造\n      手槍及子彈，亦不足為被告有利之認定。況被告於本次更\n      （二）審中，確認查獲扣案之槍枝確係馬豫瑞帶來的（見\n      本院更二審卷第46頁背面、第47頁）。是本案查獲改造槍\n      枝、子彈，應為馬豫瑞帶至，而與「地瓜」楊志平所另外\n      找被告改造之槍枝無關。\n（四）經將在被告工廠查獲扣案之手槍及子彈，送請內政部警政\n      署刑事警察局鑑定結果；改造手槍（槍枝管制編號000000\n      0000），係由仿GLOCK廠17型半自動手槍製造之玩具手槍\n      換裝土造金屬槍管而成之改造手槍，機械性能良好，可擊\n      發適用子彈，具有殺傷力；子彈3顆，均係口徑9mm制式子\n      彈，均具殺傷力，有同局92年12月31日刑鑑字第09202404\n      57號槍彈鑑定書在卷可證。\n（五）扣案改造手槍1支及子彈3顆係馬豫瑞攜帶前來被告工廠，\n      被告於本院自承：我看到子彈這個東西放在桌上不恰當，\n      所以就把他放在房間內（見本院上訴字卷第69頁最後二行\n      ）。而該等子彈為制式子彈，外觀一望即知，且警員前來\n      搜索時，被告受僱人張秋月即將扣案改造手槍藏匿；足見\n      被告明知扣案槍彈均具殺傷力而共同持有之。又馬瑞豫因\n      與被告共同未經許可持有扣案具殺傷力之槍彈，業經法院\n      判處有期徒刑1年6月，併科罰金新臺幣20萬元確定，以足\n      證被告確與馬豫瑞共同持有扣案之改造手槍及子彈。\n（六）被告另稱：內政部警政署刑事警察局僅以性能鑑驗法檢驗\n      扣案改造手槍及子彈，並未實際試射，所為檢驗結果不具\n      證據能力。惟所謂性能檢驗法係檢驗證物之機械性能是否\n      完整之方法，包含檢測證物之機械結構（槍身、滑套、槍\n      管、撞針、擊錘、扳機等主要零件結構）及機械性能（進\n      彈、上膛、閉鎖、擊發、退殼拋殼等運作性能）是否完整\n      、良好之方法，原理係以實際操作之方式進行槍枝檢測，\n      鑑定槍枝結構及性能是否完整良好，倘結構完整，能夠發\n      揮擊發適用子彈之功能者，則認該槍枝具殺傷力。且經刑\n      事警察局以往試射結果，此類改造槍枝，經以「性能檢驗\n      法」鑑定認具殺傷力，後經試射其發射彈丸之單位面積動\n      能，可輕易超過日本科學警察研究所每平方公分二十焦耳\n      之研究結果，亦即具有殺傷人畜之能力（最高法院94年度\n      臺上字第7274號、95年度臺上字第7369號判決要旨參照）\n      。本件扣案改造手槍既經刑事警察局以性能檢驗法鑑定結\n      果，認具殺傷力，自堪採信。被告人聲請再將扣案槍枝送\n      請國軍後勤司令部軍品鑑定測試部以實際試射法確認有無\n      殺傷力，自無必要，附此說明。\n（七）綜上所述，被告所辯，為事後翻異卸責之詞，不足採信，\n      其罪證已臻明確，犯行洵堪認定，應予依法論科。\n、法律之適用：\n（一）被告行為後，槍砲彈藥刀械管制條例業於94年1月26日修\n      正公布施行，其中第11條第4項持有可發射子彈具有殺傷\n      力之槍械部分業經修正刪除（第12條第4項並未修正），\n      而併入第8條第4項，原第11條第4項法定刑為1年以上7年\n      以下有期徒刑，併科新台幣700萬元以下罰金。修正後第8\n      條第4項法定刑為3年以上10年以下有期徒刑，併科新台幣\n      700萬元以下罰金，經比較新舊法結果，以修正前之法律\n      較有利於被告，自應適用被告修正前行為時之槍砲彈藥刀\n      械管制條例。核被告所為，係犯修正前行為時槍砲彈藥刀\n      械管制條例第11條第4項之未經許可無故持有可發射子彈\n      具殺傷力之改造手槍罪及槍砲彈藥刀械管制條例第12條第\n      4項之未經許可持有子彈罪。公訴人認被告持有仿克拉克\n      手槍、子彈之行為，係犯槍砲彈藥刀械管制條例第10條第\n      3項、第11條第3項之罪，尚有未洽，起訴法條應予變更。\n（二）被告行為後，刑法第28條共同正犯之範圍，已修正限縮於\n      共同實行犯罪行為者始成立共同正犯，排除陰謀犯、預備\n      犯共同正犯；新舊法就共同正犯範圍之要件，既因此而有\n      變動，自屬行為後法律有變更，而非僅屬文字修正，經比\n      較新舊法結果，以修正前有利於被告，自應適用修正前刑\n      法第28條規定，被告與馬豫瑞間，有犯意聯絡及行為分擔\n      ，均為共同正犯。被告以一持有行為，同時持有槍枝、子\n      彈觸犯上開二罪，為想像競合犯，想像競合犯之規定，刑\n      法並未修正應從一重論以持有其他可發射子彈具有殺傷力\n      之槍枝罪。\n肆、撤銷改判及量刑之理由：原審就被告為有罪科刑之判決，固\n    非無見。惟查（一）原判決未說明被告與馬豫瑞為共同正犯\n    之理由，復於主文漏未載明為共同正犯，並漏引刑法第28條\n    ，尚有未當。（二）被告行為合於中華民國96年罪犯減刑條\n    例之規定，原審亦漏未為減刑諭知，亦有未合。（三）修正\n    前槍砲彈藥刀械管制條例第11條第4項法定罰金刑貨幣單位\n    為新台幣，原判決併科被告罰金刑，漏未載明貨幣單位為新\n    臺幣，均有不當，而無可維持。被告上訴意旨，仍執前詞否\n    認犯罪，雖無理由，惟原判決關於被告乙○○未經許可，持\n    有發射子彈具有殺傷力之改造槍枝部分既有可議（其餘製造\n    槍枝子彈部分，已判決無罪確定），自應由本院將此部分撤\n    銷改判。爰審酌被告平日素行，犯罪之動機、目的、手段、\n    非法持有槍彈所生危害非輕，持有槍彈數量及犯罪後態度等\n    一切情狀，量處有期徒刑1年2月，併科罰金新臺幣15萬元。\n    又被告犯罪時間在96年4月24日以前，合於中華民國96年罪\n    犯減刑條例第2條第1項第3款規定，並依該條例減刑之規定\n    ，減為有期徒刑7月，併科罰金新臺幣7萬5千元。被告於犯\n    罪時，刑法第42條第2項前段規定：「易服勞役以1元以上3\n    元以下折算一日。」行為時之易服勞役折算標準，業據修正\n    前罰金罰鍰提高標準條例第2條前段規定，就其原定數額提\n    高為100倍折算1日，本件被告行為時之易服勞役折算標準，\n    應以銀元300元即新臺幣900元折算1日。惟95年7月1日修正\n    公布施行之刑法第42條第3項前段規定：「易服勞役以新臺\n    幣1仟元、2仟元或3仟元折算一日。」經比較結果，以修正\n    後法律有利於被告，應依修正後刑法第42條第3項前段定其\n    折算標準。扣案之仿GLO CK廠17型半自動手槍製造之改造手\n    槍1支（槍枝管制編號0000000000）9mm制式子彈3顆，均係\n    違禁物，應依刑法第38條第1項第1款規定，宣告沒收。\n伍、據上論斷，應依刑事訴訟法第369條第1項前段、第364條、\n    第299條第1項前段、第300條，修正前行為時槍砲彈藥刀械\n    管制條例第11條第4項、槍砲彈藥刀械管制條例第12條第4項\n    ，刑法第11 條前段、第2條第1項前段、修正前刑法第28條\n    、刑法第55條、第42條第3項前段、第38條第1項第1款，中\n    華民國96年罪犯減刑條例第2條第1項第3款、第7條第1項、\n    第2項，判決如主文。\n本案經檢察官李良忠到庭執行職務。\n中    華    民    國    99    年    5     月    12    日\n                  刑事第七庭審判長法  官  宋明蒼\n                                  法  官  游紅桃\n                                  法  官  趙功恒\n以上正本證明與原本無異。\n如不服本判決，應於收受送達後10日內向本院提出上訴書狀，其\n未敘述上訴之理由者並得於提起上訴後10日內向本院補提理由書\n（均須按他造當事人之人數附繕本）「切勿逕送上級法院」。\n                                  書記官  潘文賢\n中    華    民    國    99    年    5     月    12    日\n附錄本案論罪科刑法條全文\n修正前行為時槍砲彈藥刀械管制條例第11條第1項、第4項：\n未經許可，製造、販賣或運輸第四條第一項第一款所稱其他可發\n射金屬或子彈具有殺傷力之各式槍砲者，處五年以上有期徒刑，\n併科新臺幣一千萬元以下罰金。\n未經許可，持有、寄藏或意圖販賣而陳列第一項所列槍砲者，處\n一年以上七年以下有期徒刑，併科新臺幣七百萬元以下罰金。\n槍砲彈藥刀械管制條例第12條第4項：\n未經許可，持有、寄藏或意圖販賣而陳列子彈者，處五年以下有\n期徒刑，併科新台幣三百萬元以下罰金。",
  "structure": {
    "main": "原判決關於乙○○未經許可，持有可發射子彈，具有殺傷力之改\n造槍枝部分撤銷。\n乙○○共同未經許可，持有可發射子彈具有殺傷力之改造手槍，\n處有期徒刑壹年貳月，併科罰金新臺幣拾伍萬元，罰金如易服勞\n役，以新臺幣壹仟元折算壹日；減為有期徒刑柒月，併科罰金新\n臺幣柒萬伍仟元，罰金如易服勞役，以新臺幣壹仟元折算壹日。\n扣案之仿GLOCK廠拾柒型半自動手槍製造之改造手槍（槍枝管制\n編號0000000000）壹支、口徑玖mm制式子彈顆，均沒收。",
    "fact": "壹、乙○○之友人馬豫瑞（所犯未經許可持有可發射子彈具有殺\n    傷力之改造手槍罪，業另經本院判處有期徒刑1年6月，併科\n    罰金新臺幣20萬元確定），於民國92年12月14日或15日，將\n    其所購得可發射子彈具有殺傷力之仿克拉克改造手槍1支（\n    槍枝管制編號0000000000）及口徑9mm制式子彈3顆，持至臺\n    北縣新店市○○路87巷22號乙○○之鐵工廠，欲利用工具，\n    加以改造。乙○○與馬豫瑞即基於共同之犯意，未經許可，\n    持有該槍彈，並將該改造手槍置於屋內工作檯上；子彈則由\n    乙○○藏置於房間內。嗣於92年12月16日，為警持搜索票前\n    往上址搜索，乙○○僱用之張秋月（所犯隱匿關係他人刑事\n    被告案件證據罪，經判處有期徒刑6月確定）將置於工作檯\n    上之改造手槍丟入浴室浴缸內，仍為警當場查獲，並在乙○\n    ○使用之房間內扣得9mm制式子彈3顆。\n貳、案經臺北縣政府警察局金山分局報請臺灣臺北地方法院檢察\n    署檢察官偵查起訴。",
    "reason": "壹、證據能力部分：\n一、刑事訴訟法第287條之2規定，法院就被告本人之案件調查共\n    同被告時，該共同被告準用有關人證之規定。同法第159條\n    之2規定，被告以外之人（含共同被告、共犯、證人、鑑定\n    人、被害人）於檢察事務官、司法警察官或司法警察調查中\n    所為之陳述，與審判中不符時，其先前之陳述具有較可信之\n    特別情況，且為證明犯罪事實存否所必要者，得為證據。所\n    謂具有較可信之特別情況，係指其陳述係在特別可信為真實\n    之情況下所為者而言。例如被告以外之人出於自然之發言、\n    臨終前之陳述，或違反自己利益之陳述等特別情形均屬之。\n    蓋被告以外之人在類此特別情況下所為之陳述，就通常而言\n    ，虛偽可能性偏低，可信程度較高，若該項陳述為證明犯罪\n    事實存否所必要，自得構成傳聞法則之例外，承認具有證據\n    能力。本件同案被告張秋月於警詢當場指認經警查獲的改造\n    手槍是馬豫瑞所有；同案被告馬豫祥於警詢亦稱：在浴室澡\n    堂內查獲1把GLOCK廠牌改造槍支、制式子彈3顆是我弟弟馬\n    豫瑞和朋友乙○○所有等語，核與張秋月及馬豫祥於原審以\n    證人身分證稱：克拉克17型的那枝槍，我在地檢等候交保時\n    ，乙○○說是綽號「地瓜」楊志平拿去給他修理的，就是偵\n    查卷第179頁左上角那枝等語；及張秋月於原審以證人身分\n    證稱：查獲前一天綽號「地瓜」者拿槍來要乙○○修理好，\n    乙○○有說他不會，他把槍放在工作檯上等語不符。然張秋\n    月及馬豫祥於警詢係在自由意志下陳述，張秋月係受僱於被\n    告；馬瑞祥與馬瑞豫係親生兄弟，倘該槍彈係地瓜任意放置\n    於被告居處，張秋月及馬豫瑞自無於警詢指稱係馬豫瑞所有\n    ；馬豫祥陳稱係馬豫瑞所有，更係違反自己利益，足見二人\n    於警詢陳述顯具有較可信之特別情況，並為證明本件被告犯\n    罪事實存否所必要，自得為證據。\n二、被告以外之人於審判外向法官所為之陳述，得為證據。被告\n    以外之人於偵查中向檢察官所為之陳述，除顯有不可信之情\n    況者外，得為證據。刑事訴訟法第159條之1定有明文，考其\n    立法理由：被告以外之人（含共同被告、共犯、被害人、證\n    人等）於法官面前所為之陳述（含書面及言詞），因其陳述\n    係在法官面前為之，故不問係其他刑事案件之準備程序、審\n    判期日或民事事件或其他訴訟程序之陳述，均係在任意陳述\n    之信用性已受確定保障之情況下所為，因此該等陳述應得作\n    為證據。檢察官職司追訴犯罪，必須對於被告之犯罪事實負\n    舉證之責。就審判程序之訴訟構造言，檢察官係屬與被告相\n    對立之當事人一方（參照本法第三條），是故偵查中對被告\n    以外之人所為之偵查筆錄，或被告以外之人向檢察官所提之\n    書面陳述，性質上均屬傳聞證據，且常為認定被告有罪之證\n    據，自理論上言，如未予被告反對詰問、適當辯解之機會，\n    一律准其為證據，似與當事人進行主義之精神不無扞格之處\n    ，對被告之防禦權亦有所妨礙；然而現階段刑事訴訟法規定\n    檢察官代表國家偵查犯罪、實施公訴，依法其有訊問被告、\n    證人及鑑定人之權，證人、鑑定人且須具結，而實務運作時\n    ，偵查中檢察官向被告以外之人所取得之陳述，原則上均能\n    遵守法律規定，不致違法取供，其可信性極高，為兼顧理論\n    與實務，爰於第二項明定被告以外之人於偵查中向檢察官所\n    為陳述，除顯有不可信之情況者外，得為證據。本件共同正\n    犯馬豫瑞所陳述就被告乙○○部分，亦屬被告以外之人，基\n    於偵查中於檢察官被告身分訊問時，坦承持有本案扣案之槍\n    枝，到被告乙○○處改造。於原審法院法官在聲請羈押庭及\n    起訴移審分別於法官訊問時，仍為同一陳述。雖於其後於原\n    審改稱，未與被告共同持有該槍彈云云。但其不利於已又不\n    利於共犯（乙○○）之陳述，經調查其他證據結果又與事實\n    相符，且其共同持有槍彈部分，也經有罪判決確定，於法官\n    前所為陳述有證據能力，於檢察官偵查中所為陳述，並無顯\n    不可信之情況，亦得為證據。\n貳、實體部分：\n一、訊之上訴人即被告乙○○，矢口否認持有具殺傷力改造手槍\n    及子彈犯行，辯稱：警方在其臺北縣新店市○○路87巷22號\n    工廠搜索時，扣得改造手槍一把及制式子彈3顆，是馬豫瑞\n    的，他要我幫他改造，但我不同意，他放在我這裡，我未持\n    有云云。其於更審前上訴審則辯稱：該槍枝係楊志平即綽號\n    「地瓜」之人所有，帶至居處強迫我修理，我並未同意下，\n    楊志平即將槍彈留下離去，我並無持有之意思云云。\n二、經查：\n（一）被告於警詢時已自白犯行，供稱：我與馬豫祥、馬豫瑞、\n      張秋月係朋友關係，馬豫瑞在我工廠使用車床改造槍械約\n      有20天左右，沙發旁工作檯上的槍枝是馬豫瑞帶來的，警\n      察來時，張秋月可能因為害怕而將工作檯上的槍往門後丟\n      。馬豫瑞要我幫他改造槍械，所以將改造槍械的工具放在\n      我房間。屋內改造手槍的成品、半成品都是馬豫瑞的，改\n      造槍械器具、材料都是我提供的等語（見偵查卷第6頁至\n      第13頁、第202頁至第204頁）。於檢察官偵查中仍坦承：\n      工廠裡的車床、鑽孔機等工具是我的，我在使用，馬豫瑞\n      有用車床在我工廠改造槍械約20天了，為警查獲前的一、\n      二天前，馬豫瑞拿扣案的槍枝來放在工作檯抽屜，我把他\n      收起來放等語（見偵查卷第109頁）。於檢察官向法院聲\n      請羈押時，於原審法院法官訊問時，亦自白供述：我知道\n      馬豫瑞在我工廠改造槍械，我默許他做槍械。（見原審聲\n      羈字卷第12頁）。被告於警詢、偵查中、原審法院羈押庭\n      之自白扣案槍枝係馬豫瑞於警查獲前一、二天攜來其居處\n      及工廠，要被告代為修改之事實。而在被告房內查獲之子\n      彈、被告於上訴本院亦坦承由其藏放房間內（見本院上訴\n      字卷第69頁最後二行）。又已判決確定之共犯馬豫瑞於檢\n      察官訊問時，以被告身分自白供承：經乙○○同意，到乙\n      ○○工廠去改造槍械（見偵查卷第20頁、第21頁），於檢\n      察官聲請羈押時，於法官訊問時仍為同一自白，供承該槍\n      械為其所有，至乙○○處改造（見原審聲羈字卷第12頁）\n      。另於檢察官起訴移審原審法院訊問時，仍自白其偵查中\n      所述為實在（見原審訴字卷第一宗第30頁）。核與同案被\n      告張秋月於警詢當場指認經警查獲的改造手槍是馬豫瑞所\n      有（見偵查卷第24-1頁）。又證人馬豫瑞之兄馬豫祥於警\n      詢陳稱：在台北縣新店市○○路87巷22號工廠浴室澡堂內\n      查獲1把GLOCK廠牌改造槍支、制式子彈3顆是我弟弟馬豫\n      瑞和朋友乙○○所有等語（見偵查卷第16頁）。於檢察官\n      偵查中亦陳稱：我曾勸過我弟弟（馬豫瑞），不要作改造\n      槍的事（見偵查卷第113頁）相互所述，均相符合。又證\n      人即到場搜索之警員竇忠國於原審證稱：改造槍枝是在工\n      廠最後面浴缸裡找到的，馬豫瑞坦承是他的，有提示給馬\n      豫瑞確認。所有在場人都站在證物前面，逐一看證物，逐\n      一簽名。刑事警察局93年5月6日函所附照片一，槍托上有\n      馬豫瑞簽名、蓋印是回到分局之後，交給馬豫瑞看，他說\n      是他的，並簽名、蓋印，之後我們再貼在槍托上等語（見\n      原審卷第二宗第138頁至第146頁）。\n（二）證人楊志平於原審證稱：（偵查卷第179頁鑑定書槍枝上\n      照片）我有買過與照片上同型的手槍，可是不是打17，我\n      買的上面是打18，形狀看起來外表是一樣的。原先我是想\n      要自己用，之後1天我就拿到工廠給馬豫祥。我是在乙○\n      ○的工廠92年12月16日被警方搜索前1、2個月拿給馬豫祥\n      的，查獲前1、2天我沒有到過乙○○的工廠，差不多有1\n      、2個星期沒有去，在搜索的那一天我剛好有經過被警方\n      攔下來，我跟警察說要去前面修理廠找人就走了，但沒有\n      進去乙○○工廠。我拿去的不包含照片上的3顆子彈等語\n      （見原審卷第二宗第150頁至第152頁）。證人楊志平於原\n      審明確指證未曾將扣案槍彈交付被告。另證人甲○○於原\n      審證稱：楊志平曾來我店裡買克拉克17Ｃ型同款灌瓦斯打\n      BB彈的玩具槍，我所販售槍枝沒有殺傷力，（提示偵卷第\n      179頁）同款式的槍枝市面上很多，只看圖片沒有辦法看\n      出是不是我賣出的。子彈不是我出售的等語（見原審卷第\n      二宗第146頁背面至149頁正面）。原審雖未進一步調取槍\n      枝由甲○○指認，本院傳喚拘提甲○○無著，未就原槍枝\n      分辨，然縱楊志平曾向甲○○購買克拉克玩具槍，於查獲\n      前一、二個月帶至被告工廠，要被告改造或交給馬豫祥，\n      但與本案馬豫瑞所帶至被告工廠，查獲扣案之改造手槍無\n      關。\n（三）雖被告於法院審理中翻異改稱：警詢、偵查係為不實之自\n      白云云。證人馬豫祥於原審改稱：克拉克17型的那枝槍，\n      我在地檢署等候交保時，乙○○說是綽號「地瓜」楊志平\n      拿去給他修理的，我介紹「地瓜」去市○○道一家玩具模\n      型玩具槍店去買的，就是偵查卷第179頁左上角那枝云云\n      。證人張秋月於原審亦改稱：查獲前一天綽號「地瓜」者\n      拿槍來要乙○○作並且說不管，就留在那裡，乙○○有說\n      他不會，他把槍放在工作檯上云云（見原審卷第二宗第7\n      頁、第12頁、第15頁至第20頁）。惟馬豫祥僅係聽聞被告\n      告知，並未親眼目睹綽號「地瓜」楊志平交付被告扣案槍\n      彈；自無從為被告有利之依據。再被告及張秋月於警詢精\n      神狀況正常、良好、意識清楚，筆錄亦經詳閱後始行簽名\n      ，並有錄音，核無何強暴、脅迫之事，業據證人即製作筆\n      錄之警員嚴戊坤、羅國粹、郭進興、李錦煌、鄭坤源於原\n      審證述屬實。另證人馬豫祥於警詢精神狀況良好，筆錄亦\n      依馬豫祥意思記載，並親白簽名，亦據證人即製作筆錄之\n      警員竇忠國於原審證述無誤。而被告及張秋月、馬豫祥等\n      人於查獲次日旋即解送臺灣臺北地方法院檢察署檢察官訊\n      問時，亦均未指稱警詢意識不清或警詢筆錄係違反本人意\n      願下所為，被告並自承扣案改造手槍係馬豫瑞攜帶前來（\n      見偵查卷第107頁至第114頁）。被告、馬豫祥於同日經原\n      審聲羈庭訊問時，復均供稱偵查中所言實在（見92年聲羈\n      字第407號卷第12頁、第13頁），足見被告警詢自白及張\n      秋月、馬豫祥警詢所稱，均在自由意志下陳述無疑。馬豫\n      祥與馬豫瑞係親生兄弟，被告與馬豫瑞則為朋友關係，另\n      張秋月則受雇於被告，彼等間亦無嫌隙，設扣案槍彈係綽\n      號「地瓜」所擅自放置，張秋月自無虛構係馬豫瑞所有攜\n      帶。證人馬豫祥更無誣指馬豫瑞與被告共有之可能；被告\n      及共犯馬豫瑞亦無於警詢、偵查中及原審聲羈庭自承被告\n      乙○○與馬豫瑞共同持有扣案槍枝之理。況非法持有槍枝\n      ，政府查緝甚嚴，並屬有期徒刑3年以上10年以下重罪，\n      綽號「地瓜」之人當無任意將扣案槍、彈置於被告居處。\n      足見被告辯稱扣案槍彈係綽號「地瓜」任意放置，殊無可\n      採。證人張秋月、馬豫祥於原審證稱扣案槍彈係「地瓜」\n      交付，均屬事後翻供迴護被告及迴護馬豫瑞之詞，不足憑\n      信。另證人黃光瑩於原審證稱：查獲前曾見「地瓜」去被\n      告工廠，我聽被告他說「地瓜」拿槍來，但並無看到地瓜\n      拿過來的東西等語（見原審卷第二宗第21頁、第22頁）。\n      證人黃光瑩既未親眼目睹綽號「地瓜」交付被告扣案改造\n      手槍及子彈，亦不足為被告有利之認定。況被告於本次更\n      （二）審中，確認查獲扣案之槍枝確係馬豫瑞帶來的（見\n      本院更二審卷第46頁背面、第47頁）。是本案查獲改造槍\n      枝、子彈，應為馬豫瑞帶至，而與「地瓜」楊志平所另外\n      找被告改造之槍枝無關。\n（四）經將在被告工廠查獲扣案之手槍及子彈，送請內政部警政\n      署刑事警察局鑑定結果；改造手槍（槍枝管制編號000000\n      0000），係由仿GLOCK廠17型半自動手槍製造之玩具手槍\n      換裝土造金屬槍管而成之改造手槍，機械性能良好，可擊\n      發適用子彈，具有殺傷力；子彈3顆，均係口徑9mm制式子\n      彈，均具殺傷力，有同局92年12月31日刑鑑字第09202404\n      57號槍彈鑑定書在卷可證。\n（五）扣案改造手槍1支及子彈3顆係馬豫瑞攜帶前來被告工廠，\n      被告於本院自承：我看到子彈這個東西放在桌上不恰當，\n      所以就把他放在房間內（見本院上訴字卷第69頁最後二行\n      ）。而該等子彈為制式子彈，外觀一望即知，且警員前來\n      搜索時，被告受僱人張秋月即將扣案改造手槍藏匿；足見\n      被告明知扣案槍彈均具殺傷力而共同持有之。又馬瑞豫因\n      與被告共同未經許可持有扣案具殺傷力之槍彈，業經法院\n      判處有期徒刑1年6月，併科罰金新臺幣20萬元確定，以足\n      證被告確與馬豫瑞共同持有扣案之改造手槍及子彈。\n（六）被告另稱：內政部警政署刑事警察局僅以性能鑑驗法檢驗\n      扣案改造手槍及子彈，並未實際試射，所為檢驗結果不具\n      證據能力。惟所謂性能檢驗法係檢驗證物之機械性能是否\n      完整之方法，包含檢測證物之機械結構（槍身、滑套、槍\n      管、撞針、擊錘、扳機等主要零件結構）及機械性能（進\n      彈、上膛、閉鎖、擊發、退殼拋殼等運作性能）是否完整\n      、良好之方法，原理係以實際操作之方式進行槍枝檢測，\n      鑑定槍枝結構及性能是否完整良好，倘結構完整，能夠發\n      揮擊發適用子彈之功能者，則認該槍枝具殺傷力。且經刑\n      事警察局以往試射結果，此類改造槍枝，經以「性能檢驗\n      法」鑑定認具殺傷力，後經試射其發射彈丸之單位面積動\n      能，可輕易超過日本科學警察研究所每平方公分二十焦耳\n      之研究結果，亦即具有殺傷人畜之能力（最高法院94年度\n      臺上字第7274號、95年度臺上字第7369號判決要旨參照）\n      。本件扣案改造手槍既經刑事警察局以性能檢驗法鑑定結\n      果，認具殺傷力，自堪採信。被告人聲請再將扣案槍枝送\n      請國軍後勤司令部軍品鑑定測試部以實際試射法確認有無\n      殺傷力，自無必要，附此說明。\n（七）綜上所述，被告所辯，為事後翻異卸責之詞，不足採信，\n      其罪證已臻明確，犯行洵堪認定，應予依法論科。\n、法律之適用：\n（一）被告行為後，槍砲彈藥刀械管制條例業於94年1月26日修\n      正公布施行，其中第11條第4項持有可發射子彈具有殺傷\n      力之槍械部分業經修正刪除（第12條第4項並未修正），\n      而併入第8條第4項，原第11條第4項法定刑為1年以上7年\n      以下有期徒刑，併科新台幣700萬元以下罰金。修正後第8\n      條第4項法定刑為3年以上10年以下有期徒刑，併科新台幣\n      700萬元以下罰金，經比較新舊法結果，以修正前之法律\n      較有利於被告，自應適用被告修正前行為時之槍砲彈藥刀\n      械管制條例。核被告所為，係犯修正前行為時槍砲彈藥刀\n      械管制條例第11條第4項之未經許可無故持有可發射子彈\n      具殺傷力之改造手槍罪及槍砲彈藥刀械管制條例第12條第\n      4項之未經許可持有子彈罪。公訴人認被告持有仿克拉克\n      手槍、子彈之行為，係犯槍砲彈藥刀械管制條例第10條第\n      3項、第11條第3項之罪，尚有未洽，起訴法條應予變更。\n（二）被告行為後，刑法第28條共同正犯之範圍，已修正限縮於\n      共同實行犯罪行為者始成立共同正犯，排除陰謀犯、預備\n      犯共同正犯；新舊法就共同正犯範圍之要件，既因此而有\n      變動，自屬行為後法律有變更，而非僅屬文字修正，經比\n      較新舊法結果，以修正前有利於被告，自應適用修正前刑\n      法第28條規定，被告與馬豫瑞間，有犯意聯絡及行為分擔\n      ，均為共同正犯。被告以一持有行為，同時持有槍枝、子\n      彈觸犯上開二罪，為想像競合犯，想像競合犯之規定，刑\n      法並未修正應從一重論以持有其他可發射子彈具有殺傷力\n      之槍枝罪。\n肆、撤銷改判及量刑之理由：原審就被告為有罪科刑之判決，固\n    非無見。惟查（一）原判決未說明被告與馬豫瑞為共同正犯\n    之理由，復於主文漏未載明為共同正犯，並漏引刑法第28條\n    ，尚有未當。（二）被告行為合於中華民國96年罪犯減刑條\n    例之規定，原審亦漏未為減刑諭知，亦有未合。（三）修正\n    前槍砲彈藥刀械管制條例第11條第4項法定罰金刑貨幣單位\n    為新台幣，原判決併科被告罰金刑，漏未載明貨幣單位為新\n    臺幣，均有不當，而無可維持。被告上訴意旨，仍執前詞否\n    認犯罪，雖無理由，惟原判決關於被告乙○○未經許可，持\n    有發射子彈具有殺傷力之改造槍枝部分既有可議（其餘製造\n    槍枝子彈部分，已判決無罪確定），自應由本院將此部分撤\n    銷改判。爰審酌被告平日素行，犯罪之動機、目的、手段、\n    非法持有槍彈所生危害非輕，持有槍彈數量及犯罪後態度等\n    一切情狀，量處有期徒刑1年2月，併科罰金新臺幣15萬元。\n    又被告犯罪時間在96年4月24日以前，合於中華民國96年罪\n    犯減刑條例第2條第1項第3款規定，並依該條例減刑之規定\n    ，減為有期徒刑7月，併科罰金新臺幣7萬5千元。被告於犯\n    罪時，刑法第42條第2項前段規定：「易服勞役以1元以上3\n    元以下折算一日。」行為時之易服勞役折算標準，業據修正\n    前罰金罰鍰提高標準條例第2條前段規定，就其原定數額提\n    高為100倍折算1日，本件被告行為時之易服勞役折算標準，\n    應以銀元300元即新臺幣900元折算1日。惟95年7月1日修正\n    公布施行之刑法第42條第3項前段規定：「易服勞役以新臺\n    幣1仟元、2仟元或3仟元折算一日。」經比較結果，以修正\n    後法律有利於被告，應依修正後刑法第42條第3項前段定其\n    折算標準。扣案之仿GLO CK廠17型半自動手槍製造之改造手\n    槍1支（槍枝管制編號0000000000）9mm制式子彈3顆，均係\n    違禁物，應依刑法第38條第1項第1款規定，宣告沒收。\n伍、據上論斷，應依刑事訴訟法第369條第1項前段、第364條、\n    第299條第1項前段、第300條，修正前行為時槍砲彈藥刀械\n    管制條例第11條第4項、槍砲彈藥刀械管制條例第12條第4項\n    ，刑法第11 條前段、第2條第1項前段、修正前刑法第28條\n    、刑法第55條、第42條第3項前段、第38條第1項第1款，中\n    華民國96年罪犯減刑條例第2條第1項第3款、第7條第1項、\n    第2項，判決如主文。\n本案經檢察官李良忠到庭執行職務。\n中    華    民    國    99    年    5     月    12    日\n                  刑事第七庭審判長法  官  宋明蒼\n                                  法  官  游紅桃\n                                  法  官  趙功恒\n以上正本證明與原本無異。\n如不服本判決，應於收受送達後10日內向本院提出上訴書狀，其\n未敘述上訴之理由者並得於提起上訴後10日內向本院補提理由書\n（均須按他造當事人之人數附繕本）「切勿逕送上級法院」。\n                                  書記官  潘文賢"
  },
  "characters": {
    "judges": [
      "宋明蒼",
      "游紅桃",
      "趙功恒"
    ],
    "prosecutors": [
      "李良忠"
    ],
    "lawyers": [

    ],
    "clerks": [
      "潘文賢"
    ],
    "plaintiffs": [

    ],
    "defendants": [
      "乙"
    ],
    "prosecutor_office": [

    ],
    "creditors": [

    ],
    "debtors": [

    ],
    "judicial_associate_officer": [

    ]
  },
  "adjudged_at": "2010-05-12",
  "created_at": "2016-01-05 11:53:29",
  "updated_at": "2016-01-05 11:53:29"
}