{
  "identify": "TPH-99-上訴-38-20100105-1",
  "court": {
    "name": "臺灣高等法院",
    "code": "TPH"
  },
  "division": {
    "name": "刑事",
    "code": "M"
  },
  "year": 99,
  "word": "上訴",
  "number": "38",
  "jcheck": "1",
  "reason": "毒品危害防制條例",
  "content": "臺灣高等法院刑事判決                  99年度上訴字第38號\n上  訴  人\n即  被  告  甲○○\n                      之2號\n上列上訴人因毒品危害防制條例案件，不服臺灣板橋地方法院98\n年度訴字第1806號，中華民國98年10月13日第一審判決（起訴案\n號：臺灣板橋地方法院檢察署98年度毒偵字第2219號），提起上\n訴，本院判決如下：\n    主  文\n上訴駁回。\n    理  由\n一、依刑事訴訟法第三百五十條、第三百六十一條、第三百六十\n    二條、第三百六十七條規定，不服地方法院之第一審判決而\n    上訴者，須提出上訴書狀，並應敘述具體理由，為上訴必備\n    之程式；其所提出之書狀未敘述上訴理由，或僅曾以言詞陳\n    述上訴理由者，均應於上訴期間屆滿後二十日內補提理由書\n    於第一審法院。第一審法院經形式審查，認逾期未補提上訴\n    理由者，應定期間先命補正；逾期未補正者，為上訴不合法\n    律上之程式，應以裁定駁回。倘已提出上訴理由，但所提非\n    屬具體理由者，則由第二審法院以上訴不合法律上之程式，\n    判決駁回。而所謂具體理由，必係依據卷內既有訴訟資料或\n    提出新事證，指摘或表明第一審判決有何採證認事、用法或\n    量刑等足以影響判決本旨之不當或違法，而構成應予撤銷之\n    具體事由，始克當之（例如：依憑證據法則具體指出所採證\n    據何以不具證據能力，或依憑卷證資料，明確指出所為證據\n    證明力之判斷如何違背經驗、論理法則）；倘僅泛言原判決\n    認定事實錯誤、違背法令、量刑失之過重或輕縱，而未依上\n    揭意旨指出具體事由，或形式上雖已指出具體事由，然該事\n    由縱使屬實，亦不足以認為原判決有何不當或違法者（例如\n    ：對不具有調查必要性之證據，法院未依聲請調查亦未說明\n    理由，或援用證據不當，但除去該證據仍應為同一事實之認\n    定），皆難謂係具體理由，俾與第二審上訴制度旨在請求第\n    二審法院撤銷、變更第一審不當或違法之判決，以實現個案\n    救濟之立法目的相契合，此有最高法院九十七年台上字第八\n    九二號判決意旨可參照。\n二、本件被告上訴意旨略以：被告犯錯至今，深深悔悟，即和新\n    莊偵查隊配合，可調閱資料，以保被告權益等語。查：原審\n    以被告自白施用毒品不諱（原審卷第42頁反面、第74頁），\n    且其為警查獲後所採集之尿液，經鑑驗確呈嗎啡（施用海洛\n    因之代謝物為嗎啡）及甲基安非他命陽性反應等情，有臺北\n    縣政府警察局新莊分局偵辦毒品危害防制條例案被移送人姓\n    名代碼對照表、臺灣檢驗科技股份有限公司濫用藥物檢驗報\n    告在卷可稽（偵卷第16、32頁），復有吸食器一組扣案可佐\n    ，且說明被告辯稱無施用犯意，如何不可採，因認被告犯行\n    ，事證明確，而審酌被告曾因相同犯行經戒毒處遇及追訴處\n    罰，猶未能知所警惕，顯然漠視法令之禁制，暨其施用毒品\n    之動機、目的、素行、犯後態度等一切情狀，量處有期徒刑\n    一年四月，並說明扣案玻璃球一組，應依法沒收等情，認事\n    用法，均無不合。被告上訴謂係犯後知錯等情，惟如前所述\n    ，原審量刑已審酌其犯後態度。至於被告所指本件犯後與警\n    政機關配合乙節，顯係另案情節與問題，尚非本件所應調查\n    與審酌者。綜上，被告上訴顯未依據卷內既有訴訟資料或提\n    出新事證，指摘或表明第一審判決有何採證認事、用法或量\n    刑等足以影響判決本旨之不當或違法，而構成應予撤銷之具\n    體事由，揆諸上開法條規定及最高法院判決意旨，難認上訴\n    合法，應予駁回。爰不經言詞辯論，依刑事訴訟法第三百六\n    十七條前段、第三百七十二條規定，判決如主文。\n中    華    民    國    99    年    1     月    5     日\n                  刑事第十八庭審判長法  官  吳鴻章\n                                    法  官  汪梅芬\n                                    法  官  周政達\n以上正本證明與原本無異。\n如不服本判決，應於收受送達後10日內向本院提出上訴書狀，其\n未敘述上訴之理由者並得於提起上訴後10日內向本院補提理由書\n（均須按他造當事人之人數附繕本）「切勿逕送上級法院」。\n                                    書記官  廖純瑜\n中    華    民    國    99    年    1     月    5     日\n",
  "structure": {
    "main": "上訴駁回。",
    "reason": "一、依刑事訴訟法第三百五十條、第三百六十一條、第三百六十\n    二條、第三百六十七條規定，不服地方法院之第一審判決而\n    上訴者，須提出上訴書狀，並應敘述具體理由，為上訴必備\n    之程式；其所提出之書狀未敘述上訴理由，或僅曾以言詞陳\n    述上訴理由者，均應於上訴期間屆滿後二十日內補提理由書\n    於第一審法院。第一審法院經形式審查，認逾期未補提上訴\n    理由者，應定期間先命補正；逾期未補正者，為上訴不合法\n    律上之程式，應以裁定駁回。倘已提出上訴理由，但所提非\n    屬具體理由者，則由第二審法院以上訴不合法律上之程式，\n    判決駁回。而所謂具體理由，必係依據卷內既有訴訟資料或\n    提出新事證，指摘或表明第一審判決有何採證認事、用法或\n    量刑等足以影響判決本旨之不當或違法，而構成應予撤銷之\n    具體事由，始克當之（例如：依憑證據法則具體指出所採證\n    據何以不具證據能力，或依憑卷證資料，明確指出所為證據\n    證明力之判斷如何違背經驗、論理法則）；倘僅泛言原判決\n    認定事實錯誤、違背法令、量刑失之過重或輕縱，而未依上\n    揭意旨指出具體事由，或形式上雖已指出具體事由，然該事\n    由縱使屬實，亦不足以認為原判決有何不當或違法者（例如\n    ：對不具有調查必要性之證據，法院未依聲請調查亦未說明\n    理由，或援用證據不當，但除去該證據仍應為同一事實之認\n    定），皆難謂係具體理由，俾與第二審上訴制度旨在請求第\n    二審法院撤銷、變更第一審不當或違法之判決，以實現個案\n    救濟之立法目的相契合，此有最高法院九十七年台上字第八\n    九二號判決意旨可參照。\n二、本件被告上訴意旨略以：被告犯錯至今，深深悔悟，即和新\n    莊偵查隊配合，可調閱資料，以保被告權益等語。查：原審\n    以被告自白施用毒品不諱（原審卷第42頁反面、第74頁），\n    且其為警查獲後所採集之尿液，經鑑驗確呈嗎啡（施用海洛\n    因之代謝物為嗎啡）及甲基安非他命陽性反應等情，有臺北\n    縣政府警察局新莊分局偵辦毒品危害防制條例案被移送人姓\n    名代碼對照表、臺灣檢驗科技股份有限公司濫用藥物檢驗報\n    告在卷可稽（偵卷第16、32頁），復有吸食器一組扣案可佐\n    ，且說明被告辯稱無施用犯意，如何不可採，因認被告犯行\n    ，事證明確，而審酌被告曾因相同犯行經戒毒處遇及追訴處\n    罰，猶未能知所警惕，顯然漠視法令之禁制，暨其施用毒品\n    之動機、目的、素行、犯後態度等一切情狀，量處有期徒刑\n    一年四月，並說明扣案玻璃球一組，應依法沒收等情，認事\n    用法，均無不合。被告上訴謂係犯後知錯等情，惟如前所述\n    ，原審量刑已審酌其犯後態度。至於被告所指本件犯後與警\n    政機關配合乙節，顯係另案情節與問題，尚非本件所應調查\n    與審酌者。綜上，被告上訴顯未依據卷內既有訴訟資料或提\n    出新事證，指摘或表明第一審判決有何採證認事、用法或量\n    刑等足以影響判決本旨之不當或違法，而構成應予撤銷之具\n    體事由，揆諸上開法條規定及最高法院判決意旨，難認上訴\n    合法，應予駁回。爰不經言詞辯論，依刑事訴訟法第三百六\n    十七條前段、第三百七十二條規定，判決如主文。"
  },
  "characters": {
    "judges": [
      "吳鴻章",
      "汪梅芬",
      "周政達"
    ],
    "prosecutors": [

    ],
    "lawyers": [

    ],
    "clerks": [
      "廖純瑜"
    ],
    "plaintiffs": [

    ],
    "defendants": [
      "甲"
    ],
    "prosecutor_office": [

    ],
    "creditors": [

    ],
    "debtors": [

    ],
    "judicial_associate_officer": [

    ]
  },
  "adjudged_at": "2010-01-05",
  "created_at": "2016-01-05 15:00:53",
  "updated_at": "2016-01-05 15:00:53"
}