{
  "identify": "TPH-98-上訴-4451-20100104-2",
  "court": {
    "name": "臺灣高等法院",
    "code": "TPH"
  },
  "division": {
    "name": "刑事",
    "code": "M"
  },
  "year": 98,
  "word": "上訴",
  "number": "4451",
  "jcheck": "2",
  "reason": "毒品危害防制條例",
  "content": "臺灣高等法院刑事裁定                98年度上訴字第4451號\n上  訴  人\n即  被  告  甲○○\n上列上訴人因違反毒品危害防制條例案件，不服本院98年度上訴\n字第4451號，中華民國98年11月12日第二審判決，提起上訴，本\n院裁定如下：\n    主  文\n甲○○施用第二級毒品部分上訴駁回。\n    理  由\n一、按最重本刑為3 年以下有期徒刑、拘役或專科罰金之罪之案\n    件，經第二審判決後，不得上訴於第三審法院，刑事訴訟法\n    第376條第1款定有明文。次按原審法院認為上訴不合法律上\n    之程式或法律上不應准許或其上訴權已經喪失者，應以裁定\n    駁回之，刑事訴訟法第384條前段明文規定。\n二、本件被告所犯毒品危害防制條例第10條第2 項之施用第二級\n    毒品罪部分，其法定刑為3 年以下有期徒刑，核屬刑事訴訟\n    法第376條第1款所定不得上訴第三審之案件，依前開規定，\n    被告對於本件施用第二級毒品罪部分不得再為上訴第三審。\n    因而被告所為本件上訴，就施用第二級毒品罪部分，依法不\n    應准許，應予駁回。\n據上論斷，應依刑事訴訟法第384條前段，裁定如主文。\n中    華    民    國    99    年    1     月    4     日\n                  刑事第三庭  審判長法  官  陳博志\n                                    法  官  劉興浪\n                                    法  官  許文章\n以上正本證明與原本無異。\n不得抗告。\n                                    書記官  蔡慧娟\n中    華    民    國    99    年    1     月    4     日\n",
  "structure": {
    "main": "甲○○施用第二級毒品部分上訴駁回。",
    "reason": "一、按最重本刑為3 年以下有期徒刑、拘役或專科罰金之罪之案\n    件，經第二審判決後，不得上訴於第三審法院，刑事訴訟法\n    第376條第1款定有明文。次按原審法院認為上訴不合法律上\n    之程式或法律上不應准許或其上訴權已經喪失者，應以裁定\n    駁回之，刑事訴訟法第384條前段明文規定。\n二、本件被告所犯毒品危害防制條例第10條第2 項之施用第二級\n    毒品罪部分，其法定刑為3 年以下有期徒刑，核屬刑事訴訟\n    法第376條第1款所定不得上訴第三審之案件，依前開規定，\n    被告對於本件施用第二級毒品罪部分不得再為上訴第三審。\n    因而被告所為本件上訴，就施用第二級毒品罪部分，依法不\n    應准許，應予駁回。\n據上論斷，應依刑事訴訟法第384條前段，裁定如主文。"
  },
  "characters": {
    "judges": [
      "陳博志",
      "劉興浪",
      "許文章"
    ],
    "prosecutors": [

    ],
    "lawyers": [

    ],
    "clerks": [
      "蔡慧娟"
    ],
    "plaintiffs": [

    ],
    "defendants": [
      "甲"
    ],
    "prosecutor_office": [

    ],
    "creditors": [

    ],
    "debtors": [

    ],
    "judicial_associate_officer": [

    ]
  },
  "adjudged_at": "2010-01-04",
  "created_at": "2016-01-05 14:34:39",
  "updated_at": "2016-01-05 14:34:39"
}