{
  "identify": "TPH-99-上訴-1187-20100512-2",
  "court": {
    "name": "臺灣高等法院",
    "code": "TPH"
  },
  "division": {
    "name": "刑事",
    "code": "M"
  },
  "year": 99,
  "word": "上訴",
  "number": "1187",
  "jcheck": "2",
  "reason": "毒品危害防制條例",
  "content": "臺灣高等法院刑事裁定                99年度上訴字第1187號\n上  訴  人\n即  被  告  甲○○\n上列上訴人因違反毒品危害防制條例案件，對於本院中華民國99\n年4月6日所為第二審判決（99年度上訴字第1187號），提起上訴\n，本院裁定如下：\n    主  文\n甲○○施用第二級毒品部分，上訴駁回。\n    理  由\n一、按最重本刑為3年以下有期徒刑、拘役或專科罰金之罪之案\n    件，經第二審判決後，不得上訴於第三審法院，刑事訴訟法\n    第376條第1款定有明文。次按原審法院認為第三審上訴不合\n    法律上之程式或法律上不應准許或其上訴權已經喪失者，應\n    以裁定駁回之，為刑事訴訟法第384條前段明文規定。\n二、本件上訴人即被告甲○○所犯為毒品危害防制條例第10條第\n    1項之施用第一級毒品罪，及同條第2項之施用第二級毒品罪\n    ，其中施用第二級毒品罪之法定刑為3年以下有期徒刑，係\n    屬不得上訴第三審之罪。茲被告對本院就本件所為之第二審\n    判決，向第三審法院上訴，其中關於施用第二級毒品部分之\n    上訴，顯為法律所不准許，爰依同法第384條前段，裁定如\n    主文。\n中    華    民    國    99    年    5     月    12    日\n                 刑事第十三庭  審判長法  官  曾德水\n                                     法  官  陳恆寬\n                                     法  官  崔玲琦\n以上正本證明與原本無異。\n不得抗告。\n                                     書記官  馬佳瑩\n中    華    民    國    99    年    5     月    12    日",
  "structure": {
    "main": "甲○○施用第二級毒品部分，上訴駁回。",
    "reason": "一、按最重本刑為3年以下有期徒刑、拘役或專科罰金之罪之案\n    件，經第二審判決後，不得上訴於第三審法院，刑事訴訟法\n    第376條第1款定有明文。次按原審法院認為第三審上訴不合\n    法律上之程式或法律上不應准許或其上訴權已經喪失者，應\n    以裁定駁回之，為刑事訴訟法第384條前段明文規定。\n二、本件上訴人即被告甲○○所犯為毒品危害防制條例第10條第\n    1項之施用第一級毒品罪，及同條第2項之施用第二級毒品罪\n    ，其中施用第二級毒品罪之法定刑為3年以下有期徒刑，係\n    屬不得上訴第三審之罪。茲被告對本院就本件所為之第二審\n    判決，向第三審法院上訴，其中關於施用第二級毒品部分之\n    上訴，顯為法律所不准許，爰依同法第384條前段，裁定如\n    主文。"
  },
  "characters": {
    "judges": [
      "曾德水",
      "陳恆寬",
      "崔玲琦"
    ],
    "prosecutors": [

    ],
    "lawyers": [

    ],
    "clerks": [
      "馬佳瑩"
    ],
    "plaintiffs": [

    ],
    "defendants": [
      "甲"
    ],
    "prosecutor_office": [

    ],
    "creditors": [

    ],
    "debtors": [

    ],
    "judicial_associate_officer": [

    ]
  },
  "adjudged_at": "2010-05-12",
  "created_at": "2016-01-05 11:52:51",
  "updated_at": "2016-01-05 11:52:51"
}