{
  "identify": "TPH-98-上-324-20100105-1",
  "court": {
    "name": "臺灣高等法院",
    "code": "TPH"
  },
  "division": {
    "name": "民事",
    "code": "V"
  },
  "year": 98,
  "word": "上",
  "number": "324",
  "jcheck": "1",
  "reason": "返還無權占有物等",
  "content": "臺灣高等法院民事判決                   98年度上字第324號\n上  訴  人  天○○\n訴訟代理人  楊雅惠律師\n複 代理 人  張倪羚律師\n上  訴  人  子○○○即林維賢.\n            壬○○即林維賢之.\n            辛○○即林維賢之.\n            庚○○即林維賢之.\n上  四  人\n訴訟代理人  吳仲立律師\n被 上訴 人  丁○○\n訴訟代理人  許朝昇律師\n複 代理 人  地○○\n被 上訴 人  癸○○\n            己○○\n            戊○○\n            申○○（兼林衡立之承受訴訟人）\n            丑○○\n            卯○○\n            午○○\n            亥○\n            寅○○\n            黃○○\n                       vally,ca.92708 U.S.A.\n            宙○○\n                        番45號\n            玄○○\n            酉○○○\n            戌○○○\n            辰○○ (兼林衡立之承受訴訟人)\n            宇○○○\n            未○○\n            甲○○\n            乙○○\n            丙○○\n            Ａ○○\n            巳○○\n上列當事人間請求返還無權占有物等事件，上訴人對於中華民國\n98年1月16日臺灣板橋地方法院95年度訴字第2618號第一審判決\n提起上訴，本院於98年12月22日言詞辯論終結，判決如下：\n    主      文\n原判決關於命上訴人天○○給付新臺幣貳拾貳萬捌仟伍佰肆拾柒\n元自民國九十五年十二月三十一日起至民國九十六年一月十四日\n止，以週年利率百分之五計算之利息部分，及該部分假執行之宣\n告，暨命上訴人天○○負擔訴訟費用部分均廢棄。\n上開廢棄部分，被上訴人在第一審之訴及假執行之聲請均駁回。\n其餘上訴駁回。\n第一審關於命上訴人天○○負擔訴訟費用部分，及第二審訴訟費\n用關於上訴人天○○上訴部分，由上訴人天○○負擔。第二審訴\n訟費用關於上訴人子○○○、壬○○、辛○○、庚○○上訴部分\n，由上訴人子○○○、壬○○、辛○○、庚○○連帶負擔。\n    事實及理由\n甲、程序方面：\n一按「訴訟標的對於數人必須合一確定而應共同起訴，如其中一\n  人或數人拒絕同為原告而無正當理由者，法院得依原告聲請，\n  以裁定命該未起訴之人於一定期間內追加為原告。逾期未追加\n  者，視為已一同起訴」，民事訴訟法第56條之1第1項定有明文\n  。本件被上訴人丁○○於原審起訴後，向原審聲請追加其餘公\n  同共有人為原告，經原審依民事訴訟法第56條之1第1項之規定\n  ，通知林衡立、癸○○、己○○、戊○○、申○○、丑○○、\n  卯○○、午○○、亥○、寅○○、黃○○、宙○○、黃○○、\n  玄○○、酉○○○（即楊思瑛）、戌○○○（即楊思雄）、辰\n  ○○、宇○○○、未○○、甲○○、乙○○、丙○○、Ａ○○\n  、巳○○等人就追加為原告之事表示意見後，其等均未為任何\n  表示，復無正當理由拒絕為原告，原審乃於民國96年5月21 日\n  裁定林衡立（嗣於96年5月31日死亡，經原審裁定命其繼承人\n  申○○、辰○○承受訴訟）、癸○○、己○○、戊○○、申○\n  ○、丑○○、卯○○、午○○、亥○、寅○○、黃○○、宙○\n  ○、黃○○、玄○○、酉○○○、戌○○○、辰○○、宇○○\n  ○、未○○、甲○○、乙○○、丙○○、Ａ○○、巳○○（下\n  稱癸○○等22人）等人為原告，合於上開之規定。\n二又癸○○等22人未為任何表示，復無正當理由拒絕為原告，有\n  如上述，上訴人辯稱系爭土地之其他公同共有人，就其他土地\n  之訴訟事件中，曾於他案表明其不願與該事件之原告同為該事\n  件之原告，各該承審法院亦均以原告之訴之當事人適格有欠缺\n  為由，駁回原告之訴，是就本件訴訟可推定系爭土地之其他公\n  同共有人，同樣不願與原告丁○○同為本事件之原告，應駁回\n  原告之訴云云（本院卷(二)第137頁背面、第144頁），然癸○○\n  等22人於其他案件之陳述非等同於本件之陳述，況其等縱拒絕\n  同為原告而無正當理由者，法院仍得依原告聲請，以裁定命該\n  未起訴之人於一定期間內追加為原告，為民事訴訟法第56條之\n  1 第1項前段所明定，子○○○等4人所稱其他案件之處理非得\n  拘束本件。\n三上訴人子○○○、壬○○、辛○○、庚○○（下稱子○○○等\n  4人）再辯稱得依上開規定裁定命未起訴之人於一定期間內追\n  加為原告者，限於物權之請求權，不及於債權請求權，本件有\n  關不當得利之訴求部分，非固有必要共同訴訟，原審逕依民事\n  訴訟法第56條之1裁准被上訴人就不當得利請求部分追加林衡\n  立等人為原告，並判決上訴人應返還不當得利於全體原告，顯\n  有違誤云云（本院卷(二)第143、144頁），天○○亦為相同之辯\n  解（本院卷(二)第139頁）。然被上訴人係以一訴（民法第767條\n  之物上請求權）附帶請求相當於租金之不當得利（民事訴訟法\n  第77條之2第2項參照），原審係就被上訴人主張之物上請求權\n  追加林衡立等人為原告，並就被上訴人所為之附帶請求併為裁\n  判，並無不合，子○○○等4人上開辯解，非屬可採。\n四按「當事人不得提出新攻擊或防禦方法。但有下列情形之一者\n  ，不在此限……六、如不許其提出顯失公平者」，民事訴訟法\n  第447條第1項第6款定有明文。本件上訴人於原審經合法通知\n  未到場，經原審准被上訴人之聲請由其一造辯論而為判決，上\n  訴人聲明不服提起第二審上訴，應准上訴人提出新攻擊防禦方\n  法，否則有顯失公平之情形；則上訴人於本院提出地政登記資\n  料、房屋稅繳納證明文件，並聲請函查相關單位相關事宜等，\n  均應准其提出。\n五另按「言詞辯論期日，當事人之一造不到場者，得依到場當事\n  人之聲請，由其一造辯論而為判決；不到場之當事人，經再次\n  通知而仍不到場者，並得依職權由一造辯論而為判決。前項規\n  定，於訴訟標的對於共同訴訟之各人必須合一確定者，言詞辯\n  論期日，共同訴訟人中一人到場時，亦適用之」，民事訴訟法\n  第385條第1項、第2項定有明文。本件訴訟標的對於共同訴訟\n  之各人（原審共同原告即被上訴人）必須合一確定，有如上述\n  ，原審共同訴訟人即原審共同原告僅丁○○一人到場，其餘共\n  同原告未到場，原審共同被告天○○、子○○○等4人經合法\n  通知，未於言詞辯論期日到場，原審認無民事訴訟法第386條\n  所列各款情形，而准原審原告之聲請，由其一造辯論而為判決\n  ，核無違誤。上訴人子○○○等4人辯稱原審「訴訟程序是否\n  有瑕疵，亦實有疑義」云云（本院卷(二)第144頁），即無可取\n  。\n六被上訴人癸○○等22人經合法通知，未於言詞辯論期日到場，\n  核無民事訴訟法第386條所列各款情形，應准上訴人之聲請，\n  由其一造辯論而為判決。\n乙、實體方面：\n一被上訴人起訴主張：坐落臺北縣土城市○○段第756、758地號\n  土地（下合稱系爭土地，分稱756或758號土地）為伊等公同共\n  有。上訴人天○○、上訴人子○○○等4人之被繼承人林維賢\n  無權占用系爭土地，天○○在758號、756號土地如附圖依序所\n  示A、B部分上興建門牌號碼為臺北縣土城市○○街16號之建物\n  （下稱16號建物）、林維賢在756號土地如附圖所示編號C部分\n  上興建門牌號碼為臺北縣土城市○○街14號之建物（下稱14\n  號建物）。上訴人等無權占用系爭土地，應給付伊等相當於租\n  金之不當得利，計天○○應給付5年租金328,500元，並自96年\n  1月起至建物拆除日止，按月於每月末日前給付5,475元；子○\n  ○○等4人應給付5年租金350,755元，並自96年4月起至建物拆\n  除日止，按月於每月末日前給付5,846元。爰依民法第767條、\n  第179條之規定，求為命(一)天○○將758、756號土地上如附圖\n  所示A、B部分之全部建物拆除，將上開土地全部騰空交還被上\n  訴人、(二)子○○○等4人將756號土地上如附圖所示C部分之全\n  部建物拆除，將上開土地全部騰空交還被上訴人、(三)天○○給\n  付328,500元，及自起訴狀繕本送達翌日起加計法定遲延利息\n  、(四)天○○自96年1月起至騰空返還第1項所示土地之日止，按\n  月於每月末日前給付5,475元、(五)子○○○等4人給付350,755\n  元，及自起訴狀繕本送達翌日起加計法定遲延利息、(六)子○○\n  ○等4人自96年4月起至騰空返還第2項所示土地之日止，按月\n  於每月末日前給付5,846元之判決。\n  上訴人天○○則以：伊世居16號建物有百年歷史，自民國時期\n  迄今，稅捐機關亦以伊或先人為合法房屋稅捐繳納義務人，被\n  上訴人從未主張伊或先人無權占用系爭土地，顯然伊自祖先以\n  來絕非無權占有，且除丁○○以外，其他共有人或其祖先，未\n  否認伊或祖先之權利。依卷內資料，16號建物經由日據時代之\n  臺灣總督府臺北地方法院公證官吏辦理公證程序，益證16號建\n  物得占有系爭土地，絕非無權占有，而於日據時代大正12年間\n  ，16號建物經整修後登記為「土塊木造瓦葺平家壹棟建坪拾八\n  坪（並含）六合六勺六才（院落）」，保存登記之所有者係楊\n  勝旺，即伊父，益證被上訴人之被繼承人確知16號建物興建之\n  事實，伊非無權占用系爭土地云云，資為抗辯。\n  上訴人子○○○等4人以：14號建物原由呂傳文於日據時代辦\n  竣保存登記，其後經買賣之事由，移轉登記於林遠吉，顯然呂\n  傳文占用系爭土地，已獲得土地所有權人同意，是14號建物係\n  合法占有系爭土地。14號建物雖有拆除部分建物而有整建之情\n  事，係依政府政策進行拆除及整建，非將原有建物整棟拆除，\n  公所亦認定為合法建物。14號建物於日據時代即登記為林遠吉\n  所有，現所有人或其被繼承人無處分該建物情事，復無法定消\n  滅之原因，則其所有權不能因地政機關未予轉載，即認14號建\n  物已消滅或變為非法建物。再14號建物自日據時代以來數十年\n  ，被上訴人均未積極請求返還系爭土地，顯然被上訴人或其被\n  繼承人至少業默示同意14號建物占用系爭土地，乃係合法占有\n  使用關係。兩造間就14號建物顯有未定期限之合法使用關係，\n  而使用系爭土地之目的，既為建造房屋以居住為目的，自應以\n  伊等使用系爭土地之目的完畢，即無法繼續居住14號建物或該\n  房屋不堪住用時，返還期限始屆至。又數十年來除被上訴人丁\n  ○○外，其他公同共有人均未曾異議，丁○○行使所有物返還\n  請求權，意圖取回系爭土地，實有違反誠信原則或權利濫用之\n  情形云云，資為抗辯。\n二原審命天○○將758號內如附圖所示A部分面積52.96平方公尺\n  、756地號如附圖所示B部分面積0.74平方公尺土地上之建物拆\n  除，將該部分土地交還被上訴人、給付228,547元及自95年12\n  月31日起加計法定遲延利息；並自96年1月1日起至返還前項土\n  地之日止，按月給付3,809元。子○○○等4人將756地號內如\n  附圖所示C部分面積56.95平方公尺土地上之建物拆除，將該部\n  分土地交還被上訴人、給付242,379元及96年3月27日起加計法\n  定遲延利息；並自96年4月1日至返還第三項所示土地之日止，\n  按月給付4,040元，駁回被上訴人其餘之請求。上訴人提起上\n  訴，聲明：\n  (一)原判決不利上訴人部分廢棄。\n  (二)上開廢棄部分，被上訴人在第一審之訴及假執行之聲請均駁\n    回。\n  被上訴人丁○○則聲明：上訴駁回。\n  被上訴人癸○○等22人受合法通知，未於言詞辯論期日到場，\n  亦未提出任何書狀。\n  被上訴人於原審敗訴部分，未據聲明不服而告確定。\n三被上訴人主張前揭事實，提出系爭土地登記謄本、林熊祥、顏\n  春和、林陳師恆、林衡道、朱林茗之繼承系統表、律師函、臺\n  灣臺北地方法院92年度重訴字第1572號裁判暨確定證明書等件\n  為證（原審卷(一)第10-31頁）。被上訴人主張上訴人無權占用\n  系爭土地，為上訴人所否認，並以前詞置辯。經查：\n  (一)系爭土地為被上訴人或被上訴人之繼承人公同共有，有系爭\n    土地登記謄本、登記名義人林熊祥之繼承系統表在卷可憑（\n    原審卷(一)第10-13頁）。又原審至現場履行勘驗，並囑託臺\n    北縣板橋地政事務所（下稱板橋地政所）測量明確，系爭建\n    物占用系爭土地之位置、面積各如附圖說明欄所示，有勘驗\n    筆錄、土地複丈成果圖、板橋地政所96年4月16日北縣板地\n    測字第0960005464號函各1份在卷可憑（原審卷(一)第149-150\n    、238-239頁）。上訴人天○○、子○○○等4人依序就16號\n    建物、14號建物分別為其等所有一節並不爭執（本院卷(二)第\n    138-139、142頁）。上訴人雖辯稱其等所有之系爭建物係得\n    被上訴人或被上訴人之先祖之同意而興建，非屬無權占用系\n    爭土地云云。查依天○○提出之41年上期房捐查定通知書，\n    上載納稅義務人為楊勝旺，固為天○○之父，有其戶口名簿\n    可憑（本院卷(一)第96頁），然該通知書上載「現在住址：土\n    城10鄰慶安14號、房屋坐落所在地址：仝上」（本院卷(一)第\n    106頁），顯然房捐查定通知書上房屋坐落係14號建物，非\n    本件天○○占用之16號建物，另53年上期房捐繳納通知書所\n    載房屋坐落亦為土城村9鄰慶安街14號（本院卷(一)第107頁）\n    ，仍非本件其占用之16號建物，上開通知書均難作為有利於\n    天○○認定之依據。\n  (二)另天○○之父、祖母、曾祖父依序為楊勝旺、楊氏真、楊允\n    北，有繼承系統表、戶籍資料等在卷可參（本院卷(一)第87、\n    88、93、96頁）。楊允北於日據時代大正元年10月4日向林\n    春土購買「土塊木造瓦葺平家壹棟建坪拾八坪四合」，有家\n    屋賣買證書謄本可參（本院卷(一)第82-96頁）。又依天○○\n    提出之土地登記謄本，系爭土地分割自重測前之臺北縣土城\n    員林段土城小段83地號土地，該83地號土地於日據時代普查\n    時，登錄原始所有權人係林熊光，經林熊光贈與林熊祥、林\n    熊祥再移轉登記予大有物產株式會社，嗣回復為林熊祥，有\n    土地臺帳可稽（本院卷(一)第80頁）。上開「土塊木造瓦葺平\n    家壹棟建坪拾八坪四合」於日據時代大正12年11月2日登記\n    為「土塊木造瓦葺平家壹棟建坪拾八坪六合六勺六才」，保\n    存登記為天○○之父楊勝旺（本院卷(一)第100-101頁）。天\n    ○○聲請本院函查相關事宜，經內政部96年6月9日內授中辦\n    地字第0980045542號函，內附臺北縣政府地政局98年6月3日\n    北地籍字第0980416257號載：「說明……二……若辦理未登\n    記建物之所有權登記者，應提出土地登記簿謄本或土地台帳\n    謄本，證明申請人為已登記或登錄於土地台帳之建物基地所\n    權人或地上權人……」等語（本院卷(一)第185頁），天○○\n    進而辯稱林春土只有二種身分得請求為建物所有權之登記，\n    一為基地之所有權人，一為基地之地上權人云云。然上開楊\n    允北所購買之「土塊木造瓦葺平家壹棟建坪拾八坪四合」或\n    楊勝旺名義登記之「土塊木造瓦葺平家壹棟建坪拾八坪六合\n    六勺六才」建物，是否確為本件16號建物，尚屬有疑，依天\n    ○○提出之上開房捐查定通知書所載，反得證明非16號建物\n    。再林春土非基地之所有權人，至是否為地上權人，未據天\n    ○○舉證以實其說，況是否為地上權人於臺灣光復後應依土\n    地登記資料認定，其亦未提出相關土地登記資料以資證明楊\n    春土確為地上權人。縱依日據時代之日本民法第176條、第\n    177條「物權之設定、移轉因當事人意思表示即發生效力」\n    、「不動產物權之得喪變更，從登記法所定，非經登記不得\n    以對抗第三人」之規定，地上權之成立不以登記為生效要件\n    ，僅因當事人意思表示即發生效力。然天○○仍應就林春土\n    於日據時代確與系爭土地所有權人意思表示合致成立地上權\n    一節舉證以實其說，乃天○○迄未就此提出任何證據，僅以\n    上開臺北縣政府地政局函自為有利於己之解釋，謂林春土非\n    所有權即係地上權人，辯稱「該日據時期，有名『林春土』\n    之人，以興建房屋之目的，向土地所有權人林熊祥購得土地\n    之地上權，建造『土塊木造瓦葺平家壹棟建坪拾八坪(並含)\n    四合(院落)』」云云（本院卷(二)第138頁背面），自難採信\n    。\n  (三)天○○另辯稱依日據時代不動產登記法第106條「未登記之\n    建物所有權，其登記得依左列方式申請之：一、登記簿上登\n    記之建物所在土地之所有人或地上權人。二、證明依土地臺\n    帳謄本，自己或被繼承人被登錄為土地臺帳的所在土地之所\n    有人者。依已登記的所在土地的所有人或地上權人的證明書\n    ，證明自己的所有權者。依判決、其他官廳或公署之書面等\n    證明自己的所有權者」之規定，系爭建物所有權既已得日據\n    時代之地政機關核准為房屋所有權之保存登記，則自可推知\n    系爭建物之所有權人，必係取得系爭土地之所有權人或地上\n    權人，故依當時之法令規定，得申請辦理建物保存登記自明\n    。因此，上訴人系爭房屋絕無該當無權占有系爭土地之情事\n    云云（本院卷(二)第137-138頁）。然承上述，天○○之父楊\n    勝旺登記之上開「土塊木造瓦葺平家壹棟建坪拾八坪六合六\n    勺六才」建物，是否確為本件16號建物，尚屬有疑，楊勝旺\n    非系爭土地所有權人，天○○尤未舉證證明楊勝旺已取得地\n    上權，其逕依日據時代不動產登記法之上開規定為上開辯解\n    ，仍無可採。況上開楊勝旺登記之建物為「土塊木造瓦葺平\n    家」，顯然與系爭建物之現狀不符（見原審卷(三)第73-79頁\n    之照片），堪認16號建物非日據時代所興建，即與最高法院\n    93年台上字第818號判決「系爭土地為上訴人於民國四十五\n    年至五十七年間自原地主購得，而建蓋於系爭土地上之系爭\n    建物，為日據時代興建，並經辦畢保存登記，依當時施行於\n    台灣之日本民法及不動產登記法之規定，可推定系爭建物所\n    有權人曾於當時提出土地所有人之許可、同意或承諾之書面\n    證件」之情形有間，天○○自不得比附援引上開判決要旨為\n    其有利證據之認定。天○○再謂所有人對於有權占有其所有\n    物者，即無返還所有物之請求餘地，另依最高法院85年台上\n    字第389號判例：「按消滅時效完成，僅債務人取得拒絕履\n    行之抗辯權，得執以拒絕給付而已，其原有之法律關係並不\n    因而消滅。在土地買賣之情形，倘出賣人已交付土地與買受\n    人，雖買受人之所有權移轉登記請求權之消滅時效已完成，\n    惟其占有土地既係出賣人本於買賣之法律關係所交付，即具\n    有正當權源，原出賣人自不得認係無權占有而請求返還」，\n    本件上訴人既原始已屬合法占有人，縱目前已無地上權或土\n    地所有權登記之請求權，仍非得逕指為無權占有人云云（本\n    院卷(二)第138頁），然天○○未舉證其父楊勝旺或曾祖父楊\n    允北之前手已合法取得地上權，已如前述，其逕援引上開判\n    例謂被上訴人不得認係無權占有而請求返還云云，仍屬無據\n    。以上，天○○就其所有16號建物占用系爭土地如附圖所示\n    A、B部分一節，未能舉證證明係屬有權占有，則被上訴人主\n    張天○○所有之16號建物係無權占用系爭土地如附圖所示A\n    、B部分之事實，應認為實在。\n  (四)子○○○等4人辯稱14號建物係由呂傳文於日據時代辦竣保\n    存登記，嗣經買賣之事由，輾轉移轉登記於林遠吉，顯然呂\n    傳文占用系爭土地，已獲得土地所有權人同意，14號建物既\n    已經地政機關登記在案，即屬合法建物、合法占有系爭土地\n    云云（本院卷(二)第144-145頁）。查林遠吉為子○○○等4人\n    之被繼承人林維賢之父（原審卷(二)第81頁），而子○○○等\n    上開辯解，固提出土地登記簿為證（本院卷(一)第66-69頁）\n    ，惟其仍應就林遠吉登記之建物之前前手呂傳文取得登記之\n    初，已得系爭土地所有權人之同意方興建14號建物一節舉證\n    以實其說，理由均同上述，其以上開登記之事實，遽謂14號\n    建物合法占有系爭土地云云，尚無可採。況子○○○等4人\n    謂「嗣後系爭房屋雖有拆除部分建物而有整建之情事……係\n    依政府政策進行拆除及整建，並非將原有建物整棟拆除……\n    」云云，然林遠吉登記之建物同為「土塊造瓦葺平家」（本\n    院卷(一)第68頁），與14號建物之現況為大相逕庭，有被上訴\n    人提出之照片、子○○○等4人提出之正面照片等在卷足稽\n    （原審卷(三)第73-79頁照片、本院卷(一)第72頁），顯然林遠\n    吉前所登記之「土塊造瓦葺平家」已完全拆除再興建現況之\n    14 號建物，子○○○等4人所稱拆除部分建物而有整建之情\n    事云云，非屬實在。其等提出臺北縣土城鄉○○道路拆除合\n    法建築物剩餘部分就地整建完工證明申請書、台北縣土城鄉\n    公所函（本院卷(一)第70、73頁）僅在發給完工證明、同意接\n    用水電等情，非在出具應由地政相關單位認定之合法建物之\n    登記，否則其等之被繼承人林維賢豈無不在所稱14號建物整\n    建完工之69年間逕向地政機關為保存登記之理，其等再稱「\n    ……系爭房屋所有權尚不能因地政機關行政作業問題未予轉\n    載，即認定已消滅或變為非法建物……系爭房屋占有系爭土\n    地，並非無權占有」云云（本院卷(二)第145頁），與事實不\n    符而無可取。\n  (五)子○○○等4人再辯稱14號建物自日據時代以來數十年，被\n    上訴人均未積極請求返還系爭土地，顯然被上訴人或其被繼\n    承人至少業默示同意系爭房屋占用系爭土地，乃係合法占有\n    使用關係云云（本院卷(二)第145頁），惟子○○○等4人未就\n    被上訴人或其被繼承人默示同意14號建物占用系爭土地一節\n    舉證以實其說，自不得以被上訴人遲至95年間方提起本件訴\n    訟，遽謂有默示同意14號建物使用系爭土地之事實。尤以子\n    ○○○等4人自認：「系爭房屋係合法登記在案之建物，因\n    登記謄本並無地上權之登記，故兩造間就系爭房屋所坐落之\n    系爭土地顯有未定期限之合法使用關係，而使用系爭土地之\n    目的，既為建造房屋以居住為目的，自應以上訴人使用系爭\n    土地之目的完畢，即無法繼續居住系爭房屋或該房屋不堪住\n    用時，返還期限始屆至」等語（本院卷(二)第145、146頁），\n    即退步言，其等自認14號建物占用系爭土地係「使用」（使\n    用借貸）關係，迄該建物不堪住用時，返還期限即屆至，而\n    林遠吉登記之「土塊造瓦葺平家」已於69年間完全拆除再興\n    建現況之14號建物，已如上述，則依子○○○等4人退步言\n    之辯解，其等被繼承人之父之「土塊造瓦葺平家」於69年間\n    已因不堪住用而拆除，返還期限即已屆至，即至遲於69年1\n    月19日起，其等所有之14號建物仍屬無權占用系爭土地，而\n    應拆屋還地。至其等辯稱被上訴人應就上訴人無權占有系爭\n    土地，負舉證責任云云，然「以無權占有為原因，請求返還\n    土地者，占有人對土地所有權存在之事實無爭執，而僅以非\n    無權占有為抗辯者，土地所有權人對其土地被無權占有之事\n    實無舉證責任，占有人自應就其取得占有係有正當權源之事\n    實證明之」（最高法院85年度台上字第1120號判決意旨參照\n    另同院72年度台上字第1552號判決同此旨），子○○○等4\n    人上開辯解即非可取。其等另舉最高法院93年台上字第818\n    號判決為其有利證據之認定云云，然14號建物係於69年間興\n    建，非日據時代所建，與該判決所稱情形不同，理由同上，\n    該判決不能作為有利於子○○○等4人認定之依據。\n  (六)子○○○等4人以其所有建物於日據時代大正12年11月2日即\n    已辦理保存登記一節，進而辯稱「可推定系爭建物所有權人\n    曾於當時提出土地所有人之許可、同意或承諾之書面證件，\n    故本件縱使上訴人現無法提出其先人確實曾購買系爭土地或\n    有地上權、使用借貸等權利證明，惟至少已證明當時之土地\n    所有人確實已同意在系爭土地上建築系爭房屋，上訴人並非\n    無權占有系爭土地」云云，核無可採，理由同上。而被上訴\n    人係基於民法第767條所賦予之物上請求權為本件之起訴，\n    自無違反誠信原則或權利濫用之情形。另板橋地政所98年5\n    月8日北縣板地登字第0980007403號函所載：「……光復初\n    期有關建物所有權登記，並未比照土地強制登記規定，建物\n    所有權登記係採任意登記制，由登記機關經常辦理，本所並\n    未辦理將前開建物由日據登記簿轉載情事」、臺北縣土城市\n    公所98年6月3日北縣土工字第0980019978號函：「旨揭房屋\n    （指14號建物）就地整建，因年代久遠及本所位址遷移檔案\n    保存不易，已查無相關就地整建證明文件……」等語，暨後\n    者所附「台北縣興闢公共設施拆除剩餘建築基地內建築物改\n    建增建辦法」第7條規定，申請於興闢公共設施拆除剩餘建\n    築基地內合法建物之改建、增建應檢附申請書、「土地權利\n    證明文件……等文件」（本院卷(一)第147、180-182頁），均\n    無由證明14號建物係合法使用系爭土地，否則林維賢於69年\n    間即可就14號建物逕向地政機關為登記。至臺北縣政府地政\n    局98年6月3日北地籍字第0980416257號函及內政部98年6月\n    9日內授中辦地字第0980045542號函不能為有利於子○○○\n    等4人認定之證據，理由同前。以上，子○○○等4人就其所\n    有14號建物占用系爭土地如附圖所示C部分一節，未能舉證\n    證明係屬有權占有，則被上訴人主張子○○○等4人所有之\n    14號建物係無權占用系爭土地如附圖所示C部分之事實，應\n    認為實在。按「所有人對於無權占有或侵奪其所有物者，得\n    請求返還之」，民法第767條前段定有明文。被上訴人依該\n    規定，請求天○○將坐落758地號內如附圖所示A部分面積52\n    .96平方公尺及756地號如附圖所示B部分面積0.74平方公尺\n    土地上之建物拆除，將該部分土地交還被上訴人、請求子○\n    ○○等4人將756地號內如附圖所示C部分面積56.95平方公尺\n    土地上之建物拆除，將該部分土地交還被上訴人，於法有據\n    ，應予准許。\n  (七)另按「無法律上之原因而受利益，致他人受損害者，應返還\n    其利益。雖有法律上之原因，而其後已不存在者，亦同」，\n    民法第179條定有明文。又依不當得利之法則請求返還不當\n    得利，以無法律上之原因而受利益，致他人受有損害為其要\n    件，故其得請求返還之範圍，應以對方所受之利益為度，非\n    以請求人所受損害若干為準，無權占有他人土地，可能獲得\n    相當於租金之利益為社會通常之觀念，是被上訴人抗辯其占\n    有系爭土地所得之利益，僅相當於法定最高限額租金之數額\n    ，尚屬可採（最高法院61年台上字第1695號判例參照）。天\n    ○○無權占有系爭土地之面積為53.7平方公尺（52.96+0.74\n    ＝53.7）、子○○○等4人無權占有系爭土地面積為56.95平\n    方公尺，依社會通常之觀念，可獲得免於支付租金之利益，\n    致被上訴人受有損害，被上訴人依上開規定，請求上訴人給\n    付相當於租金之不當得利，自屬有據。至被上訴人得請求之\n    不當得利應為若干？按城市地方房屋之租金，以不超過土地\n    及其建築物申報總價年息10％為限，土地法第97條第1項定\n    有明文，而依土地法施行法第25條規定，土地法第97條規定\n    之土地價額係指「法定地價」而言，又依土地法第148條規\n    定，土地所有權人依土地法所「申報之地價」為法定地價，\n    另依土地法第105條規定，同法第97條之規定，於租用基地\n    建築房屋準用之，是城市地方建築基地之租金亦應以土地申\n    報地價年息10％為限。本院審酌系爭土地位於土城市舊市區\n    、商店林立、生活機能尚稱便利等情，有被上訴人提出之現\n    場照片6張附卷可參（原審卷(三)第73頁以下），應以上訴人\n    無權占有使用之土地總地價年息7％計算年租金為適當。又\n    「租金之請求權因五年間不行使而消滅，既為民法第一百二\n    十六條所明定，則凡無法律上之原因，而獲得相當於租金之\n    利益，致他人受損害時，如該他人之返還利益請求權，已逾\n    租金短期消滅時效之期間，對於相當於已罹於消滅時效之租\n    金之利益，即不得依不當得利之法則，請求返還。其請求權\n    之時效期間，仍應依前開規定為五年，此為本院所持之見解\n    」，有最高法院96年度台上字第2660號判決意旨可參。被上\n    訴人於95年12月4日、96年3月20日依序對天○○、子○○○\n    等4人之被繼承人林維賢提起本件訴訟（原審卷(一)第3、192\n    頁），請求拆屋還地並給付相當於租金之不當得利，則被上\n    訴人請求天○○、子○○○等4人依序給付自95年12月31日\n    、96年3月27日回溯5年之相當於租金之不當得利、並依序自\n    96年1月1日、96年4月1日起至返還系爭土地之日止，按月給\n    付相當於租金之不當得利，即屬有據。系爭土地93年1月申\n    報地價為每平方公尺12,160元（原審卷(一)第10-11頁），另\n    系爭土地自89年7月至96年1月之公告地價均為15,200元（本\n    院卷(一)第255-256頁），依平均地權條例第16條「舉辦規定\n    地價或重新規定地價時，土地所有權人未於公告期間申報地\n    價者，以公告地價百分之八十為其申報地價」之規定，系爭\n    土地自89年7月至96年1月之申報地價均為12,160元（15,200\n    ×0.8＝12,160）。天○○、子○○○等4人所有16、14號建\n    物占用系爭土地面積如附圖說明欄所載，其等應給付5年之\n    不當得利、按月應給付之不當得利如附表所示。計天○○應\n    給付5年之不當得利為228,547元、按月應給付之不當得利為\n    3,809元、子○○○等4人應給付5年之不當得利為242,379元\n    、按月應給付之不當得利為4,040元，被上訴人請求天○○\n    、子○○○等4人各給付上開不當得利，於法有據，應予准\n    許。\n  (八)又按「給付無確定期限者，債務人於債權人得請求給付時，\n    經其催告而未為給付，自受催告時起，負遲延責任。其經債\n    權人起訴而送達訴狀，或依督促程序送達支付命令，或為其\n    他相類之行為者，與催告有同一之效力」，民法第229條第2\n    項定有明文。被上訴人請求天○○、子○○○等4人給付5年\n    不當得利部分，請求法定遲延利息，固屬有據。查被上訴人\n    於96年3月20日追加林維賢為被告，繕本於96年3月26日送達\n    （原審卷(一)第192、202頁），則被上訴人請求子○○○等4\n    人就5年之不當得利242,379元，自96年3月27日加計法定遲\n    延利息，於法有據。至天○○部分，原審第一次送達地址載\n    臺北縣土城市○○街16號（原審卷(一)第38頁），非天○○之\n    戶籍地，其寄存送達非屬合法，經被上訴人陳報天○○之戶\n    籍地為臺北縣土城市○○街16號後，原審再次以正確地址送\n    達，於96年1月4日寄存送達於臺北縣警察局土城分局土城派\n    出所，有天○○之戶籍謄本、送達證書可參（原審卷(一)第41\n    -42頁），按「寄存送達，自寄存之日起，經十日發生效力\n    」，民事訴訟法第138條第2項定有明文，再依民法第121條\n    第1項規定：「以日、星期、月或年定期間者，以期間末日\n    之終止，為期間之終止」，是寄存送達發生效力所應經之10\n    日期間，係以其期間末日之終止，為10日期間之終止，則就\n    天○○部分至96年1月14日發生送達效力，其給付5年不當得\n    利228,547元部分應自翌日即96年1月15日起算法定遲延利息\n    ，被上訴人請求天○○給付法定遲延利息超過上開部分，於\n    法無據。\n四綜上所述，被上訴人依民法第767條、第179條及繼承（被上訴\n  人就子○○○等4人部分，雖未述及該法律關係，然陳述子○\n  ○○等4人為林維賢之繼承人承受訴訟時，即已陳述其原因事\n  實）之規定，請求(一)天○○將758地號內如附圖所示A部分面積\n  52.96平方公尺及756地號如附圖所示B部分面積0.74平方公尺\n  土地上之建物拆除，將該部分土地交還被上訴人、(二)天○○給\n  付被上訴人228,547元，及自96年1月15日起至清償日止按週年\n  利率5％計算之利息；及自96年1月1日起至返還上開土地之日\n  止，按月給付被上訴人3,809元、(三)子○○○等4人將756地號\n  內如附圖所示C部分面積56.95平方公尺土地上之建物拆除，將\n  該部分土地交還被上訴人、(四)子○○○等4人給付被上訴人242\n  ,379元，及自96年3月27日起至清償日止按週年利率5％計算之\n  利息；及自96年4月1日起至返還上開土地之日止，按月給付被\n  上訴人為4,040元，於法有據，應予准許，被上訴人逾此範圍\n  之請求，於法無據，應予駁回。上開不應准許部分（即被上訴\n  人請求天○○給付228,547元自95年12月31日起至96年1月14日\n  止，以週年利率5％計算之利息部分），原審為上訴人敗訴之\n  判決，尚有未洽，上訴意旨指摘此部分原判決不當，求予廢棄\n  改判，為有理由，應由本院予以廢棄，改判如主文第二項所示\n  。上開應准許部分，原審為上訴人敗訴之判決，並依被上訴人\n  之聲請及依職權，酌定相當擔保金，分別為假執行、免為假執\n  行之諭知，核無不合。上訴意旨指摘原判決此部分不當，求予\n  廢棄改判，為無理由，應予駁回。\n五本件因事證已臻明確，兩造其餘攻擊、防禦方法及所為之立證\n  ，經審酌後認與判決之結果不生若何影響，無庸再逐一予以論\n  列，合併敘明。\n據上論結，本件上訴人天○○之上訴為一部有理由，一部無理由\n，上訴人子○○○等4人之上訴為無理由，依民事訴訟法第450條\n、第449條第1項、第79條、第85條第2項、第463條、第385條第1\n項前段判決如主文。\n中    華    民    國    99    年    1     月    5     日\n                    民事第十四庭\n                        審判長法  官  林金村\n                              法  官  王麗莉\n                              法  官  湯美玉\n正本係照原本作成。\n被上訴人不得上訴。\n上訴人如不服本判決，應於收受送達後20日內向本院提出上訴書\n狀，其未表明上訴理由者，應於提出上訴後20日內向本院補提理\n由書狀（均須按他造當事人之人數附繕本）上訴時應提出委任律\n師或具有律師資格之人之委任狀；委任有律師資格者，另應附具\n律師資格證書及釋明委任人與受任人有民事訴訟法第466條之1第\n1項但書或第2項（詳附註）所定關係之釋明文書影本。\n中    華    民    國    99    年    1     月    6     日\n                              書記官  蕭進忠\n附註：\n民事訴訟法第466條之1（第1項、第2項）：\n對於第二審判決上訴，上訴人應委任律師為訴訟代理人。但上訴\n人或其他法定代理人具有律師資格者，不在此限。\n上訴人之配偶、三親等內之血親、二親等內之姻親，或上訴人為\n法人、中央或地方機關時，其所屬專任人員具有律師資格並經法\n院認為適當者，亦得為第三審訴訟代理人。",
  "structure": {
    "main": "原判決關於命上訴人天○○給付新臺幣貳拾貳萬捌仟伍佰肆拾柒\n元自民國九十五年十二月三十一日起至民國九十六年一月十四日\n止，以週年利率百分之五計算之利息部分，及該部分假執行之宣\n告，暨命上訴人天○○負擔訴訟費用部分均廢棄。\n上開廢棄部分，被上訴人在第一審之訴及假執行之聲請均駁回。\n其餘上訴駁回。\n第一審關於命上訴人天○○負擔訴訟費用部分，及第二審訴訟費\n用關於上訴人天○○上訴部分，由上訴人天○○負擔。第二審訴\n訟費用關於上訴人子○○○、壬○○、辛○○、庚○○上訴部分\n，由上訴人子○○○、壬○○、辛○○、庚○○連帶負擔。",
    "fact": "甲、程序方面：\n一按「訴訟標的對於數人必須合一確定而應共同起訴，如其中一\n  人或數人拒絕同為原告而無正當理由者，法院得依原告聲請，\n  以裁定命該未起訴之人於一定期間內追加為原告。逾期未追加\n  者，視為已一同起訴」，民事訴訟法第56條之1第1項定有明文\n  。本件被上訴人丁○○於原審起訴後，向原審聲請追加其餘公\n  同共有人為原告，經原審依民事訴訟法第56條之1第1項之規定\n  ，通知林衡立、癸○○、己○○、戊○○、申○○、丑○○、\n  卯○○、午○○、亥○、寅○○、黃○○、宙○○、黃○○、\n  玄○○、酉○○○（即楊思瑛）、戌○○○（即楊思雄）、辰\n  ○○、宇○○○、未○○、甲○○、乙○○、丙○○、Ａ○○\n  、巳○○等人就追加為原告之事表示意見後，其等均未為任何\n  表示，復無正當理由拒絕為原告，原審乃於民國96年5月21 日\n  裁定林衡立（嗣於96年5月31日死亡，經原審裁定命其繼承人\n  申○○、辰○○承受訴訟）、癸○○、己○○、戊○○、申○\n  ○、丑○○、卯○○、午○○、亥○、寅○○、黃○○、宙○\n  ○、黃○○、玄○○、酉○○○、戌○○○、辰○○、宇○○\n  ○、未○○、甲○○、乙○○、丙○○、Ａ○○、巳○○（下\n  稱癸○○等22人）等人為原告，合於上開之規定。\n二又癸○○等22人未為任何表示，復無正當理由拒絕為原告，有\n  如上述，上訴人辯稱系爭土地之其他公同共有人，就其他土地\n  之訴訟事件中，曾於他案表明其不願與該事件之原告同為該事\n  件之原告，各該承審法院亦均以原告之訴之當事人適格有欠缺\n  為由，駁回原告之訴，是就本件訴訟可推定系爭土地之其他公\n  同共有人，同樣不願與原告丁○○同為本事件之原告，應駁回\n  原告之訴云云（本院卷(二)第137頁背面、第144頁），然癸○○\n  等22人於其他案件之陳述非等同於本件之陳述，況其等縱拒絕\n  同為原告而無正當理由者，法院仍得依原告聲請，以裁定命該\n  未起訴之人於一定期間內追加為原告，為民事訴訟法第56條之\n  1 第1項前段所明定，子○○○等4人所稱其他案件之處理非得\n  拘束本件。\n三上訴人子○○○、壬○○、辛○○、庚○○（下稱子○○○等\n  4人）再辯稱得依上開規定裁定命未起訴之人於一定期間內追\n  加為原告者，限於物權之請求權，不及於債權請求權，本件有\n  關不當得利之訴求部分，非固有必要共同訴訟，原審逕依民事\n  訴訟法第56條之1裁准被上訴人就不當得利請求部分追加林衡\n  立等人為原告，並判決上訴人應返還不當得利於全體原告，顯\n  有違誤云云（本院卷(二)第143、144頁），天○○亦為相同之辯\n  解（本院卷(二)第139頁）。然被上訴人係以一訴（民法第767條\n  之物上請求權）附帶請求相當於租金之不當得利（民事訴訟法\n  第77條之2第2項參照），原審係就被上訴人主張之物上請求權\n  追加林衡立等人為原告，並就被上訴人所為之附帶請求併為裁\n  判，並無不合，子○○○等4人上開辯解，非屬可採。\n四按「當事人不得提出新攻擊或防禦方法。但有下列情形之一者\n  ，不在此限……六、如不許其提出顯失公平者」，民事訴訟法\n  第447條第1項第6款定有明文。本件上訴人於原審經合法通知\n  未到場，經原審准被上訴人之聲請由其一造辯論而為判決，上\n  訴人聲明不服提起第二審上訴，應准上訴人提出新攻擊防禦方\n  法，否則有顯失公平之情形；則上訴人於本院提出地政登記資\n  料、房屋稅繳納證明文件，並聲請函查相關單位相關事宜等，\n  均應准其提出。\n五另按「言詞辯論期日，當事人之一造不到場者，得依到場當事\n  人之聲請，由其一造辯論而為判決；不到場之當事人，經再次\n  通知而仍不到場者，並得依職權由一造辯論而為判決。前項規\n  定，於訴訟標的對於共同訴訟之各人必須合一確定者，言詞辯\n  論期日，共同訴訟人中一人到場時，亦適用之」，民事訴訟法\n  第385條第1項、第2項定有明文。本件訴訟標的對於共同訴訟\n  之各人（原審共同原告即被上訴人）必須合一確定，有如上述\n  ，原審共同訴訟人即原審共同原告僅丁○○一人到場，其餘共\n  同原告未到場，原審共同被告天○○、子○○○等4人經合法\n  通知，未於言詞辯論期日到場，原審認無民事訴訟法第386條\n  所列各款情形，而准原審原告之聲請，由其一造辯論而為判決\n  ，核無違誤。上訴人子○○○等4人辯稱原審「訴訟程序是否\n  有瑕疵，亦實有疑義」云云（本院卷(二)第144頁），即無可取\n  。\n六被上訴人癸○○等22人經合法通知，未於言詞辯論期日到場，\n  核無民事訴訟法第386條所列各款情形，應准上訴人之聲請，\n  由其一造辯論而為判決。\n乙、實體方面：\n一被上訴人起訴主張：坐落臺北縣土城市○○段第756、758地號\n  土地（下合稱系爭土地，分稱756或758號土地）為伊等公同共\n  有。上訴人天○○、上訴人子○○○等4人之被繼承人林維賢\n  無權占用系爭土地，天○○在758號、756號土地如附圖依序所\n  示A、B部分上興建門牌號碼為臺北縣土城市○○街16號之建物\n  （下稱16號建物）、林維賢在756號土地如附圖所示編號C部分\n  上興建門牌號碼為臺北縣土城市○○街14號之建物（下稱14\n  號建物）。上訴人等無權占用系爭土地，應給付伊等相當於租\n  金之不當得利，計天○○應給付5年租金328,500元，並自96年\n  1月起至建物拆除日止，按月於每月末日前給付5,475元；子○\n  ○○等4人應給付5年租金350,755元，並自96年4月起至建物拆\n  除日止，按月於每月末日前給付5,846元。爰依民法第767條、\n  第179條之規定，求為命(一)天○○將758、756號土地上如附圖\n  所示A、B部分之全部建物拆除，將上開土地全部騰空交還被上\n  訴人、(二)子○○○等4人將756號土地上如附圖所示C部分之全\n  部建物拆除，將上開土地全部騰空交還被上訴人、(三)天○○給\n  付328,500元，及自起訴狀繕本送達翌日起加計法定遲延利息\n  、(四)天○○自96年1月起至騰空返還第1項所示土地之日止，按\n  月於每月末日前給付5,475元、(五)子○○○等4人給付350,755\n  元，及自起訴狀繕本送達翌日起加計法定遲延利息、(六)子○○\n  ○等4人自96年4月起至騰空返還第2項所示土地之日止，按月\n  於每月末日前給付5,846元之判決。\n  上訴人天○○則以：伊世居16號建物有百年歷史，自民國時期\n  迄今，稅捐機關亦以伊或先人為合法房屋稅捐繳納義務人，被\n  上訴人從未主張伊或先人無權占用系爭土地，顯然伊自祖先以\n  來絕非無權占有，且除丁○○以外，其他共有人或其祖先，未\n  否認伊或祖先之權利。依卷內資料，16號建物經由日據時代之\n  臺灣總督府臺北地方法院公證官吏辦理公證程序，益證16號建\n  物得占有系爭土地，絕非無權占有，而於日據時代大正12年間\n  ，16號建物經整修後登記為「土塊木造瓦葺平家壹棟建坪拾八\n  坪（並含）六合六勺六才（院落）」，保存登記之所有者係楊\n  勝旺，即伊父，益證被上訴人之被繼承人確知16號建物興建之\n  事實，伊非無權占用系爭土地云云，資為抗辯。\n  上訴人子○○○等4人以：14號建物原由呂傳文於日據時代辦\n  竣保存登記，其後經買賣之事由，移轉登記於林遠吉，顯然呂\n  傳文占用系爭土地，已獲得土地所有權人同意，是14號建物係\n  合法占有系爭土地。14號建物雖有拆除部分建物而有整建之情\n  事，係依政府政策進行拆除及整建，非將原有建物整棟拆除，\n  公所亦認定為合法建物。14號建物於日據時代即登記為林遠吉\n  所有，現所有人或其被繼承人無處分該建物情事，復無法定消\n  滅之原因，則其所有權不能因地政機關未予轉載，即認14號建\n  物已消滅或變為非法建物。再14號建物自日據時代以來數十年\n  ，被上訴人均未積極請求返還系爭土地，顯然被上訴人或其被\n  繼承人至少業默示同意14號建物占用系爭土地，乃係合法占有\n  使用關係。兩造間就14號建物顯有未定期限之合法使用關係，\n  而使用系爭土地之目的，既為建造房屋以居住為目的，自應以\n  伊等使用系爭土地之目的完畢，即無法繼續居住14號建物或該\n  房屋不堪住用時，返還期限始屆至。又數十年來除被上訴人丁\n  ○○外，其他公同共有人均未曾異議，丁○○行使所有物返還\n  請求權，意圖取回系爭土地，實有違反誠信原則或權利濫用之\n  情形云云，資為抗辯。\n二原審命天○○將758號內如附圖所示A部分面積52.96平方公尺\n  、756地號如附圖所示B部分面積0.74平方公尺土地上之建物拆\n  除，將該部分土地交還被上訴人、給付228,547元及自95年12\n  月31日起加計法定遲延利息；並自96年1月1日起至返還前項土\n  地之日止，按月給付3,809元。子○○○等4人將756地號內如\n  附圖所示C部分面積56.95平方公尺土地上之建物拆除，將該部\n  分土地交還被上訴人、給付242,379元及96年3月27日起加計法\n  定遲延利息；並自96年4月1日至返還第三項所示土地之日止，\n  按月給付4,040元，駁回被上訴人其餘之請求。上訴人提起上\n  訴，聲明：\n  (一)原判決不利上訴人部分廢棄。\n  (二)上開廢棄部分，被上訴人在第一審之訴及假執行之聲請均駁\n    回。\n  被上訴人丁○○則聲明：上訴駁回。\n  被上訴人癸○○等22人受合法通知，未於言詞辯論期日到場，\n  亦未提出任何書狀。\n  被上訴人於原審敗訴部分，未據聲明不服而告確定。\n三被上訴人主張前揭事實，提出系爭土地登記謄本、林熊祥、顏\n  春和、林陳師恆、林衡道、朱林茗之繼承系統表、律師函、臺\n  灣臺北地方法院92年度重訴字第1572號裁判暨確定證明書等件\n  為證（原審卷(一)第10-31頁）。被上訴人主張上訴人無權占用\n  系爭土地，為上訴人所否認，並以前詞置辯。經查：\n  (一)系爭土地為被上訴人或被上訴人之繼承人公同共有，有系爭\n    土地登記謄本、登記名義人林熊祥之繼承系統表在卷可憑（\n    原審卷(一)第10-13頁）。又原審至現場履行勘驗，並囑託臺\n    北縣板橋地政事務所（下稱板橋地政所）測量明確，系爭建\n    物占用系爭土地之位置、面積各如附圖說明欄所示，有勘驗\n    筆錄、土地複丈成果圖、板橋地政所96年4月16日北縣板地\n    測字第0960005464號函各1份在卷可憑（原審卷(一)第149-150\n    、238-239頁）。上訴人天○○、子○○○等4人依序就16號\n    建物、14號建物分別為其等所有一節並不爭執（本院卷(二)第\n    138-139、142頁）。上訴人雖辯稱其等所有之系爭建物係得\n    被上訴人或被上訴人之先祖之同意而興建，非屬無權占用系\n    爭土地云云。查依天○○提出之41年上期房捐查定通知書，\n    上載納稅義務人為楊勝旺，固為天○○之父，有其戶口名簿\n    可憑（本院卷(一)第96頁），然該通知書上載「現在住址：土\n    城10鄰慶安14號、房屋坐落所在地址：仝上」（本院卷(一)第\n    106頁），顯然房捐查定通知書上房屋坐落係14號建物，非\n    本件天○○占用之16號建物，另53年上期房捐繳納通知書所\n    載房屋坐落亦為土城村9鄰慶安街14號（本院卷(一)第107頁）\n    ，仍非本件其占用之16號建物，上開通知書均難作為有利於\n    天○○認定之依據。\n  (二)另天○○之父、祖母、曾祖父依序為楊勝旺、楊氏真、楊允\n    北，有繼承系統表、戶籍資料等在卷可參（本院卷(一)第87、\n    88、93、96頁）。楊允北於日據時代大正元年10月4日向林\n    春土購買「土塊木造瓦葺平家壹棟建坪拾八坪四合」，有家\n    屋賣買證書謄本可參（本院卷(一)第82-96頁）。又依天○○\n    提出之土地登記謄本，系爭土地分割自重測前之臺北縣土城\n    員林段土城小段83地號土地，該83地號土地於日據時代普查\n    時，登錄原始所有權人係林熊光，經林熊光贈與林熊祥、林\n    熊祥再移轉登記予大有物產株式會社，嗣回復為林熊祥，有\n    土地臺帳可稽（本院卷(一)第80頁）。上開「土塊木造瓦葺平\n    家壹棟建坪拾八坪四合」於日據時代大正12年11月2日登記\n    為「土塊木造瓦葺平家壹棟建坪拾八坪六合六勺六才」，保\n    存登記為天○○之父楊勝旺（本院卷(一)第100-101頁）。天\n    ○○聲請本院函查相關事宜，經內政部96年6月9日內授中辦\n    地字第0980045542號函，內附臺北縣政府地政局98年6月3日\n    北地籍字第0980416257號載：「說明……二……若辦理未登\n    記建物之所有權登記者，應提出土地登記簿謄本或土地台帳\n    謄本，證明申請人為已登記或登錄於土地台帳之建物基地所\n    權人或地上權人……」等語（本院卷(一)第185頁），天○○\n    進而辯稱林春土只有二種身分得請求為建物所有權之登記，\n    一為基地之所有權人，一為基地之地上權人云云。然上開楊\n    允北所購買之「土塊木造瓦葺平家壹棟建坪拾八坪四合」或\n    楊勝旺名義登記之「土塊木造瓦葺平家壹棟建坪拾八坪六合\n    六勺六才」建物，是否確為本件16號建物，尚屬有疑，依天\n    ○○提出之上開房捐查定通知書所載，反得證明非16號建物\n    。再林春土非基地之所有權人，至是否為地上權人，未據天\n    ○○舉證以實其說，況是否為地上權人於臺灣光復後應依土\n    地登記資料認定，其亦未提出相關土地登記資料以資證明楊\n    春土確為地上權人。縱依日據時代之日本民法第176條、第\n    177條「物權之設定、移轉因當事人意思表示即發生效力」\n    、「不動產物權之得喪變更，從登記法所定，非經登記不得\n    以對抗第三人」之規定，地上權之成立不以登記為生效要件\n    ，僅因當事人意思表示即發生效力。然天○○仍應就林春土\n    於日據時代確與系爭土地所有權人意思表示合致成立地上權\n    一節舉證以實其說，乃天○○迄未就此提出任何證據，僅以\n    上開臺北縣政府地政局函自為有利於己之解釋，謂林春土非\n    所有權即係地上權人，辯稱「該日據時期，有名『林春土』\n    之人，以興建房屋之目的，向土地所有權人林熊祥購得土地\n    之地上權，建造『土塊木造瓦葺平家壹棟建坪拾八坪(並含)\n    四合(院落)』」云云（本院卷(二)第138頁背面），自難採信\n    。\n  (三)天○○另辯稱依日據時代不動產登記法第106條「未登記之\n    建物所有權，其登記得依左列方式申請之：一、登記簿上登\n    記之建物所在土地之所有人或地上權人。二、證明依土地臺\n    帳謄本，自己或被繼承人被登錄為土地臺帳的所在土地之所\n    有人者。依已登記的所在土地的所有人或地上權人的證明書\n    ，證明自己的所有權者。依判決、其他官廳或公署之書面等\n    證明自己的所有權者」之規定，系爭建物所有權既已得日據\n    時代之地政機關核准為房屋所有權之保存登記，則自可推知\n    系爭建物之所有權人，必係取得系爭土地之所有權人或地上\n    權人，故依當時之法令規定，得申請辦理建物保存登記自明\n    。因此，上訴人系爭房屋絕無該當無權占有系爭土地之情事\n    云云（本院卷(二)第137-138頁）。然承上述，天○○之父楊\n    勝旺登記之上開「土塊木造瓦葺平家壹棟建坪拾八坪六合六\n    勺六才」建物，是否確為本件16號建物，尚屬有疑，楊勝旺\n    非系爭土地所有權人，天○○尤未舉證證明楊勝旺已取得地\n    上權，其逕依日據時代不動產登記法之上開規定為上開辯解\n    ，仍無可採。況上開楊勝旺登記之建物為「土塊木造瓦葺平\n    家」，顯然與系爭建物之現狀不符（見原審卷(三)第73-79頁\n    之照片），堪認16號建物非日據時代所興建，即與最高法院\n    93年台上字第818號判決「系爭土地為上訴人於民國四十五\n    年至五十七年間自原地主購得，而建蓋於系爭土地上之系爭\n    建物，為日據時代興建，並經辦畢保存登記，依當時施行於\n    台灣之日本民法及不動產登記法之規定，可推定系爭建物所\n    有權人曾於當時提出土地所有人之許可、同意或承諾之書面\n    證件」之情形有間，天○○自不得比附援引上開判決要旨為\n    其有利證據之認定。天○○再謂所有人對於有權占有其所有\n    物者，即無返還所有物之請求餘地，另依最高法院85年台上\n    字第389號判例：「按消滅時效完成，僅債務人取得拒絕履\n    行之抗辯權，得執以拒絕給付而已，其原有之法律關係並不\n    因而消滅。在土地買賣之情形，倘出賣人已交付土地與買受\n    人，雖買受人之所有權移轉登記請求權之消滅時效已完成，\n    惟其占有土地既係出賣人本於買賣之法律關係所交付，即具\n    有正當權源，原出賣人自不得認係無權占有而請求返還」，\n    本件上訴人既原始已屬合法占有人，縱目前已無地上權或土\n    地所有權登記之請求權，仍非得逕指為無權占有人云云（本\n    院卷(二)第138頁），然天○○未舉證其父楊勝旺或曾祖父楊\n    允北之前手已合法取得地上權，已如前述，其逕援引上開判\n    例謂被上訴人不得認係無權占有而請求返還云云，仍屬無據\n    。以上，天○○就其所有16號建物占用系爭土地如附圖所示\n    A、B部分一節，未能舉證證明係屬有權占有，則被上訴人主\n    張天○○所有之16號建物係無權占用系爭土地如附圖所示A\n    、B部分之事實，應認為實在。\n  (四)子○○○等4人辯稱14號建物係由呂傳文於日據時代辦竣保\n    存登記，嗣經買賣之事由，輾轉移轉登記於林遠吉，顯然呂\n    傳文占用系爭土地，已獲得土地所有權人同意，14號建物既\n    已經地政機關登記在案，即屬合法建物、合法占有系爭土地\n    云云（本院卷(二)第144-145頁）。查林遠吉為子○○○等4人\n    之被繼承人林維賢之父（原審卷(二)第81頁），而子○○○等\n    上開辯解，固提出土地登記簿為證（本院卷(一)第66-69頁）\n    ，惟其仍應就林遠吉登記之建物之前前手呂傳文取得登記之\n    初，已得系爭土地所有權人之同意方興建14號建物一節舉證\n    以實其說，理由均同上述，其以上開登記之事實，遽謂14號\n    建物合法占有系爭土地云云，尚無可採。況子○○○等4人\n    謂「嗣後系爭房屋雖有拆除部分建物而有整建之情事……係\n    依政府政策進行拆除及整建，並非將原有建物整棟拆除……\n    」云云，然林遠吉登記之建物同為「土塊造瓦葺平家」（本\n    院卷(一)第68頁），與14號建物之現況為大相逕庭，有被上訴\n    人提出之照片、子○○○等4人提出之正面照片等在卷足稽\n    （原審卷(三)第73-79頁照片、本院卷(一)第72頁），顯然林遠\n    吉前所登記之「土塊造瓦葺平家」已完全拆除再興建現況之\n    14 號建物，子○○○等4人所稱拆除部分建物而有整建之情\n    事云云，非屬實在。其等提出臺北縣土城鄉○○道路拆除合\n    法建築物剩餘部分就地整建完工證明申請書、台北縣土城鄉\n    公所函（本院卷(一)第70、73頁）僅在發給完工證明、同意接\n    用水電等情，非在出具應由地政相關單位認定之合法建物之\n    登記，否則其等之被繼承人林維賢豈無不在所稱14號建物整\n    建完工之69年間逕向地政機關為保存登記之理，其等再稱「\n    ……系爭房屋所有權尚不能因地政機關行政作業問題未予轉\n    載，即認定已消滅或變為非法建物……系爭房屋占有系爭土\n    地，並非無權占有」云云（本院卷(二)第145頁），與事實不\n    符而無可取。\n  (五)子○○○等4人再辯稱14號建物自日據時代以來數十年，被\n    上訴人均未積極請求返還系爭土地，顯然被上訴人或其被繼\n    承人至少業默示同意系爭房屋占用系爭土地，乃係合法占有\n    使用關係云云（本院卷(二)第145頁），惟子○○○等4人未就\n    被上訴人或其被繼承人默示同意14號建物占用系爭土地一節\n    舉證以實其說，自不得以被上訴人遲至95年間方提起本件訴\n    訟，遽謂有默示同意14號建物使用系爭土地之事實。尤以子\n    ○○○等4人自認：「系爭房屋係合法登記在案之建物，因\n    登記謄本並無地上權之登記，故兩造間就系爭房屋所坐落之\n    系爭土地顯有未定期限之合法使用關係，而使用系爭土地之\n    目的，既為建造房屋以居住為目的，自應以上訴人使用系爭\n    土地之目的完畢，即無法繼續居住系爭房屋或該房屋不堪住\n    用時，返還期限始屆至」等語（本院卷(二)第145、146頁），\n    即退步言，其等自認14號建物占用系爭土地係「使用」（使\n    用借貸）關係，迄該建物不堪住用時，返還期限即屆至，而\n    林遠吉登記之「土塊造瓦葺平家」已於69年間完全拆除再興\n    建現況之14號建物，已如上述，則依子○○○等4人退步言\n    之辯解，其等被繼承人之父之「土塊造瓦葺平家」於69年間\n    已因不堪住用而拆除，返還期限即已屆至，即至遲於69年1\n    月19日起，其等所有之14號建物仍屬無權占用系爭土地，而\n    應拆屋還地。至其等辯稱被上訴人應就上訴人無權占有系爭\n    土地，負舉證責任云云，然「以無權占有為原因，請求返還\n    土地者，占有人對土地所有權存在之事實無爭執，而僅以非\n    無權占有為抗辯者，土地所有權人對其土地被無權占有之事\n    實無舉證責任，占有人自應就其取得占有係有正當權源之事\n    實證明之」（最高法院85年度台上字第1120號判決意旨參照\n    另同院72年度台上字第1552號判決同此旨），子○○○等4\n    人上開辯解即非可取。其等另舉最高法院93年台上字第818\n    號判決為其有利證據之認定云云，然14號建物係於69年間興\n    建，非日據時代所建，與該判決所稱情形不同，理由同上，\n    該判決不能作為有利於子○○○等4人認定之依據。\n  (六)子○○○等4人以其所有建物於日據時代大正12年11月2日即\n    已辦理保存登記一節，進而辯稱「可推定系爭建物所有權人\n    曾於當時提出土地所有人之許可、同意或承諾之書面證件，\n    故本件縱使上訴人現無法提出其先人確實曾購買系爭土地或\n    有地上權、使用借貸等權利證明，惟至少已證明當時之土地\n    所有人確實已同意在系爭土地上建築系爭房屋，上訴人並非\n    無權占有系爭土地」云云，核無可採，理由同上。而被上訴\n    人係基於民法第767條所賦予之物上請求權為本件之起訴，\n    自無違反誠信原則或權利濫用之情形。另板橋地政所98年5\n    月8日北縣板地登字第0980007403號函所載：「……光復初\n    期有關建物所有權登記，並未比照土地強制登記規定，建物\n    所有權登記係採任意登記制，由登記機關經常辦理，本所並\n    未辦理將前開建物由日據登記簿轉載情事」、臺北縣土城市\n    公所98年6月3日北縣土工字第0980019978號函：「旨揭房屋\n    （指14號建物）就地整建，因年代久遠及本所位址遷移檔案\n    保存不易，已查無相關就地整建證明文件……」等語，暨後\n    者所附「台北縣興闢公共設施拆除剩餘建築基地內建築物改\n    建增建辦法」第7條規定，申請於興闢公共設施拆除剩餘建\n    築基地內合法建物之改建、增建應檢附申請書、「土地權利\n    證明文件……等文件」（本院卷(一)第147、180-182頁），均\n    無由證明14號建物係合法使用系爭土地，否則林維賢於69年\n    間即可就14號建物逕向地政機關為登記。至臺北縣政府地政\n    局98年6月3日北地籍字第0980416257號函及內政部98年6月\n    9日內授中辦地字第0980045542號函不能為有利於子○○○\n    等4人認定之證據，理由同前。以上，子○○○等4人就其所\n    有14號建物占用系爭土地如附圖所示C部分一節，未能舉證\n    證明係屬有權占有，則被上訴人主張子○○○等4人所有之\n    14號建物係無權占用系爭土地如附圖所示C部分之事實，應\n    認為實在。按「所有人對於無權占有或侵奪其所有物者，得\n    請求返還之」，民法第767條前段定有明文。被上訴人依該\n    規定，請求天○○將坐落758地號內如附圖所示A部分面積52\n    .96平方公尺及756地號如附圖所示B部分面積0.74平方公尺\n    土地上之建物拆除，將該部分土地交還被上訴人、請求子○\n    ○○等4人將756地號內如附圖所示C部分面積56.95平方公尺\n    土地上之建物拆除，將該部分土地交還被上訴人，於法有據\n    ，應予准許。\n  (七)另按「無法律上之原因而受利益，致他人受損害者，應返還\n    其利益。雖有法律上之原因，而其後已不存在者，亦同」，\n    民法第179條定有明文。又依不當得利之法則請求返還不當\n    得利，以無法律上之原因而受利益，致他人受有損害為其要\n    件，故其得請求返還之範圍，應以對方所受之利益為度，非\n    以請求人所受損害若干為準，無權占有他人土地，可能獲得\n    相當於租金之利益為社會通常之觀念，是被上訴人抗辯其占\n    有系爭土地所得之利益，僅相當於法定最高限額租金之數額\n    ，尚屬可採（最高法院61年台上字第1695號判例參照）。天\n    ○○無權占有系爭土地之面積為53.7平方公尺（52.96+0.74\n    ＝53.7）、子○○○等4人無權占有系爭土地面積為56.95平\n    方公尺，依社會通常之觀念，可獲得免於支付租金之利益，\n    致被上訴人受有損害，被上訴人依上開規定，請求上訴人給\n    付相當於租金之不當得利，自屬有據。至被上訴人得請求之\n    不當得利應為若干？按城市地方房屋之租金，以不超過土地\n    及其建築物申報總價年息10％為限，土地法第97條第1項定\n    有明文，而依土地法施行法第25條規定，土地法第97條規定\n    之土地價額係指「法定地價」而言，又依土地法第148條規\n    定，土地所有權人依土地法所「申報之地價」為法定地價，\n    另依土地法第105條規定，同法第97條之規定，於租用基地\n    建築房屋準用之，是城市地方建築基地之租金亦應以土地申\n    報地價年息10％為限。本院審酌系爭土地位於土城市舊市區\n    、商店林立、生活機能尚稱便利等情，有被上訴人提出之現\n    場照片6張附卷可參（原審卷(三)第73頁以下），應以上訴人\n    無權占有使用之土地總地價年息7％計算年租金為適當。又\n    「租金之請求權因五年間不行使而消滅，既為民法第一百二\n    十六條所明定，則凡無法律上之原因，而獲得相當於租金之\n    利益，致他人受損害時，如該他人之返還利益請求權，已逾\n    租金短期消滅時效之期間，對於相當於已罹於消滅時效之租\n    金之利益，即不得依不當得利之法則，請求返還。其請求權\n    之時效期間，仍應依前開規定為五年，此為本院所持之見解\n    」，有最高法院96年度台上字第2660號判決意旨可參。被上\n    訴人於95年12月4日、96年3月20日依序對天○○、子○○○\n    等4人之被繼承人林維賢提起本件訴訟（原審卷(一)第3、192\n    頁），請求拆屋還地並給付相當於租金之不當得利，則被上\n    訴人請求天○○、子○○○等4人依序給付自95年12月31日\n    、96年3月27日回溯5年之相當於租金之不當得利、並依序自\n    96年1月1日、96年4月1日起至返還系爭土地之日止，按月給\n    付相當於租金之不當得利，即屬有據。系爭土地93年1月申\n    報地價為每平方公尺12,160元（原審卷(一)第10-11頁），另\n    系爭土地自89年7月至96年1月之公告地價均為15,200元（本\n    院卷(一)第255-256頁），依平均地權條例第16條「舉辦規定\n    地價或重新規定地價時，土地所有權人未於公告期間申報地\n    價者，以公告地價百分之八十為其申報地價」之規定，系爭\n    土地自89年7月至96年1月之申報地價均為12,160元（15,200\n    ×0.8＝12,160）。天○○、子○○○等4人所有16、14號建\n    物占用系爭土地面積如附圖說明欄所載，其等應給付5年之\n    不當得利、按月應給付之不當得利如附表所示。計天○○應\n    給付5年之不當得利為228,547元、按月應給付之不當得利為\n    3,809元、子○○○等4人應給付5年之不當得利為242,379元\n    、按月應給付之不當得利為4,040元，被上訴人請求天○○\n    、子○○○等4人各給付上開不當得利，於法有據，應予准\n    許。\n  (八)又按「給付無確定期限者，債務人於債權人得請求給付時，\n    經其催告而未為給付，自受催告時起，負遲延責任。其經債\n    權人起訴而送達訴狀，或依督促程序送達支付命令，或為其\n    他相類之行為者，與催告有同一之效力」，民法第229條第2\n    項定有明文。被上訴人請求天○○、子○○○等4人給付5年\n    不當得利部分，請求法定遲延利息，固屬有據。查被上訴人\n    於96年3月20日追加林維賢為被告，繕本於96年3月26日送達\n    （原審卷(一)第192、202頁），則被上訴人請求子○○○等4\n    人就5年之不當得利242,379元，自96年3月27日加計法定遲\n    延利息，於法有據。至天○○部分，原審第一次送達地址載\n    臺北縣土城市○○街16號（原審卷(一)第38頁），非天○○之\n    戶籍地，其寄存送達非屬合法，經被上訴人陳報天○○之戶\n    籍地為臺北縣土城市○○街16號後，原審再次以正確地址送\n    達，於96年1月4日寄存送達於臺北縣警察局土城分局土城派\n    出所，有天○○之戶籍謄本、送達證書可參（原審卷(一)第41\n    -42頁），按「寄存送達，自寄存之日起，經十日發生效力\n    」，民事訴訟法第138條第2項定有明文，再依民法第121條\n    第1項規定：「以日、星期、月或年定期間者，以期間末日\n    之終止，為期間之終止」，是寄存送達發生效力所應經之10\n    日期間，係以其期間末日之終止，為10日期間之終止，則就\n    天○○部分至96年1月14日發生送達效力，其給付5年不當得\n    利228,547元部分應自翌日即96年1月15日起算法定遲延利息\n    ，被上訴人請求天○○給付法定遲延利息超過上開部分，於\n    法無據。\n四綜上所述，被上訴人依民法第767條、第179條及繼承（被上訴\n  人就子○○○等4人部分，雖未述及該法律關係，然陳述子○\n  ○○等4人為林維賢之繼承人承受訴訟時，即已陳述其原因事\n  實）之規定，請求(一)天○○將758地號內如附圖所示A部分面積\n  52.96平方公尺及756地號如附圖所示B部分面積0.74平方公尺\n  土地上之建物拆除，將該部分土地交還被上訴人、(二)天○○給\n  付被上訴人228,547元，及自96年1月15日起至清償日止按週年\n  利率5％計算之利息；及自96年1月1日起至返還上開土地之日\n  止，按月給付被上訴人3,809元、(三)子○○○等4人將756地號\n  內如附圖所示C部分面積56.95平方公尺土地上之建物拆除，將\n  該部分土地交還被上訴人、(四)子○○○等4人給付被上訴人242\n  ,379元，及自96年3月27日起至清償日止按週年利率5％計算之\n  利息；及自96年4月1日起至返還上開土地之日止，按月給付被\n  上訴人為4,040元，於法有據，應予准許，被上訴人逾此範圍\n  之請求，於法無據，應予駁回。上開不應准許部分（即被上訴\n  人請求天○○給付228,547元自95年12月31日起至96年1月14日\n  止，以週年利率5％計算之利息部分），原審為上訴人敗訴之\n  判決，尚有未洽，上訴意旨指摘此部分原判決不當，求予廢棄\n  改判，為有理由，應由本院予以廢棄，改判如主文第二項所示\n  。上開應准許部分，原審為上訴人敗訴之判決，並依被上訴人\n  之聲請及依職權，酌定相當擔保金，分別為假執行、免為假執\n  行之諭知，核無不合。上訴意旨指摘原判決此部分不當，求予\n  廢棄改判，為無理由，應予駁回。\n五本件因事證已臻明確，兩造其餘攻擊、防禦方法及所為之立證\n  ，經審酌後認與判決之結果不生若何影響，無庸再逐一予以論\n  列，合併敘明。\n據上論結，本件上訴人天○○之上訴為一部有理由，一部無理由\n，上訴人子○○○等4人之上訴為無理由，依民事訴訟法第450條\n、第449條第1項、第79條、第85條第2項、第463條、第385條第1\n項前段判決如主文。",
    "reason": "甲、程序方面：\n一按「訴訟標的對於數人必須合一確定而應共同起訴，如其中一\n  人或數人拒絕同為原告而無正當理由者，法院得依原告聲請，\n  以裁定命該未起訴之人於一定期間內追加為原告。逾期未追加\n  者，視為已一同起訴」，民事訴訟法第56條之1第1項定有明文\n  。本件被上訴人丁○○於原審起訴後，向原審聲請追加其餘公\n  同共有人為原告，經原審依民事訴訟法第56條之1第1項之規定\n  ，通知林衡立、癸○○、己○○、戊○○、申○○、丑○○、\n  卯○○、午○○、亥○、寅○○、黃○○、宙○○、黃○○、\n  玄○○、酉○○○（即楊思瑛）、戌○○○（即楊思雄）、辰\n  ○○、宇○○○、未○○、甲○○、乙○○、丙○○、Ａ○○\n  、巳○○等人就追加為原告之事表示意見後，其等均未為任何\n  表示，復無正當理由拒絕為原告，原審乃於民國96年5月21 日\n  裁定林衡立（嗣於96年5月31日死亡，經原審裁定命其繼承人\n  申○○、辰○○承受訴訟）、癸○○、己○○、戊○○、申○\n  ○、丑○○、卯○○、午○○、亥○、寅○○、黃○○、宙○\n  ○、黃○○、玄○○、酉○○○、戌○○○、辰○○、宇○○\n  ○、未○○、甲○○、乙○○、丙○○、Ａ○○、巳○○（下\n  稱癸○○等22人）等人為原告，合於上開之規定。\n二又癸○○等22人未為任何表示，復無正當理由拒絕為原告，有\n  如上述，上訴人辯稱系爭土地之其他公同共有人，就其他土地\n  之訴訟事件中，曾於他案表明其不願與該事件之原告同為該事\n  件之原告，各該承審法院亦均以原告之訴之當事人適格有欠缺\n  為由，駁回原告之訴，是就本件訴訟可推定系爭土地之其他公\n  同共有人，同樣不願與原告丁○○同為本事件之原告，應駁回\n  原告之訴云云（本院卷(二)第137頁背面、第144頁），然癸○○\n  等22人於其他案件之陳述非等同於本件之陳述，況其等縱拒絕\n  同為原告而無正當理由者，法院仍得依原告聲請，以裁定命該\n  未起訴之人於一定期間內追加為原告，為民事訴訟法第56條之\n  1 第1項前段所明定，子○○○等4人所稱其他案件之處理非得\n  拘束本件。\n三上訴人子○○○、壬○○、辛○○、庚○○（下稱子○○○等\n  4人）再辯稱得依上開規定裁定命未起訴之人於一定期間內追\n  加為原告者，限於物權之請求權，不及於債權請求權，本件有\n  關不當得利之訴求部分，非固有必要共同訴訟，原審逕依民事\n  訴訟法第56條之1裁准被上訴人就不當得利請求部分追加林衡\n  立等人為原告，並判決上訴人應返還不當得利於全體原告，顯\n  有違誤云云（本院卷(二)第143、144頁），天○○亦為相同之辯\n  解（本院卷(二)第139頁）。然被上訴人係以一訴（民法第767條\n  之物上請求權）附帶請求相當於租金之不當得利（民事訴訟法\n  第77條之2第2項參照），原審係就被上訴人主張之物上請求權\n  追加林衡立等人為原告，並就被上訴人所為之附帶請求併為裁\n  判，並無不合，子○○○等4人上開辯解，非屬可採。\n四按「當事人不得提出新攻擊或防禦方法。但有下列情形之一者\n  ，不在此限……六、如不許其提出顯失公平者」，民事訴訟法\n  第447條第1項第6款定有明文。本件上訴人於原審經合法通知\n  未到場，經原審准被上訴人之聲請由其一造辯論而為判決，上\n  訴人聲明不服提起第二審上訴，應准上訴人提出新攻擊防禦方\n  法，否則有顯失公平之情形；則上訴人於本院提出地政登記資\n  料、房屋稅繳納證明文件，並聲請函查相關單位相關事宜等，\n  均應准其提出。\n五另按「言詞辯論期日，當事人之一造不到場者，得依到場當事\n  人之聲請，由其一造辯論而為判決；不到場之當事人，經再次\n  通知而仍不到場者，並得依職權由一造辯論而為判決。前項規\n  定，於訴訟標的對於共同訴訟之各人必須合一確定者，言詞辯\n  論期日，共同訴訟人中一人到場時，亦適用之」，民事訴訟法\n  第385條第1項、第2項定有明文。本件訴訟標的對於共同訴訟\n  之各人（原審共同原告即被上訴人）必須合一確定，有如上述\n  ，原審共同訴訟人即原審共同原告僅丁○○一人到場，其餘共\n  同原告未到場，原審共同被告天○○、子○○○等4人經合法\n  通知，未於言詞辯論期日到場，原審認無民事訴訟法第386條\n  所列各款情形，而准原審原告之聲請，由其一造辯論而為判決\n  ，核無違誤。上訴人子○○○等4人辯稱原審「訴訟程序是否\n  有瑕疵，亦實有疑義」云云（本院卷(二)第144頁），即無可取\n  。\n六被上訴人癸○○等22人經合法通知，未於言詞辯論期日到場，\n  核無民事訴訟法第386條所列各款情形，應准上訴人之聲請，\n  由其一造辯論而為判決。\n乙、實體方面：\n一被上訴人起訴主張：坐落臺北縣土城市○○段第756、758地號\n  土地（下合稱系爭土地，分稱756或758號土地）為伊等公同共\n  有。上訴人天○○、上訴人子○○○等4人之被繼承人林維賢\n  無權占用系爭土地，天○○在758號、756號土地如附圖依序所\n  示A、B部分上興建門牌號碼為臺北縣土城市○○街16號之建物\n  （下稱16號建物）、林維賢在756號土地如附圖所示編號C部分\n  上興建門牌號碼為臺北縣土城市○○街14號之建物（下稱14\n  號建物）。上訴人等無權占用系爭土地，應給付伊等相當於租\n  金之不當得利，計天○○應給付5年租金328,500元，並自96年\n  1月起至建物拆除日止，按月於每月末日前給付5,475元；子○\n  ○○等4人應給付5年租金350,755元，並自96年4月起至建物拆\n  除日止，按月於每月末日前給付5,846元。爰依民法第767條、\n  第179條之規定，求為命(一)天○○將758、756號土地上如附圖\n  所示A、B部分之全部建物拆除，將上開土地全部騰空交還被上\n  訴人、(二)子○○○等4人將756號土地上如附圖所示C部分之全\n  部建物拆除，將上開土地全部騰空交還被上訴人、(三)天○○給\n  付328,500元，及自起訴狀繕本送達翌日起加計法定遲延利息\n  、(四)天○○自96年1月起至騰空返還第1項所示土地之日止，按\n  月於每月末日前給付5,475元、(五)子○○○等4人給付350,755\n  元，及自起訴狀繕本送達翌日起加計法定遲延利息、(六)子○○\n  ○等4人自96年4月起至騰空返還第2項所示土地之日止，按月\n  於每月末日前給付5,846元之判決。\n  上訴人天○○則以：伊世居16號建物有百年歷史，自民國時期\n  迄今，稅捐機關亦以伊或先人為合法房屋稅捐繳納義務人，被\n  上訴人從未主張伊或先人無權占用系爭土地，顯然伊自祖先以\n  來絕非無權占有，且除丁○○以外，其他共有人或其祖先，未\n  否認伊或祖先之權利。依卷內資料，16號建物經由日據時代之\n  臺灣總督府臺北地方法院公證官吏辦理公證程序，益證16號建\n  物得占有系爭土地，絕非無權占有，而於日據時代大正12年間\n  ，16號建物經整修後登記為「土塊木造瓦葺平家壹棟建坪拾八\n  坪（並含）六合六勺六才（院落）」，保存登記之所有者係楊\n  勝旺，即伊父，益證被上訴人之被繼承人確知16號建物興建之\n  事實，伊非無權占用系爭土地云云，資為抗辯。\n  上訴人子○○○等4人以：14號建物原由呂傳文於日據時代辦\n  竣保存登記，其後經買賣之事由，移轉登記於林遠吉，顯然呂\n  傳文占用系爭土地，已獲得土地所有權人同意，是14號建物係\n  合法占有系爭土地。14號建物雖有拆除部分建物而有整建之情\n  事，係依政府政策進行拆除及整建，非將原有建物整棟拆除，\n  公所亦認定為合法建物。14號建物於日據時代即登記為林遠吉\n  所有，現所有人或其被繼承人無處分該建物情事，復無法定消\n  滅之原因，則其所有權不能因地政機關未予轉載，即認14號建\n  物已消滅或變為非法建物。再14號建物自日據時代以來數十年\n  ，被上訴人均未積極請求返還系爭土地，顯然被上訴人或其被\n  繼承人至少業默示同意14號建物占用系爭土地，乃係合法占有\n  使用關係。兩造間就14號建物顯有未定期限之合法使用關係，\n  而使用系爭土地之目的，既為建造房屋以居住為目的，自應以\n  伊等使用系爭土地之目的完畢，即無法繼續居住14號建物或該\n  房屋不堪住用時，返還期限始屆至。又數十年來除被上訴人丁\n  ○○外，其他公同共有人均未曾異議，丁○○行使所有物返還\n  請求權，意圖取回系爭土地，實有違反誠信原則或權利濫用之\n  情形云云，資為抗辯。\n二原審命天○○將758號內如附圖所示A部分面積52.96平方公尺\n  、756地號如附圖所示B部分面積0.74平方公尺土地上之建物拆\n  除，將該部分土地交還被上訴人、給付228,547元及自95年12\n  月31日起加計法定遲延利息；並自96年1月1日起至返還前項土\n  地之日止，按月給付3,809元。子○○○等4人將756地號內如\n  附圖所示C部分面積56.95平方公尺土地上之建物拆除，將該部\n  分土地交還被上訴人、給付242,379元及96年3月27日起加計法\n  定遲延利息；並自96年4月1日至返還第三項所示土地之日止，\n  按月給付4,040元，駁回被上訴人其餘之請求。上訴人提起上\n  訴，聲明：\n  (一)原判決不利上訴人部分廢棄。\n  (二)上開廢棄部分，被上訴人在第一審之訴及假執行之聲請均駁\n    回。\n  被上訴人丁○○則聲明：上訴駁回。\n  被上訴人癸○○等22人受合法通知，未於言詞辯論期日到場，\n  亦未提出任何書狀。\n  被上訴人於原審敗訴部分，未據聲明不服而告確定。\n三被上訴人主張前揭事實，提出系爭土地登記謄本、林熊祥、顏\n  春和、林陳師恆、林衡道、朱林茗之繼承系統表、律師函、臺\n  灣臺北地方法院92年度重訴字第1572號裁判暨確定證明書等件\n  為證（原審卷(一)第10-31頁）。被上訴人主張上訴人無權占用\n  系爭土地，為上訴人所否認，並以前詞置辯。經查：\n  (一)系爭土地為被上訴人或被上訴人之繼承人公同共有，有系爭\n    土地登記謄本、登記名義人林熊祥之繼承系統表在卷可憑（\n    原審卷(一)第10-13頁）。又原審至現場履行勘驗，並囑託臺\n    北縣板橋地政事務所（下稱板橋地政所）測量明確，系爭建\n    物占用系爭土地之位置、面積各如附圖說明欄所示，有勘驗\n    筆錄、土地複丈成果圖、板橋地政所96年4月16日北縣板地\n    測字第0960005464號函各1份在卷可憑（原審卷(一)第149-150\n    、238-239頁）。上訴人天○○、子○○○等4人依序就16號\n    建物、14號建物分別為其等所有一節並不爭執（本院卷(二)第\n    138-139、142頁）。上訴人雖辯稱其等所有之系爭建物係得\n    被上訴人或被上訴人之先祖之同意而興建，非屬無權占用系\n    爭土地云云。查依天○○提出之41年上期房捐查定通知書，\n    上載納稅義務人為楊勝旺，固為天○○之父，有其戶口名簿\n    可憑（本院卷(一)第96頁），然該通知書上載「現在住址：土\n    城10鄰慶安14號、房屋坐落所在地址：仝上」（本院卷(一)第\n    106頁），顯然房捐查定通知書上房屋坐落係14號建物，非\n    本件天○○占用之16號建物，另53年上期房捐繳納通知書所\n    載房屋坐落亦為土城村9鄰慶安街14號（本院卷(一)第107頁）\n    ，仍非本件其占用之16號建物，上開通知書均難作為有利於\n    天○○認定之依據。\n  (二)另天○○之父、祖母、曾祖父依序為楊勝旺、楊氏真、楊允\n    北，有繼承系統表、戶籍資料等在卷可參（本院卷(一)第87、\n    88、93、96頁）。楊允北於日據時代大正元年10月4日向林\n    春土購買「土塊木造瓦葺平家壹棟建坪拾八坪四合」，有家\n    屋賣買證書謄本可參（本院卷(一)第82-96頁）。又依天○○\n    提出之土地登記謄本，系爭土地分割自重測前之臺北縣土城\n    員林段土城小段83地號土地，該83地號土地於日據時代普查\n    時，登錄原始所有權人係林熊光，經林熊光贈與林熊祥、林\n    熊祥再移轉登記予大有物產株式會社，嗣回復為林熊祥，有\n    土地臺帳可稽（本院卷(一)第80頁）。上開「土塊木造瓦葺平\n    家壹棟建坪拾八坪四合」於日據時代大正12年11月2日登記\n    為「土塊木造瓦葺平家壹棟建坪拾八坪六合六勺六才」，保\n    存登記為天○○之父楊勝旺（本院卷(一)第100-101頁）。天\n    ○○聲請本院函查相關事宜，經內政部96年6月9日內授中辦\n    地字第0980045542號函，內附臺北縣政府地政局98年6月3日\n    北地籍字第0980416257號載：「說明……二……若辦理未登\n    記建物之所有權登記者，應提出土地登記簿謄本或土地台帳\n    謄本，證明申請人為已登記或登錄於土地台帳之建物基地所\n    權人或地上權人……」等語（本院卷(一)第185頁），天○○\n    進而辯稱林春土只有二種身分得請求為建物所有權之登記，\n    一為基地之所有權人，一為基地之地上權人云云。然上開楊\n    允北所購買之「土塊木造瓦葺平家壹棟建坪拾八坪四合」或\n    楊勝旺名義登記之「土塊木造瓦葺平家壹棟建坪拾八坪六合\n    六勺六才」建物，是否確為本件16號建物，尚屬有疑，依天\n    ○○提出之上開房捐查定通知書所載，反得證明非16號建物\n    。再林春土非基地之所有權人，至是否為地上權人，未據天\n    ○○舉證以實其說，況是否為地上權人於臺灣光復後應依土\n    地登記資料認定，其亦未提出相關土地登記資料以資證明楊\n    春土確為地上權人。縱依日據時代之日本民法第176條、第\n    177條「物權之設定、移轉因當事人意思表示即發生效力」\n    、「不動產物權之得喪變更，從登記法所定，非經登記不得\n    以對抗第三人」之規定，地上權之成立不以登記為生效要件\n    ，僅因當事人意思表示即發生效力。然天○○仍應就林春土\n    於日據時代確與系爭土地所有權人意思表示合致成立地上權\n    一節舉證以實其說，乃天○○迄未就此提出任何證據，僅以\n    上開臺北縣政府地政局函自為有利於己之解釋，謂林春土非\n    所有權即係地上權人，辯稱「該日據時期，有名『林春土』\n    之人，以興建房屋之目的，向土地所有權人林熊祥購得土地\n    之地上權，建造『土塊木造瓦葺平家壹棟建坪拾八坪(並含)\n    四合(院落)』」云云（本院卷(二)第138頁背面），自難採信\n    。\n  (三)天○○另辯稱依日據時代不動產登記法第106條「未登記之\n    建物所有權，其登記得依左列方式申請之：一、登記簿上登\n    記之建物所在土地之所有人或地上權人。二、證明依土地臺\n    帳謄本，自己或被繼承人被登錄為土地臺帳的所在土地之所\n    有人者。依已登記的所在土地的所有人或地上權人的證明書\n    ，證明自己的所有權者。依判決、其他官廳或公署之書面等\n    證明自己的所有權者」之規定，系爭建物所有權既已得日據\n    時代之地政機關核准為房屋所有權之保存登記，則自可推知\n    系爭建物之所有權人，必係取得系爭土地之所有權人或地上\n    權人，故依當時之法令規定，得申請辦理建物保存登記自明\n    。因此，上訴人系爭房屋絕無該當無權占有系爭土地之情事\n    云云（本院卷(二)第137-138頁）。然承上述，天○○之父楊\n    勝旺登記之上開「土塊木造瓦葺平家壹棟建坪拾八坪六合六\n    勺六才」建物，是否確為本件16號建物，尚屬有疑，楊勝旺\n    非系爭土地所有權人，天○○尤未舉證證明楊勝旺已取得地\n    上權，其逕依日據時代不動產登記法之上開規定為上開辯解\n    ，仍無可採。況上開楊勝旺登記之建物為「土塊木造瓦葺平\n    家」，顯然與系爭建物之現狀不符（見原審卷(三)第73-79頁\n    之照片），堪認16號建物非日據時代所興建，即與最高法院\n    93年台上字第818號判決「系爭土地為上訴人於民國四十五\n    年至五十七年間自原地主購得，而建蓋於系爭土地上之系爭\n    建物，為日據時代興建，並經辦畢保存登記，依當時施行於\n    台灣之日本民法及不動產登記法之規定，可推定系爭建物所\n    有權人曾於當時提出土地所有人之許可、同意或承諾之書面\n    證件」之情形有間，天○○自不得比附援引上開判決要旨為\n    其有利證據之認定。天○○再謂所有人對於有權占有其所有\n    物者，即無返還所有物之請求餘地，另依最高法院85年台上\n    字第389號判例：「按消滅時效完成，僅債務人取得拒絕履\n    行之抗辯權，得執以拒絕給付而已，其原有之法律關係並不\n    因而消滅。在土地買賣之情形，倘出賣人已交付土地與買受\n    人，雖買受人之所有權移轉登記請求權之消滅時效已完成，\n    惟其占有土地既係出賣人本於買賣之法律關係所交付，即具\n    有正當權源，原出賣人自不得認係無權占有而請求返還」，\n    本件上訴人既原始已屬合法占有人，縱目前已無地上權或土\n    地所有權登記之請求權，仍非得逕指為無權占有人云云（本\n    院卷(二)第138頁），然天○○未舉證其父楊勝旺或曾祖父楊\n    允北之前手已合法取得地上權，已如前述，其逕援引上開判\n    例謂被上訴人不得認係無權占有而請求返還云云，仍屬無據\n    。以上，天○○就其所有16號建物占用系爭土地如附圖所示\n    A、B部分一節，未能舉證證明係屬有權占有，則被上訴人主\n    張天○○所有之16號建物係無權占用系爭土地如附圖所示A\n    、B部分之事實，應認為實在。\n  (四)子○○○等4人辯稱14號建物係由呂傳文於日據時代辦竣保\n    存登記，嗣經買賣之事由，輾轉移轉登記於林遠吉，顯然呂\n    傳文占用系爭土地，已獲得土地所有權人同意，14號建物既\n    已經地政機關登記在案，即屬合法建物、合法占有系爭土地\n    云云（本院卷(二)第144-145頁）。查林遠吉為子○○○等4人\n    之被繼承人林維賢之父（原審卷(二)第81頁），而子○○○等\n    上開辯解，固提出土地登記簿為證（本院卷(一)第66-69頁）\n    ，惟其仍應就林遠吉登記之建物之前前手呂傳文取得登記之\n    初，已得系爭土地所有權人之同意方興建14號建物一節舉證\n    以實其說，理由均同上述，其以上開登記之事實，遽謂14號\n    建物合法占有系爭土地云云，尚無可採。況子○○○等4人\n    謂「嗣後系爭房屋雖有拆除部分建物而有整建之情事……係\n    依政府政策進行拆除及整建，並非將原有建物整棟拆除……\n    」云云，然林遠吉登記之建物同為「土塊造瓦葺平家」（本\n    院卷(一)第68頁），與14號建物之現況為大相逕庭，有被上訴\n    人提出之照片、子○○○等4人提出之正面照片等在卷足稽\n    （原審卷(三)第73-79頁照片、本院卷(一)第72頁），顯然林遠\n    吉前所登記之「土塊造瓦葺平家」已完全拆除再興建現況之\n    14 號建物，子○○○等4人所稱拆除部分建物而有整建之情\n    事云云，非屬實在。其等提出臺北縣土城鄉○○道路拆除合\n    法建築物剩餘部分就地整建完工證明申請書、台北縣土城鄉\n    公所函（本院卷(一)第70、73頁）僅在發給完工證明、同意接\n    用水電等情，非在出具應由地政相關單位認定之合法建物之\n    登記，否則其等之被繼承人林維賢豈無不在所稱14號建物整\n    建完工之69年間逕向地政機關為保存登記之理，其等再稱「\n    ……系爭房屋所有權尚不能因地政機關行政作業問題未予轉\n    載，即認定已消滅或變為非法建物……系爭房屋占有系爭土\n    地，並非無權占有」云云（本院卷(二)第145頁），與事實不\n    符而無可取。\n  (五)子○○○等4人再辯稱14號建物自日據時代以來數十年，被\n    上訴人均未積極請求返還系爭土地，顯然被上訴人或其被繼\n    承人至少業默示同意系爭房屋占用系爭土地，乃係合法占有\n    使用關係云云（本院卷(二)第145頁），惟子○○○等4人未就\n    被上訴人或其被繼承人默示同意14號建物占用系爭土地一節\n    舉證以實其說，自不得以被上訴人遲至95年間方提起本件訴\n    訟，遽謂有默示同意14號建物使用系爭土地之事實。尤以子\n    ○○○等4人自認：「系爭房屋係合法登記在案之建物，因\n    登記謄本並無地上權之登記，故兩造間就系爭房屋所坐落之\n    系爭土地顯有未定期限之合法使用關係，而使用系爭土地之\n    目的，既為建造房屋以居住為目的，自應以上訴人使用系爭\n    土地之目的完畢，即無法繼續居住系爭房屋或該房屋不堪住\n    用時，返還期限始屆至」等語（本院卷(二)第145、146頁），\n    即退步言，其等自認14號建物占用系爭土地係「使用」（使\n    用借貸）關係，迄該建物不堪住用時，返還期限即屆至，而\n    林遠吉登記之「土塊造瓦葺平家」已於69年間完全拆除再興\n    建現況之14號建物，已如上述，則依子○○○等4人退步言\n    之辯解，其等被繼承人之父之「土塊造瓦葺平家」於69年間\n    已因不堪住用而拆除，返還期限即已屆至，即至遲於69年1\n    月19日起，其等所有之14號建物仍屬無權占用系爭土地，而\n    應拆屋還地。至其等辯稱被上訴人應就上訴人無權占有系爭\n    土地，負舉證責任云云，然「以無權占有為原因，請求返還\n    土地者，占有人對土地所有權存在之事實無爭執，而僅以非\n    無權占有為抗辯者，土地所有權人對其土地被無權占有之事\n    實無舉證責任，占有人自應就其取得占有係有正當權源之事\n    實證明之」（最高法院85年度台上字第1120號判決意旨參照\n    另同院72年度台上字第1552號判決同此旨），子○○○等4\n    人上開辯解即非可取。其等另舉最高法院93年台上字第818\n    號判決為其有利證據之認定云云，然14號建物係於69年間興\n    建，非日據時代所建，與該判決所稱情形不同，理由同上，\n    該判決不能作為有利於子○○○等4人認定之依據。\n  (六)子○○○等4人以其所有建物於日據時代大正12年11月2日即\n    已辦理保存登記一節，進而辯稱「可推定系爭建物所有權人\n    曾於當時提出土地所有人之許可、同意或承諾之書面證件，\n    故本件縱使上訴人現無法提出其先人確實曾購買系爭土地或\n    有地上權、使用借貸等權利證明，惟至少已證明當時之土地\n    所有人確實已同意在系爭土地上建築系爭房屋，上訴人並非\n    無權占有系爭土地」云云，核無可採，理由同上。而被上訴\n    人係基於民法第767條所賦予之物上請求權為本件之起訴，\n    自無違反誠信原則或權利濫用之情形。另板橋地政所98年5\n    月8日北縣板地登字第0980007403號函所載：「……光復初\n    期有關建物所有權登記，並未比照土地強制登記規定，建物\n    所有權登記係採任意登記制，由登記機關經常辦理，本所並\n    未辦理將前開建物由日據登記簿轉載情事」、臺北縣土城市\n    公所98年6月3日北縣土工字第0980019978號函：「旨揭房屋\n    （指14號建物）就地整建，因年代久遠及本所位址遷移檔案\n    保存不易，已查無相關就地整建證明文件……」等語，暨後\n    者所附「台北縣興闢公共設施拆除剩餘建築基地內建築物改\n    建增建辦法」第7條規定，申請於興闢公共設施拆除剩餘建\n    築基地內合法建物之改建、增建應檢附申請書、「土地權利\n    證明文件……等文件」（本院卷(一)第147、180-182頁），均\n    無由證明14號建物係合法使用系爭土地，否則林維賢於69年\n    間即可就14號建物逕向地政機關為登記。至臺北縣政府地政\n    局98年6月3日北地籍字第0980416257號函及內政部98年6月\n    9日內授中辦地字第0980045542號函不能為有利於子○○○\n    等4人認定之證據，理由同前。以上，子○○○等4人就其所\n    有14號建物占用系爭土地如附圖所示C部分一節，未能舉證\n    證明係屬有權占有，則被上訴人主張子○○○等4人所有之\n    14號建物係無權占用系爭土地如附圖所示C部分之事實，應\n    認為實在。按「所有人對於無權占有或侵奪其所有物者，得\n    請求返還之」，民法第767條前段定有明文。被上訴人依該\n    規定，請求天○○將坐落758地號內如附圖所示A部分面積52\n    .96平方公尺及756地號如附圖所示B部分面積0.74平方公尺\n    土地上之建物拆除，將該部分土地交還被上訴人、請求子○\n    ○○等4人將756地號內如附圖所示C部分面積56.95平方公尺\n    土地上之建物拆除，將該部分土地交還被上訴人，於法有據\n    ，應予准許。\n  (七)另按「無法律上之原因而受利益，致他人受損害者，應返還\n    其利益。雖有法律上之原因，而其後已不存在者，亦同」，\n    民法第179條定有明文。又依不當得利之法則請求返還不當\n    得利，以無法律上之原因而受利益，致他人受有損害為其要\n    件，故其得請求返還之範圍，應以對方所受之利益為度，非\n    以請求人所受損害若干為準，無權占有他人土地，可能獲得\n    相當於租金之利益為社會通常之觀念，是被上訴人抗辯其占\n    有系爭土地所得之利益，僅相當於法定最高限額租金之數額\n    ，尚屬可採（最高法院61年台上字第1695號判例參照）。天\n    ○○無權占有系爭土地之面積為53.7平方公尺（52.96+0.74\n    ＝53.7）、子○○○等4人無權占有系爭土地面積為56.95平\n    方公尺，依社會通常之觀念，可獲得免於支付租金之利益，\n    致被上訴人受有損害，被上訴人依上開規定，請求上訴人給\n    付相當於租金之不當得利，自屬有據。至被上訴人得請求之\n    不當得利應為若干？按城市地方房屋之租金，以不超過土地\n    及其建築物申報總價年息10％為限，土地法第97條第1項定\n    有明文，而依土地法施行法第25條規定，土地法第97條規定\n    之土地價額係指「法定地價」而言，又依土地法第148條規\n    定，土地所有權人依土地法所「申報之地價」為法定地價，\n    另依土地法第105條規定，同法第97條之規定，於租用基地\n    建築房屋準用之，是城市地方建築基地之租金亦應以土地申\n    報地價年息10％為限。本院審酌系爭土地位於土城市舊市區\n    、商店林立、生活機能尚稱便利等情，有被上訴人提出之現\n    場照片6張附卷可參（原審卷(三)第73頁以下），應以上訴人\n    無權占有使用之土地總地價年息7％計算年租金為適當。又\n    「租金之請求權因五年間不行使而消滅，既為民法第一百二\n    十六條所明定，則凡無法律上之原因，而獲得相當於租金之\n    利益，致他人受損害時，如該他人之返還利益請求權，已逾\n    租金短期消滅時效之期間，對於相當於已罹於消滅時效之租\n    金之利益，即不得依不當得利之法則，請求返還。其請求權\n    之時效期間，仍應依前開規定為五年，此為本院所持之見解\n    」，有最高法院96年度台上字第2660號判決意旨可參。被上\n    訴人於95年12月4日、96年3月20日依序對天○○、子○○○\n    等4人之被繼承人林維賢提起本件訴訟（原審卷(一)第3、192\n    頁），請求拆屋還地並給付相當於租金之不當得利，則被上\n    訴人請求天○○、子○○○等4人依序給付自95年12月31日\n    、96年3月27日回溯5年之相當於租金之不當得利、並依序自\n    96年1月1日、96年4月1日起至返還系爭土地之日止，按月給\n    付相當於租金之不當得利，即屬有據。系爭土地93年1月申\n    報地價為每平方公尺12,160元（原審卷(一)第10-11頁），另\n    系爭土地自89年7月至96年1月之公告地價均為15,200元（本\n    院卷(一)第255-256頁），依平均地權條例第16條「舉辦規定\n    地價或重新規定地價時，土地所有權人未於公告期間申報地\n    價者，以公告地價百分之八十為其申報地價」之規定，系爭\n    土地自89年7月至96年1月之申報地價均為12,160元（15,200\n    ×0.8＝12,160）。天○○、子○○○等4人所有16、14號建\n    物占用系爭土地面積如附圖說明欄所載，其等應給付5年之\n    不當得利、按月應給付之不當得利如附表所示。計天○○應\n    給付5年之不當得利為228,547元、按月應給付之不當得利為\n    3,809元、子○○○等4人應給付5年之不當得利為242,379元\n    、按月應給付之不當得利為4,040元，被上訴人請求天○○\n    、子○○○等4人各給付上開不當得利，於法有據，應予准\n    許。\n  (八)又按「給付無確定期限者，債務人於債權人得請求給付時，\n    經其催告而未為給付，自受催告時起，負遲延責任。其經債\n    權人起訴而送達訴狀，或依督促程序送達支付命令，或為其\n    他相類之行為者，與催告有同一之效力」，民法第229條第2\n    項定有明文。被上訴人請求天○○、子○○○等4人給付5年\n    不當得利部分，請求法定遲延利息，固屬有據。查被上訴人\n    於96年3月20日追加林維賢為被告，繕本於96年3月26日送達\n    （原審卷(一)第192、202頁），則被上訴人請求子○○○等4\n    人就5年之不當得利242,379元，自96年3月27日加計法定遲\n    延利息，於法有據。至天○○部分，原審第一次送達地址載\n    臺北縣土城市○○街16號（原審卷(一)第38頁），非天○○之\n    戶籍地，其寄存送達非屬合法，經被上訴人陳報天○○之戶\n    籍地為臺北縣土城市○○街16號後，原審再次以正確地址送\n    達，於96年1月4日寄存送達於臺北縣警察局土城分局土城派\n    出所，有天○○之戶籍謄本、送達證書可參（原審卷(一)第41\n    -42頁），按「寄存送達，自寄存之日起，經十日發生效力\n    」，民事訴訟法第138條第2項定有明文，再依民法第121條\n    第1項規定：「以日、星期、月或年定期間者，以期間末日\n    之終止，為期間之終止」，是寄存送達發生效力所應經之10\n    日期間，係以其期間末日之終止，為10日期間之終止，則就\n    天○○部分至96年1月14日發生送達效力，其給付5年不當得\n    利228,547元部分應自翌日即96年1月15日起算法定遲延利息\n    ，被上訴人請求天○○給付法定遲延利息超過上開部分，於\n    法無據。\n四綜上所述，被上訴人依民法第767條、第179條及繼承（被上訴\n  人就子○○○等4人部分，雖未述及該法律關係，然陳述子○\n  ○○等4人為林維賢之繼承人承受訴訟時，即已陳述其原因事\n  實）之規定，請求(一)天○○將758地號內如附圖所示A部分面積\n  52.96平方公尺及756地號如附圖所示B部分面積0.74平方公尺\n  土地上之建物拆除，將該部分土地交還被上訴人、(二)天○○給\n  付被上訴人228,547元，及自96年1月15日起至清償日止按週年\n  利率5％計算之利息；及自96年1月1日起至返還上開土地之日\n  止，按月給付被上訴人3,809元、(三)子○○○等4人將756地號\n  內如附圖所示C部分面積56.95平方公尺土地上之建物拆除，將\n  該部分土地交還被上訴人、(四)子○○○等4人給付被上訴人242\n  ,379元，及自96年3月27日起至清償日止按週年利率5％計算之\n  利息；及自96年4月1日起至返還上開土地之日止，按月給付被\n  上訴人為4,040元，於法有據，應予准許，被上訴人逾此範圍\n  之請求，於法無據，應予駁回。上開不應准許部分（即被上訴\n  人請求天○○給付228,547元自95年12月31日起至96年1月14日\n  止，以週年利率5％計算之利息部分），原審為上訴人敗訴之\n  判決，尚有未洽，上訴意旨指摘此部分原判決不當，求予廢棄\n  改判，為有理由，應由本院予以廢棄，改判如主文第二項所示\n  。上開應准許部分，原審為上訴人敗訴之判決，並依被上訴人\n  之聲請及依職權，酌定相當擔保金，分別為假執行、免為假執\n  行之諭知，核無不合。上訴意旨指摘原判決此部分不當，求予\n  廢棄改判，為無理由，應予駁回。\n五本件因事證已臻明確，兩造其餘攻擊、防禦方法及所為之立證\n  ，經審酌後認與判決之結果不生若何影響，無庸再逐一予以論\n  列，合併敘明。\n據上論結，本件上訴人天○○之上訴為一部有理由，一部無理由\n，上訴人子○○○等4人之上訴為無理由，依民事訴訟法第450條\n、第449條第1項、第79條、第85條第2項、第463條、第385條第1\n項前段判決如主文。"
  },
  "characters": {
    "judges": [
      "林金村",
      "王麗莉",
      "湯美玉"
    ],
    "prosecutors": [

    ],
    "lawyers": [
      "楊雅惠",
      "張倪羚",
      "吳仲立",
      "許朝昇",
      "師或具有",
      "人或其他法定代理人具有"
    ],
    "clerks": [
      "蕭進忠"
    ],
    "plaintiffs": [

    ],
    "defendants": [

    ],
    "prosecutor_office": [

    ],
    "creditors": [

    ],
    "debtors": [

    ],
    "judicial_associate_officer": [

    ]
  },
  "adjudged_at": "2010-01-05",
  "created_at": "2016-01-05 15:04:56",
  "updated_at": "2016-01-05 15:04:56"
}