{
  "identify": "TPH-98-上易-1231-20100512-1",
  "court": {
    "name": "臺灣高等法院",
    "code": "TPH"
  },
  "division": {
    "name": "民事",
    "code": "V"
  },
  "year": 98,
  "word": "上易",
  "number": "1231",
  "jcheck": "1",
  "reason": "所有權移轉登記",
  "content": "臺灣高等法院民事判決                98年度上易字第1231號\n上  訴  人  林秋福\n訴訟代理人  丙○○\n            陳文億律師\n被 上訴 人  甲○○\n訴訟代理人  丁○○\n            乙○○\n上列當事人間所有權移轉登記事件，上訴人對於中華民國98年11\n月12日臺灣士林地方法院98年度訴字第1122號第一審判決提起上\n訴，本院於99年4月28日言詞辯論終結，判決如下：\n    主  文\n上訴駁回。\n第二審訴訟費用由上訴人負擔。\n    事實及理由\n壹、程序方面：\n    按「在第二審為訴之變更或追加，非經他造同意，不得為之\n    。但第255條第1項第2款至第6款情形，不在此限。」、「訴\n    狀送達後，原告不得將原訴變更或追加他訴。但有下列各款\n    情形之一者，不在此限：……二、請求之基礎事實同一者。\n    」民事訴訟法第446條第1項、第255條第1項第2款分別定有\n    明文。所謂請求之基礎事實同一，係指變更或追加之訴與原\n    訴之主要爭點有其共同性，各請求利益之主張在社會生活上\n    可認為同一或關連，而就原請求之訴訟及證據資料，於審理\n    繼續進行在相當程度範圍內具有同一性或一體性，得期待於\n    後請求之審理予以利用，俾先後兩請求在同一程序得加以解\n    決，避免重複審理，進而為統一解決紛爭者而言。查上訴人\n    於原法院原係依其與被上訴人配偶林秋貴於民國73年2月24\n    日簽訂之協議書（下稱系爭協議書）請求被上訴人應將坐落\n    苗栗縣造橋鄉○○○段306-3地號、面積992平方公尺土地（\n    下稱系爭土地）所有權應有部分1/2移轉登記予上訴人，嗣\n    於本院變更訴訟標的為終止借名登記契約，類推適用委任關\n    係，請求如上開聲明所示（本院卷第33頁）。被上訴人雖不\n    同意上訴人為該訴訟標的之變更（本院卷第47頁背面），惟\n    該變更與原訴之主要爭點均在於評價被上訴人應否移轉系爭\n    土地應有部分1/2予上訴人，二者具有共同性，且上訴人原\n    提出之訴訟及證據資料，於變更後請求之審理仍得相互援用\n    ，核屬請求基礎事實同一，依上開規定，應予准許。\n貳、實體方面：\n一、上訴人主張：系爭土地係上訴人與林秋貴以新台幣（下同）\n    100,000元向訴外人黃金土贖回耕作權，經政府放領後，因\n    上訴人與林秋貴均非自耕農，礙於當時土地法第30條第1項\n    非自耕農不得登記為農地所有權人之規定，遂將系爭土地借\n    名登記於有自耕農身分之上訴人與林秋貴之父林德旺名下，\n    嗣於71年6月25日復將系爭土地借名登記予具有自耕農身分\n    之被上訴人，並約定俟上開法令限制取消或變更後，被上訴\n    人應將系爭土地應有部分1/2返還登記予上訴人，且於73年2\n    月24日由上訴人與林秋貴簽訂系爭協議書。又土地法第30條\n    限制自耕農登記之規定，已於89年1月26日公布刪除，爰終\n    止借名登記契約，類推適用委任關係，請求被上訴人應將系\n    爭土地所有權應有部分1/2移轉登記予上訴人等語。\n二、被上訴人則以：被上訴人自幼即為林德旺之童養媳，長大後\n    與林秋貴結婚，林德旺為求公平，乃於生前將系爭土地贈與\n    被上訴人作為嫁妝，系爭土地係被上訴人所有。被上訴人並\n    未簽立系爭協議書，亦不知此事。另林秋貴不識字，系爭協\n    議書之內容皆係有利於上訴人，上訴人未告知其內容即強迫\n    林秋貴簽立，亦未依約交付275,000元，且隱瞞18年，迄91\n    年間，始郵寄系爭協議書影本予林秋貴，系爭協議書對被上\n    訴人不生效力，上訴人上開請求無理由等語，資為抗辯。\n三、本件經原法院判決駁回上訴人之訴。上訴人不服原判決，上\n    訴聲明：（一）原判決廢棄；（二）被上訴人應將系爭土地\n    所有權應有部分1/2移轉登記予上訴人。被上訴人答辯聲明\n    ：上訴駁回。\n四、經查：上訴人與林秋貴係兄弟關係，林德旺於72年1月18日\n    死亡，林德旺於68年7月1日因繳清地價（放領公地）登記為\n    系爭土地所有權人，系爭土地於71年8月9日以贈與為原因（\n    原因發生日為71年6月25日），移轉登記為被上訴人名義。\n    系爭協議書之立書人為上訴人與林秋貴，其上立協議書人林\n    秋貴之簽名、印章係真正等情，為兩造所不爭執，且有土地\n    所有權狀、土地登記簿謄本、土地登記聲請書、贈與所有權\n    移轉契約書、免繳土地增值稅證明書、印鑑證明、贈與稅免\n    稅證明書、農地承受人自耕能力證明書、戶籍謄本、林德旺\n    除戶謄本及系爭協議書可按（原審98年度湖家調字第11號卷\n    第9至13頁、第23至46頁），並據證人林秋貴於原審證稱：\n    系爭協議書上其簽名、印章均係真正等語（原審卷第22頁背\n    面），堪信此部分之事實為真正。\n五、本件爭點：\n（一）系爭土地是否係上訴人與林秋貴借名登記於被上訴人名下\n      ？\n（二）如認系爭土地係上訴人與林秋貴借名登記於被上訴人名下\n      ，則上訴人終止借名登記契約，類推適用委任關係，請求\n      如上開聲明所示，是否有理由？\n      爰述之如下：\n（一）系爭土地是否係上訴人與林秋貴借名登記於被上訴人名下\n      ？\n  １、按當事人主張有利於己之事實者，就其事實有舉證之責任\n      ，民事訴訟法第277條前段定有明文，又主張法律關係存\n      在之當事人，應就該法律關係發生所須具備之特別要件，\n      負舉證之責任，至於他造主張有利於己之事實（變更或消\n      滅之特別要件），則應由他造舉證證明（最高法院48年台\n      上字第887號判例意旨參照）。次按「夫妻於日常家務，\n      互為代理人。夫妻之一方濫用前項代理權時，他方得限制\n      之。但不得對抗善意第三人。」民法第1003條定有明文，\n      可知，夫妻得互為代理人，僅限於日常家務。另74年6月5\n      日修正前民法第1017條規定：聯合財產中，妻於結婚時所\n      有之財產，及婚姻關係存續中因繼承或其他無償取得之財\n      產，為妻之原有財產，保有其所有權。聯合財產中夫之原\n      有財產及不屬於妻之原有財產之部分，為夫所有。由妻之\n      原有財產所生之孳息，其所有權歸屬於夫。\n  ２、經查：\n    (1)上訴人主張：系爭土地係伊與林秋貴以100,000元向黃金\n      土贖回耕作權，經政府放領後，因伊與林秋貴均非自耕農\n      ，礙於當時土地法第30條第1項非自耕農不得登記為農地\n      所有權人之限制，遂將系爭土地借名登記於林德旺名下等\n      語，為被上訴人所否認，並辯以：系爭土地原係林德旺所\n      有等語。經查上訴人於原審係主張系爭土地係伊與林秋貴\n      繼承其父林德旺之共有土地，有上訴人之民事起訴狀可憑\n      （原審98年度湖家調字第11號卷第6頁），茲復主張系爭\n      土地係上訴人與林秋貴借名登記於林德旺名下，前後陳述\n      不一，已有疑義；另證人林秋貴業於原審證稱：「（問：\n      系爭土地為何登記你父親名字？）本來是我父親在耕作，\n      所以土地是父親所有。」等語（原審卷第23頁），而上訴\n      人復無其他證據證明系爭土地係上訴人與林秋貴借名登記\n      於林德旺名下，是上訴人此部分之主張，自難遽採。\n    (2)上訴人復主張：伊與林秋貴於71年6月25日將系爭土地借\n      名登記予被上訴人，系爭土地所有權1/2係林秋貴所有，\n      林秋貴與伊簽訂系爭協議書，依夫妻得互為代理人規定，\n      系爭協議書之效力及於被上訴人等語。被上訴人則辯以：\n      伊係童養媳，嗣與林秋貴結婚，林德旺為求公平，乃於生\n      前將系爭土地贈與伊作為嫁妝，伊未簽署系爭協議書，亦\n      不知林秋貴簽署系爭協議書，該協議書對伊不生效力等語\n      。經查：\n    如上所述，林德旺係於68年7月1日因繳清地價（放領公地\n      ）而登記取得系爭土地所有權，係系爭土地之所有權人，\n      林德旺於71年8月9日以贈與為原因（原因發生日期為71年\n      6月25日）將系爭土地所有權移轉登記予被上訴人，嗣於\n      72年1月18日死亡，可知，系爭土地係林德旺於其生前即\n      將之贈與被上訴人，而非上訴人與林秋貴繼承林德旺遺產\n      所取得之財產。\n    系爭協議書之立書人為上訴人與林秋貴，被上訴人並非係\n      系爭協議書之當事人，有系爭協議書可按。又依71年8月9\n      日被上訴人取得系爭土地所有權時，如前開１所述民法第\n      1017條之規定，夫妻法定財產制係採聯合財產制，聯合財\n      產中，妻於結婚時所有之財產，及婚姻關係存續中因繼承\n      或其他無償取得之財產，為妻之原有財產，保有其所有權\n      。而聯合財產制中夫之原有財產及不屬於妻之原有財產之\n      部分，始為夫所有。系爭土地係被上訴人受贈取得，屬被\n      上訴人無償取得之財產，揆諸前揭規定，應屬被上訴人之\n      原有財產，而非林秋貴所有。另系爭協議書第2條約定系\n      爭土地為上訴人與林秋貴平均共同共有，因農業區基於法\n      令規定，無法登記為共有，暫以林秋貴之妻即被上訴人名\n      義登記，林秋貴不得私自處分或設定負擔其所有權，否則\n      願負損害賠償及有關法律責任等語，並非屬民法第1003條\n      規定日常家務夫妻得互為代理人之範疇；況系爭協議書係\n      以林秋貴名義簽訂，而非林秋貴以代理被上訴人之名義為\n      之，亦無所謂代理之問題。被上訴人既非系爭協議書之當\n      事人，且上訴人又未能舉證系爭協議書之效力及於被上訴\n      人，是上訴人此部分之主張，仍屬無據。\n    至上訴人於本院聲請訊問證人林阿財，以證明林秋貴簽立\n      系爭協議書並無受脅迫之情，惟林秋貴簽訂系爭協議書之\n      效力並不及於被上訴人，已如上述，本院自無訊問證人林\n      阿財之必要，併此敘明。\n  ３、從而，上訴人主張系爭土地係上訴人與林秋貴借名登記於\n      被上訴人名下等語，自不可採。\n（二）如認系爭土地係上訴人與林秋貴借名登記於被上訴人名下\n      ，則上訴人終止借名登記契約，類推適用委任關係，請求\n      如上開聲明所示，是否有理由？\n  １、按「解除權之行使，應向他方當事人以意思表示為之。契\n      約當事人之一方有數人者，前項意思表示，應由其全體或\n      向其全體為之。」、「第258條及第260條之規定，於當事\n      人依法律之規定終止契約者準用之。」民法第258條第1、\n      2項、第263條分別定有明文。\n  ２、經查：系爭土地尚難認係上訴人與林秋貴借名登記於被上\n      訴人名下，業如上述。退步言，縱認上訴人主張系爭土地\n      係上訴人與林秋貴借名登記於被上訴人名下屬實，則上訴\n      人所主張之該借名登記契約係存在上訴人、林秋貴與被上\n      訴人間，此時，上訴人、林秋貴係將系爭土地借名予被上\n      訴人之借名登記契約之一方，依前開民法第258條第1、2\n      項、第263條之規定，如要終止該借名登記契約，應由上\n      訴人、林秋貴向被上訴人為終止該借名契約之意思表示，\n      茲上訴人僅以其名義向被上訴人為終止該借名契約之意思\n      表示，自與前開規定不符，是上訴人所為上開終止之意思\n      表示，亦不合法，上訴人本於終止借名登記契約，並類推\n      適用委任關係，請求如上開聲明所示，仍無理由。\n六、綜上所述，上訴人依終止借名登記契約，並類推適用委任關\n    係，請求被上訴人應將系爭土地所有權應有部分1/2移轉登\n    記予上訴人，為無理由，不應准許。原審為上訴人敗訴之判\n    決，並無不合。上訴意旨指摘原判決不當，聲明廢棄改判，\n    為無理由，應予駁回。\n七、本件事證已臻明確，兩造其餘之攻擊、防禦方法，核與判決\n    結果不生影響，爰毋庸一一論述，併此敘明。\n八、據上論結，本件上訴為無理由，依民事訴訟法第449條第1項\n    、第78條，判決如主文。\n中    華    民    國    99    年    5     月    12    日\n                  民事第十二庭\n                      審判長法  官  陳駿璧\n                            法  官  李媛媛\n                            法  官  陳邦豪\n正本係照原本作成。\n不得上訴。\n中    華    民    國    99    年    5     月    12    日\n                            書記官  李佳樺",
  "structure": {
    "main": "上訴駁回。\n第二審訴訟費用由上訴人負擔。",
    "fact": "壹、程序方面：\n    按「在第二審為訴之變更或追加，非經他造同意，不得為之\n    。但第255條第1項第2款至第6款情形，不在此限。」、「訴\n    狀送達後，原告不得將原訴變更或追加他訴。但有下列各款\n    情形之一者，不在此限：……二、請求之基礎事實同一者。\n    」民事訴訟法第446條第1項、第255條第1項第2款分別定有\n    明文。所謂請求之基礎事實同一，係指變更或追加之訴與原\n    訴之主要爭點有其共同性，各請求利益之主張在社會生活上\n    可認為同一或關連，而就原請求之訴訟及證據資料，於審理\n    繼續進行在相當程度範圍內具有同一性或一體性，得期待於\n    後請求之審理予以利用，俾先後兩請求在同一程序得加以解\n    決，避免重複審理，進而為統一解決紛爭者而言。查上訴人\n    於原法院原係依其與被上訴人配偶林秋貴於民國73年2月24\n    日簽訂之協議書（下稱系爭協議書）請求被上訴人應將坐落\n    苗栗縣造橋鄉○○○段306-3地號、面積992平方公尺土地（\n    下稱系爭土地）所有權應有部分1/2移轉登記予上訴人，嗣\n    於本院變更訴訟標的為終止借名登記契約，類推適用委任關\n    係，請求如上開聲明所示（本院卷第33頁）。被上訴人雖不\n    同意上訴人為該訴訟標的之變更（本院卷第47頁背面），惟\n    該變更與原訴之主要爭點均在於評價被上訴人應否移轉系爭\n    土地應有部分1/2予上訴人，二者具有共同性，且上訴人原\n    提出之訴訟及證據資料，於變更後請求之審理仍得相互援用\n    ，核屬請求基礎事實同一，依上開規定，應予准許。\n貳、實體方面：\n一、上訴人主張：系爭土地係上訴人與林秋貴以新台幣（下同）\n    100,000元向訴外人黃金土贖回耕作權，經政府放領後，因\n    上訴人與林秋貴均非自耕農，礙於當時土地法第30條第1項\n    非自耕農不得登記為農地所有權人之規定，遂將系爭土地借\n    名登記於有自耕農身分之上訴人與林秋貴之父林德旺名下，\n    嗣於71年6月25日復將系爭土地借名登記予具有自耕農身分\n    之被上訴人，並約定俟上開法令限制取消或變更後，被上訴\n    人應將系爭土地應有部分1/2返還登記予上訴人，且於73年2\n    月24日由上訴人與林秋貴簽訂系爭協議書。又土地法第30條\n    限制自耕農登記之規定，已於89年1月26日公布刪除，爰終\n    止借名登記契約，類推適用委任關係，請求被上訴人應將系\n    爭土地所有權應有部分1/2移轉登記予上訴人等語。\n二、被上訴人則以：被上訴人自幼即為林德旺之童養媳，長大後\n    與林秋貴結婚，林德旺為求公平，乃於生前將系爭土地贈與\n    被上訴人作為嫁妝，系爭土地係被上訴人所有。被上訴人並\n    未簽立系爭協議書，亦不知此事。另林秋貴不識字，系爭協\n    議書之內容皆係有利於上訴人，上訴人未告知其內容即強迫\n    林秋貴簽立，亦未依約交付275,000元，且隱瞞18年，迄91\n    年間，始郵寄系爭協議書影本予林秋貴，系爭協議書對被上\n    訴人不生效力，上訴人上開請求無理由等語，資為抗辯。\n三、本件經原法院判決駁回上訴人之訴。上訴人不服原判決，上\n    訴聲明：（一）原判決廢棄；（二）被上訴人應將系爭土地\n    所有權應有部分1/2移轉登記予上訴人。被上訴人答辯聲明\n    ：上訴駁回。\n四、經查：上訴人與林秋貴係兄弟關係，林德旺於72年1月18日\n    死亡，林德旺於68年7月1日因繳清地價（放領公地）登記為\n    系爭土地所有權人，系爭土地於71年8月9日以贈與為原因（\n    原因發生日為71年6月25日），移轉登記為被上訴人名義。\n    系爭協議書之立書人為上訴人與林秋貴，其上立協議書人林\n    秋貴之簽名、印章係真正等情，為兩造所不爭執，且有土地\n    所有權狀、土地登記簿謄本、土地登記聲請書、贈與所有權\n    移轉契約書、免繳土地增值稅證明書、印鑑證明、贈與稅免\n    稅證明書、農地承受人自耕能力證明書、戶籍謄本、林德旺\n    除戶謄本及系爭協議書可按（原審98年度湖家調字第11號卷\n    第9至13頁、第23至46頁），並據證人林秋貴於原審證稱：\n    系爭協議書上其簽名、印章均係真正等語（原審卷第22頁背\n    面），堪信此部分之事實為真正。\n五、本件爭點：\n（一）系爭土地是否係上訴人與林秋貴借名登記於被上訴人名下\n      ？\n（二）如認系爭土地係上訴人與林秋貴借名登記於被上訴人名下\n      ，則上訴人終止借名登記契約，類推適用委任關係，請求\n      如上開聲明所示，是否有理由？\n      爰述之如下：\n（一）系爭土地是否係上訴人與林秋貴借名登記於被上訴人名下\n      ？\n  １、按當事人主張有利於己之事實者，就其事實有舉證之責任\n      ，民事訴訟法第277條前段定有明文，又主張法律關係存\n      在之當事人，應就該法律關係發生所須具備之特別要件，\n      負舉證之責任，至於他造主張有利於己之事實（變更或消\n      滅之特別要件），則應由他造舉證證明（最高法院48年台\n      上字第887號判例意旨參照）。次按「夫妻於日常家務，\n      互為代理人。夫妻之一方濫用前項代理權時，他方得限制\n      之。但不得對抗善意第三人。」民法第1003條定有明文，\n      可知，夫妻得互為代理人，僅限於日常家務。另74年6月5\n      日修正前民法第1017條規定：聯合財產中，妻於結婚時所\n      有之財產，及婚姻關係存續中因繼承或其他無償取得之財\n      產，為妻之原有財產，保有其所有權。聯合財產中夫之原\n      有財產及不屬於妻之原有財產之部分，為夫所有。由妻之\n      原有財產所生之孳息，其所有權歸屬於夫。\n  ２、經查：\n    (1)上訴人主張：系爭土地係伊與林秋貴以100,000元向黃金\n      土贖回耕作權，經政府放領後，因伊與林秋貴均非自耕農\n      ，礙於當時土地法第30條第1項非自耕農不得登記為農地\n      所有權人之限制，遂將系爭土地借名登記於林德旺名下等\n      語，為被上訴人所否認，並辯以：系爭土地原係林德旺所\n      有等語。經查上訴人於原審係主張系爭土地係伊與林秋貴\n      繼承其父林德旺之共有土地，有上訴人之民事起訴狀可憑\n      （原審98年度湖家調字第11號卷第6頁），茲復主張系爭\n      土地係上訴人與林秋貴借名登記於林德旺名下，前後陳述\n      不一，已有疑義；另證人林秋貴業於原審證稱：「（問：\n      系爭土地為何登記你父親名字？）本來是我父親在耕作，\n      所以土地是父親所有。」等語（原審卷第23頁），而上訴\n      人復無其他證據證明系爭土地係上訴人與林秋貴借名登記\n      於林德旺名下，是上訴人此部分之主張，自難遽採。\n    (2)上訴人復主張：伊與林秋貴於71年6月25日將系爭土地借\n      名登記予被上訴人，系爭土地所有權1/2係林秋貴所有，\n      林秋貴與伊簽訂系爭協議書，依夫妻得互為代理人規定，\n      系爭協議書之效力及於被上訴人等語。被上訴人則辯以：\n      伊係童養媳，嗣與林秋貴結婚，林德旺為求公平，乃於生\n      前將系爭土地贈與伊作為嫁妝，伊未簽署系爭協議書，亦\n      不知林秋貴簽署系爭協議書，該協議書對伊不生效力等語\n      。經查：\n    如上所述，林德旺係於68年7月1日因繳清地價（放領公地\n      ）而登記取得系爭土地所有權，係系爭土地之所有權人，\n      林德旺於71年8月9日以贈與為原因（原因發生日期為71年\n      6月25日）將系爭土地所有權移轉登記予被上訴人，嗣於\n      72年1月18日死亡，可知，系爭土地係林德旺於其生前即\n      將之贈與被上訴人，而非上訴人與林秋貴繼承林德旺遺產\n      所取得之財產。\n    系爭協議書之立書人為上訴人與林秋貴，被上訴人並非係\n      系爭協議書之當事人，有系爭協議書可按。又依71年8月9\n      日被上訴人取得系爭土地所有權時，如前開１所述民法第\n      1017條之規定，夫妻法定財產制係採聯合財產制，聯合財\n      產中，妻於結婚時所有之財產，及婚姻關係存續中因繼承\n      或其他無償取得之財產，為妻之原有財產，保有其所有權\n      。而聯合財產制中夫之原有財產及不屬於妻之原有財產之\n      部分，始為夫所有。系爭土地係被上訴人受贈取得，屬被\n      上訴人無償取得之財產，揆諸前揭規定，應屬被上訴人之\n      原有財產，而非林秋貴所有。另系爭協議書第2條約定系\n      爭土地為上訴人與林秋貴平均共同共有，因農業區基於法\n      令規定，無法登記為共有，暫以林秋貴之妻即被上訴人名\n      義登記，林秋貴不得私自處分或設定負擔其所有權，否則\n      願負損害賠償及有關法律責任等語，並非屬民法第1003條\n      規定日常家務夫妻得互為代理人之範疇；況系爭協議書係\n      以林秋貴名義簽訂，而非林秋貴以代理被上訴人之名義為\n      之，亦無所謂代理之問題。被上訴人既非系爭協議書之當\n      事人，且上訴人又未能舉證系爭協議書之效力及於被上訴\n      人，是上訴人此部分之主張，仍屬無據。\n    至上訴人於本院聲請訊問證人林阿財，以證明林秋貴簽立\n      系爭協議書並無受脅迫之情，惟林秋貴簽訂系爭協議書之\n      效力並不及於被上訴人，已如上述，本院自無訊問證人林\n      阿財之必要，併此敘明。\n  ３、從而，上訴人主張系爭土地係上訴人與林秋貴借名登記於\n      被上訴人名下等語，自不可採。\n（二）如認系爭土地係上訴人與林秋貴借名登記於被上訴人名下\n      ，則上訴人終止借名登記契約，類推適用委任關係，請求\n      如上開聲明所示，是否有理由？\n  １、按「解除權之行使，應向他方當事人以意思表示為之。契\n      約當事人之一方有數人者，前項意思表示，應由其全體或\n      向其全體為之。」、「第258條及第260條之規定，於當事\n      人依法律之規定終止契約者準用之。」民法第258條第1、\n      2項、第263條分別定有明文。\n  ２、經查：系爭土地尚難認係上訴人與林秋貴借名登記於被上\n      訴人名下，業如上述。退步言，縱認上訴人主張系爭土地\n      係上訴人與林秋貴借名登記於被上訴人名下屬實，則上訴\n      人所主張之該借名登記契約係存在上訴人、林秋貴與被上\n      訴人間，此時，上訴人、林秋貴係將系爭土地借名予被上\n      訴人之借名登記契約之一方，依前開民法第258條第1、2\n      項、第263條之規定，如要終止該借名登記契約，應由上\n      訴人、林秋貴向被上訴人為終止該借名契約之意思表示，\n      茲上訴人僅以其名義向被上訴人為終止該借名契約之意思\n      表示，自與前開規定不符，是上訴人所為上開終止之意思\n      表示，亦不合法，上訴人本於終止借名登記契約，並類推\n      適用委任關係，請求如上開聲明所示，仍無理由。\n六、綜上所述，上訴人依終止借名登記契約，並類推適用委任關\n    係，請求被上訴人應將系爭土地所有權應有部分1/2移轉登\n    記予上訴人，為無理由，不應准許。原審為上訴人敗訴之判\n    決，並無不合。上訴意旨指摘原判決不當，聲明廢棄改判，\n    為無理由，應予駁回。\n七、本件事證已臻明確，兩造其餘之攻擊、防禦方法，核與判決\n    結果不生影響，爰毋庸一一論述，併此敘明。\n八、據上論結，本件上訴為無理由，依民事訴訟法第449條第1項\n    、第78條，判決如主文。",
    "reason": "壹、程序方面：\n    按「在第二審為訴之變更或追加，非經他造同意，不得為之\n    。但第255條第1項第2款至第6款情形，不在此限。」、「訴\n    狀送達後，原告不得將原訴變更或追加他訴。但有下列各款\n    情形之一者，不在此限：……二、請求之基礎事實同一者。\n    」民事訴訟法第446條第1項、第255條第1項第2款分別定有\n    明文。所謂請求之基礎事實同一，係指變更或追加之訴與原\n    訴之主要爭點有其共同性，各請求利益之主張在社會生活上\n    可認為同一或關連，而就原請求之訴訟及證據資料，於審理\n    繼續進行在相當程度範圍內具有同一性或一體性，得期待於\n    後請求之審理予以利用，俾先後兩請求在同一程序得加以解\n    決，避免重複審理，進而為統一解決紛爭者而言。查上訴人\n    於原法院原係依其與被上訴人配偶林秋貴於民國73年2月24\n    日簽訂之協議書（下稱系爭協議書）請求被上訴人應將坐落\n    苗栗縣造橋鄉○○○段306-3地號、面積992平方公尺土地（\n    下稱系爭土地）所有權應有部分1/2移轉登記予上訴人，嗣\n    於本院變更訴訟標的為終止借名登記契約，類推適用委任關\n    係，請求如上開聲明所示（本院卷第33頁）。被上訴人雖不\n    同意上訴人為該訴訟標的之變更（本院卷第47頁背面），惟\n    該變更與原訴之主要爭點均在於評價被上訴人應否移轉系爭\n    土地應有部分1/2予上訴人，二者具有共同性，且上訴人原\n    提出之訴訟及證據資料，於變更後請求之審理仍得相互援用\n    ，核屬請求基礎事實同一，依上開規定，應予准許。\n貳、實體方面：\n一、上訴人主張：系爭土地係上訴人與林秋貴以新台幣（下同）\n    100,000元向訴外人黃金土贖回耕作權，經政府放領後，因\n    上訴人與林秋貴均非自耕農，礙於當時土地法第30條第1項\n    非自耕農不得登記為農地所有權人之規定，遂將系爭土地借\n    名登記於有自耕農身分之上訴人與林秋貴之父林德旺名下，\n    嗣於71年6月25日復將系爭土地借名登記予具有自耕農身分\n    之被上訴人，並約定俟上開法令限制取消或變更後，被上訴\n    人應將系爭土地應有部分1/2返還登記予上訴人，且於73年2\n    月24日由上訴人與林秋貴簽訂系爭協議書。又土地法第30條\n    限制自耕農登記之規定，已於89年1月26日公布刪除，爰終\n    止借名登記契約，類推適用委任關係，請求被上訴人應將系\n    爭土地所有權應有部分1/2移轉登記予上訴人等語。\n二、被上訴人則以：被上訴人自幼即為林德旺之童養媳，長大後\n    與林秋貴結婚，林德旺為求公平，乃於生前將系爭土地贈與\n    被上訴人作為嫁妝，系爭土地係被上訴人所有。被上訴人並\n    未簽立系爭協議書，亦不知此事。另林秋貴不識字，系爭協\n    議書之內容皆係有利於上訴人，上訴人未告知其內容即強迫\n    林秋貴簽立，亦未依約交付275,000元，且隱瞞18年，迄91\n    年間，始郵寄系爭協議書影本予林秋貴，系爭協議書對被上\n    訴人不生效力，上訴人上開請求無理由等語，資為抗辯。\n三、本件經原法院判決駁回上訴人之訴。上訴人不服原判決，上\n    訴聲明：（一）原判決廢棄；（二）被上訴人應將系爭土地\n    所有權應有部分1/2移轉登記予上訴人。被上訴人答辯聲明\n    ：上訴駁回。\n四、經查：上訴人與林秋貴係兄弟關係，林德旺於72年1月18日\n    死亡，林德旺於68年7月1日因繳清地價（放領公地）登記為\n    系爭土地所有權人，系爭土地於71年8月9日以贈與為原因（\n    原因發生日為71年6月25日），移轉登記為被上訴人名義。\n    系爭協議書之立書人為上訴人與林秋貴，其上立協議書人林\n    秋貴之簽名、印章係真正等情，為兩造所不爭執，且有土地\n    所有權狀、土地登記簿謄本、土地登記聲請書、贈與所有權\n    移轉契約書、免繳土地增值稅證明書、印鑑證明、贈與稅免\n    稅證明書、農地承受人自耕能力證明書、戶籍謄本、林德旺\n    除戶謄本及系爭協議書可按（原審98年度湖家調字第11號卷\n    第9至13頁、第23至46頁），並據證人林秋貴於原審證稱：\n    系爭協議書上其簽名、印章均係真正等語（原審卷第22頁背\n    面），堪信此部分之事實為真正。\n五、本件爭點：\n（一）系爭土地是否係上訴人與林秋貴借名登記於被上訴人名下\n      ？\n（二）如認系爭土地係上訴人與林秋貴借名登記於被上訴人名下\n      ，則上訴人終止借名登記契約，類推適用委任關係，請求\n      如上開聲明所示，是否有理由？\n      爰述之如下：\n（一）系爭土地是否係上訴人與林秋貴借名登記於被上訴人名下\n      ？\n  １、按當事人主張有利於己之事實者，就其事實有舉證之責任\n      ，民事訴訟法第277條前段定有明文，又主張法律關係存\n      在之當事人，應就該法律關係發生所須具備之特別要件，\n      負舉證之責任，至於他造主張有利於己之事實（變更或消\n      滅之特別要件），則應由他造舉證證明（最高法院48年台\n      上字第887號判例意旨參照）。次按「夫妻於日常家務，\n      互為代理人。夫妻之一方濫用前項代理權時，他方得限制\n      之。但不得對抗善意第三人。」民法第1003條定有明文，\n      可知，夫妻得互為代理人，僅限於日常家務。另74年6月5\n      日修正前民法第1017條規定：聯合財產中，妻於結婚時所\n      有之財產，及婚姻關係存續中因繼承或其他無償取得之財\n      產，為妻之原有財產，保有其所有權。聯合財產中夫之原\n      有財產及不屬於妻之原有財產之部分，為夫所有。由妻之\n      原有財產所生之孳息，其所有權歸屬於夫。\n  ２、經查：\n    (1)上訴人主張：系爭土地係伊與林秋貴以100,000元向黃金\n      土贖回耕作權，經政府放領後，因伊與林秋貴均非自耕農\n      ，礙於當時土地法第30條第1項非自耕農不得登記為農地\n      所有權人之限制，遂將系爭土地借名登記於林德旺名下等\n      語，為被上訴人所否認，並辯以：系爭土地原係林德旺所\n      有等語。經查上訴人於原審係主張系爭土地係伊與林秋貴\n      繼承其父林德旺之共有土地，有上訴人之民事起訴狀可憑\n      （原審98年度湖家調字第11號卷第6頁），茲復主張系爭\n      土地係上訴人與林秋貴借名登記於林德旺名下，前後陳述\n      不一，已有疑義；另證人林秋貴業於原審證稱：「（問：\n      系爭土地為何登記你父親名字？）本來是我父親在耕作，\n      所以土地是父親所有。」等語（原審卷第23頁），而上訴\n      人復無其他證據證明系爭土地係上訴人與林秋貴借名登記\n      於林德旺名下，是上訴人此部分之主張，自難遽採。\n    (2)上訴人復主張：伊與林秋貴於71年6月25日將系爭土地借\n      名登記予被上訴人，系爭土地所有權1/2係林秋貴所有，\n      林秋貴與伊簽訂系爭協議書，依夫妻得互為代理人規定，\n      系爭協議書之效力及於被上訴人等語。被上訴人則辯以：\n      伊係童養媳，嗣與林秋貴結婚，林德旺為求公平，乃於生\n      前將系爭土地贈與伊作為嫁妝，伊未簽署系爭協議書，亦\n      不知林秋貴簽署系爭協議書，該協議書對伊不生效力等語\n      。經查：\n    如上所述，林德旺係於68年7月1日因繳清地價（放領公地\n      ）而登記取得系爭土地所有權，係系爭土地之所有權人，\n      林德旺於71年8月9日以贈與為原因（原因發生日期為71年\n      6月25日）將系爭土地所有權移轉登記予被上訴人，嗣於\n      72年1月18日死亡，可知，系爭土地係林德旺於其生前即\n      將之贈與被上訴人，而非上訴人與林秋貴繼承林德旺遺產\n      所取得之財產。\n    系爭協議書之立書人為上訴人與林秋貴，被上訴人並非係\n      系爭協議書之當事人，有系爭協議書可按。又依71年8月9\n      日被上訴人取得系爭土地所有權時，如前開１所述民法第\n      1017條之規定，夫妻法定財產制係採聯合財產制，聯合財\n      產中，妻於結婚時所有之財產，及婚姻關係存續中因繼承\n      或其他無償取得之財產，為妻之原有財產，保有其所有權\n      。而聯合財產制中夫之原有財產及不屬於妻之原有財產之\n      部分，始為夫所有。系爭土地係被上訴人受贈取得，屬被\n      上訴人無償取得之財產，揆諸前揭規定，應屬被上訴人之\n      原有財產，而非林秋貴所有。另系爭協議書第2條約定系\n      爭土地為上訴人與林秋貴平均共同共有，因農業區基於法\n      令規定，無法登記為共有，暫以林秋貴之妻即被上訴人名\n      義登記，林秋貴不得私自處分或設定負擔其所有權，否則\n      願負損害賠償及有關法律責任等語，並非屬民法第1003條\n      規定日常家務夫妻得互為代理人之範疇；況系爭協議書係\n      以林秋貴名義簽訂，而非林秋貴以代理被上訴人之名義為\n      之，亦無所謂代理之問題。被上訴人既非系爭協議書之當\n      事人，且上訴人又未能舉證系爭協議書之效力及於被上訴\n      人，是上訴人此部分之主張，仍屬無據。\n    至上訴人於本院聲請訊問證人林阿財，以證明林秋貴簽立\n      系爭協議書並無受脅迫之情，惟林秋貴簽訂系爭協議書之\n      效力並不及於被上訴人，已如上述，本院自無訊問證人林\n      阿財之必要，併此敘明。\n  ３、從而，上訴人主張系爭土地係上訴人與林秋貴借名登記於\n      被上訴人名下等語，自不可採。\n（二）如認系爭土地係上訴人與林秋貴借名登記於被上訴人名下\n      ，則上訴人終止借名登記契約，類推適用委任關係，請求\n      如上開聲明所示，是否有理由？\n  １、按「解除權之行使，應向他方當事人以意思表示為之。契\n      約當事人之一方有數人者，前項意思表示，應由其全體或\n      向其全體為之。」、「第258條及第260條之規定，於當事\n      人依法律之規定終止契約者準用之。」民法第258條第1、\n      2項、第263條分別定有明文。\n  ２、經查：系爭土地尚難認係上訴人與林秋貴借名登記於被上\n      訴人名下，業如上述。退步言，縱認上訴人主張系爭土地\n      係上訴人與林秋貴借名登記於被上訴人名下屬實，則上訴\n      人所主張之該借名登記契約係存在上訴人、林秋貴與被上\n      訴人間，此時，上訴人、林秋貴係將系爭土地借名予被上\n      訴人之借名登記契約之一方，依前開民法第258條第1、2\n      項、第263條之規定，如要終止該借名登記契約，應由上\n      訴人、林秋貴向被上訴人為終止該借名契約之意思表示，\n      茲上訴人僅以其名義向被上訴人為終止該借名契約之意思\n      表示，自與前開規定不符，是上訴人所為上開終止之意思\n      表示，亦不合法，上訴人本於終止借名登記契約，並類推\n      適用委任關係，請求如上開聲明所示，仍無理由。\n六、綜上所述，上訴人依終止借名登記契約，並類推適用委任關\n    係，請求被上訴人應將系爭土地所有權應有部分1/2移轉登\n    記予上訴人，為無理由，不應准許。原審為上訴人敗訴之判\n    決，並無不合。上訴意旨指摘原判決不當，聲明廢棄改判，\n    為無理由，應予駁回。\n七、本件事證已臻明確，兩造其餘之攻擊、防禦方法，核與判決\n    結果不生影響，爰毋庸一一論述，併此敘明。\n八、據上論結，本件上訴為無理由，依民事訴訟法第449條第1項\n    、第78條，判決如主文。"
  },
  "characters": {
    "judges": [
      "陳駿璧",
      "李媛媛",
      "陳邦豪"
    ],
    "prosecutors": [

    ],
    "lawyers": [
      "陳文億"
    ],
    "clerks": [

    ],
    "plaintiffs": [

    ],
    "defendants": [

    ],
    "prosecutor_office": [

    ],
    "creditors": [

    ],
    "debtors": [

    ],
    "judicial_associate_officer": [

    ]
  },
  "adjudged_at": "2010-05-12",
  "created_at": "2016-01-05 11:56:13",
  "updated_at": "2016-01-05 11:56:13"
}