{
  "identify": "TPH-99-上易-1004-20100512-1",
  "court": {
    "name": "臺灣高等法院",
    "code": "TPH"
  },
  "division": {
    "name": "刑事",
    "code": "M"
  },
  "year": 99,
  "word": "上易",
  "number": "1004",
  "jcheck": "1",
  "reason": "毒品危害防制條例",
  "content": "臺灣高等法院刑事判決                99年度上易字第1004號\n上  訴  人\n即  被  告  甲○○\n上列上訴人因毒品危害防制條例案件，不服臺灣桃園地方法院99\n年度審易字第235號，中華民國99年3月26日第一審判決（起訴案\n號：臺灣桃園地方法院檢察署98年度毒偵字第5981號），提起上\n訴，本院判決如下：\n    主  文\n上訴駁回。\n    理  由\n一、按上訴期間為10日，自送達判決後起算，但判決宣示後送達\n    前之上訴，亦有效力；原審法院認為上訴不合法律上之程式\n    或法律上不應准許或其上訴權已經喪失者，應以裁定駁回之\n    ；第二審法院認為上訴有第362 條前段上訴權已喪失等情形\n    者，應以判決駁回之，刑事訴訟法第349條、第362條前段、\n    第367條前段分別定有明文。\n二、經查本件上訴人即被告甲○○於民國99年4月1日接受臺灣桃\n    園地方法院第一審判決書正本，上訴人住桃園縣桃園市，不\n    需加計在途期間，揆諸前揭說明，其上訴期間之末日應為99\n    年4月12日，而其遲至同年月14日始提起上訴，此有卷附送\n    達證書暨臺灣桃園地方法院收受上訴狀之收發戳記可稽，已\n    逾越法定10日之上訴期間，顯屬違背法律上之程式，爰依法\n    駁回其上訴，並不經言詞辯論為之。\n據上論斷，應依刑事訴訟法第367條前段、第372條，判決如主文\n。\n中    華    民    國    99    年    5     月    12    日\n                  刑事第五庭  審判長 法  官  高明哲\n                                     法  官  高玉舜\n                                     法  官  劉秉鑫\n以上正本證明與原本無異。\n不得上訴。\n                                     書記官  蔡宜蓁\n中    華    民    國    99    年    5     月    13    日",
  "structure": {
    "main": "上訴駁回。",
    "reason": "一、按上訴期間為10日，自送達判決後起算，但判決宣示後送達\n    前之上訴，亦有效力；原審法院認為上訴不合法律上之程式\n    或法律上不應准許或其上訴權已經喪失者，應以裁定駁回之\n    ；第二審法院認為上訴有第362 條前段上訴權已喪失等情形\n    者，應以判決駁回之，刑事訴訟法第349條、第362條前段、\n    第367條前段分別定有明文。\n二、經查本件上訴人即被告甲○○於民國99年4月1日接受臺灣桃\n    園地方法院第一審判決書正本，上訴人住桃園縣桃園市，不\n    需加計在途期間，揆諸前揭說明，其上訴期間之末日應為99\n    年4月12日，而其遲至同年月14日始提起上訴，此有卷附送\n    達證書暨臺灣桃園地方法院收受上訴狀之收發戳記可稽，已\n    逾越法定10日之上訴期間，顯屬違背法律上之程式，爰依法\n    駁回其上訴，並不經言詞辯論為之。\n據上論斷，應依刑事訴訟法第367條前段、第372條，判決如主文\n。"
  },
  "characters": {
    "judges": [
      "高明哲",
      "高玉舜",
      "劉秉鑫"
    ],
    "prosecutors": [

    ],
    "lawyers": [

    ],
    "clerks": [
      "蔡宜蓁"
    ],
    "plaintiffs": [

    ],
    "defendants": [
      "甲"
    ],
    "prosecutor_office": [

    ],
    "creditors": [

    ],
    "debtors": [

    ],
    "judicial_associate_officer": [

    ]
  },
  "adjudged_at": "2010-05-12",
  "created_at": "2016-01-05 11:53:15",
  "updated_at": "2016-01-05 11:53:15"
}