{
  "identify": "TPH-98-聲-2957-20100105-1",
  "court": {
    "name": "臺灣高等法院",
    "code": "TPH"
  },
  "division": {
    "name": "刑事",
    "code": "M"
  },
  "year": 98,
  "word": "聲",
  "number": "2957",
  "jcheck": "1",
  "reason": "聲請解除限制出境",
  "content": "臺灣高等法院刑事裁定                  98年度聲字第2957號\n聲  請  人  甲○○原名劉冠宜\n上列被告因聲請解除限制出境案件，本院裁定如下：\n    主  文\n甲○○（原名劉冠宜）之限制出境處分准予解除。\n    理  由\n一、聲請意旨略以：聲請人即被告甲○○（原名劉冠宜）因涉嫌\n    貪污治罪條例案件，經臺灣臺北地方法院民國（下同）92年\n    8 月1 日以北院錦刑卯九十二聲羈二五三字第17233 號函，\n    通知內部部警政署入出境管理局（現業務業由內政部入出國\n    及移民署承辦），限制聲請人出境，有該局92年8 月7 日境\n    愛卿字第0920087278號函影本在卷。然本件一審法院業已判\n    決聲請人無罪，雖尚在二審繫屬中，亦無限制聲請人出境之\n    必要，為保障業經一審判決無罪之聲請人自由權益，爰聲請\n    鈞院解除聲請人限制出境之處分，並通知內政部入出國及移\n    民署（設臺北市○○區○○街15號) 。\n二、按刑事訴訟強制處分之目的，在於確保訴訟程序之進行、確\n    保證據之存在及真實、確保刑罰之執行，而被告有無施以強\n    制處分之必要，法院並得就具體個案情節及訴訟進行情形，\n    予以斟酌決定。本案被告甲○○（原名劉冠宜）因涉嫌貪污\n    治罪條例案件，前經臺灣臺北地方法院於92年8 月1 日諭令\n    限制出境，迄今已6 年有餘，而本案多來經調查、審理，被\n    告均能按時出庭，並無延誤情事，被告並經原審判處無罪。\n    是本院審酌上開事由，認被告甲○○（原名劉冠宜）無再限\n    制其出境之必要，上開聲請核無不合，應予准許。\n據上論斷，依刑事訴訟法第220條、第121條第1項，裁定如主文\n。\n中    華    民    國    99    年    1     月    5     日\n                  刑事第七庭審判長法  官  宋明蒼\n                                  法  官  游紅桃\n                                  法  官  楊智勝\n以上正本證明與原本無異。\n如不服本裁定，應於收受送達後五日內向本院提出抗告狀。\n                                  書記官  駱麗君\n中    華    民    國    99    年    1     月    5     日\n",
  "structure": {
    "main": "甲○○（原名劉冠宜）之限制出境處分准予解除。",
    "reason": "一、聲請意旨略以：聲請人即被告甲○○（原名劉冠宜）因涉嫌\n    貪污治罪條例案件，經臺灣臺北地方法院民國（下同）92年\n    8 月1 日以北院錦刑卯九十二聲羈二五三字第17233 號函，\n    通知內部部警政署入出境管理局（現業務業由內政部入出國\n    及移民署承辦），限制聲請人出境，有該局92年8 月7 日境\n    愛卿字第0920087278號函影本在卷。然本件一審法院業已判\n    決聲請人無罪，雖尚在二審繫屬中，亦無限制聲請人出境之\n    必要，為保障業經一審判決無罪之聲請人自由權益，爰聲請\n    鈞院解除聲請人限制出境之處分，並通知內政部入出國及移\n    民署（設臺北市○○區○○街15號) 。\n二、按刑事訴訟強制處分之目的，在於確保訴訟程序之進行、確\n    保證據之存在及真實、確保刑罰之執行，而被告有無施以強\n    制處分之必要，法院並得就具體個案情節及訴訟進行情形，\n    予以斟酌決定。本案被告甲○○（原名劉冠宜）因涉嫌貪污\n    治罪條例案件，前經臺灣臺北地方法院於92年8 月1 日諭令\n    限制出境，迄今已6 年有餘，而本案多來經調查、審理，被\n    告均能按時出庭，並無延誤情事，被告並經原審判處無罪。\n    是本院審酌上開事由，認被告甲○○（原名劉冠宜）無再限\n    制其出境之必要，上開聲請核無不合，應予准許。\n據上論斷，依刑事訴訟法第220條、第121條第1項，裁定如主文\n。"
  },
  "characters": {
    "judges": [
      "宋明蒼",
      "游紅桃",
      "楊智勝"
    ],
    "prosecutors": [

    ],
    "lawyers": [

    ],
    "clerks": [
      "駱麗君"
    ],
    "plaintiffs": [

    ],
    "defendants": [

    ],
    "prosecutor_office": [
      "甲"
    ],
    "creditors": [

    ],
    "debtors": [

    ],
    "judicial_associate_officer": [

    ]
  },
  "adjudged_at": "2010-01-05",
  "created_at": "2016-01-05 15:00:41",
  "updated_at": "2016-01-05 15:00:41"
}