{
  "identify": "TPH-98-聲-3916-20100105-1",
  "court": {
    "name": "臺灣高等法院",
    "code": "TPH"
  },
  "division": {
    "name": "刑事",
    "code": "M"
  },
  "year": 98,
  "word": "聲",
  "number": "3916",
  "jcheck": "1",
  "reason": "聲請定其應執行刑",
  "content": "臺灣高等法院刑事裁定                  98年度聲字第3916號\n聲  請  人  臺灣高等法院檢察署檢察官\n受  刑  人  甲○○\n上列聲請人因受刑人妨害自由等案件，先後經判決確定，有二裁\n判以上，聲請定其應執行刑（聲請案號：98年度執聲字第1769號\n），本院裁定如下：\n    主  文\n甲○○所犯如附表編號一所示之罪減得之刑與附表編號二所示之\n罪所處之刑，應執行有期徒刑壹年捌月。\n    理  由\n一、查受刑人甲○○於附表編號一、二所列日期犯恐嚇、強制等\n    罪，原經臺灣板橋地方法院97年度訴字第1773號判決分別判\n    處有期徒刑1 年，減為有期徒刑6 月（恐嚇罪）；有期徒刑\n    1 年，減為有期徒刑6 月（強制罪）；有期徒刑1 年2 月（\n    恐嚇罪）共3 罪，嗣經本院以98年度上訴字第3260號判決將\n    以上3 罪部分予以撤銷，改處有期徒刑1 年2 月（恐嚇罪）\n    ；有期徒刑1 年6 月，減為有期徒刑9 月（強制罪）共2 罪\n    確定在案。檢察官以其所犯上開附表編號一所示之罪減得之\n    刑與附表編號二所示之罪所處之刑，應依刑法第53條、第51\n    條第5 款規定，定其應執行之刑，爰依刑事訴訟法第477 條\n    第1 項聲請裁定。\n二、經核尚無不合，應予准許。爰依刑事訴訟法第477 條第1 項\n    、刑法第53條、刑法第51條第5 款，裁定如主文。\n中    華    民    國    99    年    1     月    5     日\n                  刑事第十四庭審判長法  官  陳志洋\n                                    法  官  梁耀鑌\n                                    法  官  謝靜恒\n以上正本證明與原本無異。\n不得抗告。\n                                    書記官  陳珮茹                                    書記官\n中    華    民    國    99    年    1     月    6    日\n",
  "structure": {
    "main": "甲○○所犯如附表編號一所示之罪減得之刑與附表編號二所示之\n罪所處之刑，應執行有期徒刑壹年捌月。",
    "reason": "一、查受刑人甲○○於附表編號一、二所列日期犯恐嚇、強制等\n    罪，原經臺灣板橋地方法院97年度訴字第1773號判決分別判\n    處有期徒刑1 年，減為有期徒刑6 月（恐嚇罪）；有期徒刑\n    1 年，減為有期徒刑6 月（強制罪）；有期徒刑1 年2 月（\n    恐嚇罪）共3 罪，嗣經本院以98年度上訴字第3260號判決將\n    以上3 罪部分予以撤銷，改處有期徒刑1 年2 月（恐嚇罪）\n    ；有期徒刑1 年6 月，減為有期徒刑9 月（強制罪）共2 罪\n    確定在案。檢察官以其所犯上開附表編號一所示之罪減得之\n    刑與附表編號二所示之罪所處之刑，應依刑法第53條、第51\n    條第5 款規定，定其應執行之刑，爰依刑事訴訟法第477 條\n    第1 項聲請裁定。\n二、經核尚無不合，應予准許。爰依刑事訴訟法第477 條第1 項\n    、刑法第53條、刑法第51條第5 款，裁定如主文。"
  },
  "characters": {
    "judges": [
      "陳志洋",
      "梁耀鑌",
      "謝靜恒"
    ],
    "prosecutors": [

    ],
    "lawyers": [

    ],
    "clerks": [
      "陳珮茹書記官"
    ],
    "plaintiffs": [

    ],
    "defendants": [

    ],
    "prosecutor_office": [
      "臺灣高等法院檢察署檢察官"
    ],
    "creditors": [

    ],
    "debtors": [

    ],
    "judicial_associate_officer": [

    ]
  },
  "adjudged_at": "2010-01-05",
  "created_at": "2016-01-05 15:00:50",
  "updated_at": "2016-01-05 15:00:50"
}