{
  "identify": "TPH-98-交抗-2932-20100104-1",
  "court": {
    "name": "臺灣高等法院",
    "code": "TPH"
  },
  "division": {
    "name": "刑事",
    "code": "M"
  },
  "year": 98,
  "word": "交抗",
  "number": "2932",
  "jcheck": "1",
  "reason": "違反道路交通管理處罰條例",
  "content": "臺灣高等法院交通事件裁定            98年度交抗字第2932號\n抗  告  人\n即受處分人  甲○○\n上列抗告人因違反道路交通管理處罰條例案件，不服臺灣板橋地\n方法院，中華民國98年11月12日所為裁定（98年度交聲字第3181\n號），提起抗告，本院裁定如下：\n    主  文\n抗告駁回。\n    理  由\n一、抗告意旨略以：我於岳父母家旁對面鄰居住處喝酒，所以之\n    前我會說有在家裡喝一點點酒，但我是以徒步回家，並未騎\n    車行進於馬路上。天色昏暗中，員警可能見到我牽著車，東\n    張西望，覺得可疑而前來盤查，本來並非要抓酒後騎車，恰\n    巧我坦承有喝酒，就未多聽解釋，連同人、車帶至派出所作\n    酒測。難道執法之警員事後就不會自圓其說嗎？在原審法院\n    出庭調查時，警員說當天有打電話到我家，事實上家中根本\n    沒有人接到電話，可見警員是避重就輕、胡說八道等語。\n二、按汽機車駕駛人飲用酒類或其他類似物後其吐氣所含酒精濃\n    度超過每公升0.25毫克或血液中酒精濃度超過百分之0.05以\n    上者，不得駕車。汽機車駕駛人，駕駛汽機車經測試檢定有\n    酒精濃度超過規定標準之情形，處新臺幣（下同）15,000元\n    以上60,000元以下罰鍰，並當場移置保管該汽機車及吊扣其\n    駕駛執照1年。另應接受道路交通安全講習。道路交通安全\n    規則第2條第1項第1款、第114條第2款，道路交通管理處罰\n    條例第3條第8款、第35條第1項第1款、第24 條第1項第2款\n    ，分別定有明文。\n三、經查：\n  (一)受處分人於民國98年7月14日22時27分許，騎乘車牌號碼HY9\n    -790號重型機車，行經臺北縣三峽鎮○○街195號前時，為\n    巡邏員警發現騎車明顯搖晃，乃予攔停盤查，並帶回警局進\n    行酒測，酒測值達每公升0.30毫克，超過規定標準，因而擎\n    單舉發之違規事實，業據證人即舉發員警黃昱勳於原審到庭\n    具結證述綦詳（見原審卷第24頁至第25頁），並有臺北縣政\n    府警察局北縣警交大字第C00000000號舉發違反道路交通管\n    理事件通知單附卷可參。\n  (二)證人即舉發員警黃昱勳於原審已證稱：當時我騎機車執行巡\n    邏勤務，行駛民權街往愛國路口時，見對向車道有輛機車明\n    顯有酒後駕車的情形，明顯搖晃，我與同事就迴轉將該機車\n    攔停，將車輛攔停後，請受處分人出示證件，我與他對談之\n    間明顯有聞到酒味，當時受處分人說他是在前面小吃麵攤跟\n    人喝酒，距離500公尺左右，當時我就請他回派出所酒測等\n    語明確（見原審卷24頁反面）。按舉發員警於司法審查之訴\n    訟程序上，係立於證人之地位而證述當時親身見聞之交通違\n    規行為經過，屬於法定證據方法之一之供述證據，於法本屬\n    有據，又證人黃昱勳與受處分人素不相識，亦無怨隙，自無\n    甘冒偽證罪責故意設詞誣陷受處分人之理。從而，證人前揭\n    之證言，應堪採信。至受處分人雖否認上情，惟觀諸其於98\n    年7月20日陳述書先係辯稱：我在住家樓下，欲將機車停在\n    自家走廊，因坡道很陡，我坐在機車上，觀望左右看何處可\n    停，突然騎機車之員警停下問我有無喝酒，我說在家有喝一\n    點云云（見原審卷第15頁）；嗣於同年8月19日異議狀稱：\n    當時我在斜坡旁左看右看，警員騎機車過來問我有無喝酒，\n    我說在家有喝一點補藥酒云云（見原審卷第4頁）；於原審\n    訊問時先稱：當時我在斜坡，因為很陡，我才要坐上車騎上\n    去，我是之前約晚上8、9點在家裡喝酒云云，嗣又改稱：我\n    是在我岳父對面的鄰居家喝酒云云（見原審卷第25頁）；惟\n    於抗告狀中又改稱：當時天色昏暗，警員可能見到我牽著機\n    車，東張西望，覺得可疑云云（見本院卷第5頁）。由受處\n    分人歷次辯解以觀，其對於本件遭警員舉發前之晚上究係在\n    何處喝酒，及遭警員盤查時究竟有無坐在機車上等情節，迭\n    次所辯均不一致，其辯解之真實性，顯非無疑，讓人難以採\n    信。綜上，本件受處分人違規事實明確，原處分機關援引上\n    開道路交通管理處罰條例及道路交通安全規則之規定，裁處\n    受處分人罰鍰15,000元，吊扣駕駛執照12個月，並應施以道\n    路交通安全講習，於法並無不合，原審裁定駁回其異議，亦\n    無不當。受處分人猶執前揭情詞置辯，提起抗告，為無理由\n    ，應予駁回。\n四、據上論斷，應依道路交通案件處理辦法第26條，刑事訴訟法\n    第412條，裁定如主文。\n中    華    民    國    99    年    1     月    4     日\n                  刑事第十三庭  審判長法  官   曾德水\n                                      法  官   陳恆寬\n                                      法  官   崔玲琦\n以上正本證明與原本無異。\n不得再抗告。\n                                      書記官   馬佳瑩\n中    華    民    國    99    年    1     月    5     日\n",
  "structure": {
    "main": "抗告駁回。",
    "reason": "一、抗告意旨略以：我於岳父母家旁對面鄰居住處喝酒，所以之\n    前我會說有在家裡喝一點點酒，但我是以徒步回家，並未騎\n    車行進於馬路上。天色昏暗中，員警可能見到我牽著車，東\n    張西望，覺得可疑而前來盤查，本來並非要抓酒後騎車，恰\n    巧我坦承有喝酒，就未多聽解釋，連同人、車帶至派出所作\n    酒測。難道執法之警員事後就不會自圓其說嗎？在原審法院\n    出庭調查時，警員說當天有打電話到我家，事實上家中根本\n    沒有人接到電話，可見警員是避重就輕、胡說八道等語。\n二、按汽機車駕駛人飲用酒類或其他類似物後其吐氣所含酒精濃\n    度超過每公升0.25毫克或血液中酒精濃度超過百分之0.05以\n    上者，不得駕車。汽機車駕駛人，駕駛汽機車經測試檢定有\n    酒精濃度超過規定標準之情形，處新臺幣（下同）15,000元\n    以上60,000元以下罰鍰，並當場移置保管該汽機車及吊扣其\n    駕駛執照1年。另應接受道路交通安全講習。道路交通安全\n    規則第2條第1項第1款、第114條第2款，道路交通管理處罰\n    條例第3條第8款、第35條第1項第1款、第24 條第1項第2款\n    ，分別定有明文。\n三、經查：\n  (一)受處分人於民國98年7月14日22時27分許，騎乘車牌號碼HY9\n    -790號重型機車，行經臺北縣三峽鎮○○街195號前時，為\n    巡邏員警發現騎車明顯搖晃，乃予攔停盤查，並帶回警局進\n    行酒測，酒測值達每公升0.30毫克，超過規定標準，因而擎\n    單舉發之違規事實，業據證人即舉發員警黃昱勳於原審到庭\n    具結證述綦詳（見原審卷第24頁至第25頁），並有臺北縣政\n    府警察局北縣警交大字第C00000000號舉發違反道路交通管\n    理事件通知單附卷可參。\n  (二)證人即舉發員警黃昱勳於原審已證稱：當時我騎機車執行巡\n    邏勤務，行駛民權街往愛國路口時，見對向車道有輛機車明\n    顯有酒後駕車的情形，明顯搖晃，我與同事就迴轉將該機車\n    攔停，將車輛攔停後，請受處分人出示證件，我與他對談之\n    間明顯有聞到酒味，當時受處分人說他是在前面小吃麵攤跟\n    人喝酒，距離500公尺左右，當時我就請他回派出所酒測等\n    語明確（見原審卷24頁反面）。按舉發員警於司法審查之訴\n    訟程序上，係立於證人之地位而證述當時親身見聞之交通違\n    規行為經過，屬於法定證據方法之一之供述證據，於法本屬\n    有據，又證人黃昱勳與受處分人素不相識，亦無怨隙，自無\n    甘冒偽證罪責故意設詞誣陷受處分人之理。從而，證人前揭\n    之證言，應堪採信。至受處分人雖否認上情，惟觀諸其於98\n    年7月20日陳述書先係辯稱：我在住家樓下，欲將機車停在\n    自家走廊，因坡道很陡，我坐在機車上，觀望左右看何處可\n    停，突然騎機車之員警停下問我有無喝酒，我說在家有喝一\n    點云云（見原審卷第15頁）；嗣於同年8月19日異議狀稱：\n    當時我在斜坡旁左看右看，警員騎機車過來問我有無喝酒，\n    我說在家有喝一點補藥酒云云（見原審卷第4頁）；於原審\n    訊問時先稱：當時我在斜坡，因為很陡，我才要坐上車騎上\n    去，我是之前約晚上8、9點在家裡喝酒云云，嗣又改稱：我\n    是在我岳父對面的鄰居家喝酒云云（見原審卷第25頁）；惟\n    於抗告狀中又改稱：當時天色昏暗，警員可能見到我牽著機\n    車，東張西望，覺得可疑云云（見本院卷第5頁）。由受處\n    分人歷次辯解以觀，其對於本件遭警員舉發前之晚上究係在\n    何處喝酒，及遭警員盤查時究竟有無坐在機車上等情節，迭\n    次所辯均不一致，其辯解之真實性，顯非無疑，讓人難以採\n    信。綜上，本件受處分人違規事實明確，原處分機關援引上\n    開道路交通管理處罰條例及道路交通安全規則之規定，裁處\n    受處分人罰鍰15,000元，吊扣駕駛執照12個月，並應施以道\n    路交通安全講習，於法並無不合，原審裁定駁回其異議，亦\n    無不當。受處分人猶執前揭情詞置辯，提起抗告，為無理由\n    ，應予駁回。\n四、據上論斷，應依道路交通案件處理辦法第26條，刑事訴訟法\n    第412條，裁定如主文。"
  },
  "characters": {
    "judges": [
      "曾德水",
      "陳恆寬",
      "崔玲琦"
    ],
    "prosecutors": [

    ],
    "lawyers": [

    ],
    "clerks": [
      "馬佳瑩"
    ],
    "plaintiffs": [

    ],
    "defendants": [

    ],
    "prosecutor_office": [

    ],
    "creditors": [

    ],
    "debtors": [

    ],
    "judicial_associate_officer": [

    ]
  },
  "adjudged_at": "2010-01-04",
  "created_at": "2016-01-05 14:34:58",
  "updated_at": "2016-01-05 14:34:58"
}