{
  "identify": "TPH-99-上訴-1565-20100512-1",
  "court": {
    "name": "臺灣高等法院",
    "code": "TPH"
  },
  "division": {
    "name": "刑事",
    "code": "M"
  },
  "year": 99,
  "word": "上訴",
  "number": "1565",
  "jcheck": "1",
  "reason": "毒品危害防制條例",
  "content": "臺灣高等法院刑事判決                99年度上訴字第1565號\n上  訴  人\n即  被  告  甲○○\n上列上訴人即被告因違反毒品危害防制條例案件，不服臺灣板橋\n地方法院98年度訴字第4653號，中華民國99年2 月26日第一審判\n決（起訴案號：臺灣板橋地方法院檢察署98年度毒偵字第6431號\n），提起上訴，本院判決如下：\n    主  文\n上訴駁回。\n    理  由\n一、按提起第二審之上訴，其上訴書狀應敘述具體理由，為第二\n    審上訴必備之程式。此觀民國96年7 月4 日修正公布刑事訴\n    訟法第361 條第2 項之規定甚明。倘上訴理由之敘述未合乎\n    具體之要求者，其上訴即屬同法第362 條前段所定「上訴不\n    合法律上之程式」，第二審法院應依同法第367 條前段之規\n    定，以判決駁回之。至其理由之具體與否，屬第二審法院審\n    查範圍，不在第一審法院命補正之列，上訴書狀如已敘述理\n    由，無論其具體與否，即無待其補提理由書或命補正之問題\n    。此與上訴書狀全未敘述上訴理由者，第一審法院依刑事訴\n    訟法第361 條第3 項之規定，應定期間先命補正之情形，尚\n    屬有別。又第二審上訴之目的，既在於請求撤銷、變更原判\n    決，則所謂「具體理由」，自應就原判決如何足以撤銷、如\n    何應予變更之「事實上」或「法律上」之具體根據，本於確\n    實之訴訟資料暨原因事實之所出，逐一敘述、記載，必已具\n    體指出原判決事實認定之所憑有如何之錯誤（如原判決所採\n    之證據如何不具證據能力，所為證明力之判斷如何違背經驗\n    、論理法則等），法律之適用（尤其實體法）有如何之違誤\n    ，形式上已足以動搖原判決使之成為不當或違法而得改判之\n    事由；必要時並應提出有利於己之事證，期使第二審法院採\n    納，俾為有利於上訴人之認定，始屬合法。上訴理由之敘述\n    ，應先合乎具體之要求，始有所敘述可取與否之實體審理與\n    判斷之問題。是上訴人之上訴書狀雖敘述上訴理由，但僅泛\n    言原判決認定事實錯誤、違背法令、量刑失之過重或輕縱等\n    情詞，而未依上揭意旨指出具體事由，或形式上雖已指出具\n    體事由，然該等事由縱使屬實，亦不足以認為原判決有何不\n    當或違法，或其所陳之事由，與訴訟資料所載不相適合，或\n    所指摘原判決之「不當」或「違法」根本不存在者，均應認\n    其實質上並未符合具體之要件，庶符節制濫行上訴之立法意\n    旨。又上訴之「理由」應於理由書中敘述，不得引用或檢附\n    其他文書替代，方能認為合法。\n二、本件原判決認定上訴人即被告甲○○有原判決事實欄所載之\n    犯行，因而分別論處被告施用第一級毒品罪（累犯）、施用\n    第二級毒品罪（累犯）及施用第二級毒品罪（累犯），係以\n    「上開事實，業經被告坦承不諱，並有扣案之第二級毒品甲\n    基安非他命1 包（驗餘淨重0.53公克）及內政部警政署刑事\n    警察局98年9 月30日刑鑑字第0980123769號鑑定書1 份足資\n    佐證。且被告為警所採集之尿液，經送檢驗結果，確呈安非\n    他命類、鴉片類及MDMA類陽性反應，亦有臺灣檢驗科技股份\n    有限公司於98年9 月17日所出具之濫用藥物檢驗報告1 份及\n    移送機關姓名代碼對照表1 紙附卷可稽。」等情，為其論據\n    ，足見原判決已詳敘其憑以認定之證據及理由，並無違背證\n    據、經驗及論理法則。再原判決依其確認之事實而為法律之\n    適用，亦無違誤。被告不服原審之判決，提起上訴，其上訴\n    理由略稱：被告父親罹患重病，目前仍在新光吳火獅紀念醫\n    院診療修養，急需他人長期看照，惟被告之母因年邁無法適\n    任，懇請從輕量刑，讓被告得至醫院照顧父親云云。惟查，\n    量刑輕重，屬為裁判之法院得依職權自由裁量之事項，苟其\n    量刑已以行為人之責任為基礎，並斟酌刑法第57條各款所列\n    情狀，在法定刑度內，酌量科刑，如無偏執一端，致明顯失\n    出失入情形，上級審法院即不得單就量刑部分遽指為不當或\n    違法。原判決關於被告科刑之部分，業已以被告之責任為基\n    礎，並審酌刑法第57條各款規定事項，且就被告所犯之罪，\n    分別敘明就施用第一級毒品部分，係構成累犯之要件，而判\n    處有期徒刑7 月；並就2 次施用第二級毒品部分，均屬累犯\n    ，而分別判處有期徒刑4 月、4 月，並定應執行刑為有期徒\n    刑1 年1 月等情，並未逾法定刑度，經核亦無違誤，此均不\n    能任意指摘為違法。是上訴意旨，徒憑己詞，再事爭執，且\n    未具體指明原判決前開認事或用法有何不當或違法情形，因\n    此，應認被告之上訴實質上未符合理由應具體之要件。依上\n    說明，其上訴為不合法律上之程式，應予駁回，並不經言詞\n    辯論為之。\n三、據上論斷，應依刑事訴訟法第367 條前段、第372 條，判決\n    如主文。\n中    華    民    國    99    年    5     月    12    日\n                  刑事第二十庭  審判長法  官  楊貴雄\n                                      法  官  林銓正\n                                      法  官  許必奇\n以上正本證明與原本無異。\n施用第一級毒品部分如不服本判決，應於收受送達後10日內向本\n院提出上訴書狀，其未敘述上訴之理由者並得於提起上訴後10日\n內向本院補提理由書（均須按他造當事人之人數附繕本）「切勿\n逕送上級法院」。\n施用第二級毒品部分不得上訴。\n                                      書記官  高郁婷\n中    華    民    國    99    年    5     月    14    日",
  "structure": {
    "main": "上訴駁回。",
    "reason": "一、按提起第二審之上訴，其上訴書狀應敘述具體理由，為第二\n    審上訴必備之程式。此觀民國96年7 月4 日修正公布刑事訴\n    訟法第361 條第2 項之規定甚明。倘上訴理由之敘述未合乎\n    具體之要求者，其上訴即屬同法第362 條前段所定「上訴不\n    合法律上之程式」，第二審法院應依同法第367 條前段之規\n    定，以判決駁回之。至其理由之具體與否，屬第二審法院審\n    查範圍，不在第一審法院命補正之列，上訴書狀如已敘述理\n    由，無論其具體與否，即無待其補提理由書或命補正之問題\n    。此與上訴書狀全未敘述上訴理由者，第一審法院依刑事訴\n    訟法第361 條第3 項之規定，應定期間先命補正之情形，尚\n    屬有別。又第二審上訴之目的，既在於請求撤銷、變更原判\n    決，則所謂「具體理由」，自應就原判決如何足以撤銷、如\n    何應予變更之「事實上」或「法律上」之具體根據，本於確\n    實之訴訟資料暨原因事實之所出，逐一敘述、記載，必已具\n    體指出原判決事實認定之所憑有如何之錯誤（如原判決所採\n    之證據如何不具證據能力，所為證明力之判斷如何違背經驗\n    、論理法則等），法律之適用（尤其實體法）有如何之違誤\n    ，形式上已足以動搖原判決使之成為不當或違法而得改判之\n    事由；必要時並應提出有利於己之事證，期使第二審法院採\n    納，俾為有利於上訴人之認定，始屬合法。上訴理由之敘述\n    ，應先合乎具體之要求，始有所敘述可取與否之實體審理與\n    判斷之問題。是上訴人之上訴書狀雖敘述上訴理由，但僅泛\n    言原判決認定事實錯誤、違背法令、量刑失之過重或輕縱等\n    情詞，而未依上揭意旨指出具體事由，或形式上雖已指出具\n    體事由，然該等事由縱使屬實，亦不足以認為原判決有何不\n    當或違法，或其所陳之事由，與訴訟資料所載不相適合，或\n    所指摘原判決之「不當」或「違法」根本不存在者，均應認\n    其實質上並未符合具體之要件，庶符節制濫行上訴之立法意\n    旨。又上訴之「理由」應於理由書中敘述，不得引用或檢附\n    其他文書替代，方能認為合法。\n二、本件原判決認定上訴人即被告甲○○有原判決事實欄所載之\n    犯行，因而分別論處被告施用第一級毒品罪（累犯）、施用\n    第二級毒品罪（累犯）及施用第二級毒品罪（累犯），係以\n    「上開事實，業經被告坦承不諱，並有扣案之第二級毒品甲\n    基安非他命1 包（驗餘淨重0.53公克）及內政部警政署刑事\n    警察局98年9 月30日刑鑑字第0980123769號鑑定書1 份足資\n    佐證。且被告為警所採集之尿液，經送檢驗結果，確呈安非\n    他命類、鴉片類及MDMA類陽性反應，亦有臺灣檢驗科技股份\n    有限公司於98年9 月17日所出具之濫用藥物檢驗報告1 份及\n    移送機關姓名代碼對照表1 紙附卷可稽。」等情，為其論據\n    ，足見原判決已詳敘其憑以認定之證據及理由，並無違背證\n    據、經驗及論理法則。再原判決依其確認之事實而為法律之\n    適用，亦無違誤。被告不服原審之判決，提起上訴，其上訴\n    理由略稱：被告父親罹患重病，目前仍在新光吳火獅紀念醫\n    院診療修養，急需他人長期看照，惟被告之母因年邁無法適\n    任，懇請從輕量刑，讓被告得至醫院照顧父親云云。惟查，\n    量刑輕重，屬為裁判之法院得依職權自由裁量之事項，苟其\n    量刑已以行為人之責任為基礎，並斟酌刑法第57條各款所列\n    情狀，在法定刑度內，酌量科刑，如無偏執一端，致明顯失\n    出失入情形，上級審法院即不得單就量刑部分遽指為不當或\n    違法。原判決關於被告科刑之部分，業已以被告之責任為基\n    礎，並審酌刑法第57條各款規定事項，且就被告所犯之罪，\n    分別敘明就施用第一級毒品部分，係構成累犯之要件，而判\n    處有期徒刑7 月；並就2 次施用第二級毒品部分，均屬累犯\n    ，而分別判處有期徒刑4 月、4 月，並定應執行刑為有期徒\n    刑1 年1 月等情，並未逾法定刑度，經核亦無違誤，此均不\n    能任意指摘為違法。是上訴意旨，徒憑己詞，再事爭執，且\n    未具體指明原判決前開認事或用法有何不當或違法情形，因\n    此，應認被告之上訴實質上未符合理由應具體之要件。依上\n    說明，其上訴為不合法律上之程式，應予駁回，並不經言詞\n    辯論為之。\n三、據上論斷，應依刑事訴訟法第367 條前段、第372 條，判決\n    如主文。"
  },
  "characters": {
    "judges": [
      "楊貴雄",
      "林銓正",
      "許必奇"
    ],
    "prosecutors": [

    ],
    "lawyers": [

    ],
    "clerks": [
      "高郁婷"
    ],
    "plaintiffs": [

    ],
    "defendants": [
      "甲"
    ],
    "prosecutor_office": [

    ],
    "creditors": [

    ],
    "debtors": [

    ],
    "judicial_associate_officer": [

    ]
  },
  "adjudged_at": "2010-05-12",
  "created_at": "2016-01-05 11:54:25",
  "updated_at": "2016-01-05 11:54:25"
}