{
  "identify": "TPH-98-抗-1476-20100104-2",
  "court": {
    "name": "臺灣高等法院",
    "code": "TPH"
  },
  "division": {
    "name": "民事",
    "code": "V"
  },
  "year": 98,
  "word": "抗",
  "number": "1476",
  "jcheck": "2",
  "reason": "給付承攬報酬等",
  "content": "臺灣高等法院民事裁定                  98年度抗字第1476號\n抗  告  人  金標企業股份有限公司\n法定代理人  甲○○\n上列抗告人因與相對人台北縣三重市三重國民小學間給付承攬報\n酬等事件，對於中華民國98年10月30日本院98年度抗字第1476號\n所為裁定提起抗告，本院裁定如下：\n    主  文\n抗告駁回\n抗告訴訟費用由抗告人負擔。\n    理  由\n一、按抗告、再抗告，非因裁定而受不到益者不得為之，此為訴\n    訟法上之原則（最高法院76年度台聲字第419號裁定參照）\n    。抗告為受裁定之當事人或其他利害關係人對於裁定聲明不\n    服之救濟方法，必須原裁定對其不利，始得為之；如原裁定\n    對其並無不利，自無許其提起抗告之餘地（最高法院78年度\n    台抗字第10號裁判要旨參照）。有無不利之判斷應以主文為\n    準，若依原裁定主文之記載，對抗告人無何不利，抗告人即\n    無對該裁定提起抗告予以救濟之餘地。\n二、本件抗告人以台北縣三重市三重國民小學為被告向原法院起\n    訴請求給付承攬報酬等事件，經原法院以裁定駁回原告即抗\n    告人之訴及假執行聲請；抗告人對之不服，提起抗告，業經\n    本院以裁定將原法院所為裁定廢棄，發回原法院另為適法之\n    處理；是本院原裁定對抗告人並無不利，揆諸前揭說明，抗\n    告人即不得對之再聲明不服，抗告論旨指摘本院裁定不當，\n    求為廢棄，其抗告於法不合，應予駁回。\n三、據上論結，本件抗告為不合法，爰裁定如主文。\n中    華    民    國    99    年    1    月    4    日\n                  民事第十庭\n                        審判長法  官  黃豐澤\n                              法  官  林麗玲\n                              法  官  吳謀焰\n正本係照原本作成。\n不得再抗告。\n中    華    民    國    99    年    1     月    4     日\n                              書記官  鄭淑昀",
  "structure": {
    "main": "抗告駁回\n抗告訴訟費用由抗告人負擔。",
    "reason": "一、按抗告、再抗告，非因裁定而受不到益者不得為之，此為訴\n    訟法上之原則（最高法院76年度台聲字第419號裁定參照）\n    。抗告為受裁定之當事人或其他利害關係人對於裁定聲明不\n    服之救濟方法，必須原裁定對其不利，始得為之；如原裁定\n    對其並無不利，自無許其提起抗告之餘地（最高法院78年度\n    台抗字第10號裁判要旨參照）。有無不利之判斷應以主文為\n    準，若依原裁定主文之記載，對抗告人無何不利，抗告人即\n    無對該裁定提起抗告予以救濟之餘地。\n二、本件抗告人以台北縣三重市三重國民小學為被告向原法院起\n    訴請求給付承攬報酬等事件，經原法院以裁定駁回原告即抗\n    告人之訴及假執行聲請；抗告人對之不服，提起抗告，業經\n    本院以裁定將原法院所為裁定廢棄，發回原法院另為適法之\n    處理；是本院原裁定對抗告人並無不利，揆諸前揭說明，抗\n    告人即不得對之再聲明不服，抗告論旨指摘本院裁定不當，\n    求為廢棄，其抗告於法不合，應予駁回。\n三、據上論結，本件抗告為不合法，爰裁定如主文。"
  },
  "characters": {
    "judges": [
      "黃豐澤",
      "林麗玲",
      "吳謀焰"
    ],
    "prosecutors": [

    ],
    "lawyers": [

    ],
    "clerks": [

    ],
    "plaintiffs": [

    ],
    "defendants": [

    ],
    "prosecutor_office": [

    ],
    "creditors": [

    ],
    "debtors": [

    ],
    "judicial_associate_officer": [

    ]
  },
  "adjudged_at": "2010-01-04",
  "created_at": "2016-01-05 14:35:27",
  "updated_at": "2016-01-05 14:35:27"
}