{
  "identify": "TPH-99-抗-549-20100512-1",
  "court": {
    "name": "臺灣高等法院",
    "code": "TPH"
  },
  "division": {
    "name": "刑事",
    "code": "M"
  },
  "year": 99,
  "word": "抗",
  "number": "549",
  "jcheck": "1",
  "reason": "聲請定其應執行刑",
  "content": "臺灣高等法院刑事裁定                   99年度抗字第549號\n抗  告  人\n即  被  告  甲○○\n上列抗告人因聲請定其應執行刑案件，不服臺灣桃園地方法院中\n華民國99年4 月12日裁定（99年度聲字第1178號），提起抗告，\n本院裁定如下：\n    主  文\n抗告駁回。\n    理  由\n一、按裁判確定前犯數罪者，併合處罰之；又數罪併罰，有二裁\n    判以上者，依刑法第51條之規定，定其應執行之刑，同法第\n    50條、第53條分別定有明文。次按數罪併罰之案件，其各罪\n    判決均係宣告刑，並非執行刑，縱令各案中一部分犯罪之宣\n    告刑在形式上已經執行，仍應依法聲請犯罪事實最後判決之\n    法院裁定，然後再依所裁定之執行刑，換發指揮書併合執行\n    ，其前已執行之有期徒刑部分，僅應予扣除而不能認為已執\n    行完畢，在所裁定之執行刑尚未執行完畢前，各案之宣告刑\n    不發生執行完畢之問題（最高法院90年度台非字第340 號、\n    最高法院95年度台非字第320號判決同此意旨）。\n二、原裁定意旨略以：抗告人即受刑人甲○○因附表所示各罪，\n    經原審法院先後判處如附表所示之刑，均經分別確定在案。\n    檢察官聲請就其中如附表所示編號1 、2 之罪定其應執行刑\n    。原審認聲請為正當，爰定其應執行有期徒刑10月，如易科\n    罰金，以新臺幣1千元折算1日等語。\n三、抗告意旨略以：附表1 所示之罪（臺灣板桃園方法院97年度\n    桃簡字第3537號判處竊盜罪有期徒刑5 月）服刑期滿，故已\n    執行完畢。原裁定將上述已執行完畢之案件與原審法院98年\n    度簡上字第1151 號刑事判決所確定之刑（有期徒刑6月），\n    合併定應執行之刑，顯然有誤，請本院查明後准予更正裁定\n    等語。\n四、經查：本件抗告人所犯如附表所示之竊盜等罪，符合刑法第\n    50條所定併合處罰之規定，原審法院裁定准許檢察官定應執\n    行刑之聲請，於法並無不合。又抗告人所犯附表編號1 之罪\n    ，固於98年11月29日服刑期滿，此有本院被告前案紀錄表附\n    卷可參，惟其前已執行之有期徒刑部分，依據前揭說明，仍\n    應合併定執行刑，已執行完畢部分，要屬檢察官日後指揮執\n    行時應行扣除之問題，與定應執行刑之裁定無涉。抗告意旨\n    以裁定有錯誤為由指摘原裁定不當，為無理由，應予駁回。\n據上論斷，應依刑事訴訟法第412條，裁定如主文。\n中    華    民    國    99    年    5     月    12    日\n                  刑事第五庭  審判長 法  官  高明哲\n                                     法  官  高玉舜\n                                     法  官  劉秉鑫\n以上正本證明與原本無異。\n不得再抗告。\n                                     書記官  蔡宜蓁\n中    華    民    國    99    年    5     月    13    日",
  "structure": {
    "main": "抗告駁回。",
    "reason": "一、按裁判確定前犯數罪者，併合處罰之；又數罪併罰，有二裁\n    判以上者，依刑法第51條之規定，定其應執行之刑，同法第\n    50條、第53條分別定有明文。次按數罪併罰之案件，其各罪\n    判決均係宣告刑，並非執行刑，縱令各案中一部分犯罪之宣\n    告刑在形式上已經執行，仍應依法聲請犯罪事實最後判決之\n    法院裁定，然後再依所裁定之執行刑，換發指揮書併合執行\n    ，其前已執行之有期徒刑部分，僅應予扣除而不能認為已執\n    行完畢，在所裁定之執行刑尚未執行完畢前，各案之宣告刑\n    不發生執行完畢之問題（最高法院90年度台非字第340 號、\n    最高法院95年度台非字第320號判決同此意旨）。\n二、原裁定意旨略以：抗告人即受刑人甲○○因附表所示各罪，\n    經原審法院先後判處如附表所示之刑，均經分別確定在案。\n    檢察官聲請就其中如附表所示編號1 、2 之罪定其應執行刑\n    。原審認聲請為正當，爰定其應執行有期徒刑10月，如易科\n    罰金，以新臺幣1千元折算1日等語。\n三、抗告意旨略以：附表1 所示之罪（臺灣板桃園方法院97年度\n    桃簡字第3537號判處竊盜罪有期徒刑5 月）服刑期滿，故已\n    執行完畢。原裁定將上述已執行完畢之案件與原審法院98年\n    度簡上字第1151 號刑事判決所確定之刑（有期徒刑6月），\n    合併定應執行之刑，顯然有誤，請本院查明後准予更正裁定\n    等語。\n四、經查：本件抗告人所犯如附表所示之竊盜等罪，符合刑法第\n    50條所定併合處罰之規定，原審法院裁定准許檢察官定應執\n    行刑之聲請，於法並無不合。又抗告人所犯附表編號1 之罪\n    ，固於98年11月29日服刑期滿，此有本院被告前案紀錄表附\n    卷可參，惟其前已執行之有期徒刑部分，依據前揭說明，仍\n    應合併定執行刑，已執行完畢部分，要屬檢察官日後指揮執\n    行時應行扣除之問題，與定應執行刑之裁定無涉。抗告意旨\n    以裁定有錯誤為由指摘原裁定不當，為無理由，應予駁回。\n據上論斷，應依刑事訴訟法第412條，裁定如主文。"
  },
  "characters": {
    "judges": [
      "高明哲",
      "高玉舜",
      "劉秉鑫"
    ],
    "prosecutors": [

    ],
    "lawyers": [

    ],
    "clerks": [
      "蔡宜蓁"
    ],
    "plaintiffs": [

    ],
    "defendants": [
      "甲"
    ],
    "prosecutor_office": [

    ],
    "creditors": [

    ],
    "debtors": [

    ],
    "judicial_associate_officer": [

    ]
  },
  "adjudged_at": "2010-05-12",
  "created_at": "2016-01-05 11:53:26",
  "updated_at": "2016-01-05 11:53:26"
}