{
  "identify": "TPH-99-聲再-3-20100105-1",
  "court": {
    "name": "臺灣高等法院",
    "code": "TPH"
  },
  "division": {
    "name": "刑事",
    "code": "M"
  },
  "year": 99,
  "word": "聲再",
  "number": "3",
  "jcheck": "1",
  "reason": "違反臺灣地區與大陸地區人民關係條例等",
  "content": "臺灣高等法院刑事裁定                   99年度聲再字第3號\n再審聲請人\n即受判決人  甲○○\n上列聲請人因違反臺灣地區與大陸地區人民關係條例等案件，對\n於本院95年度上訴字第4478號判決，中華民國96年8 月30日第二\n審確定判決（臺灣宜蘭地方法院95年度訴字第242 號），聲請再\n審，本院裁定如下：\n    主  文\n再審之聲請駁回。\n    理  由\n一、按聲請再審應以再審書狀，敘述理由，附具原判決之繕本及\n    證據，提出於管轄法院為之，刑事訴訟法第429 條定有明文\n    。上述法定程式，如有違背，法院應依同法第433 條規定，\n    裁定駁回再審聲請。刑事訴訟法再審編並無準用同法第三編\n    有關上訴的規定，此種訴訟程式的欠缺，法院無需先命為補\n    正（最高法院88年度台抗字第416號裁定參照）。\n二、本件再審聲請人對於原確定判決聲請再審，未據提出原判決\n    之繕本及證據，按之上開規定，其聲請程序顯屬有所違背，\n    應予駁回。\n三、據上論斷，應依刑事訴訟法第433條，裁定如主文。\n中    華    民    國    99    年     1     月    5    日\n                  刑事第二庭審判長法  官 洪光燦\n                                  法  官 楊照男\n                                  法  官 李麗玲\n以上正本證明與原本無異。\n如不服本裁定，應於收受送達後五日內向本院提出抗告狀。\n                                  書記官 廖婷璇\n中    華    民    國    99    年    1    月      6    日\n",
  "structure": {
    "main": "再審之聲請駁回。",
    "reason": "一、按聲請再審應以再審書狀，敘述理由，附具原判決之繕本及\n    證據，提出於管轄法院為之，刑事訴訟法第429 條定有明文\n    。上述法定程式，如有違背，法院應依同法第433 條規定，\n    裁定駁回再審聲請。刑事訴訟法再審編並無準用同法第三編\n    有關上訴的規定，此種訴訟程式的欠缺，法院無需先命為補\n    正（最高法院88年度台抗字第416號裁定參照）。\n二、本件再審聲請人對於原確定判決聲請再審，未據提出原判決\n    之繕本及證據，按之上開規定，其聲請程序顯屬有所違背，\n    應予駁回。\n三、據上論斷，應依刑事訴訟法第433條，裁定如主文。"
  },
  "characters": {
    "judges": [
      "洪光燦",
      "楊照男",
      "李麗玲"
    ],
    "prosecutors": [

    ],
    "lawyers": [

    ],
    "clerks": [
      "廖婷璇"
    ],
    "plaintiffs": [

    ],
    "defendants": [

    ],
    "prosecutor_office": [

    ],
    "creditors": [

    ],
    "debtors": [

    ],
    "judicial_associate_officer": [

    ]
  },
  "adjudged_at": "2010-01-05",
  "created_at": "2016-01-05 15:01:02",
  "updated_at": "2016-01-05 15:01:02"
}