{
  "identify": "TPH-99-聲-152-20100512-1",
  "court": {
    "name": "臺灣高等法院",
    "code": "TPH"
  },
  "division": {
    "name": "民事",
    "code": "V"
  },
  "year": 99,
  "word": "聲",
  "number": "152",
  "jcheck": "1",
  "reason": "訴訟救助",
  "content": "臺灣高等法院民事裁定                   99年度聲字第152號\n聲  請  人  甲○○\n上列當事人與相對人乙○○間因侵權行為損害賠償事件，聲請人\n以本院99年度重再字第6號案件提起再審之訴，並聲請訴訟救助\n，本院裁定如下：\n    主  文\n聲請駁回。\n    理  由\n一、按當事人無資力支出訴訟費用者，法院應依聲請，以裁定准\n    予訴訟救助，但顯無勝訴之望者，不在此限，民事訴訟法第\n    107條第1項定有明文。又所謂無資力係指窘於生活，且缺乏\n    經濟信用者而言，所謂顯無勝訴之望者，係指聲請訴訟救助\n    之當事人所提起之訴或上訴依其主張之事實於法律上本無獲\n    得勝訴之望，或其起訴或上訴為不合法之情形而言（最高法\n    院43年度台抗字第152號判例、87年度台抗字第660號裁判意\n    旨參照）。又提起再審之訴，應依民事訴訟法第501條第1項\n    第4款提出再審理由及關於再審理由並遵守不變期間之證據\n    ，此為必須具備之程式。所謂表明再審理由，必須指明確定\n    判決有如何合於法定再審事由之具體情事始為相當，倘僅泛\n    言有何條款之再審事由，而無具體情形者，仍難謂已合法表\n    明再審事由。既未合法表明再審事由，即為無再審之事由，\n    其訴即屬不合法，毋庸命其補正，法院得逕以裁定駁回之（\n    最高法院61 年台再字第137號、70年台再字第35號判例參照\n    ）。故當事人提起再審之訴而未合法表明再審理由時，其訴\n    為不合法，應認已顯無勝訴之望，當事人如聲請訴訟救助，\n    自亦無從准許。\n二、本件聲請意旨略以： 聲請人對於本院97年度重上字第539號\n    確定判決提起再審之訴（ 99年度重再字第6號），聲請人目\n    前債務包括彰化銀行房屋貸款新台幣（下同 ）880萬元、二\n    胎房貸約90萬元、各銀行卡債約450萬元， 而聲請人名下之\n    不動產皆遭債權人聲請拍賣，且以賣得金額抵償後，尚有部\n    分債務無法受償，故聲請人無法取得任何拍賣款，而聲請人\n    持有之佳錄公司股票，因該公司已下市，亦已無交換價值，\n    實無資力負擔本件訴訟費用， 爰依民事訴訟法第107條規定\n    聲請訴訟救助，並提出國稅局財產清單、聯徵中心債權人清\n    冊、臺灣板橋地方法院民事執行處函、及證券交易所函為證\n    。\n三、查依聲請人所提上開財產歸屬清單及信用報告等資料，固足\n    以釋明聲請人無資力支出訴訟費用，惟聲請人對於本院97年\n    度重上字第539號確定判決提起再審之訴，雖主張： (一)聲請\n    人未到庭不應逕以一造辯論判決；原確定判決駁回聲請人登\n    報道歉及擴張慰撫金之請求，未考慮到公然侮辱對被害人之\n    後續衝擊及名譽回復，違反比例原則，適用法規顯有錯誤，\n    而有民事訴訟法第496條第1項第1款之再審事由云云，惟並\n    未具體指明原判決適用何法規有錯誤。(二)主張原法院未定命\n    補正即駁回聲請人訴訟救助之聲請，又駁回聲請人停止訴訟\n    程序之聲請，損害其訴訟利益，有同條第1項第2款之再審事\n    由云云。惟其所述事由核與民事訴訟法第496條第1項第2款\n    「判決理由與主文顯有矛盾」之規定，全無關涉。(三)主張參\n    與審判之法官有民事訴訟法第33條第1項第2款之情形，有民\n    事訴訟法第496條第1項第7款再審事由；及筆錄登載不實 ，\n    協商庭錄音未依法保存，開庭錄音不完整，屬民事訴訟法第\n    496條第1項第9 款之再審事由云云，惟此部分並無宣告有罪\n    之判決或處罰鍰之裁定已確定，或因證據不足以外之理由，\n    而不能為有罪之確定判決或罰鍰之確定裁定之情形，核與該\n    二款之再審事由要件亦有不合。(四)其主張原確定判決法院未\n    踐行爭點整理程序、未盡闡明義務、未提示證據進行調查、\n    更換審判長突遭更換、判決未經宣示，均屬當然違背法令部\n    分，亦未具體指明原確定判決違背何法令。(五)其主張原確定\n    判決未依法調查聲請人所提供之證據， 有民事訴訟法第496\n    條第1項第13款之再審事由部分，核亦與民事訴訟法第496條\n    第1條第13款「 當事人發現未經斟酌之證物或得使用該證物\n    者」規定之情形不符。準此，其所提再審之訴，顯無勝訴之\n    望。則依首揭規定，其訴訟救助之聲請即不應准許，應予駁\n    回。\n四、據上論結，本件聲請為無理由，爰裁定如主文。\n中    華    民    國    99    年    5     月    12    日\n                  民事第三庭\n                        審判長法  官 林敬修\n                              法  官 吳青蓉\n                              法  官 張靜女\n正本係照原本作成。\n如不服本裁定，應於收受送達後10日內向本院提出抗告狀，並應\n繳納抗告費新台幣１千元。\n中    華    民    國    99    年    5     月    12    日\n                              書記官 蕭麗珍",
  "structure": {
    "main": "聲請駁回。",
    "reason": "一、按當事人無資力支出訴訟費用者，法院應依聲請，以裁定准\n    予訴訟救助，但顯無勝訴之望者，不在此限，民事訴訟法第\n    107條第1項定有明文。又所謂無資力係指窘於生活，且缺乏\n    經濟信用者而言，所謂顯無勝訴之望者，係指聲請訴訟救助\n    之當事人所提起之訴或上訴依其主張之事實於法律上本無獲\n    得勝訴之望，或其起訴或上訴為不合法之情形而言（最高法\n    院43年度台抗字第152號判例、87年度台抗字第660號裁判意\n    旨參照）。又提起再審之訴，應依民事訴訟法第501條第1項\n    第4款提出再審理由及關於再審理由並遵守不變期間之證據\n    ，此為必須具備之程式。所謂表明再審理由，必須指明確定\n    判決有如何合於法定再審事由之具體情事始為相當，倘僅泛\n    言有何條款之再審事由，而無具體情形者，仍難謂已合法表\n    明再審事由。既未合法表明再審事由，即為無再審之事由，\n    其訴即屬不合法，毋庸命其補正，法院得逕以裁定駁回之（\n    最高法院61 年台再字第137號、70年台再字第35號判例參照\n    ）。故當事人提起再審之訴而未合法表明再審理由時，其訴\n    為不合法，應認已顯無勝訴之望，當事人如聲請訴訟救助，\n    自亦無從准許。\n二、本件聲請意旨略以： 聲請人對於本院97年度重上字第539號\n    確定判決提起再審之訴（ 99年度重再字第6號），聲請人目\n    前債務包括彰化銀行房屋貸款新台幣（下同 ）880萬元、二\n    胎房貸約90萬元、各銀行卡債約450萬元， 而聲請人名下之\n    不動產皆遭債權人聲請拍賣，且以賣得金額抵償後，尚有部\n    分債務無法受償，故聲請人無法取得任何拍賣款，而聲請人\n    持有之佳錄公司股票，因該公司已下市，亦已無交換價值，\n    實無資力負擔本件訴訟費用， 爰依民事訴訟法第107條規定\n    聲請訴訟救助，並提出國稅局財產清單、聯徵中心債權人清\n    冊、臺灣板橋地方法院民事執行處函、及證券交易所函為證\n    。\n三、查依聲請人所提上開財產歸屬清單及信用報告等資料，固足\n    以釋明聲請人無資力支出訴訟費用，惟聲請人對於本院97年\n    度重上字第539號確定判決提起再審之訴，雖主張： (一)聲請\n    人未到庭不應逕以一造辯論判決；原確定判決駁回聲請人登\n    報道歉及擴張慰撫金之請求，未考慮到公然侮辱對被害人之\n    後續衝擊及名譽回復，違反比例原則，適用法規顯有錯誤，\n    而有民事訴訟法第496條第1項第1款之再審事由云云，惟並\n    未具體指明原判決適用何法規有錯誤。(二)主張原法院未定命\n    補正即駁回聲請人訴訟救助之聲請，又駁回聲請人停止訴訟\n    程序之聲請，損害其訴訟利益，有同條第1項第2款之再審事\n    由云云。惟其所述事由核與民事訴訟法第496條第1項第2款\n    「判決理由與主文顯有矛盾」之規定，全無關涉。(三)主張參\n    與審判之法官有民事訴訟法第33條第1項第2款之情形，有民\n    事訴訟法第496條第1項第7款再審事由；及筆錄登載不實 ，\n    協商庭錄音未依法保存，開庭錄音不完整，屬民事訴訟法第\n    496條第1項第9 款之再審事由云云，惟此部分並無宣告有罪\n    之判決或處罰鍰之裁定已確定，或因證據不足以外之理由，\n    而不能為有罪之確定判決或罰鍰之確定裁定之情形，核與該\n    二款之再審事由要件亦有不合。(四)其主張原確定判決法院未\n    踐行爭點整理程序、未盡闡明義務、未提示證據進行調查、\n    更換審判長突遭更換、判決未經宣示，均屬當然違背法令部\n    分，亦未具體指明原確定判決違背何法令。(五)其主張原確定\n    判決未依法調查聲請人所提供之證據， 有民事訴訟法第496\n    條第1項第13款之再審事由部分，核亦與民事訴訟法第496條\n    第1條第13款「 當事人發現未經斟酌之證物或得使用該證物\n    者」規定之情形不符。準此，其所提再審之訴，顯無勝訴之\n    望。則依首揭規定，其訴訟救助之聲請即不應准許，應予駁\n    回。\n四、據上論結，本件聲請為無理由，爰裁定如主文。"
  },
  "characters": {
    "judges": [
      "林敬修",
      "吳青蓉",
      "張靜女"
    ],
    "prosecutors": [

    ],
    "lawyers": [

    ],
    "clerks": [

    ],
    "plaintiffs": [

    ],
    "defendants": [

    ],
    "prosecutor_office": [
      "甲"
    ],
    "creditors": [

    ],
    "debtors": [

    ],
    "judicial_associate_officer": [

    ]
  },
  "adjudged_at": "2010-05-12",
  "created_at": "2016-01-05 11:55:29",
  "updated_at": "2016-01-05 11:55:29"
}