{
  "identify": "TPH-98-抗-1864-20100105-1",
  "court": {
    "name": "臺灣高等法院",
    "code": "TPH"
  },
  "division": {
    "name": "民事",
    "code": "V"
  },
  "year": 98,
  "word": "抗",
  "number": "1864",
  "jcheck": "1",
  "reason": "假扣押",
  "content": "臺灣高等法院民事裁定                  98年度抗字第1864號\n抗  告  人  霖興機械工業股份有限公司\n法定代理人  甲○○\n相  對  人  加和紙業股份有限公司\n法定代理人  乙○○\n上列當事人間假扣押事件，抗告人對於中華民國98年9月11日臺\n灣宜蘭地方法院98年度裁全字第363號裁定，提起抗告，本院裁\n定如下：\n    主  文\n原裁定廢棄。\n相對人於原法院之聲請駁回。\n聲請及抗告費用由相對人負擔。\n    理  由\n一按債權人就金錢請求或得易為金錢請求之請求，欲保全強制執\n  行者，得聲請假扣押；假扣押非有日後不能強制執行或甚難執\n  行之虞者，不得為之；請求及假扣押之原因應釋明之；前項釋\n  明如有不足，而債權人陳明願供擔保或法院認為適當者，法院\n  得定相當之擔保，命供擔保後為假扣押，民事訴訟法第522 條\n  第1項、第523條第1項、第526條第1項、第2項分別定有明文。\n  又民事訴訟法第526條第2 項規定之修正理由為：「依原第2項\n  規定，債權人得供擔保以代釋明，惟債權人聲請假扣押，應使\n  法院信其請求及假扣押之原因大致為正當，故仍應盡其釋明責\n  任。然其釋明如有不足，為補強計，於債權人陳明就債務人可\n  能遭受之損害願供擔保並足以補釋明之不足，或於法院認以供\n  擔保可補釋明之不足並為適當時，法院均可斟酌情形定相當之\n  擔保，命債權人供擔保後為假扣押，爰修正第2 項」，可知債\n  權人應先就「請求」及「假扣押之原因」，盡其釋明之責，必\n  待釋明而仍有不足者，始得以供擔保補釋明之不足，倘債權人\n  就任一要件未為任何釋明，縱其陳明願供擔保，仍不得准其供\n  擔保以補釋明之欠缺，其假扣押之聲請自不應准許。\n二本件相對人於原法院聲請假扣押，主張「假扣押原因」為：伊\n  恐抗告人不願自動履行而進行脫產行為，致伊日後有甚難執行\n  之虞云云，但未提出任何證據釋明此一主張。原法院裁定准予\n  假扣押，經抗告人提起抗告，於抗告狀指摘相對人未釋明「假\n  扣押原因」，本院送達該抗告狀予相對人，並諭知相對人應於\n  五日內表示意見，相對人逾期未提出任何證據以為釋明（見本\n  院卷第4、5、14、15頁）。揆諸前揭說明，相對人縱陳明願供\n  擔保，仍不得准其供擔保以補釋明之欠缺，其假扣押之聲請自\n  不應准許。原法院未察，遽以裁定准許假扣押，自有未洽。抗\n  告意旨執此指摘原裁定不當，求予廢棄，為有理由\n三據上論結，本件抗告為有理由，裁定如主文。\n中    華    民    國    99    年    1     月    5     日\n                    民事第四庭\n                        審判長法  官  張劍男\n                              法  官  彭昭芬\n                              法  官  翁昭蓉\n正本係照原本作成。\n本裁定除以適用法規顯有錯誤為理由外，不得再抗告。如提起再\n抗告，應於收受後10日內委任律師為代理人向本院提出再抗告狀\n。並繳納再抗告費新台幣１千元。\n中    華    民    國    99    年    1     月    7     日\n                              書記官  張淑芬",
  "structure": {
    "main": "原裁定廢棄。\n相對人於原法院之聲請駁回。\n聲請及抗告費用由相對人負擔。",
    "reason": "一按債權人就金錢請求或得易為金錢請求之請求，欲保全強制執\n  行者，得聲請假扣押；假扣押非有日後不能強制執行或甚難執\n  行之虞者，不得為之；請求及假扣押之原因應釋明之；前項釋\n  明如有不足，而債權人陳明願供擔保或法院認為適當者，法院\n  得定相當之擔保，命供擔保後為假扣押，民事訴訟法第522 條\n  第1項、第523條第1項、第526條第1項、第2項分別定有明文。\n  又民事訴訟法第526條第2 項規定之修正理由為：「依原第2項\n  規定，債權人得供擔保以代釋明，惟債權人聲請假扣押，應使\n  法院信其請求及假扣押之原因大致為正當，故仍應盡其釋明責\n  任。然其釋明如有不足，為補強計，於債權人陳明就債務人可\n  能遭受之損害願供擔保並足以補釋明之不足，或於法院認以供\n  擔保可補釋明之不足並為適當時，法院均可斟酌情形定相當之\n  擔保，命債權人供擔保後為假扣押，爰修正第2 項」，可知債\n  權人應先就「請求」及「假扣押之原因」，盡其釋明之責，必\n  待釋明而仍有不足者，始得以供擔保補釋明之不足，倘債權人\n  就任一要件未為任何釋明，縱其陳明願供擔保，仍不得准其供\n  擔保以補釋明之欠缺，其假扣押之聲請自不應准許。\n二本件相對人於原法院聲請假扣押，主張「假扣押原因」為：伊\n  恐抗告人不願自動履行而進行脫產行為，致伊日後有甚難執行\n  之虞云云，但未提出任何證據釋明此一主張。原法院裁定准予\n  假扣押，經抗告人提起抗告，於抗告狀指摘相對人未釋明「假\n  扣押原因」，本院送達該抗告狀予相對人，並諭知相對人應於\n  五日內表示意見，相對人逾期未提出任何證據以為釋明（見本\n  院卷第4、5、14、15頁）。揆諸前揭說明，相對人縱陳明願供\n  擔保，仍不得准其供擔保以補釋明之欠缺，其假扣押之聲請自\n  不應准許。原法院未察，遽以裁定准許假扣押，自有未洽。抗\n  告意旨執此指摘原裁定不當，求予廢棄，為有理由\n三據上論結，本件抗告為有理由，裁定如主文。"
  },
  "characters": {
    "judges": [
      "張劍男",
      "彭昭芬",
      "翁昭蓉"
    ],
    "prosecutors": [

    ],
    "lawyers": [

    ],
    "clerks": [

    ],
    "plaintiffs": [

    ],
    "defendants": [

    ],
    "prosecutor_office": [

    ],
    "creditors": [

    ],
    "debtors": [

    ],
    "judicial_associate_officer": [

    ]
  },
  "adjudged_at": "2010-01-05",
  "created_at": "2016-01-05 15:05:28",
  "updated_at": "2016-01-05 15:05:28"
}