{
  "identify": "TPH-98-上-327-20100105-1",
  "court": {
    "name": "臺灣高等法院",
    "code": "TPH"
  },
  "division": {
    "name": "民事",
    "code": "V"
  },
  "year": 98,
  "word": "上",
  "number": "327",
  "jcheck": "1",
  "reason": "返還土地等",
  "content": "臺灣高等法院民事判決                   98年度上字第327號\n上  訴  人  莊謹合即忠原駕駛訓練班\n訴訟代理人  張立業律師\n複代  理人  王世豪律師\n            林輝豪律師\n被上  訴人  臺灣省石門農田水利會\n法定代理人  乙○○\n訴訟代理人  卓聖圍律師\n上列當事人間返還土地等事件，上訴人對於中華民國97年12月17\n日臺灣桃園地方法院97年度訴字第1172號第一審判決提起上訴，\n本院於98年12月22日言詞辯論終結，判決如下：\n    主  文\n原判決關於命上訴人(一)拆除坐落桃園縣中壢市○○段第六三地號\n土地上如附圖所示六三之Ｂ建物及返還該部分土地；(二)給付超過\n新臺幣玖萬伍仟陸佰陸拾玖元及自民國九十七年七月十日起至返\n還土地之日止，按月給付新臺幣壹仟柒佰陸拾貳元部分，及該部\n分假執行之宣告，暨訴訟費用之裁判均廢棄。\n前開廢棄部分，被上訴人在第一審之訴及假執行之聲請均駁回。\n其餘上訴駁回。\n第一、二審訴訟費用由上訴人負擔十分之四，餘由被上訴人負擔\n。\n原判決所命拆除、清除及返還土地之位置及面積應更正為如附圖\n所示五三之Ａ（面積四平方公尺，鐵皮造）、五三之Ｂ（面積三\n平方公尺，鐵皮造）、五三之Ｃ（面積四平方公尺，ＲＣ造）、\n六三之Ａ（面積二十一平方公尺，ＲＣ造）、六三之Ｄ（面積一\n平方公尺，ＲＣ＋鐵皮造），及六三之Ｃ（面積十六平方公尺，\n柏油路）。\n    事實及理由\n一、被上訴人主張：坐落桃園縣中壢市○○段第53、63地號土地\n    （下稱系爭土地）為伊所有，上訴人竟自民國91年起在系爭\n    土地如原判決附圖所示53、53-A、53-B面積共計11平方公尺\n    及63面積45平方公尺上搭蓋建物（以下稱系爭建物），並於\n    63-A面積18平方公尺鋪設柏油路，供作上訴人營業使用，自\n    屬無權占用，幾經請求上訴人拆除並返還土地，均未獲置理\n    。又上訴人無權占用系爭土地，致伊受有相當於租金之損害\n    ，伊自得請求上訴人返還不當得利，並依土地法第105 條準\n    用同法第97條規定，按系爭土地申報總價10% 計算相當於租\n    金之不當得利等情，爰依民法第767條、179條規定，求為命\n    上訴人拆除上開建物、清除柏油路並返還土地，及給付新臺\n    幣（下同）25萬3,185元及自97年7月10日至返還土地之日止\n    ，按月給付4,603 元之判決。原審判命上訴人拆屋還地、給\n    付24萬9,914元及自97年7月10日起至返還土地之日止，按月\n    給付4,603 元，並駁回被上訴人其餘之訴。上訴人不服，提\n    起上訴，被上訴人於本院答辯聲明：上訴駁回（原審駁回被\n    上訴人其餘請求部分，未據其聲明不服，已告確定）。\n二、上訴人則以：伊係於54年間經被上訴人同意於系爭土地架設\n    空橋，占用迄今已42年，已因時效取得地上權。又伊之建物\n    為5棟3層高之加強磚造房屋，皆為一體建造不可分割，系爭\n    建物占用部分乃該建物之重要結構支撐，如拆除系爭建物，\n    整體建物勢將倒塌，顯有害於公共利益，且被上訴人明知伊\n    自54年間起即有建物跨越系爭土地之事實，惟從未反對伊使\n    用系爭土地，則依民法第796條、796條之1 規定，被上訴人\n    即不得請求伊拆屋還地。再被上訴人主張按系爭土地申報總\n    價10% 計算相當之不當得利，尚屬過高，伊於排水溝上架設\n    涵橋建屋其上，並不影響其水利使用，且現已無灌溉之需，\n    用途不大價值不高，被上訴人率予提起本件訴訟，僅係因補\n    償金未能達成協議之故，顯有權利濫用及違反誠信原則等語\n    ，資為抗辯。並上訴聲明：(一)原判決關於命上訴人拆屋、清\n    除柏油路並返還土地及給付不當得利部分均廢棄。(二)上開廢\n    棄部分，被上訴人在第一審之訴駁回。\n三、查系爭土地為被上訴人所有，上訴人於其上興建如附圖所示\n    53-A（面積4平方公尺，鐵皮造）、53-B（面積3平方公尺，\n    鐵皮造）、53-C（面積4平方公尺，RC造）、63-A（面積21\n    平方公尺，RC造）、63-D（面積1平方公尺，RC+鐵皮造）建\n    物，及鋪設如附圖所示63-C（面積16平方公尺）柏油路，供\n    作汽車駕駛訓練班營業使用等事實，為兩造所不爭，復有土\n    地登記簿謄本、照片影本附卷足稽，並經本院會同桃園縣中\n    壢地政事務所人員勘驗現場測量屬實，製有勘驗筆錄及土地\n    複丈成果圖附卷可憑，堪信為真實。\n四、被上訴人主張，上訴人無權占有系爭土地上開部分，應拆除\n    建物、清除柏油路及返還土地，並給付相當租金之不當得利\n    等情，為上訴人所否認，並以前揭情詞置辯。經查：\n  (一)按所有人對於無權占有或侵奪其所有物者，得請求返還之。\n    對於妨害其所有權者，得請求除去之，民法第767 條前段及\n    中段定有明文。又以無權占有為原因，請求返還所有物之訴\n    ，被告對原告就其物有所有權存在之事實無爭執，而僅以非\n    無權占有為抗辯者，原告於被告無權占有之事實，無舉證責\n    任。被告應就其取得占有，係有正當權源之事實證明之。如\n    不能證明，則應認原告之請求為有理由。本件上訴人對系爭\n    建物及柏油路占用被上訴人所有系爭土地前開部分之事實既\n    不爭執，則其對於占用係有正當權源之事實，即應舉證證明\n    之。\n  (二)上訴人固辯稱，伊前得被上訴人同意在系爭土地架設空橋而\n    有權占有系爭土地云云，並提出本院58年度上易字第1518號\n    、判字第5789號刑事判決影本為證。惟該刑事判決係以上訴\n    人經被上訴人同意在所屬中壢平埔頂支渠大牛欄分渠地約10\n    坪架設高空橋2 座，嗣在該渠道所架橋樑上興建高空樓房，\n    雖已超過被上訴人同意範圍，然屬民事問題，尚不該當竊佔\n    罪，而判處上訴人無罪（見原審卷第37頁）。上訴人自承當\n    初空橋均在地面下，現場已看不到等語，並有所提照片為證\n    （見本院卷第128、137頁）。上訴人既自承被上訴人當初係\n    同意伊於渠道架設空橋供公眾通行使用，則其封閉空橋埋入\n    地下而興建建物及鋪設柏油路，已超過被上訴人同意範圍，\n    此部分已無正當使用土地權源，自屬無權占有。\n  (三)再因時效取得地上權，依民法第772條準用同法第769條或第\n    770 條之規定，須以「行使地上權」之意思而占有他人之土\n    地，經過一定之期間，始得請求登記為地上權人，又占有人\n    因地上權取得時效完成而得主張時效利益，僅得請求登記為\n    地上權人而已，並非即取得地上權，在其未依法登記為地上\n    權人之前，自不能本於地上權之法律關係，向土地所有人有\n    所主張而認其非無權占有，上訴人未舉證證明其占有系爭土\n    地已登記取得地上權，其執此抗辯非無權占有，亦非可採。\n  (四)又土地所有人建築房屋逾越疆界者，鄰地所有人如知其越界\n    而不即提出異議，不得請求移去或變更其建築物，固為民法\n    第796 條所明定。惟主張鄰地所有人知其越界而不即提出異\n    議者，應就此項事實負舉證責任。查被上訴人前於58年間即\n    以上訴人超過空橋使用範圍興建樓房而提出告訴，追究上訴\n    人竊占罪責，已如前述，顯見被上訴人對上訴人之占用已提\n    出異議。再民法第796條之1固規定，土地所有人建築房屋逾\n    越地界，鄰地所有人請求移去或變更時，法院得斟酌公共利\n    益及當事人利益，免為全部或一部之移去或變更。惟系爭土\n    地地目為「水」，現為被上訴人石門大圳中壢平埔頂支渠大\n    牛攔分渠之引水、排水渠道用地，有土地登記簿謄本可稽，\n    並為上訴人所不爭，前被上訴人同意上訴人架設空橋使用，\n    係因水利設施綿延數公里，或有影響當地居民出入，為免妨\n    害居民權益，同意在不影響水利設施前提下，架設橋涵、建\n    築通路跨越埋設設施等情，亦有臺灣省水利局83年4月27日8\n    3水政字第23220號函為憑 (見原審卷第57頁），然上訴人超\n    過架橋供公眾通行使用之範圍，用作建築物基地，進而納入\n    封閉建物中供經營汽車駕駛人訓練場所營利使用，顯已影響\n    系爭土地作為引水、排水渠道之使用目的，並妨害水利事業\n    使用，影響公共利益重大；而其無權占用部分或為系爭建物\n    之小部分範圍、或為柏油路面（見本院卷第81頁），與前開\n    公共利益相較影響為小，上訴人自不得據前開條文抗辯免為\n    全部或一部之移去或變更。而被上訴人本於農田水利事業之\n    興辦管理法人，為公共利益請求上訴人拆除建物、柏油路，\n    返還無權占用之土地，自難謂係以損害上訴人為主要目的，\n    上訴人抗辯，被上訴人權利濫用或違反誠信原則云云，亦不\n    可採。\n  (五)上訴人未能證明占用系爭土地有何正當權源，依前開說明，\n    被上訴人請求上訴人將上開占用部分拆除、清除柏油路，返\n    還土地，自屬有據。另附圖所示63-B（面積25平方公尺，RC\n    造）之建物，為訴外人羅經權所有，業據證人羅經權證述在\n    卷（見本院卷第72、73頁），並為被上訴人所不爭，則上訴\n    人並未占用該部分土地，被上訴人請求上訴人拆除該部分建\n    物及返還土地，即屬無據。\n  (六)次按，無權占有他人之土地，可能獲得相當於租金之利益為\n    社會之通常觀念（最高法院61年台上字第1695號判例意旨參\n    照）。又依土地法第97條、第105 條規定，租用基地建築房\n    屋之租金，以不超過土地及其建築物申報總價額年息10% 為\n    限。查系爭53、63地號土地，93年1 月申報地價每平方公尺\n    分別為4,400元、8,000 元，有地價第1類謄本在卷可按（見\n    原審卷第13、14頁）。再系爭土地位於桃園縣中壢至內壢間\n    市○○○○○道面右側為軍營、左側是巷道，上訴人占用系\n    爭土地現供作忠原駕駛訓練班使用，有勘驗筆錄可憑（見原\n    審卷第32頁）。本院斟酌系爭土地之地目為「水」及上訴人\n    占有土地利用之情形，認上訴人無權占有所獲之利益，依前\n    揭土地法之規定年息6%計算為當。上訴人占用系爭53、63地\n    號土地面積分別為11平方公尺、38平方公尺，依此計算被上\n    訴人得請求上訴人93年1月1日起至97年7月9日止相當租金之\n    不當得利金額為9萬5,669元〔（4,400×11＋8,000×38）×\n    6%×4.5＋（4,400×11＋8,000×38）×6%×9/365〕，另自\n    97年7月10日起至返還土地之日止，按月給付相當租金之不\n    當得利金額為1,762元〔（4,400×11＋8,000×38）×6%÷1\n    2）。\n五、綜上所述，被上訴人依民法第767條及不當得利之法律關係\n    ，請求上訴人將系爭土地如附圖所示53-A（面積4平方公尺\n    ，鐵皮造）、53-B（面積3平方公尺，鐵皮造）、53-C（面\n    積4平方公尺，RC造）、63-A（面積21平方公尺，RC造）、\n    63-D（面積1平方公尺，RC+鐵皮造）建物拆除、及將如附圖\n    所示63-C（面積16平方公尺）柏油路清除，將前開土地返還\n    被上訴人；並給付被上訴人9萬5,669元，暨自97年7月10日\n    起至返還前開土地之日止，按月給付被上訴人1,762元，為\n    有理由，應予准許。逾此所為請求，為無理由，不應准許。\n    原審就上開不應准許部分，為上訴人敗訴之判決，並為假執\n    行之宣告，自有未洽。上訴意旨就此部分指摘原判決不當，\n    求予廢棄改判，為有理由，爰由本院予以廢棄，改判如主文\n    第2項所示。至於上開應准許部分，原審判命上訴人給付，\n    並為假執行之宣告，核無違誤。上訴意旨，就此部分，仍執\n    陳詞，指摘原判決不當，聲明廢棄，為無理由，應駁回其上\n    訴。再原判決判命上訴人拆除及返還系爭53地號土地上如原\n    判決附圖所示53、53-A部分、53-B部分及系爭63地號土地如\n    原判決附圖所示63、63-A部分，除本判決附圖63-B部分不應\n    准許外，其餘部分因套圖後套繪線變動，應以本院囑託測量\n    後之複丈成果圖較為精準，業據證人甲○○證述在卷，是前\n    開判命拆除、清除及返還土地之位置及面積，應更正如本判\n    決附圖所示。\n六、兩造其餘攻擊防禦方法及未經援用之證據，經審酌後認與本\n    判決之論斷不生影響，爰不一一論駁，附此敘明。\n七、據上論結，本件上訴為一部有理由，一部無理由。依民事訴\n    訟法第450條、第449條第1項、第79條，判決如主文。\n中    華    民    國    99    年    1     月    5     日\n                    民事第十一庭\n                        審判長法  官  鄭雅萍\n                              法  官  徐福晉\n                              法  官  詹文馨\n正本係照原本作成。\n如不服本判決，應於收受送達後20日內向本院提出上訴書狀，其\n未表明上訴理由者，應於提出上訴後20日內向本院補提理由書狀\n（均須按他造當事人之人數附繕本）上訴時應提出委任律師或具\n有律師資格之人之委任狀；委任有律師資格者，另應附具律師資\n格證書及釋明委任人與受任人有民事訴訟法第466 條之1第1項但\n書或第2項（詳附註）所定關係之釋明文書影本。\n中    華    民    國    99    年    1     月    6     日\n                              書記官  洪秋帆\n附註：\n民事訴訟法第466條之1（第1項、第2項）：\n對於第二審判決上訴，上訴人應委任律師為訴訟代理人。但上訴\n人或其他法定代理人具有律師資格者，不在此限。\n上訴人之配偶、三親等內之血親、二親等內之姻親，或上訴人為\n法人、中央或地方機關時，其所屬專任人員具有律師資格並經法\n院認為適當者，亦得為第三審訴訟代理人。",
  "structure": {
    "main": "原判決關於命上訴人(一)拆除坐落桃園縣中壢市○○段第六三地號\n土地上如附圖所示六三之Ｂ建物及返還該部分土地；(二)給付超過\n新臺幣玖萬伍仟陸佰陸拾玖元及自民國九十七年七月十日起至返\n還土地之日止，按月給付新臺幣壹仟柒佰陸拾貳元部分，及該部\n分假執行之宣告，暨訴訟費用之裁判均廢棄。\n前開廢棄部分，被上訴人在第一審之訴及假執行之聲請均駁回。\n其餘上訴駁回。\n第一、二審訴訟費用由上訴人負擔十分之四，餘由被上訴人負擔\n。\n原判決所命拆除、清除及返還土地之位置及面積應更正為如附圖\n所示五三之Ａ（面積四平方公尺，鐵皮造）、五三之Ｂ（面積三\n平方公尺，鐵皮造）、五三之Ｃ（面積四平方公尺，ＲＣ造）、\n六三之Ａ（面積二十一平方公尺，ＲＣ造）、六三之Ｄ（面積一\n平方公尺，ＲＣ＋鐵皮造），及六三之Ｃ（面積十六平方公尺，\n柏油路）。",
    "fact": "一、被上訴人主張：坐落桃園縣中壢市○○段第53、63地號土地\n    （下稱系爭土地）為伊所有，上訴人竟自民國91年起在系爭\n    土地如原判決附圖所示53、53-A、53-B面積共計11平方公尺\n    及63面積45平方公尺上搭蓋建物（以下稱系爭建物），並於\n    63-A面積18平方公尺鋪設柏油路，供作上訴人營業使用，自\n    屬無權占用，幾經請求上訴人拆除並返還土地，均未獲置理\n    。又上訴人無權占用系爭土地，致伊受有相當於租金之損害\n    ，伊自得請求上訴人返還不當得利，並依土地法第105 條準\n    用同法第97條規定，按系爭土地申報總價10% 計算相當於租\n    金之不當得利等情，爰依民法第767條、179條規定，求為命\n    上訴人拆除上開建物、清除柏油路並返還土地，及給付新臺\n    幣（下同）25萬3,185元及自97年7月10日至返還土地之日止\n    ，按月給付4,603 元之判決。原審判命上訴人拆屋還地、給\n    付24萬9,914元及自97年7月10日起至返還土地之日止，按月\n    給付4,603 元，並駁回被上訴人其餘之訴。上訴人不服，提\n    起上訴，被上訴人於本院答辯聲明：上訴駁回（原審駁回被\n    上訴人其餘請求部分，未據其聲明不服，已告確定）。\n二、上訴人則以：伊係於54年間經被上訴人同意於系爭土地架設\n    空橋，占用迄今已42年，已因時效取得地上權。又伊之建物\n    為5棟3層高之加強磚造房屋，皆為一體建造不可分割，系爭\n    建物占用部分乃該建物之重要結構支撐，如拆除系爭建物，\n    整體建物勢將倒塌，顯有害於公共利益，且被上訴人明知伊\n    自54年間起即有建物跨越系爭土地之事實，惟從未反對伊使\n    用系爭土地，則依民法第796條、796條之1 規定，被上訴人\n    即不得請求伊拆屋還地。再被上訴人主張按系爭土地申報總\n    價10% 計算相當之不當得利，尚屬過高，伊於排水溝上架設\n    涵橋建屋其上，並不影響其水利使用，且現已無灌溉之需，\n    用途不大價值不高，被上訴人率予提起本件訴訟，僅係因補\n    償金未能達成協議之故，顯有權利濫用及違反誠信原則等語\n    ，資為抗辯。並上訴聲明：(一)原判決關於命上訴人拆屋、清\n    除柏油路並返還土地及給付不當得利部分均廢棄。(二)上開廢\n    棄部分，被上訴人在第一審之訴駁回。\n三、查系爭土地為被上訴人所有，上訴人於其上興建如附圖所示\n    53-A（面積4平方公尺，鐵皮造）、53-B（面積3平方公尺，\n    鐵皮造）、53-C（面積4平方公尺，RC造）、63-A（面積21\n    平方公尺，RC造）、63-D（面積1平方公尺，RC+鐵皮造）建\n    物，及鋪設如附圖所示63-C（面積16平方公尺）柏油路，供\n    作汽車駕駛訓練班營業使用等事實，為兩造所不爭，復有土\n    地登記簿謄本、照片影本附卷足稽，並經本院會同桃園縣中\n    壢地政事務所人員勘驗現場測量屬實，製有勘驗筆錄及土地\n    複丈成果圖附卷可憑，堪信為真實。\n四、被上訴人主張，上訴人無權占有系爭土地上開部分，應拆除\n    建物、清除柏油路及返還土地，並給付相當租金之不當得利\n    等情，為上訴人所否認，並以前揭情詞置辯。經查：\n  (一)按所有人對於無權占有或侵奪其所有物者，得請求返還之。\n    對於妨害其所有權者，得請求除去之，民法第767 條前段及\n    中段定有明文。又以無權占有為原因，請求返還所有物之訴\n    ，被告對原告就其物有所有權存在之事實無爭執，而僅以非\n    無權占有為抗辯者，原告於被告無權占有之事實，無舉證責\n    任。被告應就其取得占有，係有正當權源之事實證明之。如\n    不能證明，則應認原告之請求為有理由。本件上訴人對系爭\n    建物及柏油路占用被上訴人所有系爭土地前開部分之事實既\n    不爭執，則其對於占用係有正當權源之事實，即應舉證證明\n    之。\n  (二)上訴人固辯稱，伊前得被上訴人同意在系爭土地架設空橋而\n    有權占有系爭土地云云，並提出本院58年度上易字第1518號\n    、判字第5789號刑事判決影本為證。惟該刑事判決係以上訴\n    人經被上訴人同意在所屬中壢平埔頂支渠大牛欄分渠地約10\n    坪架設高空橋2 座，嗣在該渠道所架橋樑上興建高空樓房，\n    雖已超過被上訴人同意範圍，然屬民事問題，尚不該當竊佔\n    罪，而判處上訴人無罪（見原審卷第37頁）。上訴人自承當\n    初空橋均在地面下，現場已看不到等語，並有所提照片為證\n    （見本院卷第128、137頁）。上訴人既自承被上訴人當初係\n    同意伊於渠道架設空橋供公眾通行使用，則其封閉空橋埋入\n    地下而興建建物及鋪設柏油路，已超過被上訴人同意範圍，\n    此部分已無正當使用土地權源，自屬無權占有。\n  (三)再因時效取得地上權，依民法第772條準用同法第769條或第\n    770 條之規定，須以「行使地上權」之意思而占有他人之土\n    地，經過一定之期間，始得請求登記為地上權人，又占有人\n    因地上權取得時效完成而得主張時效利益，僅得請求登記為\n    地上權人而已，並非即取得地上權，在其未依法登記為地上\n    權人之前，自不能本於地上權之法律關係，向土地所有人有\n    所主張而認其非無權占有，上訴人未舉證證明其占有系爭土\n    地已登記取得地上權，其執此抗辯非無權占有，亦非可採。\n  (四)又土地所有人建築房屋逾越疆界者，鄰地所有人如知其越界\n    而不即提出異議，不得請求移去或變更其建築物，固為民法\n    第796 條所明定。惟主張鄰地所有人知其越界而不即提出異\n    議者，應就此項事實負舉證責任。查被上訴人前於58年間即\n    以上訴人超過空橋使用範圍興建樓房而提出告訴，追究上訴\n    人竊占罪責，已如前述，顯見被上訴人對上訴人之占用已提\n    出異議。再民法第796條之1固規定，土地所有人建築房屋逾\n    越地界，鄰地所有人請求移去或變更時，法院得斟酌公共利\n    益及當事人利益，免為全部或一部之移去或變更。惟系爭土\n    地地目為「水」，現為被上訴人石門大圳中壢平埔頂支渠大\n    牛攔分渠之引水、排水渠道用地，有土地登記簿謄本可稽，\n    並為上訴人所不爭，前被上訴人同意上訴人架設空橋使用，\n    係因水利設施綿延數公里，或有影響當地居民出入，為免妨\n    害居民權益，同意在不影響水利設施前提下，架設橋涵、建\n    築通路跨越埋設設施等情，亦有臺灣省水利局83年4月27日8\n    3水政字第23220號函為憑 (見原審卷第57頁），然上訴人超\n    過架橋供公眾通行使用之範圍，用作建築物基地，進而納入\n    封閉建物中供經營汽車駕駛人訓練場所營利使用，顯已影響\n    系爭土地作為引水、排水渠道之使用目的，並妨害水利事業\n    使用，影響公共利益重大；而其無權占用部分或為系爭建物\n    之小部分範圍、或為柏油路面（見本院卷第81頁），與前開\n    公共利益相較影響為小，上訴人自不得據前開條文抗辯免為\n    全部或一部之移去或變更。而被上訴人本於農田水利事業之\n    興辦管理法人，為公共利益請求上訴人拆除建物、柏油路，\n    返還無權占用之土地，自難謂係以損害上訴人為主要目的，\n    上訴人抗辯，被上訴人權利濫用或違反誠信原則云云，亦不\n    可採。\n  (五)上訴人未能證明占用系爭土地有何正當權源，依前開說明，\n    被上訴人請求上訴人將上開占用部分拆除、清除柏油路，返\n    還土地，自屬有據。另附圖所示63-B（面積25平方公尺，RC\n    造）之建物，為訴外人羅經權所有，業據證人羅經權證述在\n    卷（見本院卷第72、73頁），並為被上訴人所不爭，則上訴\n    人並未占用該部分土地，被上訴人請求上訴人拆除該部分建\n    物及返還土地，即屬無據。\n  (六)次按，無權占有他人之土地，可能獲得相當於租金之利益為\n    社會之通常觀念（最高法院61年台上字第1695號判例意旨參\n    照）。又依土地法第97條、第105 條規定，租用基地建築房\n    屋之租金，以不超過土地及其建築物申報總價額年息10% 為\n    限。查系爭53、63地號土地，93年1 月申報地價每平方公尺\n    分別為4,400元、8,000 元，有地價第1類謄本在卷可按（見\n    原審卷第13、14頁）。再系爭土地位於桃園縣中壢至內壢間\n    市○○○○○道面右側為軍營、左側是巷道，上訴人占用系\n    爭土地現供作忠原駕駛訓練班使用，有勘驗筆錄可憑（見原\n    審卷第32頁）。本院斟酌系爭土地之地目為「水」及上訴人\n    占有土地利用之情形，認上訴人無權占有所獲之利益，依前\n    揭土地法之規定年息6%計算為當。上訴人占用系爭53、63地\n    號土地面積分別為11平方公尺、38平方公尺，依此計算被上\n    訴人得請求上訴人93年1月1日起至97年7月9日止相當租金之\n    不當得利金額為9萬5,669元〔（4,400×11＋8,000×38）×\n    6%×4.5＋（4,400×11＋8,000×38）×6%×9/365〕，另自\n    97年7月10日起至返還土地之日止，按月給付相當租金之不\n    當得利金額為1,762元〔（4,400×11＋8,000×38）×6%÷1\n    2）。\n五、綜上所述，被上訴人依民法第767條及不當得利之法律關係\n    ，請求上訴人將系爭土地如附圖所示53-A（面積4平方公尺\n    ，鐵皮造）、53-B（面積3平方公尺，鐵皮造）、53-C（面\n    積4平方公尺，RC造）、63-A（面積21平方公尺，RC造）、\n    63-D（面積1平方公尺，RC+鐵皮造）建物拆除、及將如附圖\n    所示63-C（面積16平方公尺）柏油路清除，將前開土地返還\n    被上訴人；並給付被上訴人9萬5,669元，暨自97年7月10日\n    起至返還前開土地之日止，按月給付被上訴人1,762元，為\n    有理由，應予准許。逾此所為請求，為無理由，不應准許。\n    原審就上開不應准許部分，為上訴人敗訴之判決，並為假執\n    行之宣告，自有未洽。上訴意旨就此部分指摘原判決不當，\n    求予廢棄改判，為有理由，爰由本院予以廢棄，改判如主文\n    第2項所示。至於上開應准許部分，原審判命上訴人給付，\n    並為假執行之宣告，核無違誤。上訴意旨，就此部分，仍執\n    陳詞，指摘原判決不當，聲明廢棄，為無理由，應駁回其上\n    訴。再原判決判命上訴人拆除及返還系爭53地號土地上如原\n    判決附圖所示53、53-A部分、53-B部分及系爭63地號土地如\n    原判決附圖所示63、63-A部分，除本判決附圖63-B部分不應\n    准許外，其餘部分因套圖後套繪線變動，應以本院囑託測量\n    後之複丈成果圖較為精準，業據證人甲○○證述在卷，是前\n    開判命拆除、清除及返還土地之位置及面積，應更正如本判\n    決附圖所示。\n六、兩造其餘攻擊防禦方法及未經援用之證據，經審酌後認與本\n    判決之論斷不生影響，爰不一一論駁，附此敘明。\n七、據上論結，本件上訴為一部有理由，一部無理由。依民事訴\n    訟法第450條、第449條第1項、第79條，判決如主文。",
    "reason": "一、被上訴人主張：坐落桃園縣中壢市○○段第53、63地號土地\n    （下稱系爭土地）為伊所有，上訴人竟自民國91年起在系爭\n    土地如原判決附圖所示53、53-A、53-B面積共計11平方公尺\n    及63面積45平方公尺上搭蓋建物（以下稱系爭建物），並於\n    63-A面積18平方公尺鋪設柏油路，供作上訴人營業使用，自\n    屬無權占用，幾經請求上訴人拆除並返還土地，均未獲置理\n    。又上訴人無權占用系爭土地，致伊受有相當於租金之損害\n    ，伊自得請求上訴人返還不當得利，並依土地法第105 條準\n    用同法第97條規定，按系爭土地申報總價10% 計算相當於租\n    金之不當得利等情，爰依民法第767條、179條規定，求為命\n    上訴人拆除上開建物、清除柏油路並返還土地，及給付新臺\n    幣（下同）25萬3,185元及自97年7月10日至返還土地之日止\n    ，按月給付4,603 元之判決。原審判命上訴人拆屋還地、給\n    付24萬9,914元及自97年7月10日起至返還土地之日止，按月\n    給付4,603 元，並駁回被上訴人其餘之訴。上訴人不服，提\n    起上訴，被上訴人於本院答辯聲明：上訴駁回（原審駁回被\n    上訴人其餘請求部分，未據其聲明不服，已告確定）。\n二、上訴人則以：伊係於54年間經被上訴人同意於系爭土地架設\n    空橋，占用迄今已42年，已因時效取得地上權。又伊之建物\n    為5棟3層高之加強磚造房屋，皆為一體建造不可分割，系爭\n    建物占用部分乃該建物之重要結構支撐，如拆除系爭建物，\n    整體建物勢將倒塌，顯有害於公共利益，且被上訴人明知伊\n    自54年間起即有建物跨越系爭土地之事實，惟從未反對伊使\n    用系爭土地，則依民法第796條、796條之1 規定，被上訴人\n    即不得請求伊拆屋還地。再被上訴人主張按系爭土地申報總\n    價10% 計算相當之不當得利，尚屬過高，伊於排水溝上架設\n    涵橋建屋其上，並不影響其水利使用，且現已無灌溉之需，\n    用途不大價值不高，被上訴人率予提起本件訴訟，僅係因補\n    償金未能達成協議之故，顯有權利濫用及違反誠信原則等語\n    ，資為抗辯。並上訴聲明：(一)原判決關於命上訴人拆屋、清\n    除柏油路並返還土地及給付不當得利部分均廢棄。(二)上開廢\n    棄部分，被上訴人在第一審之訴駁回。\n三、查系爭土地為被上訴人所有，上訴人於其上興建如附圖所示\n    53-A（面積4平方公尺，鐵皮造）、53-B（面積3平方公尺，\n    鐵皮造）、53-C（面積4平方公尺，RC造）、63-A（面積21\n    平方公尺，RC造）、63-D（面積1平方公尺，RC+鐵皮造）建\n    物，及鋪設如附圖所示63-C（面積16平方公尺）柏油路，供\n    作汽車駕駛訓練班營業使用等事實，為兩造所不爭，復有土\n    地登記簿謄本、照片影本附卷足稽，並經本院會同桃園縣中\n    壢地政事務所人員勘驗現場測量屬實，製有勘驗筆錄及土地\n    複丈成果圖附卷可憑，堪信為真實。\n四、被上訴人主張，上訴人無權占有系爭土地上開部分，應拆除\n    建物、清除柏油路及返還土地，並給付相當租金之不當得利\n    等情，為上訴人所否認，並以前揭情詞置辯。經查：\n  (一)按所有人對於無權占有或侵奪其所有物者，得請求返還之。\n    對於妨害其所有權者，得請求除去之，民法第767 條前段及\n    中段定有明文。又以無權占有為原因，請求返還所有物之訴\n    ，被告對原告就其物有所有權存在之事實無爭執，而僅以非\n    無權占有為抗辯者，原告於被告無權占有之事實，無舉證責\n    任。被告應就其取得占有，係有正當權源之事實證明之。如\n    不能證明，則應認原告之請求為有理由。本件上訴人對系爭\n    建物及柏油路占用被上訴人所有系爭土地前開部分之事實既\n    不爭執，則其對於占用係有正當權源之事實，即應舉證證明\n    之。\n  (二)上訴人固辯稱，伊前得被上訴人同意在系爭土地架設空橋而\n    有權占有系爭土地云云，並提出本院58年度上易字第1518號\n    、判字第5789號刑事判決影本為證。惟該刑事判決係以上訴\n    人經被上訴人同意在所屬中壢平埔頂支渠大牛欄分渠地約10\n    坪架設高空橋2 座，嗣在該渠道所架橋樑上興建高空樓房，\n    雖已超過被上訴人同意範圍，然屬民事問題，尚不該當竊佔\n    罪，而判處上訴人無罪（見原審卷第37頁）。上訴人自承當\n    初空橋均在地面下，現場已看不到等語，並有所提照片為證\n    （見本院卷第128、137頁）。上訴人既自承被上訴人當初係\n    同意伊於渠道架設空橋供公眾通行使用，則其封閉空橋埋入\n    地下而興建建物及鋪設柏油路，已超過被上訴人同意範圍，\n    此部分已無正當使用土地權源，自屬無權占有。\n  (三)再因時效取得地上權，依民法第772條準用同法第769條或第\n    770 條之規定，須以「行使地上權」之意思而占有他人之土\n    地，經過一定之期間，始得請求登記為地上權人，又占有人\n    因地上權取得時效完成而得主張時效利益，僅得請求登記為\n    地上權人而已，並非即取得地上權，在其未依法登記為地上\n    權人之前，自不能本於地上權之法律關係，向土地所有人有\n    所主張而認其非無權占有，上訴人未舉證證明其占有系爭土\n    地已登記取得地上權，其執此抗辯非無權占有，亦非可採。\n  (四)又土地所有人建築房屋逾越疆界者，鄰地所有人如知其越界\n    而不即提出異議，不得請求移去或變更其建築物，固為民法\n    第796 條所明定。惟主張鄰地所有人知其越界而不即提出異\n    議者，應就此項事實負舉證責任。查被上訴人前於58年間即\n    以上訴人超過空橋使用範圍興建樓房而提出告訴，追究上訴\n    人竊占罪責，已如前述，顯見被上訴人對上訴人之占用已提\n    出異議。再民法第796條之1固規定，土地所有人建築房屋逾\n    越地界，鄰地所有人請求移去或變更時，法院得斟酌公共利\n    益及當事人利益，免為全部或一部之移去或變更。惟系爭土\n    地地目為「水」，現為被上訴人石門大圳中壢平埔頂支渠大\n    牛攔分渠之引水、排水渠道用地，有土地登記簿謄本可稽，\n    並為上訴人所不爭，前被上訴人同意上訴人架設空橋使用，\n    係因水利設施綿延數公里，或有影響當地居民出入，為免妨\n    害居民權益，同意在不影響水利設施前提下，架設橋涵、建\n    築通路跨越埋設設施等情，亦有臺灣省水利局83年4月27日8\n    3水政字第23220號函為憑 (見原審卷第57頁），然上訴人超\n    過架橋供公眾通行使用之範圍，用作建築物基地，進而納入\n    封閉建物中供經營汽車駕駛人訓練場所營利使用，顯已影響\n    系爭土地作為引水、排水渠道之使用目的，並妨害水利事業\n    使用，影響公共利益重大；而其無權占用部分或為系爭建物\n    之小部分範圍、或為柏油路面（見本院卷第81頁），與前開\n    公共利益相較影響為小，上訴人自不得據前開條文抗辯免為\n    全部或一部之移去或變更。而被上訴人本於農田水利事業之\n    興辦管理法人，為公共利益請求上訴人拆除建物、柏油路，\n    返還無權占用之土地，自難謂係以損害上訴人為主要目的，\n    上訴人抗辯，被上訴人權利濫用或違反誠信原則云云，亦不\n    可採。\n  (五)上訴人未能證明占用系爭土地有何正當權源，依前開說明，\n    被上訴人請求上訴人將上開占用部分拆除、清除柏油路，返\n    還土地，自屬有據。另附圖所示63-B（面積25平方公尺，RC\n    造）之建物，為訴外人羅經權所有，業據證人羅經權證述在\n    卷（見本院卷第72、73頁），並為被上訴人所不爭，則上訴\n    人並未占用該部分土地，被上訴人請求上訴人拆除該部分建\n    物及返還土地，即屬無據。\n  (六)次按，無權占有他人之土地，可能獲得相當於租金之利益為\n    社會之通常觀念（最高法院61年台上字第1695號判例意旨參\n    照）。又依土地法第97條、第105 條規定，租用基地建築房\n    屋之租金，以不超過土地及其建築物申報總價額年息10% 為\n    限。查系爭53、63地號土地，93年1 月申報地價每平方公尺\n    分別為4,400元、8,000 元，有地價第1類謄本在卷可按（見\n    原審卷第13、14頁）。再系爭土地位於桃園縣中壢至內壢間\n    市○○○○○道面右側為軍營、左側是巷道，上訴人占用系\n    爭土地現供作忠原駕駛訓練班使用，有勘驗筆錄可憑（見原\n    審卷第32頁）。本院斟酌系爭土地之地目為「水」及上訴人\n    占有土地利用之情形，認上訴人無權占有所獲之利益，依前\n    揭土地法之規定年息6%計算為當。上訴人占用系爭53、63地\n    號土地面積分別為11平方公尺、38平方公尺，依此計算被上\n    訴人得請求上訴人93年1月1日起至97年7月9日止相當租金之\n    不當得利金額為9萬5,669元〔（4,400×11＋8,000×38）×\n    6%×4.5＋（4,400×11＋8,000×38）×6%×9/365〕，另自\n    97年7月10日起至返還土地之日止，按月給付相當租金之不\n    當得利金額為1,762元〔（4,400×11＋8,000×38）×6%÷1\n    2）。\n五、綜上所述，被上訴人依民法第767條及不當得利之法律關係\n    ，請求上訴人將系爭土地如附圖所示53-A（面積4平方公尺\n    ，鐵皮造）、53-B（面積3平方公尺，鐵皮造）、53-C（面\n    積4平方公尺，RC造）、63-A（面積21平方公尺，RC造）、\n    63-D（面積1平方公尺，RC+鐵皮造）建物拆除、及將如附圖\n    所示63-C（面積16平方公尺）柏油路清除，將前開土地返還\n    被上訴人；並給付被上訴人9萬5,669元，暨自97年7月10日\n    起至返還前開土地之日止，按月給付被上訴人1,762元，為\n    有理由，應予准許。逾此所為請求，為無理由，不應准許。\n    原審就上開不應准許部分，為上訴人敗訴之判決，並為假執\n    行之宣告，自有未洽。上訴意旨就此部分指摘原判決不當，\n    求予廢棄改判，為有理由，爰由本院予以廢棄，改判如主文\n    第2項所示。至於上開應准許部分，原審判命上訴人給付，\n    並為假執行之宣告，核無違誤。上訴意旨，就此部分，仍執\n    陳詞，指摘原判決不當，聲明廢棄，為無理由，應駁回其上\n    訴。再原判決判命上訴人拆除及返還系爭53地號土地上如原\n    判決附圖所示53、53-A部分、53-B部分及系爭63地號土地如\n    原判決附圖所示63、63-A部分，除本判決附圖63-B部分不應\n    准許外，其餘部分因套圖後套繪線變動，應以本院囑託測量\n    後之複丈成果圖較為精準，業據證人甲○○證述在卷，是前\n    開判命拆除、清除及返還土地之位置及面積，應更正如本判\n    決附圖所示。\n六、兩造其餘攻擊防禦方法及未經援用之證據，經審酌後認與本\n    判決之論斷不生影響，爰不一一論駁，附此敘明。\n七、據上論結，本件上訴為一部有理由，一部無理由。依民事訴\n    訟法第450條、第449條第1項、第79條，判決如主文。"
  },
  "characters": {
    "judges": [
      "鄭雅萍",
      "徐福晉",
      "詹文馨"
    ],
    "prosecutors": [

    ],
    "lawyers": [
      "張立業",
      "王世豪",
      "林輝豪",
      "卓聖圍",
      "有",
      "人或其他法定代理人具有"
    ],
    "clerks": [
      "洪秋帆"
    ],
    "plaintiffs": [

    ],
    "defendants": [

    ],
    "prosecutor_office": [

    ],
    "creditors": [

    ],
    "debtors": [

    ],
    "judicial_associate_officer": [

    ]
  },
  "adjudged_at": "2010-01-05",
  "created_at": "2016-01-05 15:05:21",
  "updated_at": "2016-01-05 15:05:21"
}