{
  "identify": "TPH-99-上訴-1614-20100512-1",
  "court": {
    "name": "臺灣高等法院",
    "code": "TPH"
  },
  "division": {
    "name": "刑事",
    "code": "M"
  },
  "year": 99,
  "word": "上訴",
  "number": "1614",
  "jcheck": "1",
  "reason": "妨害自由",
  "content": "臺灣高等法院刑事判決                99年度上訴字第1614號\n上  訴  人\n即  被  告  甲○○\n上列上訴人即被告妨害自由案件，不服臺灣板橋地方法院98年度\n訴字第3608號，中華民國99 年2月26日第一審判決（臺灣板橋法\n院檢察署98年度偵字第22399 號），提起上訴，本院判決如下：\n    主  文\n上訴駁回。\n    理  由\n一、按上訴期間為10日，自送達判決後起算，但判決宣示後送達\n    前之上訴，亦有效力；原審法院認為上訴不合法律上之程式\n    或法律上不應准許或其上訴權已經喪失者，應以裁定駁回之\n    ；第二審法院認為上訴有第362 條前段上訴權已喪失等情形\n    者，應以判決駁回之，刑事訴訟法第349條、第362條前段、\n    第367條前段分別定有明文。\n二、經查本件上訴人即被告甲○○於民國99年3月5日接受臺灣板\n    橋地方法院第一審判決書正本，上訴人住臺北市文山區，加\n    計在途期間2 日，揆諸前揭說明，其上訴期間之末日應為99\n    年3月17 日，而其遲至同年月18日始提起上訴，此有卷附送\n    達證書暨臺灣板橋地方法院收受上訴狀之收發戳記可稽，已\n    逾越法定10日之上訴期間，顯屬違背法律上之程式，爰依法\n    駁回其上訴，並不經言詞辯論為之。\n據上論斷，應依刑事訴訟法第367條前段、第372條，判決如主文\n。\n中    華    民    國    99    年    5     月    12    日\n                  刑事第五庭  審判長 法  官  高明哲\n                                     法  官  高玉舜\n                                     法  官  劉秉鑫\n以上正本證明與原本無異。\n如不服本判決，應於收受送達後10日內向本院提出上訴書狀，其\n未敘述上訴之理由者並得於提起上訴後10日內向本院補提理由書\n（均須按他造當事人之人數附繕本）「切勿逕送上級法院」。\n                                     書記官  蔡宜蓁\n中    華    民    國    99    年    5     月    13    日",
  "structure": {
    "main": "上訴駁回。",
    "reason": "一、按上訴期間為10日，自送達判決後起算，但判決宣示後送達\n    前之上訴，亦有效力；原審法院認為上訴不合法律上之程式\n    或法律上不應准許或其上訴權已經喪失者，應以裁定駁回之\n    ；第二審法院認為上訴有第362 條前段上訴權已喪失等情形\n    者，應以判決駁回之，刑事訴訟法第349條、第362條前段、\n    第367條前段分別定有明文。\n二、經查本件上訴人即被告甲○○於民國99年3月5日接受臺灣板\n    橋地方法院第一審判決書正本，上訴人住臺北市文山區，加\n    計在途期間2 日，揆諸前揭說明，其上訴期間之末日應為99\n    年3月17 日，而其遲至同年月18日始提起上訴，此有卷附送\n    達證書暨臺灣板橋地方法院收受上訴狀之收發戳記可稽，已\n    逾越法定10日之上訴期間，顯屬違背法律上之程式，爰依法\n    駁回其上訴，並不經言詞辯論為之。\n據上論斷，應依刑事訴訟法第367條前段、第372條，判決如主文\n。"
  },
  "characters": {
    "judges": [
      "高明哲",
      "高玉舜",
      "劉秉鑫"
    ],
    "prosecutors": [

    ],
    "lawyers": [

    ],
    "clerks": [
      "蔡宜蓁"
    ],
    "plaintiffs": [

    ],
    "defendants": [
      "甲"
    ],
    "prosecutor_office": [

    ],
    "creditors": [

    ],
    "debtors": [

    ],
    "judicial_associate_officer": [

    ]
  },
  "adjudged_at": "2010-05-12",
  "created_at": "2016-01-05 11:53:21",
  "updated_at": "2016-01-05 11:53:21"
}