{
  "identify": "TYD-99-審訴-394-20100512-2",
  "court": {
    "name": "臺灣桃園地方法院",
    "code": "TYD"
  },
  "division": {
    "name": "刑事",
    "code": "M"
  },
  "year": 99,
  "word": "審訴",
  "number": "394",
  "jcheck": "2",
  "reason": "毒品危害防制條例",
  "content": "臺灣桃園地方法院刑事裁定             99年度審訴字第394號\n上  訴  人\n即  被  告  甲○○\n上列上訴人因違反毒品危害防制條例案件，不服本院中華民國99\n年4 月9 日之協商判決，提起上訴，本院裁定如下：\n    主  文\n上訴駁回。\n    理  由\n一、協商判決除有刑事訴訟法第455 條之4 第1 項第1 款於本訊\n    問程序終結前，被告撤銷協商合意或檢察官撤回協商聲請者\n    ；第2 款被告協商之意思非出於自由意志者；第4 款被告所\n    犯之罪非第455 條之2 第1 項所定得以協商判決者；第6 款\n    被告有其他較重之裁判上一罪之犯罪事實者；第7 款法院認\n    應諭知免刑或免訴、不受理者情形之一，及違反同條第2 項\n    「法院應於協商合意範圍內為判決；法院為協商判決所科之\n    刑，以宣告緩刑或2 年以下有期徒刑、拘役或罰金為限」之\n    規定者外，不得上訴；原審法院認為上訴為法律上不應准許\n    者，應以裁定駁回之，刑事訴訟法第455 條之10第1 項、第\n    362 條前段分別定有明文。\n二、本件被告甲○○上訴理由略以：依毒品危害防制條例第21條\n    規定，被告所犯本案應由檢察官為不起訴之處分云云，爰具\n    狀提起上訴。\n三、經查，本件被告於本院審理中自白犯行，經檢察官與被告就\n    被告願受科刑之範圍於審判外進行協商，經當事人雙方合意\n    且被告認罪後，由檢察官聲請本院改依協商程序而為判決，\n    本院復告知被告如適用協商程序判決，將喪失之訴訟上權利\n    及除有刑事訴訟法第455 條之10第1 項但書所定情形外，不\n    得上訴之限制，並就所協商合意向被告確定係出於自由意志\n    ，有本院民國99年3 月23日簡式審判筆錄在卷可憑，是本件\n    協商程序並無違誤之處，合先敘明。\n四、再查，本件被告、檢察官並未撤銷協商合意或撤回協商之聲\n    請，又被告協商之意思係出於其自由意志，被告所犯之罪亦\n    為刑事訴訟法第455 條之2 第1 項所定得以聲請協商判決者\n    ，另被告無其他較重之裁判上一罪之犯罪事實，或法院認應\n    諭知免刑或免訴、不受理之情，協商判決判處被告之刑度亦\n    係於協商合意範圍內為之。揆諸前開說明，被告上訴意旨既\n    未敘明何以符合刑事訴訟法第455 條之10第1 項但書所列得\n    為上訴之法定要件，故其上訴自屬法律上不應准許，應予裁\n    定駁回。\n五、爰依刑事訴訟法第455 條之11第1 項、第362 條前段，裁定\n    如主文。\n中    華    民    國    99    年    5     月    12    日\n                        刑事庭  法  官  林靜梅\n以上正本證明與原本無異\n如不服本裁定，應於送達後5 日內，向本院提出抗告狀\n                                書記官  郭怡君\n中    華    民    國    99    年    5     月    12    日",
  "structure": {
    "main": "上訴駁回。",
    "reason": "一、協商判決除有刑事訴訟法第455 條之4 第1 項第1 款於本訊\n    問程序終結前，被告撤銷協商合意或檢察官撤回協商聲請者\n    ；第2 款被告協商之意思非出於自由意志者；第4 款被告所\n    犯之罪非第455 條之2 第1 項所定得以協商判決者；第6 款\n    被告有其他較重之裁判上一罪之犯罪事實者；第7 款法院認\n    應諭知免刑或免訴、不受理者情形之一，及違反同條第2 項\n    「法院應於協商合意範圍內為判決；法院為協商判決所科之\n    刑，以宣告緩刑或2 年以下有期徒刑、拘役或罰金為限」之\n    規定者外，不得上訴；原審法院認為上訴為法律上不應准許\n    者，應以裁定駁回之，刑事訴訟法第455 條之10第1 項、第\n    362 條前段分別定有明文。\n二、本件被告甲○○上訴理由略以：依毒品危害防制條例第21條\n    規定，被告所犯本案應由檢察官為不起訴之處分云云，爰具\n    狀提起上訴。\n三、經查，本件被告於本院審理中自白犯行，經檢察官與被告就\n    被告願受科刑之範圍於審判外進行協商，經當事人雙方合意\n    且被告認罪後，由檢察官聲請本院改依協商程序而為判決，\n    本院復告知被告如適用協商程序判決，將喪失之訴訟上權利\n    及除有刑事訴訟法第455 條之10第1 項但書所定情形外，不\n    得上訴之限制，並就所協商合意向被告確定係出於自由意志\n    ，有本院民國99年3 月23日簡式審判筆錄在卷可憑，是本件\n    協商程序並無違誤之處，合先敘明。\n四、再查，本件被告、檢察官並未撤銷協商合意或撤回協商之聲\n    請，又被告協商之意思係出於其自由意志，被告所犯之罪亦\n    為刑事訴訟法第455 條之2 第1 項所定得以聲請協商判決者\n    ，另被告無其他較重之裁判上一罪之犯罪事實，或法院認應\n    諭知免刑或免訴、不受理之情，協商判決判處被告之刑度亦\n    係於協商合意範圍內為之。揆諸前開說明，被告上訴意旨既\n    未敘明何以符合刑事訴訟法第455 條之10第1 項但書所列得\n    為上訴之法定要件，故其上訴自屬法律上不應准許，應予裁\n    定駁回。\n五、爰依刑事訴訟法第455 條之11第1 項、第362 條前段，裁定\n    如主文。"
  },
  "characters": {
    "judges": [
      "林靜梅"
    ],
    "prosecutors": [

    ],
    "lawyers": [

    ],
    "clerks": [
      "郭怡君"
    ],
    "plaintiffs": [

    ],
    "defendants": [
      "甲"
    ],
    "prosecutor_office": [

    ],
    "creditors": [

    ],
    "debtors": [

    ],
    "judicial_associate_officer": [

    ]
  },
  "adjudged_at": "2010-05-12",
  "created_at": "2016-01-05 12:35:46",
  "updated_at": "2016-01-05 12:35:46"
}