{
  "identify": "TYD-98-訴-1282-20100512-1",
  "court": {
    "name": "臺灣桃園地方法院",
    "code": "TYD"
  },
  "division": {
    "name": "刑事",
    "code": "M"
  },
  "year": 98,
  "word": "訴",
  "number": "1282",
  "jcheck": "1",
  "reason": "違反槍砲彈藥刀械管制條例",
  "content": "臺灣桃園地方法院刑事裁定              98年度訴字第1282號\n公  訴  人  臺灣桃園地方法院檢察署檢察官\n被      告  甲○\n上列被告因違反槍砲彈藥刀械管制條例等案件，經檢察官提起公\n訴，本院裁定如下：\n    主  文\n甲○自民國玖拾玖年伍月拾玖日起延長羈押貳月。\n    理  由\n一、首查，本件被告甲○因違反槍砲彈藥刀械管制條例等案件，\n    經本院法官訊問後認為其犯罪嫌疑重大，且經通緝到案，有\n    事實足認有逃亡之虞，即有刑事訴訟法第101 條第1 項第1\n    款之羈押事由而有羈押必要，而於99年2 月19日裁定自該日\n    起執行羈押。\n二、次查，本院再經訊問被告，仍認被告犯罪嫌疑重大，且上開\n    羈押原因與羈押必要性依然存在，仍有繼續羈押之必要，著\n    自民國99年5月19日起延長羈押2 月。\n三、爰依刑事訴訟法第108 條第1 項裁定如主文。\n中    華    民    國    99    年    5     月    12    日\n                  刑事第三庭審判長法  官  謝順輝\n                                  法  官  柯姿佐\n                                  法  官  曾雨明\n以上正本証明與原本無異\n如不服本裁定應於送達後5 日內向本院提出抗告狀\n                                  書記官  蘇  萱\n中    華    民    國    99    年    5     月    13    日",
  "structure": {
    "main": "甲○自民國玖拾玖年伍月拾玖日起延長羈押貳月。",
    "reason": "一、首查，本件被告甲○因違反槍砲彈藥刀械管制條例等案件，\n    經本院法官訊問後認為其犯罪嫌疑重大，且經通緝到案，有\n    事實足認有逃亡之虞，即有刑事訴訟法第101 條第1 項第1\n    款之羈押事由而有羈押必要，而於99年2 月19日裁定自該日\n    起執行羈押。\n二、次查，本院再經訊問被告，仍認被告犯罪嫌疑重大，且上開\n    羈押原因與羈押必要性依然存在，仍有繼續羈押之必要，著\n    自民國99年5月19日起延長羈押2 月。\n三、爰依刑事訴訟法第108 條第1 項裁定如主文。"
  },
  "characters": {
    "judges": [
      "謝順輝",
      "柯姿佐",
      "曾雨明"
    ],
    "prosecutors": [

    ],
    "lawyers": [

    ],
    "clerks": [
      "蘇萱"
    ],
    "plaintiffs": [

    ],
    "defendants": [
      "甲○"
    ],
    "prosecutor_office": [
      "臺灣桃園地方法院檢察署檢察官"
    ],
    "creditors": [

    ],
    "debtors": [

    ],
    "judicial_associate_officer": [

    ]
  },
  "adjudged_at": "2010-05-12",
  "created_at": "2016-01-05 12:35:53",
  "updated_at": "2016-01-05 12:35:53"
}