{
  "identify": "TYD-99-司票-2287-20100512-1",
  "court": {
    "name": "臺灣桃園地方法院",
    "code": "TYD"
  },
  "division": {
    "name": "民事",
    "code": "V"
  },
  "year": 99,
  "word": "司票",
  "number": "2287",
  "jcheck": "1",
  "reason": "本票裁定",
  "content": "臺灣桃園地方法院簡易庭民事裁定      99年度司票字第2287號\n聲  請  人  桃苗汽車股份有限公司\n法定代理人  丙○\n相  對  人  乙○○\n相  對  人  甲○○\n上列當事人間聲請本票裁定事件，本院裁定如下：\n    主  文\n相對人於民國九十六年六月一日共同簽發之本票內載憑票交付聲\n請人新臺幣肆拾貳萬元，及自民國九十九年四月五日起至清償日\n止，按週年利率百分之一計算之利息，准予強制執行。\n聲請程序費用新臺幣壹仟元由相對人連帶負擔。\n    理  由\n一、本件聲請意旨略以：聲請人執有相對人於民國96年6 月1 日\n    共同簽發免除作成拒絕證書之本票一紙，內載金額新臺幣42\n    0,000 元，到期日99年4 月5 日，詎於到期日後經提示尚有\n    如主文所示之本金及利息未獲清償；為此，提出本票一份，\n    聲請裁定准許強制執行等語。\n二、本件聲請核與票據法第123 條規定相符，應予准許。\n三、依非訟事件法第23條、民事訴訟法第85條第2 項，裁定如主\n    文。\n四、如不服本裁定，應於裁定送達後10日之不變期間內向本院提\n    出抗告狀。（須附繕本，並繳納抗告費新臺幣1,000 元）。\n五、發票人如主張本票係偽造、變造者，得於接到本裁定後20日\n    之內，對執票人向本院另行提起確認債權不存在之訴。\n中    華    民    國    99    年    5     月    12    日\n                  簡易庭司法事務官\n附記：\n一、嗣後遞狀均須註明案號、股別。\n二、案件一經確定，本院依職權逕行核發確定證明書，聲請人勿\n    庸另行聲請。",
  "structure": {
    "main": "相對人於民國九十六年六月一日共同簽發之本票內載憑票交付聲\n請人新臺幣肆拾貳萬元，及自民國九十九年四月五日起至清償日\n止，按週年利率百分之一計算之利息，准予強制執行。\n聲請程序費用新臺幣壹仟元由相對人連帶負擔。",
    "reason": "一、本件聲請意旨略以：聲請人執有相對人於民國96年6 月1 日\n    共同簽發免除作成拒絕證書之本票一紙，內載金額新臺幣42\n    0,000 元，到期日99年4 月5 日，詎於到期日後經提示尚有\n    如主文所示之本金及利息未獲清償；為此，提出本票一份，\n    聲請裁定准許強制執行等語。\n二、本件聲請核與票據法第123 條規定相符，應予准許。\n三、依非訟事件法第23條、民事訴訟法第85條第2 項，裁定如主\n    文。\n四、如不服本裁定，應於裁定送達後10日之不變期間內向本院提\n    出抗告狀。（須附繕本，並繳納抗告費新臺幣1,000 元）。\n五、發票人如主張本票係偽造、變造者，得於接到本裁定後20日\n    之內，對執票人向本院另行提起確認債權不存在之訴。"
  },
  "characters": {
    "judges": [

    ],
    "prosecutors": [

    ],
    "lawyers": [

    ],
    "clerks": [

    ],
    "plaintiffs": [

    ],
    "defendants": [

    ],
    "prosecutor_office": [
      "桃苗汽車股份有限公司"
    ],
    "creditors": [

    ],
    "debtors": [

    ],
    "judicial_associate_officer": [
      "簡易庭"
    ]
  },
  "adjudged_at": "2010-05-12",
  "created_at": "2016-01-05 12:39:43",
  "updated_at": "2016-01-05 12:39:43"
}