{
  "identify": "TYD-99-撤緩-106-20100512-1",
  "court": {
    "name": "臺灣桃園地方法院",
    "code": "TYD"
  },
  "division": {
    "name": "刑事",
    "code": "M"
  },
  "year": 99,
  "word": "撤緩",
  "number": "106",
  "jcheck": "1",
  "reason": "撤銷緩刑",
  "content": "臺灣桃園地方法院刑事裁定             99年度撤緩字第106號\n公  訴  人  臺灣桃園地方法院檢察署檢察官\n受  刑  人  甲○○\n上列聲請人因受刑人違反詐欺案件，聲請撤銷其緩刑宣告（99年\n度執聲字第964號），本院裁定如下：\n    主  文\n聲請駁回。\n    理  由\n一、聲請意旨略以：受刑人甲○○前因犯詐欺案件，經本院於民\n    國98年6 月18日以98年度易字第144 號（本署96年度偵字第\n    24398 號）判處有期徒刑4 月，緩刑2 年，於98年7 月13日\n    確定在案，乃於緩刑期前即96年6 月8 日更犯幫助詐欺案件\n    ，經本院於98年12月30日以98年度桃簡字第1695號判決判處\n    拘役80日，於99年2 月8 日確定，已動搖原判決認定受刑人\n    「因一時失慮，偶罹刑典，事後坦承犯行，深具悔意」而予\n    緩刑宣告之基礎，認受刑人顯非偶蹈法網或對其所犯有所悔\n    悟，自有執行刑罰之必要，已合於刑法第75條之1 第1 項第\n    1 款所定撤銷緩刑宣告之原因，爰依刑事訴訟法第476 條規\n    定聲請撤銷緩刑宣告云云。\n二、按於中華民國98年5月19日刑法修正施行前，受緩刑之宣告\n    ，98年5月19日修正刑法施行後，仍在緩刑期內者，適用98\n    年5月19日修正施行之刑法第75條及第75條之1規定；又上開\n    修正公布之刑法第75條之1，自98年9月1日施行，刑法施行\n    法第6條之1第2項、第10條之2第2項分別定有明文。查本件\n    受刑人甲○○因詐欺案件，經本院98年6月18日以98年度易\n    字第144號判決判處有期徒刑4月，緩刑2年，於98年7月13日\n    判決確定在案，其緩刑期係自98年7月14日起至100年7月13\n    日止，此有該案判決書及臺灣高等法院被告前案紀錄表各1\n    份附卷可稽，足認該案之緩刑宣告，係於98年9月1日刑法修\n    正施行前諭知，且於施行後仍在緩刑期間內，揆諸前開說明\n    ，本件有關該案緩刑之撤銷，應逕適用修正後刑法第75條之\n    1 之規定，而無庸比較新舊法，合先敘明。\n三、次按緩刑前因故意犯他罪，而在緩刑期內受六月以下有期徒\n    刑、拘役或罰金之宣告確定者，足認原宣告之緩刑難收其預\n    期效果，而有執行刑罰之必要者，得撤銷其宣告，98年5 月\n    18日修正之刑法第75條之1 第1 項第1 款定有明文。考本條\n    文前於94年2 月2 日增訂立法意旨略以：關於緩刑之撤銷，\n    現行法第75條第1 項固已設有二款應撤銷之原因；至得撤銷\n    緩刑之原因，則僅於保安處分章內第93條第3 項與撤銷假釋\n    合併加以規定，體例上不相連貫，實用上亦欠彈性，爰參酌\n    德國及奧地利現行立法例增訂得撤銷緩刑之原因，其中現行\n    關於緩刑前或緩刑期間故意犯他罪，而在緩刑期內受得易科\n    罰金之有期徒刑之宣告者，列為應撤銷緩刑之事由，因認過\n    於嚴苛，而排除第75條應撤銷緩刑之事由，移列至得撤銷緩\n    刑事由，俾使法官依被告再犯情節，而裁量是否撤銷先前緩\n    刑之宣告。其次，如有前開事由，但判決宣告拘役、罰金時\n    ，可見行為人仍未見悔悟，有列為得撤銷緩刑之事由，以資\n    彈性適用，爰於第1 項第1 款、第2 款增訂之。且本條採用\n    裁量撤銷主義，賦予法院撤銷與否之權限，特於第1 項規定\n    實質要件為「足認原宣告之緩刑難收其預期效果，而有執行\n    刑罰之必要」，供作審認之標準。亦即於「得」撤銷緩刑之\n    情形，法官應依職權本於合目的性之裁量，妥適審酌被告所\n    犯前後數罪間，關於法益侵害之性質、再犯之原因、違反法\n    規範之情節是否重大、被告主觀犯意所顯現之惡性及其反社\n    會性等情，是否已使前案原為促使惡性輕微之被告或偶發犯\n    、初犯改過自新而宣告之緩刑，已難收其預期之效果，而確\n    有執行刑罰之必要，此與刑法第75條第1 項所定二款要件有\n    一具備，即毋庸再行審酌其他情狀，應逕予撤銷緩刑之情形\n    不同，先予敘明。\n四、經查：\n（一）本件受刑人甲○○前因違反詐欺案件，經本院判決判處有\n      期徒刑4 月，並諭知以新臺幣（下同）1,000 元折算1日\n      之易科罰金標準，且緩刑2年，於98年7月13日確定（下稱\n      前案），受刑人竟又於緩刑期前即96年6月8日更犯詐欺案\n      件，經本院於99年2月8日以98年度桃簡字第1695號判決判\n      處拘役30日確定（下稱後案）等情，有臺灣高等法院被告\n      前案紀錄表及上開判決各1份附卷可證，是被告於緩刑前\n      ，因故意犯他罪，而於緩刑期內受得易科罰金之拘役刑宣\n      告確定等事實，堪以認定。\n（二）受刑人雖於前案緩刑期前另犯後案，並在緩刑期內經本院\n      判處得易科罰金之拘役確定，然觀其後案之犯罪時間係在\n      96年6月8日，實早於前案之犯罪時間96年9月20日，自非\n      無視於緩刑期內尤應循規蹈矩之誡命要求，再犯同屬侵害\n      財產法益之犯行所得比擬。抑且，前案法院考量受刑人與\n      被害人達成和解之誠意與犯後態度，而宣告緩刑以予其自\n      新之機會；而後案雖亦係幫助詐欺取財罪，惟經法院斟酌\n      情節後，認被害人蕭政壹經合法送達而未到庭，亦經電話\n      聯繫未果，且受刑人將該受害人所受之損害金額捐款至財\n      團法人臺灣兒童暨家庭扶助基金會，是法院僅宣告拘役30\n      日之輕刑，足見受刑人後案之犯罪情節尚非重大，況後案\n      係在前案緩刑期間尚未啟始之前所為，已如前述，衡情不\n      能因此遽認其前案緩刑之宣告難收預期效果而有執行刑罰\n      之必要。另酌以受刑人於為前案及後案之犯行後，迄今均\n      無其他犯罪紀錄等情，有臺灣高等法院被告前案紀錄表1\n      份在卷可按，亦無足認原宣告之緩刑難收其預期效果而有\n      執行刑罰必要之情形。此外，卷內復查無任何證據足認其\n      原緩刑之宣告，難收其預期效果而有執行刑罰之必要。是\n      不能因案件追查及偵、審制度之進行，至受刑人於緩刑期\n      內受得易科罰金之拘役宣告，而遽認受刑人未改過遷善，\n      全無悔悟之心，或非經入監執行無以收儆懲或矯正之效，\n      且於緩刑期內受6月以下之有期徒刑宣告，即一律撤銷緩\n      刑，則刑法第75條及第75條之1即無區分之必要，進而前\n      開刑法第75條之1第1項之立法本旨將意義盡失，復與緩刑\n      之目的乃係避免短期自由刑之弊，並給予受刑人自新機會\n      未盡相符。因之，聲請人執此聲請撤銷受刑人前案之緩刑\n      ，非有理由，應予駁回。\n四、據上論斷，應依刑事訴訟法第220條，裁定如主文。\n中    華    民    國    99    年    5     月    12    日\n                  刑事第十一庭    法  官  汪曉君\n以上正本證明與原本無異。\n如不服本裁定，應於裁定送達後5 日內向本院提出抗告狀。\n                                  書記官  楊晴文\n中    華    民    國    99    年    5     月    18    日",
  "structure": {
    "main": "聲請駁回。",
    "reason": "一、聲請意旨略以：受刑人甲○○前因犯詐欺案件，經本院於民\n    國98年6 月18日以98年度易字第144 號（本署96年度偵字第\n    24398 號）判處有期徒刑4 月，緩刑2 年，於98年7 月13日\n    確定在案，乃於緩刑期前即96年6 月8 日更犯幫助詐欺案件\n    ，經本院於98年12月30日以98年度桃簡字第1695號判決判處\n    拘役80日，於99年2 月8 日確定，已動搖原判決認定受刑人\n    「因一時失慮，偶罹刑典，事後坦承犯行，深具悔意」而予\n    緩刑宣告之基礎，認受刑人顯非偶蹈法網或對其所犯有所悔\n    悟，自有執行刑罰之必要，已合於刑法第75條之1 第1 項第\n    1 款所定撤銷緩刑宣告之原因，爰依刑事訴訟法第476 條規\n    定聲請撤銷緩刑宣告云云。\n二、按於中華民國98年5月19日刑法修正施行前，受緩刑之宣告\n    ，98年5月19日修正刑法施行後，仍在緩刑期內者，適用98\n    年5月19日修正施行之刑法第75條及第75條之1規定；又上開\n    修正公布之刑法第75條之1，自98年9月1日施行，刑法施行\n    法第6條之1第2項、第10條之2第2項分別定有明文。查本件\n    受刑人甲○○因詐欺案件，經本院98年6月18日以98年度易\n    字第144號判決判處有期徒刑4月，緩刑2年，於98年7月13日\n    判決確定在案，其緩刑期係自98年7月14日起至100年7月13\n    日止，此有該案判決書及臺灣高等法院被告前案紀錄表各1\n    份附卷可稽，足認該案之緩刑宣告，係於98年9月1日刑法修\n    正施行前諭知，且於施行後仍在緩刑期間內，揆諸前開說明\n    ，本件有關該案緩刑之撤銷，應逕適用修正後刑法第75條之\n    1 之規定，而無庸比較新舊法，合先敘明。\n三、次按緩刑前因故意犯他罪，而在緩刑期內受六月以下有期徒\n    刑、拘役或罰金之宣告確定者，足認原宣告之緩刑難收其預\n    期效果，而有執行刑罰之必要者，得撤銷其宣告，98年5 月\n    18日修正之刑法第75條之1 第1 項第1 款定有明文。考本條\n    文前於94年2 月2 日增訂立法意旨略以：關於緩刑之撤銷，\n    現行法第75條第1 項固已設有二款應撤銷之原因；至得撤銷\n    緩刑之原因，則僅於保安處分章內第93條第3 項與撤銷假釋\n    合併加以規定，體例上不相連貫，實用上亦欠彈性，爰參酌\n    德國及奧地利現行立法例增訂得撤銷緩刑之原因，其中現行\n    關於緩刑前或緩刑期間故意犯他罪，而在緩刑期內受得易科\n    罰金之有期徒刑之宣告者，列為應撤銷緩刑之事由，因認過\n    於嚴苛，而排除第75條應撤銷緩刑之事由，移列至得撤銷緩\n    刑事由，俾使法官依被告再犯情節，而裁量是否撤銷先前緩\n    刑之宣告。其次，如有前開事由，但判決宣告拘役、罰金時\n    ，可見行為人仍未見悔悟，有列為得撤銷緩刑之事由，以資\n    彈性適用，爰於第1 項第1 款、第2 款增訂之。且本條採用\n    裁量撤銷主義，賦予法院撤銷與否之權限，特於第1 項規定\n    實質要件為「足認原宣告之緩刑難收其預期效果，而有執行\n    刑罰之必要」，供作審認之標準。亦即於「得」撤銷緩刑之\n    情形，法官應依職權本於合目的性之裁量，妥適審酌被告所\n    犯前後數罪間，關於法益侵害之性質、再犯之原因、違反法\n    規範之情節是否重大、被告主觀犯意所顯現之惡性及其反社\n    會性等情，是否已使前案原為促使惡性輕微之被告或偶發犯\n    、初犯改過自新而宣告之緩刑，已難收其預期之效果，而確\n    有執行刑罰之必要，此與刑法第75條第1 項所定二款要件有\n    一具備，即毋庸再行審酌其他情狀，應逕予撤銷緩刑之情形\n    不同，先予敘明。\n四、經查：\n（一）本件受刑人甲○○前因違反詐欺案件，經本院判決判處有\n      期徒刑4 月，並諭知以新臺幣（下同）1,000 元折算1日\n      之易科罰金標準，且緩刑2年，於98年7月13日確定（下稱\n      前案），受刑人竟又於緩刑期前即96年6月8日更犯詐欺案\n      件，經本院於99年2月8日以98年度桃簡字第1695號判決判\n      處拘役30日確定（下稱後案）等情，有臺灣高等法院被告\n      前案紀錄表及上開判決各1份附卷可證，是被告於緩刑前\n      ，因故意犯他罪，而於緩刑期內受得易科罰金之拘役刑宣\n      告確定等事實，堪以認定。\n（二）受刑人雖於前案緩刑期前另犯後案，並在緩刑期內經本院\n      判處得易科罰金之拘役確定，然觀其後案之犯罪時間係在\n      96年6月8日，實早於前案之犯罪時間96年9月20日，自非\n      無視於緩刑期內尤應循規蹈矩之誡命要求，再犯同屬侵害\n      財產法益之犯行所得比擬。抑且，前案法院考量受刑人與\n      被害人達成和解之誠意與犯後態度，而宣告緩刑以予其自\n      新之機會；而後案雖亦係幫助詐欺取財罪，惟經法院斟酌\n      情節後，認被害人蕭政壹經合法送達而未到庭，亦經電話\n      聯繫未果，且受刑人將該受害人所受之損害金額捐款至財\n      團法人臺灣兒童暨家庭扶助基金會，是法院僅宣告拘役30\n      日之輕刑，足見受刑人後案之犯罪情節尚非重大，況後案\n      係在前案緩刑期間尚未啟始之前所為，已如前述，衡情不\n      能因此遽認其前案緩刑之宣告難收預期效果而有執行刑罰\n      之必要。另酌以受刑人於為前案及後案之犯行後，迄今均\n      無其他犯罪紀錄等情，有臺灣高等法院被告前案紀錄表1\n      份在卷可按，亦無足認原宣告之緩刑難收其預期效果而有\n      執行刑罰必要之情形。此外，卷內復查無任何證據足認其\n      原緩刑之宣告，難收其預期效果而有執行刑罰之必要。是\n      不能因案件追查及偵、審制度之進行，至受刑人於緩刑期\n      內受得易科罰金之拘役宣告，而遽認受刑人未改過遷善，\n      全無悔悟之心，或非經入監執行無以收儆懲或矯正之效，\n      且於緩刑期內受6月以下之有期徒刑宣告，即一律撤銷緩\n      刑，則刑法第75條及第75條之1即無區分之必要，進而前\n      開刑法第75條之1第1項之立法本旨將意義盡失，復與緩刑\n      之目的乃係避免短期自由刑之弊，並給予受刑人自新機會\n      未盡相符。因之，聲請人執此聲請撤銷受刑人前案之緩刑\n      ，非有理由，應予駁回。\n四、據上論斷，應依刑事訴訟法第220條，裁定如主文。"
  },
  "characters": {
    "judges": [
      "汪曉君"
    ],
    "prosecutors": [

    ],
    "lawyers": [

    ],
    "clerks": [
      "楊晴文"
    ],
    "plaintiffs": [

    ],
    "defendants": [

    ],
    "prosecutor_office": [
      "臺灣桃園地方法院檢察署檢察官"
    ],
    "creditors": [

    ],
    "debtors": [

    ],
    "judicial_associate_officer": [

    ]
  },
  "adjudged_at": "2010-05-12",
  "created_at": "2016-01-05 12:36:54",
  "updated_at": "2016-01-05 12:36:54"
}