{
  "identify": "TYD-99-訴-587-20100512-2",
  "court": {
    "name": "臺灣桃園地方法院",
    "code": "TYD"
  },
  "division": {
    "name": "民事",
    "code": "V"
  },
  "year": 99,
  "word": "訴",
  "number": "587",
  "jcheck": "2",
  "reason": "清償債務",
  "content": "臺灣桃園地方法院民事裁定               99年度訴字第587號\n原      告  日盛國際商業銀行股份有限公司\n法定代理人  乙  ○\n被      告  丙○○\n            甲○○\n上列當事人間請求清償債務事件，本院裁定如下：\n    主  文\n原告之訴駁回。\n訴訟費用由原告負擔。\n    理  由\n一、按提起民事訴訟，應依民事訴訟法第77條之13規定繳納裁判\n    費，此為必須具備之程式。又起訴不合程式或不備其他要件\n    者，其情形可以補正，審判長應定期間命其補正，逾期仍未\n    補正，法院應以裁定駁回之。同法第249 條第1 項第6 款亦\n    定明文。\n二、本件原告聲請支付命令後經被告聲明異議視同起訴僅繳納部\n    分裁判費新台幣（下同）500 元，經本院於民國99年4 月16\n    日以裁定限期命其於送達原告時起5 日內補正，此項裁定已\n    於99年4 月21日送達原告，有送達證書在卷可稽。\n三、原告逾期迄今仍未補正，其訴不能認為合法，應予駁回。\n四、依民事訴訟法第249 條第1 項第6 款、第95條、第78條，裁\n    定如主文。\n中    華    民    國    99    年    5     月    12    日\n                        民事第二庭  法  官  高明德\n上列正本證明與原本無異\n如不服本裁定應於送達後10日內向本院提出抗告狀，並應繳納抗\n告費新台幣1,000 元。\n中    華    民    國    99    年    5     月    12    日\n                                    書記官  崔青菁",
  "structure": {
    "main": "原告之訴駁回。\n訴訟費用由原告負擔。",
    "reason": "一、按提起民事訴訟，應依民事訴訟法第77條之13規定繳納裁判\n    費，此為必須具備之程式。又起訴不合程式或不備其他要件\n    者，其情形可以補正，審判長應定期間命其補正，逾期仍未\n    補正，法院應以裁定駁回之。同法第249 條第1 項第6 款亦\n    定明文。\n二、本件原告聲請支付命令後經被告聲明異議視同起訴僅繳納部\n    分裁判費新台幣（下同）500 元，經本院於民國99年4 月16\n    日以裁定限期命其於送達原告時起5 日內補正，此項裁定已\n    於99年4 月21日送達原告，有送達證書在卷可稽。\n三、原告逾期迄今仍未補正，其訴不能認為合法，應予駁回。\n四、依民事訴訟法第249 條第1 項第6 款、第95條、第78條，裁\n    定如主文。"
  },
  "characters": {
    "judges": [
      "高明德"
    ],
    "prosecutors": [

    ],
    "lawyers": [

    ],
    "clerks": [

    ],
    "plaintiffs": [
      "日盛國際商業銀行股份有限公司"
    ],
    "defendants": [
      "丙○○"
    ],
    "prosecutor_office": [

    ],
    "creditors": [

    ],
    "debtors": [

    ],
    "judicial_associate_officer": [

    ]
  },
  "adjudged_at": "2010-05-12",
  "created_at": "2016-01-05 12:39:57",
  "updated_at": "2016-01-05 12:39:57"
}