{
  "identify": "TYD-99-司票-2277-20100512-5",
  "court": {
    "name": "臺灣桃園地方法院",
    "code": "TYD"
  },
  "division": {
    "name": "民事",
    "code": "V"
  },
  "year": 99,
  "word": "司票",
  "number": "2277",
  "jcheck": "5",
  "reason": "本票裁定",
  "content": "臺灣桃園地方法院簡易庭民事裁定      99年度司票字第2277號\n聲  請  人  板信商業銀行股份有限公司\n法定代理人  乙○○\n非訟代理人  甲○○\n相  對  人  丙○○\n上列當事人間聲請本票裁定事件，本院裁定如下：\n主  文\n相對人於民國九十四年十一月三日簽發之本票內載憑票交付聲請\n人新臺幣拾萬元，其中之新臺幣壹拾貳萬玖仟零伍元及自民國\n九十九年四月十四日起至清償日止，按週年利率百分之三點二三\n計算之利息，准予強制執行。\n聲請人其餘之聲請駁回。\n聲請程序費用新臺幣壹仟元由相對人負擔。\n理  由\n一、本件聲請意旨略以：聲請人執有相對人於民國94年11月3 日\n    簽發之本票一件，內載金額新臺幣300,000 元，到期日99年\n    4 月14日，並免除作成拒絕證書。詎於到期後經提示未獲付\n    款，為此提出本票一件，聲請裁定就如主文所示之本金及自\n    99年2 月10日起至清償日止，按週年利率百分之三點二三計\n    算之利息，准許強制執行等語。\n二、本件聲請，除利息未屆到期日部份聲請人無請求權，應予駁\n    回外，其餘之聲請核與票據法第123 條規定相符，應予准許\n    。\n三、依非訟事件法第21條第2 項、民事訴訟法第79條，裁定如主\n    文。\n四、如不服本裁定，應於裁定送達後10日之不變期間內向本院提\n    出抗告狀，並繳納抗告費新臺幣1,000 元。\n五、發票人如主張本票係偽造、變造者，得於接到本裁定後20日\n    內，對執票人向本院另行提起確認債權不存在之訴。\n中    華    民    國    99    年    5     月    12    日\n                  簡易庭司法事務官\n附記：\n一、嗣後遞狀均須註明案號、股別。\n二、案件一經確定，本院依職權逕行核發確定證明書，聲請人勿\n    庸另行聲請。",
  "structure": {
    "main": "相對人於民國九十四年十一月三日簽發之本票內載憑票交付聲請\n人新臺幣拾萬元，其中之新臺幣壹拾貳萬玖仟零伍元及自民國\n九十九年四月十四日起至清償日止，按週年利率百分之三點二三\n計算之利息，准予強制執行。\n聲請人其餘之聲請駁回。\n聲請程序費用新臺幣壹仟元由相對人負擔。",
    "reason": "一、本件聲請意旨略以：聲請人執有相對人於民國94年11月3 日\n    簽發之本票一件，內載金額新臺幣300,000 元，到期日99年\n    4 月14日，並免除作成拒絕證書。詎於到期後經提示未獲付\n    款，為此提出本票一件，聲請裁定就如主文所示之本金及自\n    99年2 月10日起至清償日止，按週年利率百分之三點二三計\n    算之利息，准許強制執行等語。\n二、本件聲請，除利息未屆到期日部份聲請人無請求權，應予駁\n    回外，其餘之聲請核與票據法第123 條規定相符，應予准許\n    。\n三、依非訟事件法第21條第2 項、民事訴訟法第79條，裁定如主\n    文。\n四、如不服本裁定，應於裁定送達後10日之不變期間內向本院提\n    出抗告狀，並繳納抗告費新臺幣1,000 元。\n五、發票人如主張本票係偽造、變造者，得於接到本裁定後20日\n    內，對執票人向本院另行提起確認債權不存在之訴。"
  },
  "characters": {
    "judges": [

    ],
    "prosecutors": [

    ],
    "lawyers": [

    ],
    "clerks": [

    ],
    "plaintiffs": [

    ],
    "defendants": [

    ],
    "prosecutor_office": [
      "板信商業銀行股份有限公司"
    ],
    "creditors": [

    ],
    "debtors": [

    ],
    "judicial_associate_officer": [
      "簡易庭"
    ]
  },
  "adjudged_at": "2010-05-12",
  "created_at": "2016-01-05 12:40:40",
  "updated_at": "2016-01-05 12:40:40"
}