{
  "identify": "TYD-99-桃簡-983-20100512-1",
  "court": {
    "name": "臺灣桃園地方法院",
    "code": "TYD"
  },
  "division": {
    "name": "刑事",
    "code": "M"
  },
  "year": 99,
  "word": "桃簡",
  "number": "983",
  "jcheck": "1",
  "reason": "毒品危害防制條例",
  "content": "臺灣桃園地方法院刑事簡易判決         99年度桃簡字第983號\n聲  請  人  臺灣桃園地方法院檢察署檢察官\n被      告  甲○\n上列被告因違反毒品危害防制條例案件，經檢察官聲請以簡易判\n決處刑（99年度毒偵字第844 號），本院判決如下：\n    主      文\n甲○施用第二級毒品，處有期徒刑貳月，如易科罰金，以新臺幣\n壹仟元折算壹日。扣案第二級毒品甲基安非他命陸包（驗餘含塑\n膠袋合計毛重拾柒點伍柒捌肆公克，連同包裝之塑膠袋陸個），\n沒收銷燬之。\n    事實及理由\n一、本件犯罪事實及證據，併所犯法條，均引用臺灣桃園地方法\n    院檢察署檢察官聲請簡易判決處刑書之記載（如附件），並\n    補充：\n  (一)證據另補充：國道公路警察局第六警察隊99年移送煙毒麻醉\n    藥品人犯尿液檢體編號對照表。\n  (二)核被告甲○所為，係犯毒品危害防制條例第10條第2 項之施\n    用第二級毒品罪。被告於施用第二級毒品甲基安非他命前持\n    有之低度行為為施用之高度行為所吸收，不另論罪。爰審酌\n    被告曾經觀察勒戒程序，仍無法戒除，復又觸犯本件犯行，\n    顯示其尚無法完全戒絕吸毒惡習，惟施用毒品係傷害其自身\n    健康，所生危害非鉅，犯後坦承犯行等一切情狀，量處如主\n    文所示之刑，並諭知易科罰金之折算標準，以資儆懲。\n  (三)扣案之透明結晶物6 包經送鑑驗結果，確呈甲基安非他命反\n    應（含袋重17.6公克，因鑑驗使用0.0216公克，驗畢含袋餘\n    17.5784 公克），此有臺灣檢驗科技股份有限公司濫用藥物\n    檢驗報告（報告編號：UL/2010/20278 號）附卷（見偵查卷\n    第51頁）可稽，而包裹毒品之包裝袋6 只，難與所包裹之毒\n    品析離或析離需費甚鉅，均應依毒品危害防制條例第18條第\n    1 項前段之規定，沒收銷燬之。\n二、依刑事訴訟法第449 條第1 項前段、第3 項、第450 條第1\n    項、第454 條第2 項，毒品危害防制條例第10條第2 項、第\n    18條第1 項前段，刑法第11條、第41條第1 項前段，逕以簡\n    易判決處如主文所示之刑。\n三、如不服本判決，應於判決送達後10日內，向本院提出上訴狀\n    （應附繕本），上訴於本院合議庭。\n中    華    民    國    99    年    5     月    12    日\n                  刑事第二庭  法  官  陳德池\n以上正本證明與原本無異。\n如不服本判決，應於判決送達後10日內向本院提出上訴狀（應附\n繕本）。\n                              書記官  謝雅茹\n中    華    民    國    99    年    5     月    19    日\n附錄論罪科刑依據之法條：\n毒品危害防制條例第10條\n施用第一級毒品者，處6 月以上5 年以下有期徒刑。\n施用第二級毒品者，處3 年以下有期徒刑。\n附件：臺灣桃園地方法院檢察署檢察官99年度毒偵字第844 號聲\n      請簡易判決處刑書1 份。",
  "structure": {
    "main": "甲○施用第二級毒品，處有期徒刑貳月，如易科罰金，以新臺幣\n壹仟元折算壹日。扣案第二級毒品甲基安非他命陸包（驗餘含塑\n膠袋合計毛重拾柒點伍柒捌肆公克，連同包裝之塑膠袋陸個），\n沒收銷燬之。",
    "fact": "一、本件犯罪事實及證據，併所犯法條，均引用臺灣桃園地方法\n    院檢察署檢察官聲請簡易判決處刑書之記載（如附件），並\n    補充：\n  (一)證據另補充：國道公路警察局第六警察隊99年移送煙毒麻醉\n    藥品人犯尿液檢體編號對照表。\n  (二)核被告甲○所為，係犯毒品危害防制條例第10條第2 項之施\n    用第二級毒品罪。被告於施用第二級毒品甲基安非他命前持\n    有之低度行為為施用之高度行為所吸收，不另論罪。爰審酌\n    被告曾經觀察勒戒程序，仍無法戒除，復又觸犯本件犯行，\n    顯示其尚無法完全戒絕吸毒惡習，惟施用毒品係傷害其自身\n    健康，所生危害非鉅，犯後坦承犯行等一切情狀，量處如主\n    文所示之刑，並諭知易科罰金之折算標準，以資儆懲。\n  (三)扣案之透明結晶物6 包經送鑑驗結果，確呈甲基安非他命反\n    應（含袋重17.6公克，因鑑驗使用0.0216公克，驗畢含袋餘\n    17.5784 公克），此有臺灣檢驗科技股份有限公司濫用藥物\n    檢驗報告（報告編號：UL/2010/20278 號）附卷（見偵查卷\n    第51頁）可稽，而包裹毒品之包裝袋6 只，難與所包裹之毒\n    品析離或析離需費甚鉅，均應依毒品危害防制條例第18條第\n    1 項前段之規定，沒收銷燬之。\n二、依刑事訴訟法第449 條第1 項前段、第3 項、第450 條第1\n    項、第454 條第2 項，毒品危害防制條例第10條第2 項、第\n    18條第1 項前段，刑法第11條、第41條第1 項前段，逕以簡\n    易判決處如主文所示之刑。\n三、如不服本判決，應於判決送達後10日內，向本院提出上訴狀\n    （應附繕本），上訴於本院合議庭。",
    "reason": "一、本件犯罪事實及證據，併所犯法條，均引用臺灣桃園地方法\n    院檢察署檢察官聲請簡易判決處刑書之記載（如附件），並\n    補充：\n  (一)證據另補充：國道公路警察局第六警察隊99年移送煙毒麻醉\n    藥品人犯尿液檢體編號對照表。\n  (二)核被告甲○所為，係犯毒品危害防制條例第10條第2 項之施\n    用第二級毒品罪。被告於施用第二級毒品甲基安非他命前持\n    有之低度行為為施用之高度行為所吸收，不另論罪。爰審酌\n    被告曾經觀察勒戒程序，仍無法戒除，復又觸犯本件犯行，\n    顯示其尚無法完全戒絕吸毒惡習，惟施用毒品係傷害其自身\n    健康，所生危害非鉅，犯後坦承犯行等一切情狀，量處如主\n    文所示之刑，並諭知易科罰金之折算標準，以資儆懲。\n  (三)扣案之透明結晶物6 包經送鑑驗結果，確呈甲基安非他命反\n    應（含袋重17.6公克，因鑑驗使用0.0216公克，驗畢含袋餘\n    17.5784 公克），此有臺灣檢驗科技股份有限公司濫用藥物\n    檢驗報告（報告編號：UL/2010/20278 號）附卷（見偵查卷\n    第51頁）可稽，而包裹毒品之包裝袋6 只，難與所包裹之毒\n    品析離或析離需費甚鉅，均應依毒品危害防制條例第18條第\n    1 項前段之規定，沒收銷燬之。\n二、依刑事訴訟法第449 條第1 項前段、第3 項、第450 條第1\n    項、第454 條第2 項，毒品危害防制條例第10條第2 項、第\n    18條第1 項前段，刑法第11條、第41條第1 項前段，逕以簡\n    易判決處如主文所示之刑。\n三、如不服本判決，應於判決送達後10日內，向本院提出上訴狀\n    （應附繕本），上訴於本院合議庭。"
  },
  "characters": {
    "judges": [
      "陳德池"
    ],
    "prosecutors": [

    ],
    "lawyers": [

    ],
    "clerks": [
      "謝雅茹"
    ],
    "plaintiffs": [

    ],
    "defendants": [
      "甲○"
    ],
    "prosecutor_office": [
      "臺灣桃園地方法院檢察署檢察官"
    ],
    "creditors": [

    ],
    "debtors": [

    ],
    "judicial_associate_officer": [

    ]
  },
  "adjudged_at": "2010-05-12",
  "created_at": "2016-01-05 12:38:00",
  "updated_at": "2016-01-05 12:38:00"
}